[INFO] Scanning for projects...
[INFO]                                                                         
[INFO] ------------------------------------------------------------------------
[INFO] Building xrates 0.0.1-SNAPSHOT
[INFO] ------------------------------------------------------------------------
[INFO] 
[INFO] --- maven-resources-plugin:2.6:resources (default-resources) @ io.xrates ---
[INFO] Using 'UTF-8' encoding to copy filtered resources.
[INFO] Copying 1 resource
[INFO] Copying 8 resources
[INFO] 
[INFO] --- maven-compiler-plugin:3.1:compile (default-compile) @ io.xrates ---
[INFO] Nothing to compile - all classes are up to date
[INFO] 
[INFO] --- maven-resources-plugin:2.6:testResources (default-testResources) @ io.xrates ---
[INFO] Using 'UTF-8' encoding to copy filtered resources.
[INFO] skip non existing resourceDirectory /root/workspace/siddharthgoel88/xrates/377772477/src/test/resources
[INFO] 
[INFO] --- maven-compiler-plugin:3.1:testCompile (default-testCompile) @ io.xrates ---
[INFO] Nothing to compile - all classes are up to date
[INFO] 
[INFO] --- maven-surefire-plugin:2.18.1:test (default-test) @ io.xrates ---
[INFO] Surefire report directory: /root/workspace/siddharthgoel88/xrates/377772477/target/surefire-reports
Downloading: https://repo.maven.apache.org/maven2/org/apache/maven/surefire/surefire-junit4/2.18.1/surefire-junit4-2.18.1.pom
3/3 KB   
3/3 KB   
         
Downloaded: https://repo.maven.apache.org/maven2/org/apache/maven/surefire/surefire-junit4/2.18.1/surefire-junit4-2.18.1.pom (3 KB at 6.2 KB/sec)
Downloading: https://repo.maven.apache.org/maven2/org/apache/maven/surefire/surefire-providers/2.18.1/surefire-providers-2.18.1.pom
3/3 KB   
3/3 KB   
         
Downloaded: https://repo.maven.apache.org/maven2/org/apache/maven/surefire/surefire-providers/2.18.1/surefire-providers-2.18.1.pom (3 KB at 95.6 KB/sec)
Downloading: https://repo.maven.apache.org/maven2/org/apache/maven/surefire/surefire-junit4/2.18.1/surefire-junit4-2.18.1.jar
3/67 KB   
5/67 KB   
8/67 KB   
11/67 KB   
13/67 KB   
16/67 KB   
19/67 KB   
21/67 KB   
24/67 KB   
27/67 KB   
29/67 KB   
32/67 KB   
36/67 KB   
40/67 KB   
44/67 KB   
48/67 KB   
52/67 KB   
56/67 KB   
60/67 KB   
64/67 KB   
67/67 KB   
           
Downloaded: https://repo.maven.apache.org/maven2/org/apache/maven/surefire/surefire-junit4/2.18.1/surefire-junit4-2.18.1.jar (67 KB at 948.5 KB/sec)

-------------------------------------------------------
 T E S T S
-------------------------------------------------------
Running io.xrates.backend.rateprovider.impl.DBSRateProviderImplTest
2018-05-11 17:36:40.015  INFO   --- [           main] i.x.b.rateprovider.AbstractRateProvider  : Found rates null so updating it.
2018-05-11 17:36:40.029  INFO   --- [           main] i.x.b.rateprovider.AbstractRateProvider  : Instantiating following service : 
 ____   ____   ____  
|  _ \ | __ ) / ___| 
| | | ||  _ \ \___ \ 
| |_| || |_) | ___) |
|____/ |____/ |____/ 
                     

2018-05-11 17:36:40.030  INFO   --- [           main] i.x.b.r.impl.DBSRateProviderImpl         : DBS: Fetching page @ http://www.dbs.com.sg/personal/rates-online/foreign-currency-foreign-exchange.page
2018-05-11 17:36:40.914  INFO   --- [           main] i.x.b.rateprovider.AbstractRateProvider  : Found rates null so updating it.
2018-05-11 17:36:40.921  INFO   --- [           main] i.x.b.rateprovider.AbstractRateProvider  : Instantiating following service : 
 ____   ____   ____  
|  _ \ | __ ) / ___| 
| | | ||  _ \ \___ \ 
| |_| || |_) | ___) |
|____/ |____/ |____/ 
                     

2018-05-11 17:36:40.921  INFO   --- [           main] i.x.b.r.impl.DBSRateProviderImpl         : DBS: Fetching page @ http://www.dbs.com.sg/personal/rates-online/foreign-currency-foreign-exchange.page
2018-05-11 17:36:41.212  INFO   --- [           main] i.x.b.rateprovider.AbstractRateProvider  : Found rates null so updating it.
2018-05-11 17:36:41.219  INFO   --- [           main] i.x.b.rateprovider.AbstractRateProvider  : Instantiating following service : 
 ____   ____   ____  
|  _ \ | __ ) / ___| 
| | | ||  _ \ \___ \ 
| |_| || |_) | ___) |
|____/ |____/ |____/ 
                     

2018-05-11 17:36:41.220  INFO   --- [           main] i.x.b.r.impl.DBSRateProviderImpl         : DBS: Fetching page @ http://www.dbs.com.sg/personal/rates-online/foreign-currency-foreign-exchange.page
2018-05-11 17:36:41.512  INFO   --- [           main] i.x.b.rateprovider.AbstractRateProvider  : Found rates null so updating it.
2018-05-11 17:36:41.519  INFO   --- [           main] i.x.b.rateprovider.AbstractRateProvider  : Instantiating following service : 
 ____   ____   ____  
|  _ \ | __ ) / ___| 
| | | ||  _ \ \___ \ 
| |_| || |_) | ___) |
|____/ |____/ |____/ 
                     

2018-05-11 17:36:41.520  INFO   --- [           main] i.x.b.r.impl.DBSRateProviderImpl         : DBS: Fetching page @ http://www.dbs.com.sg/personal/rates-online/foreign-currency-foreign-exchange.page
2018-05-11 17:36:41.822  INFO   --- [           main] i.x.b.rateprovider.AbstractRateProvider  : Found rates null so updating it.
2018-05-11 17:36:41.828  INFO   --- [           main] i.x.b.rateprovider.AbstractRateProvider  : Instantiating following service : 
 ____   ____   ____  
|  _ \ | __ ) / ___| 
| | | ||  _ \ \___ \ 
| |_| || |_) | ___) |
|____/ |____/ |____/ 
                     

2018-05-11 17:36:41.829  INFO   --- [           main] i.x.b.r.impl.DBSRateProviderImpl         : DBS: Fetching page @ http://www.dbs.com.sg/personal/rates-online/foreign-currency-foreign-exchange.page
2018-05-11 17:36:42.132  INFO   --- [           main] i.x.b.rateprovider.AbstractRateProvider  : Found rates null so updating it.
2018-05-11 17:36:42.137  INFO   --- [           main] i.x.b.rateprovider.AbstractRateProvider  : Instantiating following service : 
 ____   ____   ____  
|  _ \ | __ ) / ___| 
| | | ||  _ \ \___ \ 
| |_| || |_) | ___) |
|____/ |____/ |____/ 
                     

2018-05-11 17:36:42.138  INFO   --- [           main] i.x.b.r.impl.DBSRateProviderImpl         : DBS: Fetching page @ http://www.dbs.com.sg/personal/rates-online/foreign-currency-foreign-exchange.page
2018-05-11 17:36:42.777  INFO   --- [           main] i.x.b.rateprovider.AbstractRateProvider  : Found rates null so updating it.
2018-05-11 17:36:42.781  INFO   --- [           main] i.x.b.rateprovider.AbstractRateProvider  : Instantiating following service : 
 ____   ____   ____  
|  _ \ | __ ) / ___| 
| | | ||  _ \ \___ \ 
| |_| || |_) | ___) |
|____/ |____/ |____/ 
                     

2018-05-11 17:36:42.781  INFO   --- [           main] i.x.b.r.impl.DBSRateProviderImpl         : DBS: Fetching page @ http://www.dbs.com.sg/personal/rates-online/foreign-currency-foreign-exchange.page
2018-05-11 17:36:43.253  INFO   --- [           main] i.x.b.rateprovider.AbstractRateProvider  : Found rates null so updating it.
2018-05-11 17:36:43.257  INFO   --- [           main] i.x.b.rateprovider.AbstractRateProvider  : Instantiating following service : 
 ____   ____   ____  
|  _ \ | __ ) / ___| 
| | | ||  _ \ \___ \ 
| |_| || |_) | ___) |
|____/ |____/ |____/ 
                     

2018-05-11 17:36:43.257  INFO   --- [           main] i.x.b.r.impl.DBSRateProviderImpl         : DBS: Fetching page @ http://www.dbs.com.sg/personal/rates-online/foreign-currency-foreign-exchange.page
2018-05-11 17:36:43.766  INFO   --- [           main] i.x.b.rateprovider.AbstractRateProvider  : Found rates null so updating it.
2018-05-11 17:36:43.769  INFO   --- [           main] i.x.b.rateprovider.AbstractRateProvider  : Instantiating following service : 
 ____   ____   ____  
|  _ \ | __ ) / ___| 
| | | ||  _ \ \___ \ 
| |_| || |_) | ___) |
|____/ |____/ |____/ 
                     

2018-05-11 17:36:43.770  INFO   --- [           main] i.x.b.r.impl.DBSRateProviderImpl         : DBS: Fetching page @ http://www.dbs.com.sg/personal/rates-online/foreign-currency-foreign-exchange.page
2018-05-11 17:36:44.246  INFO   --- [           main] i.x.b.rateprovider.AbstractRateProvider  : Found rates null so updating it.
2018-05-11 17:36:44.249  INFO   --- [           main] i.x.b.rateprovider.AbstractRateProvider  : Instantiating following service : 
 ____   ____   ____  
|  _ \ | __ ) / ___| 
| | | ||  _ \ \___ \ 
| |_| || |_) | ___) |
|____/ |____/ |____/ 
                     

2018-05-11 17:36:44.250  INFO   --- [           main] i.x.b.r.impl.DBSRateProviderImpl         : DBS: Fetching page @ http://www.dbs.com.sg/personal/rates-online/foreign-currency-foreign-exchange.page
2018-05-11 17:36:44.732  INFO   --- [           main] i.x.b.rateprovider.AbstractRateProvider  : Found rates null so updating it.
2018-05-11 17:36:44.735  INFO   --- [           main] i.x.b.rateprovider.AbstractRateProvider  : Instantiating following service : 
 ____   ____   ____  
|  _ \ | __ ) / ___| 
| | | ||  _ \ \___ \ 
| |_| || |_) | ___) |
|____/ |____/ |____/ 
                     

2018-05-11 17:36:44.736  INFO   --- [           main] i.x.b.r.impl.DBSRateProviderImpl         : DBS: Fetching page @ http://www.dbs.com.sg/personal/rates-online/foreign-currency-foreign-exchange.page
2018-05-11 17:36:45.213  INFO   --- [           main] i.x.b.rateprovider.AbstractRateProvider  : Found rates null so updating it.
2018-05-11 17:36:45.216  INFO   --- [           main] i.x.b.rateprovider.AbstractRateProvider  : Instantiating following service : 
 ____   ____   ____  
|  _ \ | __ ) / ___| 
| | | ||  _ \ \___ \ 
| |_| || |_) | ___) |
|____/ |____/ |____/ 
                     

2018-05-11 17:36:45.216  INFO   --- [           main] i.x.b.r.impl.DBSRateProviderImpl         : DBS: Fetching page @ http://www.dbs.com.sg/personal/rates-online/foreign-currency-foreign-exchange.page
2018-05-11 17:36:45.693  INFO   --- [           main] i.x.b.rateprovider.AbstractRateProvider  : Found rates null so updating it.
2018-05-11 17:36:45.697  INFO   --- [           main] i.x.b.rateprovider.AbstractRateProvider  : Instantiating following service : 
 ____   ____   ____  
|  _ \ | __ ) / ___| 
| | | ||  _ \ \___ \ 
| |_| || |_) | ___) |
|____/ |____/ |____/ 
                     

2018-05-11 17:36:45.697  INFO   --- [           main] i.x.b.r.impl.DBSRateProviderImpl         : DBS: Fetching page @ http://www.dbs.com.sg/personal/rates-online/foreign-currency-foreign-exchange.page
2018-05-11 17:36:46.189  INFO   --- [           main] i.x.b.rateprovider.AbstractRateProvider  : Found rates null so updating it.
2018-05-11 17:36:46.191  INFO   --- [           main] i.x.b.rateprovider.AbstractRateProvider  : Instantiating following service : 
 ____   ____   ____  
|  _ \ | __ ) / ___| 
| | | ||  _ \ \___ \ 
| |_| || |_) | ___) |
|____/ |____/ |____/ 
                     

2018-05-11 17:36:46.191  INFO   --- [           main] i.x.b.r.impl.DBSRateProviderImpl         : DBS: Fetching page @ http://www.dbs.com.sg/personal/rates-online/foreign-currency-foreign-exchange.page
2018-05-11 17:36:46.665  INFO   --- [           main] i.x.b.rateprovider.AbstractRateProvider  : Found rates null so updating it.
2018-05-11 17:36:46.668  INFO   --- [           main] i.x.b.rateprovider.AbstractRateProvider  : Instantiating following service : 
 ____   ____   ____  
|  _ \ | __ ) / ___| 
| | | ||  _ \ \___ \ 
| |_| || |_) | ___) |
|____/ |____/ |____/ 
                     

2018-05-11 17:36:46.668  INFO   --- [           main] i.x.b.r.impl.DBSRateProviderImpl         : DBS: Fetching page @ http://www.dbs.com.sg/personal/rates-online/foreign-currency-foreign-exchange.page
2018-05-11 17:36:47.144  INFO   --- [           main] i.x.b.rateprovider.AbstractRateProvider  : Found rates null so updating it.
2018-05-11 17:36:47.146  INFO   --- [           main] i.x.b.rateprovider.AbstractRateProvider  : Instantiating following service : 
 ____   ____   ____  
|  _ \ | __ ) / ___| 
| | | ||  _ \ \___ \ 
| |_| || |_) | ___) |
|____/ |____/ |____/ 
                     

2018-05-11 17:36:47.146  INFO   --- [           main] i.x.b.r.impl.DBSRateProviderImpl         : DBS: Fetching page @ http://www.dbs.com.sg/personal/rates-online/foreign-currency-foreign-exchange.page
2018-05-11 17:36:47.626  INFO   --- [           main] i.x.b.rateprovider.AbstractRateProvider  : Found rates null so updating it.
2018-05-11 17:36:47.628  INFO   --- [           main] i.x.b.rateprovider.AbstractRateProvider  : Instantiating following service : 
 ____   ____   ____  
|  _ \ | __ ) / ___| 
| | | ||  _ \ \___ \ 
| |_| || |_) | ___) |
|____/ |____/ |____/ 
                     

2018-05-11 17:36:47.629  INFO   --- [           main] i.x.b.r.impl.DBSRateProviderImpl         : DBS: Fetching page @ http://www.dbs.com.sg/personal/rates-online/foreign-currency-foreign-exchange.page
2018-05-11 17:36:48.108  INFO   --- [           main] i.x.b.rateprovider.AbstractRateProvider  : Found rates null so updating it.
2018-05-11 17:36:48.111  INFO   --- [           main] i.x.b.rateprovider.AbstractRateProvider  : Instantiating following service : 
 ____   ____   ____  
|  _ \ | __ ) / ___| 
| | | ||  _ \ \___ \ 
| |_| || |_) | ___) |
|____/ |____/ |____/ 
                     

2018-05-11 17:36:48.111  INFO   --- [           main] i.x.b.r.impl.DBSRateProviderImpl         : DBS: Fetching page @ http://www.dbs.com.sg/personal/rates-online/foreign-currency-foreign-exchange.page
2018-05-11 17:36:48.592  INFO   --- [           main] i.x.b.rateprovider.AbstractRateProvider  : Found rates null so updating it.
2018-05-11 17:36:48.595  INFO   --- [           main] i.x.b.rateprovider.AbstractRateProvider  : Instantiating following service : 
 ____   ____   ____  
|  _ \ | __ ) / ___| 
| | | ||  _ \ \___ \ 
| |_| || |_) | ___) |
|____/ |____/ |____/ 
                     

2018-05-11 17:36:48.596  INFO   --- [           main] i.x.b.r.impl.DBSRateProviderImpl         : DBS: Fetching page @ http://www.dbs.com.sg/personal/rates-online/foreign-currency-foreign-exchange.page
2018-05-11 17:36:49.078  INFO   --- [           main] i.x.b.rateprovider.AbstractRateProvider  : Found rates null so updating it.
2018-05-11 17:36:49.081  INFO   --- [           main] i.x.b.rateprovider.AbstractRateProvider  : Instantiating following service : 
 ____   ____   ____  
|  _ \ | __ ) / ___| 
| | | ||  _ \ \___ \ 
| |_| || |_) | ___) |
|____/ |____/ |____/ 
                     

2018-05-11 17:36:49.081  INFO   --- [           main] i.x.b.r.impl.DBSRateProviderImpl         : DBS: Fetching page @ http://www.dbs.com.sg/personal/rates-online/foreign-currency-foreign-exchange.page
2018-05-11 17:36:49.556  INFO   --- [           main] i.x.b.rateprovider.AbstractRateProvider  : Found rates null so updating it.
2018-05-11 17:36:49.559  INFO   --- [           main] i.x.b.rateprovider.AbstractRateProvider  : Instantiating following service : 
 ____   ____   ____  
|  _ \ | __ ) / ___| 
| | | ||  _ \ \___ \ 
| |_| || |_) | ___) |
|____/ |____/ |____/ 
                     

2018-05-11 17:36:49.560  INFO   --- [           main] i.x.b.r.impl.DBSRateProviderImpl         : DBS: Fetching page @ http://www.dbs.com.sg/personal/rates-online/foreign-currency-foreign-exchange.page
2018-05-11 17:36:50.043  INFO   --- [           main] i.x.b.rateprovider.AbstractRateProvider  : Found rates null so updating it.
2018-05-11 17:36:50.047  INFO   --- [           main] i.x.b.rateprovider.AbstractRateProvider  : Instantiating following service : 
 ____   ____   ____  
|  _ \ | __ ) / ___| 
| | | ||  _ \ \___ \ 
| |_| || |_) | ___) |
|____/ |____/ |____/ 
                     

2018-05-11 17:36:50.047  INFO   --- [           main] i.x.b.r.impl.DBSRateProviderImpl         : DBS: Fetching page @ http://www.dbs.com.sg/personal/rates-online/foreign-currency-foreign-exchange.page
2018-05-11 17:36:50.531  INFO   --- [           main] i.x.b.rateprovider.AbstractRateProvider  : Found rates null so updating it.
2018-05-11 17:36:50.534  INFO   --- [           main] i.x.b.rateprovider.AbstractRateProvider  : Instantiating following service : 
 ____   ____   ____  
|  _ \ | __ ) / ___| 
| | | ||  _ \ \___ \ 
| |_| || |_) | ___) |
|____/ |____/ |____/ 
                     

2018-05-11 17:36:50.535  INFO   --- [           main] i.x.b.r.impl.DBSRateProviderImpl         : DBS: Fetching page @ http://www.dbs.com.sg/personal/rates-online/foreign-currency-foreign-exchange.page
Tests run: 23, Failures: 23, Errors: 0, Skipped: 0, Time elapsed: 11.303 sec <<< FAILURE! - in io.xrates.backend.rateprovider.impl.DBSRateProviderImplTest
testAUD(io.xrates.backend.rateprovider.impl.DBSRateProviderImplTest)  Time elapsed: 0.9 sec  <<< FAILURE!
java.lang.AssertionError: null
	at org.junit.Assert.fail(Assert.java:86)
	at org.junit.Assert.assertTrue(Assert.java:41)
	at org.junit.Assert.assertFalse(Assert.java:64)
	at org.junit.Assert.assertFalse(Assert.java:74)
	at io.xrates.backend.rateprovider.impl.DBSRateProviderImplTest.testAUD(DBSRateProviderImplTest.java:72)

testBND(io.xrates.backend.rateprovider.impl.DBSRateProviderImplTest)  Time elapsed: 0.296 sec  <<< FAILURE!
java.lang.AssertionError: null
	at org.junit.Assert.fail(Assert.java:86)
	at org.junit.Assert.assertTrue(Assert.java:41)
	at org.junit.Assert.assertFalse(Assert.java:64)
	at org.junit.Assert.assertFalse(Assert.java:74)
	at io.xrates.backend.rateprovider.impl.DBSRateProviderImplTest.testBND(DBSRateProviderImplTest.java:216)

testCAD(io.xrates.backend.rateprovider.impl.DBSRateProviderImplTest)  Time elapsed: 0.299 sec  <<< FAILURE!
java.lang.AssertionError: null
	at org.junit.Assert.fail(Assert.java:86)
	at org.junit.Assert.assertTrue(Assert.java:41)
	at org.junit.Assert.assertFalse(Assert.java:64)
	at org.junit.Assert.assertFalse(Assert.java:74)
	at io.xrates.backend.rateprovider.impl.DBSRateProviderImplTest.testCAD(DBSRateProviderImplTest.java:84)

testCHF(io.xrates.backend.rateprovider.impl.DBSRateProviderImplTest)  Time elapsed: 0.309 sec  <<< FAILURE!
java.lang.AssertionError: null
	at org.junit.Assert.fail(Assert.java:86)
	at org.junit.Assert.assertTrue(Assert.java:41)
	at org.junit.Assert.assertFalse(Assert.java:64)
	at org.junit.Assert.assertFalse(Assert.java:74)
	at io.xrates.backend.rateprovider.impl.DBSRateProviderImplTest.testCHF(DBSRateProviderImplTest.java:156)

testCNY(io.xrates.backend.rateprovider.impl.DBSRateProviderImplTest)  Time elapsed: 0.309 sec  <<< FAILURE!
java.lang.AssertionError: null
	at org.junit.Assert.fail(Assert.java:86)
	at org.junit.Assert.assertTrue(Assert.java:41)
	at org.junit.Assert.assertFalse(Assert.java:64)
	at org.junit.Assert.assertFalse(Assert.java:74)
	at io.xrates.backend.rateprovider.impl.DBSRateProviderImplTest.testCNY(DBSRateProviderImplTest.java:168)

testDKK(io.xrates.backend.rateprovider.impl.DBSRateProviderImplTest)  Time elapsed: 0.644 sec  <<< FAILURE!
java.lang.AssertionError: null
	at org.junit.Assert.fail(Assert.java:86)
	at org.junit.Assert.assertTrue(Assert.java:41)
	at org.junit.Assert.assertFalse(Assert.java:64)
	at org.junit.Assert.assertFalse(Assert.java:74)
	at io.xrates.backend.rateprovider.impl.DBSRateProviderImplTest.testDKK(DBSRateProviderImplTest.java:108)

testEUR(io.xrates.backend.rateprovider.impl.DBSRateProviderImplTest)  Time elapsed: 0.476 sec  <<< FAILURE!
java.lang.AssertionError: null
	at org.junit.Assert.fail(Assert.java:86)
	at org.junit.Assert.assertTrue(Assert.java:41)
	at org.junit.Assert.assertFalse(Assert.java:64)
	at org.junit.Assert.assertFalse(Assert.java:74)
	at io.xrates.backend.rateprovider.impl.DBSRateProviderImplTest.testEUR(DBSRateProviderImplTest.java:48)

testGBP(io.xrates.backend.rateprovider.impl.DBSRateProviderImplTest)  Time elapsed: 0.512 sec  <<< FAILURE!
java.lang.AssertionError: null
	at org.junit.Assert.fail(Assert.java:86)
	at org.junit.Assert.assertTrue(Assert.java:41)
	at org.junit.Assert.assertFalse(Assert.java:64)
	at org.junit.Assert.assertFalse(Assert.java:74)
	at io.xrates.backend.rateprovider.impl.DBSRateProviderImplTest.testGBP(DBSRateProviderImplTest.java:60)

testHDK(io.xrates.backend.rateprovider.impl.DBSRateProviderImplTest)  Time elapsed: 0.479 sec  <<< FAILURE!
java.lang.AssertionError: null
	at org.junit.Assert.fail(Assert.java:86)
	at org.junit.Assert.assertTrue(Assert.java:41)
	at org.junit.Assert.assertFalse(Assert.java:64)
	at org.junit.Assert.assertFalse(Assert.java:74)
	at io.xrates.backend.rateprovider.impl.DBSRateProviderImplTest.testHDK(DBSRateProviderImplTest.java:120)

testIDR(io.xrates.backend.rateprovider.impl.DBSRateProviderImplTest)  Time elapsed: 0.485 sec  <<< FAILURE!
java.lang.AssertionError: null
	at org.junit.Assert.fail(Assert.java:86)
	at org.junit.Assert.assertTrue(Assert.java:41)
	at org.junit.Assert.assertFalse(Assert.java:64)
	at org.junit.Assert.assertFalse(Assert.java:74)
	at io.xrates.backend.rateprovider.impl.DBSRateProviderImplTest.testIDR(DBSRateProviderImplTest.java:204)

testINR(io.xrates.backend.rateprovider.impl.DBSRateProviderImplTest)  Time elapsed: 0.48 sec  <<< FAILURE!
java.lang.AssertionError: null
	at org.junit.Assert.fail(Assert.java:86)
	at org.junit.Assert.assertTrue(Assert.java:41)
	at org.junit.Assert.assertFalse(Assert.java:64)
	at org.junit.Assert.assertFalse(Assert.java:74)
	at io.xrates.backend.rateprovider.impl.DBSRateProviderImplTest.testINR(DBSRateProviderImplTest.java:240)

testJPY(io.xrates.backend.rateprovider.impl.DBSRateProviderImplTest)  Time elapsed: 0.479 sec  <<< FAILURE!
java.lang.AssertionError: null
	at org.junit.Assert.fail(Assert.java:86)
	at org.junit.Assert.assertTrue(Assert.java:41)
	at org.junit.Assert.assertFalse(Assert.java:64)
	at org.junit.Assert.assertFalse(Assert.java:74)
	at io.xrates.backend.rateprovider.impl.DBSRateProviderImplTest.testJPY(DBSRateProviderImplTest.java:180)

testKRW(io.xrates.backend.rateprovider.impl.DBSRateProviderImplTest)  Time elapsed: 0.495 sec  <<< FAILURE!
java.lang.AssertionError: null
	at org.junit.Assert.fail(Assert.java:86)
	at org.junit.Assert.assertTrue(Assert.java:41)
	at org.junit.Assert.assertFalse(Assert.java:64)
	at org.junit.Assert.assertFalse(Assert.java:74)
	at io.xrates.backend.rateprovider.impl.DBSRateProviderImplTest.testKRW(DBSRateProviderImplTest.java:252)

testLKR(io.xrates.backend.rateprovider.impl.DBSRateProviderImplTest)  Time elapsed: 0.475 sec  <<< FAILURE!
java.lang.AssertionError: null
	at org.junit.Assert.fail(Assert.java:86)
	at org.junit.Assert.assertTrue(Assert.java:41)
	at org.junit.Assert.assertFalse(Assert.java:64)
	at org.junit.Assert.assertFalse(Assert.java:74)
	at io.xrates.backend.rateprovider.impl.DBSRateProviderImplTest.testLKR(DBSRateProviderImplTest.java:264)

testNOK(io.xrates.backend.rateprovider.impl.DBSRateProviderImplTest)  Time elapsed: 0.477 sec  <<< FAILURE!
java.lang.AssertionError: null
	at org.junit.Assert.fail(Assert.java:86)
	at org.junit.Assert.assertTrue(Assert.java:41)
	at org.junit.Assert.assertFalse(Assert.java:64)
	at org.junit.Assert.assertFalse(Assert.java:74)
	at io.xrates.backend.rateprovider.impl.DBSRateProviderImplTest.testNOK(DBSRateProviderImplTest.java:132)

testNZD(io.xrates.backend.rateprovider.impl.DBSRateProviderImplTest)  Time elapsed: 0.482 sec  <<< FAILURE!
java.lang.AssertionError: null
	at org.junit.Assert.fail(Assert.java:86)
	at org.junit.Assert.assertTrue(Assert.java:41)
	at org.junit.Assert.assertFalse(Assert.java:64)
	at org.junit.Assert.assertFalse(Assert.java:74)
	at io.xrates.backend.rateprovider.impl.DBSRateProviderImplTest.testNZD(DBSRateProviderImplTest.java:96)

testPHP(io.xrates.backend.rateprovider.impl.DBSRateProviderImplTest)  Time elapsed: 0.481 sec  <<< FAILURE!
java.lang.AssertionError: null
	at org.junit.Assert.fail(Assert.java:86)
	at org.junit.Assert.assertTrue(Assert.java:41)
	at org.junit.Assert.assertFalse(Assert.java:64)
	at org.junit.Assert.assertFalse(Assert.java:74)
	at io.xrates.backend.rateprovider.impl.DBSRateProviderImplTest.testPHP(DBSRateProviderImplTest.java:276)

testSAR(io.xrates.backend.rateprovider.impl.DBSRateProviderImplTest)  Time elapsed: 0.483 sec  <<< FAILURE!
java.lang.AssertionError: null
	at org.junit.Assert.fail(Assert.java:86)
	at org.junit.Assert.assertTrue(Assert.java:41)
	at org.junit.Assert.assertFalse(Assert.java:64)
	at org.junit.Assert.assertFalse(Assert.java:74)
	at io.xrates.backend.rateprovider.impl.DBSRateProviderImplTest.testSAR(DBSRateProviderImplTest.java:288)

testSEK(io.xrates.backend.rateprovider.impl.DBSRateProviderImplTest)  Time elapsed: 0.485 sec  <<< FAILURE!
java.lang.AssertionError: null
	at org.junit.Assert.fail(Assert.java:86)
	at org.junit.Assert.assertTrue(Assert.java:41)
	at org.junit.Assert.assertFalse(Assert.java:64)
	at org.junit.Assert.assertFalse(Assert.java:74)
	at io.xrates.backend.rateprovider.impl.DBSRateProviderImplTest.testSEK(DBSRateProviderImplTest.java:144)

testTHB(io.xrates.backend.rateprovider.impl.DBSRateProviderImplTest)  Time elapsed: 0.477 sec  <<< FAILURE!
java.lang.AssertionError: null
	at org.junit.Assert.fail(Assert.java:86)
	at org.junit.Assert.assertTrue(Assert.java:41)
	at org.junit.Assert.assertFalse(Assert.java:64)
	at org.junit.Assert.assertFalse(Assert.java:74)
	at io.xrates.backend.rateprovider.impl.DBSRateProviderImplTest.testTHB(DBSRateProviderImplTest.java:192)

testTWD(io.xrates.backend.rateprovider.impl.DBSRateProviderImplTest)  Time elapsed: 0.486 sec  <<< FAILURE!
java.lang.AssertionError: null
	at org.junit.Assert.fail(Assert.java:86)
	at org.junit.Assert.assertTrue(Assert.java:41)
	at org.junit.Assert.assertFalse(Assert.java:64)
	at org.junit.Assert.assertFalse(Assert.java:74)
	at io.xrates.backend.rateprovider.impl.DBSRateProviderImplTest.testTWD(DBSRateProviderImplTest.java:300)

testUSD(io.xrates.backend.rateprovider.impl.DBSRateProviderImplTest)  Time elapsed: 0.487 sec  <<< FAILURE!
java.lang.AssertionError: null
	at org.junit.Assert.fail(Assert.java:86)
	at org.junit.Assert.assertTrue(Assert.java:41)
	at org.junit.Assert.assertFalse(Assert.java:64)
	at org.junit.Assert.assertFalse(Assert.java:74)
	at io.xrates.backend.rateprovider.impl.DBSRateProviderImplTest.testUSD(DBSRateProviderImplTest.java:36)

testZAR(io.xrates.backend.rateprovider.impl.DBSRateProviderImplTest)  Time elapsed: 0.48 sec  <<< FAILURE!
java.lang.AssertionError: null
	at org.junit.Assert.fail(Assert.java:86)
	at org.junit.Assert.assertTrue(Assert.java:41)
	at org.junit.Assert.assertFalse(Assert.java:64)
	at org.junit.Assert.assertFalse(Assert.java:74)
	at io.xrates.backend.rateprovider.impl.DBSRateProviderImplTest.testZAR(DBSRateProviderImplTest.java:228)


Results :

Failed tests: 
  DBSRateProviderImplTest.testAUD:72 null
  DBSRateProviderImplTest.testBND:216 null
  DBSRateProviderImplTest.testCAD:84 null
  DBSRateProviderImplTest.testCHF:156 null
  DBSRateProviderImplTest.testCNY:168 null
  DBSRateProviderImplTest.testDKK:108 null
  DBSRateProviderImplTest.testEUR:48 null
  DBSRateProviderImplTest.testGBP:60 null
  DBSRateProviderImplTest.testHDK:120 null
  DBSRateProviderImplTest.testIDR:204 null
  DBSRateProviderImplTest.testINR:240 null
  DBSRateProviderImplTest.testJPY:180 null
  DBSRateProviderImplTest.testKRW:252 null
  DBSRateProviderImplTest.testLKR:264 null
  DBSRateProviderImplTest.testNOK:132 null
  DBSRateProviderImplTest.testNZD:96 null
  DBSRateProviderImplTest.testPHP:276 null
  DBSRateProviderImplTest.testSAR:288 null
  DBSRateProviderImplTest.testSEK:144 null
  DBSRateProviderImplTest.testTHB:192 null
  DBSRateProviderImplTest.testTWD:300 null
  DBSRateProviderImplTest.testUSD:36 null
  DBSRateProviderImplTest.testZAR:228 null

Tests run: 23, Failures: 23, Errors: 0, Skipped: 0

[INFO] ------------------------------------------------------------------------
[INFO] BUILD FAILURE
[INFO] ------------------------------------------------------------------------
[INFO] Total time: 13.869 s
[INFO] Finished at: 2018-05-11T17:36:51+02:00
[INFO] Final Memory: 25M/940M
[INFO] ------------------------------------------------------------------------
[ERROR] Failed to execute goal org.apache.maven.plugins:maven-surefire-plugin:2.18.1:test (default-test) on project io.xrates: There are test failures.
[ERROR] 
[ERROR] Please refer to /root/workspace/siddharthgoel88/xrates/377772477/target/surefire-reports for the individual test results.
[ERROR] -> [Help 1]
[ERROR] 
[ERROR] To see the full stack trace of the errors, re-run Maven with the -e switch.
[ERROR] Re-run Maven using the -X switch to enable full debug logging.
[ERROR] 
[ERROR] For more information about the errors and possible solutions, please read the following articles:
[ERROR] [Help 1] http://cwiki.apache.org/confluence/display/MAVEN/MojoFailureException
