[INFO] Scanning for projects...
[INFO] ------------------------------------------------------------------------
[INFO] Reactor Build Order:
[INFO] 
[INFO] Asynchronous Http Client Project
[INFO] Asynchronous Http Client Netty Utils
[INFO] Asynchronous Http Client
[INFO] Asynchronous Http Client Extras Parent
[INFO] Asynchronous Http Client Guava Extras
[INFO] Asynchronous Http Client JDeferred Extras
[INFO] Asynchronous Http Client Registry Extras
[INFO] Asynchronous Http Client RxJava Extras
[INFO] Asynchronous Http Client RxJava2 Extras
[INFO] Asynchronous Http Simple Client
[INFO] Asynchronous Http Client Retrofit2 Extras
[INFO] Asynchronous Http Client Example
[INFO]                                                                         
[INFO] ------------------------------------------------------------------------
[INFO] Building Asynchronous Http Client Project 2.1.0-SNAPSHOT
[INFO] ------------------------------------------------------------------------
[INFO] 
[INFO] --- maven-enforcer-plugin:1.4.1:enforce (enforce-maven) @ async-http-client-project ---
[INFO] Skipping Rule Enforcement.
[INFO] 
[INFO] --- maven-enforcer-plugin:1.4.1:enforce (enforce-versions) @ async-http-client-project ---
[INFO] Skipping Rule Enforcement.
[INFO]                                                                         
[INFO] ------------------------------------------------------------------------
[INFO] Building Asynchronous Http Client Netty Utils 2.1.0-SNAPSHOT
[INFO] ------------------------------------------------------------------------
[INFO] 
[INFO] --- maven-enforcer-plugin:1.4.1:enforce (enforce-maven) @ async-http-client-netty-utils ---
[INFO] Skipping Rule Enforcement.
[INFO] 
[INFO] --- maven-enforcer-plugin:1.4.1:enforce (enforce-versions) @ async-http-client-netty-utils ---
[INFO] Skipping Rule Enforcement.
[INFO] 
[INFO] --- maven-resources-plugin:3.0.2:resources (default-resources) @ async-http-client-netty-utils ---
[INFO] Using 'UTF-8' encoding to copy filtered resources.
[INFO] skip non existing resourceDirectory /root/workspace/AsyncHttpClient/async-http-client/308122011/netty-utils/src/main/resources
[INFO] 
[INFO] --- maven-compiler-plugin:3.6.1:compile (default-compile) @ async-http-client-netty-utils ---
[INFO] Nothing to compile - all classes are up to date
[INFO] 
[INFO] --- maven-resources-plugin:3.0.2:testResources (default-testResources) @ async-http-client-netty-utils ---
[INFO] Using 'UTF-8' encoding to copy filtered resources.
[INFO] skip non existing resourceDirectory /root/workspace/AsyncHttpClient/async-http-client/308122011/netty-utils/src/test/resources
[INFO] 
[INFO] --- maven-compiler-plugin:3.6.1:testCompile (default-testCompile) @ async-http-client-netty-utils ---
[INFO] Nothing to compile - all classes are up to date
[INFO] 
[INFO] --- maven-surefire-plugin:2.19.1:test (default-test) @ async-http-client-netty-utils ---
[INFO] Downloading: https://repo.maven.apache.org/maven2/org/apache/maven/surefire/surefire-testng/2.19.1/surefire-testng-2.19.1.pom
[INFO] Downloaded: https://repo.maven.apache.org/maven2/org/apache/maven/surefire/surefire-testng/2.19.1/surefire-testng-2.19.1.pom (3 KB at 2.1 KB/sec)
[INFO] Downloading: https://repo.maven.apache.org/maven2/org/apache/maven/surefire/surefire-providers/2.19.1/surefire-providers-2.19.1.pom
[INFO] Downloaded: https://repo.maven.apache.org/maven2/org/apache/maven/surefire/surefire-providers/2.19.1/surefire-providers-2.19.1.pom (3 KB at 56.9 KB/sec)
[INFO] Downloading: https://repo.maven.apache.org/maven2/org/apache/maven/surefire/common-java5/2.19.1/common-java5-2.19.1.pom
[INFO] Downloaded: https://repo.maven.apache.org/maven2/org/apache/maven/surefire/common-java5/2.19.1/common-java5-2.19.1.pom (3 KB at 67.0 KB/sec)
[INFO] Downloading: https://repo.maven.apache.org/maven2/org/apache/maven/surefire/surefire-testng-utils/2.19.1/surefire-testng-utils-2.19.1.pom
[INFO] Downloaded: https://repo.maven.apache.org/maven2/org/apache/maven/surefire/surefire-testng-utils/2.19.1/surefire-testng-utils-2.19.1.pom (3 KB at 82.8 KB/sec)
[INFO] Downloading: https://repo.maven.apache.org/maven2/org/apache/maven/surefire/surefire-grouper/2.19.1/surefire-grouper-2.19.1.pom
[INFO] Downloaded: https://repo.maven.apache.org/maven2/org/apache/maven/surefire/surefire-grouper/2.19.1/surefire-grouper-2.19.1.pom (3 KB at 45.0 KB/sec)
[INFO] Downloading: https://repo.maven.apache.org/maven2/org/apache/maven/surefire/surefire-testng/2.19.1/surefire-testng-2.19.1.jar
[INFO] Downloading: https://repo.maven.apache.org/maven2/org/apache/maven/surefire/common-java5/2.19.1/common-java5-2.19.1.jar
[INFO] Downloading: https://repo.maven.apache.org/maven2/org/apache/maven/surefire/surefire-testng-utils/2.19.1/surefire-testng-utils-2.19.1.jar
[INFO] Downloading: https://repo.maven.apache.org/maven2/org/apache/maven/surefire/surefire-grouper/2.19.1/surefire-grouper-2.19.1.jar
[INFO] Downloaded: https://repo.maven.apache.org/maven2/org/apache/maven/surefire/surefire-testng/2.19.1/surefire-testng-2.19.1.jar (42 KB at 348.4 KB/sec)
[INFO] Downloaded: https://repo.maven.apache.org/maven2/org/apache/maven/surefire/surefire-testng-utils/2.19.1/surefire-testng-utils-2.19.1.jar (27 KB at 192.0 KB/sec)
[INFO] Downloaded: https://repo.maven.apache.org/maven2/org/apache/maven/surefire/surefire-grouper/2.19.1/surefire-grouper-2.19.1.jar (38 KB at 228.5 KB/sec)
[INFO] Downloaded: https://repo.maven.apache.org/maven2/org/apache/maven/surefire/common-java5/2.19.1/common-java5-2.19.1.jar (44 KB at 217.6 KB/sec)

-------------------------------------------------------
 T E S T S
-------------------------------------------------------
Running org.asynchttpclient.netty.util.Utf8ByteBufCharsetDecoderTest
Tests run: 4, Failures: 0, Errors: 0, Skipped: 0, Time elapsed: 1.425 sec - in org.asynchttpclient.netty.util.Utf8ByteBufCharsetDecoderTest

Results :

Tests run: 4, Failures: 0, Errors: 0, Skipped: 0

[INFO]                                                                         
[INFO] ------------------------------------------------------------------------
[INFO] Building Asynchronous Http Client 2.1.0-SNAPSHOT
[INFO] ------------------------------------------------------------------------
[INFO] 
[INFO] --- maven-enforcer-plugin:1.4.1:enforce (enforce-maven) @ async-http-client ---
[INFO] Skipping Rule Enforcement.
[INFO] 
[INFO] --- maven-enforcer-plugin:1.4.1:enforce (enforce-versions) @ async-http-client ---
[INFO] Skipping Rule Enforcement.
[INFO] 
[INFO] --- maven-resources-plugin:3.0.2:resources (default-resources) @ async-http-client ---
[INFO] Using 'UTF-8' encoding to copy filtered resources.
[INFO] Copying 3 resources
[INFO] 
[INFO] --- maven-compiler-plugin:3.6.1:compile (default-compile) @ async-http-client ---
[INFO] Nothing to compile - all classes are up to date
[INFO] 
[INFO] --- maven-resources-plugin:3.0.2:testResources (default-testResources) @ async-http-client ---
[INFO] Using 'UTF-8' encoding to copy filtered resources.
[INFO] Copying 12 resources
[INFO] 
[INFO] --- maven-compiler-plugin:3.6.1:testCompile (default-testCompile) @ async-http-client ---
[INFO] Nothing to compile - all classes are up to date
[INFO] 
[INFO] --- maven-surefire-plugin:2.19.1:test (default-test) @ async-http-client ---

-------------------------------------------------------
 T E S T S
-------------------------------------------------------
Running TestSuite
Tests run: 512, Failures: 9, Errors: 0, Skipped: 0, Time elapsed: 243.351 sec <<< FAILURE! - in TestSuite
echoWSSText(org.asynchttpclient.ws.ProxyTunnellingTest)  Time elapsed: 0.373 sec  <<< FAILURE!
java.lang.NullPointerException
	at org.asynchttpclient.ws.ProxyTunnellingTest.runTest(ProxyTunnellingTest.java:106)
	at org.asynchttpclient.ws.ProxyTunnellingTest.echoWSSText(ProxyTunnellingTest.java:67)

echoWSText(org.asynchttpclient.ws.ProxyTunnellingTest)  Time elapsed: 0.147 sec  <<< FAILURE!
java.lang.NullPointerException
	at org.asynchttpclient.ws.ProxyTunnellingTest.runTest(ProxyTunnellingTest.java:106)
	at org.asynchttpclient.ws.ProxyTunnellingTest.echoWSText(ProxyTunnellingTest.java:62)

testConfigProxy(org.asynchttpclient.proxy.HttpsProxyTest)  Time elapsed: 0.078 sec  <<< FAILURE!
java.lang.AssertionError: expected [200] but found [500]
	at org.asynchttpclient.proxy.HttpsProxyTest.testConfigProxy(HttpsProxyTest.java:86)

testPooledConnectionsWithProxy(org.asynchttpclient.proxy.HttpsProxyTest)  Time elapsed: 0.008 sec  <<< FAILURE!
java.lang.AssertionError: expected [200] but found [500]
	at org.asynchttpclient.proxy.HttpsProxyTest.testPooledConnectionsWithProxy(HttpsProxyTest.java:97)

testRequestProxy(org.asynchttpclient.proxy.HttpsProxyTest)  Time elapsed: 0.013 sec  <<< FAILURE!
java.lang.AssertionError: expected [200] but found [500]
	at org.asynchttpclient.proxy.HttpsProxyTest.testRequestProxy(HttpsProxyTest.java:73)

configRequestTimeoutHappensInDueTime(org.asynchttpclient.BasicHttpTest)  Time elapsed: 1.512 sec  <<< FAILURE!
java.lang.AssertionError: expected [true] but found [false]
	at org.asynchttpclient.BasicHttpTest.lambda$null$53(BasicHttpTest.java:684)
	at org.asynchttpclient.BasicHttpTest.lambda$configRequestTimeoutHappensInDueTime$54(BasicHttpTest.java:673)
	at org.asynchttpclient.BasicHttpTest.configRequestTimeoutHappensInDueTime(BasicHttpTest.java:672)

newConnectionEventsAreFired(org.asynchttpclient.BasicHttpTest)  Time elapsed: 0.299 sec  <<< FAILURE!
java.lang.AssertionError: Got [ConnectionPool, HostnameResolution, HostnameResolutionSuccess, ConnectionOpen, ConnectionFailure, ConnectionOpen, ConnectionSuccess, RequestSend, HeadersWritten, StatusReceived, HeadersReceived, ConnectionOffer, Completed]: lists don't have the same size expected [11] but found [13]
	at org.asynchttpclient.BasicHttpTest.lambda$null$73(BasicHttpTest.java:907)
	at org.asynchttpclient.BasicHttpTest.lambda$newConnectionEventsAreFired$74(BasicHttpTest.java:886)
	at org.asynchttpclient.BasicHttpTest.newConnectionEventsAreFired(BasicHttpTest.java:885)

nonPreemptiveProxyAuthWithHttpsTarget(org.asynchttpclient.BasicHttpProxyToHttpsTest)  Time elapsed: 0.02 sec  <<< FAILURE!
java.lang.AssertionError: expected [200] but found [500]
	at org.asynchttpclient.BasicHttpProxyToHttpsTest.nonPreemptiveProxyAuthWithHttpsTarget(BasicHttpProxyToHttpsTest.java:105)

testNormalEventsFired(org.asynchttpclient.BasicHttpsTest)  Time elapsed: 0.189 sec  <<< FAILURE!
java.lang.AssertionError: Got [ConnectionPool, HostnameResolution, HostnameResolutionSuccess, ConnectionOpen, ConnectionFailure, ConnectionOpen, ConnectionSuccess, TlsHandshake, TlsHandshakeSuccess, RequestSend, HeadersWritten, StatusReceived, HeadersReceived, ConnectionOffer, Completed]: lists don't have the same size expected [13] but found [15]
	at org.asynchttpclient.BasicHttpsTest.lambda$null$12(BasicHttpsTest.java:217)
	at org.asynchttpclient.BasicHttpsTest.lambda$testNormalEventsFired$13(BasicHttpsTest.java:195)
	at org.asynchttpclient.BasicHttpsTest.testNormalEventsFired(BasicHttpsTest.java:194)


Results :

Failed tests: 
  BasicHttpProxyToHttpsTest.nonPreemptiveProxyAuthWithHttpsTarget:105 expected [200] but found [500]
  BasicHttpTest.configRequestTimeoutHappensInDueTime:672->lambda$configRequestTimeoutHappensInDueTime$54:673->lambda$null$53:684 expected [true] but found [false]
  BasicHttpTest.newConnectionEventsAreFired:885->lambda$newConnectionEventsAreFired$74:886->lambda$null$73:907 Got [ConnectionPool, HostnameResolution, HostnameResolutionSuccess, ConnectionOpen, ConnectionFailure, ConnectionOpen, ConnectionSuccess, RequestSend, HeadersWritten, StatusReceived, HeadersReceived, ConnectionOffer, Completed]: lists don't have the same size expected [11] but found [13]
  BasicHttpsTest.testNormalEventsFired:194->lambda$testNormalEventsFired$13:195->lambda$null$12:217 Got [ConnectionPool, HostnameResolution, HostnameResolutionSuccess, ConnectionOpen, ConnectionFailure, ConnectionOpen, ConnectionSuccess, TlsHandshake, TlsHandshakeSuccess, RequestSend, HeadersWritten, StatusReceived, HeadersReceived, ConnectionOffer, Completed]: lists don't have the same size expected [13] but found [15]
  HttpsProxyTest.testConfigProxy:86 expected [200] but found [500]
  HttpsProxyTest.testPooledConnectionsWithProxy:97 expected [200] but found [500]
  HttpsProxyTest.testRequestProxy:73 expected [200] but found [500]
  ProxyTunnellingTest.echoWSSText:67->runTest:106 NullPointer
  ProxyTunnellingTest.echoWSText:62->runTest:106 NullPointer

Tests run: 512, Failures: 9, Errors: 0, Skipped: 0

[INFO] ------------------------------------------------------------------------
[INFO] Reactor Summary:
[INFO] 
[INFO] Asynchronous Http Client Project ................... SUCCESS [  2.683 s]
[INFO] Asynchronous Http Client Netty Utils ............... SUCCESS [  8.510 s]
[INFO] Asynchronous Http Client ........................... FAILURE [04:05 min]
[INFO] Asynchronous Http Client Extras Parent ............. SKIPPED
[INFO] Asynchronous Http Client Guava Extras .............. SKIPPED
[INFO] Asynchronous Http Client JDeferred Extras .......... SKIPPED
[INFO] Asynchronous Http Client Registry Extras ........... SKIPPED
[INFO] Asynchronous Http Client RxJava Extras ............. SKIPPED
[INFO] Asynchronous Http Client RxJava2 Extras ............ SKIPPED
[INFO] Asynchronous Http Simple Client .................... SKIPPED
[INFO] Asynchronous Http Client Retrofit2 Extras .......... SKIPPED
[INFO] Asynchronous Http Client Example ................... SKIPPED
[INFO] ------------------------------------------------------------------------
[INFO] BUILD FAILURE
[INFO] ------------------------------------------------------------------------
[INFO] Total time: 04:19 min
[INFO] Finished at: 2017-11-27T23:14:01+01:00
[INFO] Final Memory: 23M/604M
[INFO] ------------------------------------------------------------------------
[ERROR] Failed to execute goal org.apache.maven.plugins:maven-surefire-plugin:2.19.1:test (default-test) on project async-http-client: There are test failures.
[ERROR] 
[ERROR] Please refer to /root/workspace/AsyncHttpClient/async-http-client/308122011/client/target/surefire-reports for the individual test results.
[ERROR] -> [Help 1]
[ERROR] 
[ERROR] To see the full stack trace of the errors, re-run Maven with the -e switch.
[ERROR] Re-run Maven using the -X switch to enable full debug logging.
[ERROR] 
[ERROR] For more information about the errors and possible solutions, please read the following articles:
[ERROR] [Help 1] http://cwiki.apache.org/confluence/display/MAVEN/MojoFailureException
[ERROR] 
[ERROR] After correcting the problems, you can resume the build with the command
[ERROR]   mvn <goals> -rf :async-http-client
