[INFO] Scanning for projects...
[INFO]                                                                         
[INFO] ------------------------------------------------------------------------
[INFO] Building Ryanair Cucumber Test 1.0-SNAPSHOT
[INFO] ------------------------------------------------------------------------
[INFO] 
[INFO] --- maven-resources-plugin:2.6:resources (default-resources) @ ryanair.com ---
[INFO] Using 'UTF-8' encoding to copy filtered resources.
[INFO] skip non existing resourceDirectory /root/workspace/scripnichenko/ryanair.com/414730108/src/main/resources
[INFO] 
[INFO] --- maven-compiler-plugin:3.1:compile (default-compile) @ ryanair.com ---
[INFO] No sources to compile
[INFO] 
[INFO] --- maven-resources-plugin:2.6:testResources (default-testResources) @ ryanair.com ---
[INFO] Using 'UTF-8' encoding to copy filtered resources.
[INFO] Copying 2 resources
[INFO] 
[INFO] --- maven-compiler-plugin:3.1:testCompile (default-testCompile) @ ryanair.com ---
[INFO] Nothing to compile - all classes are up to date
[INFO] 
[INFO] --- maven-surefire-plugin:2.20:test (default-test) @ ryanair.com ---
[INFO] Downloading: https://repo.maven.apache.org/maven2/org/apache/maven/surefire/surefire-junit4/2.20/surefire-junit4-2.20.pom
[INFO] Downloaded: https://repo.maven.apache.org/maven2/org/apache/maven/surefire/surefire-junit4/2.20/surefire-junit4-2.20.pom (4 KB at 2.2 KB/sec)
[INFO] Downloading: https://repo.maven.apache.org/maven2/org/apache/maven/surefire/surefire-providers/2.20/surefire-providers-2.20.pom
[INFO] Downloaded: https://repo.maven.apache.org/maven2/org/apache/maven/surefire/surefire-providers/2.20/surefire-providers-2.20.pom (3 KB at 59.8 KB/sec)
[INFO] Downloading: https://repo.maven.apache.org/maven2/org/apache/maven/surefire/surefire-junit4/2.20/surefire-junit4-2.20.jar
[INFO] Downloaded: https://repo.maven.apache.org/maven2/org/apache/maven/surefire/surefire-junit4/2.20/surefire-junit4-2.20.jar (81 KB at 758.6 KB/sec)
[INFO] 
[INFO] -------------------------------------------------------
[INFO]  T E S T S
[INFO] -------------------------------------------------------
[INFO] Running runner.DeclinedPaymentTest

[31mFailed scenarios:[0m
[31mfeatures/checkDeclinedPaymentErrorMessage.feature:5 [0m# Scenario: Not valid card being used to pay for a ticket

1 Scenarios ([31m1 failed[0m)
3 Steps ([36m3 skipped[0m)
0m5.673s

org.openqa.selenium.WebDriverException: Cannot find firefox binary in PATH. Make sure firefox is installed. OS appears to be: LINUX
Build info: version: '3.8.1', revision: '6e95a6684b', time: '2017-12-01T18:33:54.468Z'
System info: host: 'spirals-repairnator', ip: '172.17.7.87', os.name: 'Linux', os.arch: 'amd64', os.version: '4.9.0-6-amd64', java.version: '1.8.0_121'
Driver info: driver.version: FirefoxDriver
selenide.url: https://www.ryanair.com/ie/en/
selenide.baseUrl: https://www.ryanair.com/ie/en
	at org.openqa.selenium.firefox.FirefoxBinary.<init>(FirefoxBinary.java:116)
	at java.util.Optional.orElseGet(Optional.java:267)
	at org.openqa.selenium.firefox.FirefoxOptions.getBinary(FirefoxOptions.java:218)
	at org.openqa.selenium.firefox.FirefoxDriver.toExecutor(FirefoxDriver.java:155)
	at org.openqa.selenium.firefox.FirefoxDriver.<init>(FirefoxDriver.java:120)
	at com.codeborne.selenide.webdriver.FirefoxDriverFactory.createFirefoxDriver(FirefoxDriverFactory.java:31)
	at com.codeborne.selenide.webdriver.FirefoxDriverFactory.create(FirefoxDriverFactory.java:26)
	at com.codeborne.selenide.webdriver.WebDriverFactory.lambda$createWebDriver$0(WebDriverFactory.java:51)
	at java.util.Optional.map(Optional.java:215)
	at com.codeborne.selenide.webdriver.WebDriverFactory.createWebDriver(WebDriverFactory.java:51)
	at com.codeborne.selenide.impl.WebDriverThreadLocalContainer.createDriver(WebDriverThreadLocalContainer.java:224)
	at com.codeborne.selenide.impl.WebDriverThreadLocalContainer.getAndCheckWebDriver(WebDriverThreadLocalContainer.java:111)
	at com.codeborne.selenide.WebDriverRunner.getAndCheckWebDriver(WebDriverRunner.java:135)
	at com.codeborne.selenide.impl.Navigator.navigateToAbsoluteUrl(Navigator.java:66)
	at com.codeborne.selenide.impl.Navigator.open(Navigator.java:32)
	at com.codeborne.selenide.Selenide.open(Selenide.java:79)
	at com.codeborne.selenide.Selenide.open(Selenide.java:53)
	at flow.DeclinedPaymentFlow.setUp(DeclinedPaymentFlow.java:35)
	at sun.reflect.NativeMethodAccessorImpl.invoke0(Native Method)
	at sun.reflect.NativeMethodAccessorImpl.invoke(NativeMethodAccessorImpl.java:62)
	at sun.reflect.DelegatingMethodAccessorImpl.invoke(DelegatingMethodAccessorImpl.java:43)
	at java.lang.reflect.Method.invoke(Method.java:498)
	at cucumber.runtime.Utils$1.call(Utils.java:40)
	at cucumber.runtime.Timeout.timeout(Timeout.java:16)
	at cucumber.runtime.Utils.invoke(Utils.java:34)
	at cucumber.runtime.java.JavaHookDefinition.execute(JavaHookDefinition.java:60)
	at cucumber.runtime.Runtime.runHookIfTagsMatch(Runtime.java:224)
	at cucumber.runtime.Runtime.runHooks(Runtime.java:212)
	at cucumber.runtime.Runtime.runBeforeHooks(Runtime.java:202)
	at cucumber.runtime.model.CucumberScenario.run(CucumberScenario.java:40)
	at cucumber.runtime.junit.ExecutionUnitRunner.run(ExecutionUnitRunner.java:102)
	at cucumber.runtime.junit.FeatureRunner.runChild(FeatureRunner.java:63)
	at cucumber.runtime.junit.FeatureRunner.runChild(FeatureRunner.java:18)
	at org.junit.runners.ParentRunner$3.run(ParentRunner.java:290)
	at org.junit.runners.ParentRunner$1.schedule(ParentRunner.java:71)
	at org.junit.runners.ParentRunner.runChildren(ParentRunner.java:288)
	at org.junit.runners.ParentRunner.access$000(ParentRunner.java:58)
	at org.junit.runners.ParentRunner$2.evaluate(ParentRunner.java:268)
	at org.junit.runners.ParentRunner.run(ParentRunner.java:363)
	at cucumber.runtime.junit.FeatureRunner.run(FeatureRunner.java:70)
	at cucumber.api.junit.Cucumber.runChild(Cucumber.java:95)
	at cucumber.api.junit.Cucumber.runChild(Cucumber.java:38)
	at org.junit.runners.ParentRunner$3.run(ParentRunner.java:290)
	at org.junit.runners.ParentRunner$1.schedule(ParentRunner.java:71)
	at org.junit.runners.ParentRunner.runChildren(ParentRunner.java:288)
	at org.junit.runners.ParentRunner.access$000(ParentRunner.java:58)
	at org.junit.runners.ParentRunner$2.evaluate(ParentRunner.java:268)
	at org.junit.runners.ParentRunner.run(ParentRunner.java:363)
	at cucumber.api.junit.Cucumber.run(Cucumber.java:100)
	at org.apache.maven.surefire.junit4.JUnit4Provider.execute(JUnit4Provider.java:365)
	at org.apache.maven.surefire.junit4.JUnit4Provider.executeWithRerun(JUnit4Provider.java:272)
	at org.apache.maven.surefire.junit4.JUnit4Provider.executeTestSet(JUnit4Provider.java:236)
	at org.apache.maven.surefire.junit4.JUnit4Provider.invoke(JUnit4Provider.java:159)
	at org.apache.maven.surefire.booter.ForkedBooter.invokeProviderInSameClassLoader(ForkedBooter.java:386)
	at org.apache.maven.surefire.booter.ForkedBooter.runSuitesInProcess(ForkedBooter.java:323)
	at org.apache.maven.surefire.booter.ForkedBooter.main(ForkedBooter.java:143)

java.lang.NullPointerException
	at com.google.common.base.Preconditions.checkNotNull(Preconditions.java:882)
	at com.google.common.io.Files$FileByteSource.<init>(Files.java:125)
	at com.google.common.io.Files$FileByteSource.<init>(Files.java:120)
	at com.google.common.io.Files.asByteSource(Files.java:117)
	at com.google.common.io.Files.toByteArray(Files.java:259)
	at flow.DeclinedPaymentFlow.screenshot(DeclinedPaymentFlow.java:85)
	at flow.DeclinedPaymentFlow.tearDown(DeclinedPaymentFlow.java:79)
	at sun.reflect.NativeMethodAccessorImpl.invoke0(Native Method)
	at sun.reflect.NativeMethodAccessorImpl.invoke(NativeMethodAccessorImpl.java:62)
	at sun.reflect.DelegatingMethodAccessorImpl.invoke(DelegatingMethodAccessorImpl.java:43)
	at java.lang.reflect.Method.invoke(Method.java:498)
	at cucumber.runtime.Utils$1.call(Utils.java:40)
	at cucumber.runtime.Timeout.timeout(Timeout.java:16)
	at cucumber.runtime.Utils.invoke(Utils.java:34)
	at cucumber.runtime.java.JavaHookDefinition.execute(JavaHookDefinition.java:60)
	at cucumber.runtime.Runtime.runHookIfTagsMatch(Runtime.java:224)
	at cucumber.runtime.Runtime.runHooks(Runtime.java:212)
	at cucumber.runtime.Runtime.runAfterHooks(Runtime.java:206)
	at cucumber.runtime.model.CucumberScenario.run(CucumberScenario.java:46)
	at cucumber.runtime.junit.ExecutionUnitRunner.run(ExecutionUnitRunner.java:102)
	at cucumber.runtime.junit.FeatureRunner.runChild(FeatureRunner.java:63)
	at cucumber.runtime.junit.FeatureRunner.runChild(FeatureRunner.java:18)
	at org.junit.runners.ParentRunner$3.run(ParentRunner.java:290)
	at org.junit.runners.ParentRunner$1.schedule(ParentRunner.java:71)
	at org.junit.runners.ParentRunner.runChildren(ParentRunner.java:288)
	at org.junit.runners.ParentRunner.access$000(ParentRunner.java:58)
	at org.junit.runners.ParentRunner$2.evaluate(ParentRunner.java:268)
	at org.junit.runners.ParentRunner.run(ParentRunner.java:363)
	at cucumber.runtime.junit.FeatureRunner.run(FeatureRunner.java:70)
	at cucumber.api.junit.Cucumber.runChild(Cucumber.java:95)
	at cucumber.api.junit.Cucumber.runChild(Cucumber.java:38)
	at org.junit.runners.ParentRunner$3.run(ParentRunner.java:290)
	at org.junit.runners.ParentRunner$1.schedule(ParentRunner.java:71)
	at org.junit.runners.ParentRunner.runChildren(ParentRunner.java:288)
	at org.junit.runners.ParentRunner.access$000(ParentRunner.java:58)
	at org.junit.runners.ParentRunner$2.evaluate(ParentRunner.java:268)
	at org.junit.runners.ParentRunner.run(ParentRunner.java:363)
	at cucumber.api.junit.Cucumber.run(Cucumber.java:100)
	at org.apache.maven.surefire.junit4.JUnit4Provider.execute(JUnit4Provider.java:365)
	at org.apache.maven.surefire.junit4.JUnit4Provider.executeWithRerun(JUnit4Provider.java:272)
	at org.apache.maven.surefire.junit4.JUnit4Provider.executeTestSet(JUnit4Provider.java:236)
	at org.apache.maven.surefire.junit4.JUnit4Provider.invoke(JUnit4Provider.java:159)
	at org.apache.maven.surefire.booter.ForkedBooter.invokeProviderInSameClassLoader(ForkedBooter.java:386)
	at org.apache.maven.surefire.booter.ForkedBooter.runSuitesInProcess(ForkedBooter.java:323)
	at org.apache.maven.surefire.booter.ForkedBooter.main(ForkedBooter.java:143)

[ERROR] Tests run: 5, Failures: 0, Errors: 2, Skipped: 3, Time elapsed: 7.96 s <<< FAILURE! - in runner.DeclinedPaymentTest
[ERROR] Scenario: Not valid card being used to pay for a ticket  Time elapsed: 6.187 s  <<< ERROR!
org.openqa.selenium.WebDriverException: 
Cannot find firefox binary in PATH. Make sure firefox is installed. OS appears to be: LINUX
Build info: version: '3.8.1', revision: '6e95a6684b', time: '2017-12-01T18:33:54.468Z'
System info: host: 'spirals-repairnator', ip: '172.17.7.87', os.name: 'Linux', os.arch: 'amd64', os.version: '4.9.0-6-amd64', java.version: '1.8.0_121'
Driver info: driver.version: FirefoxDriver
selenide.url: https://www.ryanair.com/ie/en/
selenide.baseUrl: https://www.ryanair.com/ie/en

[ERROR] Scenario: Not valid card being used to pay for a ticket  Time elapsed: 6.658 s  <<< ERROR!
java.lang.NullPointerException

[INFO] 
[INFO] Results:
[INFO] 
[ERROR] Errors: 
[ERROR] Scenario: Not valid card being used to pay for a ticket.Scenario: Not valid card being used to pay for a ticket
[ERROR]   Run 1: Cannot find firefox binary in PATH. Make sure firefox is installed. OS appears to be: LINUX
Build info: version: '3.8.1', revision: '6e95a6684b', time: '2017-12-01T18:33:54.468Z'
System info: host: 'spirals-repairnator', ip: '172.17.7.87', os.name: 'Linux', os.arch: 'amd64', os.version: '4.9.0-6-amd64', java.version: '1.8.0_121'
Driver info: driver.version: FirefoxDriver
selenide.url: https://www.ryanair.com/ie/en/
selenide.baseUrl: https://www.ryanair.com/ie/en
[ERROR]   Run 2: null
[INFO] 
[INFO] 
[ERROR] Tests run: 4, Failures: 0, Errors: 1, Skipped: 3
[INFO] 
[INFO] ------------------------------------------------------------------------
[INFO] BUILD FAILURE
[INFO] ------------------------------------------------------------------------
[INFO] Total time: 15.922 s
[INFO] Finished at: 2018-08-11T01:14:27+02:00
[INFO] Final Memory: 17M/308M
[INFO] ------------------------------------------------------------------------
[ERROR] Failed to execute goal org.apache.maven.plugins:maven-surefire-plugin:2.20:test (default-test) on project ryanair.com: There are test failures.
[ERROR] 
[ERROR] Please refer to /root/workspace/scripnichenko/ryanair.com/414730108/target/surefire-reports for the individual test results.
[ERROR] Please refer to dump files (if any exist) [date]-jvmRun[N].dump, [date].dumpstream and [date]-jvmRun[N].dumpstream.
[ERROR] -> [Help 1]
[ERROR] 
[ERROR] To see the full stack trace of the errors, re-run Maven with the -e switch.
[ERROR] Re-run Maven using the -X switch to enable full debug logging.
[ERROR] 
[ERROR] For more information about the errors and possible solutions, please read the following articles:
[ERROR] [Help 1] http://cwiki.apache.org/confluence/display/MAVEN/MojoFailureException
