[INFO] Scanning for projects...
[INFO] Inspecting build with total of 1 modules...
[INFO] Installing Nexus Staging features:
[INFO]   ... total of 1 executions of maven-deploy-plugin replaced with nexus-staging-maven-plugin
[INFO]                                                                         
[INFO] ------------------------------------------------------------------------
[INFO] Building FastClasspathScanner 2.12.3-SNAPSHOT
[INFO] ------------------------------------------------------------------------
[INFO] 
[INFO] --- maven-resources-plugin:2.6:resources (default-resources) @ fast-classpath-scanner ---
[INFO] Using 'UTF-8' encoding to copy filtered resources.
[INFO] skip non existing resourceDirectory /root/workspace/lukehutch/fast-classpath-scanner/336237814/src/main/resources
[INFO] 
[INFO] --- maven-compiler-plugin:3.5.1:compile (default-compile) @ fast-classpath-scanner ---
[INFO] Nothing to compile - all classes are up to date
[INFO] 
[INFO] --- maven-bundle-plugin:3.2.0:manifest (bundle-manifest) @ fast-classpath-scanner ---
[INFO] 
[INFO] --- maven-resources-plugin:2.6:testResources (default-testResources) @ fast-classpath-scanner ---
[INFO] Using 'UTF-8' encoding to copy filtered resources.
[INFO] Copying 11 resources
[INFO] 
[INFO] --- maven-compiler-plugin:3.5.1:testCompile (default-testCompile) @ fast-classpath-scanner ---
[INFO] Nothing to compile - all classes are up to date
[INFO] 
[INFO] --- maven-surefire-plugin:2.19.1:test (default-test) @ fast-classpath-scanner ---
[INFO] Downloading: https://repo.maven.apache.org/maven2/org/apache/maven/surefire/surefire-junit4/2.19.1/surefire-junit4-2.19.1.pom
[INFO] Downloaded: https://repo.maven.apache.org/maven2/org/apache/maven/surefire/surefire-junit4/2.19.1/surefire-junit4-2.19.1.pom (4 KB at 7.1 KB/sec)
[INFO] Downloading: https://repo.maven.apache.org/maven2/org/apache/maven/surefire/surefire-providers/2.19.1/surefire-providers-2.19.1.pom
[INFO] Downloaded: https://repo.maven.apache.org/maven2/org/apache/maven/surefire/surefire-providers/2.19.1/surefire-providers-2.19.1.pom (3 KB at 113.8 KB/sec)
[INFO] Downloading: https://repo.maven.apache.org/maven2/org/apache/maven/surefire/surefire-junit4/2.19.1/surefire-junit4-2.19.1.jar
[INFO] Downloaded: https://repo.maven.apache.org/maven2/org/apache/maven/surefire/surefire-junit4/2.19.1/surefire-junit4-2.19.1.jar (74 KB at 932.3 KB/sec)

-------------------------------------------------------
 T E S T S
-------------------------------------------------------
Running DefaultPackageTest
Tests run: 2, Failures: 0, Errors: 0, Skipped: 0, Time elapsed: 1.096 sec - in DefaultPackageTest
Running DisableRecursiveScanningTest
Tests run: 2, Failures: 0, Errors: 0, Skipped: 0, Time elapsed: 0.186 sec - in DisableRecursiveScanningTest
Running io.github.lukehutch.fastclasspathscanner.test.ClassInfoTest
Tests run: 5, Failures: 0, Errors: 0, Skipped: 0, Time elapsed: 2.304 sec - in io.github.lukehutch.fastclasspathscanner.test.ClassInfoTest
Running io.github.lukehutch.fastclasspathscanner.test.fieldannotation.FieldAnnotationTest
Tests run: 3, Failures: 0, Errors: 0, Skipped: 0, Time elapsed: 0.207 sec - in io.github.lukehutch.fastclasspathscanner.test.fieldannotation.FieldAnnotationTest
Running io.github.lukehutch.fastclasspathscanner.test.methodannotation2.TestMethodMetaAnnotation
Tests run: 2, Failures: 0, Errors: 0, Skipped: 0, Time elapsed: 0.153 sec - in io.github.lukehutch.fastclasspathscanner.test.methodannotation2.TestMethodMetaAnnotation
Running io.github.lukehutch.fastclasspathscanner.test.methodinfo.MethodInfoTest
Tests run: 4, Failures: 0, Errors: 0, Skipped: 0, Time elapsed: 0.337 sec - in io.github.lukehutch.fastclasspathscanner.test.methodinfo.MethodInfoTest
Running io.github.lukehutch.fastclasspathscanner.test.fieldinfo.FieldInfoTest
Tests run: 3, Failures: 0, Errors: 0, Skipped: 0, Time elapsed: 0.186 sec - in io.github.lukehutch.fastclasspathscanner.test.fieldinfo.FieldInfoTest
Running io.github.lukehutch.fastclasspathscanner.test.FastClasspathScannerTest
Tests run: 22, Failures: 0, Errors: 0, Skipped: 0, Time elapsed: 3.075 sec - in io.github.lukehutch.fastclasspathscanner.test.FastClasspathScannerTest
Running io.github.lukehutch.fastclasspathscanner.test.methodannotation.MethodAnnotationTest
Tests run: 3, Failures: 0, Errors: 0, Skipped: 0, Time elapsed: 0.17 sec - in io.github.lukehutch.fastclasspathscanner.test.methodannotation.MethodAnnotationTest
Running io.github.lukehutch.fastclasspathscanner.test.internal.InternalExternalTest
Tests run: 3, Failures: 0, Errors: 0, Skipped: 0, Time elapsed: 0.181 sec - in io.github.lukehutch.fastclasspathscanner.test.internal.InternalExternalTest
Running io.github.lukehutch.fastclasspathscanner.issues.IssuesTest
Tests run: 9, Failures: 0, Errors: 0, Skipped: 0, Time elapsed: 1.958 sec - in io.github.lukehutch.fastclasspathscanner.issues.IssuesTest
Running io.github.lukehutch.fastclasspathscanner.issues.issue140.Issue140Test
Tests run: 1, Failures: 0, Errors: 0, Skipped: 0, Time elapsed: 0.251 sec - in io.github.lukehutch.fastclasspathscanner.issues.issue140.Issue140Test
Running io.github.lukehutch.fastclasspathscanner.issues.issue172.Issue172Test
Tests run: 1, Failures: 0, Errors: 0, Skipped: 0, Time elapsed: 0 sec - in io.github.lukehutch.fastclasspathscanner.issues.issue172.Issue172Test
Running io.github.lukehutch.fastclasspathscanner.issues.issue141.Issue141Test
Tests run: 1, Failures: 0, Errors: 0, Skipped: 0, Time elapsed: 1.141 sec - in io.github.lukehutch.fastclasspathscanner.issues.issue141.Issue141Test
Running io.github.lukehutch.fastclasspathscanner.issues.issue167.Issue167Test
Tests run: 2, Failures: 0, Errors: 0, Skipped: 0, Time elapsed: 0.194 sec - in io.github.lukehutch.fastclasspathscanner.issues.issue167.Issue167Test
Running io.github.lukehutch.fastclasspathscanner.issues.issue100.Issue100Test
Tests run: 1, Failures: 0, Errors: 0, Skipped: 0, Time elapsed: 0.102 sec - in io.github.lukehutch.fastclasspathscanner.issues.issue100.Issue100Test
Running io.github.lukehutch.fastclasspathscanner.issues.issue107.Issue107Test
Tests run: 1, Failures: 0, Errors: 0, Skipped: 0, Time elapsed: 0.114 sec - in io.github.lukehutch.fastclasspathscanner.issues.issue107.Issue107Test
Running io.github.lukehutch.fastclasspathscanner.issues.issue148.Issue148Test
Tests run: 1, Failures: 0, Errors: 0, Skipped: 0, Time elapsed: 0.07 sec - in io.github.lukehutch.fastclasspathscanner.issues.issue148.Issue148Test
Running io.github.lukehutch.fastclasspathscanner.issues.issue74.Issue74Test
Tests run: 1, Failures: 0, Errors: 0, Skipped: 0, Time elapsed: 0.068 sec - in io.github.lukehutch.fastclasspathscanner.issues.issue74.Issue74Test
Running io.github.lukehutch.fastclasspathscanner.issues.issue78.Issue78Test
Tests run: 1, Failures: 0, Errors: 0, Skipped: 0, Time elapsed: 0.065 sec - in io.github.lukehutch.fastclasspathscanner.issues.issue78.Issue78Test
Running io.github.lukehutch.fastclasspathscanner.issues.issue103.Issue103Test
Tests run: 3, Failures: 0, Errors: 0, Skipped: 0, Time elapsed: 0.361 sec - in io.github.lukehutch.fastclasspathscanner.issues.issue103.Issue103Test
Running io.github.lukehutch.fastclasspathscanner.issues.issue151.Issue151Test
Tests run: 1, Failures: 0, Errors: 0, Skipped: 0, Time elapsed: 0.127 sec - in io.github.lukehutch.fastclasspathscanner.issues.issue151.Issue151Test
Running io.github.lukehutch.fastclasspathscanner.issues.issue146.Issue146Test
Tests run: 1, Failures: 0, Errors: 0, Skipped: 0, Time elapsed: 0.07 sec - in io.github.lukehutch.fastclasspathscanner.issues.issue146.Issue146Test
Running io.github.lukehutch.fastclasspathscanner.issues.issue175.Issue175Test
Tests run: 3, Failures: 0, Errors: 1, Skipped: 0, Time elapsed: 0.092 sec <<< FAILURE! - in io.github.lukehutch.fastclasspathscanner.issues.issue175.Issue175Test
testMismatchedTypes(io.github.lukehutch.fastclasspathscanner.issues.issue175.Issue175Test)  Time elapsed: 0.041 sec  <<< ERROR!
java.lang.IllegalArgumentException: Result types could not be reconciled: java.lang.Object vs. W
	at io.github.lukehutch.fastclasspathscanner.issues.issue175.Issue175Test.testMismatchedTypes(Issue175Test.java:119)

Running io.github.lukehutch.fastclasspathscanner.issues.issue80.Issue80Test
Tests run: 1, Failures: 0, Errors: 0, Skipped: 0, Time elapsed: 0.257 sec - in io.github.lukehutch.fastclasspathscanner.issues.issue80.Issue80Test
Running io.github.lukehutch.fastclasspathscanner.issues.issue171.Issue171Test
Tests run: 1, Failures: 1, Errors: 0, Skipped: 0, Time elapsed: 0.174 sec <<< FAILURE! - in io.github.lukehutch.fastclasspathscanner.issues.issue171.Issue171Test
springBootFullyExecutableJar(io.github.lukehutch.fastclasspathscanner.issues.issue171.Issue171Test)  Time elapsed: 0.167 sec  <<< FAILURE!
java.lang.AssertionError: 

Expecting:
  <[]>
to contain only:
  <["hello/HelloController.class", "hello/Application.class"]>
but could not find the following elements:
  <["hello/HelloController.class", "hello/Application.class"]>

	at io.github.lukehutch.fastclasspathscanner.issues.issue171.Issue171Test.springBootFullyExecutableJar(Issue171Test.java:34)

Running io.github.lukehutch.fastclasspathscanner.issues.issue99.Issue99Test
Tests run: 1, Failures: 1, Errors: 0, Skipped: 0, Time elapsed: 0.052 sec <<< FAILURE! - in io.github.lukehutch.fastclasspathscanner.issues.issue99.Issue99Test
issue99Test(io.github.lukehutch.fastclasspathscanner.issues.issue99.Issue99Test)  Time elapsed: 0.041 sec  <<< FAILURE!
java.lang.AssertionError: 

Expecting:
  <[]>
to contain only:
  <["com.test.Test"]>
but could not find the following elements:
  <["com.test.Test"]>

	at io.github.lukehutch.fastclasspathscanner.issues.issue99.Issue99Test.issue99Test(Issue99Test.java:43)

Running io.github.lukehutch.fastclasspathscanner.issues.issue101.Issue101Test
Tests run: 3, Failures: 0, Errors: 0, Skipped: 0, Time elapsed: 0.421 sec - in io.github.lukehutch.fastclasspathscanner.issues.issue101.Issue101Test
Running io.github.lukehutch.fastclasspathscanner.issues.issue83.Issue83Test
Tests run: 2, Failures: 0, Errors: 0, Skipped: 0, Time elapsed: 1.051 sec - in io.github.lukehutch.fastclasspathscanner.issues.issue83.Issue83Test
Running io.github.lukehutch.fastclasspathscanner.issues.issue166.Issue166Test
Tests run: 3, Failures: 0, Errors: 0, Skipped: 0, Time elapsed: 0.038 sec - in io.github.lukehutch.fastclasspathscanner.issues.issue166.Issue166Test
Running io.github.lukehutch.fastclasspathscanner.issues.issue152.Issue152Test
Tests run: 1, Failures: 0, Errors: 0, Skipped: 0, Time elapsed: 0.07 sec - in io.github.lukehutch.fastclasspathscanner.issues.issue152.Issue152Test
Running io.github.lukehutch.fastclasspathscanner.issues.issue153.Issue153Test
Tests run: 1, Failures: 0, Errors: 0, Skipped: 0, Time elapsed: 0.064 sec - in io.github.lukehutch.fastclasspathscanner.issues.issue153.Issue153Test
Running io.github.lukehutch.fastclasspathscanner.issues.issue128.Issue128Test
Tests run: 1, Failures: 0, Errors: 1, Skipped: 0, Time elapsed: 2.156 sec <<< FAILURE! - in io.github.lukehutch.fastclasspathscanner.issues.issue128.Issue128Test
issue128Test(io.github.lukehutch.fastclasspathscanner.issues.issue128.Issue128Test)  Time elapsed: 2.156 sec  <<< ERROR!
java.lang.RuntimeException: Able to download remote jar, but could not find files within jar
	at io.github.lukehutch.fastclasspathscanner.issues.issue128.Issue128Test.issue128Test(Issue128Test.java:72)

Running io.github.lukehutch.fastclasspathscanner.issues.issue37.Issue37Test
Tests run: 1, Failures: 0, Errors: 0, Skipped: 0, Time elapsed: 0.057 sec - in io.github.lukehutch.fastclasspathscanner.issues.issue37.Issue37Test
Running io.github.lukehutch.fastclasspathscanner.issues.issue159.Issue159Test
Tests run: 1, Failures: 0, Errors: 0, Skipped: 0, Time elapsed: 0 sec - in io.github.lukehutch.fastclasspathscanner.issues.issue159.Issue159Test
Running io.github.lukehutch.fastclasspathscanner.issues.issue46.Issue46Test
Tests run: 1, Failures: 1, Errors: 0, Skipped: 0, Time elapsed: 0.013 sec <<< FAILURE! - in io.github.lukehutch.fastclasspathscanner.issues.issue46.Issue46Test
issue46Test(io.github.lukehutch.fastclasspathscanner.issues.issue46.Issue46Test)  Time elapsed: 0.013 sec  <<< FAILURE!
java.lang.AssertionError: 

Expecting:
  <[]>
to contain only:
  <["com.test.Test"]>
but could not find the following elements:
  <["com.test.Test"]>

	at io.github.lukehutch.fastclasspathscanner.issues.issue46.Issue46Test.issue46Test(Issue46Test.java:43)

Running com.xyz.MetaAnnotationTest
Tests run: 6, Failures: 0, Errors: 0, Skipped: 0, Time elapsed: 0.332 sec - in com.xyz.MetaAnnotationTest

Results :

Failed tests: 
  Issue171Test.springBootFullyExecutableJar:34 
Expecting:
  <[]>
to contain only:
  <["hello/HelloController.class", "hello/Application.class"]>
but could not find the following elements:
  <["hello/HelloController.class", "hello/Application.class"]>

  Issue46Test.issue46Test:43 
Expecting:
  <[]>
to contain only:
  <["com.test.Test"]>
but could not find the following elements:
  <["com.test.Test"]>

  Issue99Test.issue99Test:43 
Expecting:
  <[]>
to contain only:
  <["com.test.Test"]>
but could not find the following elements:
  <["com.test.Test"]>

Tests in error: 
  Issue128Test.issue128Test:72 Runtime Able to download remote jar, but could no...
  Issue175Test.testMismatchedTypes:119 » IllegalArgument Result types could not ...

Tests run: 99, Failures: 3, Errors: 2, Skipped: 0

[INFO] ------------------------------------------------------------------------
[INFO] BUILD FAILURE
[INFO] ------------------------------------------------------------------------
[INFO] Total time: 25.013 s
[INFO] Finished at: 2018-02-01T20:09:19+01:00
[INFO] Final Memory: 28M/596M
[INFO] ------------------------------------------------------------------------
[ERROR] Failed to execute goal org.apache.maven.plugins:maven-surefire-plugin:2.19.1:test (default-test) on project fast-classpath-scanner: There are test failures.
[ERROR] 
[ERROR] Please refer to /root/workspace/lukehutch/fast-classpath-scanner/336237814/target/surefire-reports for the individual test results.
[ERROR] -> [Help 1]
[ERROR] 
[ERROR] To see the full stack trace of the errors, re-run Maven with the -e switch.
[ERROR] Re-run Maven using the -X switch to enable full debug logging.
[ERROR] 
[ERROR] For more information about the errors and possible solutions, please read the following articles:
[ERROR] [Help 1] http://cwiki.apache.org/confluence/display/MAVEN/MojoFailureException
