[INFO] Scanning for projects...
[INFO] ------------------------------------------------------------------------
[INFO] Reactor Build Order:
[INFO] 
[INFO] net.oneandone:ejb-cdi-unit-parent
[INFO] net.oneandone:ejb-cdi-unit
[INFO] net.oneandone:ejb-cdi-unit5
[INFO] net.oneandone:ejb-cdi-unit-test-war
[INFO] net.oneandone:ejb-cdi-unit-tests
[INFO] net.oneandone:ejb-cdi-unit-tests5
[INFO] net.oneandone:ejb-cdi-unit-simulators
[INFO] net.oneandone:ejb-cdi-unit-camunda
[INFO] net.oneandone:ejb-cdi-unit arquillian tests
[INFO] net.oneandone:ejb-cdi-unit-examples
[INFO] example1 service with one entity
[INFO] service with one entity in Junit5 nested classes
[INFO] service syncconsumed
[INFO] service asyncconsumed with polling
[INFO] service asyncconsumed with callback
[INFO] service asyncconsumed with callback use jms
[INFO] service asyncconsumed with callback use jms
[INFO] service as simple rest
[INFO]                                                                         
[INFO] ------------------------------------------------------------------------
[INFO] Building net.oneandone:ejb-cdi-unit-parent 1.1.15.2-SNAPSHOT
[INFO] ------------------------------------------------------------------------
[INFO]                                                                         
[INFO] ------------------------------------------------------------------------
[INFO] Building net.oneandone:ejb-cdi-unit 1.1.15.2-SNAPSHOT
[INFO] ------------------------------------------------------------------------
[INFO] 
[INFO] --- maven-resources-plugin:2.6:resources (default-resources) @ ejb-cdi-unit ---
[INFO] Using 'UTF-8' encoding to copy filtered resources.
[INFO] Copying 1 resource
[INFO] 
[INFO] --- maven-compiler-plugin:3.7.0:compile (default-compile) @ ejb-cdi-unit ---
[INFO] Changes detected - recompiling the module!
[INFO] Compiling 110 source files to /root/workspace/1and1/ejb-cdi-unit/422541422/ejb-cdi-unit/target/classes
[INFO] /root/workspace/1and1/ejb-cdi-unit/422541422/ejb-cdi-unit/src/main/java/com/oneandone/ejbcdiunit/resourcesimulators/EjbContextSimulation.java: Some input files use or override a deprecated API.
[INFO] /root/workspace/1and1/ejb-cdi-unit/422541422/ejb-cdi-unit/src/main/java/com/oneandone/ejbcdiunit/resourcesimulators/EjbContextSimulation.java: Recompile with -Xlint:deprecation for details.
[INFO] /root/workspace/1and1/ejb-cdi-unit/422541422/ejb-cdi-unit/src/main/java/com/oneandone/ejbcdiunit/CdiTestConfig.java: Some input files use unchecked or unsafe operations.
[INFO] /root/workspace/1and1/ejb-cdi-unit/422541422/ejb-cdi-unit/src/main/java/com/oneandone/ejbcdiunit/CdiTestConfig.java: Recompile with -Xlint:unchecked for details.
[INFO] 
[INFO] --- maven-resources-plugin:2.6:testResources (default-testResources) @ ejb-cdi-unit ---
[INFO] Using 'UTF-8' encoding to copy filtered resources.
[INFO] skip non existing resourceDirectory /root/workspace/1and1/ejb-cdi-unit/422541422/ejb-cdi-unit/src/test/resources
[INFO] 
[INFO] --- maven-compiler-plugin:3.7.0:testCompile (default-testCompile) @ ejb-cdi-unit ---
[INFO] Nothing to compile - all classes are up to date
[INFO] 
[INFO] --- maven-surefire-plugin:2.22.0:test (default-test) @ ejb-cdi-unit ---
[INFO] Downloading: https://repo.maven.apache.org/maven2/org/apache/maven/surefire/surefire-junit4/2.22.0/surefire-junit4-2.22.0.pom
[INFO] Downloaded: https://repo.maven.apache.org/maven2/org/apache/maven/surefire/surefire-junit4/2.22.0/surefire-junit4-2.22.0.pom (4 KB at 3.2 KB/sec)
[INFO] Downloading: https://repo.maven.apache.org/maven2/org/apache/maven/surefire/surefire-providers/2.22.0/surefire-providers-2.22.0.pom
[INFO] Downloaded: https://repo.maven.apache.org/maven2/org/apache/maven/surefire/surefire-providers/2.22.0/surefire-providers-2.22.0.pom (3 KB at 55.2 KB/sec)
[INFO] Downloading: https://repo.maven.apache.org/maven2/org/apache/maven/surefire/surefire-junit4/2.22.0/surefire-junit4-2.22.0.jar
[INFO] Downloaded: https://repo.maven.apache.org/maven2/org/apache/maven/surefire/surefire-junit4/2.22.0/surefire-junit4-2.22.0.jar (83 KB at 717.9 KB/sec)
[INFO] 
[INFO] -------------------------------------------------------
[INFO]  T E S T S
[INFO] -------------------------------------------------------
[INFO] Listening for transport dt_socket at address: 5005
[INFO] Running cdiunittests.TestCircularInject
[INFO] Tests run: 1, Failures: 0, Errors: 0, Skipped: 0, Time elapsed: 3.307 s - in cdiunittests.TestCircularInject
[INFO] testCircularDependency(cdiunittests.TestCircularInject)  Time elapsed: 0.001 s
[INFO] 
[INFO] Results:
[INFO] 
[INFO] Tests run: 1, Failures: 0, Errors: 0, Skipped: 0
[INFO] 
[INFO]                                                                         
[INFO] ------------------------------------------------------------------------
[INFO] Building net.oneandone:ejb-cdi-unit5 1.1.15.2-SNAPSHOT
[INFO] ------------------------------------------------------------------------
[INFO] 
[INFO] --- maven-resources-plugin:2.6:resources (default-resources) @ ejb-cdi-unit5 ---
[INFO] Using 'UTF-8' encoding to copy filtered resources.
[INFO] skip non existing resourceDirectory /root/workspace/1and1/ejb-cdi-unit/422541422/ejb-cdi-unit5/src/main/resources
[INFO] 
[INFO] --- maven-compiler-plugin:3.7.0:compile (default-compile) @ ejb-cdi-unit5 ---
[INFO] Nothing to compile - all classes are up to date
[INFO] 
[INFO] --- maven-resources-plugin:2.6:testResources (default-testResources) @ ejb-cdi-unit5 ---
[INFO] Using 'UTF-8' encoding to copy filtered resources.
[INFO] skip non existing resourceDirectory /root/workspace/1and1/ejb-cdi-unit/422541422/ejb-cdi-unit5/src/test/resources
[INFO] 
[INFO] --- maven-compiler-plugin:3.7.0:testCompile (default-testCompile) @ ejb-cdi-unit5 ---
[INFO] Nothing to compile - all classes are up to date
[INFO] 
[INFO] --- maven-surefire-plugin:2.22.0:test (default-test) @ ejb-cdi-unit5 ---
[INFO] Downloading: https://repo.maven.apache.org/maven2/org/apache/maven/wagon/wagon-provider-api/1.0-beta-6/wagon-provider-api-1.0-beta-6.pom
[INFO] Downloaded: https://repo.maven.apache.org/maven2/org/apache/maven/wagon/wagon-provider-api/1.0-beta-6/wagon-provider-api-1.0-beta-6.pom (2 KB at 26.0 KB/sec)
[INFO] Downloading: https://repo.maven.apache.org/maven2/org/apache/maven/wagon/wagon/1.0-beta-6/wagon-1.0-beta-6.pom
[INFO] Downloaded: https://repo.maven.apache.org/maven2/org/apache/maven/wagon/wagon/1.0-beta-6/wagon-1.0-beta-6.pom (13 KB at 318.3 KB/sec)
[INFO] Downloading: https://repo.maven.apache.org/maven2/org/codehaus/plexus/plexus-utils/1.4.2/plexus-utils-1.4.2.pom
[INFO] Downloaded: https://repo.maven.apache.org/maven2/org/codehaus/plexus/plexus-utils/1.4.2/plexus-utils-1.4.2.pom (2 KB at 79.7 KB/sec)
[INFO] Downloading: https://repo.maven.apache.org/maven2/org/apache/maven/wagon/wagon-http/1.0-beta-6/wagon-http-1.0-beta-6.pom
[INFO] Downloaded: https://repo.maven.apache.org/maven2/org/apache/maven/wagon/wagon-http/1.0-beta-6/wagon-http-1.0-beta-6.pom (4 KB at 83.7 KB/sec)
[INFO] Downloading: https://repo.maven.apache.org/maven2/org/apache/maven/wagon/wagon-providers/1.0-beta-6/wagon-providers-1.0-beta-6.pom
[INFO] Downloaded: https://repo.maven.apache.org/maven2/org/apache/maven/wagon/wagon-providers/1.0-beta-6/wagon-providers-1.0-beta-6.pom (3 KB at 66.5 KB/sec)
[INFO] Downloading: https://repo.maven.apache.org/maven2/org/apache/maven/wagon/wagon-http-shared/1.0-beta-6/wagon-http-shared-1.0-beta-6.pom
[INFO] Downloaded: https://repo.maven.apache.org/maven2/org/apache/maven/wagon/wagon-http-shared/1.0-beta-6/wagon-http-shared-1.0-beta-6.pom (3 KB at 51.4 KB/sec)
[INFO] Downloading: https://repo.maven.apache.org/maven2/nekohtml/xercesMinimal/1.9.6.2/xercesMinimal-1.9.6.2.pom
[INFO] Downloaded: https://repo.maven.apache.org/maven2/nekohtml/xercesMinimal/1.9.6.2/xercesMinimal-1.9.6.2.pom (390 B at 13.6 KB/sec)
[INFO] Downloading: https://repo.maven.apache.org/maven2/nekohtml/nekohtml/1.9.6.2/nekohtml-1.9.6.2.pom
[INFO] Downloaded: https://repo.maven.apache.org/maven2/nekohtml/nekohtml/1.9.6.2/nekohtml-1.9.6.2.pom (704 B at 27.5 KB/sec)
[INFO] Downloading: https://repo.maven.apache.org/maven2/commons-httpclient/commons-httpclient/3.1/commons-httpclient-3.1.pom
[INFO] Downloaded: https://repo.maven.apache.org/maven2/commons-httpclient/commons-httpclient/3.1/commons-httpclient-3.1.pom (8 KB at 223.0 KB/sec)
[INFO] Downloading: https://repo.maven.apache.org/maven2/commons-codec/commons-codec/1.2/commons-codec-1.2.pom
[INFO] Downloaded: https://repo.maven.apache.org/maven2/commons-codec/commons-codec/1.2/commons-codec-1.2.pom (4 KB at 84.9 KB/sec)
[INFO] Downloading: https://repo.maven.apache.org/maven2/org/apache/maven/wagon/wagon-webdav-jackrabbit/1.0-beta-6/wagon-webdav-jackrabbit-1.0-beta-6.pom
[INFO] Downloaded: https://repo.maven.apache.org/maven2/org/apache/maven/wagon/wagon-webdav-jackrabbit/1.0-beta-6/wagon-webdav-jackrabbit-1.0-beta-6.pom (4 KB at 77.9 KB/sec)
[INFO] Downloading: https://repo.maven.apache.org/maven2/org/apache/jackrabbit/jackrabbit-webdav/1.5.0/jackrabbit-webdav-1.5.0.pom
[INFO] Downloaded: https://repo.maven.apache.org/maven2/org/apache/jackrabbit/jackrabbit-webdav/1.5.0/jackrabbit-webdav-1.5.0.pom (4 KB at 101.7 KB/sec)
[INFO] Downloading: https://repo.maven.apache.org/maven2/org/apache/jackrabbit/jackrabbit-parent/1.5.0/jackrabbit-parent-1.5.0.pom
[INFO] Downloaded: https://repo.maven.apache.org/maven2/org/apache/jackrabbit/jackrabbit-parent/1.5.0/jackrabbit-parent-1.5.0.pom (25 KB at 575.8 KB/sec)
[INFO] Downloading: https://repo.maven.apache.org/maven2/org/apache/jackrabbit/jackrabbit-jcr-commons/1.5.0/jackrabbit-jcr-commons-1.5.0.pom
[INFO] Downloaded: https://repo.maven.apache.org/maven2/org/apache/jackrabbit/jackrabbit-jcr-commons/1.5.0/jackrabbit-jcr-commons-1.5.0.pom (3 KB at 104.1 KB/sec)
[INFO] Downloading: https://repo.maven.apache.org/maven2/org/slf4j/slf4j-api/1.5.3/slf4j-api-1.5.3.pom
[INFO] Downloaded: https://repo.maven.apache.org/maven2/org/slf4j/slf4j-api/1.5.3/slf4j-api-1.5.3.pom (3 KB at 83.3 KB/sec)
[INFO] Downloading: https://repo.maven.apache.org/maven2/org/slf4j/slf4j-parent/1.5.3/slf4j-parent-1.5.3.pom
[INFO] Downloaded: https://repo.maven.apache.org/maven2/org/slf4j/slf4j-parent/1.5.3/slf4j-parent-1.5.3.pom (8 KB at 236.1 KB/sec)
[INFO] Downloading: https://repo.maven.apache.org/maven2/commons-httpclient/commons-httpclient/3.0/commons-httpclient-3.0.pom
[INFO] Downloaded: https://repo.maven.apache.org/maven2/commons-httpclient/commons-httpclient/3.0/commons-httpclient-3.0.pom (8 KB at 261.3 KB/sec)
[INFO] Downloading: https://repo.maven.apache.org/maven2/org/slf4j/slf4j-nop/1.5.3/slf4j-nop-1.5.3.pom
[INFO] Downloaded: https://repo.maven.apache.org/maven2/org/slf4j/slf4j-nop/1.5.3/slf4j-nop-1.5.3.pom (2 KB at 62.1 KB/sec)
[INFO] Downloading: https://repo.maven.apache.org/maven2/org/apache/maven/wagon/wagon-http-shared/1.0-beta-6/wagon-http-shared-1.0-beta-6.jar
[INFO] Downloading: https://repo.maven.apache.org/maven2/org/apache/maven/wagon/wagon-provider-api/1.0-beta-6/wagon-provider-api-1.0-beta-6.jar
[INFO] Downloading: https://repo.maven.apache.org/maven2/org/apache/maven/wagon/wagon-http/1.0-beta-6/wagon-http-1.0-beta-6.jar
[INFO] Downloading: https://repo.maven.apache.org/maven2/nekohtml/nekohtml/1.9.6.2/nekohtml-1.9.6.2.jar
[INFO] Downloading: https://repo.maven.apache.org/maven2/nekohtml/xercesMinimal/1.9.6.2/xercesMinimal-1.9.6.2.jar
[INFO] Downloaded: https://repo.maven.apache.org/maven2/org/apache/maven/wagon/wagon-http-shared/1.0-beta-6/wagon-http-shared-1.0-beta-6.jar (25 KB at 317.1 KB/sec)
[INFO] Downloading: https://repo.maven.apache.org/maven2/commons-httpclient/commons-httpclient/3.1/commons-httpclient-3.1.jar
[INFO] Downloaded: https://repo.maven.apache.org/maven2/org/apache/maven/wagon/wagon-provider-api/1.0-beta-6/wagon-provider-api-1.0-beta-6.jar (52 KB at 249.7 KB/sec)
[INFO] Downloading: https://repo.maven.apache.org/maven2/commons-codec/commons-codec/1.2/commons-codec-1.2.jar
[INFO] Downloaded: https://repo.maven.apache.org/maven2/nekohtml/nekohtml/1.9.6.2/nekohtml-1.9.6.2.jar (110 KB at 508.1 KB/sec)
[INFO] Downloaded: https://repo.maven.apache.org/maven2/commons-httpclient/commons-httpclient/3.1/commons-httpclient-3.1.jar (298 KB at 2026.2 KB/sec)
[INFO] Downloaded: https://repo.maven.apache.org/maven2/nekohtml/xercesMinimal/1.9.6.2/xercesMinimal-1.9.6.2.jar (39 KB at 172.7 KB/sec)
[INFO] Downloading: https://repo.maven.apache.org/maven2/org/apache/maven/wagon/wagon-webdav-jackrabbit/1.0-beta-6/wagon-webdav-jackrabbit-1.0-beta-6.jar
[INFO] Downloaded: https://repo.maven.apache.org/maven2/org/apache/maven/wagon/wagon-http/1.0-beta-6/wagon-http-1.0-beta-6.jar (11 KB at 39.8 KB/sec)
[INFO] Downloading: https://repo.maven.apache.org/maven2/org/apache/jackrabbit/jackrabbit-webdav/1.5.0/jackrabbit-webdav-1.5.0.jar
[INFO] Downloading: https://repo.maven.apache.org/maven2/org/apache/jackrabbit/jackrabbit-jcr-commons/1.5.0/jackrabbit-jcr-commons-1.5.0.jar
[INFO] Downloading: https://repo.maven.apache.org/maven2/org/slf4j/slf4j-nop/1.5.3/slf4j-nop-1.5.3.jar
[INFO] Downloaded: https://repo.maven.apache.org/maven2/commons-codec/commons-codec/1.2/commons-codec-1.2.jar (30 KB at 402.5 KB/sec)
[INFO] Downloading: https://repo.maven.apache.org/maven2/org/apache/maven/reporting/maven-reporting-api/2.2.1/maven-reporting-api-2.2.1.jar
[INFO] Downloaded: https://repo.maven.apache.org/maven2/org/apache/maven/wagon/wagon-webdav-jackrabbit/1.0-beta-6/wagon-webdav-jackrabbit-1.0-beta-6.jar (18 KB at 350.2 KB/sec)
[INFO] Downloading: https://repo.maven.apache.org/maven2/org/apache/maven/doxia/doxia-logging-api/1.1/doxia-logging-api-1.1.jar
[INFO] Downloaded: https://repo.maven.apache.org/maven2/org/slf4j/slf4j-nop/1.5.3/slf4j-nop-1.5.3.jar (6 KB at 108.1 KB/sec)
[INFO] Downloaded: https://repo.maven.apache.org/maven2/org/apache/jackrabbit/jackrabbit-jcr-commons/1.5.0/jackrabbit-jcr-commons-1.5.0.jar (199 KB at 1609.8 KB/sec)
[INFO] Downloaded: https://repo.maven.apache.org/maven2/org/apache/maven/reporting/maven-reporting-api/2.2.1/maven-reporting-api-2.2.1.jar (10 KB at 99.6 KB/sec)
[INFO] Downloaded: https://repo.maven.apache.org/maven2/org/apache/maven/doxia/doxia-logging-api/1.1/doxia-logging-api-1.1.jar (12 KB at 135.0 KB/sec)
[INFO] Downloaded: https://repo.maven.apache.org/maven2/org/apache/jackrabbit/jackrabbit-webdav/1.5.0/jackrabbit-webdav-1.5.0.jar (296 KB at 1934.5 KB/sec)
[INFO] 
[INFO] -------------------------------------------------------
[INFO]  T E S T S
[INFO] -------------------------------------------------------
[INFO] Listening for transport dt_socket at address: 5005
[INFO] Running com.oneandone.ejbcdiunit5.junit5.FirstJunit5Test
[INFO] Tests run: 11, Failures: 0, Errors: 0, Skipped: 0, Time elapsed: 6.438 s - in com.oneandone.ejbcdiunit5.junit5.FirstJunit5Test
[INFO] myFirstRepeatedTest[1]  Time elapsed: 2.81 s
[INFO] myFirstRepeatedTest[2]  Time elapsed: 0.534 s
[INFO] myFirstRepeatedTest[3]  Time elapsed: 0.596 s
[INFO] myFirstRepeatedTest[4]  Time elapsed: 0.407 s
[INFO] myFirstRepeatedTest[5]  Time elapsed: 0.428 s
[INFO] myFirstRepeatedTestWithRepetitionInfo{RepetitionInfo, TestInfo}[1]  Time elapsed: 0.264 s
[INFO] myFirstRepeatedTestWithRepetitionInfo{RepetitionInfo, TestInfo}[2]  Time elapsed: 0.295 s
[INFO] myFirstRepeatedTestWithRepetitionInfo{RepetitionInfo, TestInfo}[3]  Time elapsed: 0.292 s
[INFO] myFirstRepeatedTestWithRepetitionInfo{RepetitionInfo, TestInfo}[4]  Time elapsed: 0.256 s
[INFO] myFirstRepeatedTestWithRepetitionInfo{RepetitionInfo, TestInfo}[5]  Time elapsed: 0.283 s
[INFO] myFirstTest  Time elapsed: 0.187 s
[INFO] 
[INFO] Results:
[INFO] 
[INFO] Tests run: 11, Failures: 0, Errors: 0, Skipped: 0
[INFO] 
[INFO]                                                                         
[INFO] ------------------------------------------------------------------------
[INFO] Building net.oneandone:ejb-cdi-unit-test-war 1.1.15.2-SNAPSHOT
[INFO] ------------------------------------------------------------------------
[INFO] 
[INFO] --- maven-resources-plugin:2.6:resources (default-resources) @ ejb-cdi-unit-test-war ---
[INFO] Using 'UTF-8' encoding to copy filtered resources.
[INFO] Copying 3 resources
[INFO] 
[INFO] --- maven-compiler-plugin:3.7.0:compile (default-compile) @ ejb-cdi-unit-test-war ---
[INFO] Nothing to compile - all classes are up to date
[INFO] 
[INFO] --- maven-resources-plugin:2.6:testResources (default-testResources) @ ejb-cdi-unit-test-war ---
[INFO] Using 'UTF-8' encoding to copy filtered resources.
[INFO] skip non existing resourceDirectory /root/workspace/1and1/ejb-cdi-unit/422541422/ejb-cdi-unit-test-war/src/test/resources
[INFO] 
[INFO] --- maven-compiler-plugin:3.7.0:testCompile (default-testCompile) @ ejb-cdi-unit-test-war ---
[INFO] No sources to compile
[INFO] 
[INFO] --- maven-surefire-plugin:2.22.0:test (default-test) @ ejb-cdi-unit-test-war ---
[INFO] No tests to run.
[INFO]                                                                         
[INFO] ------------------------------------------------------------------------
[INFO] Building net.oneandone:ejb-cdi-unit-tests 1.1.15.2-SNAPSHOT
[INFO] ------------------------------------------------------------------------
[INFO] 
[INFO] --- maven-resources-plugin:2.6:resources (default-resources) @ ejb-cdi-unit-tests ---
[INFO] Using 'UTF-8' encoding to copy filtered resources.
[INFO] skip non existing resourceDirectory /root/workspace/1and1/ejb-cdi-unit/422541422/ejb-cdi-unit-tests/src/main/resources
[INFO] 
[INFO] --- maven-compiler-plugin:3.7.0:compile (default-compile) @ ejb-cdi-unit-tests ---
[INFO] No sources to compile
[INFO] 
[INFO] --- maven-resources-plugin:2.6:testResources (default-testResources) @ ejb-cdi-unit-tests ---
[INFO] Using 'UTF-8' encoding to copy filtered resources.
[INFO] Copying 2 resources
[INFO] 
[INFO] --- maven-compiler-plugin:3.7.0:testCompile (default-testCompile) @ ejb-cdi-unit-tests ---
[INFO] Nothing to compile - all classes are up to date
[INFO] 
[INFO] --- maven-surefire-plugin:2.22.0:test (default-test) @ ejb-cdi-unit-tests ---
[INFO] 
[INFO] -------------------------------------------------------
[INFO]  T E S T S
[INFO] -------------------------------------------------------
[INFO] Listening for transport dt_socket at address: 5005
[INFO] Running com.oneandone.ejbcdiunit.asynchmdb.TestAsynch
[INFO] Tests run: 5, Failures: 0, Errors: 0, Skipped: 0, Time elapsed: 9.556 s - in com.oneandone.ejbcdiunit.asynchmdb.TestAsynch
[INFO] testTimer(com.oneandone.ejbcdiunit.asynchmdb.TestAsynch)  Time elapsed: 0.116 s
[INFO] testTimerSecondTest(com.oneandone.ejbcdiunit.asynchmdb.TestAsynch)  Time elapsed: 0.055 s
[INFO] testNotAsyncMethod(com.oneandone.ejbcdiunit.asynchmdb.TestAsynch)  Time elapsed: 0.039 s
[INFO] test(com.oneandone.ejbcdiunit.asynchmdb.TestAsynch)  Time elapsed: 0.01 s
[INFO] testTimerWithThread(com.oneandone.ejbcdiunit.asynchmdb.TestAsynch)  Time elapsed: 4.232 s
[INFO] Listening for transport dt_socket at address: 5005
[INFO] Running com.oneandone.ejbcdiunit.asynchmdb.TestTimerExclusion
[INFO] Tests run: 1, Failures: 0, Errors: 0, Skipped: 0, Time elapsed: 3.314 s - in com.oneandone.ejbcdiunit.asynchmdb.TestTimerExclusion
[INFO] testTimer(com.oneandone.ejbcdiunit.asynchmdb.TestTimerExclusion)  Time elapsed: 2.438 s
[INFO] Listening for transport dt_socket at address: 5005
[INFO] Running com.oneandone.ejbcdiunit.asynchmdb.TestCompletelyAsynch
[INFO] Tests run: 1, Failures: 0, Errors: 0, Skipped: 0, Time elapsed: 4.26 s - in com.oneandone.ejbcdiunit.asynchmdb.TestCompletelyAsynch
[INFO] test(com.oneandone.ejbcdiunit.asynchmdb.TestCompletelyAsynch)  Time elapsed: 0.048 s
[INFO] Listening for transport dt_socket at address: 5005
[INFO] Running com.oneandone.ejbcdiunit.asynchmdb.TestMdb
[INFO] Tests run: 2, Failures: 0, Errors: 0, Skipped: 0, Time elapsed: 60.18 s - in com.oneandone.ejbcdiunit.asynchmdb.TestMdb
[INFO] testTopic(com.oneandone.ejbcdiunit.asynchmdb.TestMdb)  Time elapsed: 51.811 s
[INFO] testQueues(com.oneandone.ejbcdiunit.asynchmdb.TestMdb)  Time elapsed: 4.064 s
[INFO] Listening for transport dt_socket at address: 5005
[INFO] Running com.oneandone.ejbcdiunit.persistencefactory.MySqlTest
[ERROR] Tests run: 2, Failures: 0, Errors: 1, Skipped: 0, Time elapsed: 28.645 s <<< FAILURE! - in com.oneandone.ejbcdiunit.persistencefactory.MySqlTest
[ERROR] test(com.oneandone.ejbcdiunit.persistencefactory.MySqlTest)  Time elapsed: 24.96 s  <<< ERROR!
org.jboss.weld.exceptions.WeldException: WELD-000049 Unable to invoke [method] @PostConstruct public com.oneandone.ejbcdiunit.helpers.MySqlStarter.create() on com.oneandone.ejbcdiunit.helpers.MySqlStarter@39266403
Caused by: java.lang.reflect.InvocationTargetException
Caused by: ch.vorburger.exec.ManagedProcessException: An error occurred while starting the database
Caused by: ch.vorburger.exec.ManagedProcessException: 
Asked to wait for "mysqld: ready for connections." from Program [/tmp/MariaDB4j/base/bin/mysqld, --no-defaults, --console, --skip-grant-tables, --max_allowed_packet=64M, --basedir=/tmp/MariaDB4j/base, --datadir=/tmp/MariaDB4j/data/3406, --port=3406, --socket=/tmp/MariaDB4j.3406.sock] (in working directory /tmp/MariaDB4j/base), but it already exited! (without that message in console), last 100 lines of console:
2018-08-30 15:39:36 140182073579392 [Note] /tmp/MariaDB4j/base/bin/mysqld (mysqld 10.1.13-MariaDB) starting as process 612 ...
2018-08-30 15:39:36 140182073579392 [ERROR] Fatal error: Please consult the Knowledge Base to find out how to run mysqld as root!

2018-08-30 15:39:36 140182073579392 [ERROR] Aborting


[ERROR] test2(com.oneandone.ejbcdiunit.persistencefactory.MySqlTest)  Time elapsed: 0.487 s
[INFO] Listening for transport dt_socket at address: 5005
[INFO] Running com.oneandone.ejbcdiunit.persistencefactory.TestPersistenceFactoryH2Test
[INFO] Tests run: 18, Failures: 0, Errors: 0, Skipped: 0, Time elapsed: 11.23 s - in com.oneandone.ejbcdiunit.persistencefactory.TestPersistenceFactoryH2Test
[INFO] doesFlushBeforeNativeQuery(com.oneandone.ejbcdiunit.persistencefactory.TestPersistenceFactoryH2Test)  Time elapsed: 2.775 s
[INFO] canQueryPersistedChangedEntityInTransaction(com.oneandone.ejbcdiunit.persistencefactory.TestPersistenceFactoryH2Test)  Time elapsed: 0.481 s
[INFO] doesFlushBeforeQuery(com.oneandone.ejbcdiunit.persistencefactory.TestPersistenceFactoryH2Test)  Time elapsed: 0.115 s
[INFO] checkForUpdate(com.oneandone.ejbcdiunit.persistencefactory.TestPersistenceFactoryH2Test)  Time elapsed: 0.122 s
[INFO] testTraRolledBack(com.oneandone.ejbcdiunit.persistencefactory.TestPersistenceFactoryH2Test)  Time elapsed: 0.098 s
[INFO] canInsertInEmbeddedTransaction(com.oneandone.ejbcdiunit.persistencefactory.TestPersistenceFactoryH2Test)  Time elapsed: 0.108 s
[INFO] checkForUpdateMultiThreaded(com.oneandone.ejbcdiunit.persistencefactory.TestPersistenceFactoryH2Test)  Time elapsed: 1.16 s
[INFO] canInsertInMandatoryTransactionByClosure(com.oneandone.ejbcdiunit.persistencefactory.TestPersistenceFactoryH2Test)  Time elapsed: 0.165 s
[INFO] canNotInsertInMandatoyTransaction(com.oneandone.ejbcdiunit.persistencefactory.TestPersistenceFactoryH2Test)  Time elapsed: 0.091 s
[INFO] requiresNewDoesInsertInOtherEm(com.oneandone.ejbcdiunit.persistencefactory.TestPersistenceFactoryH2Test)  Time elapsed: 0.087 s
[INFO] checkUserTransactionAndDataSource(com.oneandone.ejbcdiunit.persistencefactory.TestPersistenceFactoryH2Test)  Time elapsed: 0.102 s
[INFO] requiresNewDoesInsertInSameEm(com.oneandone.ejbcdiunit.persistencefactory.TestPersistenceFactoryH2Test)  Time elapsed: 0.207 s
[INFO] canQueryPersistedEntityInTransaction(com.oneandone.ejbcdiunit.persistencefactory.TestPersistenceFactoryH2Test)  Time elapsed: 0.087 s
[INFO] canInsertInTransaction(com.oneandone.ejbcdiunit.persistencefactory.TestPersistenceFactoryH2Test)  Time elapsed: 0.086 s
[INFO] canQueryCreatedEntityInEmbeddedTransaction(com.oneandone.ejbcdiunit.persistencefactory.TestPersistenceFactoryH2Test)  Time elapsed: 0.096 s
[INFO] canInsertInMandatoryTransaction(com.oneandone.ejbcdiunit.persistencefactory.TestPersistenceFactoryH2Test)  Time elapsed: 0.098 s
[INFO] doesCommitChangeEvenWhenAlreadyFlushed(com.oneandone.ejbcdiunit.persistencefactory.TestPersistenceFactoryH2Test)  Time elapsed: 0.09 s
[INFO] doesCommitChangeEvenWhenASecondTimeFlushed(com.oneandone.ejbcdiunit.persistencefactory.TestPersistenceFactoryH2Test)  Time elapsed: 0.087 s
[INFO] Listening for transport dt_socket at address: 5005
[INFO] Running com.oneandone.ejbcdiunit.persistencefactory.Jpa2PUTest
[INFO] Tests run: 3, Failures: 0, Errors: 0, Skipped: 0, Time elapsed: 8.659 s - in com.oneandone.ejbcdiunit.persistencefactory.Jpa2PUTest
[INFO] checkForUpdate(com.oneandone.ejbcdiunit.persistencefactory.Jpa2PUTest)  Time elapsed: 4.906 s
[INFO] canWorkIn2Transactions(com.oneandone.ejbcdiunit.persistencefactory.Jpa2PUTest)  Time elapsed: 0.39 s
[INFO] testEmsAreCorrectInjected(com.oneandone.ejbcdiunit.persistencefactory.Jpa2PUTest)  Time elapsed: 0.243 s
[INFO] Listening for transport dt_socket at address: 5005
[INFO] Running com.oneandone.ejbcdiunit.persistencefactory.PFH2Test
[INFO] Tests run: 18, Failures: 0, Errors: 0, Skipped: 0, Time elapsed: 14.996 s - in com.oneandone.ejbcdiunit.persistencefactory.PFH2Test
[INFO] doesFlushBeforeNativeQuery(com.oneandone.ejbcdiunit.persistencefactory.PFH2Test)  Time elapsed: 3.826 s
[INFO] canQueryPersistedChangedEntityInTransaction(com.oneandone.ejbcdiunit.persistencefactory.PFH2Test)  Time elapsed: 0.484 s
[INFO] doesFlushBeforeQuery(com.oneandone.ejbcdiunit.persistencefactory.PFH2Test)  Time elapsed: 0.336 s
[INFO] checkForUpdate(com.oneandone.ejbcdiunit.persistencefactory.PFH2Test)  Time elapsed: 0.187 s
[INFO] testTraRolledBack(com.oneandone.ejbcdiunit.persistencefactory.PFH2Test)  Time elapsed: 0.243 s
[INFO] canInsertInEmbeddedTransaction(com.oneandone.ejbcdiunit.persistencefactory.PFH2Test)  Time elapsed: 0.229 s
[INFO] checkForUpdateMultiThreaded(com.oneandone.ejbcdiunit.persistencefactory.PFH2Test)  Time elapsed: 1.263 s
[INFO] canInsertInMandatoryTransactionByClosure(com.oneandone.ejbcdiunit.persistencefactory.PFH2Test)  Time elapsed: 0.207 s
[INFO] canNotInsertInMandatoyTransaction(com.oneandone.ejbcdiunit.persistencefactory.PFH2Test)  Time elapsed: 0.128 s
[INFO] requiresNewDoesInsertInOtherEm(com.oneandone.ejbcdiunit.persistencefactory.PFH2Test)  Time elapsed: 0.202 s
[INFO] checkUserTransactionAndDataSource(com.oneandone.ejbcdiunit.persistencefactory.PFH2Test)  Time elapsed: 0.268 s
[INFO] requiresNewDoesInsertInSameEm(com.oneandone.ejbcdiunit.persistencefactory.PFH2Test)  Time elapsed: 0.07 s
[INFO] canQueryPersistedEntityInTransaction(com.oneandone.ejbcdiunit.persistencefactory.PFH2Test)  Time elapsed: 0.212 s
[INFO] canInsertInTransaction(com.oneandone.ejbcdiunit.persistencefactory.PFH2Test)  Time elapsed: 0.127 s
[INFO] canQueryCreatedEntityInEmbeddedTransaction(com.oneandone.ejbcdiunit.persistencefactory.PFH2Test)  Time elapsed: 0.094 s
[INFO] canInsertInMandatoryTransaction(com.oneandone.ejbcdiunit.persistencefactory.PFH2Test)  Time elapsed: 0.217 s
[INFO] doesCommitChangeEvenWhenAlreadyFlushed(com.oneandone.ejbcdiunit.persistencefactory.PFH2Test)  Time elapsed: 0.229 s
[INFO] doesCommitChangeEvenWhenASecondTimeFlushed(com.oneandone.ejbcdiunit.persistencefactory.PFH2Test)  Time elapsed: 0.068 s
[INFO] Listening for transport dt_socket at address: 5005
[INFO] Running com.oneandone.ejbcdiunit.persistencefactory.TestPersistenceFactoryAlternativeH2Test
[INFO] Tests run: 19, Failures: 0, Errors: 0, Skipped: 0, Time elapsed: 14.259 s - in com.oneandone.ejbcdiunit.persistencefactory.TestPersistenceFactoryAlternativeH2Test
[INFO] canExecuteStatementsUsingDataSource(com.oneandone.ejbcdiunit.persistencefactory.TestPersistenceFactoryAlternativeH2Test)  Time elapsed: 3.155 s
[INFO] doesFlushBeforeNativeQuery(com.oneandone.ejbcdiunit.persistencefactory.TestPersistenceFactoryAlternativeH2Test)  Time elapsed: 0.226 s
[INFO] canQueryPersistedChangedEntityInTransaction(com.oneandone.ejbcdiunit.persistencefactory.TestPersistenceFactoryAlternativeH2Test)  Time elapsed: 0.427 s
[INFO] doesFlushBeforeQuery(com.oneandone.ejbcdiunit.persistencefactory.TestPersistenceFactoryAlternativeH2Test)  Time elapsed: 0.116 s
[INFO] checkForUpdate(com.oneandone.ejbcdiunit.persistencefactory.TestPersistenceFactoryAlternativeH2Test)  Time elapsed: 0.127 s
[INFO] testTraRolledBack(com.oneandone.ejbcdiunit.persistencefactory.TestPersistenceFactoryAlternativeH2Test)  Time elapsed: 0.122 s
[INFO] canInsertInEmbeddedTransaction(com.oneandone.ejbcdiunit.persistencefactory.TestPersistenceFactoryAlternativeH2Test)  Time elapsed: 0.157 s
[INFO] checkForUpdateMultiThreaded(com.oneandone.ejbcdiunit.persistencefactory.TestPersistenceFactoryAlternativeH2Test)  Time elapsed: 1.134 s
[INFO] canInsertInMandatoryTransactionByClosure(com.oneandone.ejbcdiunit.persistencefactory.TestPersistenceFactoryAlternativeH2Test)  Time elapsed: 0.187 s
[INFO] canNotInsertInMandatoyTransaction(com.oneandone.ejbcdiunit.persistencefactory.TestPersistenceFactoryAlternativeH2Test)  Time elapsed: 0.112 s
[INFO] requiresNewDoesInsertInOtherEm(com.oneandone.ejbcdiunit.persistencefactory.TestPersistenceFactoryAlternativeH2Test)  Time elapsed: 0.134 s
[INFO] checkUserTransactionAndDataSource(com.oneandone.ejbcdiunit.persistencefactory.TestPersistenceFactoryAlternativeH2Test)  Time elapsed: 0.127 s
[INFO] requiresNewDoesInsertInSameEm(com.oneandone.ejbcdiunit.persistencefactory.TestPersistenceFactoryAlternativeH2Test)  Time elapsed: 0.229 s
[INFO] canQueryPersistedEntityInTransaction(com.oneandone.ejbcdiunit.persistencefactory.TestPersistenceFactoryAlternativeH2Test)  Time elapsed: 0.155 s
[INFO] canInsertInTransaction(com.oneandone.ejbcdiunit.persistencefactory.TestPersistenceFactoryAlternativeH2Test)  Time elapsed: 0.076 s
[INFO] canQueryCreatedEntityInEmbeddedTransaction(com.oneandone.ejbcdiunit.persistencefactory.TestPersistenceFactoryAlternativeH2Test)  Time elapsed: 0.102 s
[INFO] canInsertInMandatoryTransaction(com.oneandone.ejbcdiunit.persistencefactory.TestPersistenceFactoryAlternativeH2Test)  Time elapsed: 0.146 s
[INFO] doesCommitChangeEvenWhenAlreadyFlushed(com.oneandone.ejbcdiunit.persistencefactory.TestPersistenceFactoryAlternativeH2Test)  Time elapsed: 0.109 s
[INFO] doesCommitChangeEvenWhenASecondTimeFlushed(com.oneandone.ejbcdiunit.persistencefactory.TestPersistenceFactoryAlternativeH2Test)  Time elapsed: 0.153 s
[INFO] Listening for transport dt_socket at address: 5005
[INFO] Running com.oneandone.ejbcdiunit.persistencefactory.PFMySqlTest
[INFO] Tests run: 18, Failures: 0, Errors: 0, Skipped: 0, Time elapsed: 10.728 s - in com.oneandone.ejbcdiunit.persistencefactory.PFMySqlTest
[INFO] doesFlushBeforeNativeQuery(com.oneandone.ejbcdiunit.persistencefactory.PFMySqlTest)  Time elapsed: 2.813 s
[INFO] canQueryPersistedChangedEntityInTransaction(com.oneandone.ejbcdiunit.persistencefactory.PFMySqlTest)  Time elapsed: 0.257 s
[INFO] doesFlushBeforeQuery(com.oneandone.ejbcdiunit.persistencefactory.PFMySqlTest)  Time elapsed: 0.108 s
[INFO] checkForUpdate(com.oneandone.ejbcdiunit.persistencefactory.PFMySqlTest)  Time elapsed: 0.115 s
[INFO] testTraRolledBack(com.oneandone.ejbcdiunit.persistencefactory.PFMySqlTest)  Time elapsed: 0.09 s
[INFO] canInsertInEmbeddedTransaction(com.oneandone.ejbcdiunit.persistencefactory.PFMySqlTest)  Time elapsed: 0.086 s
[INFO] checkForUpdateMultiThreaded(com.oneandone.ejbcdiunit.persistencefactory.PFMySqlTest)  Time elapsed: 1.112 s
[INFO] canInsertInMandatoryTransactionByClosure(com.oneandone.ejbcdiunit.persistencefactory.PFMySqlTest)  Time elapsed: 0.181 s
[INFO] canNotInsertInMandatoyTransaction(com.oneandone.ejbcdiunit.persistencefactory.PFMySqlTest)  Time elapsed: 0.138 s
[INFO] requiresNewDoesInsertInOtherEm(com.oneandone.ejbcdiunit.persistencefactory.PFMySqlTest)  Time elapsed: 0.098 s
[INFO] checkUserTransactionAndDataSource(com.oneandone.ejbcdiunit.persistencefactory.PFMySqlTest)  Time elapsed: 0.097 s
[INFO] requiresNewDoesInsertInSameEm(com.oneandone.ejbcdiunit.persistencefactory.PFMySqlTest)  Time elapsed: 0.104 s
[INFO] canQueryPersistedEntityInTransaction(com.oneandone.ejbcdiunit.persistencefactory.PFMySqlTest)  Time elapsed: 0.078 s
[INFO] canInsertInTransaction(com.oneandone.ejbcdiunit.persistencefactory.PFMySqlTest)  Time elapsed: 0.075 s
[INFO] canQueryCreatedEntityInEmbeddedTransaction(com.oneandone.ejbcdiunit.persistencefactory.PFMySqlTest)  Time elapsed: 0.075 s
[INFO] canInsertInMandatoryTransaction(com.oneandone.ejbcdiunit.persistencefactory.PFMySqlTest)  Time elapsed: 0.083 s
[INFO] doesCommitChangeEvenWhenAlreadyFlushed(com.oneandone.ejbcdiunit.persistencefactory.PFMySqlTest)  Time elapsed: 0.077 s
[INFO] doesCommitChangeEvenWhenASecondTimeFlushed(com.oneandone.ejbcdiunit.persistencefactory.PFMySqlTest)  Time elapsed: 0.07 s
[INFO] Listening for transport dt_socket at address: 5005
[INFO] Running com.oneandone.ejbcdiunit.persistencefactory.TestProperty1
[INFO] Tests run: 19, Failures: 0, Errors: 0, Skipped: 0, Time elapsed: 13.393 s - in com.oneandone.ejbcdiunit.persistencefactory.TestProperty1
[INFO] doesFlushBeforeNativeQuery(com.oneandone.ejbcdiunit.persistencefactory.TestProperty1)  Time elapsed: 2.852 s
[INFO] test(com.oneandone.ejbcdiunit.persistencefactory.TestProperty1)  Time elapsed: 0.136 s
[INFO] checkUserTransactionAndDataSource(com.oneandone.ejbcdiunit.persistencefactory.TestProperty1)  Time elapsed: 0.3 s
[INFO] canQueryPersistedChangedEntityInTransaction(com.oneandone.ejbcdiunit.persistencefactory.TestProperty1)  Time elapsed: 0.114 s
[INFO] doesFlushBeforeQuery(com.oneandone.ejbcdiunit.persistencefactory.TestProperty1)  Time elapsed: 0.155 s
[INFO] checkForUpdate(com.oneandone.ejbcdiunit.persistencefactory.TestProperty1)  Time elapsed: 0.197 s
[INFO] testTraRolledBack(com.oneandone.ejbcdiunit.persistencefactory.TestProperty1)  Time elapsed: 0.334 s
[INFO] canInsertInEmbeddedTransaction(com.oneandone.ejbcdiunit.persistencefactory.TestProperty1)  Time elapsed: 0.101 s
[INFO] checkForUpdateMultiThreaded(com.oneandone.ejbcdiunit.persistencefactory.TestProperty1)  Time elapsed: 1.129 s
[INFO] canInsertInMandatoryTransactionByClosure(com.oneandone.ejbcdiunit.persistencefactory.TestProperty1)  Time elapsed: 0.207 s
[INFO] canNotInsertInMandatoyTransaction(com.oneandone.ejbcdiunit.persistencefactory.TestProperty1)  Time elapsed: 0.184 s
[INFO] requiresNewDoesInsertInOtherEm(com.oneandone.ejbcdiunit.persistencefactory.TestProperty1)  Time elapsed: 0.122 s
[INFO] requiresNewDoesInsertInSameEm(com.oneandone.ejbcdiunit.persistencefactory.TestProperty1)  Time elapsed: 0.43 s
[INFO] canQueryPersistedEntityInTransaction(com.oneandone.ejbcdiunit.persistencefactory.TestProperty1)  Time elapsed: 0.167 s
[INFO] canInsertInTransaction(com.oneandone.ejbcdiunit.persistencefactory.TestProperty1)  Time elapsed: 0.088 s
[INFO] canQueryCreatedEntityInEmbeddedTransaction(com.oneandone.ejbcdiunit.persistencefactory.TestProperty1)  Time elapsed: 0.1 s
[INFO] canInsertInMandatoryTransaction(com.oneandone.ejbcdiunit.persistencefactory.TestProperty1)  Time elapsed: 0.121 s
[INFO] doesCommitChangeEvenWhenAlreadyFlushed(com.oneandone.ejbcdiunit.persistencefactory.TestProperty1)  Time elapsed: 0.089 s
[INFO] doesCommitChangeEvenWhenASecondTimeFlushed(com.oneandone.ejbcdiunit.persistencefactory.TestProperty1)  Time elapsed: 0.089 s
[INFO] Listening for transport dt_socket at address: 5005
[INFO] Running com.oneandone.ejbcdiunit.excludedclasses.IndirectExcludeByRuleTest
[INFO] Tests run: 1, Failures: 0, Errors: 0, Skipped: 0, Time elapsed: 1.464 s - in com.oneandone.ejbcdiunit.excludedclasses.IndirectExcludeByRuleTest
[INFO] test(com.oneandone.ejbcdiunit.excludedclasses.IndirectExcludeByRuleTest)  Time elapsed: 0.443 s
[INFO] Listening for transport dt_socket at address: 5005
[INFO] Running com.oneandone.ejbcdiunit.excludedclasses.IndirectExcludeTest
[INFO] Tests run: 1, Failures: 0, Errors: 0, Skipped: 0, Time elapsed: 1.417 s - in com.oneandone.ejbcdiunit.excludedclasses.IndirectExcludeTest
[INFO] test(com.oneandone.ejbcdiunit.excludedclasses.IndirectExcludeTest)  Time elapsed: 0.003 s
[INFO] Listening for transport dt_socket at address: 5005
[INFO] Running com.oneandone.ejbcdiunit.excludedclasses.ExcludeNegativeByRuleTest
[INFO] Tests run: 1, Failures: 0, Errors: 0, Skipped: 0, Time elapsed: 2.927 s - in com.oneandone.ejbcdiunit.excludedclasses.ExcludeNegativeByRuleTest
[INFO] test(com.oneandone.ejbcdiunit.excludedclasses.ExcludeNegativeByRuleTest)  Time elapsed: 1.846 s
[INFO] Listening for transport dt_socket at address: 5005
[INFO] Running com.oneandone.ejbcdiunit.excludedclasses.SubExcludeTest
[INFO] Tests run: 1, Failures: 0, Errors: 0, Skipped: 0, Time elapsed: 3.03 s - in com.oneandone.ejbcdiunit.excludedclasses.SubExcludeTest
[INFO] test(com.oneandone.ejbcdiunit.excludedclasses.SubExcludeTest)  Time elapsed: 0.053 s
[INFO] Listening for transport dt_socket at address: 5005
[INFO] Running com.oneandone.ejbcdiunit.excludedclasses.ExcludeNegativeTest
[INFO] Tests run: 1, Failures: 0, Errors: 0, Skipped: 0, Time elapsed: 3.392 s - in com.oneandone.ejbcdiunit.excludedclasses.ExcludeNegativeTest
[INFO] test(com.oneandone.ejbcdiunit.excludedclasses.ExcludeNegativeTest)  Time elapsed: 0.044 s
[INFO] Listening for transport dt_socket at address: 5005
[INFO] Running com.oneandone.ejbcdiunit.excludedclasses.ExcludeByRuleTest
[INFO] Tests run: 1, Failures: 0, Errors: 0, Skipped: 0, Time elapsed: 2.917 s - in com.oneandone.ejbcdiunit.excludedclasses.ExcludeByRuleTest
[INFO] test(com.oneandone.ejbcdiunit.excludedclasses.ExcludeByRuleTest)  Time elapsed: 2.011 s
[INFO] Listening for transport dt_socket at address: 5005
[INFO] Running com.oneandone.ejbcdiunit.excludedclasses.ExcludeTest
[INFO] Tests run: 1, Failures: 0, Errors: 0, Skipped: 0, Time elapsed: 2.778 s - in com.oneandone.ejbcdiunit.excludedclasses.ExcludeTest
[INFO] test(com.oneandone.ejbcdiunit.excludedclasses.ExcludeTest)  Time elapsed: 0.029 s
[INFO] Listening for transport dt_socket at address: 5005
[INFO] Running com.oneandone.ejbcdiunit.ejb.TestEjb
[INFO] Tests run: 34, Failures: 0, Errors: 0, Skipped: 0, Time elapsed: 11.853 s - in com.oneandone.ejbcdiunit.ejb.TestEjb
[INFO] testBeanManagedTransactionsInTra(com.oneandone.ejbcdiunit.ejb.TestEjb)  Time elapsed: 3.953 s
[INFO] testBeanManagedTransactionsWOTra(com.oneandone.ejbcdiunit.ejb.TestEjb)  Time elapsed: 0.399 s
[INFO] testSessionContextInjection(com.oneandone.ejbcdiunit.ejb.TestEjb)  Time elapsed: 0.301 s
[INFO] canInterpretTransactionAttributeInParentClass(com.oneandone.ejbcdiunit.ejb.TestEjb)  Time elapsed: 0.272 s
[INFO] requiredMethodWorks(com.oneandone.ejbcdiunit.ejb.TestEjb)  Time elapsed: 0.441 s
[INFO] indirectSaveNewInRequired(com.oneandone.ejbcdiunit.ejb.TestEjb)  Time elapsed: 0.246 s
[INFO] indirectSaveNewInRequiredThrowException(com.oneandone.ejbcdiunit.ejb.TestEjb)  Time elapsed: 0.231 s
[INFO] requiresNewMethodWorks(com.oneandone.ejbcdiunit.ejb.TestEjb)  Time elapsed: 0.261 s
[INFO] indirectSaveRequiredInRequired(com.oneandone.ejbcdiunit.ejb.TestEjb)  Time elapsed: 0.212 s
[INFO] testBeanManagedTransactionsWOTraButOuter(com.oneandone.ejbcdiunit.ejb.TestEjb)  Time elapsed: 0.207 s
[INFO] indirectSaveRequiredPlusNewInNewTraButDirectCallAndThrow(com.oneandone.ejbcdiunit.ejb.TestEjb)  Time elapsed: 0.219 s
[INFO] indirectSaveRequiredInRequiredThrowException(com.oneandone.ejbcdiunit.ejb.TestEjb)  Time elapsed: 0.209 s
[INFO] indirectSaveRequiresNewLocalUsingSelfAndThrow(com.oneandone.ejbcdiunit.ejb.TestEjb)  Time elapsed: 0.237 s
[INFO] canInterpretTransactionAttributeInParentMethodRequired(com.oneandone.ejbcdiunit.ejb.TestEjb)  Time elapsed: 0.198 s
[INFO] testBeanManagedWOTraInTestCode(com.oneandone.ejbcdiunit.ejb.TestEjb)  Time elapsed: 0.212 s
[INFO] indirectSaveNewInNewTra(com.oneandone.ejbcdiunit.ejb.TestEjb)  Time elapsed: 0.376 s
[INFO] tryTestBeanManagedWOTraInTestCodeInSupported(com.oneandone.ejbcdiunit.ejb.TestEjb)  Time elapsed: 0.177 s
[INFO] testBeanManagedTransactionsInTraEncapsulatedPlusPreAndPostTras(com.oneandone.ejbcdiunit.ejb.TestEjb)  Time elapsed: 0.172 s
[INFO] indirectSaveRequiresNewLocalAsBusinessObjectAndThrow(com.oneandone.ejbcdiunit.ejb.TestEjb)  Time elapsed: 0.186 s
[INFO] defaultMethodWorks(com.oneandone.ejbcdiunit.ejb.TestEjb)  Time elapsed: 0.178 s
[INFO] indirectSaveRequiredInNewTra(com.oneandone.ejbcdiunit.ejb.TestEjb)  Time elapsed: 0.174 s
[INFO] saveToSetRollbackOnlyAndTryAdditionalSave(com.oneandone.ejbcdiunit.ejb.TestEjb)  Time elapsed: 0.168 s
[INFO] canInterpretTransactionAttributeInParentMethodNever(com.oneandone.ejbcdiunit.ejb.TestEjb)  Time elapsed: 0.183 s
[INFO] everythingNotNull(com.oneandone.ejbcdiunit.ejb.TestEjb)  Time elapsed: 0.169 s
[INFO] indirectSaveRequiredInNewTraThrow(com.oneandone.ejbcdiunit.ejb.TestEjb)  Time elapsed: 0.182 s
[INFO] testBeanManagedWOTraInTestCodeTryInNotSupported(com.oneandone.ejbcdiunit.ejb.TestEjb)  Time elapsed: 0.177 s
[INFO] indirectSaveRequiresNewLocalAsBusinessObject(com.oneandone.ejbcdiunit.ejb.TestEjb)  Time elapsed: 0.217 s
[INFO] indirectSaveRequiredPlusNewInNewTra(com.oneandone.ejbcdiunit.ejb.TestEjb)  Time elapsed: 0.161 s
[INFO] testSelfInjection(com.oneandone.ejbcdiunit.ejb.TestEjb)  Time elapsed: 0.15 s
[INFO] testCacheWOTransaction(com.oneandone.ejbcdiunit.ejb.TestEjb)  Time elapsed: 0.171 s
[INFO] testBeanManagedWithTraInTestCodeTryInNotSupported(com.oneandone.ejbcdiunit.ejb.TestEjb)  Time elapsed: 0.14 s
[INFO] testBeanManagedWithTraInTestCodeInSupported(com.oneandone.ejbcdiunit.ejb.TestEjb)  Time elapsed: 0.146 s
[INFO] testSelfInjectionByEjb(com.oneandone.ejbcdiunit.ejb.TestEjb)  Time elapsed: 0.156 s
[INFO] indirectSaveNewInNewTraThrow(com.oneandone.ejbcdiunit.ejb.TestEjb)  Time elapsed: 0.152 s
[INFO] Listening for transport dt_socket at address: 5005
[INFO] Running com.oneandone.ejbcdiunit.ejb.TestStringResourceInjection
[INFO] Tests run: 2, Failures: 0, Errors: 0, Skipped: 0, Time elapsed: 2.838 s - in com.oneandone.ejbcdiunit.ejb.TestStringResourceInjection
[INFO] canInjectFullSpecified(com.oneandone.ejbcdiunit.ejb.TestStringResourceInjection)  Time elapsed: 0.049 s
[INFO] canInjectPartlySpecified(com.oneandone.ejbcdiunit.ejb.TestStringResourceInjection)  Time elapsed: 0.008 s
[INFO] Listening for transport dt_socket at address: 5005
[INFO] Running com.oneandone.ejbcdiunit.ejb.TestEjbNotSupported
[INFO] Tests run: 10, Failures: 0, Errors: 0, Skipped: 0, Time elapsed: 8.26 s - in com.oneandone.ejbcdiunit.ejb.TestEjbNotSupported
[INFO] testRequiredTraPlusIOException(com.oneandone.ejbcdiunit.ejb.TestEjbNotSupported)  Time elapsed: 2.532 s
[INFO] testRequiredTraPlusRTException(com.oneandone.ejbcdiunit.ejb.TestEjbNotSupported)  Time elapsed: 0.144 s
[INFO] persistRequiresNewSetRollbackOnlyBySessionContext(com.oneandone.ejbcdiunit.ejb.TestEjbNotSupported)  Time elapsed: 0.275 s
[INFO] persistRequiresNewGetRollbackOnlyBySessionContext(com.oneandone.ejbcdiunit.ejb.TestEjbNotSupported)  Time elapsed: 0.104 s
[INFO] testRequiredIndirectTraPlusIOException(com.oneandone.ejbcdiunit.ejb.TestEjbNotSupported)  Time elapsed: 0.114 s
[INFO] testRequiredIndirectTraPlusRTException(com.oneandone.ejbcdiunit.ejb.TestEjbNotSupported)  Time elapsed: 0.085 s
[INFO] testRequiresNewTraPlusIOException(com.oneandone.ejbcdiunit.ejb.TestEjbNotSupported)  Time elapsed: 0.084 s
[INFO] testRequiresNewTraPlusRTException(com.oneandone.ejbcdiunit.ejb.TestEjbNotSupported)  Time elapsed: 0.08 s
[INFO] testRequiredIndirectTraPlusIOExceptionIndirect(com.oneandone.ejbcdiunit.ejb.TestEjbNotSupported)  Time elapsed: 0.085 s
[INFO] testRequiredIndirectTraPlusRTExceptionIndirect(com.oneandone.ejbcdiunit.ejb.TestEjbNotSupported)  Time elapsed: 0.086 s
[INFO] Listening for transport dt_socket at address: 5005
[INFO] Running com.oneandone.ejbcdiunit.ejb.TestEjbSpecialContext
[INFO] Tests run: 1, Failures: 0, Errors: 0, Skipped: 0, Time elapsed: 3.035 s - in com.oneandone.ejbcdiunit.ejb.TestEjbSpecialContext
[INFO] checkContextAlternative(com.oneandone.ejbcdiunit.ejb.TestEjbSpecialContext)  Time elapsed: 0.196 s
[INFO] Listening for transport dt_socket at address: 5005
[INFO] Running com.oneandone.ejbcdiunit.ejb.AppExceptionTest
[INFO] Tests run: 12, Failures: 0, Errors: 0, Skipped: 0, Time elapsed: 8.607 s - in com.oneandone.ejbcdiunit.ejb.AppExceptionTest
[INFO] testAppExcInNotSupported(com.oneandone.ejbcdiunit.ejb.AppExceptionTest)  Time elapsed: 2.457 s
[INFO] testAppRTExcInRequiresNew(com.oneandone.ejbcdiunit.ejb.AppExceptionTest)  Time elapsed: 0.139 s
[INFO] testAppRTExcInRequired(com.oneandone.ejbcdiunit.ejb.AppExceptionTest)  Time elapsed: 0.132 s
[INFO] testAppExcInCurrentTra(com.oneandone.ejbcdiunit.ejb.AppExceptionTest)  Time elapsed: 0.187 s
[INFO] testAppExcInSupports(com.oneandone.ejbcdiunit.ejb.AppExceptionTest)  Time elapsed: 0.159 s
[INFO] testAppExcInRequiresNew(com.oneandone.ejbcdiunit.ejb.AppExceptionTest)  Time elapsed: 0.123 s
[INFO] testAppRTExcInCurrentTra(com.oneandone.ejbcdiunit.ejb.AppExceptionTest)  Time elapsed: 0.136 s
[INFO] testDeclaredAppExcInCurrentTra(com.oneandone.ejbcdiunit.ejb.AppExceptionTest)  Time elapsed: 0.131 s
[INFO] testDeclaredAppRtExcInCurrentTra(com.oneandone.ejbcdiunit.ejb.AppExceptionTest)  Time elapsed: 0.314 s
[INFO] testAppExcInRequired(com.oneandone.ejbcdiunit.ejb.AppExceptionTest)  Time elapsed: 0.114 s
[INFO] testAppRTExcInNotSupported(com.oneandone.ejbcdiunit.ejb.AppExceptionTest)  Time elapsed: 0.106 s
[INFO] testAppRTExcInSupports(com.oneandone.ejbcdiunit.ejb.AppExceptionTest)  Time elapsed: 0.11 s
[INFO] Listening for transport dt_socket at address: 5005
[INFO] Running com.oneandone.ejbcdiunit.ejb.NonEjbTransactionTest
[INFO] Tests run: 3, Failures: 0, Errors: 0, Skipped: 0, Time elapsed: 5.781 s - in com.oneandone.ejbcdiunit.ejb.NonEjbTransactionTest
[INFO] testRequired(com.oneandone.ejbcdiunit.ejb.NonEjbTransactionTest)  Time elapsed: 2.143 s
[INFO] testRequired2(com.oneandone.ejbcdiunit.ejb.NonEjbTransactionTest)  Time elapsed: 0.104 s
[INFO] testRequired3(com.oneandone.ejbcdiunit.ejb.NonEjbTransactionTest)  Time elapsed: 0.097 s
[INFO] Listening for transport dt_socket at address: 5005
[INFO] Running com.oneandone.ejbcdiunit.ejb.TestEjbInjection
[INFO] Tests run: 1, Failures: 0, Errors: 0, Skipped: 0, Time elapsed: 4.84 s - in com.oneandone.ejbcdiunit.ejb.TestEjbInjection
[INFO] testEjbName(com.oneandone.ejbcdiunit.ejb.TestEjbInjection)  Time elapsed: 2.057 s
[INFO] Listening for transport dt_socket at address: 5005
[INFO] Running com.oneandone.ejbcdiunit.mvcc.MvccTest
[ERROR] Tests run: 2, Failures: 0, Errors: 1, Skipped: 0, Time elapsed: 24.147 s <<< FAILURE! - in com.oneandone.ejbcdiunit.mvcc.MvccTest
[ERROR] testH2(com.oneandone.ejbcdiunit.mvcc.MvccTest)  Time elapsed: 0.556 s
[ERROR] testMariaDb(com.oneandone.ejbcdiunit.mvcc.MvccTest)  Time elapsed: 23.393 s  <<< ERROR!
ch.vorburger.exec.ManagedProcessException: An error occurred while starting the database
	at com.oneandone.ejbcdiunit.mvcc.MvccTest.createConnection(MvccTest.java:62)
	at com.oneandone.ejbcdiunit.mvcc.MvccTest.initDb(MvccTest.java:77)
	at com.oneandone.ejbcdiunit.mvcc.MvccTest.testMariaDb(MvccTest.java:133)
Caused by: ch.vorburger.exec.ManagedProcessException: 
Asked to wait for "mysqld: ready for connections." from Program [/tmp/MariaDB4j/base/bin/mysqld, --no-defaults, --console, --skip-grant-tables, --max_allowed_packet=64M, --basedir=/tmp/MariaDB4j/base, --datadir=/tmp/MariaDB4j/data/3406, --port=3406, --socket=/tmp/MariaDB4j.3406.sock] (in working directory /tmp/MariaDB4j/base), but it already exited! (without that message in console), last 100 lines of console:
2018-08-30 15:42:36 139839990073216 [Note] /tmp/MariaDB4j/base/bin/mysqld (mysqld 10.1.13-MariaDB) starting as process 1365 ...
2018-08-30 15:42:36 139839990073216 [ERROR] Fatal error: Please consult the Knowledge Base to find out how to run mysqld as root!

2018-08-30 15:42:36 139839990073216 [ERROR] Aborting

	at com.oneandone.ejbcdiunit.mvcc.MvccTest.createConnection(MvccTest.java:62)
	at com.oneandone.ejbcdiunit.mvcc.MvccTest.initDb(MvccTest.java:77)
	at com.oneandone.ejbcdiunit.mvcc.MvccTest.testMariaDb(MvccTest.java:133)

[INFO] Listening for transport dt_socket at address: 5005
[INFO] Running com.oneandone.ejbcdiunit.SimpleTest
[INFO] Tests run: 1, Failures: 0, Errors: 0, Skipped: 0, Time elapsed: 2.306 s - in com.oneandone.ejbcdiunit.SimpleTest
[INFO] test(com.oneandone.ejbcdiunit.SimpleTest)  Time elapsed: 1.537 s
[INFO] Listening for transport dt_socket at address: 5005
[INFO] Running cdiunit.TestAlternativeAnnotations
[INFO] Tests run: 1, Failures: 0, Errors: 0, Skipped: 0, Time elapsed: 2.919 s - in cdiunit.TestAlternativeAnnotations
[INFO] testAlternativeSelected(cdiunit.TestAlternativeAnnotations)  Time elapsed: 0.044 s
[INFO] Listening for transport dt_socket at address: 5005
[INFO] Running cdiunit.TestNonCDIClasses
[INFO] Tests run: 1, Failures: 0, Errors: 0, Skipped: 0, Time elapsed: 2.35 s - in cdiunit.TestNonCDIClasses
[INFO] testNonCDIClassDiscovery(cdiunit.TestNonCDIClasses)  Time elapsed: 0.001 s
[INFO] Listening for transport dt_socket at address: 5005
[INFO] Running cdiunit.TestViewScope
[INFO] Tests run: 3, Failures: 0, Errors: 0, Skipped: 0, Time elapsed: 3.907 s - in cdiunit.TestViewScope
[INFO] testSameBeanEachTime(cdiunit.TestViewScope)  Time elapsed: 0.032 s
[INFO] testTransitiveViewScoped1(cdiunit.TestViewScope)  Time elapsed: 0.005 s
[INFO] testTransitiveViewScoped2(cdiunit.TestViewScope)  Time elapsed: 0.011 s
[INFO] Listening for transport dt_socket at address: 5005
[INFO] Running cdiunit.TestProducerConfig
[INFO] Tests run: 4, Failures: 0, Errors: 0, Skipped: 0, Time elapsed: 4.408 s - in cdiunit.TestProducerConfig
[INFO] testA1(cdiunit.TestProducerConfig)  Time elapsed: 0.034 s
[INFO] testA2(cdiunit.TestProducerConfig)  Time elapsed: 0.005 s
[INFO] testArrayList(cdiunit.TestProducerConfig)  Time elapsed: 0.008 s
[INFO] testHashSet(cdiunit.TestProducerConfig)  Time elapsed: 0.006 s
[INFO] Listening for transport dt_socket at address: 5005
[INFO] Running cdiunit.ExtensionInheritanceTest
[INFO] Tests run: 1, Failures: 0, Errors: 0, Skipped: 0, Time elapsed: 2.785 s - in cdiunit.ExtensionInheritanceTest
[INFO] test(cdiunit.ExtensionInheritanceTest)  Time elapsed: 0.023 s
[INFO] Listening for transport dt_socket at address: 5005
[INFO] Running cdiunit.TestCircularInject
[INFO] Tests run: 1, Failures: 0, Errors: 0, Skipped: 0, Time elapsed: 2.853 s - in cdiunit.TestCircularInject
[INFO] testCircularDependency(cdiunit.TestCircularInject)  Time elapsed: 0 s
[INFO] Listening for transport dt_socket at address: 5005
[INFO] Running cdiunit.decoratortest.NoDecoratorTest
[INFO] Tests run: 1, Failures: 0, Errors: 0, Skipped: 0, Time elapsed: 3.063 s - in cdiunit.decoratortest.NoDecoratorTest
[INFO] testZero(cdiunit.decoratortest.NoDecoratorTest)  Time elapsed: 0.038 s
[INFO] Listening for transport dt_socket at address: 5005
[INFO] Running cdiunit.decoratortest.AddOneDecoratorTest
[INFO] Tests run: 1, Failures: 0, Errors: 0, Skipped: 0, Time elapsed: 2.891 s - in cdiunit.decoratortest.AddOneDecoratorTest
[INFO] testAddOne(cdiunit.decoratortest.AddOneDecoratorTest)  Time elapsed: 0.03 s
[INFO] Listening for transport dt_socket at address: 5005
[INFO] Running cdiunit.TestJaxRs
[INFO] Tests run: 1, Failures: 0, Errors: 0, Skipped: 0, Time elapsed: 3.047 s - in cdiunit.TestJaxRs
[INFO] testJaxRs(cdiunit.TestJaxRs)  Time elapsed: 0.535 s
[INFO] Listening for transport dt_socket at address: 5005
[INFO] Running cdiunit.TestCdiUnitRunner
[INFO] Tests run: 18, Failures: 0, Errors: 0, Skipped: 0, Time elapsed: 7.014 s - in cdiunit.TestCdiUnitRunner
[INFO] testRequestScope(cdiunit.TestCdiUnitRunner)  Time elapsed: 0.839 s
[INFO] testProducedViaMethod(cdiunit.TestCdiUnitRunner)  Time elapsed: 0.019 s
[INFO] testBeanManager(cdiunit.TestCdiUnitRunner)  Time elapsed: 0.028 s
[INFO] testConversationScope(cdiunit.TestCdiUnitRunner)  Time elapsed: 0.017 s
[INFO] testSuper(cdiunit.TestCdiUnitRunner)  Time elapsed: 0.008 s
[INFO] testContextControllerSessionScoped(cdiunit.TestCdiUnitRunner)  Time elapsed: 0.018 s
[INFO] testTestAlternative(cdiunit.TestCdiUnitRunner)  Time elapsed: 0.016 s
[INFO] testSessionScopeFail(cdiunit.TestCdiUnitRunner)  Time elapsed: 0.028 s
[INFO] testRequestScopeFail(cdiunit.TestCdiUnitRunner)  Time elapsed: 0.025 s
[INFO] testPostConstruct(cdiunit.TestCdiUnitRunner)  Time elapsed: 0.01 s
[INFO] testSessionScope(cdiunit.TestCdiUnitRunner)  Time elapsed: 0.015 s
[INFO] testContextControllerRequestScoped(cdiunit.TestCdiUnitRunner)  Time elapsed: 0.016 s
[INFO] testContextControllerSessionScopedWithRequest(cdiunit.TestCdiUnitRunner)  Time elapsed: 0.02 s
[INFO] testProducedViaField(cdiunit.TestCdiUnitRunner)  Time elapsed: 0.007 s
[INFO] testContextController(cdiunit.TestCdiUnitRunner)  Time elapsed: 0.053 s
[INFO] testConversationScopeFail(cdiunit.TestCdiUnitRunner)  Time elapsed: 0.013 s
[INFO] testContextControllerConversationScoped(cdiunit.TestCdiUnitRunner)  Time elapsed: 0.013 s
[INFO] testApplicationScoped(cdiunit.TestCdiUnitRunner)  Time elapsed: 0.037 s
[INFO] Listening for transport dt_socket at address: 5005
[INFO] Running cdiunit.TestAlternativeStereotype
[INFO] Tests run: 1, Failures: 0, Errors: 0, Skipped: 0, Time elapsed: 3.272 s - in cdiunit.TestAlternativeStereotype
[INFO] testAlternativeSelected(cdiunit.TestAlternativeStereotype)  Time elapsed: 0.045 s
[INFO] Listening for transport dt_socket at address: 5005
[INFO] Running cdiunit.TestAdditionalClasspaths
[INFO] Tests run: 1, Failures: 0, Errors: 0, Skipped: 0, Time elapsed: 2.896 s - in cdiunit.TestAdditionalClasspaths
[INFO] testResolvedExternal(cdiunit.TestAdditionalClasspaths)  Time elapsed: 0.056 s
[INFO] Listening for transport dt_socket at address: 5005
[INFO] Running cdiunit.TestContextController
[INFO] Tests run: 2, Failures: 0, Errors: 0, Skipped: 0, Time elapsed: 3.457 s - in cdiunit.TestContextController
[INFO] testSynchronousExecution(cdiunit.TestContextController)  Time elapsed: 0.128 s
[INFO] testAsynchronousExecution(cdiunit.TestContextController)  Time elapsed: 0.022 s
[INFO] Listening for transport dt_socket at address: 5005
[INFO] Running cdiunit.TestAdditionalPackages
[INFO] Tests run: 1, Failures: 0, Errors: 0, Skipped: 0, Time elapsed: 2.872 s - in cdiunit.TestAdditionalPackages
[INFO] testResolvedPackage(cdiunit.TestAdditionalPackages)  Time elapsed: 0.023 s
[INFO] Listening for transport dt_socket at address: 5005
[INFO] Running cdiunit.TestServletProducers
[INFO] Tests run: 1, Failures: 0, Errors: 0, Skipped: 0, Time elapsed: 3.049 s - in cdiunit.TestServletProducers
[INFO] testServletException(cdiunit.TestServletProducers)  Time elapsed: 0.235 s
[INFO] 
[INFO] Results:
[INFO] 
[ERROR] Errors: 
[ERROR]   MvccTest.testMariaDb:133->initDb:77->createConnection:62  ManagedProcess An e...
[ERROR]   MySqlTest.test  Weld WELD-000049 Unable to invoke [method] @PostConstruct pub...
[INFO] 
[ERROR] Tests run: 217, Failures: 0, Errors: 2, Skipped: 0
[INFO] 
[INFO] ------------------------------------------------------------------------
[INFO] Reactor Summary:
[INFO] 
[INFO] net.oneandone:ejb-cdi-unit-parent .................. SUCCESS [  0.003 s]
[INFO] net.oneandone:ejb-cdi-unit ......................... SUCCESS [ 19.528 s]
[INFO] net.oneandone:ejb-cdi-unit5 ........................ SUCCESS [ 14.252 s]
[INFO] net.oneandone:ejb-cdi-unit-test-war ................ SUCCESS [  0.110 s]
[INFO] net.oneandone:ejb-cdi-unit-tests ................... FAILURE [05:58 min]
[INFO] net.oneandone:ejb-cdi-unit-tests5 .................. SKIPPED
[INFO] net.oneandone:ejb-cdi-unit-simulators .............. SKIPPED
[INFO] net.oneandone:ejb-cdi-unit-camunda ................. SKIPPED
[INFO] net.oneandone:ejb-cdi-unit arquillian tests ........ SKIPPED
[INFO] net.oneandone:ejb-cdi-unit-examples ................ SKIPPED
[INFO] example1 service with one entity ................... SKIPPED
[INFO] service with one entity in Junit5 nested classes ... SKIPPED
[INFO] service syncconsumed ............................... SKIPPED
[INFO] service asyncconsumed with polling ................. SKIPPED
[INFO] service asyncconsumed with callback ................ SKIPPED
[INFO] service asyncconsumed with callback use jms ........ SKIPPED
[INFO] service asyncconsumed with callback use jms ........ SKIPPED
[INFO] service as simple rest ............................. SKIPPED
[INFO] ------------------------------------------------------------------------
[INFO] BUILD FAILURE
[INFO] ------------------------------------------------------------------------
[INFO] Total time: 06:32 min
[INFO] Finished at: 2018-08-30T17:43:44+02:00
[INFO] Final Memory: 36M/710M
[INFO] ------------------------------------------------------------------------
[ERROR] Failed to execute goal org.apache.maven.plugins:maven-surefire-plugin:2.22.0:test (default-test) on project ejb-cdi-unit-tests: There are test failures.
[ERROR] 
[ERROR] Please refer to /root/workspace/1and1/ejb-cdi-unit/422541422/ejb-cdi-unit-tests/target/surefire-reports for the individual test results.
[ERROR] Please refer to dump files (if any exist) [date]-jvmRun[N].dump, [date].dumpstream and [date]-jvmRun[N].dumpstream.
[ERROR] -> [Help 1]
[ERROR] 
[ERROR] To see the full stack trace of the errors, re-run Maven with the -e switch.
[ERROR] Re-run Maven using the -X switch to enable full debug logging.
[ERROR] 
[ERROR] For more information about the errors and possible solutions, please read the following articles:
[ERROR] [Help 1] http://cwiki.apache.org/confluence/display/MAVEN/MojoFailureException
[ERROR] 
[ERROR] After correcting the problems, you can resume the build with the command
[ERROR]   mvn <goals> -rf :ejb-cdi-unit-tests
