[INFO] Scanning for projects...
[INFO]                                                                         
[INFO] ------------------------------------------------------------------------
[INFO] Building gilded-rose 1.0.0-SNAPSHOT
[INFO] ------------------------------------------------------------------------
[INFO] 
[INFO] --- maven-resources-plugin:2.6:resources (default-resources) @ gilded-rose ---
[INFO] Using 'UTF-8' encoding to copy filtered resources.
[INFO] skip non existing resourceDirectory /root/workspace/Samoussam/gilded-rose/348886060/src/main/resources
[INFO] skip non existing resourceDirectory /root/workspace/Samoussam/gilded-rose/348886060/src/main/resources
[INFO] 
[INFO] --- maven-compiler-plugin:3.1:compile (default-compile) @ gilded-rose ---
[INFO] Nothing to compile - all classes are up to date
[INFO] 
[INFO] --- maven-resources-plugin:2.6:testResources (default-testResources) @ gilded-rose ---
[INFO] Using 'UTF-8' encoding to copy filtered resources.
[INFO] skip non existing resourceDirectory /root/workspace/Samoussam/gilded-rose/348886060/src/test/resources
[INFO] 
[INFO] --- maven-compiler-plugin:3.1:testCompile (default-testCompile) @ gilded-rose ---
[INFO] Nothing to compile - all classes are up to date
[INFO] 
[INFO] --- maven-surefire-plugin:2.18.1:test (default-test) @ gilded-rose ---
[INFO] Surefire report directory: /root/workspace/Samoussam/gilded-rose/348886060/target/surefire-reports
[INFO] Downloading: https://repo.maven.apache.org/maven2/org/apache/maven/surefire/surefire-junit4/2.18.1/surefire-junit4-2.18.1.pom
[INFO] Downloaded: https://repo.maven.apache.org/maven2/org/apache/maven/surefire/surefire-junit4/2.18.1/surefire-junit4-2.18.1.pom (3 KB at 6.5 KB/sec)
[INFO] Downloading: https://repo.maven.apache.org/maven2/org/apache/maven/surefire/surefire-providers/2.18.1/surefire-providers-2.18.1.pom
[INFO] Downloaded: https://repo.maven.apache.org/maven2/org/apache/maven/surefire/surefire-providers/2.18.1/surefire-providers-2.18.1.pom (3 KB at 130.8 KB/sec)
[INFO] Downloading: https://repo.maven.apache.org/maven2/org/apache/maven/surefire/surefire-junit4/2.18.1/surefire-junit4-2.18.1.jar
[INFO] Downloaded: https://repo.maven.apache.org/maven2/org/apache/maven/surefire/surefire-junit4/2.18.1/surefire-junit4-2.18.1.jar (67 KB at 1088.4 KB/sec)

-------------------------------------------------------
 T E S T S
-------------------------------------------------------
12:07:50.214 [main] DEBUG org.springframework.test.context.junit4.SpringJUnit4ClassRunner - SpringJUnit4ClassRunner constructor called with [class fr.esiea.ItemControllerTest]
12:07:50.220 [main] DEBUG org.springframework.test.context.BootstrapUtils - Instantiating CacheAwareContextLoaderDelegate from class [org.springframework.test.context.cache.DefaultCacheAwareContextLoaderDelegate]
12:07:50.229 [main] DEBUG org.springframework.test.context.BootstrapUtils - Instantiating BootstrapContext using constructor [public org.springframework.test.context.support.DefaultBootstrapContext(java.lang.Class,org.springframework.test.context.CacheAwareContextLoaderDelegate)]
12:07:50.252 [main] DEBUG org.springframework.test.context.BootstrapUtils - Instantiating TestContextBootstrapper for test class [fr.esiea.ItemControllerTest] from class [org.springframework.boot.test.context.SpringBootTestContextBootstrapper]
12:07:50.264 [main] INFO org.springframework.boot.test.context.SpringBootTestContextBootstrapper - Neither @ContextConfiguration nor @ContextHierarchy found for test class [fr.esiea.ItemControllerTest], using SpringBootContextLoader
12:07:50.268 [main] DEBUG org.springframework.test.context.support.AbstractContextLoader - Did not detect default resource location for test class [fr.esiea.ItemControllerTest]: class path resource [fr/esiea/ItemControllerTest-context.xml] does not exist
12:07:50.268 [main] DEBUG org.springframework.test.context.support.AbstractContextLoader - Did not detect default resource location for test class [fr.esiea.ItemControllerTest]: class path resource [fr/esiea/ItemControllerTestContext.groovy] does not exist
12:07:50.268 [main] INFO org.springframework.test.context.support.AbstractContextLoader - Could not detect default resource locations for test class [fr.esiea.ItemControllerTest]: no resource found for suffixes {-context.xml, Context.groovy}.
12:07:50.323 [main] DEBUG org.springframework.test.context.support.ActiveProfilesUtils - Could not find an 'annotation declaring class' for annotation type [org.springframework.test.context.ActiveProfiles] and class [fr.esiea.ItemControllerTest]
12:07:50.349 [main] DEBUG org.springframework.boot.test.context.SpringBootTestContextBootstrapper - @TestExecutionListeners is not present for class [fr.esiea.ItemControllerTest]: using defaults.
12:07:50.353 [main] INFO org.springframework.boot.test.context.SpringBootTestContextBootstrapper - Loaded default TestExecutionListener class names from location [META-INF/spring.factories]: [org.springframework.boot.test.mock.mockito.MockitoTestExecutionListener, org.springframework.boot.test.mock.mockito.ResetMocksTestExecutionListener, org.springframework.boot.test.autoconfigure.restdocs.RestDocsTestExecutionListener, org.springframework.boot.test.autoconfigure.web.client.MockRestServiceServerResetTestExecutionListener, org.springframework.boot.test.autoconfigure.web.servlet.MockMvcPrintOnlyOnFailureTestExecutionListener, org.springframework.boot.test.autoconfigure.web.servlet.WebDriverTestExecutionListener, org.springframework.test.context.web.ServletTestExecutionListener, org.springframework.test.context.support.DirtiesContextBeforeModesTestExecutionListener, org.springframework.test.context.support.DependencyInjectionTestExecutionListener, org.springframework.test.context.support.DirtiesContextTestExecutionListener, org.springframework.test.context.transaction.TransactionalTestExecutionListener, org.springframework.test.context.jdbc.SqlScriptsTestExecutionListener]
12:07:50.364 [main] DEBUG org.springframework.boot.test.context.SpringBootTestContextBootstrapper - Could not instantiate TestExecutionListener [org.springframework.test.context.transaction.TransactionalTestExecutionListener]. Specify custom listener classes or make the default listener classes (and their required dependencies) available. Offending class: [org/springframework/transaction/TransactionDefinition]
12:07:50.364 [main] DEBUG org.springframework.boot.test.context.SpringBootTestContextBootstrapper - Could not instantiate TestExecutionListener [org.springframework.test.context.jdbc.SqlScriptsTestExecutionListener]. Specify custom listener classes or make the default listener classes (and their required dependencies) available. Offending class: [org/springframework/transaction/interceptor/TransactionAttribute]
12:07:50.364 [main] INFO org.springframework.boot.test.context.SpringBootTestContextBootstrapper - Using TestExecutionListeners: [org.springframework.test.context.web.ServletTestExecutionListener@b3d7190, org.springframework.test.context.support.DirtiesContextBeforeModesTestExecutionListener@5fdba6f9, org.springframework.boot.test.autoconfigure.SpringBootDependencyInjectionTestExecutionListener@10d59286, org.springframework.test.context.support.DirtiesContextTestExecutionListener@fe18270, org.springframework.boot.test.mock.mockito.MockitoTestExecutionListener@6fb0d3ed, org.springframework.boot.test.mock.mockito.ResetMocksTestExecutionListener@6dde5c8c, org.springframework.boot.test.autoconfigure.restdocs.RestDocsTestExecutionListener@5123a213, org.springframework.boot.test.autoconfigure.web.client.MockRestServiceServerResetTestExecutionListener@52525845, org.springframework.boot.test.autoconfigure.web.servlet.MockMvcPrintOnlyOnFailureTestExecutionListener@3b94d659, org.springframework.boot.test.autoconfigure.web.servlet.WebDriverTestExecutionListener@24b1d79b]
12:07:50.371 [main] DEBUG org.springframework.test.annotation.ProfileValueUtils - Retrieved @ProfileValueSourceConfiguration [null] for test class [fr.esiea.ItemControllerTest]
12:07:50.371 [main] DEBUG org.springframework.test.annotation.ProfileValueUtils - Retrieved ProfileValueSource type [class org.springframework.test.annotation.SystemProfileValueSource] for class [fr.esiea.ItemControllerTest]
Running fr.esiea.ItemControllerTest
12:07:50.375 [main] DEBUG org.springframework.test.context.junit4.SpringJUnit4ClassRunner - SpringJUnit4ClassRunner constructor called with [class fr.esiea.ItemControllerTest]
12:07:50.375 [main] DEBUG org.springframework.test.context.BootstrapUtils - Instantiating CacheAwareContextLoaderDelegate from class [org.springframework.test.context.cache.DefaultCacheAwareContextLoaderDelegate]
12:07:50.375 [main] DEBUG org.springframework.test.context.BootstrapUtils - Instantiating BootstrapContext using constructor [public org.springframework.test.context.support.DefaultBootstrapContext(java.lang.Class,org.springframework.test.context.CacheAwareContextLoaderDelegate)]
12:07:50.376 [main] DEBUG org.springframework.test.context.BootstrapUtils - Instantiating TestContextBootstrapper for test class [fr.esiea.ItemControllerTest] from class [org.springframework.boot.test.context.SpringBootTestContextBootstrapper]
12:07:50.376 [main] INFO org.springframework.boot.test.context.SpringBootTestContextBootstrapper - Neither @ContextConfiguration nor @ContextHierarchy found for test class [fr.esiea.ItemControllerTest], using SpringBootContextLoader
12:07:50.377 [main] DEBUG org.springframework.test.context.support.AbstractContextLoader - Did not detect default resource location for test class [fr.esiea.ItemControllerTest]: class path resource [fr/esiea/ItemControllerTest-context.xml] does not exist
12:07:50.377 [main] DEBUG org.springframework.test.context.support.AbstractContextLoader - Did not detect default resource location for test class [fr.esiea.ItemControllerTest]: class path resource [fr/esiea/ItemControllerTestContext.groovy] does not exist
12:07:50.377 [main] INFO org.springframework.test.context.support.AbstractContextLoader - Could not detect default resource locations for test class [fr.esiea.ItemControllerTest]: no resource found for suffixes {-context.xml, Context.groovy}.
12:07:50.385 [main] DEBUG org.springframework.test.context.support.ActiveProfilesUtils - Could not find an 'annotation declaring class' for annotation type [org.springframework.test.context.ActiveProfiles] and class [fr.esiea.ItemControllerTest]
12:07:50.387 [main] DEBUG org.springframework.boot.test.context.SpringBootTestContextBootstrapper - @TestExecutionListeners is not present for class [fr.esiea.ItemControllerTest]: using defaults.
12:07:50.389 [main] INFO org.springframework.boot.test.context.SpringBootTestContextBootstrapper - Loaded default TestExecutionListener class names from location [META-INF/spring.factories]: [org.springframework.boot.test.mock.mockito.MockitoTestExecutionListener, org.springframework.boot.test.mock.mockito.ResetMocksTestExecutionListener, org.springframework.boot.test.autoconfigure.restdocs.RestDocsTestExecutionListener, org.springframework.boot.test.autoconfigure.web.client.MockRestServiceServerResetTestExecutionListener, org.springframework.boot.test.autoconfigure.web.servlet.MockMvcPrintOnlyOnFailureTestExecutionListener, org.springframework.boot.test.autoconfigure.web.servlet.WebDriverTestExecutionListener, org.springframework.test.context.web.ServletTestExecutionListener, org.springframework.test.context.support.DirtiesContextBeforeModesTestExecutionListener, org.springframework.test.context.support.DependencyInjectionTestExecutionListener, org.springframework.test.context.support.DirtiesContextTestExecutionListener, org.springframework.test.context.transaction.TransactionalTestExecutionListener, org.springframework.test.context.jdbc.SqlScriptsTestExecutionListener]
12:07:50.392 [main] DEBUG org.springframework.boot.test.context.SpringBootTestContextBootstrapper - Could not instantiate TestExecutionListener [org.springframework.test.context.transaction.TransactionalTestExecutionListener]. Specify custom listener classes or make the default listener classes (and their required dependencies) available. Offending class: [org/springframework/transaction/TransactionDefinition]
12:07:50.393 [main] DEBUG org.springframework.boot.test.context.SpringBootTestContextBootstrapper - Could not instantiate TestExecutionListener [org.springframework.test.context.jdbc.SqlScriptsTestExecutionListener]. Specify custom listener classes or make the default listener classes (and their required dependencies) available. Offending class: [org/springframework/transaction/interceptor/TransactionAttribute]
12:07:50.393 [main] INFO org.springframework.boot.test.context.SpringBootTestContextBootstrapper - Using TestExecutionListeners: [org.springframework.test.context.web.ServletTestExecutionListener@679b62af, org.springframework.test.context.support.DirtiesContextBeforeModesTestExecutionListener@5cdd8682, org.springframework.boot.test.autoconfigure.SpringBootDependencyInjectionTestExecutionListener@d6da883, org.springframework.test.context.support.DirtiesContextTestExecutionListener@45afc369, org.springframework.boot.test.mock.mockito.MockitoTestExecutionListener@799d4f69, org.springframework.boot.test.mock.mockito.ResetMocksTestExecutionListener@49c43f4e, org.springframework.boot.test.autoconfigure.restdocs.RestDocsTestExecutionListener@290dbf45, org.springframework.boot.test.autoconfigure.web.client.MockRestServiceServerResetTestExecutionListener@12028586, org.springframework.boot.test.autoconfigure.web.servlet.MockMvcPrintOnlyOnFailureTestExecutionListener@17776a8, org.springframework.boot.test.autoconfigure.web.servlet.WebDriverTestExecutionListener@69a10787]
12:07:50.394 [main] DEBUG org.springframework.test.annotation.ProfileValueUtils - Retrieved @ProfileValueSourceConfiguration [null] for test class [fr.esiea.ItemControllerTest]
12:07:50.394 [main] DEBUG org.springframework.test.annotation.ProfileValueUtils - Retrieved ProfileValueSource type [class org.springframework.test.annotation.SystemProfileValueSource] for class [fr.esiea.ItemControllerTest]
12:07:50.395 [main] DEBUG org.springframework.test.annotation.ProfileValueUtils - Retrieved @ProfileValueSourceConfiguration [null] for test class [fr.esiea.ItemControllerTest]
12:07:50.395 [main] DEBUG org.springframework.test.annotation.ProfileValueUtils - Retrieved ProfileValueSource type [class org.springframework.test.annotation.SystemProfileValueSource] for class [fr.esiea.ItemControllerTest]
12:07:50.400 [main] DEBUG org.springframework.test.context.support.AbstractDirtiesContextTestExecutionListener - Before test class: context [DefaultTestContext@31206beb testClass = ItemControllerTest, testInstance = [null], testMethod = [null], testException = [null], mergedContextConfiguration = [WebMergedContextConfiguration@3e77a1ed testClass = ItemControllerTest, locations = '{}', classes = '{class fr.esiea.web.GildedRoseApplication, class fr.esiea.web.GildedRoseApplication}', contextInitializerClasses = '[]', activeProfiles = '{}', propertySourceLocations = '{}', propertySourceProperties = '{org.springframework.boot.test.context.SpringBootTestContextBootstrapper=true}', contextCustomizers = set[[ImportsContextCustomizer@3ffcd140 key = [org.springframework.boot.test.autoconfigure.web.servlet.MockMvcAutoConfiguration, org.springframework.boot.test.autoconfigure.web.servlet.MockMvcSecurityAutoConfiguration, org.springframework.boot.test.autoconfigure.web.servlet.MockMvcWebClientAutoConfiguration, org.springframework.boot.test.autoconfigure.web.servlet.MockMvcWebDriverAutoConfiguration]], org.springframework.boot.test.context.SpringBootTestContextCustomizer@6895a785, org.springframework.boot.test.context.filter.ExcludeFilterContextCustomizer@1f7030a6, org.springframework.boot.test.json.DuplicateJsonObjectContextCustomizerFactory$DuplicateJsonObjectContextCustomizer@394e1a0f, org.springframework.boot.test.mock.mockito.MockitoContextCustomizer@0, org.springframework.boot.test.autoconfigure.properties.PropertyMappingContextCustomizer@e7e8512, org.springframework.boot.test.autoconfigure.web.servlet.WebDriverContextCustomizerFactory$Customizer@1563da5], resourceBasePath = 'src/main/webapp', contextLoader = 'org.springframework.boot.test.context.SpringBootContextLoader', parent = [null]]], class annotated with @DirtiesContext [false] with mode [null].
12:07:50.401 [main] DEBUG org.springframework.test.annotation.ProfileValueUtils - Retrieved @ProfileValueSourceConfiguration [null] for test class [fr.esiea.ItemControllerTest]
12:07:50.401 [main] DEBUG org.springframework.test.annotation.ProfileValueUtils - Retrieved ProfileValueSource type [class org.springframework.test.annotation.SystemProfileValueSource] for class [fr.esiea.ItemControllerTest]
12:07:50.456 [main] DEBUG org.springframework.core.env.StandardEnvironment - Adding PropertySource 'systemProperties' with lowest search precedence
12:07:50.457 [main] DEBUG org.springframework.core.env.StandardEnvironment - Adding PropertySource 'systemEnvironment' with lowest search precedence
12:07:50.458 [main] DEBUG org.springframework.core.env.StandardEnvironment - Initialized StandardEnvironment with PropertySources [MapPropertySource@1997963191 {name='systemProperties', properties={java.runtime.name=OpenJDK Runtime Environment, sun.boot.library.path=/usr/lib/jvm/java-8-openjdk-amd64/jre/lib/amd64, java.vm.version=25.121-b13, java.vm.vendor=Oracle Corporation, java.vendor.url=http://java.oracle.com/, path.separator=:, java.vm.name=OpenJDK 64-Bit Server VM, file.encoding.pkg=sun.io, findbugs.skip=true, sun.java.launcher=SUN_STANDARD, sun.os.patch.level=unknown, java.vm.specification.name=Java Virtual Machine Specification, user.dir=/root/workspace/Samoussam/gilded-rose/348886060, checkstyle.skip=true, java.runtime.version=1.8.0_121-8u121-b13-1~bpo8+1-b13, basedir=/root/workspace/Samoussam/gilded-rose/348886060, java.awt.graphicsenv=sun.awt.X11GraphicsEnvironment, java.endorsed.dirs=/usr/lib/jvm/java-8-openjdk-amd64/jre/lib/endorsed, os.arch=amd64, surefire.real.class.path=/root/workspace/Samoussam/gilded-rose/348886060/target/surefire/surefirebooter2652396723134578046.jar, gpg.skip=true, java.io.tmpdir=/tmp, line.separator=
, cobertura.skip=true, java.vm.specification.vendor=Oracle Corporation, os.name=Linux, sun.jnu.encoding=UTF-8, license.skip=true, java.library.path=/usr/java/packages/lib/amd64:/usr/lib/x86_64-linux-gnu/jni:/lib/x86_64-linux-gnu:/usr/lib/x86_64-linux-gnu:/usr/lib/jni:/lib:/usr/lib, surefire.test.class.path=/root/workspace/Samoussam/gilded-rose/348886060/target/test-classes:/root/workspace/Samoussam/gilded-rose/348886060/target/classes:/root/./workspace/Samoussam/gilded-rose/348886060/.m2/junit/junit/4.12/junit-4.12.jar:/root/./workspace/Samoussam/gilded-rose/348886060/.m2/org/hamcrest/hamcrest-core/1.3/hamcrest-core-1.3.jar:/root/./workspace/Samoussam/gilded-rose/348886060/.m2/org/assertj/assertj-core/3.9.0/assertj-core-3.9.0.jar:/root/./workspace/Samoussam/gilded-rose/348886060/.m2/org/springframework/boot/spring-boot-starter-web/1.5.10.RELEASE/spring-boot-starter-web-1.5.10.RELEASE.jar:/root/./workspace/Samoussam/gilded-rose/348886060/.m2/org/springframework/boot/spring-boot-starter/1.5.10.RELEASE/spring-boot-starter-1.5.10.RELEASE.jar:/root/./workspace/Samoussam/gilded-rose/348886060/.m2/org/springframework/boot/spring-boot/1.5.10.RELEASE/spring-boot-1.5.10.RELEASE.jar:/root/./workspace/Samoussam/gilded-rose/348886060/.m2/org/springframework/boot/spring-boot-autoconfigure/1.5.10.RELEASE/spring-boot-autoconfigure-1.5.10.RELEASE.jar:/root/./workspace/Samoussam/gilded-rose/348886060/.m2/org/springframework/boot/spring-boot-starter-logging/1.5.10.RELEASE/spring-boot-starter-logging-1.5.10.RELEASE.jar:/root/./workspace/Samoussam/gilded-rose/348886060/.m2/ch/qos/logback/logback-classic/1.1.11/logback-classic-1.1.11.jar:/root/./workspace/Samoussam/gilded-rose/348886060/.m2/ch/qos/logback/logback-core/1.1.11/logback-core-1.1.11.jar:/root/./workspace/Samoussam/gilded-rose/348886060/.m2/org/slf4j/jcl-over-slf4j/1.7.25/jcl-over-slf4j-1.7.25.jar:/root/./workspace/Samoussam/gilded-rose/348886060/.m2/org/slf4j/jul-to-slf4j/1.7.25/jul-to-slf4j-1.7.25.jar:/root/./workspace/Samoussam/gilded-rose/348886060/.m2/org/slf4j/log4j-over-slf4j/1.7.25/log4j-over-slf4j-1.7.25.jar:/root/./workspace/Samoussam/gilded-rose/348886060/.m2/org/yaml/snakeyaml/1.17/snakeyaml-1.17.jar:/root/./workspace/Samoussam/gilded-rose/348886060/.m2/org/springframework/boot/spring-boot-starter-tomcat/1.5.10.RELEASE/spring-boot-starter-tomcat-1.5.10.RELEASE.jar:/root/./workspace/Samoussam/gilded-rose/348886060/.m2/org/apache/tomcat/embed/tomcat-embed-core/8.5.27/tomcat-embed-core-8.5.27.jar:/root/./workspace/Samoussam/gilded-rose/348886060/.m2/org/apache/tomcat/tomcat-annotations-api/8.5.27/tomcat-annotations-api-8.5.27.jar:/root/./workspace/Samoussam/gilded-rose/348886060/.m2/org/apache/tomcat/embed/tomcat-embed-el/8.5.27/tomcat-embed-el-8.5.27.jar:/root/./workspace/Samoussam/gilded-rose/348886060/.m2/org/apache/tomcat/embed/tomcat-embed-websocket/8.5.27/tomcat-embed-websocket-8.5.27.jar:/root/./workspace/Samoussam/gilded-rose/348886060/.m2/org/hibernate/hibernate-validator/5.3.6.Final/hibernate-validator-5.3.6.Final.jar:/root/./workspace/Samoussam/gilded-rose/348886060/.m2/javax/validation/validation-api/1.1.0.Final/validation-api-1.1.0.Final.jar:/root/./workspace/Samoussam/gilded-rose/348886060/.m2/org/jboss/logging/jboss-logging/3.3.1.Final/jboss-logging-3.3.1.Final.jar:/root/./workspace/Samoussam/gilded-rose/348886060/.m2/com/fasterxml/classmate/1.3.4/classmate-1.3.4.jar:/root/./workspace/Samoussam/gilded-rose/348886060/.m2/org/springframework/spring-web/4.3.14.RELEASE/spring-web-4.3.14.RELEASE.jar:/root/./workspace/Samoussam/gilded-rose/348886060/.m2/org/springframework/spring-aop/4.3.14.RELEASE/spring-aop-4.3.14.RELEASE.jar:/root/./workspace/Samoussam/gilded-rose/348886060/.m2/org/springframework/spring-beans/4.3.14.RELEASE/spring-beans-4.3.14.RELEASE.jar:/root/./workspace/Samoussam/gilded-rose/348886060/.m2/org/springframework/spring-context/4.3.14.RELEASE/spring-context-4.3.14.RELEASE.jar:/root/./workspace/Samoussam/gilded-rose/348886060/.m2/org/springframework/spring-webmvc/4.3.14.RELEASE/spring-webmvc-4.3.14.RELEASE.jar:/root/./workspace/Samoussam/gilded-rose/348886060/.m2/org/springframework/spring-expression/4.3.14.RELEASE/spring-expression-4.3.14.RELEASE.jar:/root/./workspace/Samoussam/gilded-rose/348886060/.m2/com/fasterxml/jackson/core/jackson-databind/2.9.4/jackson-databind-2.9.4.jar:/root/./workspace/Samoussam/gilded-rose/348886060/.m2/com/fasterxml/jackson/core/jackson-core/2.8.10/jackson-core-2.8.10.jar:/root/./workspace/Samoussam/gilded-rose/348886060/.m2/com/fasterxml/jackson/core/jackson-annotations/2.9.4/jackson-annotations-2.9.4.jar:/root/./workspace/Samoussam/gilded-rose/348886060/.m2/org/springframework/boot/spring-boot-starter-test/1.5.10.RELEASE/spring-boot-starter-test-1.5.10.RELEASE.jar:/root/./workspace/Samoussam/gilded-rose/348886060/.m2/org/springframework/boot/spring-boot-test/1.5.10.RELEASE/spring-boot-test-1.5.10.RELEASE.jar:/root/./workspace/Samoussam/gilded-rose/348886060/.m2/org/springframework/boot/spring-boot-test-autoconfigure/1.5.10.RELEASE/spring-boot-test-autoconfigure-1.5.10.RELEASE.jar:/root/./workspace/Samoussam/gilded-rose/348886060/.m2/com/jayway/jsonpath/json-path/2.2.0/json-path-2.2.0.jar:/root/./workspace/Samoussam/gilded-rose/348886060/.m2/net/minidev/json-smart/2.2.1/json-smart-2.2.1.jar:/root/./workspace/Samoussam/gilded-rose/348886060/.m2/net/minidev/accessors-smart/1.1/accessors-smart-1.1.jar:/root/./workspace/Samoussam/gilded-rose/348886060/.m2/org/ow2/asm/asm/5.0.3/asm-5.0.3.jar:/root/./workspace/Samoussam/gilded-rose/348886060/.m2/org/slf4j/slf4j-api/1.7.25/slf4j-api-1.7.25.jar:/root/./workspace/Samoussam/gilded-rose/348886060/.m2/org/mockito/mockito-core/1.10.19/mockito-core-1.10.19.jar:/root/./workspace/Samoussam/gilded-rose/348886060/.m2/org/objenesis/objenesis/2.1/objenesis-2.1.jar:/root/./workspace/Samoussam/gilded-rose/348886060/.m2/org/hamcrest/hamcrest-library/1.3/hamcrest-library-1.3.jar:/root/./workspace/Samoussam/gilded-rose/348886060/.m2/org/skyscreamer/jsonassert/1.4.0/jsonassert-1.4.0.jar:/root/./workspace/Samoussam/gilded-rose/348886060/.m2/com/vaadin/external/google/android-json/0.0.20131108.vaadin1/android-json-0.0.20131108.vaadin1.jar:/root/./workspace/Samoussam/gilded-rose/348886060/.m2/org/springframework/spring-core/4.3.14.RELEASE/spring-core-4.3.14.RELEASE.jar:/root/./workspace/Samoussam/gilded-rose/348886060/.m2/org/springframework/spring-test/4.3.14.RELEASE/spring-test-4.3.14.RELEASE.jar:/root/./workspace/Samoussam/gilded-rose/348886060/.m2/com/google/guava/guava/20.0/guava-20.0.jar:/root/./workspace/Samoussam/gilded-rose/348886060/.m2/pl/pragmatists/JUnitParams/1.1.1/JUnitParams-1.1.1.jar:, java.specification.name=Java Platform API Specification, java.class.version=52.0, sun.management.compiler=HotSpot 64-Bit Tiered Compilers, maven.repo.local=/root/./workspace/Samoussam/gilded-rose/348886060/.m2, os.version=3.10.0-693.17.1.el7.x86_64, user.home=/root, user.timezone=Europe/Paris, java.awt.printerjob=sun.print.PSPrinterJob, file.encoding=UTF-8, java.specification.version=1.8, java.class.path=/root/workspace/Samoussam/gilded-rose/348886060/target/test-classes:/root/workspace/Samoussam/gilded-rose/348886060/target/classes:/root/./workspace/Samoussam/gilded-rose/348886060/.m2/junit/junit/4.12/junit-4.12.jar:/root/./workspace/Samoussam/gilded-rose/348886060/.m2/org/hamcrest/hamcrest-core/1.3/hamcrest-core-1.3.jar:/root/./workspace/Samoussam/gilded-rose/348886060/.m2/org/assertj/assertj-core/3.9.0/assertj-core-3.9.0.jar:/root/./workspace/Samoussam/gilded-rose/348886060/.m2/org/springframework/boot/spring-boot-starter-web/1.5.10.RELEASE/spring-boot-starter-web-1.5.10.RELEASE.jar:/root/./workspace/Samoussam/gilded-rose/348886060/.m2/org/springframework/boot/spring-boot-starter/1.5.10.RELEASE/spring-boot-starter-1.5.10.RELEASE.jar:/root/./workspace/Samoussam/gilded-rose/348886060/.m2/org/springframework/boot/spring-boot/1.5.10.RELEASE/spring-boot-1.5.10.RELEASE.jar:/root/./workspace/Samoussam/gilded-rose/348886060/.m2/org/springframework/boot/spring-boot-autoconfigure/1.5.10.RELEASE/spring-boot-autoconfigure-1.5.10.RELEASE.jar:/root/./workspace/Samoussam/gilded-rose/348886060/.m2/org/springframework/boot/spring-boot-starter-logging/1.5.10.RELEASE/spring-boot-starter-logging-1.5.10.RELEASE.jar:/root/./workspace/Samoussam/gilded-rose/348886060/.m2/ch/qos/logback/logback-classic/1.1.11/logback-classic-1.1.11.jar:/root/./workspace/Samoussam/gilded-rose/348886060/.m2/ch/qos/logback/logback-core/1.1.11/logback-core-1.1.11.jar:/root/./workspace/Samoussam/gilded-rose/348886060/.m2/org/slf4j/jcl-over-slf4j/1.7.25/jcl-over-slf4j-1.7.25.jar:/root/./workspace/Samoussam/gilded-rose/348886060/.m2/org/slf4j/jul-to-slf4j/1.7.25/jul-to-slf4j-1.7.25.jar:/root/./workspace/Samoussam/gilded-rose/348886060/.m2/org/slf4j/log4j-over-slf4j/1.7.25/log4j-over-slf4j-1.7.25.jar:/root/./workspace/Samoussam/gilded-rose/348886060/.m2/org/yaml/snakeyaml/1.17/snakeyaml-1.17.jar:/root/./workspace/Samoussam/gilded-rose/348886060/.m2/org/springframework/boot/spring-boot-starter-tomcat/1.5.10.RELEASE/spring-boot-starter-tomcat-1.5.10.RELEASE.jar:/root/./workspace/Samoussam/gilded-rose/348886060/.m2/org/apache/tomcat/embed/tomcat-embed-core/8.5.27/tomcat-embed-core-8.5.27.jar:/root/./workspace/Samoussam/gilded-rose/348886060/.m2/org/apache/tomcat/tomcat-annotations-api/8.5.27/tomcat-annotations-api-8.5.27.jar:/root/./workspace/Samoussam/gilded-rose/348886060/.m2/org/apache/tomcat/embed/tomcat-embed-el/8.5.27/tomcat-embed-el-8.5.27.jar:/root/./workspace/Samoussam/gilded-rose/348886060/.m2/org/apache/tomcat/embed/tomcat-embed-websocket/8.5.27/tomcat-embed-websocket-8.5.27.jar:/root/./workspace/Samoussam/gilded-rose/348886060/.m2/org/hibernate/hibernate-validator/5.3.6.Final/hibernate-validator-5.3.6.Final.jar:/root/./workspace/Samoussam/gilded-rose/348886060/.m2/javax/validation/validation-api/1.1.0.Final/validation-api-1.1.0.Final.jar:/root/./workspace/Samoussam/gilded-rose/348886060/.m2/org/jboss/logging/jboss-logging/3.3.1.Final/jboss-logging-3.3.1.Final.jar:/root/./workspace/Samoussam/gilded-rose/348886060/.m2/com/fasterxml/classmate/1.3.4/classmate-1.3.4.jar:/root/./workspace/Samoussam/gilded-rose/348886060/.m2/org/springframework/spring-web/4.3.14.RELEASE/spring-web-4.3.14.RELEASE.jar:/root/./workspace/Samoussam/gilded-rose/348886060/.m2/org/springframework/spring-aop/4.3.14.RELEASE/spring-aop-4.3.14.RELEASE.jar:/root/./workspace/Samoussam/gilded-rose/348886060/.m2/org/springframework/spring-beans/4.3.14.RELEASE/spring-beans-4.3.14.RELEASE.jar:/root/./workspace/Samoussam/gilded-rose/348886060/.m2/org/springframework/spring-context/4.3.14.RELEASE/spring-context-4.3.14.RELEASE.jar:/root/./workspace/Samoussam/gilded-rose/348886060/.m2/org/springframework/spring-webmvc/4.3.14.RELEASE/spring-webmvc-4.3.14.RELEASE.jar:/root/./workspace/Samoussam/gilded-rose/348886060/.m2/org/springframework/spring-expression/4.3.14.RELEASE/spring-expression-4.3.14.RELEASE.jar:/root/./workspace/Samoussam/gilded-rose/348886060/.m2/com/fasterxml/jackson/core/jackson-databind/2.9.4/jackson-databind-2.9.4.jar:/root/./workspace/Samoussam/gilded-rose/348886060/.m2/com/fasterxml/jackson/core/jackson-core/2.8.10/jackson-core-2.8.10.jar:/root/./workspace/Samoussam/gilded-rose/348886060/.m2/com/fasterxml/jackson/core/jackson-annotations/2.9.4/jackson-annotations-2.9.4.jar:/root/./workspace/Samoussam/gilded-rose/348886060/.m2/org/springframework/boot/spring-boot-starter-test/1.5.10.RELEASE/spring-boot-starter-test-1.5.10.RELEASE.jar:/root/./workspace/Samoussam/gilded-rose/348886060/.m2/org/springframework/boot/spring-boot-test/1.5.10.RELEASE/spring-boot-test-1.5.10.RELEASE.jar:/root/./workspace/Samoussam/gilded-rose/348886060/.m2/org/springframework/boot/spring-boot-test-autoconfigure/1.5.10.RELEASE/spring-boot-test-autoconfigure-1.5.10.RELEASE.jar:/root/./workspace/Samoussam/gilded-rose/348886060/.m2/com/jayway/jsonpath/json-path/2.2.0/json-path-2.2.0.jar:/root/./workspace/Samoussam/gilded-rose/348886060/.m2/net/minidev/json-smart/2.2.1/json-smart-2.2.1.jar:/root/./workspace/Samoussam/gilded-rose/348886060/.m2/net/minidev/accessors-smart/1.1/accessors-smart-1.1.jar:/root/./workspace/Samoussam/gilded-rose/348886060/.m2/org/ow2/asm/asm/5.0.3/asm-5.0.3.jar:/root/./workspace/Samoussam/gilded-rose/348886060/.m2/org/slf4j/slf4j-api/1.7.25/slf4j-api-1.7.25.jar:/root/./workspace/Samoussam/gilded-rose/348886060/.m2/org/mockito/mockito-core/1.10.19/mockito-core-1.10.19.jar:/root/./workspace/Samoussam/gilded-rose/348886060/.m2/org/objenesis/objenesis/2.1/objenesis-2.1.jar:/root/./workspace/Samoussam/gilded-rose/348886060/.m2/org/hamcrest/hamcrest-library/1.3/hamcrest-library-1.3.jar:/root/./workspace/Samoussam/gilded-rose/348886060/.m2/org/skyscreamer/jsonassert/1.4.0/jsonassert-1.4.0.jar:/root/./workspace/Samoussam/gilded-rose/348886060/.m2/com/vaadin/external/google/android-json/0.0.20131108.vaadin1/android-json-0.0.20131108.vaadin1.jar:/root/./workspace/Samoussam/gilded-rose/348886060/.m2/org/springframework/spring-core/4.3.14.RELEASE/spring-core-4.3.14.RELEASE.jar:/root/./workspace/Samoussam/gilded-rose/348886060/.m2/org/springframework/spring-test/4.3.14.RELEASE/spring-test-4.3.14.RELEASE.jar:/root/./workspace/Samoussam/gilded-rose/348886060/.m2/com/google/guava/guava/20.0/guava-20.0.jar:/root/./workspace/Samoussam/gilded-rose/348886060/.m2/pl/pragmatists/JUnitParams/1.1.1/JUnitParams-1.1.1.jar:, user.name=root, skipITs=true, java.vm.specification.version=1.8, sun.java.command=/root/workspace/Samoussam/gilded-rose/348886060/target/surefire/surefirebooter2652396723134578046.jar /root/workspace/Samoussam/gilded-rose/348886060/target/surefire/surefire7351065065832707543tmp /root/workspace/Samoussam/gilded-rose/348886060/target/surefire/surefire_080439155059498633tmp, java.home=/usr/lib/jvm/java-8-openjdk-amd64/jre, sun.arch.data.model=64, user.language=en, java.specification.vendor=Oracle Corporation, awt.toolkit=sun.awt.X11.XToolkit, java.vm.info=mixed mode, java.version=1.8.0_121, java.ext.dirs=/usr/lib/jvm/java-8-openjdk-amd64/jre/lib/ext:/usr/java/packages/lib/ext, sun.boot.class.path=/usr/lib/jvm/java-8-openjdk-amd64/jre/lib/resources.jar:/usr/lib/jvm/java-8-openjdk-amd64/jre/lib/rt.jar:/usr/lib/jvm/java-8-openjdk-amd64/jre/lib/sunrsasign.jar:/usr/lib/jvm/java-8-openjdk-amd64/jre/lib/jsse.jar:/usr/lib/jvm/java-8-openjdk-amd64/jre/lib/jce.jar:/usr/lib/jvm/java-8-openjdk-amd64/jre/lib/charsets.jar:/usr/lib/jvm/java-8-openjdk-amd64/jre/lib/jfr.jar:/usr/lib/jvm/java-8-openjdk-amd64/jre/classes, rat.skip=true, enforcer.skip=true, java.vendor=Oracle Corporation, localRepository=/root/./workspace/Samoussam/gilded-rose/348886060/.m2, file.separator=/, java.vendor.url.bug=http://bugreport.sun.com/bugreport/, sun.io.unicode.encoding=UnicodeLittle, sun.cpu.endian=little, sun.cpu.isalist=}}, SystemEnvironmentPropertySource@534906248 {name='systemEnvironment', properties={PATH=/usr/local/sbin:/usr/local/bin:/usr/sbin:/usr/bin:/sbin:/bin, JAVA_HOME=/usr/lib/jvm/java-8-openjdk-amd64, NOTIFY_TO=, CA_CERTIFICATES_JAVA_VERSION=20161107~bpo8+1, MONGODB_HOST=, BUILD_ID=, LANG=C.UTF-8, GITHUB_LOGIN=, MAVEN_HOME=/usr/share/maven, SMTP_SERVER=, MONGODB_NAME=, REPAIR_MODE=, PWD=/root/workspace/Samoussam/gilded-rose/348886060, GOOGLE_ACCESS_TOKEN=, JAVA_VERSION=8u121, GITHUB_OAUTH=, MAVEN_CMD_LINE_ARGS=/root/.m2 -B -D enforcer.skip=true -D skipITs=true -D cobertura.skip=true -D maven.repo.local=/root/./workspace/Samoussam/gilded-rose/348886060/.m2 -D rat.skip=true -D findbugs.skip=true -D gpg.skip=true -D checkstyle.skip=true -D license.skip=true test, _=/usr/bin/java, SPREADSHEET_ID=, OUTPUT=, MAVEN_TERMINATE_CMD=on, MAVEN_CONFIG=/root/.m2, MAVEN_PROJECTBASEDIR=/root/workspace/Samoussam/gilded-rose/348886060, OLDPWD=/root/workspace/Samoussam/gilded-rose/348886060, LOG_FILENAME=repairnator-pipeline_2018-03-04_1207_348886060, RUN_ID=, HOSTNAME=spirals-vortex.lille.inria.fr, JAVA_DEBIAN_VERSION=8u121-b13-1~bpo8+1, M2_HOME=/usr/share/maven, HOME=/root, SHLVL=1, PUSH_URL=}}]
12:07:50.460 [main] DEBUG org.springframework.core.env.MutablePropertySources - Adding PropertySource 'inline' with highest search precedence
12:07:50.465 [main] DEBUG org.springframework.test.context.support.TestPropertySourceUtils - Adding inlined properties to environment: {spring.jmx.enabled=false, org.springframework.boot.test.context.SpringBootTestContextBootstrapper=true, server.port=-1}
12:07:50.465 [main] DEBUG org.springframework.core.env.StandardEnvironment - Adding PropertySource 'Inlined Test Properties' with highest search precedence

  .   ____          _            __ _ _
 /\\ / ___'_ __ _ _(_)_ __  __ _ \ \ \ \
( ( )\___ | '_ | '_| | '_ \/ _` | \ \ \ \
 \\/  ___)| |_)| | | | | || (_| |  ) ) ) )
  '  |____| .__|_| |_|_| |_\__, | / / / /
 =========|_|==============|___/=/_/_/_/
 :: Spring Boot ::       (v1.5.10.RELEASE)

2018-03-04 12:07:50.705  INFO 311 --- [           main] fr.esiea.ItemControllerTest              : Starting ItemControllerTest on spirals-vortex.lille.inria.fr with PID 311 (started by root in /root/workspace/Samoussam/gilded-rose/348886060)
2018-03-04 12:07:50.706  INFO 311 --- [           main] fr.esiea.ItemControllerTest              : No active profile set, falling back to default profiles: default
2018-03-04 12:07:50.727  INFO 311 --- [           main] o.s.w.c.s.GenericWebApplicationContext   : Refreshing org.springframework.web.context.support.GenericWebApplicationContext@343570b7: startup date [Sun Mar 04 12:07:50 CET 2018]; root of context hierarchy
2018-03-04 12:07:51.683  INFO 311 --- [           main] o.s.b.t.m.w.SpringBootMockServletContext : Initializing Spring FrameworkServlet ''
2018-03-04 12:07:51.683  INFO 311 --- [           main] o.s.t.web.servlet.TestDispatcherServlet  : FrameworkServlet '': initialization started
2018-03-04 12:07:51.792  INFO 311 --- [           main] s.w.s.m.m.a.RequestMappingHandlerMapping : Mapped "{[/prices]}" onto public java.lang.String fr.esiea.controllers.ItemController.prices()
2018-03-04 12:07:51.793  INFO 311 --- [           main] s.w.s.m.m.a.RequestMappingHandlerMapping : Mapped "{[/buy]}" onto public java.lang.String fr.esiea.controllers.ItemController.buy(java.lang.Integer,java.lang.Integer)
2018-03-04 12:07:51.793  INFO 311 --- [           main] s.w.s.m.m.a.RequestMappingHandlerMapping : Mapped "{[/]}" onto public java.lang.String fr.esiea.controllers.ItemController.index()
2018-03-04 12:07:51.794  INFO 311 --- [           main] s.w.s.m.m.a.RequestMappingHandlerMapping : Mapped "{[/add]}" onto public int fr.esiea.controllers.ItemController.add(java.lang.String,java.lang.Integer,java.lang.Integer,java.lang.Integer,java.lang.Integer,java.lang.String,java.lang.String)
2018-03-04 12:07:51.798  INFO 311 --- [           main] s.w.s.m.m.a.RequestMappingHandlerMapping : Mapped "{[/error],produces=[text/html]}" onto public org.springframework.web.servlet.ModelAndView org.springframework.boot.autoconfigure.web.BasicErrorController.errorHtml(javax.servlet.http.HttpServletRequest,javax.servlet.http.HttpServletResponse)
2018-03-04 12:07:51.799  INFO 311 --- [           main] s.w.s.m.m.a.RequestMappingHandlerMapping : Mapped "{[/error]}" onto public org.springframework.http.ResponseEntity<java.util.Map<java.lang.String, java.lang.Object>> org.springframework.boot.autoconfigure.web.BasicErrorController.error(javax.servlet.http.HttpServletRequest)
2018-03-04 12:07:51.829  INFO 311 --- [           main] o.s.w.s.handler.SimpleUrlHandlerMapping  : Mapped URL path [/webjars/**] onto handler of type [class org.springframework.web.servlet.resource.ResourceHttpRequestHandler]
2018-03-04 12:07:51.829  INFO 311 --- [           main] o.s.w.s.handler.SimpleUrlHandlerMapping  : Mapped URL path [/**] onto handler of type [class org.springframework.web.servlet.resource.ResourceHttpRequestHandler]
2018-03-04 12:07:51.844  INFO 311 --- [           main] o.s.w.s.handler.SimpleUrlHandlerMapping  : Mapped URL path [/**/favicon.ico] onto handler of type [class org.springframework.web.servlet.resource.ResourceHttpRequestHandler]
2018-03-04 12:07:51.991  INFO 311 --- [           main] s.w.s.m.m.a.RequestMappingHandlerAdapter : Looking for @ControllerAdvice: org.springframework.web.context.support.GenericWebApplicationContext@343570b7: startup date [Sun Mar 04 12:07:50 CET 2018]; root of context hierarchy
2018-03-04 12:07:52.090  INFO 311 --- [           main] o.s.t.web.servlet.TestDispatcherServlet  : FrameworkServlet '': initialization completed in 407 ms
2018-03-04 12:07:52.222  INFO 311 --- [           main] fr.esiea.web.GildedRoseApplication       : Let's inspect the beans provided by Spring Boot:
2018-03-04 12:07:52.222  INFO 311 --- [           main] fr.esiea.web.GildedRoseApplication       : basicErrorController
2018-03-04 12:07:52.222  INFO 311 --- [           main] fr.esiea.web.GildedRoseApplication       : beanNameHandlerMapping
2018-03-04 12:07:52.222  INFO 311 --- [           main] fr.esiea.web.GildedRoseApplication       : beanNameViewResolver
2018-03-04 12:07:52.222  INFO 311 --- [           main] fr.esiea.web.GildedRoseApplication       : characterEncodingFilter
2018-03-04 12:07:52.222  INFO 311 --- [           main] fr.esiea.web.GildedRoseApplication       : commandLineRunner
2018-03-04 12:07:52.223  INFO 311 --- [           main] fr.esiea.web.GildedRoseApplication       : conventionErrorViewResolver
2018-03-04 12:07:52.223  INFO 311 --- [           main] fr.esiea.web.GildedRoseApplication       : defaultServletHandlerMapping
2018-03-04 12:07:52.223  INFO 311 --- [           main] fr.esiea.web.GildedRoseApplication       : defaultValidator
2018-03-04 12:07:52.223  INFO 311 --- [           main] fr.esiea.web.GildedRoseApplication       : defaultViewResolver
2018-03-04 12:07:52.223  INFO 311 --- [           main] fr.esiea.web.GildedRoseApplication       : dispatcherServlet
2018-03-04 12:07:52.223  INFO 311 --- [           main] fr.esiea.web.GildedRoseApplication       : dispatcherServletRegistration
2018-03-04 12:07:52.224  INFO 311 --- [           main] fr.esiea.web.GildedRoseApplication       : duplicateServerPropertiesDetector
2018-03-04 12:07:52.224  INFO 311 --- [           main] fr.esiea.web.GildedRoseApplication       : embeddedServletContainerCustomizerBeanPostProcessor
2018-03-04 12:07:52.224  INFO 311 --- [           main] fr.esiea.web.GildedRoseApplication       : error
2018-03-04 12:07:52.224  INFO 311 --- [           main] fr.esiea.web.GildedRoseApplication       : errorAttributes
2018-03-04 12:07:52.224  INFO 311 --- [           main] fr.esiea.web.GildedRoseApplication       : errorPageCustomizer
2018-03-04 12:07:52.224  INFO 311 --- [           main] fr.esiea.web.GildedRoseApplication       : errorPageRegistrarBeanPostProcessor
2018-03-04 12:07:52.224  INFO 311 --- [           main] fr.esiea.web.GildedRoseApplication       : faviconHandlerMapping
2018-03-04 12:07:52.224  INFO 311 --- [           main] fr.esiea.web.GildedRoseApplication       : faviconRequestHandler
2018-03-04 12:07:52.224  INFO 311 --- [           main] fr.esiea.web.GildedRoseApplication       : gildedRoseApplication
2018-03-04 12:07:52.224  INFO 311 --- [           main] fr.esiea.web.GildedRoseApplication       : handlerExceptionResolver
2018-03-04 12:07:52.225  INFO 311 --- [           main] fr.esiea.web.GildedRoseApplication       : hiddenHttpMethodFilter
2018-03-04 12:07:52.225  INFO 311 --- [           main] fr.esiea.web.GildedRoseApplication       : httpPutFormContentFilter
2018-03-04 12:07:52.225  INFO 311 --- [           main] fr.esiea.web.GildedRoseApplication       : httpRequestHandlerAdapter
2018-03-04 12:07:52.225  INFO 311 --- [           main] fr.esiea.web.GildedRoseApplication       : itemController
2018-03-04 12:07:52.225  INFO 311 --- [           main] fr.esiea.web.GildedRoseApplication       : jacksonObjectMapper
2018-03-04 12:07:52.225  INFO 311 --- [           main] fr.esiea.web.GildedRoseApplication       : jacksonObjectMapperBuilder
2018-03-04 12:07:52.225  INFO 311 --- [           main] fr.esiea.web.GildedRoseApplication       : jsonComponentModule
2018-03-04 12:07:52.225  INFO 311 --- [           main] fr.esiea.web.GildedRoseApplication       : localeCharsetMappingsCustomizer
2018-03-04 12:07:52.225  INFO 311 --- [           main] fr.esiea.web.GildedRoseApplication       : mappingJackson2HttpMessageConverter
2018-03-04 12:07:52.225  INFO 311 --- [           main] fr.esiea.web.GildedRoseApplication       : messageConverters
2018-03-04 12:07:52.226  INFO 311 --- [           main] fr.esiea.web.GildedRoseApplication       : methodValidationPostProcessor
2018-03-04 12:07:52.226  INFO 311 --- [           main] fr.esiea.web.GildedRoseApplication       : mockMvc
2018-03-04 12:07:52.226  INFO 311 --- [           main] fr.esiea.web.GildedRoseApplication       : mockMvcBuilder
2018-03-04 12:07:52.226  INFO 311 --- [           main] fr.esiea.web.GildedRoseApplication       : multipartConfigElement
2018-03-04 12:07:52.226  INFO 311 --- [           main] fr.esiea.web.GildedRoseApplication       : multipartResolver
2018-03-04 12:07:52.226  INFO 311 --- [           main] fr.esiea.web.GildedRoseApplication       : mvcContentNegotiationManager
2018-03-04 12:07:52.226  INFO 311 --- [           main] fr.esiea.web.GildedRoseApplication       : mvcConversionService
2018-03-04 12:07:52.227  INFO 311 --- [           main] fr.esiea.web.GildedRoseApplication       : mvcHandlerMappingIntrospector
2018-03-04 12:07:52.227  INFO 311 --- [           main] fr.esiea.web.GildedRoseApplication       : mvcPathMatcher
2018-03-04 12:07:52.227  INFO 311 --- [           main] fr.esiea.web.GildedRoseApplication       : mvcResourceUrlProvider
2018-03-04 12:07:52.227  INFO 311 --- [           main] fr.esiea.web.GildedRoseApplication       : mvcUriComponentsContributor
2018-03-04 12:07:52.227  INFO 311 --- [           main] fr.esiea.web.GildedRoseApplication       : mvcUrlPathHelper
2018-03-04 12:07:52.227  INFO 311 --- [           main] fr.esiea.web.GildedRoseApplication       : mvcValidator
2018-03-04 12:07:52.227  INFO 311 --- [           main] fr.esiea.web.GildedRoseApplication       : mvcViewResolver
2018-03-04 12:07:52.227  INFO 311 --- [           main] fr.esiea.web.GildedRoseApplication       : org.springframework.boot.autoconfigure.AutoConfigurationPackages
2018-03-04 12:07:52.227  INFO 311 --- [           main] fr.esiea.web.GildedRoseApplication       : org.springframework.boot.autoconfigure.condition.BeanTypeRegistry
2018-03-04 12:07:52.227  INFO 311 --- [           main] fr.esiea.web.GildedRoseApplication       : org.springframework.boot.autoconfigure.context.ConfigurationPropertiesAutoConfiguration
2018-03-04 12:07:52.227  INFO 311 --- [           main] fr.esiea.web.GildedRoseApplication       : org.springframework.boot.autoconfigure.context.PropertyPlaceholderAutoConfiguration
2018-03-04 12:07:52.227  INFO 311 --- [           main] fr.esiea.web.GildedRoseApplication       : org.springframework.boot.autoconfigure.info.ProjectInfoAutoConfiguration
2018-03-04 12:07:52.227  INFO 311 --- [           main] fr.esiea.web.GildedRoseApplication       : org.springframework.boot.autoconfigure.internalCachingMetadataReaderFactory
2018-03-04 12:07:52.227  INFO 311 --- [           main] fr.esiea.web.GildedRoseApplication       : org.springframework.boot.autoconfigure.jackson.JacksonAutoConfiguration
2018-03-04 12:07:52.227  INFO 311 --- [           main] fr.esiea.web.GildedRoseApplication       : org.springframework.boot.autoconfigure.jackson.JacksonAutoConfiguration$Jackson2ObjectMapperBuilderCustomizerConfiguration
2018-03-04 12:07:52.227  INFO 311 --- [           main] fr.esiea.web.GildedRoseApplication       : org.springframework.boot.autoconfigure.jackson.JacksonAutoConfiguration$JacksonObjectMapperBuilderConfiguration
2018-03-04 12:07:52.227  INFO 311 --- [           main] fr.esiea.web.GildedRoseApplication       : org.springframework.boot.autoconfigure.jackson.JacksonAutoConfiguration$JacksonObjectMapperConfiguration
2018-03-04 12:07:52.227  INFO 311 --- [           main] fr.esiea.web.GildedRoseApplication       : org.springframework.boot.autoconfigure.validation.ValidationAutoConfiguration
2018-03-04 12:07:52.227  INFO 311 --- [           main] fr.esiea.web.GildedRoseApplication       : org.springframework.boot.autoconfigure.web.DispatcherServletAutoConfiguration
2018-03-04 12:07:52.227  INFO 311 --- [           main] fr.esiea.web.GildedRoseApplication       : org.springframework.boot.autoconfigure.web.DispatcherServletAutoConfiguration$DispatcherServletConfiguration
2018-03-04 12:07:52.228  INFO 311 --- [           main] fr.esiea.web.GildedRoseApplication       : org.springframework.boot.autoconfigure.web.DispatcherServletAutoConfiguration$DispatcherServletRegistrationConfiguration
2018-03-04 12:07:52.228  INFO 311 --- [           main] fr.esiea.web.GildedRoseApplication       : org.springframework.boot.autoconfigure.web.EmbeddedServletContainerAutoConfiguration
2018-03-04 12:07:52.228  INFO 311 --- [           main] fr.esiea.web.GildedRoseApplication       : org.springframework.boot.autoconfigure.web.EmbeddedServletContainerAutoConfiguration$EmbeddedTomcat
2018-03-04 12:07:52.228  INFO 311 --- [           main] fr.esiea.web.GildedRoseApplication       : org.springframework.boot.autoconfigure.web.ErrorMvcAutoConfiguration
2018-03-04 12:07:52.228  INFO 311 --- [           main] fr.esiea.web.GildedRoseApplication       : org.springframework.boot.autoconfigure.web.ErrorMvcAutoConfiguration$DefaultErrorViewResolverConfiguration
2018-03-04 12:07:52.228  INFO 311 --- [           main] fr.esiea.web.GildedRoseApplication       : org.springframework.boot.autoconfigure.web.ErrorMvcAutoConfiguration$WhitelabelErrorViewConfiguration
2018-03-04 12:07:52.228  INFO 311 --- [           main] fr.esiea.web.GildedRoseApplication       : org.springframework.boot.autoconfigure.web.HttpEncodingAutoConfiguration
2018-03-04 12:07:52.228  INFO 311 --- [           main] fr.esiea.web.GildedRoseApplication       : org.springframework.boot.autoconfigure.web.HttpMessageConvertersAutoConfiguration
2018-03-04 12:07:52.228  INFO 311 --- [           main] fr.esiea.web.GildedRoseApplication       : org.springframework.boot.autoconfigure.web.HttpMessageConvertersAutoConfiguration$StringHttpMessageConverterConfiguration
2018-03-04 12:07:52.228  INFO 311 --- [           main] fr.esiea.web.GildedRoseApplication       : org.springframework.boot.autoconfigure.web.JacksonHttpMessageConvertersConfiguration
2018-03-04 12:07:52.228  INFO 311 --- [           main] fr.esiea.web.GildedRoseApplication       : org.springframework.boot.autoconfigure.web.JacksonHttpMessageConvertersConfiguration$MappingJackson2HttpMessageConverterConfiguration
2018-03-04 12:07:52.228  INFO 311 --- [           main] fr.esiea.web.GildedRoseApplication       : org.springframework.boot.autoconfigure.web.MultipartAutoConfiguration
2018-03-04 12:07:52.228  INFO 311 --- [           main] fr.esiea.web.GildedRoseApplication       : org.springframework.boot.autoconfigure.web.ServerPropertiesAutoConfiguration
2018-03-04 12:07:52.229  INFO 311 --- [           main] fr.esiea.web.GildedRoseApplication       : org.springframework.boot.autoconfigure.web.WebClientAutoConfiguration
2018-03-04 12:07:52.229  INFO 311 --- [           main] fr.esiea.web.GildedRoseApplication       : org.springframework.boot.autoconfigure.web.WebClientAutoConfiguration$RestTemplateConfiguration
2018-03-04 12:07:52.229  INFO 311 --- [           main] fr.esiea.web.GildedRoseApplication       : org.springframework.boot.autoconfigure.web.WebMvcAutoConfiguration
2018-03-04 12:07:52.229  INFO 311 --- [           main] fr.esiea.web.GildedRoseApplication       : org.springframework.boot.autoconfigure.web.WebMvcAutoConfiguration$EnableWebMvcConfiguration
2018-03-04 12:07:52.229  INFO 311 --- [           main] fr.esiea.web.GildedRoseApplication       : org.springframework.boot.autoconfigure.web.WebMvcAutoConfiguration$WebMvcAutoConfigurationAdapter
2018-03-04 12:07:52.229  INFO 311 --- [           main] fr.esiea.web.GildedRoseApplication       : org.springframework.boot.autoconfigure.web.WebMvcAutoConfiguration$WebMvcAutoConfigurationAdapter$FaviconConfiguration
2018-03-04 12:07:52.229  INFO 311 --- [           main] fr.esiea.web.GildedRoseApplication       : org.springframework.boot.autoconfigure.websocket.WebSocketAutoConfiguration
2018-03-04 12:07:52.229  INFO 311 --- [           main] fr.esiea.web.GildedRoseApplication       : org.springframework.boot.autoconfigure.websocket.WebSocketAutoConfiguration$TomcatWebSocketConfiguration
2018-03-04 12:07:52.229  INFO 311 --- [           main] fr.esiea.web.GildedRoseApplication       : org.springframework.boot.context.properties.ConfigurationPropertiesBindingPostProcessor
2018-03-04 12:07:52.229  INFO 311 --- [           main] fr.esiea.web.GildedRoseApplication       : org.springframework.boot.context.properties.ConfigurationPropertiesBindingPostProcessor.store
2018-03-04 12:07:52.229  INFO 311 --- [           main] fr.esiea.web.GildedRoseApplication       : org.springframework.boot.test.autoconfigure.web.servlet.MockMvcAutoConfiguration
2018-03-04 12:07:52.230  INFO 311 --- [           main] fr.esiea.web.GildedRoseApplication       : org.springframework.boot.test.autoconfigure.web.servlet.MockMvcSecurityAutoConfiguration
2018-03-04 12:07:52.230  INFO 311 --- [           main] fr.esiea.web.GildedRoseApplication       : org.springframework.boot.test.context.ImportsContextCustomizer$ImportsCleanupPostProcessor
2018-03-04 12:07:52.230  INFO 311 --- [           main] fr.esiea.web.GildedRoseApplication       : org.springframework.boot.test.mock.mockito.MockitoPostProcessor
2018-03-04 12:07:52.230  INFO 311 --- [           main] fr.esiea.web.GildedRoseApplication       : org.springframework.boot.test.mock.mockito.MockitoPostProcessor$SpyPostProcessor
2018-03-04 12:07:52.230  INFO 311 --- [           main] fr.esiea.web.GildedRoseApplication       : org.springframework.context.annotation.internalAutowiredAnnotationProcessor
2018-03-04 12:07:52.230  INFO 311 --- [           main] fr.esiea.web.GildedRoseApplication       : org.springframework.context.annotation.internalCommonAnnotationProcessor
2018-03-04 12:07:52.230  INFO 311 --- [           main] fr.esiea.web.GildedRoseApplication       : org.springframework.context.annotation.internalConfigurationAnnotationProcessor
2018-03-04 12:07:52.230  INFO 311 --- [           main] fr.esiea.web.GildedRoseApplication       : org.springframework.context.annotation.internalRequiredAnnotationProcessor
2018-03-04 12:07:52.230  INFO 311 --- [           main] fr.esiea.web.GildedRoseApplication       : org.springframework.context.event.internalEventListenerFactory
2018-03-04 12:07:52.230  INFO 311 --- [           main] fr.esiea.web.GildedRoseApplication       : org.springframework.context.event.internalEventListenerProcessor
2018-03-04 12:07:52.230  INFO 311 --- [           main] fr.esiea.web.GildedRoseApplication       : preserveErrorControllerTargetClassPostProcessor
2018-03-04 12:07:52.230  INFO 311 --- [           main] fr.esiea.web.GildedRoseApplication       : propertySourcesPlaceholderConfigurer
2018-03-04 12:07:52.230  INFO 311 --- [           main] fr.esiea.web.GildedRoseApplication       : requestContextFilter
2018-03-04 12:07:52.230  INFO 311 --- [           main] fr.esiea.web.GildedRoseApplication       : requestMappingHandlerAdapter
2018-03-04 12:07:52.230  INFO 311 --- [           main] fr.esiea.web.GildedRoseApplication       : requestMappingHandlerMapping
2018-03-04 12:07:52.230  INFO 311 --- [           main] fr.esiea.web.GildedRoseApplication       : resourceHandlerMapping
2018-03-04 12:07:52.231  INFO 311 --- [           main] fr.esiea.web.GildedRoseApplication       : restTemplateBuilder
2018-03-04 12:07:52.231  INFO 311 --- [           main] fr.esiea.web.GildedRoseApplication       : serverProperties
2018-03-04 12:07:52.231  INFO 311 --- [           main] fr.esiea.web.GildedRoseApplication       : simpleControllerHandlerAdapter
2018-03-04 12:07:52.231  INFO 311 --- [           main] fr.esiea.web.GildedRoseApplication       : spring.http.encoding-org.springframework.boot.autoconfigure.web.HttpEncodingProperties
2018-03-04 12:07:52.231  INFO 311 --- [           main] fr.esiea.web.GildedRoseApplication       : spring.http.multipart-org.springframework.boot.autoconfigure.web.MultipartProperties
2018-03-04 12:07:52.231  INFO 311 --- [           main] fr.esiea.web.GildedRoseApplication       : spring.info-org.springframework.boot.autoconfigure.info.ProjectInfoProperties
2018-03-04 12:07:52.231  INFO 311 --- [           main] fr.esiea.web.GildedRoseApplication       : spring.jackson-org.springframework.boot.autoconfigure.jackson.JacksonProperties
2018-03-04 12:07:52.231  INFO 311 --- [           main] fr.esiea.web.GildedRoseApplication       : spring.mvc-org.springframework.boot.autoconfigure.web.WebMvcProperties
2018-03-04 12:07:52.231  INFO 311 --- [           main] fr.esiea.web.GildedRoseApplication       : spring.resources-org.springframework.boot.autoconfigure.web.ResourceProperties
2018-03-04 12:07:52.231  INFO 311 --- [           main] fr.esiea.web.GildedRoseApplication       : springBootMockMvcBuilderCustomizer
2018-03-04 12:07:52.231  INFO 311 --- [           main] fr.esiea.web.GildedRoseApplication       : standardJacksonObjectMapperBuilderCustomizer
2018-03-04 12:07:52.231  INFO 311 --- [           main] fr.esiea.web.GildedRoseApplication       : stringHttpMessageConverter
2018-03-04 12:07:52.231  INFO 311 --- [           main] fr.esiea.web.GildedRoseApplication       : tomcatEmbeddedServletContainerFactory
2018-03-04 12:07:52.231  INFO 311 --- [           main] fr.esiea.web.GildedRoseApplication       : viewControllerHandlerMapping
2018-03-04 12:07:52.231  INFO 311 --- [           main] fr.esiea.web.GildedRoseApplication       : viewResolver
2018-03-04 12:07:52.231  INFO 311 --- [           main] fr.esiea.web.GildedRoseApplication       : websocketContainerCustomizer
2018-03-04 12:07:52.232  INFO 311 --- [           main] fr.esiea.web.GildedRoseApplication       : welcomePageHandlerMapping
2018-03-04 12:07:52.235  INFO 311 --- [           main] fr.esiea.ItemControllerTest              : Started ItemControllerTest in 1.76 seconds (JVM running for 2.336)
2018-03-04 12:07:52.312  INFO 311 --- [           main] fr.esiea.web.GildedRoseApplication       : biere, sellIn : 30, quality : 10, price : 7, quantity : 2 created with ID: 1

MockHttpServletRequest:
      HTTP Method = GET
      Request URI = /add
       Parameters = {name=[biere], sellin=[30], quality=[10], price=[7], quantity=[2], type=[item], attribute=[normal]}
          Headers = {Accept=[application/json]}

Handler:
             Type = fr.esiea.controllers.ItemController
           Method = public int fr.esiea.controllers.ItemController.add(java.lang.String,java.lang.Integer,java.lang.Integer,java.lang.Integer,java.lang.Integer,java.lang.String,java.lang.String)

Async:
    Async started = false
     Async result = null

Resolved Exception:
             Type = null

ModelAndView:
        View name = null
             View = null
            Model = null

FlashMap:
       Attributes = null

MockHttpServletResponse:
           Status = 200
    Error message = null
          Headers = {Content-Type=[application/json;charset=UTF-8]}
     Content type = application/json;charset=UTF-8
             Body = 1
    Forwarded URL = null
   Redirected URL = null
          Cookies = []
2018-03-04 12:07:52.373  INFO 311 --- [           main] fr.esiea.web.GildedRoseApplication       : emmental, sellIn : 30, quality : 80, price : 100, quantity : 1 created with ID: 2

MockHttpServletRequest:
      HTTP Method = GET
      Request URI = /add
       Parameters = {name=[biere], sellin=[30], quality=[10], price=[7], quantity=[2], type=[item], attribute=[normal]}
          Headers = {Accept=[application/json]}

Handler:
             Type = fr.esiea.controllers.ItemController
           Method = public int fr.esiea.controllers.ItemController.add(java.lang.String,java.lang.Integer,java.lang.Integer,java.lang.Integer,java.lang.Integer,java.lang.String,java.lang.String)

Async:
    Async started = false
     Async result = null

Resolved Exception:
             Type = null

ModelAndView:
        View name = null
             View = null
            Model = null

FlashMap:
       Attributes = null

MockHttpServletResponse:
           Status = 200
    Error message = null
          Headers = {Content-Type=[application/json;charset=UTF-8]}
     Content type = application/json;charset=UTF-8
             Body = 1
    Forwarded URL = null
   Redirected URL = null
          Cookies = []

MockHttpServletRequest:
      HTTP Method = GET
      Request URI = /add
       Parameters = {name=[emmental], sellin=[30], quality=[80], price=[100], quantity=[1], type=[cheese], attribute=[legendary]}
          Headers = {Accept=[application/json]}

Handler:
             Type = fr.esiea.controllers.ItemController
           Method = public int fr.esiea.controllers.ItemController.add(java.lang.String,java.lang.Integer,java.lang.Integer,java.lang.Integer,java.lang.Integer,java.lang.String,java.lang.String)

Async:
    Async started = false
     Async result = null

Resolved Exception:
             Type = null

ModelAndView:
        View name = null
             View = null
            Model = null

FlashMap:
       Attributes = null

MockHttpServletResponse:
           Status = 200
    Error message = null
          Headers = {Content-Type=[application/json;charset=UTF-8]}
     Content type = application/json;charset=UTF-8
             Body = 2
    Forwarded URL = null
   Redirected URL = null
          Cookies = []
2018-03-04 12:07:52.383  INFO 311 --- [           main] fr.esiea.web.GildedRoseApplication       : jul, sellIn : 30, quality : 10, price : 50, quantity : 1 created with ID: 3

MockHttpServletRequest:
      HTTP Method = GET
      Request URI = /add
       Parameters = {name=[biere], sellin=[30], quality=[10], price=[7], quantity=[2], type=[item], attribute=[normal]}
          Headers = {Accept=[application/json]}

Handler:
             Type = fr.esiea.controllers.ItemController
           Method = public int fr.esiea.controllers.ItemController.add(java.lang.String,java.lang.Integer,java.lang.Integer,java.lang.Integer,java.lang.Integer,java.lang.String,java.lang.String)

Async:
    Async started = false
     Async result = null

Resolved Exception:
             Type = null

ModelAndView:
        View name = null
             View = null
            Model = null

FlashMap:
       Attributes = null

MockHttpServletResponse:
           Status = 200
    Error message = null
          Headers = {Content-Type=[application/json;charset=UTF-8]}
     Content type = application/json;charset=UTF-8
             Body = 1
    Forwarded URL = null
   Redirected URL = null
          Cookies = []

MockHttpServletRequest:
      HTTP Method = GET
      Request URI = /add
       Parameters = {name=[emmental], sellin=[30], quality=[80], price=[100], quantity=[1], type=[cheese], attribute=[legendary]}
          Headers = {Accept=[application/json]}

Handler:
             Type = fr.esiea.controllers.ItemController
           Method = public int fr.esiea.controllers.ItemController.add(java.lang.String,java.lang.Integer,java.lang.Integer,java.lang.Integer,java.lang.Integer,java.lang.String,java.lang.String)

Async:
    Async started = false
     Async result = null

Resolved Exception:
             Type = null

ModelAndView:
        View name = null
             View = null
            Model = null

FlashMap:
       Attributes = null

MockHttpServletResponse:
           Status = 200
    Error message = null
          Headers = {Content-Type=[application/json;charset=UTF-8]}
     Content type = application/json;charset=UTF-8
             Body = 2
    Forwarded URL = null
   Redirected URL = null
          Cookies = []

MockHttpServletRequest:
      HTTP Method = GET
      Request URI = /add
       Parameters = {name=[jul], sellin=[30], quality=[10], price=[50], quantity=[1], type=[ticket], attribute=[conjured]}
          Headers = {Accept=[application/json]}

Handler:
             Type = fr.esiea.controllers.ItemController
           Method = public int fr.esiea.controllers.ItemController.add(java.lang.String,java.lang.Integer,java.lang.Integer,java.lang.Integer,java.lang.Integer,java.lang.String,java.lang.String)

Async:
    Async started = false
     Async result = null

Resolved Exception:
             Type = null

ModelAndView:
        View name = null
             View = null
            Model = null

FlashMap:
       Attributes = null

MockHttpServletResponse:
           Status = 200
    Error message = null
          Headers = {Content-Type=[application/json;charset=UTF-8]}
     Content type = application/json;charset=UTF-8
             Body = 3
    Forwarded URL = null
   Redirected URL = null
          Cookies = []

MockHttpServletRequest:
      HTTP Method = GET
      Request URI = /add
       Parameters = {name=[biere], sellin=[30], quality=[10], price=[7], quantity=[2], type=[item], attribute=[normal]}
          Headers = {Accept=[application/json]}

Handler:
             Type = fr.esiea.controllers.ItemController
           Method = public int fr.esiea.controllers.ItemController.add(java.lang.String,java.lang.Integer,java.lang.Integer,java.lang.Integer,java.lang.Integer,java.lang.String,java.lang.String)

Async:
    Async started = false
     Async result = null

Resolved Exception:
             Type = null

ModelAndView:
        View name = null
             View = null
            Model = null

FlashMap:
       Attributes = null

MockHttpServletResponse:
           Status = 200
    Error message = null
          Headers = {Content-Type=[application/json;charset=UTF-8]}
     Content type = application/json;charset=UTF-8
             Body = 1
    Forwarded URL = null
   Redirected URL = null
          Cookies = []

MockHttpServletRequest:
      HTTP Method = GET
      Request URI = /add
       Parameters = {name=[emmental], sellin=[30], quality=[80], price=[100], quantity=[1], type=[cheese], attribute=[legendary]}
          Headers = {Accept=[application/json]}

Handler:
             Type = fr.esiea.controllers.ItemController
           Method = public int fr.esiea.controllers.ItemController.add(java.lang.String,java.lang.Integer,java.lang.Integer,java.lang.Integer,java.lang.Integer,java.lang.String,java.lang.String)

Async:
    Async started = false
     Async result = null

Resolved Exception:
             Type = null

ModelAndView:
        View name = null
             View = null
            Model = null

FlashMap:
       Attributes = null

MockHttpServletResponse:
           Status = 200
    Error message = null
          Headers = {Content-Type=[application/json;charset=UTF-8]}
     Content type = application/json;charset=UTF-8
             Body = 2
    Forwarded URL = null
   Redirected URL = null
          Cookies = []

MockHttpServletRequest:
      HTTP Method = GET
      Request URI = /add
       Parameters = {name=[jul], sellin=[30], quality=[10], price=[50], quantity=[1], type=[ticket], attribute=[conjured]}
          Headers = {Accept=[application/json]}

Handler:
             Type = fr.esiea.controllers.ItemController
           Method = public int fr.esiea.controllers.ItemController.add(java.lang.String,java.lang.Integer,java.lang.Integer,java.lang.Integer,java.lang.Integer,java.lang.String,java.lang.String)

Async:
    Async started = false
     Async result = null

Resolved Exception:
             Type = null

ModelAndView:
        View name = null
             View = null
            Model = null

FlashMap:
       Attributes = null

MockHttpServletResponse:
           Status = 200
    Error message = null
          Headers = {Content-Type=[application/json;charset=UTF-8]}
     Content type = application/json;charset=UTF-8
             Body = 3
    Forwarded URL = null
   Redirected URL = null
          Cookies = []

MockHttpServletRequest:
      HTTP Method = GET
      Request URI = /
       Parameters = {}
          Headers = {Accept=[application/json]}

Handler:
             Type = fr.esiea.controllers.ItemController
           Method = public java.lang.String fr.esiea.controllers.ItemController.index()

Async:
    Async started = false
     Async result = null

Resolved Exception:
             Type = null

ModelAndView:
        View name = null
             View = null
            Model = null

FlashMap:
       Attributes = null

MockHttpServletResponse:
           Status = 200
    Error message = null
          Headers = {Content-Type=[application/json;charset=UTF-8], Content-Length=[1196]}
     Content type = application/json;charset=UTF-8
             Body = Welcome to <strong>GildedRose</strong> !<br><br>Pour consulter la liste des objets pouvant tre vendus : <a href='/prices' style='color:black'><strong>/prices</strong></a>.<br>Pour acheter un objet : <a href='/buy?id=&quantity=' style='color:black'><strong>/buy?id=&quantity=</strong></a>.<br><ul><li><strong>id :</strong> l'id du produit</li><li><strong>quantity :</strong> le nombre de produit(s) que vous souhaitez acheter</li></ul>Pour approvisionner un objet : <a href='/add?name=&sellin=&quality=&price=&quantity=&type=&attribute=' style='color:black'><strong>/add?name=&sellin=&quality=&price=&quantity=&type=&attribute=</strong></a>.<br><ul><li><strong>name :</strong> le nom du produit</li><li><strong>sellin :</strong> le nombre de jour(s) jusqu' premption</li><li><strong>quality :</strong> la qualit du produit</li><li><strong>price :</strong> le prix du produit</li><li><strong>quantity :</strong> la quantit de produit(s) pour cet approvisionnement</li><li><strong>type :</strong> le type de produit disponible parmi <pre>item, cheese, ticket</pre></li><li><strong>attribute :</strong> l'attribut du produit disponible parmi <pre>normal, conjured, legendary</pre></li></ul>
    Forwarded URL = null
   Redirected URL = null
          Cookies = []

MockHttpServletRequest:
      HTTP Method = GET
      Request URI = /prices
       Parameters = {}
          Headers = {Accept=[application/json]}

Handler:
             Type = fr.esiea.controllers.ItemController
           Method = public java.lang.String fr.esiea.controllers.ItemController.prices()

Async:
    Async started = false
     Async result = null

Resolved Exception:
             Type = null

ModelAndView:
        View name = null
             View = null
            Model = null

FlashMap:
       Attributes = null

MockHttpServletResponse:
           Status = 200
    Error message = null
          Headers = {Content-Type=[application/json;charset=UTF-8], Content-Length=[221]}
     Content type = application/json;charset=UTF-8
             Body = [{"id":1,"name":"biere","sellIn":30,"quality":10,"price":7,"quantity":2},{"id":2,"name":"emmental","sellIn":30,"quality":80,"price":100,"quantity":1},{"id":3,"name":"jul","sellIn":30,"quality":10,"price":50,"quantity":1}]
    Forwarded URL = null
   Redirected URL = null
          Cookies = []
Tests run: 5, Failures: 4, Errors: 0, Skipped: 0, Time elapsed: 2.075 sec <<< FAILURE! - in fr.esiea.ItemControllerTest
add_buy_item_normal(fr.esiea.ItemControllerTest)  Time elapsed: 0.12 sec  <<< FAILURE!
java.lang.AssertionError: Response content
Expected: "6"
     but: was "1"
	at org.hamcrest.MatcherAssert.assertThat(MatcherAssert.java:20)
	at org.springframework.test.web.servlet.result.ContentResultMatchers$4.match(ContentResultMatchers.java:138)
	at org.springframework.test.web.servlet.MockMvc$1.andExpect(MockMvc.java:171)
	at fr.esiea.ItemControllerTest.add_buy_item_normal(ItemControllerTest.java:48)

add_cheese_legendary(fr.esiea.ItemControllerTest)  Time elapsed: 0.009 sec  <<< FAILURE!
java.lang.AssertionError: Response content
Expected: "7"
     but: was "2"
	at org.hamcrest.MatcherAssert.assertThat(MatcherAssert.java:20)
	at org.springframework.test.web.servlet.result.ContentResultMatchers$4.match(ContentResultMatchers.java:138)
	at org.springframework.test.web.servlet.MockMvc$1.andExpect(MockMvc.java:171)
	at fr.esiea.ItemControllerTest.add_cheese_legendary(ItemControllerTest.java:67)

add_ticket_conjured(fr.esiea.ItemControllerTest)  Time elapsed: 0.014 sec  <<< FAILURE!
java.lang.AssertionError: Response content
Expected: "8"
     but: was "3"
	at org.hamcrest.MatcherAssert.assertThat(MatcherAssert.java:20)
	at org.springframework.test.web.servlet.result.ContentResultMatchers$4.match(ContentResultMatchers.java:138)
	at org.springframework.test.web.servlet.MockMvc$1.andExpect(MockMvc.java:171)
	at fr.esiea.ItemControllerTest.add_ticket_conjured(ItemControllerTest.java:77)

prices(fr.esiea.ItemControllerTest)  Time elapsed: 0.044 sec  <<< FAILURE!
java.lang.AssertionError: Response content
Expected: a string containing "[]"
     but: was "[{"id":1,"name":"biere","sellIn":30,"quality":10,"price":7,"quantity":2},{"id":2,"name":"emmental","sellIn":30,"quality":80,"price":100,"quantity":1},{"id":3,"name":"jul","sellIn":30,"quality":10,"price":50,"quantity":1}]"
	at org.hamcrest.MatcherAssert.assertThat(MatcherAssert.java:20)
	at org.springframework.test.web.servlet.result.ContentResultMatchers$4.match(ContentResultMatchers.java:138)
	at org.springframework.test.web.servlet.MockMvc$1.andExpect(MockMvc.java:171)
	at fr.esiea.ItemControllerTest.prices(ItemControllerTest.java:41)

Running fr.esiea.CheeseItemTest
Tests run: 1, Failures: 0, Errors: 0, Skipped: 0, Time elapsed: 0.001 sec - in fr.esiea.CheeseItemTest
Running fr.esiea.DatabaseAdapterTest
2018-03-04 12:07:52.629  INFO 311 --- [           main] fr.esiea.web.GildedRoseApplication       : testName, sellIn : 1, quality : 2, price : 3, quantity : 4 created with ID: 4
2018-03-04 12:07:52.638  INFO 311 --- [           main] fr.esiea.web.GildedRoseApplication       : testName, sellIn : 1, quality : 2, price : 3, quantity : 4 already exists with ID: 4
2018-03-04 12:07:52.639  INFO 311 --- [           main] fr.esiea.web.GildedRoseApplication       : testName, sellIn : 1, quality : 2, price : 3, quantity : 4 removed
2018-03-04 12:07:52.665  INFO 311 --- [           main] fr.esiea.web.GildedRoseApplication       : testName1, sellIn : 1, quality : 2, price : 3, quantity : 4 created with ID: 5
2018-03-04 12:07:52.665  INFO 311 --- [           main] fr.esiea.web.GildedRoseApplication       : testName2, sellIn : 1, quality : 2, price : 3, quantity : 4 created with ID: 6
2018-03-04 12:07:52.665  INFO 311 --- [           main] fr.esiea.web.GildedRoseApplication       : testName3, sellIn : 5, quality : 6, price : 7, quantity : 8 created with ID: 7
2018-03-04 12:07:52.666  INFO 311 --- [           main] fr.esiea.web.GildedRoseApplication       : testName4, sellIn : 9, quality : 10, price : 11, quantity : 12 created with ID: 8
2018-03-04 12:07:52.740  INFO 311 --- [           main] fr.esiea.web.GildedRoseApplication       : testName1, sellIn : 1, quality : 3, price : 3, quantity : 4 removed
2018-03-04 12:07:52.740  INFO 311 --- [           main] fr.esiea.web.GildedRoseApplication       : testName2, sellIn : 1, quality : 2, price : 3, quantity : 4 removed
2018-03-04 12:07:52.740  INFO 311 --- [           main] fr.esiea.web.GildedRoseApplication       : testName3, sellIn : 5, quality : 6, price : 7, quantity : 8 removed
2018-03-04 12:07:52.740  INFO 311 --- [           main] fr.esiea.web.GildedRoseApplication       : testName4, sellIn : 9, quality : 10, price : 11, quantity : 12 removed
Tests run: 3, Failures: 1, Errors: 0, Skipped: 0, Time elapsed: 0.092 sec <<< FAILURE! - in fr.esiea.DatabaseAdapterTest
update_items(fr.esiea.DatabaseAdapterTest)  Time elapsed: 0.078 sec  <<< FAILURE!
org.assertj.core.api.SoftAssertionError: 
The following assertion failed:
1) [Item items] expected:<[[]testName1, sellIn : ...> but was:<[[biere, sellIn : 30, quality : 10, price : 7, quantity : 2,
    emmental, sellIn : 30, quality : 80, price : 100, quantity : 1,
    jul, sellIn : 30, quality : 10, price : 50, quantity : 1,
    ]testName1, sellIn : ...>
at DatabaseAdapterTest.update_items(DatabaseAdapterTest.java:85) expected:<[[]testName1, sellIn : ...> but was:<[[biere, sellIn : 30, quality : 10, price : 7, quantity : 2,
    emmental, sellIn : 30, quality : 80, price : 100, quantity : 1,
    jul, sellIn : 30, quality : 10, price : 50, quantity : 1,
    ]testName1, sellIn : ...>

	at org.assertj.core.api.SoftAssertions.assertAll(SoftAssertions.java:158)
	at fr.esiea.DatabaseAdapterTest.update_items(DatabaseAdapterTest.java:91)

Running fr.esiea.TicketItemTest
Tests run: 4, Failures: 0, Errors: 0, Skipped: 0, Time elapsed: 0 sec - in fr.esiea.TicketItemTest
Running fr.esiea.ItemTest
Tests run: 4, Failures: 0, Errors: 0, Skipped: 0, Time elapsed: 0.028 sec - in fr.esiea.ItemTest
Running fr.esiea.LegendaryItemTest
Tests run: 2, Failures: 0, Errors: 0, Skipped: 0, Time elapsed: 0 sec - in fr.esiea.LegendaryItemTest
Running fr.esiea.GildedRoseTest
Tests run: 2, Failures: 0, Errors: 0, Skipped: 0, Time elapsed: 0.001 sec - in fr.esiea.GildedRoseTest
Running fr.esiea.ConjuredItemTest
Tests run: 2, Failures: 0, Errors: 0, Skipped: 0, Time elapsed: 0 sec - in fr.esiea.ConjuredItemTest
2018-03-04 12:07:52.789  INFO 311 --- [       Thread-3] o.s.w.c.s.GenericWebApplicationContext   : Closing org.springframework.web.context.support.GenericWebApplicationContext@343570b7: startup date [Sun Mar 04 12:07:50 CET 2018]; root of context hierarchy

Results :

Failed tests: 
  DatabaseAdapterTest.update_items:91 
The following assertion failed:
1) [Item items] expected:<[[]testName1, sellIn : ...> but was:<[[biere, sellIn : 30, quality : 10, price : 7, quantity : 2,
    emmental, sellIn : 30, quality : 80, price : 100, quantity : 1,
    jul, sellIn : 30, quality : 10, price : 50, quantity : 1,
    ]testName1, sellIn : ...>
at DatabaseAdapterTest.update_items(DatabaseAdapterTest.java:85) expected:<[[]testName1, sellIn : ...> but was:<[[biere, sellIn : 30, quality : 10, price : 7, quantity : 2,
    emmental, sellIn : 30, quality : 80, price : 100, quantity : 1,
    jul, sellIn : 30, quality : 10, price : 50, quantity : 1,
    ]testName1, sellIn : ...>

  ItemControllerTest.add_buy_item_normal:48 Response content
Expected: "6"
     but: was "1"
  ItemControllerTest.add_cheese_legendary:67 Response content
Expected: "7"
     but: was "2"
  ItemControllerTest.add_ticket_conjured:77 Response content
Expected: "8"
     but: was "3"
  ItemControllerTest.prices:41 Response content
Expected: a string containing "[]"
     but: was "[{"id":1,"name":"biere","sellIn":30,"quality":10,"price":7,"quantity":2},{"id":2,"name":"emmental","sellIn":30,"quality":80,"price":100,"quantity":1},{"id":3,"name":"jul","sellIn":30,"quality":10,"price":50,"quantity":1}]"

Tests run: 23, Failures: 5, Errors: 0, Skipped: 0

[INFO] ------------------------------------------------------------------------
[INFO] BUILD FAILURE
[INFO] ------------------------------------------------------------------------
[INFO] Total time: 4.847 s
[INFO] Finished at: 2018-03-04T12:07:52+01:00
[INFO] Final Memory: 27M/935M
[INFO] ------------------------------------------------------------------------
[ERROR] Failed to execute goal org.apache.maven.plugins:maven-surefire-plugin:2.18.1:test (default-test) on project gilded-rose: There are test failures.
[ERROR] 
[ERROR] Please refer to /root/workspace/Samoussam/gilded-rose/348886060/target/surefire-reports for the individual test results.
[ERROR] -> [Help 1]
[ERROR] 
[ERROR] To see the full stack trace of the errors, re-run Maven with the -e switch.
[ERROR] Re-run Maven using the -X switch to enable full debug logging.
[ERROR] 
[ERROR] For more information about the errors and possible solutions, please read the following articles:
[ERROR] [Help 1] http://cwiki.apache.org/confluence/display/MAVEN/MojoFailureException
