[INFO] Scanning for projects...
[INFO]                                                                         
[INFO] ------------------------------------------------------------------------
[INFO] Building Java Statistical Analysis Tool 0.1.0-SNAPSHOT
[INFO] ------------------------------------------------------------------------
[INFO] 
[INFO] --- maven-resources-plugin:2.6:resources (default-resources) @ JSAT ---
[INFO] Using 'UTF-8' encoding to copy filtered resources.
[INFO] skip non existing resourceDirectory /root/workspace/EdwardRaff/JSAT/328568452/JSAT/src/main/resources
[INFO] 
[INFO] --- maven-compiler-plugin:3.1:compile (default-compile) @ JSAT ---
[INFO] Nothing to compile - all classes are up to date
[INFO] 
[INFO] --- maven-resources-plugin:2.6:testResources (default-testResources) @ JSAT ---
[INFO] Using 'UTF-8' encoding to copy filtered resources.
[INFO] skip non existing resourceDirectory /root/workspace/EdwardRaff/JSAT/328568452/JSAT/src/test/resources
[INFO] 
[INFO] --- maven-compiler-plugin:3.1:testCompile (default-testCompile) @ JSAT ---
[INFO] Nothing to compile - all classes are up to date
[INFO] 
[INFO] --- maven-surefire-plugin:2.18.1:test (default-test) @ JSAT ---
[INFO] Surefire report directory: /root/workspace/EdwardRaff/JSAT/328568452/JSAT/target/surefire-reports
[INFO] Downloading: https://repo.maven.apache.org/maven2/org/apache/maven/surefire/surefire-junit4/2.18.1/surefire-junit4-2.18.1.pom
[INFO] Downloaded: https://repo.maven.apache.org/maven2/org/apache/maven/surefire/surefire-junit4/2.18.1/surefire-junit4-2.18.1.pom (3 KB at 3.9 KB/sec)
[INFO] Downloading: https://repo.maven.apache.org/maven2/org/apache/maven/surefire/surefire-providers/2.18.1/surefire-providers-2.18.1.pom
[INFO] Downloaded: https://repo.maven.apache.org/maven2/org/apache/maven/surefire/surefire-providers/2.18.1/surefire-providers-2.18.1.pom (3 KB at 112.9 KB/sec)
[INFO] Downloading: https://repo.maven.apache.org/maven2/org/apache/maven/surefire/surefire-junit4/2.18.1/surefire-junit4-2.18.1.jar
[INFO] Downloaded: https://repo.maven.apache.org/maven2/org/apache/maven/surefire/surefire-junit4/2.18.1/surefire-junit4-2.18.1.jar (67 KB at 1355.0 KB/sec)

-------------------------------------------------------
 T E S T S
-------------------------------------------------------
Running jsat.parameters.RandomSearchTest
testClassificationAutoAdd
testClassificationEx
testRegression
testRegressionEx
testClassification
Tests run: 5, Failures: 0, Errors: 0, Skipped: 0, Time elapsed: 2.288 sec - in jsat.parameters.RandomSearchTest
Running jsat.parameters.GridSearchTest
setUseWarmStarts
classificationAutoAdd
setUseWarmStarts
setUseWarmStarts
setUseWarmStarts
setUseWarmStarts
setUseWarmStarts
setUseWarmStarts
setUseWarmStarts
Tests run: 9, Failures: 0, Errors: 0, Skipped: 0, Time elapsed: 0.363 sec - in jsat.parameters.GridSearchTest
Running jsat.regression.NadarayaWatsonTest
train
train
clone
Tests run: 3, Failures: 0, Errors: 0, Skipped: 0, Time elapsed: 1.214 sec - in jsat.regression.NadarayaWatsonTest
Running jsat.regression.OrdinaryKrigingTest
train
train
clone
Tests run: 3, Failures: 0, Errors: 0, Skipped: 0, Time elapsed: 0.801 sec - in jsat.regression.OrdinaryKrigingTest
Running jsat.regression.KernelRLSTest
train
train
clone
Tests run: 3, Failures: 0, Errors: 0, Skipped: 0, Time elapsed: 0.071 sec - in jsat.regression.KernelRLSTest
Running jsat.regression.RANSACTest
train
train
clone
Tests run: 3, Failures: 0, Errors: 0, Skipped: 0, Time elapsed: 0.158 sec - in jsat.regression.RANSACTest
Running jsat.regression.KernelRidgeRegressionTest
train
train
clone
Tests run: 3, Failures: 0, Errors: 0, Skipped: 0, Time elapsed: 0.292 sec - in jsat.regression.KernelRidgeRegressionTest
Running jsat.regression.RidgeRegressionTest
train
train
Tests run: 2, Failures: 0, Errors: 0, Skipped: 0, Time elapsed: 0.073 sec - in jsat.regression.RidgeRegressionTest
Running jsat.regression.AveragedRegressorTest
train
train
clone
Tests run: 3, Failures: 0, Errors: 0, Skipped: 0, Time elapsed: 0.019 sec - in jsat.regression.AveragedRegressorTest
Running jsat.regression.LogisticRegressionTest
clone
trainC
trainC
Tests run: 3, Failures: 0, Errors: 0, Skipped: 0, Time elapsed: 0.395 sec - in jsat.regression.LogisticRegressionTest
Running jsat.regression.StochasticRidgeRegressionTest
train
train
clone
Tests run: 3, Failures: 0, Errors: 0, Skipped: 0, Time elapsed: 3.047 sec - in jsat.regression.StochasticRidgeRegressionTest
Running jsat.regression.StochasticGradientBoostingTest
train
train
clone
Tests run: 3, Failures: 0, Errors: 0, Skipped: 0, Time elapsed: 1.111 sec - in jsat.regression.StochasticGradientBoostingTest
Running jsat.regression.evaluation.MeanSquaredErrorTest
getScore
Tests run: 1, Failures: 0, Errors: 0, Skipped: 0, Time elapsed: 0.002 sec - in jsat.regression.evaluation.MeanSquaredErrorTest
Running jsat.regression.evaluation.MeanAbsoluteErrorTest
getScore
Tests run: 1, Failures: 0, Errors: 0, Skipped: 0, Time elapsed: 0.001 sec - in jsat.regression.evaluation.MeanAbsoluteErrorTest
Running jsat.regression.evaluation.RelativeSquaredErrorTest
getScore
Tests run: 1, Failures: 0, Errors: 0, Skipped: 0, Time elapsed: 0.002 sec - in jsat.regression.evaluation.RelativeSquaredErrorTest
Running jsat.regression.evaluation.RelativeAbsoluteErrorTest
getScore
Tests run: 1, Failures: 0, Errors: 0, Skipped: 0, Time elapsed: 0 sec - in jsat.regression.evaluation.RelativeAbsoluteErrorTest
Running jsat.regression.evaluation.CoefficientOfDeterminationTest
getScore
Tests run: 1, Failures: 0, Errors: 0, Skipped: 0, Time elapsed: 0 sec - in jsat.regression.evaluation.CoefficientOfDeterminationTest
Running jsat.linear.LUPDecompositionTest
isSquare
det
solve
solve
solve
forwardSub
forwardSub
forwardSub
backSub
backSub
backSub
Tests run: 11, Failures: 0, Errors: 0, Skipped: 0, Time elapsed: 0.023 sec - in jsat.linear.LUPDecompositionTest
Running jsat.linear.SingularValueDecompositionTest
solve
solve
solve
getRank
getRank
getInverseSingularValues
getInverseSingularValues
getPseudoInverse
getPseudoDet
getSingularValues
getNorm2
getCondition
Tests run: 12, Failures: 0, Errors: 0, Skipped: 0, Time elapsed: 0.075 sec - in jsat.linear.SingularValueDecompositionTest
Running jsat.linear.QRDecompositionTest
absDet
solve
solve
solve
Tests run: 4, Failures: 0, Errors: 0, Skipped: 0, Time elapsed: 0.022 sec - in jsat.linear.QRDecompositionTest
Running jsat.linear.GenericMatrixTest
swapRows
zeroOut
lup
lup
mutableTranspose
qr
qr
Tests run: 37, Failures: 0, Errors: 0, Skipped: 0, Time elapsed: 0.068 sec - in jsat.linear.GenericMatrixTest
Running jsat.linear.SparseVectorTest
set
clone
sortedCopy
min
max
sum
variance
median
skewness
kurtosis
dot
multiply
mutableAdd
mutableMultiply
mutableDivide
pNormDist
pNorm
normalize
mutablePairwiseMultiply
mutablePairwiseDivide
equals
equals
arrayCopy
applyFunction
applyIndexFunction
getNonZeroIterator
hashCode
isSparse
mutableAdd
get
nnz
zeroOut
setLength
length
increment
Tests run: 35, Failures: 0, Errors: 0, Skipped: 0, Time elapsed: 0.04 sec - in jsat.linear.SparseVectorTest
Running jsat.linear.DenseMatrixTest
swapRows
zeroOut
lup
lup
mutableTranspose
qr
qr
Tests run: 36, Failures: 0, Errors: 0, Skipped: 0, Time elapsed: 0.069 sec - in jsat.linear.DenseMatrixTest
Running jsat.linear.CholeskyDecompositionTest
Tests run: 5, Failures: 0, Errors: 0, Skipped: 0, Time elapsed: 0.008 sec - in jsat.linear.CholeskyDecompositionTest
Running jsat.linear.SparseMatrixTest
set
clone
changeSize
mutableAdd
mutableAdd
multiply
multiply
multiplyTranspose
multiplyTranspose_Executor
0 fin
1 fin
2 fin
3 fin
4 fin
5 fin
6 fin
7 fin
transposeMultiply
transposeMultiply
getRowView
mutableAdd
mutableAdd
multiply
mutableMultiply
mutableMultiply
transpose
get
rows
cols
isSparce
mutableAdd
swapRows
zeroOut
mutableTranspose
transposeMultiply
increment
Tests run: 28, Failures: 0, Errors: 0, Skipped: 0, Time elapsed: 0.026 sec - in jsat.linear.SparseMatrixTest
Running jsat.linear.Poly2VecTest
set
clone
getNonZeroIterator
isSparse
get
nnz
length
Tests run: 7, Failures: 0, Errors: 0, Skipped: 0, Time elapsed: 0.008 sec - in jsat.linear.Poly2VecTest
Running jsat.linear.EigenvalueDecompositionTest
testImageEigen5
testRealEigen3
testPascal5
testSymmetric70
testRealRandomGenerated
testRealRandomGeneratedLarge
testNonSquare
Tests run: 7, Failures: 0, Errors: 0, Skipped: 0, Time elapsed: 0.239 sec - in jsat.linear.EigenvalueDecompositionTest
Running jsat.linear.ConcatenatedVecTest
set
clone
getNonZeroIterator
isSparse
get
length
mutableAdd
Tests run: 7, Failures: 0, Errors: 0, Skipped: 0, Time elapsed: 0.001 sec - in jsat.linear.ConcatenatedVecTest
Running jsat.linear.distancemetrics.WeightedEuclideanDistanceTest
dist
isSymmetric
metricBound
Tests run: 3, Failures: 0, Errors: 0, Skipped: 0, Time elapsed: 0.006 sec - in jsat.linear.distancemetrics.WeightedEuclideanDistanceTest
Running jsat.linear.distancemetrics.ChebyshevDistanceTest
dist
isSymmetric
metricBound
Tests run: 3, Failures: 0, Errors: 0, Skipped: 0, Time elapsed: 0 sec - in jsat.linear.distancemetrics.ChebyshevDistanceTest
Running jsat.linear.distancemetrics.ManhattanDistanceTest
dist
isSymmetric
metricBound
Tests run: 3, Failures: 0, Errors: 0, Skipped: 0, Time elapsed: 0.002 sec - in jsat.linear.distancemetrics.ManhattanDistanceTest
Running jsat.linear.distancemetrics.EuclideanDistanceTest
dist
isSymmetric
metricBound
Tests run: 3, Failures: 0, Errors: 0, Skipped: 0, Time elapsed: 0.003 sec - in jsat.linear.distancemetrics.EuclideanDistanceTest
Running jsat.linear.distancemetrics.NormalizedEuclideanDistanceTest
dist
isSymmetric
dist
metricBound
Tests run: 4, Failures: 0, Errors: 0, Skipped: 0, Time elapsed: 0.132 sec - in jsat.linear.distancemetrics.NormalizedEuclideanDistanceTest
Running jsat.linear.distancemetrics.MahalanobisDistanceTest
dist
isSymmetric
dist
metricBound
Tests run: 4, Failures: 0, Errors: 0, Skipped: 0, Time elapsed: 0.035 sec - in jsat.linear.distancemetrics.MahalanobisDistanceTest
Running jsat.linear.distancemetrics.MinkowskiDistanceTest
dist
isSymmetric
metricBound
Tests run: 3, Failures: 0, Errors: 0, Skipped: 0, Time elapsed: 0.004 sec - in jsat.linear.distancemetrics.MinkowskiDistanceTest
Running jsat.linear.distancemetrics.CosineDistanceTest
dist
isSymmetric
metricBound
Tests run: 3, Failures: 0, Errors: 0, Skipped: 0, Time elapsed: 0.025 sec - in jsat.linear.distancemetrics.CosineDistanceTest
Running jsat.linear.distancemetrics.PearsonDistanceTest
correlation
correlation
Tests run: 2, Failures: 0, Errors: 0, Skipped: 0, Time elapsed: 0.002 sec - in jsat.linear.distancemetrics.PearsonDistanceTest
Running jsat.linear.distancemetrics.JaccardDistanceTest
dist
metricBound
isSymmetric
isSubadditive
isIndiscemible
supportsAcceleration
getAccelerationCache
getAccelerationCache
getQueryInfo
normalized
Tests run: 10, Failures: 0, Errors: 0, Skipped: 0, Time elapsed: 0.003 sec - in jsat.linear.distancemetrics.JaccardDistanceTest
Running jsat.linear.distancemetrics.SquaredEuclideanDistanceTest
dist
isSymmetric
metricBound
Tests run: 3, Failures: 0, Errors: 0, Skipped: 0, Time elapsed: 0.034 sec - in jsat.linear.distancemetrics.SquaredEuclideanDistanceTest
Running jsat.linear.MatrixOfVecsTest
swapRows
zeroOut
lup
lup
mutableTranspose
qr
qr
Tests run: 36, Failures: 0, Errors: 0, Skipped: 0, Time elapsed: 0.029 sec - in jsat.linear.MatrixOfVecsTest
Running jsat.linear.ShiftedVecTest
set
clone
min
max
variance
median
kurtosis
dot
mutableAdd
mutableMultiply
mutableDivide
pNorm
mutablePairwiseMultiply
mutablePairwiseDivide
getNonZeroIterator
isSparse
mutableAdd
get
zeroOut
length
increment
setShift
embedShift
mutableAdd
mean
standardDeviation
Tests run: 26, Failures: 0, Errors: 0, Skipped: 0, Time elapsed: 0.011 sec - in jsat.linear.ShiftedVecTest
Running jsat.linear.SubVectorTest
set
clone
getNonZeroIterator
isSparse
get
length
Tests run: 6, Failures: 0, Errors: 0, Skipped: 0, Time elapsed: 0.002 sec - in jsat.linear.SubVectorTest
Running jsat.linear.MatrixTest
OuterProductUpdate
OuterProductUpdate
eye
random
diag
diagMult
diagMult
isSymmetric
isSymmetric
pascal
Tests run: 10, Failures: 0, Errors: 0, Skipped: 0, Time elapsed: 0.007 sec - in jsat.linear.MatrixTest
Running jsat.linear.VecWithNormTest
set
clone
mutableAdd
mutableMultiply
mutableDivide
mutablePairwiseMultiply
mutableAdd
get
nnz
zeroOut
length
Tests run: 11, Failures: 0, Errors: 0, Skipped: 0, Time elapsed: 0.004 sec - in jsat.linear.VecWithNormTest
Running jsat.linear.solvers.ConjugateGradientTest
solve
solve
solveCGNR
solveCGNR
solve
Tests run: 5, Failures: 0, Errors: 0, Skipped: 0, Time elapsed: 0.002 sec - in jsat.linear.solvers.ConjugateGradientTest
Running jsat.linear.vectorcollection.lsh.RandomProjectionLSHTest
search
search
Tests run: 2, Failures: 0, Errors: 0, Skipped: 0, Time elapsed: 0.133 sec - in jsat.linear.vectorcollection.lsh.RandomProjectionLSHTest
Running jsat.linear.vectorcollection.lsh.E2LSHTest
searchR
Tests run: 1, Failures: 0, Errors: 0, Skipped: 0, Time elapsed: 0.007 sec - in jsat.linear.vectorcollection.lsh.E2LSHTest
Running jsat.linear.vectorcollection.VPTreeTest
search
search
search
Tests run: 3, Failures: 0, Errors: 0, Skipped: 0, Time elapsed: 0.615 sec - in jsat.linear.vectorcollection.VPTreeTest
Running jsat.linear.vectorcollection.CoverTreeTest
search
search
Tests run: 2, Failures: 0, Errors: 0, Skipped: 0, Time elapsed: 0.254 sec - in jsat.linear.vectorcollection.CoverTreeTest
Running jsat.linear.vectorcollection.RTreeTest
search
Tests run: 1, Failures: 0, Errors: 0, Skipped: 0, Time elapsed: 0.093 sec - in jsat.linear.vectorcollection.RTreeTest
Running jsat.linear.vectorcollection.BallTreeTest
search
search
search
Tests run: 3, Failures: 0, Errors: 0, Skipped: 0, Time elapsed: 3.628 sec - in jsat.linear.vectorcollection.BallTreeTest
Running jsat.linear.vectorcollection.VPTreeMVTest
search
search
search
Tests run: 3, Failures: 0, Errors: 0, Skipped: 0, Time elapsed: 0.501 sec - in jsat.linear.vectorcollection.VPTreeMVTest
Running jsat.linear.vectorcollection.KDTreeTest
search
search
search
Tests run: 3, Failures: 0, Errors: 0, Skipped: 0, Time elapsed: 2.136 sec - in jsat.linear.vectorcollection.KDTreeTest
Running jsat.linear.vectorcollection.VectorArrayTest
search
search
Tests run: 2, Failures: 0, Errors: 0, Skipped: 0, Time elapsed: 0.055 sec - in jsat.linear.vectorcollection.VectorArrayTest
Running jsat.linear.vectorcollection.RandomBallCoverTest
search
search
search
Tests run: 3, Failures: 0, Errors: 0, Skipped: 0, Time elapsed: 0.285 sec - in jsat.linear.vectorcollection.RandomBallCoverTest
Running jsat.linear.HessenbergFormTest
hess
hess
Tests run: 2, Failures: 0, Errors: 0, Skipped: 0, Time elapsed: 0.003 sec - in jsat.linear.HessenbergFormTest
Running jsat.driftdetectors.ADWINTest
addSample
Tests run: 1, Failures: 0, Errors: 0, Skipped: 0, Time elapsed: 0.027 sec - in jsat.driftdetectors.ADWINTest
Running jsat.driftdetectors.DDMTest
addSample
Tests run: 1, Failures: 0, Errors: 0, Skipped: 0, Time elapsed: 0.001 sec - in jsat.driftdetectors.DDMTest
Running jsat.classifiers.RocchioTest
clone
trainC
trainC
Tests run: 3, Failures: 0, Errors: 0, Skipped: 0, Time elapsed: 0.269 sec - in jsat.classifiers.RocchioTest
Running jsat.classifiers.bayesian.MultivariateNormalsTest
clone
trainC
trainC
Tests run: 3, Failures: 0, Errors: 0, Skipped: 0, Time elapsed: 0.118 sec - in jsat.classifiers.bayesian.MultivariateNormalsTest
Running jsat.classifiers.bayesian.MultinomialNaiveBayesTest
clone
trainC
trainC
Tests run: 3, Failures: 0, Errors: 0, Skipped: 0, Time elapsed: 0.266 sec - in jsat.classifiers.bayesian.MultinomialNaiveBayesTest
Running jsat.classifiers.bayesian.NaiveBayesTest
clone
trainC
trainC
Tests run: 3, Failures: 0, Errors: 0, Skipped: 0, Time elapsed: 0.011 sec - in jsat.classifiers.bayesian.NaiveBayesTest
Running jsat.classifiers.bayesian.NaiveBayesUpdateableTest
clone
trainC
trainC
testSetUpUpdate
Tests run: 4, Failures: 0, Errors: 0, Skipped: 0, Time elapsed: 0.003 sec - in jsat.classifiers.bayesian.NaiveBayesUpdateableTest
Running jsat.classifiers.bayesian.AODETest
clone
trainC
trainC
getSubEpochs
Tests run: 4, Failures: 0, Errors: 0, Skipped: 0, Time elapsed: 4.14 sec - in jsat.classifiers.bayesian.AODETest
Running jsat.classifiers.OneVSOneTest
clone
trainC
trainC
Tests run: 3, Failures: 0, Errors: 0, Skipped: 0, Time elapsed: 1.456 sec - in jsat.classifiers.OneVSOneTest
Running jsat.classifiers.linear.LinearSGDTest
binary classifiation
multi class classification
regression
Tests run: 3, Failures: 0, Errors: 0, Skipped: 0, Time elapsed: 0.226 sec - in jsat.classifiers.linear.LinearSGDTest
Running jsat.classifiers.linear.LinearL1SCDTest
train
trainC
Tests run: 2, Failures: 0, Errors: 0, Skipped: 0, Time elapsed: 0.183 sec - in jsat.classifiers.linear.LinearL1SCDTest
Running jsat.classifiers.linear.PassiveAggressiveTest
train
trainC
Tests run: 2, Failures: 0, Errors: 0, Skipped: 0, Time elapsed: 0.022 sec - in jsat.classifiers.linear.PassiveAggressiveTest
Running jsat.classifiers.linear.BBRTest
trainC
trainC
Tests run: 3, Failures: 0, Errors: 0, Skipped: 0, Time elapsed: 0.209 sec - in jsat.classifiers.linear.BBRTest
Running jsat.classifiers.linear.StochasticMultinomialLogisticRegressionTest
clone
trainC
Tests run: 2, Failures: 0, Errors: 0, Skipped: 0, Time elapsed: 0.091 sec - in jsat.classifiers.linear.StochasticMultinomialLogisticRegressionTest
Running jsat.classifiers.linear.SCWTest
TrainC_Full
TrainC_Diag
Tests run: 2, Failures: 0, Errors: 0, Skipped: 0, Time elapsed: 0.01 sec - in jsat.classifiers.linear.SCWTest
Running jsat.classifiers.linear.AROWTest
train_C
Tests run: 1, Failures: 0, Errors: 0, Skipped: 0, Time elapsed: 0.004 sec - in jsat.classifiers.linear.AROWTest
Running jsat.classifiers.linear.STGDTest
train
trainC
Tests run: 2, Failures: 0, Errors: 0, Skipped: 0, Time elapsed: 0.007 sec - in jsat.classifiers.linear.STGDTest
Running jsat.classifiers.linear.SCDTest
train
trainC
Tests run: 2, Failures: 0, Errors: 0, Skipped: 0, Time elapsed: 0.073 sec - in jsat.classifiers.linear.SCDTest
Running jsat.classifiers.linear.ROMMATest
supportsWeightedData
Tests run: 1, Failures: 0, Errors: 0, Skipped: 0, Time elapsed: 0.001 sec - in jsat.classifiers.linear.ROMMATest
Running jsat.classifiers.linear.LinearBatchTest
binary classifiation
multi class classification
regression
binary classifiation MT
testTrainWarmCMultieFast
multi class classification MT
regression MT
Tests run: 9, Failures: 0, Errors: 0, Skipped: 0, Time elapsed: 1.732 sec - in jsat.classifiers.linear.LinearBatchTest
Running jsat.classifiers.linear.kernelized.DUOLTest
clone
trainC
trainC
Tests run: 3, Failures: 0, Errors: 0, Skipped: 0, Time elapsed: 0.08 sec - in jsat.classifiers.linear.kernelized.DUOLTest
Running jsat.classifiers.linear.kernelized.KernelPointTest
getSqrdNorm
dot_KernelPoint
dot_Vec
distance_Vec
distance_KernelPoint
Tests run: 5, Failures: 0, Errors: 0, Skipped: 0, Time elapsed: 0.033 sec - in jsat.classifiers.linear.kernelized.KernelPointTest
Running jsat.classifiers.linear.kernelized.ForgetronTest
clone
trainC
trainC
Tests run: 3, Failures: 0, Errors: 0, Skipped: 0, Time elapsed: 1.231 sec - in jsat.classifiers.linear.kernelized.ForgetronTest
Running jsat.classifiers.linear.kernelized.CSKLRTest
clone
trainC
trainC
Tests run: 3, Failures: 0, Errors: 0, Skipped: 0, Time elapsed: 0.155 sec - in jsat.classifiers.linear.kernelized.CSKLRTest
Running jsat.classifiers.linear.kernelized.KernelSGDTest
train
clone
trainC
trainC
trainC
trainC
train
Tests run: 7, Failures: 0, Errors: 0, Skipped: 0, Time elapsed: 0.427 sec - in jsat.classifiers.linear.kernelized.KernelSGDTest
Running jsat.classifiers.linear.kernelized.CSKLRBatchTest
clone
trainC
trainC
Serializable
Tests run: 4, Failures: 0, Errors: 0, Skipped: 0, Time elapsed: 3.612 sec - in jsat.classifiers.linear.kernelized.CSKLRBatchTest
Running jsat.classifiers.linear.kernelized.ALMA2KTest
clone
trainC
trainC
Tests run: 3, Failures: 0, Errors: 0, Skipped: 0, Time elapsed: 0.08 sec - in jsat.classifiers.linear.kernelized.ALMA2KTest
Running jsat.classifiers.linear.kernelized.BOGDTest
clone
trainC
trainC
Tests run: 3, Failures: 0, Errors: 0, Skipped: 0, Time elapsed: 0.029 sec - in jsat.classifiers.linear.kernelized.BOGDTest
Running jsat.classifiers.linear.kernelized.OSKLTest
clone
trainC
trainC
Tests run: 3, Failures: 0, Errors: 0, Skipped: 0, Time elapsed: 0.099 sec - in jsat.classifiers.linear.kernelized.OSKLTest
Running jsat.classifiers.linear.kernelized.ProjectronTest
clone
trainC
trainC
Tests run: 3, Failures: 0, Errors: 0, Skipped: 0, Time elapsed: 0.035 sec - in jsat.classifiers.linear.kernelized.ProjectronTest
Running jsat.classifiers.linear.ALMA2Test
classify
Tests run: 1, Failures: 0, Errors: 0, Skipped: 0, Time elapsed: 0.007 sec - in jsat.classifiers.linear.ALMA2Test
Running jsat.classifiers.linear.SMIDASTest
train
trainC
Tests run: 2, Failures: 0, Errors: 0, Skipped: 0, Time elapsed: 0.03 sec - in jsat.classifiers.linear.SMIDASTest
Running jsat.classifiers.linear.LogisticRegressionDCDTest
trainC
trainC
Tests run: 2, Failures: 0, Errors: 0, Skipped: 0, Time elapsed: 0.014 sec - in jsat.classifiers.linear.LogisticRegressionDCDTest
Running jsat.classifiers.linear.NHERDTest
train_C
Tests run: 1, Failures: 0, Errors: 0, Skipped: 0, Time elapsed: 0.009 sec - in jsat.classifiers.linear.NHERDTest
Running jsat.classifiers.linear.SDCATest
trainR
trainC
trainC
testScale
train
testWarm
Tests run: 6, Failures: 0, Errors: 0, Skipped: 0, Time elapsed: 10.158 sec - in jsat.classifiers.linear.SDCATest
Running jsat.classifiers.linear.NewGLMNETTest
train
Tests run: 2, Failures: 0, Errors: 0, Skipped: 0, Time elapsed: 0.315 sec - in jsat.classifiers.linear.NewGLMNETTest
Running jsat.classifiers.knn.LWLTest
train
train
clone
trainC
trainC
Tests run: 5, Failures: 0, Errors: 0, Skipped: 0, Time elapsed: 0.568 sec - in jsat.classifiers.knn.LWLTest
Running jsat.classifiers.knn.DANNTest
clone
trainC
trainC
Tests run: 3, Failures: 0, Errors: 0, Skipped: 0, Time elapsed: 0.024 sec - in jsat.classifiers.knn.DANNTest
Running jsat.classifiers.knn.NearestNeighbourTest
train
train
clone
trainC
trainC
Tests run: 5, Failures: 0, Errors: 0, Skipped: 0, Time elapsed: 0.099 sec - in jsat.classifiers.knn.NearestNeighbourTest
Running jsat.classifiers.neuralnetwork.BackPropagationNetTest
trainC
trainC
Tests run: 2, Failures: 0, Errors: 0, Skipped: 0, Time elapsed: 5.145 sec - in jsat.classifiers.neuralnetwork.BackPropagationNetTest
Running jsat.classifiers.neuralnetwork.PerceptronTest
trainC
trainC
trainCOnline
Tests run: 3, Failures: 0, Errors: 0, Skipped: 0, Time elapsed: 0.01 sec - in jsat.classifiers.neuralnetwork.PerceptronTest
Running jsat.classifiers.neuralnetwork.LVQTest
clone
trainC
trainC
Tests run: 3, Failures: 0, Errors: 0, Skipped: 0, Time elapsed: 0.709 sec - in jsat.classifiers.neuralnetwork.LVQTest
Running jsat.classifiers.neuralnetwork.LVQLLCTest
clone
trainC
trainC
Tests run: 3, Failures: 0, Errors: 0, Skipped: 0, Time elapsed: 0.762 sec - in jsat.classifiers.neuralnetwork.LVQLLCTest
Running jsat.classifiers.neuralnetwork.SOMTest
clone
trainC
trainC
Tests run: 3, Failures: 0, Errors: 0, Skipped: 0, Time elapsed: 10.52 sec - in jsat.classifiers.neuralnetwork.SOMTest
Running jsat.classifiers.neuralnetwork.RBFNetTest
train
trainC
trainC
train
Tests run: 4, Failures: 0, Errors: 0, Skipped: 0, Time elapsed: 1.83 sec - in jsat.classifiers.neuralnetwork.RBFNetTest
Running jsat.classifiers.neuralnetwork.DReDNetSimpleTest
trainC
trainC
Tests run: 2, Failures: 0, Errors: 0, Skipped: 0, Time elapsed: 3.582 sec - in jsat.classifiers.neuralnetwork.DReDNetSimpleTest
Running jsat.classifiers.DDAGTest
clone
trainC
trainC
Tests run: 3, Failures: 0, Errors: 0, Skipped: 0, Time elapsed: 1.264 sec - in jsat.classifiers.DDAGTest
Running jsat.classifiers.calibration.PlattCalibrationTest
clone
calibrate
Tests run: 2, Failures: 0, Errors: 0, Skipped: 0, Time elapsed: 0.28 sec - in jsat.classifiers.calibration.PlattCalibrationTest
Running jsat.classifiers.calibration.IsotonicCalibrationTest
clone
calibrate
Tests run: 2, Failures: 0, Errors: 0, Skipped: 0, Time elapsed: 0.241 sec - in jsat.classifiers.calibration.IsotonicCalibrationTest
Running jsat.classifiers.svm.DCDTest
train
trainC
trainC
train
Tests run: 4, Failures: 0, Errors: 0, Skipped: 0, Time elapsed: 1.263 sec - in jsat.classifiers.svm.DCDTest
Running jsat.classifiers.svm.PegasosKTest
trainC
trainC
Tests run: 2, Failures: 0, Errors: 0, Skipped: 0, Time elapsed: 1.334 sec - in jsat.classifiers.svm.PegasosKTest
Running jsat.classifiers.svm.PlattSMOTest
train
trainC
trainC
train
Tests run: 7, Failures: 0, Errors: 0, Skipped: 0, Time elapsed: 1.983 sec - in jsat.classifiers.svm.PlattSMOTest
Running jsat.classifiers.svm.extended.CPMTest
clone
trainC
Tests run: 2, Failures: 0, Errors: 0, Skipped: 0, Time elapsed: 5.848 sec - in jsat.classifiers.svm.extended.CPMTest
Running jsat.classifiers.svm.extended.AMMTest
clone
trainC
getSubEpochs
Tests run: 3, Failures: 0, Errors: 0, Skipped: 0, Time elapsed: 1.386 sec - in jsat.classifiers.svm.extended.AMMTest
Running jsat.classifiers.svm.DCSVMTest
trainC
trainC
Tests run: 2, Failures: 0, Errors: 0, Skipped: 0, Time elapsed: 32.804 sec - in jsat.classifiers.svm.DCSVMTest
Running jsat.classifiers.svm.SVMnoBiasTest
trainC
trainC
Tests run: 2, Failures: 0, Errors: 0, Skipped: 0, Time elapsed: 2.921 sec - in jsat.classifiers.svm.SVMnoBiasTest
Running jsat.classifiers.svm.SBPTest
trainC
trainC
Tests run: 2, Failures: 0, Errors: 0, Skipped: 0, Time elapsed: 0.061 sec - in jsat.classifiers.svm.SBPTest
Running jsat.classifiers.svm.DCDsTest
train
trainC
trainC
train
Tests run: 6, Failures: 0, Errors: 0, Skipped: 0, Time elapsed: 1.686 sec - in jsat.classifiers.svm.DCDsTest
Running jsat.classifiers.svm.PegasosTest
trainC
Tests run: 1, Failures: 0, Errors: 0, Skipped: 0, Time elapsed: 0.061 sec - in jsat.classifiers.svm.PegasosTest
Running jsat.classifiers.svm.LSSVMTest
train
trainC
trainC
train
Tests run: 6, Failures: 0, Errors: 0, Skipped: 0, Time elapsed: 3.806 sec - in jsat.classifiers.svm.LSSVMTest
Running jsat.classifiers.OneVSAllTest
clone
trainC
trainC
Tests run: 3, Failures: 0, Errors: 0, Skipped: 0, Time elapsed: 4.831 sec - in jsat.classifiers.OneVSAllTest
Running jsat.classifiers.trees.DecisionStumpTest
clone
trainC(ClassificationDataSet, ExecutorService)
trainC(ClassificationDataSet)
trainC(ClassificationDataSet, ExecutorService)
trainC(ClassificationDataSet, ExecutorService)
trainR(RegressionDataSet, ExecutorService)
trainR(RegressionDataSet, ExecutorService)
trainC(List<DataPointPair>, Set<integer>)
supportsWeightedData
testInfoGainSplit
testInfoGainRatioSplit
testGiniSplit
testNumericCBinary
Tests run: 13, Failures: 0, Errors: 0, Skipped: 0, Time elapsed: 0.029 sec - in jsat.classifiers.trees.DecisionStumpTest
Running jsat.classifiers.trees.RandomForestTest
train
train
clone
trainC
trainC
train
trainC
Tests run: 7, Failures: 0, Errors: 0, Skipped: 0, Time elapsed: 5.041 sec - in jsat.classifiers.trees.RandomForestTest
Running jsat.classifiers.trees.MDITest
getImportanceStats
Tests run: 1, Failures: 0, Errors: 0, Skipped: 0, Time elapsed: 13.348 sec - in jsat.classifiers.trees.MDITest
Running jsat.classifiers.trees.MDATest
getImportanceStatsR
getImportanceStats
Tests run: 2, Failures: 0, Errors: 0, Skipped: 0, Time elapsed: 2.9 sec - in jsat.classifiers.trees.MDATest
Running jsat.classifiers.trees.ERTreesTest
train
train
clone
trainC
trainC
Tests run: 5, Failures: 0, Errors: 0, Skipped: 0, Time elapsed: 29.063 sec - in jsat.classifiers.trees.ERTreesTest
Running jsat.classifiers.trees.ImportanceByUsesTest
getImportanceStats
Tests run: 1, Failures: 0, Errors: 0, Skipped: 0, Time elapsed: 4.578 sec - in jsat.classifiers.trees.ImportanceByUsesTest
Running jsat.classifiers.trees.DecisionTreeTest
train
train
clone
trainC
trainC
trainC
train
Tests run: 7, Failures: 0, Errors: 0, Skipped: 0, Time elapsed: 13.427 sec - in jsat.classifiers.trees.DecisionTreeTest
Running jsat.classifiers.boosting.StackingTest
binary classifiation
regression
binary classifiation MT
multi class classification MT
regression MT
Tests run: 6, Failures: 0, Errors: 0, Skipped: 0, Time elapsed: 10.811 sec - in jsat.classifiers.boosting.StackingTest
Running jsat.classifiers.boosting.ModestAdaBoostTest
clone
trainC
trainC
Tests run: 3, Failures: 0, Errors: 0, Skipped: 0, Time elapsed: 0.758 sec - in jsat.classifiers.boosting.ModestAdaBoostTest
Running jsat.classifiers.boosting.EmphasisBoostTest
clone
trainC
trainC
Tests run: 3, Failures: 0, Errors: 0, Skipped: 0, Time elapsed: 0.531 sec - in jsat.classifiers.boosting.EmphasisBoostTest
Running jsat.classifiers.boosting.AdaBoostM1Test
clone
trainC
trainC
Tests run: 3, Failures: 0, Errors: 0, Skipped: 0, Time elapsed: 0.328 sec - in jsat.classifiers.boosting.AdaBoostM1Test
Running jsat.classifiers.boosting.LogitBoostPLTest
clone
trainC
trainC
Tests run: 3, Failures: 0, Errors: 0, Skipped: 0, Time elapsed: 2.105 sec - in jsat.classifiers.boosting.LogitBoostPLTest
Running jsat.classifiers.boosting.LogitBoostTest
clone
trainC
trainC
Tests run: 3, Failures: 0, Errors: 0, Skipped: 0, Time elapsed: 4.532 sec - in jsat.classifiers.boosting.LogitBoostTest
Running jsat.classifiers.boosting.SAMMETest
clone
trainC
trainC
Tests run: 3, Failures: 0, Errors: 0, Skipped: 0, Time elapsed: 0.906 sec - in jsat.classifiers.boosting.SAMMETest
Running jsat.classifiers.boosting.UpdatableStackingTest
binary classifiation
regression
Tests run: 3, Failures: 0, Errors: 0, Skipped: 0, Time elapsed: 0.135 sec - in jsat.classifiers.boosting.UpdatableStackingTest
Running jsat.classifiers.boosting.WaggingNormalTest
train
train
clone
trainC
trainC
Tests run: 5, Failures: 0, Errors: 0, Skipped: 0, Time elapsed: 2.109 sec - in jsat.classifiers.boosting.WaggingNormalTest
Running jsat.classifiers.boosting.BaggingTest
train
train
clone
trainC
trainC
Tests run: 5, Failures: 0, Errors: 0, Skipped: 0, Time elapsed: 4.212 sec - in jsat.classifiers.boosting.BaggingTest
Running jsat.classifiers.boosting.ArcX4Test
clone
trainC
trainC
Tests run: 3, Failures: 0, Errors: 0, Skipped: 0, Time elapsed: 0.923 sec - in jsat.classifiers.boosting.ArcX4Test
Running jsat.classifiers.imbalance.SMOTETest
trainC
trainC
Tests run: 2, Failures: 0, Errors: 0, Skipped: 0, Time elapsed: 0.012 sec - in jsat.classifiers.imbalance.SMOTETest
Running jsat.classifiers.imbalance.BorderlineSMOTETest
trainC
trainC
Tests run: 2, Failures: 0, Errors: 0, Skipped: 0, Time elapsed: 0.036 sec - in jsat.classifiers.imbalance.BorderlineSMOTETest
Running jsat.classifiers.evaluation.AUCTest
getScore
Tests run: 1, Failures: 0, Errors: 0, Skipped: 0, Time elapsed: 0.003 sec - in jsat.classifiers.evaluation.AUCTest
Running jsat.classifiers.evaluation.FbetaScoreTest
getScore
Tests run: 1, Failures: 0, Errors: 0, Skipped: 0, Time elapsed: 0.002 sec - in jsat.classifiers.evaluation.FbetaScoreTest
Running jsat.classifiers.evaluation.KappaTest
getScore
Tests run: 1, Failures: 0, Errors: 0, Skipped: 0, Time elapsed: 0.002 sec - in jsat.classifiers.evaluation.KappaTest
Running jsat.classifiers.evaluation.F1ScoreTest
getScore
Tests run: 1, Failures: 0, Errors: 0, Skipped: 0, Time elapsed: 0.001 sec - in jsat.classifiers.evaluation.F1ScoreTest
Running jsat.classifiers.evaluation.LogLossTest
getScore
Tests run: 1, Failures: 0, Errors: 0, Skipped: 0, Time elapsed: 0.001 sec - in jsat.classifiers.evaluation.LogLossTest
Running jsat.classifiers.evaluation.AccuracyTest
getScore
Tests run: 1, Failures: 0, Errors: 0, Skipped: 0, Time elapsed: 0.001 sec - in jsat.classifiers.evaluation.AccuracyTest
Running jsat.classifiers.evaluation.PrecisionTest
getScore
Tests run: 1, Failures: 0, Errors: 0, Skipped: 0, Time elapsed: 0.002 sec - in jsat.classifiers.evaluation.PrecisionTest
Running jsat.classifiers.evaluation.RecallTest
getScore
Tests run: 1, Failures: 0, Errors: 0, Skipped: 0, Time elapsed: 0.002 sec - in jsat.classifiers.evaluation.RecallTest
Running jsat.classifiers.evaluation.MatthewsCorrelationCoefficientTest
getScore
Tests run: 1, Failures: 0, Errors: 0, Skipped: 0, Time elapsed: 0.001 sec - in jsat.classifiers.evaluation.MatthewsCorrelationCoefficientTest
Running jsat.math.optimization.NelderMeadTest
optimize
optimize
optimize
Tests run: 3, Failures: 0, Errors: 0, Skipped: 0, Time elapsed: 0.005 sec - in jsat.math.optimization.NelderMeadTest
Running jsat.math.optimization.oned.GoldenSearchTest
findMin
Tests run: 1, Failures: 0, Errors: 0, Skipped: 0, Time elapsed: 0.001 sec - in jsat.math.optimization.oned.GoldenSearchTest
Running jsat.math.optimization.stochastic.SGDMomentumTest
update
update
Tests run: 2, Failures: 0, Errors: 0, Skipped: 0, Time elapsed: 0.52 sec - in jsat.math.optimization.stochastic.SGDMomentumTest
Running jsat.math.optimization.stochastic.RMSPropTest
update
update
Tests run: 2, Failures: 0, Errors: 0, Skipped: 0, Time elapsed: 0.416 sec - in jsat.math.optimization.stochastic.RMSPropTest
Running jsat.math.optimization.stochastic.AdaGradTest
update
update
Tests run: 2, Failures: 0, Errors: 0, Skipped: 0, Time elapsed: 0.33 sec - in jsat.math.optimization.stochastic.AdaGradTest
Running jsat.math.optimization.stochastic.RpropTest
update
update
Tests run: 2, Failures: 0, Errors: 0, Skipped: 0, Time elapsed: 0.097 sec - in jsat.math.optimization.stochastic.RpropTest
Running jsat.math.optimization.stochastic.AdamTest
update
update
Tests run: 2, Failures: 1, Errors: 0, Skipped: 0, Time elapsed: 1.126 sec <<< FAILURE! - in jsat.math.optimization.stochastic.AdamTest
testUpdate_5args(jsat.math.optimization.stochastic.AdamTest)  Time elapsed: 0.581 sec  <<< FAILURE!
java.lang.AssertionError: expected:<0.0> but was:<758217.1782285534>
	at org.junit.Assert.fail(Assert.java:93)
	at org.junit.Assert.failNotEquals(Assert.java:647)
	at org.junit.Assert.assertEquals(Assert.java:443)
	at org.junit.Assert.assertEquals(Assert.java:512)
	at jsat.math.optimization.stochastic.AdamTest.testUpdate_5args(AdamTest.java:119)

Running jsat.math.optimization.stochastic.AdaDeltaTest
update
update
Tests run: 2, Failures: 0, Errors: 0, Skipped: 0, Time elapsed: 0.343 sec - in jsat.math.optimization.stochastic.AdaDeltaTest
Running jsat.math.optimization.stochastic.NAdaGradTest
update
update
update
Tests run: 3, Failures: 0, Errors: 0, Skipped: 0, Time elapsed: 0.528 sec - in jsat.math.optimization.stochastic.NAdaGradTest
Running jsat.math.optimization.stochastic.SimpleSGDTest
update
update
Tests run: 2, Failures: 0, Errors: 0, Skipped: 0, Time elapsed: 0.131 sec - in jsat.math.optimization.stochastic.SimpleSGDTest
Running jsat.math.optimization.ModifiedOWLQNTest
optimize
optimize
optimize
Tests run: 3, Failures: 0, Errors: 0, Skipped: 0, Time elapsed: 0.069 sec - in jsat.math.optimization.ModifiedOWLQNTest
Running jsat.math.optimization.LBFGSTest
optimize
Tests run: 1, Failures: 0, Errors: 0, Skipped: 0, Time elapsed: 0.004 sec - in jsat.math.optimization.LBFGSTest
Running jsat.math.optimization.BFGSTest
optimize
Tests run: 1, Failures: 0, Errors: 0, Skipped: 0, Time elapsed: 0.003 sec - in jsat.math.optimization.BFGSTest
Running jsat.math.FastMathTest
log2
log2_2pd1
log2_c11
pow2
pow2
pow
log
exp
digamma
Tests run: 9, Failures: 0, Errors: 0, Skipped: 0, Time elapsed: 0.084 sec - in jsat.math.FastMathTest
Running jsat.math.SpecialMathTest
digamma
digamma
reLnBn
bernoulli
Tests run: 4, Failures: 0, Errors: 0, Skipped: 0, Time elapsed: 0.002 sec - in jsat.math.SpecialMathTest
Running jsat.math.ComplexTest
clone
multiply
I
getReal
getImag
mutableAdd
mutableAdd
add
mutableSubtract
mutableSubtract
subtract
cMul
mutableMultiply
mutableMultiply
cDiv
mutableDivide
mutableDivide
divide
getMagnitude
getArg
mutateConjugate
getConjugate
Tests run: 22, Failures: 0, Errors: 0, Skipped: 0, Time elapsed: 0.004 sec - in jsat.math.ComplexTest
Running jsat.math.OnLineStatisticsTest
add(double)
add(double, double)
remove
add
Tests run: 4, Failures: 0, Errors: 0, Skipped: 0, Time elapsed: 0 sec - in jsat.math.OnLineStatisticsTest
Running jsat.math.MathTricksTest
logSumExp
logSumExp
softmax
softmax
hornerPolyR
hornerPoly
Tests run: 6, Failures: 0, Errors: 0, Skipped: 0, Time elapsed: 0.001 sec - in jsat.math.MathTricksTest
Running jsat.math.ExponentialMovingStatisticsTest
setSmoothing
setSmoothing Drift
Tests run: 2, Failures: 0, Errors: 0, Skipped: 0, Time elapsed: 1.663 sec - in jsat.math.ExponentialMovingStatisticsTest
Running jsat.math.rootfinding.SecantTest
root
root
root
root
Tests run: 4, Failures: 0, Errors: 0, Skipped: 0, Time elapsed: 0.003 sec - in jsat.math.rootfinding.SecantTest
Running jsat.math.rootfinding.BisectionTest
root
root
root
root
Tests run: 4, Failures: 0, Errors: 0, Skipped: 0, Time elapsed: 0.005 sec - in jsat.math.rootfinding.BisectionTest
Running jsat.math.rootfinding.ZeroinTest
root
root
root
root
Tests run: 4, Failures: 0, Errors: 0, Skipped: 0, Time elapsed: 0.007 sec - in jsat.math.rootfinding.ZeroinTest
Running jsat.math.rootfinding.RiddersMethodTest
root
root
root
root
Tests run: 4, Failures: 0, Errors: 0, Skipped: 0, Time elapsed: 0.004 sec - in jsat.math.rootfinding.RiddersMethodTest
Running jsat.datatransform.JLTransformTest
transform
Tests run: 1, Failures: 0, Errors: 0, Skipped: 0, Time elapsed: 1.019 sec - in jsat.datatransform.JLTransformTest
Running jsat.datatransform.RemoveAttributeTransformTest
clone
consolidate
transform
Tests run: 3, Failures: 0, Errors: 0, Skipped: 0, Time elapsed: 0.001 sec - in jsat.datatransform.RemoveAttributeTransformTest
Running jsat.datatransform.kernel.NystromTest
clone
trainC
trainC
Tests run: 3, Failures: 0, Errors: 0, Skipped: 0, Time elapsed: 4.276 sec - in jsat.datatransform.kernel.NystromTest
Running jsat.datatransform.kernel.KernelPCATest
clone
trainC
trainC
Tests run: 3, Failures: 0, Errors: 0, Skipped: 0, Time elapsed: 0.443 sec - in jsat.datatransform.kernel.KernelPCATest
Running jsat.datatransform.kernel.RFF_RBFTest
clone
trainC
trainC
Tests run: 3, Failures: 0, Errors: 0, Skipped: 0, Time elapsed: 0.29 sec - in jsat.datatransform.kernel.RFF_RBFTest
Running jsat.datatransform.ImputerTest
fit
Tests run: 1, Failures: 0, Errors: 0, Skipped: 0, Time elapsed: 0.181 sec - in jsat.datatransform.ImputerTest
Running jsat.datatransform.visualization.MDSTest
transform
Tests run: 1, Failures: 0, Errors: 0, Skipped: 0, Time elapsed: 0.049 sec - in jsat.datatransform.visualization.MDSTest
Running jsat.datatransform.visualization.TSNETest
transform
Tests run: 1, Failures: 0, Errors: 0, Skipped: 0, Time elapsed: 2.51 sec - in jsat.datatransform.visualization.TSNETest
Running jsat.datatransform.visualization.IsomapTest
transform
Tests run: 1, Failures: 0, Errors: 1, Skipped: 0, Time elapsed: 1.463 sec <<< FAILURE! - in jsat.datatransform.visualization.IsomapTest
testTransform_DataSet_ExecutorService(jsat.datatransform.visualization.IsomapTest)  Time elapsed: 1.461 sec  <<< ERROR!
java.lang.ArithmeticException: Can not add a value Infinity
	at jsat.linear.Matrix.increment(Matrix.java:552)
	at jsat.datatransform.visualization.MDS.transform(MDS.java:263)
	at jsat.datatransform.visualization.Isomap.transform(Isomap.java:311)
	at jsat.datatransform.visualization.IsomapTest.testTransform_DataSet_ExecutorService(IsomapTest.java:128)

Running jsat.datatransform.visualization.LargeVizTest
transform
transform
Tests run: 2, Failures: 0, Errors: 0, Skipped: 0, Time elapsed: 3.971 sec - in jsat.datatransform.visualization.LargeVizTest
Running jsat.datatransform.WhitenedZCATest
testTransform
Tests run: 1, Failures: 0, Errors: 0, Skipped: 0, Time elapsed: 0.005 sec - in jsat.datatransform.WhitenedZCATest
Running jsat.datatransform.WhitenedPCATest
testTransform
Tests run: 1, Failures: 0, Errors: 0, Skipped: 0, Time elapsed: 0.001 sec - in jsat.datatransform.WhitenedPCATest
Running jsat.datatransform.FastICATest
transform
transform
transform
Tests run: 3, Failures: 0, Errors: 0, Skipped: 0, Time elapsed: 0.019 sec - in jsat.datatransform.FastICATest
Running jsat.datatransform.featureselection.SBSTest
transformC
transformR
Tests run: 2, Failures: 0, Errors: 0, Skipped: 0, Time elapsed: 0.247 sec - in jsat.datatransform.featureselection.SBSTest
Running jsat.datatransform.featureselection.LRSTest
transformC
transformR
Tests run: 2, Failures: 0, Errors: 0, Skipped: 0, Time elapsed: 0.499 sec - in jsat.datatransform.featureselection.LRSTest
Running jsat.datatransform.featureselection.SFSTest
transform
transformR
Tests run: 2, Failures: 0, Errors: 0, Skipped: 0, Time elapsed: 0.066 sec - in jsat.datatransform.featureselection.SFSTest
Running jsat.datatransform.featureselection.MutualInfoFSTest
Tests run: 1, Failures: 0, Errors: 0, Skipped: 0, Time elapsed: 0.003 sec - in jsat.datatransform.featureselection.MutualInfoFSTest
Running jsat.datatransform.featureselection.ReliefFTest
transformC
Tests run: 1, Failures: 0, Errors: 0, Skipped: 0, Time elapsed: 0.014 sec - in jsat.datatransform.featureselection.ReliefFTest
Running jsat.datatransform.featureselection.BDSTest
transformC
transformR
Tests run: 2, Failures: 0, Errors: 0, Skipped: 0, Time elapsed: 0.16 sec - in jsat.datatransform.featureselection.BDSTest
Running jsat.datatransform.PCATest
transform
Tests run: 1, Failures: 0, Errors: 0, Skipped: 0, Time elapsed: 0.006 sec - in jsat.datatransform.PCATest
Running jsat.clustering.HDBSCANTest
cluster(dataset)
cluster(dataset, executorService)
Tests run: 2, Failures: 0, Errors: 0, Skipped: 0, Time elapsed: 0.106 sec - in jsat.clustering.HDBSCANTest
Running jsat.clustering.MeanShiftTest
cluster(dataset)
cluster(dataset, ExecutorService)
Tests run: 2, Failures: 0, Errors: 0, Skipped: 0, Time elapsed: 0.446 sec - in jsat.clustering.MeanShiftTest
Running jsat.clustering.FLAMETest
cluster(dataset)
cluster(dataset, ExecutorService)
Tests run: 2, Failures: 0, Errors: 0, Skipped: 0, Time elapsed: 3.461 sec - in jsat.clustering.FLAMETest
Running jsat.clustering.GapStatisticTest
cluster findK
Tests run: 1, Failures: 0, Errors: 0, Skipped: 0, Time elapsed: 18.403 sec - in jsat.clustering.GapStatisticTest
Running jsat.clustering.hierarchical.NNChainHACTest
cluster(dataset)
cluster(dataset, ExecutorService)
cluster(dataset, int, int)
cluster(dataset, int, int, ExecutorService)
cluster(dataset, int, ExecutorService)
cluster(dataset, int)
Tests run: 6, Failures: 0, Errors: 0, Skipped: 0, Time elapsed: 4.649 sec - in jsat.clustering.hierarchical.NNChainHACTest
Running jsat.clustering.hierarchical.DivisiveGlobalClustererTest
cluster(dataset)
cluster(dataset, ExecutorService)
cluster(dataset, int, int)
cluster(dataset, int, int, ExecutorService)
cluster(dataset, int, ExecutorService)
cluster(dataset, int)
Tests run: 6, Failures: 0, Errors: 0, Skipped: 0, Time elapsed: 0.339 sec - in jsat.clustering.hierarchical.DivisiveGlobalClustererTest
Running jsat.clustering.hierarchical.PriorityHACTest
cluster(dataset)
cluster(dataset, ExecutorService)
cluster(dataset, int, int)
cluster(dataset, int, int, ExecutorService)
cluster(dataset, int, ExecutorService)
cluster(dataset, int)
Tests run: 6, Failures: 0, Errors: 0, Skipped: 0, Time elapsed: 0.793 sec - in jsat.clustering.hierarchical.PriorityHACTest
Running jsat.clustering.hierarchical.SimpleHACTest
cluster(dataset)
cluster(dataset, ExecutorService)
cluster(dataset, int, int)
cluster(dataset, int, int, ExecutorService)
cluster(dataset, int, ExecutorService)
cluster(dataset, int)
Tests run: 6, Failures: 0, Errors: 0, Skipped: 0, Time elapsed: 5.21 sec - in jsat.clustering.hierarchical.SimpleHACTest
Running jsat.clustering.hierarchical.DivisiveLocalClustererTest
cluster(dataset, int, ExecutorService)
cluster(dataset, int)
Tests run: 2, Failures: 0, Errors: 0, Skipped: 0, Time elapsed: 0.85 sec - in jsat.clustering.hierarchical.DivisiveLocalClustererTest
Running jsat.clustering.DBSCANTest
cluster(dataset)
cluster(dataset, executorService)
cluster(dataset, int)
cluster(dataset, double, int)
cluster(dataset, int, executorService)
cluster(dataset, double, int, executorService)
Tests run: 6, Failures: 0, Errors: 0, Skipped: 0, Time elapsed: 0.135 sec - in jsat.clustering.DBSCANTest
Running jsat.clustering.LSDBCTest
cluster(dataset)
cluster(dataset, ExecutorService)
Tests run: 2, Failures: 0, Errors: 0, Skipped: 0, Time elapsed: 0.033 sec - in jsat.clustering.LSDBCTest
Running jsat.clustering.OPTICSTest
cluster(dataset)
cluster(dataset, ExecutorService)
Tests run: 2, Failures: 0, Errors: 0, Skipped: 0, Time elapsed: 0.113 sec - in jsat.clustering.OPTICSTest
Running jsat.clustering.PAMTest
cluster(dataset, int)
cluster(dataSet, int, ExecutorService)
Tests run: 2, Failures: 0, Errors: 0, Skipped: 0, Time elapsed: 0.236 sec - in jsat.clustering.PAMTest
Running jsat.clustering.EMGaussianMixtureTest
cluster(dataset, int, threadpool)
Tests run: 1, Failures: 0, Errors: 0, Skipped: 0, Time elapsed: 0.027 sec - in jsat.clustering.EMGaussianMixtureTest
Running jsat.clustering.TRIKMEDSTest
cluster(dataset, int)
cluster(dataSet, int, ExecutorService)
cluster(dataset, int)
cluster(dataset, int)
Tests run: 4, Failures: 0, Errors: 0, Skipped: 0, Time elapsed: 0.66 sec - in jsat.clustering.TRIKMEDSTest
Running jsat.clustering.CLARATest
cluster(dataset, int, ExecutorService)
cluster(dataset, int, ExecutorService)
cluster(dataset, int)
Tests run: 3, Failures: 0, Errors: 0, Skipped: 0, Time elapsed: 0.847 sec - in jsat.clustering.CLARATest
Running jsat.clustering.kmeans.ElkanKMeansTest
cluster(dataset, int)
cluster(dataset, int, threadpool)
cluster(dataset, int, threadpool)
Tests run: 3, Failures: 0, Errors: 0, Skipped: 0, Time elapsed: 0.155 sec - in jsat.clustering.kmeans.ElkanKMeansTest
Running jsat.clustering.kmeans.NaiveKMeansTest
cluster
cluster(dataset, int, threadpool)
cluster
Tests run: 3, Failures: 0, Errors: 0, Skipped: 0, Time elapsed: 0.067 sec - in jsat.clustering.kmeans.NaiveKMeansTest
Running jsat.clustering.kmeans.HamerlyKMeansTest
cluster
cluster(dataset, int, threadpool)
cluster
Tests run: 3, Failures: 0, Errors: 0, Skipped: 0, Time elapsed: 0.081 sec - in jsat.clustering.kmeans.HamerlyKMeansTest
Running jsat.clustering.kmeans.MiniBatchKMeansTest
cluster
cluster
Tests run: 2, Failures: 0, Errors: 0, Skipped: 0, Time elapsed: 0.119 sec - in jsat.clustering.kmeans.MiniBatchKMeansTest
Running jsat.clustering.kmeans.XMeansTest
cluster findK
cluster findK
Tests run: 2, Failures: 0, Errors: 0, Skipped: 0, Time elapsed: 0.101 sec - in jsat.clustering.kmeans.XMeansTest
Running jsat.clustering.kmeans.LloydKernelKMeansTest
cluster
cluster(dataset, int, threadpool)
cluster
Tests run: 3, Failures: 0, Errors: 0, Skipped: 0, Time elapsed: 1.277 sec - in jsat.clustering.kmeans.LloydKernelKMeansTest
Running jsat.clustering.kmeans.KMeansPDNTest
cluster findK
cluster findK
Tests run: 2, Failures: 0, Errors: 0, Skipped: 0, Time elapsed: 1.159 sec - in jsat.clustering.kmeans.KMeansPDNTest
Running jsat.clustering.kmeans.GMeansTest
cluster findK
cluster findK
Tests run: 2, Failures: 0, Errors: 0, Skipped: 0, Time elapsed: 0.076 sec - in jsat.clustering.kmeans.GMeansTest
Running jsat.clustering.kmeans.ElkanKernelKMeansTest
cluster
cluster(dataset, int, threadpool)
cluster
Tests run: 3, Failures: 0, Errors: 0, Skipped: 0, Time elapsed: 1.572 sec - in jsat.clustering.kmeans.ElkanKernelKMeansTest
Running jsat.clustering.evaluation.NormalizedMutualInformationTest
evaluate
Tests run: 1, Failures: 0, Errors: 0, Skipped: 0, Time elapsed: 0 sec - in jsat.clustering.evaluation.NormalizedMutualInformationTest
Running jsat.clustering.evaluation.AdjustedRandIndexTest
evaluate
Tests run: 1, Failures: 0, Errors: 0, Skipped: 0, Time elapsed: 0.001 sec - in jsat.clustering.evaluation.AdjustedRandIndexTest
Running jsat.clustering.evaluation.intra.SumOfSqrdPairwiseDistancesTest
evaluate
evaluate
Tests run: 2, Failures: 0, Errors: 0, Skipped: 0, Time elapsed: 0 sec - in jsat.clustering.evaluation.intra.SumOfSqrdPairwiseDistancesTest
Running jsat.io.LIBSVMLoaderTest
loadR
Tests run: 1, Failures: 0, Errors: 0, Skipped: 0, Time elapsed: 0.187 sec - in jsat.io.LIBSVMLoaderTest
Running jsat.io.JSATDataTest
ReadWriteSimple
ReadWriteSimple
ReadWriteClassification
ReadWriteRegression
Tests run: 4, Failures: 0, Errors: 0, Skipped: 0, Time elapsed: 0.06 sec - in jsat.io.JSATDataTest
Running jsat.io.CSVTest
read (numeric only features)
read
Tests run: 3, Failures: 0, Errors: 0, Skipped: 0, Time elapsed: 0.227 sec - in jsat.io.CSVTest
Running jsat.utils.SimpleListTest
set
get
add
size
Tests run: 4, Failures: 0, Errors: 0, Skipped: 0, Time elapsed: 0.001 sec - in jsat.utils.SimpleListTest
Running jsat.utils.LongDoubleMapTest
increment
put
remove
remove
containsKey
containsKey
put
Tests run: 7, Failures: 0, Errors: 0, Skipped: 0, Time elapsed: 0.972 sec - in jsat.utils.LongDoubleMapTest
Running jsat.utils.IntDoubleMapTest
increment
put
put
remove
containsKey
remove
containsKey
Tests run: 7, Failures: 0, Errors: 0, Skipped: 0, Time elapsed: 0.082 sec - in jsat.utils.IntDoubleMapTest
Running jsat.utils.IndexTableTest
swap
Tests run: 7, Failures: 0, Errors: 0, Skipped: 0, Time elapsed: 0.005 sec - in jsat.utils.IndexTableTest
Running jsat.utils.IntDoubleMapArrayTest
increment
put
put
remove
containsKey
remove
containsKey
Tests run: 7, Failures: 0, Errors: 0, Skipped: 0, Time elapsed: 0.071 sec - in jsat.utils.IntDoubleMapArrayTest
Running jsat.utils.ListUtilsTest
swap
splitList
Tests run: 2, Failures: 0, Errors: 0, Skipped: 0, Time elapsed: 0.003 sec - in jsat.utils.ListUtilsTest
Running jsat.utils.LongListTest
clear
Tests run: 1, Failures: 0, Errors: 0, Skipped: 0, Time elapsed: 0.01 sec - in jsat.utils.LongListTest
Running jsat.utils.QuickSortTest
sort
sort
sort
Tests run: 3, Failures: 0, Errors: 0, Skipped: 0, Time elapsed: 0.037 sec - in jsat.utils.QuickSortTest
Running jsat.utils.IntPriorityQueueTest
Tests run: 3, Failures: 0, Errors: 0, Skipped: 0, Time elapsed: 0.011 sec - in jsat.utils.IntPriorityQueueTest
Running jsat.utils.IntSetFixedSizeTest
add
contains
contains
iterator
size
add
Tests run: 6, Failures: 0, Errors: 0, Skipped: 0, Time elapsed: 0.004 sec - in jsat.utils.IntSetFixedSizeTest
Running jsat.utils.IntListTest
clear
Tests run: 1, Failures: 0, Errors: 0, Skipped: 0, Time elapsed: 0.005 sec - in jsat.utils.IntListTest
Running jsat.utils.IntSetTest
add
iterator
size
Tests run: 3, Failures: 0, Errors: 0, Skipped: 0, Time elapsed: 0 sec - in jsat.utils.IntSetTest
Running jsat.utils.IntSortedSetTest
add
iterator
size
subset
Tests run: 4, Failures: 0, Errors: 0, Skipped: 0, Time elapsed: 0.011 sec - in jsat.utils.IntSortedSetTest
Running jsat.utils.StringUtilsTest
parseDouble
Killed

Results :

Failed tests: 
  AdamTest.testUpdate_5args:119 expected:<0.0> but was:<758217.1782285534>
Tests in error: 
  IsomapTest.testTransform_DataSet_ExecutorService:128  Arithmetic Can not add ...

Tests run: 938, Failures: 1, Errors: 1, Skipped: 0

[INFO] ------------------------------------------------------------------------
[INFO] BUILD FAILURE
[INFO] ------------------------------------------------------------------------
[INFO] Total time: 04:53 min
[INFO] Finished at: 2018-01-14T00:12:33+01:00
[INFO] Final Memory: 15M/487M
[INFO] ------------------------------------------------------------------------
[ERROR] Failed to execute goal org.apache.maven.plugins:maven-surefire-plugin:2.18.1:test (default-test) on project JSAT: Execution default-test of goal org.apache.maven.plugins:maven-surefire-plugin:2.18.1:test failed: The forked VM terminated without properly saying goodbye. VM crash or System.exit called?
[ERROR] Command was /bin/sh -c cd /root/workspace/EdwardRaff/JSAT/328568452/JSAT && /usr/lib/jvm/java-8-openjdk-amd64/jre/bin/java -jar /root/workspace/EdwardRaff/JSAT/328568452/JSAT/target/surefire/surefirebooter3491983494697776778.jar /root/workspace/EdwardRaff/JSAT/328568452/JSAT/target/surefire/surefire2424454473616416327tmp /root/workspace/EdwardRaff/JSAT/328568452/JSAT/target/surefire/surefire_04207769947971865767tmp
[ERROR] -> [Help 1]
[ERROR] 
[ERROR] To see the full stack trace of the errors, re-run Maven with the -e switch.
[ERROR] Re-run Maven using the -X switch to enable full debug logging.
[ERROR] 
[ERROR] For more information about the errors and possible solutions, please read the following articles:
[ERROR] [Help 1] http://cwiki.apache.org/confluence/display/MAVEN/PluginExecutionException
