[INFO] Scanning for projects...
[INFO] Inspecting build with total of 1 modules...
[INFO] Installing Nexus Staging features:
[INFO]   ... total of 1 executions of maven-deploy-plugin replaced with nexus-staging-maven-plugin
[INFO]                                                                         
[INFO] ------------------------------------------------------------------------
[INFO] Building json iterator 0.9.22
[INFO] ------------------------------------------------------------------------
[INFO] 
[INFO] --- maven-resources-plugin:2.6:resources (default-resources) @ jsoniter ---
[INFO] Using 'UTF-8' encoding to copy filtered resources.
[INFO] skip non existing resourceDirectory /root/workspace/json-iterator/java/349155015/src/main/resources
[INFO] 
[INFO] --- maven-compiler-plugin:3.6.0:compile (default-compile) @ jsoniter ---
[INFO] Nothing to compile - all classes are up to date
[INFO] 
[INFO] --- maven-resources-plugin:2.6:testResources (default-testResources) @ jsoniter ---
[INFO] Using 'UTF-8' encoding to copy filtered resources.
[INFO] skip non existing resourceDirectory /root/workspace/json-iterator/java/349155015/test/main/resources
[INFO] 
[INFO] --- maven-compiler-plugin:3.6.0:testCompile (default-testCompile) @ jsoniter ---
[INFO] Nothing to compile - all classes are up to date
[INFO] 
[INFO] --- maven-surefire-plugin:2.19.1:test (default-test) @ jsoniter ---
[INFO] Downloading: https://repo.maven.apache.org/maven2/org/apache/maven/surefire/surefire-junit47/2.19.1/surefire-junit47-2.19.1.pom
[INFO] Downloaded: https://repo.maven.apache.org/maven2/org/apache/maven/surefire/surefire-junit47/2.19.1/surefire-junit47-2.19.1.pom (7 KB at 19.1 KB/sec)
[INFO] Downloading: https://repo.maven.apache.org/maven2/org/apache/maven/surefire/surefire-providers/2.19.1/surefire-providers-2.19.1.pom
[INFO] Downloaded: https://repo.maven.apache.org/maven2/org/apache/maven/surefire/surefire-providers/2.19.1/surefire-providers-2.19.1.pom (3 KB at 139.1 KB/sec)
[INFO] Downloading: https://repo.maven.apache.org/maven2/org/apache/maven/surefire/common-junit48/2.19.1/common-junit48-2.19.1.pom
[INFO] Downloaded: https://repo.maven.apache.org/maven2/org/apache/maven/surefire/common-junit48/2.19.1/common-junit48-2.19.1.pom (4 KB at 158.5 KB/sec)
[INFO] Downloading: https://repo.maven.apache.org/maven2/org/apache/maven/surefire/common-junit4/2.19.1/common-junit4-2.19.1.pom
[INFO] Downloaded: https://repo.maven.apache.org/maven2/org/apache/maven/surefire/common-junit4/2.19.1/common-junit4-2.19.1.pom (3 KB at 109.7 KB/sec)
[INFO] Downloading: https://repo.maven.apache.org/maven2/org/apache/maven/surefire/common-junit3/2.19.1/common-junit3-2.19.1.pom
[INFO] Downloaded: https://repo.maven.apache.org/maven2/org/apache/maven/surefire/common-junit3/2.19.1/common-junit3-2.19.1.pom (2 KB at 70.1 KB/sec)
[INFO] Downloading: https://repo.maven.apache.org/maven2/org/apache/maven/surefire/common-java5/2.19.1/common-java5-2.19.1.pom
[INFO] Downloaded: https://repo.maven.apache.org/maven2/org/apache/maven/surefire/common-java5/2.19.1/common-java5-2.19.1.pom (3 KB at 137.6 KB/sec)
[INFO] Downloading: https://repo.maven.apache.org/maven2/org/apache/maven/shared/maven-shared-utils/0.9/maven-shared-utils-0.9.pom
[INFO] Downloaded: https://repo.maven.apache.org/maven2/org/apache/maven/shared/maven-shared-utils/0.9/maven-shared-utils-0.9.pom (7 KB at 320.0 KB/sec)
[INFO] Downloading: https://repo.maven.apache.org/maven2/org/apache/maven/shared/maven-shared-components/21/maven-shared-components-21.pom
[INFO] Downloaded: https://repo.maven.apache.org/maven2/org/apache/maven/shared/maven-shared-components/21/maven-shared-components-21.pom (5 KB at 311.7 KB/sec)
[INFO] Downloading: https://repo.maven.apache.org/maven2/org/apache/maven/maven-parent/25/maven-parent-25.pom
[INFO] Downloaded: https://repo.maven.apache.org/maven2/org/apache/maven/maven-parent/25/maven-parent-25.pom (37 KB at 1523.4 KB/sec)
[INFO] Downloading: https://repo.maven.apache.org/maven2/org/apache/apache/15/apache-15.pom
[INFO] Downloaded: https://repo.maven.apache.org/maven2/org/apache/apache/15/apache-15.pom (15 KB at 743.9 KB/sec)
[INFO] Downloading: https://repo.maven.apache.org/maven2/org/apache/maven/surefire/surefire-grouper/2.19.1/surefire-grouper-2.19.1.pom
[INFO] Downloaded: https://repo.maven.apache.org/maven2/org/apache/maven/surefire/surefire-grouper/2.19.1/surefire-grouper-2.19.1.pom (3 KB at 135.1 KB/sec)
[INFO] Downloading: https://repo.maven.apache.org/maven2/org/apache/maven/surefire/common-java5/2.19.1/common-java5-2.19.1.jar
[INFO] Downloading: https://repo.maven.apache.org/maven2/org/apache/maven/surefire/common-junit3/2.19.1/common-junit3-2.19.1.jar
[INFO] Downloading: https://repo.maven.apache.org/maven2/org/apache/maven/surefire/common-junit4/2.19.1/common-junit4-2.19.1.jar
[INFO] Downloading: https://repo.maven.apache.org/maven2/org/apache/maven/surefire/surefire-junit47/2.19.1/surefire-junit47-2.19.1.jar
[INFO] Downloading: https://repo.maven.apache.org/maven2/org/apache/maven/surefire/common-junit48/2.19.1/common-junit48-2.19.1.jar
[INFO] Downloaded: https://repo.maven.apache.org/maven2/org/apache/maven/surefire/common-java5/2.19.1/common-java5-2.19.1.jar (44 KB at 1723.7 KB/sec)
[INFO] Downloading: https://repo.maven.apache.org/maven2/org/apache/maven/shared/maven-shared-utils/0.9/maven-shared-utils-0.9.jar
[INFO] Downloaded: https://repo.maven.apache.org/maven2/org/apache/maven/surefire/common-junit3/2.19.1/common-junit3-2.19.1.jar (12 KB at 249.7 KB/sec)
[INFO] Downloaded: https://repo.maven.apache.org/maven2/org/apache/maven/surefire/common-junit4/2.19.1/common-junit4-2.19.1.jar (26 KB at 562.3 KB/sec)
[INFO] Downloaded: https://repo.maven.apache.org/maven2/org/apache/maven/surefire/common-junit48/2.19.1/common-junit48-2.19.1.jar (23 KB at 503.2 KB/sec)
[INFO] Downloading: https://repo.maven.apache.org/maven2/org/apache/maven/surefire/surefire-grouper/2.19.1/surefire-grouper-2.19.1.jar
[INFO] Downloaded: https://repo.maven.apache.org/maven2/org/apache/maven/surefire/surefire-junit47/2.19.1/surefire-junit47-2.19.1.jar (150 KB at 2340.9 KB/sec)
[INFO] Downloaded: https://repo.maven.apache.org/maven2/org/apache/maven/shared/maven-shared-utils/0.9/maven-shared-utils-0.9.jar (168 KB at 4191.2 KB/sec)
[INFO] Downloaded: https://repo.maven.apache.org/maven2/org/apache/maven/surefire/surefire-grouper/2.19.1/surefire-grouper-2.19.1.jar (38 KB at 1784.3 KB/sec)

-------------------------------------------------------
 T E S T S
-------------------------------------------------------
Running com.jsoniter.extra.TestBase64
Tests run: 2, Failures: 0, Errors: 0, Skipped: 0, Time elapsed: 0.02 sec - in com.jsoniter.extra.TestBase64
Running com.jsoniter.extra.TestNamingStrategy
Tests run: 1, Failures: 0, Errors: 0, Skipped: 0, Time elapsed: 0.026 sec - in com.jsoniter.extra.TestNamingStrategy
Running com.jsoniter.extra.TestPreciseFloat
Tests run: 2, Failures: 0, Errors: 0, Skipped: 0, Time elapsed: 0.003 sec - in com.jsoniter.extra.TestPreciseFloat
Running com.jsoniter.TestAnnotationJsonIgnore
Tests run: 3, Failures: 0, Errors: 0, Skipped: 0, Time elapsed: 0.067 sec - in com.jsoniter.TestAnnotationJsonIgnore
Running com.jsoniter.output.TestAnnotationJsonIgnore
Tests run: 3, Failures: 0, Errors: 0, Skipped: 0, Time elapsed: 0.016 sec - in com.jsoniter.output.TestAnnotationJsonIgnore
Running com.jsoniter.TestAnnotationJsonIgnore
Tests run: 3, Failures: 0, Errors: 0, Skipped: 0, Time elapsed: 0.295 sec - in com.jsoniter.TestAnnotationJsonIgnore
Running com.jsoniter.TestAnnotationJsonProperty
Tests run: 11, Failures: 0, Errors: 0, Skipped: 0, Time elapsed: 0.022 sec - in com.jsoniter.TestAnnotationJsonProperty
Running com.jsoniter.output.TestAnnotationJsonProperty
Tests run: 4, Failures: 0, Errors: 0, Skipped: 0, Time elapsed: 0.014 sec - in com.jsoniter.output.TestAnnotationJsonProperty
Running com.jsoniter.output.TestAnnotationJsonIgnore
Tests run: 3, Failures: 0, Errors: 0, Skipped: 0, Time elapsed: 0.043 sec - in com.jsoniter.output.TestAnnotationJsonIgnore
Running com.jsoniter.TestAnnotationJsonWrapper
Tests run: 3, Failures: 0, Errors: 0, Skipped: 0, Time elapsed: 0.027 sec - in com.jsoniter.TestAnnotationJsonWrapper
Running com.jsoniter.output.TestAnnotationJsonUnwrapper
Tests run: 2, Failures: 0, Errors: 0, Skipped: 0, Time elapsed: 0.022 sec - in com.jsoniter.output.TestAnnotationJsonUnwrapper
Running com.jsoniter.TestAnnotation
Tests run: 4, Failures: 0, Errors: 0, Skipped: 0, Time elapsed: 0.006 sec - in com.jsoniter.TestAnnotation
Running com.jsoniter.TestAnnotationJsonCreator
Running com.jsoniter.TestAnnotationJsonIgnore
Tests run: 3, Failures: 0, Errors: 0, Skipped: 0, Time elapsed: 0.31 sec - in com.jsoniter.TestAnnotationJsonIgnore
Tests run: 2, Failures: 0, Errors: 0, Skipped: 0, Time elapsed: 0.007 sec - in com.jsoniter.TestAnnotationJsonCreator
Running com.jsoniter.output.TestGenerics
Tests run: 2, Failures: 0, Errors: 0, Skipped: 0, Time elapsed: 0.021 sec - in com.jsoniter.output.TestGenerics
Running com.jsoniter.output.TestAnnotationJsonIgnore
Running com.jsoniter.TestCustomizeType
Tests run: 2, Failures: 0, Errors: 0, Skipped: 0, Time elapsed: 0.01 sec - in com.jsoniter.TestCustomizeType
Tests run: 3, Failures: 0, Errors: 0, Skipped: 0, Time elapsed: 0.029 sec - in com.jsoniter.output.TestAnnotationJsonIgnore
Running com.jsoniter.TestDemo
363com.jsoniter.User@73846619score
100score
102Tests run: 11, Failures: 0, Errors: 0, Skipped: 0, Time elapsed: 0.024 sec - in com.jsoniter.TestDemo
Running com.jsoniter.TestIO
Tests run: 3, Failures: 0, Errors: 0, Skipped: 0, Time elapsed: 0.001 sec - in com.jsoniter.TestIO
Running com.jsoniter.TestNested
Tests run: 4, Failures: 0, Errors: 0, Skipped: 0, Time elapsed: 0.007 sec - in com.jsoniter.TestNested
Running com.jsoniter.output.TestNested
Tests run: 5, Failures: 0, Errors: 0, Skipped: 0, Time elapsed: 0.008 sec - in com.jsoniter.output.TestNested
Running com.jsoniter.TestObject
Tests run: 15, Failures: 0, Errors: 0, Skipped: 0, Time elapsed: 0.016 sec - in com.jsoniter.TestObject
Running com.jsoniter.TestAnnotationJsonProperty
Tests run: 11, Failures: 0, Errors: 0, Skipped: 0, Time elapsed: 0.307 sec - in com.jsoniter.TestAnnotationJsonProperty
Running com.jsoniter.output.TestAnnotationJsonProperty
Tests run: 4, Failures: 0, Errors: 0, Skipped: 0, Time elapsed: 0.018 sec - in com.jsoniter.output.TestAnnotationJsonProperty
Running com.jsoniter.TestAnnotationJsonWrapper
Tests run: 3, Failures: 0, Errors: 0, Skipped: 0, Time elapsed: 0.037 sec - in com.jsoniter.TestAnnotationJsonWrapper
Running com.jsoniter.output.TestAnnotationJsonUnwrapper
Tests run: 2, Failures: 0, Errors: 0, Skipped: 0, Time elapsed: 0.011 sec - in com.jsoniter.output.TestAnnotationJsonUnwrapper
Running com.jsoniter.TestAnnotationJsonProperty
Running com.jsoniter.TestAnnotation
Tests run: 11, Failures: 0, Errors: 0, Skipped: 0, Time elapsed: 0.322 sec - in com.jsoniter.TestAnnotationJsonProperty
Tests run: 4, Failures: 0, Errors: 0, Skipped: 0, Time elapsed: 0.029 sec - in com.jsoniter.TestAnnotation
Running com.jsoniter.TestAnnotationJsonCreator
Tests run: 2, Failures: 0, Errors: 0, Skipped: 0, Time elapsed: 0.018 sec - in com.jsoniter.TestAnnotationJsonCreator
Running com.jsoniter.output.TestAnnotationJsonProperty
Tests run: 4, Failures: 0, Errors: 0, Skipped: 0, Time elapsed: 0.033 sec - in com.jsoniter.output.TestAnnotationJsonProperty
Running com.jsoniter.output.TestGenerics
Tests run: 2, Failures: 0, Errors: 0, Skipped: 0, Time elapsed: 0.024 sec - in com.jsoniter.output.TestGenerics
Running com.jsoniter.output.TestObject
Tests run: 20, Failures: 0, Errors: 0, Skipped: 0, Time elapsed: 0.269 sec - in com.jsoniter.output.TestObject
Running com.jsoniter.TestReadAny
 100com.jsoniter.spi.JsonException: Value not found: failed to get index 0 from []com.jsoniter.spi.JsonException: Value not found: failed to get index 0 from []com.jsoniter.spi.JsonException: Value not found: failed to get key hello from {}com.jsoniter.spi.JsonException: Value not found: failed to get key hello from {}Tests run: 20, Failures: 0, Errors: 0, Skipped: 0, Time elapsed: 0.008 sec - in com.jsoniter.TestReadAny
Running com.jsoniter.TestSkip
Running com.jsoniter.TestCustomizeType
Tests run: 2, Failures: 0, Errors: 0, Skipped: 0, Time elapsed: 0.023 sec - in com.jsoniter.TestCustomizeType
Tests run: 6, Failures: 0, Errors: 0, Skipped: 0, Time elapsed: 0.002 sec - in com.jsoniter.TestSkip
Running com.jsoniter.TestSlice
Tests run: 2, Failures: 0, Errors: 0, Skipped: 0, Time elapsed: 0.001 sec - in com.jsoniter.TestSlice
Running com.jsoniter.TestString
Tests run: 15, Failures: 0, Errors: 0, Skipped: 0, Time elapsed: 0.002 sec - in com.jsoniter.TestString
Running com.jsoniter.output.TestString
Tests run: 2, Failures: 0, Errors: 0, Skipped: 0, Time elapsed: 0.002 sec - in com.jsoniter.output.TestString
Running com.jsoniter.TestWhatIsNext
Running com.jsoniter.TestAnnotationJsonWrapper
Tests run: 1, Failures: 0, Errors: 0, Skipped: 0, Time elapsed: 0 sec - in com.jsoniter.TestWhatIsNext
Tests run: 3, Failures: 0, Errors: 0, Skipped: 0, Time elapsed: 0.048 sec - in com.jsoniter.TestAnnotationJsonWrapper
Running com.jsoniter.output.TestAny
Tests run: 11, Failures: 0, Errors: 0, Skipped: 0, Time elapsed: 0.012 sec - in com.jsoniter.output.TestAny
Running com.jsoniter.output.TestAnnotationJsonUnwrapper
Tests run: 2, Failures: 0, Errors: 0, Skipped: 0, Time elapsed: 0.011 sec - in com.jsoniter.output.TestAnnotationJsonUnwrapper
Running com.jsoniter.output.TestArray
Tests run: 15, Failures: 0, Errors: 0, Skipped: 0, Time elapsed: 0.026 sec - in com.jsoniter.output.TestArray
Running com.jsoniter.any.TestArray
Tests run: 10, Failures: 0, Errors: 0, Skipped: 0, Time elapsed: 0.004 sec - in com.jsoniter.any.TestArray
Running com.jsoniter.TestArray
Tests run: 10, Failures: 0, Errors: 0, Skipped: 0, Time elapsed: 0.005 sec - in com.jsoniter.TestArray
Running com.jsoniter.output.TestSpiPropertyEncoder
Running com.jsoniter.TestAnnotation
Tests run: 2, Failures: 0, Errors: 0, Skipped: 0, Time elapsed: 0.006 sec - in com.jsoniter.output.TestSpiPropertyEncoder
Tests run: 4, Failures: 0, Errors: 0, Skipped: 0, Time elapsed: 0.044 sec - in com.jsoniter.TestAnnotation
Running com.jsoniter.TestAnnotationJsonCreator
Tests run: 2, Failures: 0, Errors: 0, Skipped: 0, Time elapsed: 0.019 sec - in com.jsoniter.TestAnnotationJsonCreator
Running com.jsoniter.TestMap
Tests run: 4, Failures: 0, Errors: 0, Skipped: 0, Time elapsed: 0.031 sec - in com.jsoniter.TestMap
Running com.jsoniter.output.TestMap
Tests run: 9, Failures: 0, Errors: 0, Skipped: 0, Time elapsed: 0.012 sec - in com.jsoniter.output.TestMap
Running com.jsoniter.output.TestNative
Running com.jsoniter.TestDemo
363com.jsoniter.User@27808f31score
100score
102Tests run: 22, Failures: 0, Errors: 0, Skipped: 0, Time elapsed: 0.008 sec - in com.jsoniter.output.TestNative
Running com.jsoniter.TestBoolean
Running com.jsoniter.output.TestGenerics
Tests run: 2, Failures: 0, Errors: 0, Skipped: 0, Time elapsed: 0.002 sec - in com.jsoniter.TestBoolean
Running com.jsoniter.TestFloat
Tests run: 8, Failures: 0, Errors: 0, Skipped: 0, Time elapsed: 0.003 sec - in com.jsoniter.TestFloat
Tests run: 11, Failures: 0, Errors: 0, Skipped: 0, Time elapsed: 0.115 sec - in com.jsoniter.TestDemo
Running com.jsoniter.output.TestFloat
Tests run: 1, Failures: 0, Errors: 0, Skipped: 0, Time elapsed: 0.001 sec - in com.jsoniter.output.TestFloat
Running com.jsoniter.any.TestList
Tests run: 7, Failures: 0, Errors: 0, Skipped: 0, Time elapsed: 0.002 sec - in com.jsoniter.any.TestList
Tests run: 2, Failures: 0, Errors: 0, Skipped: 0, Time elapsed: 0.028 sec - in com.jsoniter.output.TestGenerics
Running com.jsoniter.TestCustomizeType
Tests run: 2, Failures: 0, Errors: 0, Skipped: 0, Time elapsed: 0.03 sec - in com.jsoniter.TestCustomizeType
Running com.jsoniter.TestExisting
Tests run: 5, Failures: 0, Errors: 0, Skipped: 0, Time elapsed: 0.039 sec - in com.jsoniter.TestExisting
Running com.jsoniter.TestAnnotationJsonIgnore
Tests run: 3, Failures: 0, Errors: 0, Skipped: 0, Time elapsed: 0.05 sec - in com.jsoniter.TestAnnotationJsonIgnore
Running com.jsoniter.output.TestAnnotationJsonIgnore
Tests run: 3, Failures: 0, Errors: 0, Skipped: 0, Time elapsed: 0.021 sec - in com.jsoniter.output.TestAnnotationJsonIgnore
Running com.jsoniter.TestDemo
363com.jsoniter.User@36b4cef0score
100score
102Tests run: 11, Failures: 0, Errors: 0, Skipped: 0, Time elapsed: 0.096 sec - in com.jsoniter.TestDemo
Running com.jsoniter.TestAnnotationJsonProperty
Tests run: 11, Failures: 0, Errors: 0, Skipped: 0, Time elapsed: 0.024 sec - in com.jsoniter.TestAnnotationJsonProperty
Running com.jsoniter.output.TestAnnotationJsonProperty
Running com.jsoniter.TestExisting
Tests run: 4, Failures: 0, Errors: 0, Skipped: 0, Time elapsed: 0.007 sec - in com.jsoniter.output.TestAnnotationJsonProperty
Tests run: 5, Failures: 0, Errors: 0, Skipped: 0, Time elapsed: 0.027 sec - in com.jsoniter.TestExisting
Running com.jsoniter.TestAnnotationJsonWrapper
Tests run: 3, Failures: 0, Errors: 0, Skipped: 0, Time elapsed: 0.013 sec - in com.jsoniter.TestAnnotationJsonWrapper
Running com.jsoniter.output.TestAnnotationJsonUnwrapper
Tests run: 2, Failures: 0, Errors: 0, Skipped: 0, Time elapsed: 0.006 sec - in com.jsoniter.output.TestAnnotationJsonUnwrapper
Running com.jsoniter.TestAnnotation
Tests run: 4, Failures: 0, Errors: 0, Skipped: 0, Time elapsed: 0.007 sec - in com.jsoniter.TestAnnotation
Running com.jsoniter.TestAnnotationJsonCreator
Tests run: 2, Failures: 0, Errors: 0, Skipped: 0, Time elapsed: 0.005 sec - in com.jsoniter.TestAnnotationJsonCreator
Running com.jsoniter.output.TestGenerics
Tests run: 2, Failures: 0, Errors: 0, Skipped: 0, Time elapsed: 0.006 sec - in com.jsoniter.output.TestGenerics
Running com.jsoniter.TestCustomizeType
Running com.jsoniter.TestNested
Tests run: 2, Failures: 0, Errors: 0, Skipped: 0, Time elapsed: 0.005 sec - in com.jsoniter.TestCustomizeType
Tests run: 4, Failures: 0, Errors: 0, Skipped: 0, Time elapsed: 0.05 sec - in com.jsoniter.TestNested
Running com.jsoniter.TestDemo
363com.jsoniter.User@2d554825score
100score
102Tests run: 11, Failures: 0, Errors: 0, Skipped: 0, Time elapsed: 0.018 sec - in com.jsoniter.TestDemo
Running com.jsoniter.output.TestNested
Tests run: 5, Failures: 0, Errors: 0, Skipped: 0, Time elapsed: 0.037 sec - in com.jsoniter.output.TestNested
Running com.jsoniter.output.TestJackson
Tests run: 3, Failures: 0, Errors: 0, Skipped: 0, Time elapsed: 0.24 sec - in com.jsoniter.output.TestJackson
Running com.jsoniter.TestNested
Tests run: 4, Failures: 0, Errors: 0, Skipped: 0, Time elapsed: 0.006 sec - in com.jsoniter.TestNested
Running com.jsoniter.output.TestNested
Tests run: 5, Failures: 0, Errors: 0, Skipped: 0, Time elapsed: 0.007 sec - in com.jsoniter.output.TestNested
Running com.jsoniter.TestObject
Tests run: 15, Failures: 0, Errors: 0, Skipped: 0, Time elapsed: 0.019 sec - in com.jsoniter.TestObject
Running com.jsoniter.TestJackson
Tests run: 3, Failures: 0, Errors: 0, Skipped: 0, Time elapsed: 0.051 sec - in com.jsoniter.TestJackson
Running com.jsoniter.output.TestSpiTypeEncoder
jsoniter_codegen.cfg1830135045.
Running com.jsoniter.TestNested
Tests run: 2, Failures: 0, Errors: 0, Skipped: 0, Time elapsed: 0.002 sec - in com.jsoniter.output.TestSpiTypeEncoder
Tests run: 4, Failures: 0, Errors: 0, Skipped: 0, Time elapsed: 0.029 sec - in com.jsoniter.TestNested
Running com.jsoniter.TestSpiTypeDecoder
Tests run: 6, Failures: 0, Errors: 0, Skipped: 0, Time elapsed: 0.01 sec - in com.jsoniter.TestSpiTypeDecoder
Running com.jsoniter.TestSpiPropertyDecoder
Tests run: 2, Failures: 0, Errors: 0, Skipped: 0, Time elapsed: 0.002 sec - in com.jsoniter.TestSpiPropertyDecoder
Running com.jsoniter.TestObject
Tests run: 15, Failures: 0, Errors: 0, Skipped: 0, Time elapsed: 0.084 sec - in com.jsoniter.TestObject
Running com.jsoniter.output.TestNested
Tests run: 5, Failures: 0, Errors: 0, Skipped: 0, Time elapsed: 0.021 sec - in com.jsoniter.output.TestNested
Running com.jsoniter.TestObject
Running com.jsoniter.TestGson
Tests run: 14, Failures: 0, Errors: 0, Skipped: 0, Time elapsed: 0.093 sec - in com.jsoniter.TestGson
Tests run: 15, Failures: 0, Errors: 0, Skipped: 0, Time elapsed: 0.085 sec - in com.jsoniter.TestObject
Running com.jsoniter.output.TestGson
Gson: {"test":"lorem-👄👀"}
jsoniter: {"test":"lorem-👄👀"}
Tests run: 15, Failures: 0, Errors: 0, Skipped: 0, Time elapsed: 0.031 sec - in com.jsoniter.output.TestGson
Running com.jsoniter.output.TestStreamBuffer
Tests run: 6, Failures: 0, Errors: 0, Skipped: 0, Time elapsed: 0.011 sec - in com.jsoniter.output.TestStreamBuffer
Running com.jsoniter.output.TestCollection
Tests run: 2, Failures: 0, Errors: 0, Skipped: 0, Time elapsed: 0.008 sec - in com.jsoniter.output.TestCollection
Running com.jsoniter.TestAnnotationJsonObject
com.jsoniter.spi.JsonException: found should not present property: field1com.jsoniter.spi.JsonException: unknown property: field-1Tests run: 4, Failures: 0, Errors: 0, Skipped: 0, Time elapsed: 0.01 sec - in com.jsoniter.TestAnnotationJsonObject
Running com.jsoniter.TestExisting
Tests run: 5, Failures: 2, Errors: 0, Skipped: 0, Time elapsed: 0.008 sec <<< FAILURE! - in com.jsoniter.TestExisting
test_reuse_list(com.jsoniter.TestExisting)  Time elapsed: 0.003 sec  <<< FAILURE!
junit.framework.AssertionFailedError: expected:<1234776885> but was:<540159270>
	at com.jsoniter.TestExisting.test_reuse_list(TestExisting.java:54)

test_reuse_linked_list(com.jsoniter.TestExisting)  Time elapsed: 0 sec  <<< FAILURE!
junit.framework.AssertionFailedError: expected:<540585569> but was:<1007653873>
	at com.jsoniter.TestExisting.test_reuse_linked_list(TestExisting.java:61)

Running com.jsoniter.TestGenerics
Tests run: 22, Failures: 0, Errors: 0, Skipped: 0, Time elapsed: 0.045 sec - in com.jsoniter.TestGenerics
Running com.jsoniter.output.TestInteger
Tests run: 2, Failures: 0, Errors: 0, Skipped: 0, Time elapsed: 0.001 sec - in com.jsoniter.output.TestInteger
Running com.jsoniter.output.TestObject
Tests run: 20, Failures: 0, Errors: 0, Skipped: 0, Time elapsed: 0.212 sec - in com.jsoniter.output.TestObject
Running com.jsoniter.TestReadAny
 100com.jsoniter.spi.JsonException: Value not found: failed to get index 0 from []com.jsoniter.spi.JsonException: Value not found: failed to get index 0 from []com.jsoniter.spi.JsonException: Value not found: failed to get key hello from {}com.jsoniter.spi.JsonException: Value not found: failed to get key hello from {}Tests run: 19, Failures: 0, Errors: 0, Skipped: 0, Time elapsed: 0.029 sec - in com.jsoniter.TestReadAny
Running com.jsoniter.TestSkip
Tests run: 5, Failures: 0, Errors: 0, Skipped: 0, Time elapsed: 0.005 sec - in com.jsoniter.TestSkip
Running com.jsoniter.TestSlice
Tests run: 2, Failures: 0, Errors: 0, Skipped: 0, Time elapsed: 0.001 sec - in com.jsoniter.TestSlice
Running com.jsoniter.TestString
Tests run: 10, Failures: 0, Errors: 0, Skipped: 0, Time elapsed: 0.003 sec - in com.jsoniter.TestString
Running com.jsoniter.output.TestString
Tests run: 2, Failures: 0, Errors: 0, Skipped: 0, Time elapsed: 0.001 sec - in com.jsoniter.output.TestString
Running com.jsoniter.TestWhatIsNext
Tests run: 1, Failures: 0, Errors: 0, Skipped: 0, Time elapsed: 0 sec - in com.jsoniter.TestWhatIsNext
Running com.jsoniter.output.TestAny
Tests run: 11, Failures: 0, Errors: 0, Skipped: 0, Time elapsed: 0.021 sec - in com.jsoniter.output.TestAny
Running com.jsoniter.output.TestObject
Tests run: 20, Failures: 0, Errors: 0, Skipped: 0, Time elapsed: 0.237 sec - in com.jsoniter.output.TestObject
Running com.jsoniter.TestReadAny
 100com.jsoniter.spi.JsonException: Value not found: failed to get index 0 from []com.jsoniter.spi.JsonException: Value not found: failed to get index 0 from []com.jsoniter.spi.JsonException: Value not found: failed to get key hello from {}com.jsoniter.spi.JsonException: Value not found: failed to get key hello from {}Tests run: 19, Failures: 0, Errors: 0, Skipped: 0, Time elapsed: 0.023 sec - in com.jsoniter.TestReadAny
Running com.jsoniter.output.TestArray
Tests run: 15, Failures: 0, Errors: 0, Skipped: 0, Time elapsed: 0.089 sec - in com.jsoniter.output.TestArray
Running com.jsoniter.TestSkip
Tests run: 5, Failures: 0, Errors: 0, Skipped: 0, Time elapsed: 0.011 sec - in com.jsoniter.TestSkip
Running com.jsoniter.any.TestArray
Running com.jsoniter.TestSlice
Tests run: 10, Failures: 0, Errors: 0, Skipped: 0, Time elapsed: 0.008 sec - in com.jsoniter.any.TestArray
Tests run: 2, Failures: 0, Errors: 0, Skipped: 0, Time elapsed: 0 sec - in com.jsoniter.TestSlice
Running com.jsoniter.TestString
Tests run: 10, Failures: 0, Errors: 0, Skipped: 0, Time elapsed: 0.003 sec - in com.jsoniter.TestString
Running com.jsoniter.output.TestString
Tests run: 2, Failures: 0, Errors: 0, Skipped: 0, Time elapsed: 0.002 sec - in com.jsoniter.output.TestString
Running com.jsoniter.TestWhatIsNext
Tests run: 1, Failures: 0, Errors: 0, Skipped: 0, Time elapsed: 0 sec - in com.jsoniter.TestWhatIsNext
Running com.jsoniter.output.TestObject
Running com.jsoniter.output.TestAny
Tests run: 11, Failures: 0, Errors: 0, Skipped: 0, Time elapsed: 0.019 sec - in com.jsoniter.output.TestAny
Tests run: 20, Failures: 0, Errors: 0, Skipped: 0, Time elapsed: 0.415 sec - in com.jsoniter.output.TestObject
Running com.jsoniter.TestReadAny
 100com.jsoniter.spi.JsonException: Value not found: failed to get index 0 from []com.jsoniter.spi.JsonException: Value not found: failed to get index 0 from []com.jsoniter.spi.JsonException: Value not found: failed to get key hello from {}com.jsoniter.spi.JsonException: Value not found: failed to get key hello from {}Running com.jsoniter.TestArray
Tests run: 10, Failures: 0, Errors: 0, Skipped: 0, Time elapsed: 0.043 sec - in com.jsoniter.TestArray
Running com.jsoniter.output.TestSpiPropertyEncoder
Tests run: 2, Failures: 0, Errors: 0, Skipped: 0, Time elapsed: 0.008 sec - in com.jsoniter.output.TestSpiPropertyEncoder
Running com.jsoniter.output.TestArray
Tests run: 15, Failures: 0, Errors: 0, Skipped: 0, Time elapsed: 0.035 sec - in com.jsoniter.output.TestArray
Tests run: 19, Failures: 0, Errors: 0, Skipped: 0, Time elapsed: 0.015 sec - in com.jsoniter.TestReadAny
Running com.jsoniter.TestSkip
Tests run: 5, Failures: 0, Errors: 0, Skipped: 0, Time elapsed: 0.002 sec - in com.jsoniter.TestSkip
Running com.jsoniter.TestSlice
Running com.jsoniter.any.TestArray
Tests run: 2, Failures: 0, Errors: 0, Skipped: 0, Time elapsed: 0.001 sec - in com.jsoniter.TestSlice
Running com.jsoniter.TestString
Tests run: 10, Failures: 0, Errors: 0, Skipped: 0, Time elapsed: 0.012 sec - in com.jsoniter.any.TestArray
Tests run: 10, Failures: 0, Errors: 0, Skipped: 0, Time elapsed: 0.003 sec - in com.jsoniter.TestString
Running com.jsoniter.output.TestString
Tests run: 2, Failures: 0, Errors: 0, Skipped: 0, Time elapsed: 0.001 sec - in com.jsoniter.output.TestString
Running com.jsoniter.TestWhatIsNext
Tests run: 1, Failures: 0, Errors: 0, Skipped: 0, Time elapsed: 0.006 sec - in com.jsoniter.TestWhatIsNext
Running com.jsoniter.output.TestAny
Tests run: 11, Failures: 0, Errors: 0, Skipped: 0, Time elapsed: 0.014 sec - in com.jsoniter.output.TestAny
Running com.jsoniter.output.TestArray
Running com.jsoniter.TestMap
Tests run: 4, Failures: 0, Errors: 0, Skipped: 0, Time elapsed: 0.042 sec - in com.jsoniter.TestMap
Running com.jsoniter.TestArray
Tests run: 10, Failures: 0, Errors: 0, Skipped: 0, Time elapsed: 0.038 sec - in com.jsoniter.TestArray
Running com.jsoniter.output.TestSpiPropertyEncoder
Tests run: 2, Failures: 0, Errors: 0, Skipped: 0, Time elapsed: 0.008 sec - in com.jsoniter.output.TestSpiPropertyEncoder
Running com.jsoniter.output.TestMap
Tests run: 9, Failures: 0, Errors: 0, Skipped: 0, Time elapsed: 0.023 sec - in com.jsoniter.output.TestMap
Running com.jsoniter.output.TestNative
Tests run: 15, Failures: 0, Errors: 0, Skipped: 0, Time elapsed: 0.017 sec - in com.jsoniter.output.TestArray
Running com.jsoniter.any.TestArray
Tests run: 22, Failures: 0, Errors: 0, Skipped: 0, Time elapsed: 0.006 sec - in com.jsoniter.output.TestNative
Running com.jsoniter.TestBoolean
Tests run: 1, Failures: 0, Errors: 0, Skipped: 0, Time elapsed: 0.002 sec - in com.jsoniter.TestBoolean
Running com.jsoniter.TestFloat
Tests run: 7, Failures: 0, Errors: 0, Skipped: 0, Time elapsed: 0.002 sec - in com.jsoniter.TestFloat
Running com.jsoniter.output.TestFloat
Tests run: 1, Failures: 0, Errors: 0, Skipped: 0, Time elapsed: 0.001 sec - in com.jsoniter.output.TestFloat
Tests run: 10, Failures: 0, Errors: 0, Skipped: 0, Time elapsed: 0.005 sec - in com.jsoniter.any.TestArray
Running com.jsoniter.TestArray
Running com.jsoniter.any.TestList
Tests run: 7, Failures: 0, Errors: 0, Skipped: 0, Time elapsed: 0.009 sec - in com.jsoniter.any.TestList
Running com.jsoniter.TestMap
Tests run: 4, Failures: 0, Errors: 0, Skipped: 0, Time elapsed: 0.044 sec - in com.jsoniter.TestMap
Tests run: 10, Failures: 0, Errors: 0, Skipped: 0, Time elapsed: 0.006 sec - in com.jsoniter.TestArray
Running com.jsoniter.output.TestSpiPropertyEncoder
Tests run: 2, Failures: 0, Errors: 0, Skipped: 0, Time elapsed: 0.003 sec - in com.jsoniter.output.TestSpiPropertyEncoder
Running com.jsoniter.TestMap
Running com.jsoniter.output.TestMap
Tests run: 9, Failures: 0, Errors: 0, Skipped: 0, Time elapsed: 0.023 sec - in com.jsoniter.output.TestMap
Running com.jsoniter.output.TestNative
Tests run: 22, Failures: 0, Errors: 0, Skipped: 0, Time elapsed: 0.006 sec - in com.jsoniter.output.TestNative
Running com.jsoniter.TestBoolean
Tests run: 1, Failures: 0, Errors: 0, Skipped: 0, Time elapsed: 0 sec - in com.jsoniter.TestBoolean
Running com.jsoniter.TestFloat
Tests run: 7, Failures: 0, Errors: 0, Skipped: 0, Time elapsed: 0.001 sec - in com.jsoniter.TestFloat
Running com.jsoniter.output.TestFloat
Tests run: 1, Failures: 0, Errors: 0, Skipped: 0, Time elapsed: 0 sec - in com.jsoniter.output.TestFloat
Running com.jsoniter.any.TestList
Tests run: 7, Failures: 0, Errors: 0, Skipped: 0, Time elapsed: 0.003 sec - in com.jsoniter.any.TestList
Tests run: 4, Failures: 0, Errors: 0, Skipped: 0, Time elapsed: 0.038 sec - in com.jsoniter.TestMap
Running com.jsoniter.output.TestMap
Tests run: 9, Failures: 0, Errors: 0, Skipped: 0, Time elapsed: 0.011 sec - in com.jsoniter.output.TestMap
Running com.jsoniter.output.TestNative
Tests run: 22, Failures: 0, Errors: 0, Skipped: 0, Time elapsed: 0.007 sec - in com.jsoniter.output.TestNative
Running com.jsoniter.TestBoolean
Tests run: 1, Failures: 0, Errors: 0, Skipped: 0, Time elapsed: 0.001 sec - in com.jsoniter.TestBoolean
Running com.jsoniter.TestFloat
Tests run: 7, Failures: 0, Errors: 0, Skipped: 0, Time elapsed: 0.002 sec - in com.jsoniter.TestFloat
Running com.jsoniter.output.TestFloat
Tests run: 1, Failures: 0, Errors: 0, Skipped: 0, Time elapsed: 0 sec - in com.jsoniter.output.TestFloat
Running com.jsoniter.any.TestList
Tests run: 7, Failures: 0, Errors: 0, Skipped: 0, Time elapsed: 0.002 sec - in com.jsoniter.any.TestList
Running com.jsoniter.output.TestJackson
Tests run: 3, Failures: 0, Errors: 0, Skipped: 0, Time elapsed: 0.262 sec - in com.jsoniter.output.TestJackson
Running com.jsoniter.output.TestJackson
Running com.jsoniter.TestJackson
Tests run: 3, Failures: 0, Errors: 0, Skipped: 0, Time elapsed: 0.052 sec - in com.jsoniter.TestJackson
Running com.jsoniter.output.TestSpiTypeEncoder
jsoniter_codegen.cfg9223372034806973682.
Tests run: 2, Failures: 0, Errors: 0, Skipped: 0, Time elapsed: 0.002 sec - in com.jsoniter.output.TestSpiTypeEncoder
Tests run: 3, Failures: 0, Errors: 0, Skipped: 0, Time elapsed: 0.262 sec - in com.jsoniter.output.TestJackson
Running com.jsoniter.TestJackson
Running com.jsoniter.TestSpiTypeDecoder
Tests run: 6, Failures: 0, Errors: 0, Skipped: 0, Time elapsed: 0.018 sec - in com.jsoniter.TestSpiTypeDecoder
Running com.jsoniter.TestSpiPropertyDecoder
Tests run: 2, Failures: 0, Errors: 0, Skipped: 0, Time elapsed: 0.011 sec - in com.jsoniter.TestSpiPropertyDecoder
Running com.jsoniter.output.TestJackson
Tests run: 3, Failures: 0, Errors: 0, Skipped: 0, Time elapsed: 0.045 sec - in com.jsoniter.TestJackson
Running com.jsoniter.output.TestSpiTypeEncoder
jsoniter_codegen.cfg1830135045.
Tests run: 2, Failures: 0, Errors: 0, Skipped: 0, Time elapsed: 0.002 sec - in com.jsoniter.output.TestSpiTypeEncoder
Running com.jsoniter.TestSpiTypeDecoder
Tests run: 6, Failures: 0, Errors: 0, Skipped: 0, Time elapsed: 0.003 sec - in com.jsoniter.TestSpiTypeDecoder
Running com.jsoniter.TestSpiPropertyDecoder
Tests run: 3, Failures: 0, Errors: 0, Skipped: 0, Time elapsed: 0.31 sec - in com.jsoniter.output.TestJackson
Tests run: 2, Failures: 0, Errors: 0, Skipped: 0, Time elapsed: 0.006 sec - in com.jsoniter.TestSpiPropertyDecoder
Running com.jsoniter.TestJackson
Running com.jsoniter.TestGson
Tests run: 14, Failures: 0, Errors: 0, Skipped: 0, Time elapsed: 0.086 sec - in com.jsoniter.TestGson
Running com.jsoniter.TestGson
Running com.jsoniter.output.TestGson
Tests run: 3, Failures: 0, Errors: 0, Skipped: 0, Time elapsed: 0.047 sec - in com.jsoniter.TestJackson
Running com.jsoniter.output.TestSpiTypeEncoder
Gson: {"test":"lorem-👄👀"}
jsoniter_codegen.cfg9223372036535405691.
jsoniter: {"test":"lorem-👄👀"}
Tests run: 15, Failures: 0, Errors: 0, Skipped: 0, Time elapsed: 0.018 sec - in com.jsoniter.output.TestGson
Running com.jsoniter.output.TestStreamBuffer
Tests run: 6, Failures: 0, Errors: 0, Skipped: 0, Time elapsed: 0.002 sec - in com.jsoniter.output.TestStreamBuffer
Tests run: 2, Failures: 0, Errors: 0, Skipped: 0, Time elapsed: 0.001 sec - in com.jsoniter.output.TestSpiTypeEncoder
Running com.jsoniter.TestSpiTypeDecoder
Running com.jsoniter.output.TestCollection
Tests run: 2, Failures: 0, Errors: 0, Skipped: 0, Time elapsed: 0.005 sec - in com.jsoniter.output.TestCollection
Running com.jsoniter.TestAnnotationJsonObject
com.jsoniter.spi.JsonException: found should not present property: field1com.jsoniter.spi.JsonException: unknown property: field-1Tests run: 4, Failures: 0, Errors: 0, Skipped: 0, Time elapsed: 0.006 sec - in com.jsoniter.TestAnnotationJsonObject
Running com.jsoniter.TestExisting
Tests run: 6, Failures: 0, Errors: 0, Skipped: 0, Time elapsed: 0.016 sec - in com.jsoniter.TestSpiTypeDecoder
Running com.jsoniter.TestSpiPropertyDecoder
Tests run: 5, Failures: 2, Errors: 0, Skipped: 0, Time elapsed: 0.008 sec <<< FAILURE! - in com.jsoniter.TestExisting
test_reuse_list(com.jsoniter.TestExisting)  Time elapsed: 0.004 sec  <<< FAILURE!
junit.framework.AssertionFailedError: expected:<75457651> but was:<362239120>
	at com.jsoniter.TestExisting.test_reuse_list(TestExisting.java:54)

test_reuse_linked_list(com.jsoniter.TestExisting)  Time elapsed: 0 sec  <<< FAILURE!
junit.framework.AssertionFailedError: expected:<1018937824> but was:<905654280>
	at com.jsoniter.TestExisting.test_reuse_linked_list(TestExisting.java:61)

Running com.jsoniter.TestGenerics
Tests run: 22, Failures: 0, Errors: 0, Skipped: 0, Time elapsed: 0.028 sec - in com.jsoniter.TestGenerics
Running com.jsoniter.output.TestInteger
Tests run: 2, Failures: 0, Errors: 0, Skipped: 0, Time elapsed: 0.002 sec - in com.jsoniter.output.TestInteger
Tests run: 2, Failures: 0, Errors: 0, Skipped: 0, Time elapsed: 0.01 sec - in com.jsoniter.TestSpiPropertyDecoder
Tests run: 14, Failures: 0, Errors: 0, Skipped: 0, Time elapsed: 0.079 sec - in com.jsoniter.TestGson
Running com.jsoniter.output.TestGson
Gson: {"test":"lorem-👄👀"}
jsoniter: {"test":"lorem-👄👀"}
Tests run: 15, Failures: 0, Errors: 0, Skipped: 0, Time elapsed: 0.02 sec - in com.jsoniter.output.TestGson
Running com.jsoniter.output.TestStreamBuffer
Tests run: 6, Failures: 0, Errors: 0, Skipped: 0, Time elapsed: 0.001 sec - in com.jsoniter.output.TestStreamBuffer
Running com.jsoniter.output.TestCollection
Tests run: 2, Failures: 0, Errors: 0, Skipped: 0, Time elapsed: 0.003 sec - in com.jsoniter.output.TestCollection
Running com.jsoniter.TestAnnotationJsonObject
com.jsoniter.spi.JsonException: extra property: field1com.jsoniter.spi.JsonException: extra property: field-1Tests run: 4, Failures: 0, Errors: 0, Skipped: 0, Time elapsed: 0.02 sec - in com.jsoniter.TestAnnotationJsonObject
Running com.jsoniter.TestGenerics
Tests run: 22, Failures: 0, Errors: 0, Skipped: 0, Time elapsed: 0.104 sec - in com.jsoniter.TestGenerics
Running com.jsoniter.output.TestInteger
Tests run: 2, Failures: 0, Errors: 0, Skipped: 0, Time elapsed: 0.003 sec - in com.jsoniter.output.TestInteger
Running com.jsoniter.TestGson
Tests run: 14, Failures: 0, Errors: 0, Skipped: 0, Time elapsed: 0.077 sec - in com.jsoniter.TestGson
Running com.jsoniter.output.TestGson
Gson: {"test":"lorem-👄👀"}
jsoniter: {"test":"lorem-👄👀"}
Tests run: 15, Failures: 0, Errors: 0, Skipped: 0, Time elapsed: 0.021 sec - in com.jsoniter.output.TestGson
Running com.jsoniter.output.TestStreamBuffer
Tests run: 6, Failures: 0, Errors: 0, Skipped: 0, Time elapsed: 0.001 sec - in com.jsoniter.output.TestStreamBuffer
Running com.jsoniter.output.TestCollection
Tests run: 2, Failures: 0, Errors: 0, Skipped: 0, Time elapsed: 0.002 sec - in com.jsoniter.output.TestCollection
Running com.jsoniter.TestAnnotationJsonObject
com.jsoniter.spi.JsonException: extra property: field1com.jsoniter.spi.JsonException: extra property: field-1Tests run: 4, Failures: 0, Errors: 0, Skipped: 0, Time elapsed: 0.017 sec - in com.jsoniter.TestAnnotationJsonObject
Running com.jsoniter.TestGenerics
Tests run: 22, Failures: 0, Errors: 0, Skipped: 0, Time elapsed: 0.116 sec - in com.jsoniter.TestGenerics
Running com.jsoniter.output.TestInteger
Tests run: 2, Failures: 0, Errors: 0, Skipped: 0, Time elapsed: 0.005 sec - in com.jsoniter.output.TestInteger

Results :

Failed tests: 
com.jsoniter.TestExisting.test_reuse_linked_list(com.jsoniter.TestExisting)
  Run 1: PASS
  Run 2: PASS
  Run 3: TestExisting.test_reuse_linked_list:61 expected:<540585569> but was:<1007653873>
  Run 4: TestExisting.test_reuse_linked_list:61 expected:<1018937824> but was:<905654280>

com.jsoniter.TestExisting.test_reuse_list(com.jsoniter.TestExisting)
  Run 1: PASS
  Run 2: PASS
  Run 3: TestExisting.test_reuse_list:54 expected:<1234776885> but was:<540159270>
  Run 4: TestExisting.test_reuse_list:54 expected:<75457651> but was:<362239120>


Tests run: 1271, Failures: 2, Errors: 0, Skipped: 0

[INFO] ------------------------------------------------------------------------
[INFO] BUILD FAILURE
[INFO] ------------------------------------------------------------------------
[INFO] Total time: 5.819 s
[INFO] Finished at: 2018-03-05T07:38:00+01:00
[INFO] Final Memory: 27M/938M
[INFO] ------------------------------------------------------------------------
[ERROR] Failed to execute goal org.apache.maven.plugins:maven-surefire-plugin:2.19.1:test (default-test) on project jsoniter: There are test failures.
[ERROR] 
[ERROR] Please refer to /root/workspace/json-iterator/java/349155015/target/surefire-reports for the individual test results.
[ERROR] -> [Help 1]
[ERROR] 
[ERROR] To see the full stack trace of the errors, re-run Maven with the -e switch.
[ERROR] Re-run Maven using the -X switch to enable full debug logging.
[ERROR] 
[ERROR] For more information about the errors and possible solutions, please read the following articles:
[ERROR] [Help 1] http://cwiki.apache.org/confluence/display/MAVEN/MojoFailureException
