[INFO] Scanning for projects...
[INFO] ------------------------------------------------------------------------
[INFO] Reactor Build Order:
[INFO] 
[INFO] DHIS 2
[INFO] DHIS API
[INFO] DHIS Support Parent Project
[INFO] DHIS External Support
[INFO] DHIS Hibernate Support
[INFO] DHIS Test Support
[INFO] DHIS Support Commons
[INFO] DHIS System Support
[INFO] DHIS JDBC Service
[INFO] DHIS Services Parent Project
[INFO] DHIS Core API Implementations
[INFO] DHIS DXF 2 Data Exchange
[INFO] DHIS Mobile Service
[INFO] DHIS Administration Service
[INFO] DHIS Analytics
[INFO] DHIS Reporting Service
[INFO]                                                                         
[INFO] ------------------------------------------------------------------------
[INFO] Building DHIS 2 2.25
[INFO] ------------------------------------------------------------------------
[INFO]                                                                         
[INFO] ------------------------------------------------------------------------
[INFO] Building DHIS API 2.25
[INFO] ------------------------------------------------------------------------
[INFO] 
[INFO] --- maven-resources-plugin:2.5:resources (default-resources) @ dhis-api ---
[debug] execute contextualize
[INFO] Using 'UTF-8' encoding to copy filtered resources.
[INFO] skip non existing resourceDirectory /root/workspace/uonafya/jphes-core/392231543/dhis-2/dhis-api/src/main/resources
[INFO] 
[INFO] --- maven-compiler-plugin:2.3.2:compile (default-compile) @ dhis-api ---
[INFO] Nothing to compile - all classes are up to date
[INFO] 
[INFO] --- maven-resources-plugin:2.5:testResources (default-testResources) @ dhis-api ---
[debug] execute contextualize
[INFO] Using 'UTF-8' encoding to copy filtered resources.
[INFO] Copying 1 resource
[INFO] 
[INFO] --- maven-compiler-plugin:2.3.2:testCompile (default-testCompile) @ dhis-api ---
[INFO] Nothing to compile - all classes are up to date
[INFO] 
[INFO] --- maven-surefire-plugin:2.18.1:test (default-test) @ dhis-api ---
[INFO] Surefire report directory: /root/workspace/uonafya/jphes-core/392231543/dhis-2/dhis-api/target/surefire-reports
[INFO] parallel='none', perCoreThreadCount=true, threadCount=0, useUnlimitedThreads=false, threadCountSuites=0, threadCountClasses=0, threadCountMethods=0, parallelOptimized=true
[INFO] Downloading: https://repo.maven.apache.org/maven2/org/apache/maven/surefire/surefire-junit47/2.18.1/surefire-junit47-2.18.1.pom
[INFO] Downloaded: https://repo.maven.apache.org/maven2/org/apache/maven/surefire/surefire-junit47/2.18.1/surefire-junit47-2.18.1.pom (5 KB at 11.7 KB/sec)
[INFO] Downloading: https://repo.maven.apache.org/maven2/org/apache/maven/surefire/surefire-providers/2.18.1/surefire-providers-2.18.1.pom
[INFO] Downloaded: https://repo.maven.apache.org/maven2/org/apache/maven/surefire/surefire-providers/2.18.1/surefire-providers-2.18.1.pom (3 KB at 138.0 KB/sec)
[INFO] Downloading: https://repo.maven.apache.org/maven2/com/github/stephenc/jcip/jcip-annotations/1.0-1/jcip-annotations-1.0-1.pom
[INFO] Downloaded: https://repo.maven.apache.org/maven2/com/github/stephenc/jcip/jcip-annotations/1.0-1/jcip-annotations-1.0-1.pom (6 KB at 176.7 KB/sec)
[INFO] Downloading: https://repo.maven.apache.org/maven2/org/sonatype/oss/oss-parent/7/oss-parent-7.pom
[INFO] Downloaded: https://repo.maven.apache.org/maven2/org/sonatype/oss/oss-parent/7/oss-parent-7.pom (0 B at 0.0 KB/sec)
[INFO] Downloading: https://repo.maven.apache.org/maven2/org/apache/maven/surefire/common-junit48/2.18.1/common-junit48-2.18.1.pom
[INFO] Downloaded: https://repo.maven.apache.org/maven2/org/apache/maven/surefire/common-junit48/2.18.1/common-junit48-2.18.1.pom (4 KB at 173.1 KB/sec)
[INFO] Downloading: https://repo.maven.apache.org/maven2/org/apache/maven/surefire/common-junit4/2.18.1/common-junit4-2.18.1.pom
[INFO] Downloaded: https://repo.maven.apache.org/maven2/org/apache/maven/surefire/common-junit4/2.18.1/common-junit4-2.18.1.pom (2 KB at 62.4 KB/sec)
[INFO] Downloading: https://repo.maven.apache.org/maven2/org/apache/maven/surefire/common-junit3/2.18.1/common-junit3-2.18.1.pom
[INFO] Downloaded: https://repo.maven.apache.org/maven2/org/apache/maven/surefire/common-junit3/2.18.1/common-junit3-2.18.1.pom (2 KB at 85.0 KB/sec)
[INFO] Downloading: https://repo.maven.apache.org/maven2/org/apache/maven/surefire/common-java5/2.18.1/common-java5-2.18.1.pom
[INFO] Downloaded: https://repo.maven.apache.org/maven2/org/apache/maven/surefire/common-java5/2.18.1/common-java5-2.18.1.pom (2 KB at 99.2 KB/sec)
[INFO] Downloading: https://repo.maven.apache.org/maven2/org/apache/maven/shared/maven-shared-utils/0.4/maven-shared-utils-0.4.pom
[INFO] Downloaded: https://repo.maven.apache.org/maven2/org/apache/maven/shared/maven-shared-utils/0.4/maven-shared-utils-0.4.pom (4 KB at 232.5 KB/sec)
[INFO] Downloading: https://repo.maven.apache.org/maven2/org/apache/maven/shared/maven-shared-components/19/maven-shared-components-19.pom
[INFO] Downloaded: https://repo.maven.apache.org/maven2/org/apache/maven/shared/maven-shared-components/19/maven-shared-components-19.pom (7 KB at 388.1 KB/sec)
[INFO] Downloading: https://repo.maven.apache.org/maven2/org/apache/maven/maven-parent/23/maven-parent-23.pom
[INFO] Downloaded: https://repo.maven.apache.org/maven2/org/apache/maven/maven-parent/23/maven-parent-23.pom (32 KB at 1325.9 KB/sec)
[INFO] Downloading: https://repo.maven.apache.org/maven2/org/apache/apache/13/apache-13.pom
[INFO] Downloaded: https://repo.maven.apache.org/maven2/org/apache/apache/13/apache-13.pom (0 B at 0.0 KB/sec)
[INFO] Downloading: https://repo.maven.apache.org/maven2/com/google/code/findbugs/jsr305/2.0.1/jsr305-2.0.1.pom
[INFO] Downloaded: https://repo.maven.apache.org/maven2/com/google/code/findbugs/jsr305/2.0.1/jsr305-2.0.1.pom (965 B at 58.9 KB/sec)
[INFO] Downloading: https://repo.maven.apache.org/maven2/org/apache/maven/surefire/surefire-grouper/2.18.1/surefire-grouper-2.18.1.pom
[INFO] Downloaded: https://repo.maven.apache.org/maven2/org/apache/maven/surefire/surefire-grouper/2.18.1/surefire-grouper-2.18.1.pom (3 KB at 159.1 KB/sec)
[INFO] Downloading: https://repo.maven.apache.org/maven2/org/apache/maven/surefire/surefire-junit47/2.18.1/surefire-junit47-2.18.1.jar
[INFO] Downloading: https://repo.maven.apache.org/maven2/org/apache/maven/surefire/common-junit3/2.18.1/common-junit3-2.18.1.jar
[INFO] Downloading: https://repo.maven.apache.org/maven2/org/apache/maven/surefire/common-junit48/2.18.1/common-junit48-2.18.1.jar
[INFO] Downloading: https://repo.maven.apache.org/maven2/com/github/stephenc/jcip/jcip-annotations/1.0-1/jcip-annotations-1.0-1.jar
[INFO] Downloading: https://repo.maven.apache.org/maven2/org/apache/maven/surefire/common-junit4/2.18.1/common-junit4-2.18.1.jar
[INFO] Downloaded: https://repo.maven.apache.org/maven2/com/github/stephenc/jcip/jcip-annotations/1.0-1/jcip-annotations-1.0-1.jar (5 KB at 124.6 KB/sec)
[INFO] Downloaded: https://repo.maven.apache.org/maven2/org/apache/maven/surefire/common-junit3/2.18.1/common-junit3-2.18.1.jar (12 KB at 298.5 KB/sec)
[INFO] Downloading: https://repo.maven.apache.org/maven2/org/apache/maven/surefire/common-java5/2.18.1/common-java5-2.18.1.jar
[INFO] Downloading: https://repo.maven.apache.org/maven2/org/apache/maven/shared/maven-shared-utils/0.4/maven-shared-utils-0.4.jar
[INFO] Downloaded: https://repo.maven.apache.org/maven2/org/apache/maven/surefire/common-junit48/2.18.1/common-junit48-2.18.1.jar (19 KB at 473.3 KB/sec)
[INFO] Downloaded: https://repo.maven.apache.org/maven2/org/apache/maven/surefire/common-junit4/2.18.1/common-junit4-2.18.1.jar (19 KB at 463.1 KB/sec)
[INFO] Downloading: https://repo.maven.apache.org/maven2/com/google/code/findbugs/jsr305/2.0.1/jsr305-2.0.1.jar
[INFO] Downloaded: https://repo.maven.apache.org/maven2/org/apache/maven/surefire/surefire-junit47/2.18.1/surefire-junit47-2.18.1.jar (131 KB at 2955.6 KB/sec)
[INFO] Downloading: https://repo.maven.apache.org/maven2/org/apache/maven/surefire/surefire-grouper/2.18.1/surefire-grouper-2.18.1.jar
[INFO] Downloaded: https://repo.maven.apache.org/maven2/org/apache/maven/surefire/common-java5/2.18.1/common-java5-2.18.1.jar (37 KB at 1821.5 KB/sec)
[INFO] Downloaded: https://repo.maven.apache.org/maven2/com/google/code/findbugs/jsr305/2.0.1/jsr305-2.0.1.jar (32 KB at 1556.0 KB/sec)
[INFO] Downloaded: https://repo.maven.apache.org/maven2/org/apache/maven/surefire/surefire-grouper/2.18.1/surefire-grouper-2.18.1.jar (38 KB at 1786.6 KB/sec)
[INFO] Downloaded: https://repo.maven.apache.org/maven2/org/apache/maven/shared/maven-shared-utils/0.4/maven-shared-utils-0.4.jar (152 KB at 4744.0 KB/sec)

-------------------------------------------------------
 T E S T S
-------------------------------------------------------
Running org.hisp.dhis.common.IdSchemesTest
Tests run: 2, Failures: 0, Errors: 0, Skipped: 0, Time elapsed: 0.012 sec - in org.hisp.dhis.common.IdSchemesTest
Running org.hisp.dhis.common.CombinationGeneratorTest
Tests run: 8, Failures: 0, Errors: 0, Skipped: 0, Time elapsed: 0 sec - in org.hisp.dhis.common.CombinationGeneratorTest
Running org.hisp.dhis.common.ListMapTest
Tests run: 3, Failures: 0, Errors: 0, Skipped: 0, Time elapsed: 0.05 sec - in org.hisp.dhis.common.ListMapTest
Running org.hisp.dhis.common.ValueTypeTest
Tests run: 1, Failures: 0, Errors: 0, Skipped: 0, Time elapsed: 0.003 sec - in org.hisp.dhis.common.ValueTypeTest
Running org.hisp.dhis.common.DimensionalObjectUtilsTest
Tests run: 8, Failures: 0, Errors: 0, Skipped: 0, Time elapsed: 0.014 sec - in org.hisp.dhis.common.DimensionalObjectUtilsTest
Running org.hisp.dhis.common.BaseIdentifiableObjectTest
Tests run: 1, Failures: 0, Errors: 0, Skipped: 0, Time elapsed: 0 sec - in org.hisp.dhis.common.BaseIdentifiableObjectTest
Running org.hisp.dhis.common.BaseAnalyticalObjectTest
Tests run: 7, Failures: 0, Errors: 0, Skipped: 0, Time elapsed: 0.023 sec - in org.hisp.dhis.common.BaseAnalyticalObjectTest
Running org.hisp.dhis.common.DimensionalObjectTest
Tests run: 1, Failures: 0, Errors: 0, Skipped: 0, Time elapsed: 0 sec - in org.hisp.dhis.common.DimensionalObjectTest
Running org.hisp.dhis.common.CodeGeneratorTest
Tests run: 1, Failures: 0, Errors: 0, Skipped: 0, Time elapsed: 0.014 sec - in org.hisp.dhis.common.CodeGeneratorTest
Running org.hisp.dhis.common.IdentifiableObjectUtilsTest
Tests run: 2, Failures: 0, Errors: 0, Skipped: 0, Time elapsed: 0.014 sec - in org.hisp.dhis.common.IdentifiableObjectUtilsTest
Running org.hisp.dhis.common.AccessStringHelperTest
Tests run: 5, Failures: 0, Errors: 0, Skipped: 0, Time elapsed: 0.001 sec - in org.hisp.dhis.common.AccessStringHelperTest
Running org.hisp.dhis.period.PeriodTypeTest
Tests run: 2, Failures: 0, Errors: 0, Skipped: 0, Time elapsed: 0.205 sec - in org.hisp.dhis.period.PeriodTypeTest
Running org.hisp.dhis.period.WeeklyPeriodTypeTest
Tests run: 8, Failures: 0, Errors: 0, Skipped: 1, Time elapsed: 0.129 sec - in org.hisp.dhis.period.WeeklyPeriodTypeTest
Running org.hisp.dhis.period.MonthlyPeriodTypeTest
Tests run: 12, Failures: 0, Errors: 0, Skipped: 0, Time elapsed: 0.037 sec - in org.hisp.dhis.period.MonthlyPeriodTypeTest
Running org.hisp.dhis.period.BiMonthlyPeriodTypeTest
Tests run: 6, Failures: 0, Errors: 0, Skipped: 0, Time elapsed: 0.01 sec - in org.hisp.dhis.period.BiMonthlyPeriodTypeTest
Running org.hisp.dhis.period.StringFormatTest
Tests run: 1, Failures: 0, Errors: 0, Skipped: 0, Time elapsed: 0.006 sec - in org.hisp.dhis.period.StringFormatTest
Running org.hisp.dhis.period.SixMonthlyPeriodTypeTest
Tests run: 6, Failures: 0, Errors: 0, Skipped: 0, Time elapsed: 0.005 sec - in org.hisp.dhis.period.SixMonthlyPeriodTypeTest
Running org.hisp.dhis.period.FinancialAprilPeriodTypeTest
Tests run: 4, Failures: 0, Errors: 0, Skipped: 0, Time elapsed: 0.006 sec - in org.hisp.dhis.period.FinancialAprilPeriodTypeTest
Running org.hisp.dhis.period.FinancialJulyPeriodTypeTest
Tests run: 4, Failures: 0, Errors: 0, Skipped: 0, Time elapsed: 0.005 sec - in org.hisp.dhis.period.FinancialJulyPeriodTypeTest
Running org.hisp.dhis.period.FinancialOctoberPeriodTypeTest
Tests run: 4, Failures: 0, Errors: 0, Skipped: 0, Time elapsed: 0.009 sec - in org.hisp.dhis.period.FinancialOctoberPeriodTypeTest
Running org.hisp.dhis.period.RelativePeriodTest
Tests run: 22, Failures: 0, Errors: 0, Skipped: 0, Time elapsed: 0.046 sec - in org.hisp.dhis.period.RelativePeriodTest
Running org.hisp.dhis.period.YearlyPeriodTypeTest
Tests run: 5, Failures: 0, Errors: 0, Skipped: 0, Time elapsed: 0.003 sec - in org.hisp.dhis.period.YearlyPeriodTypeTest
Running org.hisp.dhis.period.SixMonthlyAprilPeriodTypeTest
Tests run: 8, Failures: 0, Errors: 0, Skipped: 0, Time elapsed: 0.004 sec - in org.hisp.dhis.period.SixMonthlyAprilPeriodTypeTest
Running org.hisp.dhis.period.QuarterlyPeriodTypeTest
Tests run: 10, Failures: 0, Errors: 0, Skipped: 0, Time elapsed: 0.004 sec - in org.hisp.dhis.period.QuarterlyPeriodTypeTest
Running org.hisp.dhis.dataset.comparator.DataSetApprovalFrequencyComparatorTest
Tests run: 4, Failures: 0, Errors: 0, Skipped: 0, Time elapsed: 0.013 sec - in org.hisp.dhis.dataset.comparator.DataSetApprovalFrequencyComparatorTest
Running org.hisp.dhis.dataset.comparator.DataSetFrequencyComparatorTest
Tests run: 2, Failures: 0, Errors: 0, Skipped: 0, Time elapsed: 0 sec - in org.hisp.dhis.dataset.comparator.DataSetFrequencyComparatorTest
Running org.hisp.dhis.dataset.DataSetTest
Tests run: 2, Failures: 0, Errors: 0, Skipped: 0, Time elapsed: 0.014 sec - in org.hisp.dhis.dataset.DataSetTest
Running org.hisp.dhis.feedback.TypeReportTest
Tests run: 2, Failures: 0, Errors: 0, Skipped: 0, Time elapsed: 0.004 sec - in org.hisp.dhis.feedback.TypeReportTest
Running org.hisp.dhis.calendar.DateTimeUnitTest
Tests run: 9, Failures: 0, Errors: 0, Skipped: 0, Time elapsed: 0.008 sec - in org.hisp.dhis.calendar.DateTimeUnitTest
Running org.hisp.dhis.calendar.impl.EthiopianCalendarTest
Tests run: 9, Failures: 0, Errors: 0, Skipped: 0, Time elapsed: 0.328 sec - in org.hisp.dhis.calendar.impl.EthiopianCalendarTest
Running org.hisp.dhis.calendar.impl.NepaliCalendarTest
Tests run: 2, Failures: 0, Errors: 0, Skipped: 0, Time elapsed: 0.017 sec - in org.hisp.dhis.calendar.impl.NepaliCalendarTest
Running org.hisp.dhis.calendar.DateTimeUnitPeriodTypeParserTest
Tests run: 1, Failures: 0, Errors: 0, Skipped: 0, Time elapsed: 0.004 sec - in org.hisp.dhis.calendar.DateTimeUnitPeriodTypeParserTest
Running org.hisp.dhis.program.ProgramIndicatorTest
Tests run: 1, Failures: 0, Errors: 0, Skipped: 0, Time elapsed: 0.001 sec - in org.hisp.dhis.program.ProgramIndicatorTest
Running org.hisp.dhis.program.ProgramTest
Tests run: 1, Failures: 0, Errors: 0, Skipped: 0, Time elapsed: 0 sec - in org.hisp.dhis.program.ProgramTest
Running org.hisp.dhis.dashboard.DashboardTest
Tests run: 3, Failures: 0, Errors: 0, Skipped: 0, Time elapsed: 0.004 sec - in org.hisp.dhis.dashboard.DashboardTest
Running org.hisp.dhis.preheat.PreheatTest
Tests run: 6, Failures: 0, Errors: 0, Skipped: 0, Time elapsed: 0.013 sec - in org.hisp.dhis.preheat.PreheatTest
Running org.hisp.dhis.dataelement.DataElementTest
Tests run: 6, Failures: 0, Errors: 0, Skipped: 0, Time elapsed: 0.006 sec - in org.hisp.dhis.dataelement.DataElementTest
Running org.hisp.dhis.dataelement.CategoryComboMapTest
Tests run: 2, Failures: 0, Errors: 0, Skipped: 0, Time elapsed: 0.003 sec - in org.hisp.dhis.dataelement.CategoryComboMapTest
Running org.hisp.dhis.dataelement.OperandTest
Tests run: 4, Failures: 0, Errors: 0, Skipped: 0, Time elapsed: 0.002 sec - in org.hisp.dhis.dataelement.OperandTest
Running org.hisp.dhis.dataelement.DataElementCategoryComboTest
Tests run: 2, Failures: 0, Errors: 0, Skipped: 0, Time elapsed: 0.001 sec - in org.hisp.dhis.dataelement.DataElementCategoryComboTest
Running org.hisp.dhis.appmanager.AppTest
Tests run: 5, Failures: 0, Errors: 0, Skipped: 0, Time elapsed: 0.296 sec - in org.hisp.dhis.appmanager.AppTest
Running org.hisp.dhis.datavalue.DataValueTest
Tests run: 1, Failures: 0, Errors: 0, Skipped: 0, Time elapsed: 0 sec - in org.hisp.dhis.datavalue.DataValueTest
Running org.hisp.dhis.sqlview.SqlViewTest
Tests run: 3, Failures: 0, Errors: 0, Skipped: 0, Time elapsed: 0.003 sec - in org.hisp.dhis.sqlview.SqlViewTest
Running org.hisp.dhis.organisationunit.OrganisationUnitHierarchyTest
Tests run: 4, Failures: 0, Errors: 0, Skipped: 0, Time elapsed: 0.017 sec - in org.hisp.dhis.organisationunit.OrganisationUnitHierarchyTest
Running org.hisp.dhis.organisationunit.OrganisationUnitTest
Tests run: 8, Failures: 0, Errors: 0, Skipped: 0, Time elapsed: 0.001 sec - in org.hisp.dhis.organisationunit.OrganisationUnitTest
Running org.hisp.dhis.util.ObjectUtilsTest
Tests run: 2, Failures: 0, Errors: 0, Skipped: 0, Time elapsed: 0.002 sec - in org.hisp.dhis.util.ObjectUtilsTest
Running org.hisp.dhis.validation.ValidationRuleGroupTest
Tests run: 3, Failures: 0, Errors: 0, Skipped: 0, Time elapsed: 0.002 sec - in org.hisp.dhis.validation.ValidationRuleGroupTest

Results :

Tests run: 213, Failures: 0, Errors: 0, Skipped: 1

[INFO]                                                                         
[INFO] ------------------------------------------------------------------------
[INFO] Building DHIS Support Parent Project 2.25
[INFO] ------------------------------------------------------------------------
[INFO]                                                                         
[INFO] ------------------------------------------------------------------------
[INFO] Building DHIS External Support 2.25
[INFO] ------------------------------------------------------------------------
[INFO] 
[INFO] --- maven-resources-plugin:2.5:resources (default-resources) @ dhis-support-external ---
[debug] execute contextualize
[INFO] Using 'UTF-8' encoding to copy filtered resources.
[INFO] Copying 1 resource
[INFO] 
[INFO] --- maven-compiler-plugin:2.3.2:compile (default-compile) @ dhis-support-external ---
[INFO] Nothing to compile - all classes are up to date
[INFO] 
[INFO] --- maven-resources-plugin:2.5:testResources (default-testResources) @ dhis-support-external ---
[debug] execute contextualize
[INFO] Using 'UTF-8' encoding to copy filtered resources.
[INFO] skip non existing resourceDirectory /root/workspace/uonafya/jphes-core/392231543/dhis-2/dhis-support/dhis-support-external/src/test/resources
[INFO] 
[INFO] --- maven-compiler-plugin:2.3.2:testCompile (default-testCompile) @ dhis-support-external ---
[INFO] No sources to compile
[INFO] 
[INFO] --- maven-surefire-plugin:2.18.1:test (default-test) @ dhis-support-external ---
[INFO] No tests to run.
[INFO]                                                                         
[INFO] ------------------------------------------------------------------------
[INFO] Building DHIS Hibernate Support 2.25
[INFO] ------------------------------------------------------------------------
[INFO] 
[INFO] --- maven-resources-plugin:2.5:resources (default-resources) @ dhis-support-hibernate ---
[debug] execute contextualize
[INFO] Using 'UTF-8' encoding to copy filtered resources.
[INFO] Copying 7 resources
[INFO] 
[INFO] --- maven-compiler-plugin:2.3.2:compile (default-compile) @ dhis-support-hibernate ---
[INFO] Nothing to compile - all classes are up to date
[INFO] 
[INFO] --- maven-resources-plugin:2.5:testResources (default-testResources) @ dhis-support-hibernate ---
[debug] execute contextualize
[INFO] Using 'UTF-8' encoding to copy filtered resources.
[INFO] skip non existing resourceDirectory /root/workspace/uonafya/jphes-core/392231543/dhis-2/dhis-support/dhis-support-hibernate/src/test/resources
[INFO] 
[INFO] --- maven-compiler-plugin:2.3.2:testCompile (default-testCompile) @ dhis-support-hibernate ---
[INFO] No sources to compile
[INFO] 
[INFO] --- maven-surefire-plugin:2.18.1:test (default-test) @ dhis-support-hibernate ---
[INFO] No tests to run.
[INFO]                                                                         
[INFO] ------------------------------------------------------------------------
[INFO] Building DHIS Test Support 2.25
[INFO] ------------------------------------------------------------------------
[INFO] 
[INFO] --- maven-resources-plugin:2.5:resources (default-resources) @ dhis-support-test ---
[debug] execute contextualize
[INFO] Using 'UTF-8' encoding to copy filtered resources.
[INFO] Copying 1 resource
[INFO] 
[INFO] --- maven-compiler-plugin:2.3.2:compile (default-compile) @ dhis-support-test ---
[INFO] Nothing to compile - all classes are up to date
[INFO] 
[INFO] --- maven-resources-plugin:2.5:testResources (default-testResources) @ dhis-support-test ---
[debug] execute contextualize
[INFO] Using 'UTF-8' encoding to copy filtered resources.
[INFO] skip non existing resourceDirectory /root/workspace/uonafya/jphes-core/392231543/dhis-2/dhis-support/dhis-support-test/src/test/resources
[INFO] 
[INFO] --- maven-compiler-plugin:2.3.2:testCompile (default-testCompile) @ dhis-support-test ---
[INFO] No sources to compile
[INFO] 
[INFO] --- maven-surefire-plugin:2.18.1:test (default-test) @ dhis-support-test ---
[INFO] No tests to run.
[INFO]                                                                         
[INFO] ------------------------------------------------------------------------
[INFO] Building DHIS Support Commons 2.25
[INFO] ------------------------------------------------------------------------
[INFO] 
[INFO] --- maven-resources-plugin:2.5:resources (default-resources) @ dhis-support-commons ---
[debug] execute contextualize
[INFO] Using 'UTF-8' encoding to copy filtered resources.
[INFO] skip non existing resourceDirectory /root/workspace/uonafya/jphes-core/392231543/dhis-2/dhis-support/dhis-support-commons/src/main/resources
[INFO] 
[INFO] --- maven-compiler-plugin:2.3.2:compile (default-compile) @ dhis-support-commons ---
[INFO] Compiling 6 source files to /root/workspace/uonafya/jphes-core/392231543/dhis-2/dhis-support/dhis-support-commons/target/classes
[INFO] 
[INFO] --- maven-resources-plugin:2.5:testResources (default-testResources) @ dhis-support-commons ---
[debug] execute contextualize
[INFO] Using 'UTF-8' encoding to copy filtered resources.
[INFO] skip non existing resourceDirectory /root/workspace/uonafya/jphes-core/392231543/dhis-2/dhis-support/dhis-support-commons/src/test/resources
[INFO] 
[INFO] --- maven-compiler-plugin:2.3.2:testCompile (default-testCompile) @ dhis-support-commons ---
[INFO] Nothing to compile - all classes are up to date
[INFO] 
[INFO] --- maven-surefire-plugin:2.18.1:test (default-test) @ dhis-support-commons ---
[INFO] Surefire report directory: /root/workspace/uonafya/jphes-core/392231543/dhis-2/dhis-support/dhis-support-commons/target/surefire-reports
[INFO] parallel='none', perCoreThreadCount=true, threadCount=0, useUnlimitedThreads=false, threadCountSuites=0, threadCountClasses=0, threadCountMethods=0, parallelOptimized=true

-------------------------------------------------------
 T E S T S
-------------------------------------------------------
Running org.hisp.dhis.commons.util.ListUtilsTest
Tests run: 2, Failures: 0, Errors: 0, Skipped: 0, Time elapsed: 0.002 sec - in org.hisp.dhis.commons.util.ListUtilsTest
Running org.hisp.dhis.commons.util.ExpressionFunctionsTest
Tests run: 1, Failures: 0, Errors: 0, Skipped: 0, Time elapsed: 0.066 sec - in org.hisp.dhis.commons.util.ExpressionFunctionsTest
Running org.hisp.dhis.commons.util.PageRangeTest
Tests run: 3, Failures: 0, Errors: 0, Skipped: 0, Time elapsed: 0 sec - in org.hisp.dhis.commons.util.PageRangeTest
Running org.hisp.dhis.commons.util.CronUtilsTest
Tests run: 4, Failures: 0, Errors: 0, Skipped: 0, Time elapsed: 0.001 sec - in org.hisp.dhis.commons.util.CronUtilsTest
Running org.hisp.dhis.commons.util.ExpressionUtilsTest
Tests run: 10, Failures: 0, Errors: 0, Skipped: 0, Time elapsed: 0.111 sec - in org.hisp.dhis.commons.util.ExpressionUtilsTest
Running org.hisp.dhis.commons.util.PaginatedListTest
Tests run: 7, Failures: 0, Errors: 0, Skipped: 0, Time elapsed: 0.001 sec - in org.hisp.dhis.commons.util.PaginatedListTest
Running org.hisp.dhis.commons.util.TextUtilsTest
Tests run: 9, Failures: 0, Errors: 0, Skipped: 0, Time elapsed: 0.007 sec - in org.hisp.dhis.commons.util.TextUtilsTest
Running org.hisp.dhis.commons.collection.CachingMapTest
Tests run: 6, Failures: 0, Errors: 0, Skipped: 0, Time elapsed: 0.003 sec - in org.hisp.dhis.commons.collection.CachingMapTest

Results :

Tests run: 42, Failures: 0, Errors: 0, Skipped: 0

[INFO]                                                                         
[INFO] ------------------------------------------------------------------------
[INFO] Building DHIS System Support 2.25
[INFO] ------------------------------------------------------------------------
[INFO] 
[INFO] --- maven-resources-plugin:2.5:resources (default-resources) @ dhis-support-system ---
[debug] execute contextualize
[INFO] Using 'UTF-8' encoding to copy filtered resources.
[INFO] Copying 12 resources
[INFO] 
[INFO] --- maven-compiler-plugin:2.3.2:compile (default-compile) @ dhis-support-system ---
[INFO] Nothing to compile - all classes are up to date
[INFO] 
[INFO] --- maven-resources-plugin:2.5:testResources (default-testResources) @ dhis-support-system ---
[debug] execute contextualize
[INFO] Using 'UTF-8' encoding to copy filtered resources.
[INFO] Copying 4 resources
[INFO] 
[INFO] --- maven-compiler-plugin:2.3.2:testCompile (default-testCompile) @ dhis-support-system ---
[INFO] Nothing to compile - all classes are up to date
[INFO] 
[INFO] --- maven-surefire-plugin:2.18.1:test (default-test) @ dhis-support-system ---
[INFO] Surefire report directory: /root/workspace/uonafya/jphes-core/392231543/dhis-2/dhis-support/dhis-support-system/target/surefire-reports
[INFO] parallel='none', perCoreThreadCount=true, threadCount=0, useUnlimitedThreads=false, threadCountSuites=0, threadCountClasses=0, threadCountMethods=0, parallelOptimized=true

-------------------------------------------------------
 T E S T S
-------------------------------------------------------
Running org.hisp.dhis.system.util.MathUtilsTest
Tests run: 19, Failures: 0, Errors: 0, Skipped: 0, Time elapsed: 0.411 sec - in org.hisp.dhis.system.util.MathUtilsTest
Running org.hisp.dhis.system.util.LocaleUtilsTest
Tests run: 1, Failures: 0, Errors: 0, Skipped: 0, Time elapsed: 0 sec - in org.hisp.dhis.system.util.LocaleUtilsTest
Running org.hisp.dhis.system.util.ValidationUtilsTest
Tests run: 10, Failures: 0, Errors: 0, Skipped: 0, Time elapsed: 0.113 sec - in org.hisp.dhis.system.util.ValidationUtilsTest
Running org.hisp.dhis.system.util.GeoUtilsTest
Tests run: 2, Failures: 0, Errors: 0, Skipped: 0, Time elapsed: 0.03 sec - in org.hisp.dhis.system.util.GeoUtilsTest
Running org.hisp.dhis.system.util.DateUtilsTest
Tests run: 15, Failures: 0, Errors: 0, Skipped: 0, Time elapsed: 0.029 sec - in org.hisp.dhis.system.util.DateUtilsTest
Running org.hisp.dhis.system.util.StreamUtilsTest
Tests run: 3, Failures: 0, Errors: 0, Skipped: 0, Time elapsed: 0.003 sec - in org.hisp.dhis.system.util.StreamUtilsTest
Running org.hisp.dhis.system.util.ReflectionUtilsTest
Tests run: 6, Failures: 0, Errors: 0, Skipped: 0, Time elapsed: 0.004 sec - in org.hisp.dhis.system.util.ReflectionUtilsTest
Running org.hisp.dhis.system.util.CodeUtilsTest
Tests run: 2, Failures: 0, Errors: 0, Skipped: 0, Time elapsed: 0.001 sec - in org.hisp.dhis.system.util.CodeUtilsTest
Running org.hisp.dhis.system.grid.GridUtilsTest
Tests run: 1, Failures: 0, Errors: 0, Skipped: 0, Time elapsed: 0.118 sec - in org.hisp.dhis.system.grid.GridUtilsTest
Running org.hisp.dhis.system.grid.GridTest
Tests run: 36, Failures: 0, Errors: 0, Skipped: 0, Time elapsed: 4.068 sec - in org.hisp.dhis.system.grid.GridTest
Running org.hisp.dhis.system.notification.NotifierTest
Tests run: 3, Failures: 0, Errors: 0, Skipped: 0, Time elapsed: 0.088 sec - in org.hisp.dhis.system.notification.NotifierTest
Running org.hisp.dhis.system.database.DatabaseInfoProviderTest
Tests run: 1, Failures: 0, Errors: 0, Skipped: 0, Time elapsed: 0.017 sec - in org.hisp.dhis.system.database.DatabaseInfoProviderTest
Running org.hisp.dhis.system.filter.AggregatableDataElementFilterTest
Tests run: 1, Failures: 0, Errors: 0, Skipped: 0, Time elapsed: 0.001 sec - in org.hisp.dhis.system.filter.AggregatableDataElementFilterTest
Running org.hisp.dhis.system.collection.UniqueArrayListTest
Tests run: 3, Failures: 0, Errors: 0, Skipped: 0, Time elapsed: 0.039 sec - in org.hisp.dhis.system.collection.UniqueArrayListTest

Results :

Tests run: 103, Failures: 0, Errors: 0, Skipped: 0

[INFO]                                                                         
[INFO] ------------------------------------------------------------------------
[INFO] Building DHIS JDBC Service 2.25
[INFO] ------------------------------------------------------------------------
[INFO] 
[INFO] --- maven-resources-plugin:2.5:resources (default-resources) @ dhis-support-jdbc ---
[debug] execute contextualize
[INFO] Using 'UTF-8' encoding to copy filtered resources.
[INFO] Copying 1 resource
[INFO] 
[INFO] --- maven-compiler-plugin:2.3.2:compile (default-compile) @ dhis-support-jdbc ---
[INFO] Nothing to compile - all classes are up to date
[INFO] 
[INFO] --- maven-resources-plugin:2.5:testResources (default-testResources) @ dhis-support-jdbc ---
[debug] execute contextualize
[INFO] Using 'UTF-8' encoding to copy filtered resources.
[INFO] skip non existing resourceDirectory /root/workspace/uonafya/jphes-core/392231543/dhis-2/dhis-support/dhis-support-jdbc/src/test/resources
[INFO] 
[INFO] --- maven-compiler-plugin:2.3.2:testCompile (default-testCompile) @ dhis-support-jdbc ---
[INFO] No sources to compile
[INFO] 
[INFO] --- maven-surefire-plugin:2.18.1:test (default-test) @ dhis-support-jdbc ---
[INFO] No tests to run.
[INFO]                                                                         
[INFO] ------------------------------------------------------------------------
[INFO] Building DHIS Services Parent Project 2.25
[INFO] ------------------------------------------------------------------------
[INFO]                                                                         
[INFO] ------------------------------------------------------------------------
[INFO] Building DHIS Core API Implementations 2.25
[INFO] ------------------------------------------------------------------------
[INFO] 
[INFO] --- maven-resources-plugin:2.5:resources (default-resources) @ dhis-service-core ---
[debug] execute contextualize
[INFO] Using 'UTF-8' encoding to copy filtered resources.
[INFO] Copying 172 resources
[INFO] 
[INFO] --- maven-compiler-plugin:2.3.2:compile (default-compile) @ dhis-service-core ---
[INFO] Nothing to compile - all classes are up to date
[INFO] 
[INFO] --- maven-resources-plugin:2.5:testResources (default-testResources) @ dhis-service-core ---
[debug] execute contextualize
[INFO] Using 'UTF-8' encoding to copy filtered resources.
[INFO] Copying 7 resources
[INFO] 
[INFO] --- maven-compiler-plugin:2.3.2:testCompile (default-testCompile) @ dhis-service-core ---
[INFO] Nothing to compile - all classes are up to date
[INFO] 
[INFO] --- maven-surefire-plugin:2.18.1:test (default-test) @ dhis-service-core ---
[INFO] Surefire report directory: /root/workspace/uonafya/jphes-core/392231543/dhis-2/dhis-services/dhis-service-core/target/surefire-reports
[INFO] parallel='none', perCoreThreadCount=true, threadCount=0, useUnlimitedThreads=false, threadCountSuites=0, threadCountClasses=0, threadCountMethods=0, parallelOptimized=true

-------------------------------------------------------
 T E S T S
-------------------------------------------------------
Running org.hisp.dhis.security.oauth2.OAuth2ClientStoreTest
Tests run: 2, Failures: 0, Errors: 0, Skipped: 0, Time elapsed: 0.214 sec - in org.hisp.dhis.security.oauth2.OAuth2ClientStoreTest
Running org.hisp.dhis.security.oauth2.OAuth2ClientServiceTest
Tests run: 2, Failures: 0, Errors: 0, Skipped: 0, Time elapsed: 0.064 sec - in org.hisp.dhis.security.oauth2.OAuth2ClientServiceTest
Running org.hisp.dhis.security.acl.AclServiceTest
Tests run: 33, Failures: 0, Errors: 0, Skipped: 0, Time elapsed: 4.183 sec - in org.hisp.dhis.security.acl.AclServiceTest
Running org.hisp.dhis.security.SecurityServiceTest
Tests run: 5, Failures: 0, Errors: 0, Skipped: 0, Time elapsed: 3.372 sec - in org.hisp.dhis.security.SecurityServiceTest
Running org.hisp.dhis.security.PasswordManagerTest
Tests run: 1, Failures: 0, Errors: 0, Skipped: 0, Time elapsed: 0.488 sec - in org.hisp.dhis.security.PasswordManagerTest
Running org.hisp.dhis.program.ProgramStageServiceTest
Tests run: 6, Failures: 0, Errors: 0, Skipped: 0, Time elapsed: 0.164 sec - in org.hisp.dhis.program.ProgramStageServiceTest
Running org.hisp.dhis.program.ProgramDataEntryServiceTest
Tests run: 2, Failures: 0, Errors: 0, Skipped: 0, Time elapsed: 0.047 sec - in org.hisp.dhis.program.ProgramDataEntryServiceTest
Running org.hisp.dhis.program.notification.NotificationMessageRendererTest
Tests run: 1, Failures: 0, Errors: 0, Skipped: 1, Time elapsed: 0.02 sec - in org.hisp.dhis.program.notification.NotificationMessageRendererTest
Running org.hisp.dhis.program.ProgramInstanceServiceTest
Tests run: 13, Failures: 0, Errors: 0, Skipped: 1, Time elapsed: 0.393 sec - in org.hisp.dhis.program.ProgramInstanceServiceTest
Running org.hisp.dhis.program.ProgramInstanceStoreTest
Tests run: 4, Failures: 0, Errors: 0, Skipped: 0, Time elapsed: 0.121 sec - in org.hisp.dhis.program.ProgramInstanceStoreTest
Running org.hisp.dhis.program.ProgramServiceTest
Tests run: 10, Failures: 0, Errors: 0, Skipped: 0, Time elapsed: 0.139 sec - in org.hisp.dhis.program.ProgramServiceTest
Running org.hisp.dhis.program.ProgramStageInstanceStoreTest
Tests run: 4, Failures: 0, Errors: 0, Skipped: 0, Time elapsed: 0.146 sec - in org.hisp.dhis.program.ProgramStageInstanceStoreTest
Running org.hisp.dhis.program.ProgramMessageStoreTest
Tests run: 8, Failures: 0, Errors: 0, Skipped: 0, Time elapsed: 0.135 sec - in org.hisp.dhis.program.ProgramMessageStoreTest
Running org.hisp.dhis.program.ProgramIndicatorServiceTest
Tests run: 26, Failures: 0, Errors: 0, Skipped: 0, Time elapsed: 0.667 sec - in org.hisp.dhis.program.ProgramIndicatorServiceTest
Running org.hisp.dhis.program.ProgramStageDataElementServiceTest
Tests run: 5, Failures: 0, Errors: 0, Skipped: 0, Time elapsed: 0.067 sec - in org.hisp.dhis.program.ProgramStageDataElementServiceTest
Running org.hisp.dhis.program.ProgramStageStoreTest
Tests run: 2, Failures: 0, Errors: 0, Skipped: 0, Time elapsed: 0.035 sec - in org.hisp.dhis.program.ProgramStageStoreTest
Running org.hisp.dhis.program.ProgramMessageServiceTest
Tests run: 8, Failures: 0, Errors: 0, Skipped: 0, Time elapsed: 0.104 sec - in org.hisp.dhis.program.ProgramMessageServiceTest
Running org.hisp.dhis.program.ProgramStageSectionStoreTest
Tests run: 1, Failures: 0, Errors: 0, Skipped: 0, Time elapsed: 0.022 sec - in org.hisp.dhis.program.ProgramStageSectionStoreTest
Running org.hisp.dhis.program.ProgramStageSectionServiceTest
Tests run: 3, Failures: 0, Errors: 0, Skipped: 0, Time elapsed: 0.037 sec - in org.hisp.dhis.program.ProgramStageSectionServiceTest
Running org.hisp.dhis.program.ProgramStageDataElementStoreTest
Tests run: 5, Failures: 0, Errors: 0, Skipped: 0, Time elapsed: 0.063 sec - in org.hisp.dhis.program.ProgramStageDataElementStoreTest
Running org.hisp.dhis.program.ProgramExpressionServiceTest
Tests run: 5, Failures: 0, Errors: 0, Skipped: 0, Time elapsed: 0.06 sec - in org.hisp.dhis.program.ProgramExpressionServiceTest
Running org.hisp.dhis.program.ProgramStoreTest
Tests run: 3, Failures: 0, Errors: 1, Skipped: 0, Time elapsed: 0.047 sec <<< FAILURE! - in org.hisp.dhis.program.ProgramStoreTest
testGetProgramsByDataEntryForm(org.hisp.dhis.program.ProgramStoreTest)  Time elapsed: 0.018 sec  <<< ERROR!
org.hibernate.QueryException: could not resolve property: dataEntryForm of: org.hisp.dhis.jphes.program.Program [from org.hisp.dhis.jphes.program.Program p where p.dataEntryForm = :dataEntryForm]
	at org.hibernate.persister.entity.AbstractPropertyMapping.propertyException(AbstractPropertyMapping.java:62)
	at org.hibernate.persister.entity.AbstractPropertyMapping.toType(AbstractPropertyMapping.java:56)
	at org.hibernate.persister.entity.AbstractEntityPersister.toType(AbstractEntityPersister.java:1788)
	at org.hibernate.hql.internal.ast.tree.FromElementType.getPropertyType(FromElementType.java:393)
	at org.hibernate.hql.internal.ast.tree.FromElement.getPropertyType(FromElement.java:505)
	at org.hibernate.hql.internal.ast.tree.DotNode.getDataType(DotNode.java:660)
	at org.hibernate.hql.internal.ast.tree.DotNode.prepareLhs(DotNode.java:264)
	at org.hibernate.hql.internal.ast.tree.DotNode.resolve(DotNode.java:204)
	at org.hibernate.hql.internal.ast.tree.FromReferenceNode.resolve(FromReferenceNode.java:109)
	at org.hibernate.hql.internal.ast.tree.FromReferenceNode.resolve(FromReferenceNode.java:104)
	at org.hibernate.hql.internal.ast.HqlSqlWalker.resolve(HqlSqlWalker.java:1013)
	at org.hibernate.hql.internal.antlr.HqlSqlBaseWalker.expr(HqlSqlBaseWalker.java:1286)
	at org.hibernate.hql.internal.antlr.HqlSqlBaseWalker.exprOrSubquery(HqlSqlBaseWalker.java:4713)
	at org.hibernate.hql.internal.antlr.HqlSqlBaseWalker.comparisonExpr(HqlSqlBaseWalker.java:4183)
	at org.hibernate.hql.internal.antlr.HqlSqlBaseWalker.logicalExpr(HqlSqlBaseWalker.java:2130)
	at org.hibernate.hql.internal.antlr.HqlSqlBaseWalker.whereClause(HqlSqlBaseWalker.java:813)
	at org.hibernate.hql.internal.antlr.HqlSqlBaseWalker.query(HqlSqlBaseWalker.java:607)
	at org.hibernate.hql.internal.antlr.HqlSqlBaseWalker.selectStatement(HqlSqlBaseWalker.java:311)
	at org.hibernate.hql.internal.antlr.HqlSqlBaseWalker.statement(HqlSqlBaseWalker.java:259)
	at org.hibernate.hql.internal.ast.QueryTranslatorImpl.analyze(QueryTranslatorImpl.java:262)
	at org.hibernate.hql.internal.ast.QueryTranslatorImpl.doCompile(QueryTranslatorImpl.java:190)
	at org.hibernate.hql.internal.ast.QueryTranslatorImpl.compile(QueryTranslatorImpl.java:142)
	at org.hibernate.engine.query.spi.HQLQueryPlan.<init>(HQLQueryPlan.java:115)
	at org.hibernate.engine.query.spi.HQLQueryPlan.<init>(HQLQueryPlan.java:76)
	at org.hibernate.engine.query.spi.QueryPlanCache.getHQLQueryPlan(QueryPlanCache.java:150)
	at org.hibernate.internal.AbstractSessionImpl.getHQLQueryPlan(AbstractSessionImpl.java:302)
	at org.hibernate.internal.AbstractSessionImpl.createQuery(AbstractSessionImpl.java:240)
	at org.hibernate.internal.SessionImpl.createQuery(SessionImpl.java:1907)
	at org.hisp.dhis.hibernate.HibernateGenericStore.getQuery(HibernateGenericStore.java:169)
	at org.hisp.dhis.program.hibernate.HibernateProgramStore.getByDataEntryForm(HibernateProgramStore.java:101)
	at org.hisp.dhis.program.ProgramStoreTest.testGetProgramsByDataEntryForm(ProgramStoreTest.java:134)

Running org.hisp.dhis.program.ProgramIndicatorGroupStoreTest
Tests run: 3, Failures: 0, Errors: 0, Skipped: 0, Time elapsed: 0.028 sec - in org.hisp.dhis.program.ProgramIndicatorGroupStoreTest
Running org.hisp.dhis.program.ProgramIndicatorGroupServiceTest
Tests run: 3, Failures: 0, Errors: 0, Skipped: 0, Time elapsed: 0.031 sec - in org.hisp.dhis.program.ProgramIndicatorGroupServiceTest
Running org.hisp.dhis.program.ProgramStageInstanceServiceTest
Tests run: 10, Failures: 0, Errors: 0, Skipped: 0, Time elapsed: 0.159 sec - in org.hisp.dhis.program.ProgramStageInstanceServiceTest
Running org.hisp.dhis.setting.SystemSettingStoreTest
Tests run: 5, Failures: 0, Errors: 0, Skipped: 0, Time elapsed: 0.038 sec - in org.hisp.dhis.setting.SystemSettingStoreTest
Running org.hisp.dhis.setting.SystemSettingManagerTest
Tests run: 6, Failures: 0, Errors: 0, Skipped: 0, Time elapsed: 0.054 sec - in org.hisp.dhis.setting.SystemSettingManagerTest
Running org.hisp.dhis.query.QueryTest
Tests run: 1, Failures: 0, Errors: 0, Skipped: 0, Time elapsed: 0.032 sec - in org.hisp.dhis.query.QueryTest
Running org.hisp.dhis.query.QueryServiceTest
Tests run: 30, Failures: 0, Errors: 0, Skipped: 0, Time elapsed: 0.223 sec - in org.hisp.dhis.query.QueryServiceTest
Running org.hisp.dhis.query.QueryUtilsTest
Tests run: 7, Failures: 0, Errors: 0, Skipped: 0, Time elapsed: 0.019 sec - in org.hisp.dhis.query.QueryUtilsTest
Running org.hisp.dhis.query.CriteriaQueryEngineTest
Tests run: 22, Failures: 0, Errors: 0, Skipped: 5, Time elapsed: 0.153 sec - in org.hisp.dhis.query.CriteriaQueryEngineTest
Running org.hisp.dhis.query.InMemoryQueryEngineTest
Tests run: 30, Failures: 0, Errors: 0, Skipped: 0, Time elapsed: 0.132 sec - in org.hisp.dhis.query.InMemoryQueryEngineTest
Running org.hisp.dhis.query.OperatorTest
Tests run: 31, Failures: 0, Errors: 0, Skipped: 0, Time elapsed: 0.02 sec - in org.hisp.dhis.query.OperatorTest
Running org.hisp.dhis.query.QueryParserTest
Tests run: 5, Failures: 0, Errors: 0, Skipped: 0, Time elapsed: 0.044 sec - in org.hisp.dhis.query.QueryParserTest
Running org.hisp.dhis.predictor.PredictorServiceTest
Tests run: 7, Failures: 0, Errors: 0, Skipped: 0, Time elapsed: 0.22 sec - in org.hisp.dhis.predictor.PredictorServiceTest
Running org.hisp.dhis.predictor.PredictorStoreTest
Tests run: 6, Failures: 0, Errors: 0, Skipped: 0, Time elapsed: 0.1 sec - in org.hisp.dhis.predictor.PredictorStoreTest
Running org.hisp.dhis.programrule.ProgramRuleVariableServiceTest
Tests run: 4, Failures: 0, Errors: 0, Skipped: 0, Time elapsed: 0.046 sec - in org.hisp.dhis.programrule.ProgramRuleVariableServiceTest
Running org.hisp.dhis.programrule.ProgramRuleActionServiceTest
Tests run: 4, Failures: 0, Errors: 0, Skipped: 0, Time elapsed: 0.055 sec - in org.hisp.dhis.programrule.ProgramRuleActionServiceTest
Running org.hisp.dhis.programrule.ProgramRuleVariableStoreTest
Tests run: 1, Failures: 0, Errors: 0, Skipped: 0, Time elapsed: 0.039 sec - in org.hisp.dhis.programrule.ProgramRuleVariableStoreTest
Running org.hisp.dhis.programrule.ProgramRuleServiceTest
Tests run: 4, Failures: 0, Errors: 0, Skipped: 0, Time elapsed: 0.066 sec - in org.hisp.dhis.programrule.ProgramRuleServiceTest
Running org.hisp.dhis.programrule.ProgramRuleActionStoreTest
Tests run: 1, Failures: 0, Errors: 0, Skipped: 0, Time elapsed: 0.021 sec - in org.hisp.dhis.programrule.ProgramRuleActionStoreTest
Running org.hisp.dhis.programrule.ProgramRuleStoreTest
Tests run: 1, Failures: 0, Errors: 0, Skipped: 0, Time elapsed: 0.021 sec - in org.hisp.dhis.programrule.ProgramRuleStoreTest
Running org.hisp.dhis.dataelement.DataElementCategoryOptionComboStoreTest
Tests run: 6, Failures: 0, Errors: 0, Skipped: 0, Time elapsed: 0.077 sec - in org.hisp.dhis.dataelement.DataElementCategoryOptionComboStoreTest
Running org.hisp.dhis.dataelement.DataElementOperandServiceTest
Tests run: 2, Failures: 0, Errors: 0, Skipped: 0, Time elapsed: 0.032 sec - in org.hisp.dhis.dataelement.DataElementOperandServiceTest
Running org.hisp.dhis.dataelement.DataElementStoreTest
Tests run: 18, Failures: 0, Errors: 0, Skipped: 1, Time elapsed: 0.164 sec - in org.hisp.dhis.dataelement.DataElementStoreTest
Running org.hisp.dhis.dataelement.DataElementCategoryStoreTest
Tests run: 3, Failures: 0, Errors: 0, Skipped: 0, Time elapsed: 0.034 sec - in org.hisp.dhis.dataelement.DataElementCategoryStoreTest
Running org.hisp.dhis.dataelement.DataElementCategoryOptionServiceTest
Tests run: 4, Failures: 0, Errors: 0, Skipped: 0, Time elapsed: 0.042 sec - in org.hisp.dhis.dataelement.DataElementCategoryOptionServiceTest
Running org.hisp.dhis.dataelement.DataElementServiceTest
Tests run: 15, Failures: 0, Errors: 0, Skipped: 0, Time elapsed: 0.145 sec - in org.hisp.dhis.dataelement.DataElementServiceTest
Running org.hisp.dhis.dataelement.DataElementCategoryOptionStoreTest
Tests run: 3, Failures: 0, Errors: 0, Skipped: 0, Time elapsed: 0.029 sec - in org.hisp.dhis.dataelement.DataElementCategoryOptionStoreTest
Running org.hisp.dhis.dataelement.DataElementGroupSetStoreTest
Tests run: 4, Failures: 0, Errors: 0, Skipped: 0, Time elapsed: 0.029 sec - in org.hisp.dhis.dataelement.DataElementGroupSetStoreTest
Running org.hisp.dhis.dataelement.DataElementGroupStoreTest
Tests run: 5, Failures: 0, Errors: 0, Skipped: 0, Time elapsed: 0.033 sec - in org.hisp.dhis.dataelement.DataElementGroupStoreTest
Running org.hisp.dhis.dataelement.DataElementCategoryComboServiceTest
Tests run: 7, Failures: 0, Errors: 0, Skipped: 0, Time elapsed: 0.093 sec - in org.hisp.dhis.dataelement.DataElementCategoryComboServiceTest
Running org.hisp.dhis.dataelement.DataElementCategoryOptionComboServiceTest
Tests run: 8, Failures: 0, Errors: 0, Skipped: 0, Time elapsed: 0.086 sec - in org.hisp.dhis.dataelement.DataElementCategoryOptionComboServiceTest
Running org.hisp.dhis.dataelement.DataElementCategoryComboStoreTest
Tests run: 3, Failures: 0, Errors: 0, Skipped: 0, Time elapsed: 0.024 sec - in org.hisp.dhis.dataelement.DataElementCategoryComboStoreTest
Running org.hisp.dhis.dataelement.DataElementCategoryServiceTest
Tests run: 5, Failures: 0, Errors: 0, Skipped: 0, Time elapsed: 0.037 sec - in org.hisp.dhis.dataelement.DataElementCategoryServiceTest
Running org.hisp.dhis.trackedentity.TrackedEntityInstanceServiceTest
Tests run: 7, Failures: 0, Errors: 0, Skipped: 0, Time elapsed: 0.054 sec - in org.hisp.dhis.trackedentity.TrackedEntityInstanceServiceTest
Running org.hisp.dhis.trackedentity.TrackedEntityAttributeStoreTest
Tests run: 9, Failures: 0, Errors: 0, Skipped: 0, Time elapsed: 0.05 sec - in org.hisp.dhis.trackedentity.TrackedEntityAttributeStoreTest
Running org.hisp.dhis.trackedentity.TrackedEntityInstanceStoreTest
Tests run: 6, Failures: 0, Errors: 0, Skipped: 0, Time elapsed: 0.085 sec - in org.hisp.dhis.trackedentity.TrackedEntityInstanceStoreTest
Running org.hisp.dhis.trackedentity.TrackedEntityAttributeServiceTest
Tests run: 2, Failures: 0, Errors: 0, Skipped: 0, Time elapsed: 0.02 sec - in org.hisp.dhis.trackedentity.TrackedEntityAttributeServiceTest
Running org.hisp.dhis.trackedentity.TrackedEntityAttributeGroupServiceTest
Tests run: 6, Failures: 0, Errors: 0, Skipped: 0, Time elapsed: 0.047 sec - in org.hisp.dhis.trackedentity.TrackedEntityAttributeGroupServiceTest
Running org.hisp.dhis.common.AnalyticalObjectStoreTest
Tests run: 2, Failures: 0, Errors: 0, Skipped: 0, Time elapsed: 0.042 sec - in org.hisp.dhis.common.AnalyticalObjectStoreTest
Running org.hisp.dhis.common.IdentifiableObjectManagerTest
Tests run: 35, Failures: 0, Errors: 0, Skipped: 0, Time elapsed: 0.836 sec - in org.hisp.dhis.common.IdentifiableObjectManagerTest
Running org.hisp.dhis.keyjsonvalue.KeyJsonValueStoreTest
Tests run: 5, Failures: 0, Errors: 0, Skipped: 0, Time elapsed: 0.033 sec - in org.hisp.dhis.keyjsonvalue.KeyJsonValueStoreTest
Running org.hisp.dhis.render.RenderServiceTest
Tests run: 6, Failures: 0, Errors: 0, Skipped: 1, Time elapsed: 0.201 sec - in org.hisp.dhis.render.RenderServiceTest
Running org.hisp.dhis.dataapproval.DataApprovalStoreTest
Tests run: 2, Failures: 0, Errors: 0, Skipped: 0, Time elapsed: 0.05 sec - in org.hisp.dhis.dataapproval.DataApprovalStoreTest
Running org.hisp.dhis.dataapproval.DataApprovalWorkflowServiceTest
Tests run: 5, Failures: 0, Errors: 0, Skipped: 0, Time elapsed: 0.046 sec - in org.hisp.dhis.dataapproval.DataApprovalWorkflowServiceTest
Running org.hisp.dhis.dataapproval.DataApprovalLevelServiceTest
Tests run: 16, Failures: 0, Errors: 0, Skipped: 0, Time elapsed: 6.567 sec - in org.hisp.dhis.dataapproval.DataApprovalLevelServiceTest
Running org.hisp.dhis.jdbc.batchhandler.DataValueAuditBatchHandlerTest
Tests run: 3, Failures: 0, Errors: 0, Skipped: 0, Time elapsed: 0.162 sec - in org.hisp.dhis.jdbc.batchhandler.DataValueAuditBatchHandlerTest
Running org.hisp.dhis.jdbc.batchhandler.CompleteDataSetRegistrationBatchHandlerTest
Tests run: 5, Failures: 0, Errors: 0, Skipped: 0, Time elapsed: 0.179 sec - in org.hisp.dhis.jdbc.batchhandler.CompleteDataSetRegistrationBatchHandlerTest
Running org.hisp.dhis.jdbc.batchhandler.DataValueBatchHandlerTest
Tests run: 6, Failures: 0, Errors: 0, Skipped: 0, Time elapsed: 0.177 sec - in org.hisp.dhis.jdbc.batchhandler.DataValueBatchHandlerTest
Running org.hisp.dhis.jdbc.statementbuilder.StatementBuilderTest
Tests run: 1, Failures: 0, Errors: 0, Skipped: 0, Time elapsed: 0.017 sec - in org.hisp.dhis.jdbc.statementbuilder.StatementBuilderTest
Running org.hisp.dhis.translation.TranslationServiceTest
Tests run: 1, Failures: 0, Errors: 0, Skipped: 0, Time elapsed: 0.03 sec - in org.hisp.dhis.translation.TranslationServiceTest
Running org.hisp.dhis.organisationunit.OrganisationUnitGroupStoreTest
Tests run: 4, Failures: 0, Errors: 0, Skipped: 0, Time elapsed: 0.029 sec - in org.hisp.dhis.organisationunit.OrganisationUnitGroupStoreTest
Running org.hisp.dhis.organisationunit.OrganisationUnitGroupSetStoreTest
Tests run: 4, Failures: 0, Errors: 0, Skipped: 0, Time elapsed: 0.032 sec - in org.hisp.dhis.organisationunit.OrganisationUnitGroupSetStoreTest
Running org.hisp.dhis.organisationunit.OrganisationUnitServiceTest
Tests run: 25, Failures: 0, Errors: 0, Skipped: 1, Time elapsed: 0.335 sec - in org.hisp.dhis.organisationunit.OrganisationUnitServiceTest
Running org.hisp.dhis.organisationunit.OrganisationUnitStoreTest
Tests run: 6, Failures: 0, Errors: 0, Skipped: 0, Time elapsed: 0.084 sec - in org.hisp.dhis.organisationunit.OrganisationUnitStoreTest
Running org.hisp.dhis.indicator.IndicatorGroupSetStoreTest
Tests run: 4, Failures: 0, Errors: 0, Skipped: 0, Time elapsed: 0.032 sec - in org.hisp.dhis.indicator.IndicatorGroupSetStoreTest
Running org.hisp.dhis.indicator.IndicatorStoreTest
Tests run: 12, Failures: 0, Errors: 0, Skipped: 0, Time elapsed: 0.079 sec - in org.hisp.dhis.indicator.IndicatorStoreTest
Running org.hisp.dhis.indicator.IndicatorServiceTest
Tests run: 12, Failures: 0, Errors: 0, Skipped: 0, Time elapsed: 0.073 sec - in org.hisp.dhis.indicator.IndicatorServiceTest
Running org.hisp.dhis.indicator.IndicatorGroupStoreTest
Tests run: 5, Failures: 0, Errors: 0, Skipped: 0, Time elapsed: 0.035 sec - in org.hisp.dhis.indicator.IndicatorGroupStoreTest
Running org.hisp.dhis.relationship.RelationshipTypeStoreTest
Tests run: 1, Failures: 0, Errors: 0, Skipped: 0, Time elapsed: 0.017 sec - in org.hisp.dhis.relationship.RelationshipTypeStoreTest
Running org.hisp.dhis.relationship.RelationshipTypeServiceTest
Tests run: 6, Failures: 0, Errors: 0, Skipped: 0, Time elapsed: 0.039 sec - in org.hisp.dhis.relationship.RelationshipTypeServiceTest
Running org.hisp.dhis.relationship.RelationshipServiceTest
Tests run: 6, Failures: 0, Errors: 0, Skipped: 0, Time elapsed: 0.063 sec - in org.hisp.dhis.relationship.RelationshipServiceTest
Running org.hisp.dhis.relationship.RelationshipStoreTest
Tests run: 3, Failures: 0, Errors: 0, Skipped: 0, Time elapsed: 0.034 sec - in org.hisp.dhis.relationship.RelationshipStoreTest
Running org.hisp.dhis.userkeyjsonvalue.UserKeyJsonValueStoreTest
Tests run: 3, Failures: 0, Errors: 0, Skipped: 0, Time elapsed: 0.046 sec - in org.hisp.dhis.userkeyjsonvalue.UserKeyJsonValueStoreTest
Running org.hisp.dhis.trackedentitycomment.TrackedEntityCommentServiceTest
Tests run: 4, Failures: 0, Errors: 0, Skipped: 0, Time elapsed: 0.044 sec - in org.hisp.dhis.trackedentitycomment.TrackedEntityCommentServiceTest
Running org.hisp.dhis.option.OptionGroupSetStoreTest
Tests run: 4, Failures: 0, Errors: 0, Skipped: 0, Time elapsed: 0.039 sec - in org.hisp.dhis.option.OptionGroupSetStoreTest
Running org.hisp.dhis.option.OptionServiceTest
Tests run: 4, Failures: 0, Errors: 0, Skipped: 0, Time elapsed: 0.063 sec - in org.hisp.dhis.option.OptionServiceTest
Running org.hisp.dhis.option.OptionGroupStoreTest
Tests run: 3, Failures: 0, Errors: 0, Skipped: 0, Time elapsed: 0.029 sec - in org.hisp.dhis.option.OptionGroupStoreTest
Running org.hisp.dhis.dataset.CompleteDataSetRegistrationServiceTest
Tests run: 5, Failures: 0, Errors: 0, Skipped: 0, Time elapsed: 0.089 sec - in org.hisp.dhis.dataset.CompleteDataSetRegistrationServiceTest
Running org.hisp.dhis.dataset.DataSetStoreTest
Tests run: 8, Failures: 0, Errors: 0, Skipped: 1, Time elapsed: 0.076 sec - in org.hisp.dhis.dataset.DataSetStoreTest
Running org.hisp.dhis.dataset.DataSetServiceTest
Tests run: 14, Failures: 0, Errors: 0, Skipped: 1, Time elapsed: 0.685 sec - in org.hisp.dhis.dataset.DataSetServiceTest
Running org.hisp.dhis.dataset.SectionStoreTest
Tests run: 2, Failures: 0, Errors: 0, Skipped: 0, Time elapsed: 0.043 sec - in org.hisp.dhis.dataset.SectionStoreTest
Running org.hisp.dhis.mapping.MappingServiceTest
Tests run: 3, Failures: 0, Errors: 0, Skipped: 0, Time elapsed: 0.058 sec - in org.hisp.dhis.mapping.MappingServiceTest
Running org.hisp.dhis.trackedentityattributevalue.TrackedEntityAttributeReservedValueServiceTest
* WARN  14:44:59,825 Not able to provide all requested reserved values for  gJfAOBBdqvR.  9 of 11 created. (DefaultTrackedEntityAttributeReservedValueService.java [main])
Tests run: 7, Failures: 0, Errors: 0, Skipped: 0, Time elapsed: 0.133 sec - in org.hisp.dhis.trackedentityattributevalue.TrackedEntityAttributeReservedValueServiceTest
Running org.hisp.dhis.trackedentityattributevalue.TrackedEntityAttributeReservedValueStoreTest
Tests run: 1, Failures: 0, Errors: 0, Skipped: 0, Time elapsed: 0.027 sec - in org.hisp.dhis.trackedentityattributevalue.TrackedEntityAttributeReservedValueStoreTest
Running org.hisp.dhis.trackedentityattributevalue.TrackedEntityAttributeValueStoreTest
Tests run: 6, Failures: 0, Errors: 0, Skipped: 0, Time elapsed: 0.077 sec - in org.hisp.dhis.trackedentityattributevalue.TrackedEntityAttributeValueStoreTest
Running org.hisp.dhis.trackedentityattributevalue.TrackedEntityAttributeValueServiceTest
Tests run: 9, Failures: 0, Errors: 0, Skipped: 0, Time elapsed: 0.082 sec - in org.hisp.dhis.trackedentityattributevalue.TrackedEntityAttributeValueServiceTest
Running org.hisp.dhis.datavalue.DataValueDimensionTest
Tests run: 2, Failures: 0, Errors: 0, Skipped: 0, Time elapsed: 0.043 sec - in org.hisp.dhis.datavalue.DataValueDimensionTest
Running org.hisp.dhis.datavalue.DataValueAuditServiceTest
Tests run: 1, Failures: 0, Errors: 0, Skipped: 0, Time elapsed: 0.029 sec - in org.hisp.dhis.datavalue.DataValueAuditServiceTest
Running org.hisp.dhis.datavalue.DataValueServiceTest
Tests run: 6, Failures: 0, Errors: 0, Skipped: 0, Time elapsed: 0.111 sec - in org.hisp.dhis.datavalue.DataValueServiceTest
Running org.hisp.dhis.schema.FieldComplexNodePropertyIntrospectorServiceTest
Tests run: 6, Failures: 0, Errors: 0, Skipped: 0, Time elapsed: 0.005 sec - in org.hisp.dhis.schema.FieldComplexNodePropertyIntrospectorServiceTest
Running org.hisp.dhis.schema.FieldCollectionNodePropertyIntrospectorServiceTest
Tests run: 8, Failures: 0, Errors: 0, Skipped: 0, Time elapsed: 0.021 sec - in org.hisp.dhis.schema.FieldCollectionNodePropertyIntrospectorServiceTest
Running org.hisp.dhis.schema.SchemaServiceTest
Tests run: 1, Failures: 0, Errors: 0, Skipped: 0, Time elapsed: 0.004 sec - in org.hisp.dhis.schema.SchemaServiceTest
Running org.hisp.dhis.schema.FieldSimpleNodePropertyIntrospectorServiceTest
Tests run: 7, Failures: 0, Errors: 0, Skipped: 0, Time elapsed: 0.022 sec - in org.hisp.dhis.schema.FieldSimpleNodePropertyIntrospectorServiceTest
Running org.hisp.dhis.expression.ExpressionStoreTest
Tests run: 4, Failures: 0, Errors: 0, Skipped: 0, Time elapsed: 0.05 sec - in org.hisp.dhis.expression.ExpressionStoreTest
Running org.hisp.dhis.expression.ExpressionServiceTest
* WARN  14:45:00,554 No IdentifiableObjectStore found for class: class org.hisp.dhis.common.ReportingRate (DefaultIdentifiableObjectManager.java [main])
* WARN  14:45:01,009 No IdentifiableObjectStore found for class: class org.hisp.dhis.common.ReportingRate (DefaultIdentifiableObjectManager.java [main])
Tests run: 24, Failures: 0, Errors: 0, Skipped: 0, Time elapsed: 0.655 sec - in org.hisp.dhis.expression.ExpressionServiceTest
Running org.hisp.dhis.message.MessageConversationStoreTest
Tests run: 3, Failures: 0, Errors: 0, Skipped: 0, Time elapsed: 0.136 sec - in org.hisp.dhis.message.MessageConversationStoreTest
Running org.hisp.dhis.message.MessageServiceTest
Tests run: 7, Failures: 0, Errors: 0, Skipped: 0, Time elapsed: 0.093 sec - in org.hisp.dhis.message.MessageServiceTest
Running org.hisp.dhis.legend.LegendServiceTest
Tests run: 4, Failures: 0, Errors: 0, Skipped: 0, Time elapsed: 0.025 sec - in org.hisp.dhis.legend.LegendServiceTest
Running org.hisp.dhis.dimension.DimensionServiceTest
Tests run: 7, Failures: 0, Errors: 0, Skipped: 0, Time elapsed: 0.328 sec - in org.hisp.dhis.dimension.DimensionServiceTest
Running org.hisp.dhis.trackedentitydatavalue.TrackedEntityDataValueStoreTest
Tests run: 7, Failures: 0, Errors: 0, Skipped: 0, Time elapsed: 0.101 sec - in org.hisp.dhis.trackedentitydatavalue.TrackedEntityDataValueStoreTest
Running org.hisp.dhis.trackedentitydatavalue.TrackedEntityDataValueServiceTest
Tests run: 9, Failures: 0, Errors: 0, Skipped: 0, Time elapsed: 0.167 sec - in org.hisp.dhis.trackedentitydatavalue.TrackedEntityDataValueServiceTest
Running org.hisp.dhis.user.UserAuthorityGroupTest
Tests run: 2, Failures: 0, Errors: 0, Skipped: 0, Time elapsed: 0.02 sec - in org.hisp.dhis.user.UserAuthorityGroupTest
Running org.hisp.dhis.user.UserGroupServiceTest
Tests run: 6, Failures: 0, Errors: 0, Skipped: 0, Time elapsed: 0.042 sec - in org.hisp.dhis.user.UserGroupServiceTest
Running org.hisp.dhis.user.UserServiceTest
* WARN  14:45:02,078 Cannot get managed users as user does not have any managed groups (DefaultUserService.java [main])
* WARN  14:45:02,079 Cannot get managed users as user does not have any managed groups (DefaultUserService.java [main])
Tests run: 12, Failures: 0, Errors: 0, Skipped: 0, Time elapsed: 0.432 sec - in org.hisp.dhis.user.UserServiceTest
Running org.hisp.dhis.user.UserSettingServiceTest
Tests run: 3, Failures: 0, Errors: 0, Skipped: 0, Time elapsed: 0.035 sec - in org.hisp.dhis.user.UserSettingServiceTest
Running org.hisp.dhis.user.UserStoreTest
Tests run: 3, Failures: 0, Errors: 0, Skipped: 0, Time elapsed: 0.027 sec - in org.hisp.dhis.user.UserStoreTest
Running org.hisp.dhis.user.UserCredentialsStoreTest
Tests run: 1, Failures: 0, Errors: 0, Skipped: 0, Time elapsed: 0.018 sec - in org.hisp.dhis.user.UserCredentialsStoreTest
Running org.hisp.dhis.dataanalysis.DataAnalysisStoreTest
Tests run: 2, Failures: 0, Errors: 0, Skipped: 0, Time elapsed: 0.04 sec - in org.hisp.dhis.dataanalysis.DataAnalysisStoreTest
Running org.hisp.dhis.dataanalysis.MinMaxOutlierAnalysisServiceTest
Tests run: 1, Failures: 0, Errors: 0, Skipped: 1, Time elapsed: 0.009 sec - in org.hisp.dhis.dataanalysis.MinMaxOutlierAnalysisServiceTest
Running org.hisp.dhis.dataanalysis.StdDevOutlierAnalysisServiceTest
Tests run: 1, Failures: 0, Errors: 0, Skipped: 0, Time elapsed: 0.039 sec - in org.hisp.dhis.dataanalysis.StdDevOutlierAnalysisServiceTest
Running org.hisp.dhis.validation.ValidationCriteriaStoreTest
Tests run: 5, Failures: 0, Errors: 0, Skipped: 0, Time elapsed: 0.029 sec - in org.hisp.dhis.validation.ValidationCriteriaStoreTest
Running org.hisp.dhis.validation.ValidationRuleGroupStoreTest
Tests run: 5, Failures: 0, Errors: 0, Skipped: 0, Time elapsed: 0.05 sec - in org.hisp.dhis.validation.ValidationRuleGroupStoreTest
Running org.hisp.dhis.validation.ValidationRuleServiceTest
Handled all 2 rules to get 2 violations in 36.160046 milliseconds.
Handled all 2 rules to get 4 violations in 13.510371 milliseconds.
Handled all 2 rules to get 0 violations in 3.983989 milliseconds.
Handled all 4 rules to get 8 violations in 21.043254 milliseconds.
Handled all 4 rules to get 2 violations in 10.867963 milliseconds.
Handled all 4 rules to get 4 violations in 19.417594 milliseconds.
Handled all 1 rules to get 0 violations in 4.493209 milliseconds.
Handled all 1 rules to get 1 violations in 12.572342 milliseconds.
Handled all 1 rules to get 1 violations in 7.663256 milliseconds.
Handled all 1 rules to get 0 violations in 8.011174 milliseconds.
* ERROR 14:45:04,089 Resource table _dataelementcategoryoptioncomboname does not exist, please generate it (HibernateDataElementStore.java [pool-15-thread-1])
Handled all 2 rules to get 1 violations in 17.372555 milliseconds.
* ERROR 14:45:04,162 Resource table _dataelementcategoryoptioncomboname does not exist, please generate it (HibernateDataElementStore.java [pool-16-thread-1])
Handled all 2 rules to get 1 violations in 23.017881 milliseconds.
* ERROR 14:45:04,234 Resource table _dataelementcategoryoptioncomboname does not exist, please generate it (HibernateDataElementStore.java [pool-17-thread-1])
Handled all 2 rules to get 1 violations in 12.674796 milliseconds.
* ERROR 14:45:04,303 Resource table _dataelementcategoryoptioncomboname does not exist, please generate it (HibernateDataElementStore.java [pool-18-thread-1])
Handled all 2 rules to get 2 violations in 15.475336 milliseconds.
Handled all 1 rules to get 0 violations in 8.565529 milliseconds.
Handled all 1 rules to get 0 violations in 7.332168 milliseconds.
Handled all 1 rules to get 0 violations in 6.307292 milliseconds.
Handled all 1 rules to get 1 violations in 7.29479 milliseconds.
Handled all 2 rules to get 4 violations in 14.196222 milliseconds.
* ERROR 14:45:04,754 Resource table _dataelementcategoryoptioncomboname does not exist, please generate it (HibernateDataElementStore.java [pool-24-thread-1])
Handled all 1 rules to get 0 violations in 5.427801 milliseconds.
* ERROR 14:45:04,803 Resource table _dataelementcategoryoptioncomboname does not exist, please generate it (HibernateDataElementStore.java [pool-25-thread-1])
Handled all 1 rules to get 1 violations in 12.367763 milliseconds.
* ERROR 14:45:04,881 Resource table _dataelementcategoryoptioncomboname does not exist, please generate it (HibernateDataElementStore.java [pool-26-thread-1])
Handled all 1 rules to get 1 violations in 8.541169 milliseconds.
Handled all 0 rules to get 0 violations in 1.295581 milliseconds.
Tests run: 31, Failures: 0, Errors: 0, Skipped: 0, Time elapsed: 2.331 sec - in org.hisp.dhis.validation.ValidationRuleServiceTest
Running org.hisp.dhis.validation.ValidationRuleStoreTest
Tests run: 6, Failures: 0, Errors: 0, Skipped: 0, Time elapsed: 0.054 sec - in org.hisp.dhis.validation.ValidationRuleStoreTest
Running org.hisp.dhis.validation.ValidationCriteriaServiceTest
Tests run: 5, Failures: 0, Errors: 0, Skipped: 0, Time elapsed: 0.032 sec - in org.hisp.dhis.validation.ValidationCriteriaServiceTest
Running org.hisp.dhis.period.PeriodServiceTest
Tests run: 13, Failures: 0, Errors: 0, Skipped: 0, Time elapsed: 0.1 sec - in org.hisp.dhis.period.PeriodServiceTest
Running org.hisp.dhis.period.PeriodStoreTest
Tests run: 9, Failures: 0, Errors: 0, Skipped: 0, Time elapsed: 0.055 sec - in org.hisp.dhis.period.PeriodStoreTest
Running org.hisp.dhis.attribute.AttributeStoreTest
Tests run: 4, Failures: 0, Errors: 0, Skipped: 0, Time elapsed: 0.036 sec - in org.hisp.dhis.attribute.AttributeStoreTest
Running org.hisp.dhis.attribute.AttributeValueServiceTest
Tests run: 8, Failures: 0, Errors: 0, Skipped: 0, Time elapsed: 0.638 sec - in org.hisp.dhis.attribute.AttributeValueServiceTest
Running org.hisp.dhis.attribute.AttributeValueStoreTest
Tests run: 5, Failures: 0, Errors: 0, Skipped: 0, Time elapsed: 0.033 sec - in org.hisp.dhis.attribute.AttributeValueStoreTest
Running org.hisp.dhis.attribute.AttributeServiceTest
Tests run: 5, Failures: 0, Errors: 0, Skipped: 0, Time elapsed: 0.027 sec - in org.hisp.dhis.attribute.AttributeServiceTest
Running org.hisp.dhis.i18n.I18nLocaleServiceTest
Tests run: 1, Failures: 0, Errors: 0, Skipped: 0, Time elapsed: 0.014 sec - in org.hisp.dhis.i18n.I18nLocaleServiceTest
Running org.hisp.dhis.minmax.MinMaxDataElementStoreTest
Tests run: 1, Failures: 0, Errors: 0, Skipped: 0, Time elapsed: 0.024 sec - in org.hisp.dhis.minmax.MinMaxDataElementStoreTest
Running org.hisp.dhis.metadata.version.hibernate.HibernateMetadataVersionStoreTest
Tests run: 5, Failures: 0, Errors: 0, Skipped: 0, Time elapsed: 0.018 sec - in org.hisp.dhis.metadata.version.hibernate.HibernateMetadataVersionStoreTest
Running org.hisp.dhis.external.location.LocationManagerTest
Tests run: 1, Failures: 0, Errors: 0, Skipped: 1, Time elapsed: 0.01 sec - in org.hisp.dhis.external.location.LocationManagerTest
Running org.hisp.dhis.cofiguration.ConfigurationServiceTest
Tests run: 1, Failures: 0, Errors: 0, Skipped: 0, Time elapsed: 0.013 sec - in org.hisp.dhis.cofiguration.ConfigurationServiceTest
Running org.hisp.dhis.trackedentityinstance.TrackedEntityInstanceQueryTest
Tests run: 1, Failures: 0, Errors: 0, Skipped: 0, Time elapsed: 0.014 sec - in org.hisp.dhis.trackedentityinstance.TrackedEntityInstanceQueryTest
Running org.hisp.dhis.constant.ConstantServiceTest
Tests run: 6, Failures: 0, Errors: 0, Skipped: 0, Time elapsed: 0.054 sec - in org.hisp.dhis.constant.ConstantServiceTest
Running org.hisp.dhis.dataentryform.DataEntryFormStoreTest
Tests run: 5, Failures: 0, Errors: 0, Skipped: 0, Time elapsed: 0.032 sec - in org.hisp.dhis.dataentryform.DataEntryFormStoreTest
Running org.hisp.dhis.dataentryform.DataEntryFormServiceTest
Tests run: 8, Failures: 0, Errors: 0, Skipped: 0, Time elapsed: 0.078 sec - in org.hisp.dhis.dataentryform.DataEntryFormServiceTest
Running org.hisp.dhis.version.VersionServiceTest
Tests run: 6, Failures: 0, Errors: 0, Skipped: 0, Time elapsed: 0.033 sec - in org.hisp.dhis.version.VersionServiceTest
Running org.hisp.dhis.eventreport.EventReportServiceTest
Tests run: 2, Failures: 0, Errors: 0, Skipped: 0, Time elapsed: 0.034 sec - in org.hisp.dhis.eventreport.EventReportServiceTest
Running org.hisp.dhis.eventchart.EventChartServiceTest
Tests run: 2, Failures: 0, Errors: 0, Skipped: 0, Time elapsed: 0.045 sec - in org.hisp.dhis.eventchart.EventChartServiceTest
Running org.hisp.dhis.preheat.PreheatServiceTest
Tests run: 18, Failures: 0, Errors: 0, Skipped: 2, Time elapsed: 0.175 sec - in org.hisp.dhis.preheat.PreheatServiceTest

Results :

Tests in error: 
  ProgramStoreTest.testGetProgramsByDataEntryForm:134  Query could not resolve ...

Tests run: 971, Failures: 0, Errors: 1, Skipped: 16

[INFO] ------------------------------------------------------------------------
[INFO] Reactor Summary:
[INFO] 
[INFO] DHIS 2 ............................................. SUCCESS [  0.002 s]
[INFO] DHIS API ........................................... SUCCESS [  4.236 s]
[INFO] DHIS Support Parent Project ........................ SUCCESS [  0.002 s]
[INFO] DHIS External Support .............................. SUCCESS [  0.111 s]
[INFO] DHIS Hibernate Support ............................. SUCCESS [  0.063 s]
[INFO] DHIS Test Support .................................. SUCCESS [  0.025 s]
[INFO] DHIS Support Commons ............................... SUCCESS [  0.717 s]
[INFO] DHIS System Support ................................ SUCCESS [  5.805 s]
[INFO] DHIS JDBC Service .................................. SUCCESS [  0.036 s]
[INFO] DHIS Services Parent Project ....................... SUCCESS [  0.000 s]
[INFO] DHIS Core API Implementations ...................... FAILURE [ 47.841 s]
[INFO] DHIS DXF 2 Data Exchange ........................... SKIPPED
[INFO] DHIS Mobile Service ................................ SKIPPED
[INFO] DHIS Administration Service ........................ SKIPPED
[INFO] DHIS Analytics ..................................... SKIPPED
[INFO] DHIS Reporting Service ............................. SKIPPED
[INFO] ------------------------------------------------------------------------
[INFO] BUILD FAILURE
[INFO] ------------------------------------------------------------------------
[INFO] Total time: 59.273 s
[INFO] Finished at: 2018-06-14T14:45:06+02:00
[INFO] Final Memory: 34M/930M
[INFO] ------------------------------------------------------------------------
[ERROR] Failed to execute goal org.apache.maven.plugins:maven-surefire-plugin:2.18.1:test (default-test) on project dhis-service-core: There are test failures.
[ERROR] 
[ERROR] Please refer to /root/workspace/uonafya/jphes-core/392231543/dhis-2/dhis-services/dhis-service-core/target/surefire-reports for the individual test results.
[ERROR] -> [Help 1]
[ERROR] 
[ERROR] To see the full stack trace of the errors, re-run Maven with the -e switch.
[ERROR] Re-run Maven using the -X switch to enable full debug logging.
[ERROR] 
[ERROR] For more information about the errors and possible solutions, please read the following articles:
[ERROR] [Help 1] http://cwiki.apache.org/confluence/display/MAVEN/MojoFailureException
[ERROR] 
[ERROR] After correcting the problems, you can resume the build with the command
[ERROR]   mvn <goals> -rf :dhis-service-core
