[INFO] Scanning for projects...
[INFO] ------------------------------------------------------------------------
[INFO] Reactor Build Order:
[INFO] 
[INFO] jsprit
[INFO] jsprit-core
[INFO] jsprit-analysis
[INFO] jsprit-io
[INFO] jsprit-instances
[INFO] jsprit-examples
[INFO]                                                                         
[INFO] ------------------------------------------------------------------------
[INFO] Building jsprit 1.7.3-SNAPSHOT
[INFO] ------------------------------------------------------------------------
[INFO]                                                                         
[INFO] ------------------------------------------------------------------------
[INFO] Building jsprit-core 1.7.3-SNAPSHOT
[INFO] ------------------------------------------------------------------------
[INFO] 
[INFO] --- maven-resources-plugin:2.6:resources (default-resources) @ jsprit-core ---
[INFO] Using 'UTF-8' encoding to copy filtered resources.
[INFO] skip non existing resourceDirectory /root/workspace/graphhopper/jsprit/348894180/jsprit-core/src/main/resources
[INFO] 
[INFO] --- maven-compiler-plugin:3.5.1:compile (default-compile) @ jsprit-core ---
[INFO] Nothing to compile - all classes are up to date
[INFO] 
[INFO] --- maven-resources-plugin:2.6:testResources (default-testResources) @ jsprit-core ---
[INFO] Using 'UTF-8' encoding to copy filtered resources.
[INFO] Copying 6 resources
[INFO] 
[INFO] --- maven-compiler-plugin:3.5.1:testCompile (default-testCompile) @ jsprit-core ---
[INFO] Nothing to compile - all classes are up to date
[INFO] 
[INFO] --- maven-surefire-plugin:2.19.1:test (default-test) @ jsprit-core ---
[INFO] Downloading: https://repo.maven.apache.org/maven2/org/apache/maven/surefire/surefire-junit4/2.19.1/surefire-junit4-2.19.1.pom
[INFO] Downloaded: https://repo.maven.apache.org/maven2/org/apache/maven/surefire/surefire-junit4/2.19.1/surefire-junit4-2.19.1.pom (4 KB at 8.4 KB/sec)
[INFO] Downloading: https://repo.maven.apache.org/maven2/org/apache/maven/surefire/surefire-providers/2.19.1/surefire-providers-2.19.1.pom
[INFO] Downloaded: https://repo.maven.apache.org/maven2/org/apache/maven/surefire/surefire-providers/2.19.1/surefire-providers-2.19.1.pom (3 KB at 139.1 KB/sec)
[INFO] Downloading: https://repo.maven.apache.org/maven2/org/apache/maven/surefire/surefire-junit4/2.19.1/surefire-junit4-2.19.1.jar
[INFO] Downloaded: https://repo.maven.apache.org/maven2/org/apache/maven/surefire/surefire-junit4/2.19.1/surefire-junit4-2.19.1.jar (74 KB at 1169.1 KB/sec)

-------------------------------------------------------
 T E S T S
-------------------------------------------------------
Running com.graphhopper.jsprit.core.algorithm.recreate.TestMixedServiceAndShipmentsProblemOnRouteLevel
Tests run: 2, Failures: 0, Errors: 0, Skipped: 0, Time elapsed: 0.068 sec - in com.graphhopper.jsprit.core.algorithm.recreate.TestMixedServiceAndShipmentsProblemOnRouteLevel
Running com.graphhopper.jsprit.core.algorithm.recreate.JobInsertionConsideringFixCostsCalculatorTest
Tests run: 26, Failures: 0, Errors: 0, Skipped: 0, Time elapsed: 0.154 sec - in com.graphhopper.jsprit.core.algorithm.recreate.JobInsertionConsideringFixCostsCalculatorTest
Running com.graphhopper.jsprit.core.algorithm.recreate.TestAuxilliaryCostCalculator
Tests run: 4, Failures: 0, Errors: 0, Skipped: 0, Time elapsed: 0.012 sec - in com.graphhopper.jsprit.core.algorithm.recreate.TestAuxilliaryCostCalculator
Running com.graphhopper.jsprit.core.algorithm.recreate.ServiceInsertionAndLoadConstraintsTest
Tests run: 1, Failures: 0, Errors: 0, Skipped: 0, Time elapsed: 0.02 sec - in com.graphhopper.jsprit.core.algorithm.recreate.ServiceInsertionAndLoadConstraintsTest
Running com.graphhopper.jsprit.core.algorithm.recreate.TestRouteLevelServiceInsertionCostEstimator
Tests run: 5, Failures: 0, Errors: 0, Skipped: 0, Time elapsed: 0.009 sec - in com.graphhopper.jsprit.core.algorithm.recreate.TestRouteLevelServiceInsertionCostEstimator
Running com.graphhopper.jsprit.core.algorithm.recreate.TestCalculatesServiceInsertionOnRouteLevel
Tests run: 5, Failures: 0, Errors: 0, Skipped: 0, Time elapsed: 0.004 sec - in com.graphhopper.jsprit.core.algorithm.recreate.TestCalculatesServiceInsertionOnRouteLevel
Running com.graphhopper.jsprit.core.algorithm.recreate.TestRouteLevelActivityInsertionCostEstimator
Tests run: 7, Failures: 0, Errors: 0, Skipped: 0, Time elapsed: 0.003 sec - in com.graphhopper.jsprit.core.algorithm.recreate.TestRouteLevelActivityInsertionCostEstimator
Running com.graphhopper.jsprit.core.algorithm.recreate.ShipmentInsertionCalculatorTest
Tests run: 7, Failures: 0, Errors: 0, Skipped: 0, Time elapsed: 0.011 sec - in com.graphhopper.jsprit.core.algorithm.recreate.ShipmentInsertionCalculatorTest
Running com.graphhopper.jsprit.core.algorithm.recreate.RegretInsertionTest
Tests run: 7, Failures: 0, Errors: 0, Skipped: 0, Time elapsed: 0.731 sec - in com.graphhopper.jsprit.core.algorithm.recreate.RegretInsertionTest
Running com.graphhopper.jsprit.core.algorithm.recreate.TestLocalActivityInsertionCostsCalculator
Tests run: 17, Failures: 0, Errors: 0, Skipped: 0, Time elapsed: 0.037 sec - in com.graphhopper.jsprit.core.algorithm.recreate.TestLocalActivityInsertionCostsCalculator
Running com.graphhopper.jsprit.core.algorithm.recreate.TestInserter
Tests run: 7, Failures: 0, Errors: 0, Skipped: 0, Time elapsed: 0.037 sec - in com.graphhopper.jsprit.core.algorithm.recreate.TestInserter
Running com.graphhopper.jsprit.core.algorithm.recreate.TestComparator
Tests run: 1, Failures: 0, Errors: 0, Skipped: 0, Time elapsed: 0 sec - in com.graphhopper.jsprit.core.algorithm.recreate.TestComparator
Running com.graphhopper.jsprit.core.algorithm.recreate.TestCalculatesServiceInsertion
Tests run: 9, Failures: 0, Errors: 0, Skipped: 0, Time elapsed: 0.006 sec - in com.graphhopper.jsprit.core.algorithm.recreate.TestCalculatesServiceInsertion
Running com.graphhopper.jsprit.core.algorithm.recreate.CalcVehicleTypeDependentServiceInsertionTest
Tests run: 2, Failures: 0, Errors: 0, Skipped: 0, Time elapsed: 0.006 sec - in com.graphhopper.jsprit.core.algorithm.recreate.CalcVehicleTypeDependentServiceInsertionTest
Running com.graphhopper.jsprit.core.algorithm.SearchStrategyManagerTest
Tests run: 11, Failures: 0, Errors: 0, Skipped: 0, Time elapsed: 0.019 sec - in com.graphhopper.jsprit.core.algorithm.SearchStrategyManagerTest
Running com.graphhopper.jsprit.core.algorithm.VehicleRoutingAlgorithmTest
Tests run: 7, Failures: 0, Errors: 0, Skipped: 0, Time elapsed: 0.036 sec - in com.graphhopper.jsprit.core.algorithm.VehicleRoutingAlgorithmTest
Running com.graphhopper.jsprit.core.algorithm.ruin.RuinBreakTest
Tests run: 1, Failures: 0, Errors: 0, Skipped: 0, Time elapsed: 0.001 sec - in com.graphhopper.jsprit.core.algorithm.ruin.RuinBreakTest
Running com.graphhopper.jsprit.core.algorithm.ruin.DBSCANClustererTest
Tests run: 3, Failures: 0, Errors: 0, Skipped: 0, Time elapsed: 0.001 sec - in com.graphhopper.jsprit.core.algorithm.ruin.DBSCANClustererTest
Running com.graphhopper.jsprit.core.algorithm.ruin.JobNeighborhoodsOptimizedTest
Tests run: 6, Failures: 0, Errors: 0, Skipped: 0, Time elapsed: 0.003 sec - in com.graphhopper.jsprit.core.algorithm.ruin.JobNeighborhoodsOptimizedTest
Running com.graphhopper.jsprit.core.algorithm.ruin.RuinClustersTest
Tests run: 1, Failures: 0, Errors: 0, Skipped: 0, Time elapsed: 0.002 sec - in com.graphhopper.jsprit.core.algorithm.ruin.RuinClustersTest
Running com.graphhopper.jsprit.core.algorithm.ruin.StringUtilTest
Tests run: 5, Failures: 0, Errors: 0, Skipped: 0, Time elapsed: 0.001 sec - in com.graphhopper.jsprit.core.algorithm.ruin.StringUtilTest
Running com.graphhopper.jsprit.core.algorithm.ruin.distance.AverageJobDistanceTest
Tests run: 2, Failures: 0, Errors: 0, Skipped: 0, Time elapsed: 0.002 sec - in com.graphhopper.jsprit.core.algorithm.ruin.distance.AverageJobDistanceTest
Running com.graphhopper.jsprit.core.algorithm.ruin.distance.TestJobDistanceAvgCosts
Tests run: 1, Failures: 0, Errors: 0, Skipped: 0, Time elapsed: 0 sec - in com.graphhopper.jsprit.core.algorithm.ruin.distance.TestJobDistanceAvgCosts
Running com.graphhopper.jsprit.core.algorithm.ruin.RuinWorstTest
Tests run: 6, Failures: 0, Errors: 0, Skipped: 0, Time elapsed: 0.002 sec - in com.graphhopper.jsprit.core.algorithm.ruin.RuinWorstTest
Running com.graphhopper.jsprit.core.algorithm.ruin.JobNeighborhoodsWithCapRestrictionImplTest
Tests run: 5, Failures: 0, Errors: 0, Skipped: 0, Time elapsed: 0.002 sec - in com.graphhopper.jsprit.core.algorithm.ruin.JobNeighborhoodsWithCapRestrictionImplTest
Running com.graphhopper.jsprit.core.algorithm.ruin.JobNeighborhoodsImplTest
Tests run: 5, Failures: 0, Errors: 0, Skipped: 0, Time elapsed: 0.001 sec - in com.graphhopper.jsprit.core.algorithm.ruin.JobNeighborhoodsImplTest
Running com.graphhopper.jsprit.core.algorithm.state.HardPickupAndDeliveryShipmentActivityConstraintTest
Tests run: 3, Failures: 0, Errors: 0, Skipped: 0, Time elapsed: 0.001 sec - in com.graphhopper.jsprit.core.algorithm.state.HardPickupAndDeliveryShipmentActivityConstraintTest
Running com.graphhopper.jsprit.core.algorithm.state.UpdateVehicleDependentTimeWindowTest
Tests run: 14, Failures: 0, Errors: 0, Skipped: 0, Time elapsed: 0.005 sec - in com.graphhopper.jsprit.core.algorithm.state.UpdateVehicleDependentTimeWindowTest
Running com.graphhopper.jsprit.core.algorithm.state.StateManagerTest
Tests run: 23, Failures: 0, Errors: 0, Skipped: 0, Time elapsed: 0.014 sec - in com.graphhopper.jsprit.core.algorithm.state.StateManagerTest
Running com.graphhopper.jsprit.core.algorithm.state.UpdatePracticalTimeWindowTest
Tests run: 3, Failures: 0, Errors: 0, Skipped: 0, Time elapsed: 0.002 sec - in com.graphhopper.jsprit.core.algorithm.state.UpdatePracticalTimeWindowTest
Running com.graphhopper.jsprit.core.algorithm.state.UpdateRequiredSkillsTest
Tests run: 1, Failures: 0, Errors: 0, Skipped: 0, Time elapsed: 0 sec - in com.graphhopper.jsprit.core.algorithm.state.UpdateRequiredSkillsTest
Running com.graphhopper.jsprit.core.algorithm.state.LoadStateTest
Tests run: 30, Failures: 0, Errors: 0, Skipped: 0, Time elapsed: 0.022 sec - in com.graphhopper.jsprit.core.algorithm.state.LoadStateTest
Running com.graphhopper.jsprit.core.algorithm.state.UpdateMaxTimeInVehicleTest
Tests run: 1, Failures: 0, Errors: 0, Skipped: 0, Time elapsed: 0.002 sec - in com.graphhopper.jsprit.core.algorithm.state.UpdateMaxTimeInVehicleTest
Running com.graphhopper.jsprit.core.algorithm.selector.SelectRandomlyTest
Tests run: 3, Failures: 0, Errors: 0, Skipped: 0, Time elapsed: 0.004 sec - in com.graphhopper.jsprit.core.algorithm.selector.SelectRandomlyTest
Running com.graphhopper.jsprit.core.algorithm.selector.SelectBestTest
Tests run: 3, Failures: 0, Errors: 0, Skipped: 0, Time elapsed: 0 sec - in com.graphhopper.jsprit.core.algorithm.selector.SelectBestTest
Running com.graphhopper.jsprit.core.algorithm.termination.TimeTerminationTest
Tests run: 2, Failures: 0, Errors: 0, Skipped: 0, Time elapsed: 0 sec - in com.graphhopper.jsprit.core.algorithm.termination.TimeTerminationTest
Running com.graphhopper.jsprit.core.algorithm.termination.IterationsWithoutImprovementTest
Tests run: 3, Failures: 0, Errors: 0, Skipped: 0, Time elapsed: 0.006 sec - in com.graphhopper.jsprit.core.algorithm.termination.IterationsWithoutImprovementTest
Running com.graphhopper.jsprit.core.algorithm.IgnoreBreakTimeWindowTest
Tests run: 1, Failures: 0, Errors: 0, Skipped: 0, Time elapsed: 0.042 sec - in com.graphhopper.jsprit.core.algorithm.IgnoreBreakTimeWindowTest
Running com.graphhopper.jsprit.core.algorithm.InitialRoutesTest
Tests run: 7, Failures: 0, Errors: 0, Skipped: 0, Time elapsed: 0.254 sec - in com.graphhopper.jsprit.core.algorithm.InitialRoutesTest
Running com.graphhopper.jsprit.core.algorithm.SearchStrategyTest
Tests run: 5, Failures: 0, Errors: 0, Skipped: 0, Time elapsed: 0.003 sec - in com.graphhopper.jsprit.core.algorithm.SearchStrategyTest
Running com.graphhopper.jsprit.core.algorithm.DeactivateTimeWindowsTest
Tests run: 2, Failures: 0, Errors: 0, Skipped: 0, Time elapsed: 0.001 sec - in com.graphhopper.jsprit.core.algorithm.DeactivateTimeWindowsTest
Running com.graphhopper.jsprit.core.algorithm.OpenRoutesTest
Tests run: 5, Failures: 0, Errors: 0, Skipped: 0, Time elapsed: 0.006 sec - in com.graphhopper.jsprit.core.algorithm.OpenRoutesTest
Running com.graphhopper.jsprit.core.algorithm.MultipleTimeWindowsTest
Tests run: 3, Failures: 0, Errors: 0, Skipped: 0, Time elapsed: 0.039 sec - in com.graphhopper.jsprit.core.algorithm.MultipleTimeWindowsTest
Running com.graphhopper.jsprit.core.algorithm.UnassignedJobListTest
Tests run: 2, Failures: 0, Errors: 0, Skipped: 0, Time elapsed: 0.004 sec - in com.graphhopper.jsprit.core.algorithm.UnassignedJobListTest
Running com.graphhopper.jsprit.core.algorithm.acceptor.SchrimpfAcceptanceTest
Tests run: 12, Failures: 0, Errors: 0, Skipped: 0, Time elapsed: 0.001 sec - in com.graphhopper.jsprit.core.algorithm.acceptor.SchrimpfAcceptanceTest
Running com.graphhopper.jsprit.core.algorithm.acceptor.GreedyAcceptanceTest
Tests run: 1, Failures: 0, Errors: 0, Skipped: 0, Time elapsed: 0 sec - in com.graphhopper.jsprit.core.algorithm.acceptor.GreedyAcceptanceTest
Running com.graphhopper.jsprit.core.algorithm.box.JspritTest
Tests run: 11, Failures: 0, Errors: 0, Skipped: 0, Time elapsed: 0.381 sec - in com.graphhopper.jsprit.core.algorithm.box.JspritTest
Running com.graphhopper.jsprit.core.algorithm.ExternalInitialSolutionIsInValidTest
Tests run: 1, Failures: 0, Errors: 0, Skipped: 0, Time elapsed: 0.125 sec - in com.graphhopper.jsprit.core.algorithm.ExternalInitialSolutionIsInValidTest
Running com.graphhopper.jsprit.core.util.TimeTest
Tests run: 26, Failures: 0, Errors: 0, Skipped: 0, Time elapsed: 0.009 sec - in com.graphhopper.jsprit.core.util.TimeTest
Running com.graphhopper.jsprit.core.util.FastVehicleRoutingTransportCostsMatrixTest
Tests run: 7, Failures: 0, Errors: 0, Skipped: 0, Time elapsed: 0.002 sec - in com.graphhopper.jsprit.core.util.FastVehicleRoutingTransportCostsMatrixTest
Running com.graphhopper.jsprit.core.util.GreatCircleDistanceCalculatorTest
Tests run: 2, Failures: 0, Errors: 0, Skipped: 0, Time elapsed: 0 sec - in com.graphhopper.jsprit.core.util.GreatCircleDistanceCalculatorTest
Running com.graphhopper.jsprit.core.util.VehicleRoutingTransportCostsMatrixTest
Tests run: 19, Failures: 0, Errors: 0, Skipped: 0, Time elapsed: 0.003 sec - in com.graphhopper.jsprit.core.util.VehicleRoutingTransportCostsMatrixTest
Running com.graphhopper.jsprit.core.util.UnassignedJobReasonTrackerTest
VehicleDependentTimeWindowHardActivityConstraint 2
b 1
Tests run: 6, Failures: 0, Errors: 0, Skipped: 0, Time elapsed: 0.097 sec - in com.graphhopper.jsprit.core.util.UnassignedJobReasonTrackerTest
Running com.graphhopper.jsprit.core.util.RandomUtilsTest
Tests run: 3, Failures: 0, Errors: 0, Skipped: 0, Time elapsed: 0 sec - in com.graphhopper.jsprit.core.util.RandomUtilsTest
Running com.graphhopper.jsprit.core.problem.solution.route.activity.PickupServiceTest
Tests run: 7, Failures: 0, Errors: 0, Skipped: 0, Time elapsed: 0 sec - in com.graphhopper.jsprit.core.problem.solution.route.activity.PickupServiceTest
Running com.graphhopper.jsprit.core.problem.solution.route.activity.DeliverServiceTest
Tests run: 7, Failures: 0, Errors: 0, Skipped: 0, Time elapsed: 0 sec - in com.graphhopper.jsprit.core.problem.solution.route.activity.DeliverServiceTest
Running com.graphhopper.jsprit.core.problem.solution.route.activity.DefaultShipmentActivityFactoryTest
Tests run: 2, Failures: 0, Errors: 0, Skipped: 0, Time elapsed: 0 sec - in com.graphhopper.jsprit.core.problem.solution.route.activity.DefaultShipmentActivityFactoryTest
Running com.graphhopper.jsprit.core.problem.solution.route.activity.TestRefs
Tests run: 1, Failures: 0, Errors: 0, Skipped: 0, Time elapsed: 0 sec - in com.graphhopper.jsprit.core.problem.solution.route.activity.TestRefs
Running com.graphhopper.jsprit.core.problem.solution.route.activity.StartTest
Tests run: 7, Failures: 0, Errors: 0, Skipped: 0, Time elapsed: 0 sec - in com.graphhopper.jsprit.core.problem.solution.route.activity.StartTest
Running com.graphhopper.jsprit.core.problem.solution.route.activity.DeliverShipmentTest
Tests run: 8, Failures: 0, Errors: 0, Skipped: 0, Time elapsed: 0 sec - in com.graphhopper.jsprit.core.problem.solution.route.activity.DeliverShipmentTest
Running com.graphhopper.jsprit.core.problem.solution.route.activity.DefaultTourActivityFactoryTest
Tests run: 3, Failures: 0, Errors: 0, Skipped: 0, Time elapsed: 0 sec - in com.graphhopper.jsprit.core.problem.solution.route.activity.DefaultTourActivityFactoryTest
Running com.graphhopper.jsprit.core.problem.solution.route.activity.ServiceActivityTest
Tests run: 9, Failures: 0, Errors: 0, Skipped: 0, Time elapsed: 0 sec - in com.graphhopper.jsprit.core.problem.solution.route.activity.ServiceActivityTest
Running com.graphhopper.jsprit.core.problem.solution.route.activity.PickupShipmentTest
Tests run: 8, Failures: 0, Errors: 0, Skipped: 0, Time elapsed: 0 sec - in com.graphhopper.jsprit.core.problem.solution.route.activity.PickupShipmentTest
Running com.graphhopper.jsprit.core.problem.solution.route.activity.BreakActivityTest
Tests run: 9, Failures: 0, Errors: 0, Skipped: 0, Time elapsed: 0.001 sec - in com.graphhopper.jsprit.core.problem.solution.route.activity.BreakActivityTest
Running com.graphhopper.jsprit.core.problem.solution.route.activity.TimeWindowsImplTest
Tests run: 3, Failures: 0, Errors: 0, Skipped: 0, Time elapsed: 0 sec - in com.graphhopper.jsprit.core.problem.solution.route.activity.TimeWindowsImplTest
Running com.graphhopper.jsprit.core.problem.solution.route.activity.TestTourActivities
Tests run: 13, Failures: 0, Errors: 0, Skipped: 0, Time elapsed: 0 sec - in com.graphhopper.jsprit.core.problem.solution.route.activity.TestTourActivities
Running com.graphhopper.jsprit.core.problem.solution.route.activity.EndTest
Tests run: 7, Failures: 0, Errors: 0, Skipped: 0, Time elapsed: 0 sec - in com.graphhopper.jsprit.core.problem.solution.route.activity.EndTest
Running com.graphhopper.jsprit.core.problem.solution.route.VehicleRouteBuilderTest
Tests run: 8, Failures: 0, Errors: 0, Skipped: 0, Time elapsed: 0.001 sec - in com.graphhopper.jsprit.core.problem.solution.route.VehicleRouteBuilderTest
Running com.graphhopper.jsprit.core.problem.solution.route.TestVehicleRoute
Tests run: 28, Failures: 0, Errors: 0, Skipped: 0, Time elapsed: 0.003 sec - in com.graphhopper.jsprit.core.problem.solution.route.TestVehicleRoute
Running com.graphhopper.jsprit.core.problem.solution.VehicleRoutingProblemSolutionTest
Tests run: 7, Failures: 0, Errors: 0, Skipped: 0, Time elapsed: 0 sec - in com.graphhopper.jsprit.core.problem.solution.VehicleRoutingProblemSolutionTest
Running com.graphhopper.jsprit.core.problem.vehicle.VehicleTypeImplTest
Tests run: 24, Failures: 0, Errors: 0, Skipped: 0, Time elapsed: 0.002 sec - in com.graphhopper.jsprit.core.problem.vehicle.VehicleTypeImplTest
Running com.graphhopper.jsprit.core.problem.vehicle.VehicleImplTest
Tests run: 31, Failures: 0, Errors: 0, Skipped: 0, Time elapsed: 0.003 sec - in com.graphhopper.jsprit.core.problem.vehicle.VehicleImplTest
Running com.graphhopper.jsprit.core.problem.vehicle.VehicleTypeKeyTest
Tests run: 2, Failures: 0, Errors: 0, Skipped: 0, Time elapsed: 0 sec - in com.graphhopper.jsprit.core.problem.vehicle.VehicleTypeKeyTest
Running com.graphhopper.jsprit.core.problem.vehicle.TestVehicleFleetManagerImpl
Tests run: 14, Failures: 0, Errors: 0, Skipped: 0, Time elapsed: 0 sec - in com.graphhopper.jsprit.core.problem.vehicle.TestVehicleFleetManagerImpl
Running com.graphhopper.jsprit.core.problem.vehicle.FiniteVehicleFleetManagerFactoryTest
Tests run: 1, Failures: 0, Errors: 0, Skipped: 0, Time elapsed: 0 sec - in com.graphhopper.jsprit.core.problem.vehicle.FiniteVehicleFleetManagerFactoryTest
Running com.graphhopper.jsprit.core.problem.constraint.VehicleDependentTraveledDistanceTest
Tests run: 13, Failures: 0, Errors: 0, Skipped: 0, Time elapsed: 0.003 sec - in com.graphhopper.jsprit.core.problem.constraint.VehicleDependentTraveledDistanceTest
Running com.graphhopper.jsprit.core.problem.constraint.VehicleDependentTimeWindowTest
Tests run: 14, Failures: 0, Errors: 0, Skipped: 0, Time elapsed: 0.004 sec - in com.graphhopper.jsprit.core.problem.constraint.VehicleDependentTimeWindowTest
Running com.graphhopper.jsprit.core.problem.constraint.SoftActivityConstraintManagerTest
Tests run: 3, Failures: 0, Errors: 0, Skipped: 0, Time elapsed: 0.004 sec - in com.graphhopper.jsprit.core.problem.constraint.SoftActivityConstraintManagerTest
Running com.graphhopper.jsprit.core.problem.constraint.ServiceLoadRouteLevelConstraintTest
Tests run: 17, Failures: 0, Errors: 0, Skipped: 0, Time elapsed: 0.02 sec - in com.graphhopper.jsprit.core.problem.constraint.ServiceLoadRouteLevelConstraintTest
Running com.graphhopper.jsprit.core.problem.constraint.VehicleDependentTimeWindowWithStartTimeAndMaxOperationTimeTest
Tests run: 14, Failures: 0, Errors: 0, Skipped: 0, Time elapsed: 0.004 sec - in com.graphhopper.jsprit.core.problem.constraint.VehicleDependentTimeWindowWithStartTimeAndMaxOperationTimeTest
Running com.graphhopper.jsprit.core.problem.constraint.MaxTimeInVehicleConstraintTest
Tests run: 11, Failures: 0, Errors: 0, Skipped: 0, Time elapsed: 0.003 sec - in com.graphhopper.jsprit.core.problem.constraint.MaxTimeInVehicleConstraintTest
Running com.graphhopper.jsprit.core.problem.constraint.SkillConstraintTest
Tests run: 5, Failures: 0, Errors: 0, Skipped: 0, Time elapsed: 0.001 sec - in com.graphhopper.jsprit.core.problem.constraint.SkillConstraintTest
Running com.graphhopper.jsprit.core.problem.constraint.SoftRouteConstraintManagerTest
Tests run: 3, Failures: 0, Errors: 0, Skipped: 0, Time elapsed: 0.002 sec - in com.graphhopper.jsprit.core.problem.constraint.SoftRouteConstraintManagerTest
Running com.graphhopper.jsprit.core.problem.constraint.TestConstraintManager
Tests run: 6, Failures: 0, Errors: 0, Skipped: 0, Time elapsed: 0.005 sec - in com.graphhopper.jsprit.core.problem.constraint.TestConstraintManager
Running com.graphhopper.jsprit.core.problem.constraint.LoadConstraintTest
Tests run: 50, Failures: 0, Errors: 0, Skipped: 0, Time elapsed: 0.034 sec - in com.graphhopper.jsprit.core.problem.constraint.LoadConstraintTest
Running com.graphhopper.jsprit.core.problem.LocationTest
Tests run: 10, Failures: 0, Errors: 0, Skipped: 0, Time elapsed: 0.001 sec - in com.graphhopper.jsprit.core.problem.LocationTest
Running com.graphhopper.jsprit.core.problem.job.ShipmentTest
Tests run: 52, Failures: 4, Errors: 0, Skipped: 0, Time elapsed: 0.012 sec <<< FAILURE! - in com.graphhopper.jsprit.core.problem.job.ShipmentTest
whenNotSettingPriorities_defaultShouldBe2(com.graphhopper.jsprit.core.problem.job.ShipmentTest)  Time elapsed: 0.005 sec  <<< FAILURE!
java.lang.AssertionError: Use assertEquals(expected, actual, delta) to compare floating-point numbers
	at com.graphhopper.jsprit.core.problem.job.ShipmentTest.whenNotSettingPriorities_defaultShouldBe2(ShipmentTest.java:420)

whenSettingPriorities_itShouldBeSetCorrectly(com.graphhopper.jsprit.core.problem.job.ShipmentTest)  Time elapsed: 0.001 sec  <<< FAILURE!
java.lang.AssertionError: Use assertEquals(expected, actual, delta) to compare floating-point numbers
	at com.graphhopper.jsprit.core.problem.job.ShipmentTest.whenSettingPriorities_itShouldBeSetCorrectly(ShipmentTest.java:396)

whenSettingPriorities_itShouldBeSetCorrectly2(com.graphhopper.jsprit.core.problem.job.ShipmentTest)  Time elapsed: 0 sec  <<< FAILURE!
java.lang.AssertionError: Use assertEquals(expected, actual, delta) to compare floating-point numbers
	at com.graphhopper.jsprit.core.problem.job.ShipmentTest.whenSettingPriorities_itShouldBeSetCorrectly2(ShipmentTest.java:404)

whenSettingPriorities_itShouldBeSetCorrectly3(com.graphhopper.jsprit.core.problem.job.ShipmentTest)  Time elapsed: 0 sec  <<< FAILURE!
java.lang.AssertionError: Use assertEquals(expected, actual, delta) to compare floating-point numbers
	at com.graphhopper.jsprit.core.problem.job.ShipmentTest.whenSettingPriorities_itShouldBeSetCorrectly3(ShipmentTest.java:412)

Running com.graphhopper.jsprit.core.problem.job.PickupTest
Tests run: 13, Failures: 2, Errors: 0, Skipped: 0, Time elapsed: 0.001 sec <<< FAILURE! - in com.graphhopper.jsprit.core.problem.job.PickupTest
whenNotSettingPriorities_defaultShouldBe(com.graphhopper.jsprit.core.problem.job.PickupTest)  Time elapsed: 0 sec  <<< FAILURE!
java.lang.AssertionError: Use assertEquals(expected, actual, delta) to compare floating-point numbers
	at com.graphhopper.jsprit.core.problem.job.PickupTest.whenNotSettingPriorities_defaultShouldBe(PickupTest.java:108)

whenSettingPriorities_itShouldBeSetCorrectly(com.graphhopper.jsprit.core.problem.job.PickupTest)  Time elapsed: 0 sec  <<< FAILURE!
java.lang.AssertionError: Use assertEquals(expected, actual, delta) to compare floating-point numbers
	at com.graphhopper.jsprit.core.problem.job.PickupTest.whenSettingPriorities_itShouldBeSetCorrectly(PickupTest.java:101)

Running com.graphhopper.jsprit.core.problem.job.ServiceTest
Tests run: 36, Failures: 0, Errors: 1, Skipped: 0, Time elapsed: 0.002 sec <<< FAILURE! - in com.graphhopper.jsprit.core.problem.job.ServiceTest
whenSettingPriorities_itShouldBeSetCorrectly4(com.graphhopper.jsprit.core.problem.job.ServiceTest)  Time elapsed: 0 sec  <<< ERROR!
java.lang.IllegalArgumentException: The priority value is not valid. Only 1 (very high) to 10 (very low) are allowed.
	at com.graphhopper.jsprit.core.problem.job.ServiceTest.whenSettingPriorities_itShouldBeSetCorrectly4(ServiceTest.java:265)

Running com.graphhopper.jsprit.core.problem.job.DeliveryTest
Tests run: 13, Failures: 2, Errors: 0, Skipped: 0, Time elapsed: 0.001 sec <<< FAILURE! - in com.graphhopper.jsprit.core.problem.job.DeliveryTest
whenNotSettingPriorities_defaultShouldBe(com.graphhopper.jsprit.core.problem.job.DeliveryTest)  Time elapsed: 0 sec  <<< FAILURE!
java.lang.AssertionError: Use assertEquals(expected, actual, delta) to compare floating-point numbers
	at com.graphhopper.jsprit.core.problem.job.DeliveryTest.whenNotSettingPriorities_defaultShouldBe(DeliveryTest.java:106)

whenSettingPriorities_itShouldBeSetCorrectly(com.graphhopper.jsprit.core.problem.job.DeliveryTest)  Time elapsed: 0 sec  <<< FAILURE!
java.lang.AssertionError: Use assertEquals(expected, actual, delta) to compare floating-point numbers
	at com.graphhopper.jsprit.core.problem.job.DeliveryTest.whenSettingPriorities_itShouldBeSetCorrectly(DeliveryTest.java:99)

Running com.graphhopper.jsprit.core.problem.VehicleRoutingProblemTest
Tests run: 32, Failures: 0, Errors: 0, Skipped: 0, Time elapsed: 0.007 sec - in com.graphhopper.jsprit.core.problem.VehicleRoutingProblemTest
Running com.graphhopper.jsprit.core.problem.SkillsTest
Tests run: 9, Failures: 0, Errors: 0, Skipped: 0, Time elapsed: 0 sec - in com.graphhopper.jsprit.core.problem.SkillsTest
Running com.graphhopper.jsprit.core.problem.CapacityTest
Tests run: 42, Failures: 0, Errors: 0, Skipped: 0, Time elapsed: 0.012 sec - in com.graphhopper.jsprit.core.problem.CapacityTest
Running com.graphhopper.jsprit.core.problem.misc.JobInsertionContextTest
Tests run: 7, Failures: 0, Errors: 0, Skipped: 0, Time elapsed: 0.003 sec - in com.graphhopper.jsprit.core.problem.misc.JobInsertionContextTest
Running com.graphhopper.jsprit.core.analysis.SolutionAnalyserTest
Tests run: 160, Failures: 0, Errors: 0, Skipped: 0, Time elapsed: 0.064 sec - in com.graphhopper.jsprit.core.analysis.SolutionAnalyserTest

Results :

Failed tests: 
  DeliveryTest.whenNotSettingPriorities_defaultShouldBe:106 Use assertEquals(expected, actual, delta) to compare floating-point numbers
  DeliveryTest.whenSettingPriorities_itShouldBeSetCorrectly:99 Use assertEquals(expected, actual, delta) to compare floating-point numbers
  PickupTest.whenNotSettingPriorities_defaultShouldBe:108 Use assertEquals(expected, actual, delta) to compare floating-point numbers
  PickupTest.whenSettingPriorities_itShouldBeSetCorrectly:101 Use assertEquals(expected, actual, delta) to compare floating-point numbers
  ShipmentTest.whenNotSettingPriorities_defaultShouldBe2:420 Use assertEquals(expected, actual, delta) to compare floating-point numbers
  ShipmentTest.whenSettingPriorities_itShouldBeSetCorrectly:396 Use assertEquals(expected, actual, delta) to compare floating-point numbers
  ShipmentTest.whenSettingPriorities_itShouldBeSetCorrectly2:404 Use assertEquals(expected, actual, delta) to compare floating-point numbers
  ShipmentTest.whenSettingPriorities_itShouldBeSetCorrectly3:412 Use assertEquals(expected, actual, delta) to compare floating-point numbers
Tests in error: 
  ServiceTest.whenSettingPriorities_itShouldBeSetCorrectly4:265 » IllegalArgument

Tests run: 1061, Failures: 8, Errors: 1, Skipped: 0

[INFO] ------------------------------------------------------------------------
[INFO] Reactor Summary:
[INFO] 
[INFO] jsprit ............................................. SUCCESS [  0.032 s]
[INFO] jsprit-core ........................................ FAILURE [  4.685 s]
[INFO] jsprit-analysis .................................... SKIPPED
[INFO] jsprit-io .......................................... SKIPPED
[INFO] jsprit-instances ................................... SKIPPED
[INFO] jsprit-examples .................................... SKIPPED
[INFO] ------------------------------------------------------------------------
[INFO] BUILD FAILURE
[INFO] ------------------------------------------------------------------------
[INFO] Total time: 5.064 s
[INFO] Finished at: 2018-03-04T12:28:52+01:00
[INFO] Final Memory: 21M/933M
[INFO] ------------------------------------------------------------------------
[ERROR] Failed to execute goal org.apache.maven.plugins:maven-surefire-plugin:2.19.1:test (default-test) on project jsprit-core: There are test failures.
[ERROR] 
[ERROR] Please refer to /root/workspace/graphhopper/jsprit/348894180/jsprit-core/target/surefire-reports for the individual test results.
[ERROR] -> [Help 1]
[ERROR] 
[ERROR] To see the full stack trace of the errors, re-run Maven with the -e switch.
[ERROR] Re-run Maven using the -X switch to enable full debug logging.
[ERROR] 
[ERROR] For more information about the errors and possible solutions, please read the following articles:
[ERROR] [Help 1] http://cwiki.apache.org/confluence/display/MAVEN/MojoFailureException
[ERROR] 
[ERROR] After correcting the problems, you can resume the build with the command
[ERROR]   mvn <goals> -rf :jsprit-core
