[INFO] Scanning for projects...
[INFO] ------------------------------------------------------------------------
[INFO] Reactor Build Order:
[INFO] 
[INFO] replicator
[INFO] mysql-replicator-commons
[INFO] mysql-replicator-streams
[INFO] mysql-replicator-coordinator
[INFO] mysql-replicator-supplier-model
[INFO] mysql-replicator-supplier
[INFO] mysql-replicator-augmenter-model
[INFO] mysql-replicator-augmenter
[INFO] mysql-replicator-applier
[INFO] mysql-replicator
[INFO]                                                                         
[INFO] ------------------------------------------------------------------------
[INFO] Building replicator 0.16.0-alpha-1-SNAPSHOT
[INFO] ------------------------------------------------------------------------
[INFO] 
[INFO] --- maven-checkstyle-plugin:3.0.0:check (validate) @ replicator ---
[INFO] 
[INFO] --- jacoco-maven-plugin:0.8.0:prepare-agent (default) @ replicator ---
[INFO] tests.arguments set to -javaagent:/root/./workspace/mysql-time-machine/replicator/392314555/.m2/org/jacoco/org.jacoco.agent/0.8.0/org.jacoco.agent-0.8.0-runtime.jar=destfile=/root/workspace/mysql-time-machine/replicator/392314555/target/jacoco.exec -Djava.util.logging.manager=org.apache.logging.log4j.jul.LogManager
[INFO] 
[INFO] --- jacoco-maven-plugin:0.8.0:report (report) @ replicator ---
[INFO] Skipping JaCoCo execution due to missing execution data file.
[INFO]                                                                         
[INFO] ------------------------------------------------------------------------
[INFO] Building mysql-replicator-commons 0.16.0-alpha-1-SNAPSHOT
[INFO] ------------------------------------------------------------------------
[INFO] 
[INFO] --- maven-checkstyle-plugin:3.0.0:check (validate) @ mysql-replicator-commons ---
[INFO] 
[INFO] --- jacoco-maven-plugin:0.8.0:prepare-agent (default) @ mysql-replicator-commons ---
[INFO] tests.arguments set to -javaagent:/root/./workspace/mysql-time-machine/replicator/392314555/.m2/org/jacoco/org.jacoco.agent/0.8.0/org.jacoco.agent-0.8.0-runtime.jar=destfile=/root/workspace/mysql-time-machine/replicator/392314555/mysql-replicator-commons/target/jacoco.exec -Djava.util.logging.manager=org.apache.logging.log4j.jul.LogManager
[INFO] 
[INFO] --- maven-resources-plugin:2.6:resources (default-resources) @ mysql-replicator-commons ---
[INFO] Using 'UTF-8' encoding to copy filtered resources.
[INFO] skip non existing resourceDirectory /root/workspace/mysql-time-machine/replicator/392314555/mysql-replicator-commons/src/main/resources
[INFO] 
[INFO] --- maven-compiler-plugin:3.7.0:compile (default-compile) @ mysql-replicator-commons ---
[INFO] Nothing to compile - all classes are up to date
[INFO] 
[INFO] --- maven-resources-plugin:2.6:testResources (default-testResources) @ mysql-replicator-commons ---
[INFO] Using 'UTF-8' encoding to copy filtered resources.
[INFO] Copying 2 resources
[INFO] 
[INFO] --- maven-compiler-plugin:3.7.0:testCompile (default-testCompile) @ mysql-replicator-commons ---
[INFO] Nothing to compile - all classes are up to date
[INFO] 
[INFO] --- maven-surefire-plugin:2.20.1:test (default-test) @ mysql-replicator-commons ---
[INFO] 
[INFO] --- jacoco-maven-plugin:0.8.0:report (report) @ mysql-replicator-commons ---
[INFO] Skipping JaCoCo execution due to missing execution data file.
[INFO]                                                                         
[INFO] ------------------------------------------------------------------------
[INFO] Building mysql-replicator-streams 0.16.0-alpha-1-SNAPSHOT
[INFO] ------------------------------------------------------------------------
[INFO] 
[INFO] --- maven-checkstyle-plugin:3.0.0:check (validate) @ mysql-replicator-streams ---
[INFO] 
[INFO] --- jacoco-maven-plugin:0.8.0:prepare-agent (default) @ mysql-replicator-streams ---
[INFO] tests.arguments set to -javaagent:/root/./workspace/mysql-time-machine/replicator/392314555/.m2/org/jacoco/org.jacoco.agent/0.8.0/org.jacoco.agent-0.8.0-runtime.jar=destfile=/root/workspace/mysql-time-machine/replicator/392314555/mysql-replicator-streams/target/jacoco.exec -Djava.util.logging.manager=org.apache.logging.log4j.jul.LogManager
[INFO] 
[INFO] --- maven-resources-plugin:2.6:resources (default-resources) @ mysql-replicator-streams ---
[INFO] Using 'UTF-8' encoding to copy filtered resources.
[INFO] skip non existing resourceDirectory /root/workspace/mysql-time-machine/replicator/392314555/mysql-replicator-streams/src/main/resources
[INFO] 
[INFO] --- maven-compiler-plugin:3.7.0:compile (default-compile) @ mysql-replicator-streams ---
[INFO] Nothing to compile - all classes are up to date
[INFO] 
[INFO] --- maven-resources-plugin:2.6:testResources (default-testResources) @ mysql-replicator-streams ---
[INFO] Using 'UTF-8' encoding to copy filtered resources.
[INFO] Copying 1 resource
[INFO] 
[INFO] --- maven-compiler-plugin:3.7.0:testCompile (default-testCompile) @ mysql-replicator-streams ---
[INFO] Nothing to compile - all classes are up to date
[INFO] 
[INFO] --- maven-surefire-plugin:2.20.1:test (default-test) @ mysql-replicator-streams ---
[INFO] Downloading: https://repo.maven.apache.org/maven2/org/apache/maven/surefire/surefire-junit4/2.20.1/surefire-junit4-2.20.1.pom
[INFO] Downloaded: https://repo.maven.apache.org/maven2/org/apache/maven/surefire/surefire-junit4/2.20.1/surefire-junit4-2.20.1.pom (4 KB at 9.8 KB/sec)
[INFO] Downloading: https://repo.maven.apache.org/maven2/org/apache/maven/surefire/surefire-providers/2.20.1/surefire-providers-2.20.1.pom
[INFO] Downloaded: https://repo.maven.apache.org/maven2/org/apache/maven/surefire/surefire-providers/2.20.1/surefire-providers-2.20.1.pom (3 KB at 143.6 KB/sec)
[INFO] Downloading: https://repo.maven.apache.org/maven2/org/apache/maven/surefire/surefire-junit4/2.20.1/surefire-junit4-2.20.1.jar
[INFO] Downloaded: https://repo.maven.apache.org/maven2/org/apache/maven/surefire/surefire-junit4/2.20.1/surefire-junit4-2.20.1.jar (81 KB at 1673.9 KB/sec)
[INFO] 
[INFO] -------------------------------------------------------
[INFO]  T E S T S
[INFO] -------------------------------------------------------
[INFO] Running com.booking.replication.streams.StreamsTest
2018-06-14 17:38:26,857 main DEBUG Initializing configuration XmlConfiguration[location=/root/workspace/mysql-time-machine/replicator/392314555/mysql-replicator-streams/target/test-classes/log4j2.xml]
2018-06-14 17:38:26,863 main DEBUG Installed 1 script engine
2018-06-14 17:38:27,128 main DEBUG Oracle Nashorn version: 1.8.0_121, language: ECMAScript, threading: Not Thread Safe, compile: true, names: [nashorn, Nashorn, js, JS, JavaScript, javascript, ECMAScript, ecmascript], factory class: jdk.nashorn.api.scripting.NashornScriptEngineFactory
2018-06-14 17:38:27,129 main DEBUG PluginManager 'Core' found 116 plugins
2018-06-14 17:38:27,129 main DEBUG PluginManager 'Level' found 0 plugins
2018-06-14 17:38:27,133 main DEBUG PluginManager 'Lookup' found 13 plugins
2018-06-14 17:38:27,135 main DEBUG Building Plugin[name=layout, class=org.apache.logging.log4j.core.layout.PatternLayout].
2018-06-14 17:38:27,143 main DEBUG PluginManager 'TypeConverter' found 26 plugins
2018-06-14 17:38:27,156 main DEBUG PatternLayout$Builder(pattern="%d{yyyy-MM-dd HH:mm:ss} [%-5p] %c{1}:%L - %m%n", PatternSelector=null, Configuration(/root/workspace/mysql-time-machine/replicator/392314555/mysql-replicator-streams/target/test-classes/log4j2.xml), Replace=null, charset="null", alwaysWriteExceptions="null", disableAnsi="null", noConsoleNoAnsi="null", header="null", footer="null")
2018-06-14 17:38:27,156 main DEBUG PluginManager 'Converter' found 42 plugins
2018-06-14 17:38:27,168 main DEBUG Building Plugin[name=appender, class=org.apache.logging.log4j.core.appender.ConsoleAppender].
2018-06-14 17:38:27,175 main DEBUG ConsoleAppender$Builder(target="SYSTEM_OUT", follow="null", direct="null", bufferedIo="null", bufferSize="null", immediateFlush="null", ignoreExceptions="null", PatternLayout(%d{yyyy-MM-dd HH:mm:ss} [%-5p] %c{1}:%L - %m%n), name="Console", Configuration(/root/workspace/mysql-time-machine/replicator/392314555/mysql-replicator-streams/target/test-classes/log4j2.xml), Filter=null)
2018-06-14 17:38:27,177 main DEBUG Starting OutputStreamManager SYSTEM_OUT.false.false
2018-06-14 17:38:27,177 main DEBUG Building Plugin[name=appenders, class=org.apache.logging.log4j.core.config.AppendersPlugin].
2018-06-14 17:38:27,179 main DEBUG createAppenders(={Console})
2018-06-14 17:38:27,179 main DEBUG Building Plugin[name=AppenderRef, class=org.apache.logging.log4j.core.config.AppenderRef].
2018-06-14 17:38:27,183 main DEBUG createAppenderRef(ref="Console", level="null", Filter=null)
2018-06-14 17:38:27,183 main DEBUG Building Plugin[name=root, class=org.apache.logging.log4j.core.config.LoggerConfig$RootLogger].
2018-06-14 17:38:27,184 main DEBUG createLogger(additivity="null", level="DEBUG", includeLocation="null", ={Console}, ={}, Configuration(/root/workspace/mysql-time-machine/replicator/392314555/mysql-replicator-streams/target/test-classes/log4j2.xml), Filter=null)
2018-06-14 17:38:27,186 main DEBUG Building Plugin[name=loggers, class=org.apache.logging.log4j.core.config.LoggersPlugin].
2018-06-14 17:38:27,187 main DEBUG createLoggers(={root})
2018-06-14 17:38:27,187 main DEBUG Configuration XmlConfiguration[location=/root/workspace/mysql-time-machine/replicator/392314555/mysql-replicator-streams/target/test-classes/log4j2.xml] initialized
2018-06-14 17:38:27,188 main DEBUG Starting configuration XmlConfiguration[location=/root/workspace/mysql-time-machine/replicator/392314555/mysql-replicator-streams/target/test-classes/log4j2.xml]
2018-06-14 17:38:27,188 main DEBUG Started configuration XmlConfiguration[location=/root/workspace/mysql-time-machine/replicator/392314555/mysql-replicator-streams/target/test-classes/log4j2.xml] OK.
2018-06-14 17:38:27,189 main DEBUG Shutting down OutputStreamManager SYSTEM_OUT.false.false-1
2018-06-14 17:38:27,189 main DEBUG Shut down OutputStreamManager SYSTEM_OUT.false.false-1, all resources released: true
2018-06-14 17:38:27,189 main DEBUG Appender DefaultConsole-1 stopped with status true
2018-06-14 17:38:27,190 main DEBUG Stopped org.apache.logging.log4j.core.config.DefaultConfiguration@2344fc66 OK
2018-06-14 17:38:27,233 main DEBUG Registering MBean org.apache.logging.log4j2:type=330bedb4
2018-06-14 17:38:27,235 main DEBUG Registering MBean org.apache.logging.log4j2:type=330bedb4,component=StatusLogger
2018-06-14 17:38:27,237 main DEBUG Registering MBean org.apache.logging.log4j2:type=330bedb4,component=ContextSelector
2018-06-14 17:38:27,238 main DEBUG Registering MBean org.apache.logging.log4j2:type=330bedb4,component=Loggers,name=
2018-06-14 17:38:27,239 main DEBUG Registering MBean org.apache.logging.log4j2:type=330bedb4,component=Appenders,name=Console
2018-06-14 17:38:27,241 main DEBUG Reconfiguration complete for context[name=330bedb4] at URI /root/workspace/mysql-time-machine/replicator/392314555/mysql-replicator-streams/target/test-classes/log4j2.xml (org.apache.logging.log4j.core.LoggerContext@12405818) with optional ClassLoader: null
2018-06-14 17:38:27,241 main DEBUG Shutdown hook enabled. Registering a new one.
2018-06-14 17:38:27,242 main DEBUG LoggerContext[name=330bedb4, org.apache.logging.log4j.core.LoggerContext@12405818] started OK.
2018-06-14 17:38:27 [DEBUG] StreamsImplementation:133 - streams started
2018-06-14 17:38:27 [DEBUG] StreamsImplementation:162 - streams stopped
2018-06-14 17:38:27 [DEBUG] StreamsImplementation:133 - streams started
2018-06-14 17:38:27 [DEBUG] StreamsImplementation:133 - streams started
2018-06-14 17:38:27 [DEBUG] StreamsImplementation:162 - streams stopped
2018-06-14 17:38:27 [DEBUG] StreamsImplementation:133 - streams started
2018-06-14 17:38:28 [DEBUG] StreamsImplementation:162 - streams stopped
2018-06-14 17:38:28 [DEBUG] StreamsImplementation:133 - streams started
2018-06-14 17:38:29 [DEBUG] StreamsImplementation:162 - streams stopped
2018-06-14 17:38:29 [DEBUG] StreamsImplementation:133 - streams started
2018-06-14 17:38:30 [DEBUG] StreamsImplementation:162 - streams stopped
2018-06-14 17:38:30 [DEBUG] StreamsImplementation:133 - streams started
2018-06-14 17:38:31 [DEBUG] StreamsImplementation:162 - streams stopped
2018-06-14 17:38:31 [DEBUG] StreamsImplementation:133 - streams started
2018-06-14 17:38:32 [DEBUG] StreamsImplementation:162 - streams stopped
2018-06-14 17:38:32 [DEBUG] StreamsImplementation:133 - streams started
2018-06-14 17:38:33 [DEBUG] StreamsImplementation:162 - streams stopped
2018-06-14 17:38:33 [DEBUG] StreamsImplementation:133 - streams started
2018-06-14 17:38:34 [DEBUG] StreamsImplementation:162 - streams stopped
2018-06-14 17:38:34 [DEBUG] StreamsImplementation:133 - streams started
2018-06-14 17:38:35 [DEBUG] StreamsImplementation:162 - streams stopped
[INFO] Tests run: 10, Failures: 0, Errors: 0, Skipped: 0, Time elapsed: 8.735 s - in com.booking.replication.streams.StreamsTest
2018-06-14 17:38:35,341 pool-1-thread-1 DEBUG Stopping LoggerContext[name=330bedb4, org.apache.logging.log4j.core.LoggerContext@12405818]
2018-06-14 17:38:35,343 pool-1-thread-1 DEBUG Stopping LoggerContext[name=330bedb4, org.apache.logging.log4j.core.LoggerContext@12405818]...
2018-06-14 17:38:35,348 pool-1-thread-1 DEBUG Shutting down OutputStreamManager SYSTEM_OUT.false.false
2018-06-14 17:38:35,349 pool-1-thread-1 DEBUG Shut down OutputStreamManager SYSTEM_OUT.false.false, all resources released: true
2018-06-14 17:38:35,349 pool-1-thread-1 DEBUG Appender Console stopped with status true
2018-06-14 17:38:35,350 pool-1-thread-1 DEBUG Stopped XmlConfiguration[location=/root/workspace/mysql-time-machine/replicator/392314555/mysql-replicator-streams/target/test-classes/log4j2.xml] OK
2018-06-14 17:38:35,351 pool-1-thread-1 DEBUG Stopped LoggerContext[name=330bedb4, org.apache.logging.log4j.core.LoggerContext@12405818] with status true
[INFO] 
[INFO] Results:
[INFO] 
[INFO] Tests run: 10, Failures: 0, Errors: 0, Skipped: 0
[INFO] 
[INFO] 
[INFO] --- jacoco-maven-plugin:0.8.0:report (report) @ mysql-replicator-streams ---
[INFO] Skipping JaCoCo execution due to missing execution data file.
[INFO]                                                                         
[INFO] ------------------------------------------------------------------------
[INFO] Building mysql-replicator-coordinator 0.16.0-alpha-1-SNAPSHOT
[INFO] ------------------------------------------------------------------------
[INFO] 
[INFO] --- maven-checkstyle-plugin:3.0.0:check (validate) @ mysql-replicator-coordinator ---
[INFO] 
[INFO] --- jacoco-maven-plugin:0.8.0:prepare-agent (default) @ mysql-replicator-coordinator ---
[INFO] tests.arguments set to -javaagent:/root/./workspace/mysql-time-machine/replicator/392314555/.m2/org/jacoco/org.jacoco.agent/0.8.0/org.jacoco.agent-0.8.0-runtime.jar=destfile=/root/workspace/mysql-time-machine/replicator/392314555/mysql-replicator-coordinator/target/jacoco.exec -Djava.util.logging.manager=org.apache.logging.log4j.jul.LogManager
[INFO] 
[INFO] --- maven-resources-plugin:2.6:resources (default-resources) @ mysql-replicator-coordinator ---
[INFO] Using 'UTF-8' encoding to copy filtered resources.
[INFO] skip non existing resourceDirectory /root/workspace/mysql-time-machine/replicator/392314555/mysql-replicator-coordinator/src/main/resources
[INFO] 
[INFO] --- maven-compiler-plugin:3.7.0:compile (default-compile) @ mysql-replicator-coordinator ---
[INFO] Nothing to compile - all classes are up to date
[INFO] 
[INFO] --- maven-resources-plugin:2.6:testResources (default-testResources) @ mysql-replicator-coordinator ---
[INFO] Using 'UTF-8' encoding to copy filtered resources.
[INFO] Copying 1 resource
[INFO] 
[INFO] --- maven-compiler-plugin:3.7.0:testCompile (default-testCompile) @ mysql-replicator-coordinator ---
[INFO] Nothing to compile - all classes are up to date
[INFO] 
[INFO] --- maven-surefire-plugin:2.20.1:test (default-test) @ mysql-replicator-coordinator ---
[INFO] 
[INFO] -------------------------------------------------------
[INFO]  T E S T S
[INFO] -------------------------------------------------------
[INFO] Running com.booking.replication.coordinator.ZookeeperCoordinatorTest
2018-06-14 17:38:46 [ERROR] EnvironmentAndSystemPropertyClientProviderStrategy:44 - ping failed with configuration Environment variables, system properties and defaults. Resolved: 
    dockerHost=unix:///var/run/docker.sock
    apiVersion='{UNKNOWN_VERSION}'
    registryUrl='https://index.docker.io/v1/'
    registryUsername='root'
    registryPassword='null'
    registryEmail='null'
    dockerConfig='DefaultDockerClientConfig[dockerHost=unix:///var/run/docker.sock,registryUsername=root,registryPassword=<null>,registryEmail=<null>,registryUrl=https://index.docker.io/v1/,dockerConfigPath=/root/.docker,sslConfig=<null>,apiVersion={UNKNOWN_VERSION},dockerConfig=<null>]'
 due to org.rnorth.ducttape.TimeoutException: Timeout waiting for result with exception
org.rnorth.ducttape.TimeoutException: Timeout waiting for result with exception
	at org.rnorth.ducttape.unreliables.Unreliables.retryUntilSuccess(Unreliables.java:51) ~[duct-tape-1.0.7.jar:?]
	at org.testcontainers.dockerclient.DockerClientProviderStrategy.ping(DockerClientProviderStrategy.java:175) ~[testcontainers-1.7.3.jar:?]
	at org.testcontainers.dockerclient.EnvironmentAndSystemPropertyClientProviderStrategy.test(EnvironmentAndSystemPropertyClientProviderStrategy.java:42) ~[testcontainers-1.7.3.jar:?]
	at org.testcontainers.dockerclient.DockerClientProviderStrategy.lambda$getFirstValidStrategy$2(DockerClientProviderStrategy.java:111) ~[testcontainers-1.7.3.jar:?]
	at java.util.stream.ReferencePipeline$7$1.accept(ReferencePipeline.java:267) [?:1.8.0_121]
	at java.util.stream.StreamSpliterators$WrappingSpliterator.tryAdvance(StreamSpliterators.java:302) [?:1.8.0_121]
	at java.util.stream.Streams$ConcatSpliterator.tryAdvance(Streams.java:731) [?:1.8.0_121]
	at java.util.stream.ReferencePipeline.forEachWithCancel(ReferencePipeline.java:126) [?:1.8.0_121]
	at java.util.stream.AbstractPipeline.copyIntoWithCancel(AbstractPipeline.java:498) [?:1.8.0_121]
	at java.util.stream.AbstractPipeline.copyInto(AbstractPipeline.java:485) [?:1.8.0_121]
	at java.util.stream.AbstractPipeline.wrapAndCopyInto(AbstractPipeline.java:471) [?:1.8.0_121]
	at java.util.stream.FindOps$FindOp.evaluateSequential(FindOps.java:152) [?:1.8.0_121]
	at java.util.stream.AbstractPipeline.evaluate(AbstractPipeline.java:234) [?:1.8.0_121]
	at java.util.stream.ReferencePipeline.findAny(ReferencePipeline.java:469) [?:1.8.0_121]
	at org.testcontainers.dockerclient.DockerClientProviderStrategy.getFirstValidStrategy(DockerClientProviderStrategy.java:146) [testcontainers-1.7.3.jar:?]
	at org.testcontainers.DockerClientFactory.client(DockerClientFactory.java:100) [testcontainers-1.7.3.jar:?]
	at org.testcontainers.containers.GenericContainer.<init>(GenericContainer.java:142) [testcontainers-1.7.3.jar:?]
	at com.booking.replication.commons.services.ContainersProvider.getContainer(ContainersProvider.java:48) [test-classes/:?]
	at com.booking.replication.commons.services.ContainersProvider.getZookeeper(ContainersProvider.java:68) [test-classes/:?]
	at com.booking.replication.commons.services.ContainersProvider.startZookeeper(ContainersProvider.java:113) [test-classes/:?]
	at com.booking.replication.coordinator.ZookeeperCoordinatorTest.before(ZookeeperCoordinatorTest.java:28) [test-classes/:?]
	at sun.reflect.NativeMethodAccessorImpl.invoke0(Native Method) ~[?:1.8.0_121]
	at sun.reflect.NativeMethodAccessorImpl.invoke(NativeMethodAccessorImpl.java:62) ~[?:1.8.0_121]
	at sun.reflect.DelegatingMethodAccessorImpl.invoke(DelegatingMethodAccessorImpl.java:43) ~[?:1.8.0_121]
	at java.lang.reflect.Method.invoke(Method.java:498) ~[?:1.8.0_121]
	at org.junit.runners.model.FrameworkMethod$1.runReflectiveCall(FrameworkMethod.java:50) [junit-4.12.jar:4.12]
	at org.junit.internal.runners.model.ReflectiveCallable.run(ReflectiveCallable.java:12) [junit-4.12.jar:4.12]
	at org.junit.runners.model.FrameworkMethod.invokeExplosively(FrameworkMethod.java:47) [junit-4.12.jar:4.12]
	at org.junit.internal.runners.statements.RunBefores.evaluate(RunBefores.java:24) [junit-4.12.jar:4.12]
	at org.junit.internal.runners.statements.RunAfters.evaluate(RunAfters.java:27) [junit-4.12.jar:4.12]
	at org.junit.runners.ParentRunner.run(ParentRunner.java:363) [junit-4.12.jar:4.12]
	at org.apache.maven.surefire.junit4.JUnit4Provider.execute(JUnit4Provider.java:369) [surefire-junit4-2.20.1.jar:2.20.1]
	at org.apache.maven.surefire.junit4.JUnit4Provider.executeWithRerun(JUnit4Provider.java:275) [surefire-junit4-2.20.1.jar:2.20.1]
	at org.apache.maven.surefire.junit4.JUnit4Provider.executeTestSet(JUnit4Provider.java:239) [surefire-junit4-2.20.1.jar:2.20.1]
	at org.apache.maven.surefire.junit4.JUnit4Provider.invoke(JUnit4Provider.java:160) [surefire-junit4-2.20.1.jar:2.20.1]
	at org.apache.maven.surefire.booter.ForkedBooter.invokeProviderInSameClassLoader(ForkedBooter.java:373) [surefire-booter-2.20.1.jar:2.20.1]
	at org.apache.maven.surefire.booter.ForkedBooter.runSuitesInProcess(ForkedBooter.java:334) [surefire-booter-2.20.1.jar:2.20.1]
	at org.apache.maven.surefire.booter.ForkedBooter.execute(ForkedBooter.java:119) [surefire-booter-2.20.1.jar:2.20.1]
	at org.apache.maven.surefire.booter.ForkedBooter.main(ForkedBooter.java:407) [surefire-booter-2.20.1.jar:2.20.1]
Caused by: org.testcontainers.shaded.io.netty.channel.AbstractChannel$AnnotatedConnectException: connect(..) failed: No such file or directory: /var/run/docker.sock
	at org.testcontainers.shaded.io.netty.channel.unix.Errors.throwConnectException(Errors.java:107) ~[testcontainers-1.7.3.jar:?]
	at org.testcontainers.shaded.io.netty.channel.unix.Socket.connect(Socket.java:243) ~[testcontainers-1.7.3.jar:?]
	at org.testcontainers.shaded.io.netty.channel.epoll.AbstractEpollStreamChannel.doConnect(AbstractEpollStreamChannel.java:734) ~[testcontainers-1.7.3.jar:?]
	at org.testcontainers.shaded.io.netty.channel.epoll.EpollDomainSocketChannel.doConnect(EpollDomainSocketChannel.java:87) ~[testcontainers-1.7.3.jar:?]
	at org.testcontainers.shaded.io.netty.channel.epoll.AbstractEpollStreamChannel$EpollStreamUnsafe.connect(AbstractEpollStreamChannel.java:797) ~[testcontainers-1.7.3.jar:?]
	at org.testcontainers.shaded.io.netty.channel.DefaultChannelPipeline$HeadContext.connect(DefaultChannelPipeline.java:1274) ~[testcontainers-1.7.3.jar:?]
	at org.testcontainers.shaded.io.netty.channel.AbstractChannelHandlerContext.invokeConnect(AbstractChannelHandlerContext.java:545) ~[testcontainers-1.7.3.jar:?]
	at org.testcontainers.shaded.io.netty.channel.AbstractChannelHandlerContext.connect(AbstractChannelHandlerContext.java:530) ~[testcontainers-1.7.3.jar:?]
	at org.testcontainers.shaded.io.netty.channel.CombinedChannelDuplexHandler$DelegatingChannelHandlerContext.connect(CombinedChannelDuplexHandler.java:497) ~[testcontainers-1.7.3.jar:?]
	at org.testcontainers.shaded.io.netty.channel.ChannelOutboundHandlerAdapter.connect(ChannelOutboundHandlerAdapter.java:47) ~[testcontainers-1.7.3.jar:?]
	at org.testcontainers.shaded.io.netty.channel.CombinedChannelDuplexHandler.connect(CombinedChannelDuplexHandler.java:298) ~[testcontainers-1.7.3.jar:?]
	at org.testcontainers.shaded.io.netty.channel.AbstractChannelHandlerContext.invokeConnect(AbstractChannelHandlerContext.java:545) ~[testcontainers-1.7.3.jar:?]
	at org.testcontainers.shaded.io.netty.channel.AbstractChannelHandlerContext.connect(AbstractChannelHandlerContext.java:530) ~[testcontainers-1.7.3.jar:?]
	at org.testcontainers.shaded.io.netty.channel.AbstractChannelHandlerContext.connect(AbstractChannelHandlerContext.java:512) ~[testcontainers-1.7.3.jar:?]
	at org.testcontainers.shaded.io.netty.channel.DefaultChannelPipeline.connect(DefaultChannelPipeline.java:993) ~[testcontainers-1.7.3.jar:?]
	at org.testcontainers.shaded.io.netty.channel.AbstractChannel.connect(AbstractChannel.java:255) ~[testcontainers-1.7.3.jar:?]
	at org.testcontainers.shaded.io.netty.bootstrap.Bootstrap$3.run(Bootstrap.java:252) ~[testcontainers-1.7.3.jar:?]
	at org.testcontainers.shaded.io.netty.util.concurrent.AbstractEventExecutor.safeExecute(AbstractEventExecutor.java:163) ~[testcontainers-1.7.3.jar:?]
	at org.testcontainers.shaded.io.netty.util.concurrent.SingleThreadEventExecutor.runAllTasks(SingleThreadEventExecutor.java:403) ~[testcontainers-1.7.3.jar:?]
	at org.testcontainers.shaded.io.netty.channel.epoll.EpollEventLoop.run(EpollEventLoop.java:312) ~[testcontainers-1.7.3.jar:?]
	at org.testcontainers.shaded.io.netty.util.concurrent.SingleThreadEventExecutor$5.run(SingleThreadEventExecutor.java:858) ~[testcontainers-1.7.3.jar:?]
	at org.testcontainers.shaded.io.netty.util.concurrent.DefaultThreadFactory$DefaultRunnableDecorator.run(DefaultThreadFactory.java:138) ~[testcontainers-1.7.3.jar:?]
	at java.lang.Thread.run(Thread.java:745) ~[?:1.8.0_121]
Caused by: java.net.ConnectException: connect(..) failed: No such file or directory
	at org.testcontainers.shaded.io.netty.channel.unix.Errors.throwConnectException(Errors.java:107) ~[testcontainers-1.7.3.jar:?]
	at org.testcontainers.shaded.io.netty.channel.unix.Socket.connect(Socket.java:243) ~[testcontainers-1.7.3.jar:?]
	at org.testcontainers.shaded.io.netty.channel.epoll.AbstractEpollStreamChannel.doConnect(AbstractEpollStreamChannel.java:734) ~[testcontainers-1.7.3.jar:?]
	at org.testcontainers.shaded.io.netty.channel.epoll.EpollDomainSocketChannel.doConnect(EpollDomainSocketChannel.java:87) ~[testcontainers-1.7.3.jar:?]
	at org.testcontainers.shaded.io.netty.channel.epoll.AbstractEpollStreamChannel$EpollStreamUnsafe.connect(AbstractEpollStreamChannel.java:797) ~[testcontainers-1.7.3.jar:?]
	at org.testcontainers.shaded.io.netty.channel.DefaultChannelPipeline$HeadContext.connect(DefaultChannelPipeline.java:1274) ~[testcontainers-1.7.3.jar:?]
	at org.testcontainers.shaded.io.netty.channel.AbstractChannelHandlerContext.invokeConnect(AbstractChannelHandlerContext.java:545) ~[testcontainers-1.7.3.jar:?]
	at org.testcontainers.shaded.io.netty.channel.AbstractChannelHandlerContext.connect(AbstractChannelHandlerContext.java:530) ~[testcontainers-1.7.3.jar:?]
	at org.testcontainers.shaded.io.netty.channel.CombinedChannelDuplexHandler$DelegatingChannelHandlerContext.connect(CombinedChannelDuplexHandler.java:497) ~[testcontainers-1.7.3.jar:?]
	at org.testcontainers.shaded.io.netty.channel.ChannelOutboundHandlerAdapter.connect(ChannelOutboundHandlerAdapter.java:47) ~[testcontainers-1.7.3.jar:?]
	at org.testcontainers.shaded.io.netty.channel.CombinedChannelDuplexHandler.connect(CombinedChannelDuplexHandler.java:298) ~[testcontainers-1.7.3.jar:?]
	at org.testcontainers.shaded.io.netty.channel.AbstractChannelHandlerContext.invokeConnect(AbstractChannelHandlerContext.java:545) ~[testcontainers-1.7.3.jar:?]
	at org.testcontainers.shaded.io.netty.channel.AbstractChannelHandlerContext.connect(AbstractChannelHandlerContext.java:530) ~[testcontainers-1.7.3.jar:?]
	at org.testcontainers.shaded.io.netty.channel.AbstractChannelHandlerContext.connect(AbstractChannelHandlerContext.java:512) ~[testcontainers-1.7.3.jar:?]
	at org.testcontainers.shaded.io.netty.channel.DefaultChannelPipeline.connect(DefaultChannelPipeline.java:993) ~[testcontainers-1.7.3.jar:?]
	at org.testcontainers.shaded.io.netty.channel.AbstractChannel.connect(AbstractChannel.java:255) ~[testcontainers-1.7.3.jar:?]
	at org.testcontainers.shaded.io.netty.bootstrap.Bootstrap$3.run(Bootstrap.java:252) ~[testcontainers-1.7.3.jar:?]
	at org.testcontainers.shaded.io.netty.util.concurrent.AbstractEventExecutor.safeExecute(AbstractEventExecutor.java:163) ~[testcontainers-1.7.3.jar:?]
	at org.testcontainers.shaded.io.netty.util.concurrent.SingleThreadEventExecutor.runAllTasks(SingleThreadEventExecutor.java:403) ~[testcontainers-1.7.3.jar:?]
	at org.testcontainers.shaded.io.netty.channel.epoll.EpollEventLoop.run(EpollEventLoop.java:312) ~[testcontainers-1.7.3.jar:?]
	at org.testcontainers.shaded.io.netty.util.concurrent.SingleThreadEventExecutor$5.run(SingleThreadEventExecutor.java:858) ~[testcontainers-1.7.3.jar:?]
	at org.testcontainers.shaded.io.netty.util.concurrent.DefaultThreadFactory$DefaultRunnableDecorator.run(DefaultThreadFactory.java:138) ~[testcontainers-1.7.3.jar:?]
	at java.lang.Thread.run(Thread.java:745) ~[?:1.8.0_121]
2018-06-14 17:38:46 [ERROR] DockerClientProviderStrategy:148 - Could not find a valid Docker environment. Please check configuration. Attempted configurations were:
2018-06-14 17:38:46 [ERROR] DockerClientProviderStrategy:150 -     EnvironmentAndSystemPropertyClientProviderStrategy: failed with exception InvalidConfigurationException (ping failed)
2018-06-14 17:38:46 [ERROR] DockerClientProviderStrategy:150 -     UnixSocketClientProviderStrategy: failed with exception InvalidConfigurationException (ping failed). Root cause NoSuchFileException (/var/run/docker.sock)
2018-06-14 17:38:46 [ERROR] DockerClientProviderStrategy:152 - As no valid configuration was found, execution cannot continue
[ERROR] Tests run: 2, Failures: 0, Errors: 2, Skipped: 0, Time elapsed: 10.91 s <<< FAILURE! - in com.booking.replication.coordinator.ZookeeperCoordinatorTest
[ERROR] com.booking.replication.coordinator.ZookeeperCoordinatorTest  Time elapsed: 10.909 s  <<< ERROR!
java.lang.IllegalStateException: Could not find a valid Docker environment. Please see logs and check configuration
	at com.booking.replication.coordinator.ZookeeperCoordinatorTest.before(ZookeeperCoordinatorTest.java:28)

[ERROR] com.booking.replication.coordinator.ZookeeperCoordinatorTest  Time elapsed: 10.91 s  <<< ERROR!
java.lang.NullPointerException
	at com.booking.replication.coordinator.ZookeeperCoordinatorTest.after(ZookeeperCoordinatorTest.java:84)

[INFO] Running com.booking.replication.coordinator.FileCoordinatorTest
2018-06-14 17:38:47 [INFO ] Coordinator:106 - starting coordinator
2018-06-14 17:38:47 [INFO ] Coordinator:106 - starting coordinator
2018-06-14 17:38:51 [INFO ] Coordinator:116 - stopping coordinator
2018-06-14 17:38:51 [INFO ] Coordinator:116 - stopping coordinator
2018-06-14 17:38:56 [WARN ] Coordinator:87 - cannot take for leadership
[INFO] Tests run: 2, Failures: 0, Errors: 0, Skipped: 0, Time elapsed: 11.303 s - in com.booking.replication.coordinator.FileCoordinatorTest
[INFO] 
[INFO] Results:
[INFO] 
[ERROR] Errors: 
[ERROR] com.booking.replication.coordinator.ZookeeperCoordinatorTest.com.booking.replication.coordinator.ZookeeperCoordinatorTest
[ERROR]   Run 1: ZookeeperCoordinatorTest.before:28 » IllegalState Could not find a valid Docke...
[ERROR]   Run 2: ZookeeperCoordinatorTest.after:84 NullPointer
[INFO] 
[INFO] 
[ERROR] Tests run: 3, Failures: 0, Errors: 1, Skipped: 0
[INFO] 
[INFO] ------------------------------------------------------------------------
[INFO] Reactor Summary:
[INFO] 
[INFO] replicator ......................................... SUCCESS [  0.960 s]
[INFO] mysql-replicator-commons ........................... SUCCESS [  0.462 s]
[INFO] mysql-replicator-streams ........................... SUCCESS [ 10.247 s]
[INFO] mysql-replicator-coordinator ....................... FAILURE [ 22.961 s]
[INFO] mysql-replicator-supplier-model .................... SKIPPED
[INFO] mysql-replicator-supplier .......................... SKIPPED
[INFO] mysql-replicator-augmenter-model ................... SKIPPED
[INFO] mysql-replicator-augmenter ......................... SKIPPED
[INFO] mysql-replicator-applier ........................... SKIPPED
[INFO] mysql-replicator ................................... SKIPPED
[INFO] ------------------------------------------------------------------------
[INFO] BUILD FAILURE
[INFO] ------------------------------------------------------------------------
[INFO] Total time: 34.812 s
[INFO] Finished at: 2018-06-14T17:38:58+02:00
[INFO] Final Memory: 29M/924M
[INFO] ------------------------------------------------------------------------
[ERROR] Failed to execute goal org.apache.maven.plugins:maven-surefire-plugin:2.20.1:test (default-test) on project mysql-replicator-coordinator: There are test failures.
[ERROR] 
[ERROR] Please refer to /root/workspace/mysql-time-machine/replicator/392314555/mysql-replicator-coordinator/target/surefire-reports for the individual test results.
[ERROR] Please refer to dump files (if any exist) [date]-jvmRun[N].dump, [date].dumpstream and [date]-jvmRun[N].dumpstream.
[ERROR] -> [Help 1]
[ERROR] 
[ERROR] To see the full stack trace of the errors, re-run Maven with the -e switch.
[ERROR] Re-run Maven using the -X switch to enable full debug logging.
[ERROR] 
[ERROR] For more information about the errors and possible solutions, please read the following articles:
[ERROR] [Help 1] http://cwiki.apache.org/confluence/display/MAVEN/MojoFailureException
[ERROR] 
[ERROR] After correcting the problems, you can resume the build with the command
[ERROR]   mvn <goals> -rf :mysql-replicator-coordinator
