[INFO] Scanning for projects...
[INFO]                                                                         
[INFO] ------------------------------------------------------------------------
[INFO] Building Java Statistical Analysis Tool 0.1.0-SNAPSHOT
[INFO] ------------------------------------------------------------------------
[INFO] 
[INFO] --- maven-resources-plugin:2.6:resources (default-resources) @ JSAT ---
[INFO] Using 'UTF-8' encoding to copy filtered resources.
[INFO] skip non existing resourceDirectory /root/workspace/EdwardRaff/JSAT/328568857/JSAT/src/main/resources
[INFO] 
[INFO] --- maven-compiler-plugin:3.1:compile (default-compile) @ JSAT ---
[INFO] Nothing to compile - all classes are up to date
[INFO] 
[INFO] --- maven-resources-plugin:2.6:testResources (default-testResources) @ JSAT ---
[INFO] Using 'UTF-8' encoding to copy filtered resources.
[INFO] skip non existing resourceDirectory /root/workspace/EdwardRaff/JSAT/328568857/JSAT/src/test/resources
[INFO] 
[INFO] --- maven-compiler-plugin:3.1:testCompile (default-testCompile) @ JSAT ---
[INFO] Nothing to compile - all classes are up to date
[INFO] 
[INFO] --- maven-surefire-plugin:2.18.1:test (default-test) @ JSAT ---
[INFO] Surefire report directory: /root/workspace/EdwardRaff/JSAT/328568857/JSAT/target/surefire-reports
[INFO] Downloading: https://repo.maven.apache.org/maven2/org/apache/maven/surefire/surefire-junit4/2.18.1/surefire-junit4-2.18.1.pom
[INFO] Downloaded: https://repo.maven.apache.org/maven2/org/apache/maven/surefire/surefire-junit4/2.18.1/surefire-junit4-2.18.1.pom (3 KB at 3.9 KB/sec)
[INFO] Downloading: https://repo.maven.apache.org/maven2/org/apache/maven/surefire/surefire-providers/2.18.1/surefire-providers-2.18.1.pom
[INFO] Downloaded: https://repo.maven.apache.org/maven2/org/apache/maven/surefire/surefire-providers/2.18.1/surefire-providers-2.18.1.pom (3 KB at 75.3 KB/sec)
[INFO] Downloading: https://repo.maven.apache.org/maven2/org/apache/maven/surefire/surefire-junit4/2.18.1/surefire-junit4-2.18.1.jar
[INFO] Downloaded: https://repo.maven.apache.org/maven2/org/apache/maven/surefire/surefire-junit4/2.18.1/surefire-junit4-2.18.1.jar (67 KB at 1276.8 KB/sec)

-------------------------------------------------------
 T E S T S
-------------------------------------------------------
Running jsat.parameters.RandomSearchTest
testClassification
testClassificationAutoAdd
testClassificationEx
testRegression
testRegressionEx
Tests run: 5, Failures: 0, Errors: 0, Skipped: 0, Time elapsed: 2.512 sec - in jsat.parameters.RandomSearchTest
Running jsat.parameters.GridSearchTest
setUseWarmStarts
setUseWarmStarts
classificationAutoAdd
setUseWarmStarts
setUseWarmStarts
setUseWarmStarts
setUseWarmStarts
setUseWarmStarts
setUseWarmStarts
Tests run: 9, Failures: 0, Errors: 0, Skipped: 0, Time elapsed: 0.31 sec - in jsat.parameters.GridSearchTest
Running jsat.regression.NadarayaWatsonTest
train
train
clone
Tests run: 3, Failures: 0, Errors: 0, Skipped: 0, Time elapsed: 1.039 sec - in jsat.regression.NadarayaWatsonTest
Running jsat.regression.OrdinaryKrigingTest
train
train
clone
Tests run: 3, Failures: 0, Errors: 0, Skipped: 0, Time elapsed: 0.858 sec - in jsat.regression.OrdinaryKrigingTest
Running jsat.regression.KernelRLSTest
train
train
clone
Tests run: 3, Failures: 0, Errors: 0, Skipped: 0, Time elapsed: 0.071 sec - in jsat.regression.KernelRLSTest
Running jsat.regression.RANSACTest
train
train
clone
Tests run: 3, Failures: 0, Errors: 0, Skipped: 0, Time elapsed: 0.182 sec - in jsat.regression.RANSACTest
Running jsat.regression.KernelRidgeRegressionTest
train
train
clone
Tests run: 3, Failures: 0, Errors: 0, Skipped: 0, Time elapsed: 0.254 sec - in jsat.regression.KernelRidgeRegressionTest
Running jsat.regression.RidgeRegressionTest
train
train
Tests run: 2, Failures: 0, Errors: 0, Skipped: 0, Time elapsed: 0.114 sec - in jsat.regression.RidgeRegressionTest
Running jsat.regression.AveragedRegressorTest
train
train
clone
Tests run: 3, Failures: 0, Errors: 0, Skipped: 0, Time elapsed: 0.038 sec - in jsat.regression.AveragedRegressorTest
Running jsat.regression.LogisticRegressionTest
clone
trainC
trainC
Tests run: 3, Failures: 0, Errors: 0, Skipped: 0, Time elapsed: 0.545 sec - in jsat.regression.LogisticRegressionTest
Running jsat.regression.StochasticRidgeRegressionTest
train
train
clone
Tests run: 3, Failures: 0, Errors: 0, Skipped: 0, Time elapsed: 3.051 sec - in jsat.regression.StochasticRidgeRegressionTest
Running jsat.regression.StochasticGradientBoostingTest
train
train
clone
Tests run: 3, Failures: 0, Errors: 0, Skipped: 0, Time elapsed: 1.062 sec - in jsat.regression.StochasticGradientBoostingTest
Running jsat.regression.evaluation.MeanSquaredErrorTest
getScore
Tests run: 1, Failures: 0, Errors: 0, Skipped: 0, Time elapsed: 0.001 sec - in jsat.regression.evaluation.MeanSquaredErrorTest
Running jsat.regression.evaluation.MeanAbsoluteErrorTest
getScore
Tests run: 1, Failures: 0, Errors: 0, Skipped: 0, Time elapsed: 0.003 sec - in jsat.regression.evaluation.MeanAbsoluteErrorTest
Running jsat.regression.evaluation.RelativeSquaredErrorTest
getScore
Tests run: 1, Failures: 0, Errors: 0, Skipped: 0, Time elapsed: 0.002 sec - in jsat.regression.evaluation.RelativeSquaredErrorTest
Running jsat.regression.evaluation.RelativeAbsoluteErrorTest
getScore
Tests run: 1, Failures: 0, Errors: 0, Skipped: 0, Time elapsed: 0.003 sec - in jsat.regression.evaluation.RelativeAbsoluteErrorTest
Running jsat.regression.evaluation.CoefficientOfDeterminationTest
getScore
Tests run: 1, Failures: 0, Errors: 0, Skipped: 0, Time elapsed: 0.009 sec - in jsat.regression.evaluation.CoefficientOfDeterminationTest
Running jsat.linear.LUPDecompositionTest
isSquare
solve
det
solve
solve
forwardSub
forwardSub
forwardSub
backSub
backSub
backSub
Tests run: 11, Failures: 0, Errors: 0, Skipped: 0, Time elapsed: 0.025 sec - in jsat.linear.LUPDecompositionTest
Running jsat.linear.SingularValueDecompositionTest
solve
solve
solve
getRank
getRank
getInverseSingularValues
getInverseSingularValues
getPseudoInverse
getPseudoDet
getSingularValues
getNorm2
getCondition
Tests run: 12, Failures: 0, Errors: 0, Skipped: 0, Time elapsed: 0.046 sec - in jsat.linear.SingularValueDecompositionTest
Running jsat.linear.QRDecompositionTest
solve
solve
solve
absDet
Tests run: 4, Failures: 0, Errors: 0, Skipped: 0, Time elapsed: 0.012 sec - in jsat.linear.QRDecompositionTest
Running jsat.linear.GenericMatrixTest
swapRows
zeroOut
lup
lup
mutableTranspose
qr
qr
Tests run: 37, Failures: 0, Errors: 0, Skipped: 0, Time elapsed: 0.086 sec - in jsat.linear.GenericMatrixTest
Running jsat.linear.SparseVectorTest
set
clone
get
nnz
zeroOut
variance
median
skewness
kurtosis
dot
multiply
mutableAdd
mutableMultiply
mutableDivide
pNormDist
pNorm
normalize
mutablePairwiseMultiply
mutablePairwiseDivide
equals
equals
arrayCopy
applyFunction
applyIndexFunction
getNonZeroIterator
hashCode
isSparse
length
setLength
increment
sortedCopy
min
max
sum
mutableAdd
Tests run: 35, Failures: 0, Errors: 0, Skipped: 0, Time elapsed: 0.015 sec - in jsat.linear.SparseVectorTest
Running jsat.linear.DenseMatrixTest
swapRows
zeroOut
lup
lup
mutableTranspose
qr
qr
Tests run: 36, Failures: 0, Errors: 0, Skipped: 0, Time elapsed: 0.023 sec - in jsat.linear.DenseMatrixTest
Running jsat.linear.CholeskyDecompositionTest
Tests run: 5, Failures: 0, Errors: 0, Skipped: 0, Time elapsed: 0.001 sec - in jsat.linear.CholeskyDecompositionTest
Running jsat.linear.SparseMatrixTest
set
clone
multiplyTranspose_Executor
0 fin
1 fin
2 fin
3 fin
4 fin
5 fin
6 fin
7 fin
mutableAdd
mutableAdd
multiply
multiply
multiplyTranspose
transposeMultiply
transposeMultiply
getRowView
changeSize
multiply
mutableMultiply
mutableMultiply
transpose
get
rows
cols
isSparce
mutableAdd
swapRows
zeroOut
mutableTranspose
transposeMultiply
increment
mutableAdd
mutableAdd
Tests run: 28, Failures: 0, Errors: 0, Skipped: 0, Time elapsed: 0.048 sec - in jsat.linear.SparseMatrixTest
Running jsat.linear.Poly2VecTest
set
clone
get
nnz
getNonZeroIterator
isSparse
length
Tests run: 7, Failures: 0, Errors: 0, Skipped: 0, Time elapsed: 0.012 sec - in jsat.linear.Poly2VecTest
Running jsat.linear.EigenvalueDecompositionTest
testImageEigen5
testRealEigen3
testPascal5
testSymmetric70
testRealRandomGenerated
testRealRandomGeneratedLarge
testNonSquare
Tests run: 7, Failures: 0, Errors: 0, Skipped: 0, Time elapsed: 0.25 sec - in jsat.linear.EigenvalueDecompositionTest
Running jsat.linear.ConcatenatedVecTest
set
clone
get
getNonZeroIterator
isSparse
length
mutableAdd
Tests run: 7, Failures: 0, Errors: 0, Skipped: 0, Time elapsed: 0.009 sec - in jsat.linear.ConcatenatedVecTest
Running jsat.linear.distancemetrics.WeightedEuclideanDistanceTest
dist
isSymmetric
metricBound
Tests run: 3, Failures: 0, Errors: 0, Skipped: 0, Time elapsed: 0.011 sec - in jsat.linear.distancemetrics.WeightedEuclideanDistanceTest
Running jsat.linear.distancemetrics.ChebyshevDistanceTest
dist
isSymmetric
metricBound
Tests run: 3, Failures: 0, Errors: 0, Skipped: 0, Time elapsed: 0.001 sec - in jsat.linear.distancemetrics.ChebyshevDistanceTest
Running jsat.linear.distancemetrics.ManhattanDistanceTest
dist
isSymmetric
metricBound
Tests run: 3, Failures: 0, Errors: 0, Skipped: 0, Time elapsed: 0.008 sec - in jsat.linear.distancemetrics.ManhattanDistanceTest
Running jsat.linear.distancemetrics.EuclideanDistanceTest
dist
isSymmetric
metricBound
Tests run: 3, Failures: 0, Errors: 0, Skipped: 0, Time elapsed: 0.002 sec - in jsat.linear.distancemetrics.EuclideanDistanceTest
Running jsat.linear.distancemetrics.NormalizedEuclideanDistanceTest
dist
isSymmetric
metricBound
dist
Tests run: 4, Failures: 0, Errors: 0, Skipped: 0, Time elapsed: 0.129 sec - in jsat.linear.distancemetrics.NormalizedEuclideanDistanceTest
Running jsat.linear.distancemetrics.MahalanobisDistanceTest
dist
isSymmetric
metricBound
dist
Tests run: 4, Failures: 0, Errors: 0, Skipped: 0, Time elapsed: 0.026 sec - in jsat.linear.distancemetrics.MahalanobisDistanceTest
Running jsat.linear.distancemetrics.MinkowskiDistanceTest
dist
isSymmetric
metricBound
Tests run: 3, Failures: 0, Errors: 0, Skipped: 0, Time elapsed: 0.015 sec - in jsat.linear.distancemetrics.MinkowskiDistanceTest
Running jsat.linear.distancemetrics.CosineDistanceTest
dist
isSymmetric
metricBound
Tests run: 3, Failures: 0, Errors: 0, Skipped: 0, Time elapsed: 0.007 sec - in jsat.linear.distancemetrics.CosineDistanceTest
Running jsat.linear.distancemetrics.PearsonDistanceTest
correlation
correlation
Tests run: 2, Failures: 0, Errors: 0, Skipped: 0, Time elapsed: 0.001 sec - in jsat.linear.distancemetrics.PearsonDistanceTest
Running jsat.linear.distancemetrics.JaccardDistanceTest
dist
metricBound
isSymmetric
isSubadditive
isIndiscemible
supportsAcceleration
getAccelerationCache
getAccelerationCache
getQueryInfo
normalized
Tests run: 10, Failures: 0, Errors: 0, Skipped: 0, Time elapsed: 0.003 sec - in jsat.linear.distancemetrics.JaccardDistanceTest
Running jsat.linear.distancemetrics.SquaredEuclideanDistanceTest
dist
isSymmetric
metricBound
Tests run: 3, Failures: 0, Errors: 0, Skipped: 0, Time elapsed: 0.009 sec - in jsat.linear.distancemetrics.SquaredEuclideanDistanceTest
Running jsat.linear.MatrixOfVecsTest
swapRows
zeroOut
lup
lup
mutableTranspose
qr
qr
Tests run: 36, Failures: 0, Errors: 0, Skipped: 0, Time elapsed: 0.038 sec - in jsat.linear.MatrixOfVecsTest
Running jsat.linear.ShiftedVecTest
set
clone
get
zeroOut
variance
median
kurtosis
dot
mutableAdd
mutableMultiply
mutableDivide
pNorm
mutablePairwiseMultiply
mutablePairwiseDivide
getNonZeroIterator
isSparse
length
increment
min
max
mutableAdd
setShift
embedShift
mutableAdd
mean
standardDeviation
Tests run: 26, Failures: 0, Errors: 0, Skipped: 0, Time elapsed: 0.009 sec - in jsat.linear.ShiftedVecTest
Running jsat.linear.SubVectorTest
set
clone
get
getNonZeroIterator
isSparse
length
Tests run: 6, Failures: 0, Errors: 0, Skipped: 0, Time elapsed: 0.001 sec - in jsat.linear.SubVectorTest
Running jsat.linear.MatrixTest
OuterProductUpdate
OuterProductUpdate
eye
random
diag
pascal
diagMult
diagMult
isSymmetric
isSymmetric
Tests run: 10, Failures: 0, Errors: 0, Skipped: 0, Time elapsed: 0.007 sec - in jsat.linear.MatrixTest
Running jsat.linear.VecWithNormTest
set
clone
get
nnz
zeroOut
mutableAdd
mutableMultiply
mutableDivide
mutablePairwiseMultiply
length
mutableAdd
Tests run: 11, Failures: 0, Errors: 0, Skipped: 0, Time elapsed: 0.003 sec - in jsat.linear.VecWithNormTest
Running jsat.linear.solvers.ConjugateGradientTest
solveCGNR
solveCGNR
solve
solve
solve
Tests run: 5, Failures: 0, Errors: 0, Skipped: 0, Time elapsed: 0.002 sec - in jsat.linear.solvers.ConjugateGradientTest
Running jsat.linear.vectorcollection.lsh.RandomProjectionLSHTest
search
search
Tests run: 2, Failures: 0, Errors: 0, Skipped: 0, Time elapsed: 0.129 sec - in jsat.linear.vectorcollection.lsh.RandomProjectionLSHTest
Running jsat.linear.vectorcollection.lsh.E2LSHTest
searchR
Tests run: 1, Failures: 0, Errors: 0, Skipped: 0, Time elapsed: 0.007 sec - in jsat.linear.vectorcollection.lsh.E2LSHTest
Running jsat.linear.vectorcollection.VPTreeTest
search
search
search
Tests run: 3, Failures: 0, Errors: 0, Skipped: 0, Time elapsed: 0.706 sec - in jsat.linear.vectorcollection.VPTreeTest
Running jsat.linear.vectorcollection.CoverTreeTest
search
search
search_inc
Tests run: 3, Failures: 0, Errors: 0, Skipped: 0, Time elapsed: 0.245 sec - in jsat.linear.vectorcollection.CoverTreeTest
Running jsat.linear.vectorcollection.RTreeTest
search
Tests run: 1, Failures: 0, Errors: 0, Skipped: 0, Time elapsed: 0.091 sec - in jsat.linear.vectorcollection.RTreeTest
Running jsat.linear.vectorcollection.BallTreeTest
search
search
search
Tests run: 3, Failures: 0, Errors: 0, Skipped: 0, Time elapsed: 3.717 sec - in jsat.linear.vectorcollection.BallTreeTest
Running jsat.linear.vectorcollection.VPTreeMVTest
search
search
search
Tests run: 3, Failures: 0, Errors: 0, Skipped: 0, Time elapsed: 0.416 sec - in jsat.linear.vectorcollection.VPTreeMVTest
Running jsat.linear.vectorcollection.KDTreeTest
search
search
search
Tests run: 3, Failures: 0, Errors: 1, Skipped: 0, Time elapsed: 0.27 sec <<< FAILURE! - in jsat.linear.vectorcollection.KDTreeTest
testSearch_Vec_double(jsat.linear.vectorcollection.KDTreeTest)  Time elapsed: 0.073 sec  <<< ERROR!
java.lang.NullPointerException: null
	at jsat.linear.vectorcollection.KDTree$KDNode.<init>(KDTree.java:244)
	at jsat.linear.vectorcollection.KDTree$KDNode.clone(KDTree.java:282)
	at jsat.linear.vectorcollection.KDTree$KDNode.<init>(KDTree.java:244)
	at jsat.linear.vectorcollection.KDTree$KDNode.clone(KDTree.java:282)
	at jsat.linear.vectorcollection.KDTree$KDNode.<init>(KDTree.java:242)
	at jsat.linear.vectorcollection.KDTree$KDNode.clone(KDTree.java:282)
	at jsat.linear.vectorcollection.KDTree$KDNode.<init>(KDTree.java:242)
	at jsat.linear.vectorcollection.KDTree$KDNode.clone(KDTree.java:282)
	at jsat.linear.vectorcollection.KDTree$KDNode.<init>(KDTree.java:242)
	at jsat.linear.vectorcollection.KDTree$KDNode.clone(KDTree.java:282)
	at jsat.linear.vectorcollection.KDTree$KDNode.<init>(KDTree.java:244)
	at jsat.linear.vectorcollection.KDTree$KDNode.clone(KDTree.java:282)
	at jsat.linear.vectorcollection.KDTree.clone(KDTree.java:656)
	at jsat.linear.vectorcollection.KDTree.clone(KDTree.java:41)
	at jsat.linear.vectorcollection.KDTreeTest.testSearch_Vec_double(KDTreeTest.java:97)

Running jsat.linear.vectorcollection.VectorArrayTest
search
search
Tests run: 2, Failures: 0, Errors: 0, Skipped: 0, Time elapsed: 0.031 sec - in jsat.linear.vectorcollection.VectorArrayTest
Running jsat.linear.vectorcollection.RandomBallCoverTest
search
search
search
Tests run: 3, Failures: 0, Errors: 0, Skipped: 0, Time elapsed: 0.341 sec - in jsat.linear.vectorcollection.RandomBallCoverTest
Running jsat.linear.HessenbergFormTest
hess
hess
Tests run: 2, Failures: 0, Errors: 0, Skipped: 0, Time elapsed: 0.015 sec - in jsat.linear.HessenbergFormTest
Running jsat.driftdetectors.ADWINTest
addSample
Tests run: 1, Failures: 0, Errors: 0, Skipped: 0, Time elapsed: 0.031 sec - in jsat.driftdetectors.ADWINTest
Running jsat.driftdetectors.DDMTest
addSample
Tests run: 1, Failures: 0, Errors: 0, Skipped: 0, Time elapsed: 0.001 sec - in jsat.driftdetectors.DDMTest
Running jsat.classifiers.RocchioTest
clone
trainC
trainC
Tests run: 3, Failures: 0, Errors: 0, Skipped: 0, Time elapsed: 0.299 sec - in jsat.classifiers.RocchioTest
Running jsat.classifiers.bayesian.MultivariateNormalsTest
clone
trainC
trainC
Tests run: 3, Failures: 0, Errors: 0, Skipped: 0, Time elapsed: 0.107 sec - in jsat.classifiers.bayesian.MultivariateNormalsTest
Running jsat.classifiers.bayesian.MultinomialNaiveBayesTest
clone
trainC
trainC
Tests run: 3, Failures: 0, Errors: 0, Skipped: 0, Time elapsed: 0.282 sec - in jsat.classifiers.bayesian.MultinomialNaiveBayesTest
Running jsat.classifiers.bayesian.NaiveBayesTest
clone
trainC
trainC
Tests run: 3, Failures: 0, Errors: 0, Skipped: 0, Time elapsed: 0.012 sec - in jsat.classifiers.bayesian.NaiveBayesTest
Running jsat.classifiers.bayesian.NaiveBayesUpdateableTest
clone
trainC
trainC
testSetUpUpdate
Tests run: 4, Failures: 0, Errors: 0, Skipped: 0, Time elapsed: 0.006 sec - in jsat.classifiers.bayesian.NaiveBayesUpdateableTest
Running jsat.classifiers.bayesian.AODETest
clone
trainC
trainC
getSubEpochs
Tests run: 4, Failures: 0, Errors: 0, Skipped: 0, Time elapsed: 4.113 sec - in jsat.classifiers.bayesian.AODETest
Running jsat.classifiers.OneVSOneTest
clone
trainC
trainC
Tests run: 3, Failures: 0, Errors: 0, Skipped: 0, Time elapsed: 1.195 sec - in jsat.classifiers.OneVSOneTest
Running jsat.classifiers.linear.LinearSGDTest
regression
binary classifiation
multi class classification
Tests run: 3, Failures: 0, Errors: 0, Skipped: 0, Time elapsed: 0.229 sec - in jsat.classifiers.linear.LinearSGDTest
Running jsat.classifiers.linear.LinearL1SCDTest
train
trainC
Tests run: 2, Failures: 0, Errors: 0, Skipped: 0, Time elapsed: 0.282 sec - in jsat.classifiers.linear.LinearL1SCDTest
Running jsat.classifiers.linear.PassiveAggressiveTest
train
trainC
Tests run: 2, Failures: 0, Errors: 0, Skipped: 0, Time elapsed: 0.034 sec - in jsat.classifiers.linear.PassiveAggressiveTest
Running jsat.classifiers.linear.BBRTest
trainC
trainC
Tests run: 3, Failures: 0, Errors: 0, Skipped: 0, Time elapsed: 0.217 sec - in jsat.classifiers.linear.BBRTest
Running jsat.classifiers.linear.StochasticMultinomialLogisticRegressionTest
clone
trainC
Tests run: 2, Failures: 0, Errors: 0, Skipped: 0, Time elapsed: 0.089 sec - in jsat.classifiers.linear.StochasticMultinomialLogisticRegressionTest
Running jsat.classifiers.linear.SCWTest
TrainC_Full
TrainC_Diag
Tests run: 2, Failures: 0, Errors: 0, Skipped: 0, Time elapsed: 0.013 sec - in jsat.classifiers.linear.SCWTest
Running jsat.classifiers.linear.AROWTest
train_C
Tests run: 1, Failures: 0, Errors: 0, Skipped: 0, Time elapsed: 0.003 sec - in jsat.classifiers.linear.AROWTest
Running jsat.classifiers.linear.STGDTest
train
trainC
Tests run: 2, Failures: 0, Errors: 0, Skipped: 0, Time elapsed: 0.008 sec - in jsat.classifiers.linear.STGDTest
Running jsat.classifiers.linear.SCDTest
train
trainC
Tests run: 2, Failures: 0, Errors: 0, Skipped: 0, Time elapsed: 0.083 sec - in jsat.classifiers.linear.SCDTest
Running jsat.classifiers.linear.ROMMATest
supportsWeightedData
Tests run: 1, Failures: 0, Errors: 0, Skipped: 0, Time elapsed: 0.005 sec - in jsat.classifiers.linear.ROMMATest
Running jsat.classifiers.linear.LinearBatchTest
regression
binary classifiation
multi class classification
binary classifiation MT
testTrainWarmCMultieFast
multi class classification MT
regression MT
Tests run: 9, Failures: 0, Errors: 0, Skipped: 0, Time elapsed: 1.953 sec - in jsat.classifiers.linear.LinearBatchTest
Running jsat.classifiers.linear.kernelized.DUOLTest
clone
trainC
trainC
Tests run: 3, Failures: 0, Errors: 0, Skipped: 0, Time elapsed: 0.082 sec - in jsat.classifiers.linear.kernelized.DUOLTest
Running jsat.classifiers.linear.kernelized.KernelPointTest
getSqrdNorm
dot_KernelPoint
dot_Vec
distance_Vec
distance_KernelPoint
Tests run: 5, Failures: 0, Errors: 0, Skipped: 0, Time elapsed: 0.051 sec - in jsat.classifiers.linear.kernelized.KernelPointTest
Running jsat.classifiers.linear.kernelized.ForgetronTest
clone
trainC
trainC
Tests run: 3, Failures: 0, Errors: 0, Skipped: 0, Time elapsed: 1.31 sec - in jsat.classifiers.linear.kernelized.ForgetronTest
Running jsat.classifiers.linear.kernelized.CSKLRTest
clone
trainC
trainC
Tests run: 3, Failures: 0, Errors: 0, Skipped: 0, Time elapsed: 0.158 sec - in jsat.classifiers.linear.kernelized.CSKLRTest
Running jsat.classifiers.linear.kernelized.KernelSGDTest
clone
train
trainC
trainC
trainC
trainC
train
Tests run: 7, Failures: 0, Errors: 0, Skipped: 0, Time elapsed: 0.404 sec - in jsat.classifiers.linear.kernelized.KernelSGDTest
Running jsat.classifiers.linear.kernelized.CSKLRBatchTest
clone
trainC
trainC
Serializable
Tests run: 4, Failures: 0, Errors: 0, Skipped: 0, Time elapsed: 3.617 sec - in jsat.classifiers.linear.kernelized.CSKLRBatchTest
Running jsat.classifiers.linear.kernelized.ALMA2KTest
clone
trainC
trainC
Tests run: 3, Failures: 0, Errors: 0, Skipped: 0, Time elapsed: 0.074 sec - in jsat.classifiers.linear.kernelized.ALMA2KTest
Running jsat.classifiers.linear.kernelized.BOGDTest
clone
trainC
trainC
Tests run: 3, Failures: 0, Errors: 0, Skipped: 0, Time elapsed: 0.035 sec - in jsat.classifiers.linear.kernelized.BOGDTest
Running jsat.classifiers.linear.kernelized.OSKLTest
clone
trainC
trainC
Tests run: 3, Failures: 0, Errors: 0, Skipped: 0, Time elapsed: 0.091 sec - in jsat.classifiers.linear.kernelized.OSKLTest
Running jsat.classifiers.linear.kernelized.ProjectronTest
clone
trainC
trainC
Tests run: 3, Failures: 0, Errors: 0, Skipped: 0, Time elapsed: 0.034 sec - in jsat.classifiers.linear.kernelized.ProjectronTest
Running jsat.classifiers.linear.ALMA2Test
classify
Tests run: 1, Failures: 0, Errors: 0, Skipped: 0, Time elapsed: 0.006 sec - in jsat.classifiers.linear.ALMA2Test
Running jsat.classifiers.linear.SMIDASTest
train
trainC
Tests run: 2, Failures: 0, Errors: 0, Skipped: 0, Time elapsed: 0.025 sec - in jsat.classifiers.linear.SMIDASTest
Running jsat.classifiers.linear.LogisticRegressionDCDTest
trainC
trainC
Tests run: 2, Failures: 0, Errors: 0, Skipped: 0, Time elapsed: 0.016 sec - in jsat.classifiers.linear.LogisticRegressionDCDTest
Running jsat.classifiers.linear.NHERDTest
train_C
Tests run: 1, Failures: 0, Errors: 0, Skipped: 0, Time elapsed: 0.008 sec - in jsat.classifiers.linear.NHERDTest
Running jsat.classifiers.linear.SDCATest
trainR
trainC
trainC
testScale
train
testWarm
Tests run: 6, Failures: 0, Errors: 0, Skipped: 0, Time elapsed: 9.725 sec - in jsat.classifiers.linear.SDCATest
Running jsat.classifiers.linear.NewGLMNETTest
train
Tests run: 2, Failures: 0, Errors: 0, Skipped: 0, Time elapsed: 0.319 sec - in jsat.classifiers.linear.NewGLMNETTest
Running jsat.classifiers.knn.LWLTest
train
train
clone
trainC
trainC
Tests run: 5, Failures: 0, Errors: 0, Skipped: 0, Time elapsed: 0.506 sec - in jsat.classifiers.knn.LWLTest
Running jsat.classifiers.knn.DANNTest
clone
trainC
trainC
Tests run: 3, Failures: 0, Errors: 0, Skipped: 0, Time elapsed: 0.019 sec - in jsat.classifiers.knn.DANNTest
Running jsat.classifiers.knn.NearestNeighbourTest
train
train
clone
trainC
trainC
Tests run: 5, Failures: 0, Errors: 0, Skipped: 0, Time elapsed: 0.097 sec - in jsat.classifiers.knn.NearestNeighbourTest
Running jsat.classifiers.neuralnetwork.BackPropagationNetTest
trainC
trainC
Tests run: 2, Failures: 0, Errors: 0, Skipped: 0, Time elapsed: 5.663 sec - in jsat.classifiers.neuralnetwork.BackPropagationNetTest
Running jsat.classifiers.neuralnetwork.PerceptronTest
trainC
trainC
trainCOnline
Tests run: 3, Failures: 0, Errors: 0, Skipped: 0, Time elapsed: 0.011 sec - in jsat.classifiers.neuralnetwork.PerceptronTest
Running jsat.classifiers.neuralnetwork.LVQTest
clone
trainC
trainC
Tests run: 3, Failures: 0, Errors: 0, Skipped: 0, Time elapsed: 0.649 sec - in jsat.classifiers.neuralnetwork.LVQTest
Running jsat.classifiers.neuralnetwork.LVQLLCTest
clone
trainC
trainC
Tests run: 3, Failures: 0, Errors: 0, Skipped: 0, Time elapsed: 0.723 sec - in jsat.classifiers.neuralnetwork.LVQLLCTest
Running jsat.classifiers.neuralnetwork.SOMTest
clone
trainC
trainC
Tests run: 3, Failures: 0, Errors: 0, Skipped: 0, Time elapsed: 10.266 sec - in jsat.classifiers.neuralnetwork.SOMTest
Running jsat.classifiers.neuralnetwork.RBFNetTest
train
trainC
trainC
train
Tests run: 4, Failures: 0, Errors: 0, Skipped: 0, Time elapsed: 1.573 sec - in jsat.classifiers.neuralnetwork.RBFNetTest
Running jsat.classifiers.neuralnetwork.DReDNetSimpleTest
trainC
trainC
Tests run: 2, Failures: 0, Errors: 0, Skipped: 0, Time elapsed: 3.682 sec - in jsat.classifiers.neuralnetwork.DReDNetSimpleTest
Running jsat.classifiers.DDAGTest
clone
trainC
trainC
Tests run: 3, Failures: 0, Errors: 0, Skipped: 0, Time elapsed: 1.001 sec - in jsat.classifiers.DDAGTest
Running jsat.classifiers.calibration.PlattCalibrationTest
clone
calibrate
Tests run: 2, Failures: 0, Errors: 0, Skipped: 0, Time elapsed: 0.229 sec - in jsat.classifiers.calibration.PlattCalibrationTest
Running jsat.classifiers.calibration.IsotonicCalibrationTest
clone
calibrate
Tests run: 2, Failures: 0, Errors: 0, Skipped: 0, Time elapsed: 0.217 sec - in jsat.classifiers.calibration.IsotonicCalibrationTest
Running jsat.classifiers.svm.DCDTest
train
trainC
trainC
train
Tests run: 4, Failures: 0, Errors: 0, Skipped: 0, Time elapsed: 1.204 sec - in jsat.classifiers.svm.DCDTest
Running jsat.classifiers.svm.PegasosKTest
trainC
trainC
Tests run: 2, Failures: 0, Errors: 0, Skipped: 0, Time elapsed: 1.314 sec - in jsat.classifiers.svm.PegasosKTest
Running jsat.classifiers.svm.PlattSMOTest
train
trainC
trainC
train
Tests run: 7, Failures: 0, Errors: 0, Skipped: 0, Time elapsed: 1.978 sec - in jsat.classifiers.svm.PlattSMOTest
Running jsat.classifiers.svm.extended.CPMTest
clone
trainC
Tests run: 2, Failures: 0, Errors: 0, Skipped: 0, Time elapsed: 5.576 sec - in jsat.classifiers.svm.extended.CPMTest
Running jsat.classifiers.svm.extended.AMMTest
clone
trainC
getSubEpochs
Tests run: 3, Failures: 0, Errors: 0, Skipped: 0, Time elapsed: 1.117 sec - in jsat.classifiers.svm.extended.AMMTest
Running jsat.classifiers.svm.DCSVMTest
trainC
trainC
Tests run: 2, Failures: 0, Errors: 0, Skipped: 0, Time elapsed: 32.277 sec - in jsat.classifiers.svm.DCSVMTest
Running jsat.classifiers.svm.SVMnoBiasTest
trainC
trainC
Tests run: 2, Failures: 0, Errors: 0, Skipped: 0, Time elapsed: 3.216 sec - in jsat.classifiers.svm.SVMnoBiasTest
Running jsat.classifiers.svm.SBPTest
trainC
trainC
Tests run: 2, Failures: 0, Errors: 0, Skipped: 0, Time elapsed: 0.062 sec - in jsat.classifiers.svm.SBPTest
Running jsat.classifiers.svm.DCDsTest
train
trainC
trainC
train
Tests run: 6, Failures: 0, Errors: 0, Skipped: 0, Time elapsed: 1.685 sec - in jsat.classifiers.svm.DCDsTest
Running jsat.classifiers.svm.PegasosTest
trainC
Tests run: 1, Failures: 1, Errors: 0, Skipped: 0, Time elapsed: 0.062 sec <<< FAILURE! - in jsat.classifiers.svm.PegasosTest
testTrainC_ClassificationDataSet_ExecutorService(jsat.classifiers.svm.PegasosTest)  Time elapsed: 0.062 sec  <<< FAILURE!
java.lang.AssertionError: expected:<1> but was:<0>
	at org.junit.Assert.fail(Assert.java:93)
	at org.junit.Assert.failNotEquals(Assert.java:647)
	at org.junit.Assert.assertEquals(Assert.java:128)
	at org.junit.Assert.assertEquals(Assert.java:472)
	at org.junit.Assert.assertEquals(Assert.java:456)
	at jsat.classifiers.svm.PegasosTest.testTrainC_ClassificationDataSet_ExecutorService(PegasosTest.java:73)

Running jsat.classifiers.svm.LSSVMTest
train
trainC
trainC
train
Tests run: 6, Failures: 0, Errors: 0, Skipped: 0, Time elapsed: 3.152 sec - in jsat.classifiers.svm.LSSVMTest
Running jsat.classifiers.OneVSAllTest
clone
trainC
trainC
Tests run: 3, Failures: 0, Errors: 0, Skipped: 0, Time elapsed: 3.4 sec - in jsat.classifiers.OneVSAllTest
Running jsat.classifiers.trees.DecisionStumpTest
clone
trainC(ClassificationDataSet, ExecutorService)
trainC(ClassificationDataSet)
trainC(ClassificationDataSet, ExecutorService)
trainC(ClassificationDataSet, ExecutorService)
trainR(RegressionDataSet, ExecutorService)
trainR(RegressionDataSet, ExecutorService)
trainC(List<DataPointPair>, Set<integer>)
supportsWeightedData
testInfoGainSplit
testInfoGainRatioSplit
testGiniSplit
testNumericCBinary
Tests run: 13, Failures: 0, Errors: 0, Skipped: 0, Time elapsed: 0.036 sec - in jsat.classifiers.trees.DecisionStumpTest
Running jsat.classifiers.trees.RandomForestTest
train
train
clone
trainC
trainC
train
trainC
Tests run: 7, Failures: 0, Errors: 0, Skipped: 0, Time elapsed: 5.516 sec - in jsat.classifiers.trees.RandomForestTest
Running jsat.classifiers.trees.MDITest
getImportanceStats
Tests run: 1, Failures: 0, Errors: 0, Skipped: 0, Time elapsed: 14.327 sec - in jsat.classifiers.trees.MDITest
Running jsat.classifiers.trees.MDATest
getImportanceStatsR
getImportanceStats
Tests run: 2, Failures: 0, Errors: 0, Skipped: 0, Time elapsed: 2.911 sec - in jsat.classifiers.trees.MDATest
Running jsat.classifiers.trees.ERTreesTest
train
train
clone
trainC
trainC
Tests run: 5, Failures: 0, Errors: 0, Skipped: 0, Time elapsed: 28.573 sec - in jsat.classifiers.trees.ERTreesTest
Running jsat.classifiers.trees.ImportanceByUsesTest
getImportanceStats
Tests run: 1, Failures: 0, Errors: 0, Skipped: 0, Time elapsed: 4.601 sec - in jsat.classifiers.trees.ImportanceByUsesTest
Running jsat.classifiers.trees.DecisionTreeTest
train
train
clone
trainC
trainC
trainC
train
Tests run: 7, Failures: 0, Errors: 0, Skipped: 0, Time elapsed: 13.369 sec - in jsat.classifiers.trees.DecisionTreeTest
Running jsat.classifiers.boosting.StackingTest
regression
binary classifiation
binary classifiation MT
multi class classification MT
regression MT
Tests run: 6, Failures: 0, Errors: 0, Skipped: 0, Time elapsed: 10.657 sec - in jsat.classifiers.boosting.StackingTest
Running jsat.classifiers.boosting.ModestAdaBoostTest
clone
trainC
trainC
Tests run: 3, Failures: 0, Errors: 0, Skipped: 0, Time elapsed: 0.817 sec - in jsat.classifiers.boosting.ModestAdaBoostTest
Running jsat.classifiers.boosting.EmphasisBoostTest
clone
trainC
trainC
Tests run: 3, Failures: 0, Errors: 0, Skipped: 0, Time elapsed: 0.615 sec - in jsat.classifiers.boosting.EmphasisBoostTest
Running jsat.classifiers.boosting.AdaBoostM1Test
clone
trainC
trainC
Tests run: 3, Failures: 0, Errors: 0, Skipped: 0, Time elapsed: 0.264 sec - in jsat.classifiers.boosting.AdaBoostM1Test
Running jsat.classifiers.boosting.LogitBoostPLTest
clone
trainC
trainC
Tests run: 3, Failures: 0, Errors: 0, Skipped: 0, Time elapsed: 2.18 sec - in jsat.classifiers.boosting.LogitBoostPLTest
Running jsat.classifiers.boosting.LogitBoostTest
clone
trainC
trainC
Tests run: 3, Failures: 0, Errors: 0, Skipped: 0, Time elapsed: 4.795 sec - in jsat.classifiers.boosting.LogitBoostTest
Running jsat.classifiers.boosting.SAMMETest
clone
trainC
trainC
Tests run: 3, Failures: 0, Errors: 0, Skipped: 0, Time elapsed: 0.87 sec - in jsat.classifiers.boosting.SAMMETest
Running jsat.classifiers.boosting.UpdatableStackingTest
regression
binary classifiation
Tests run: 3, Failures: 0, Errors: 0, Skipped: 0, Time elapsed: 0.147 sec - in jsat.classifiers.boosting.UpdatableStackingTest
Running jsat.classifiers.boosting.WaggingNormalTest
train
train
clone
trainC
trainC
Tests run: 5, Failures: 0, Errors: 0, Skipped: 0, Time elapsed: 2.036 sec - in jsat.classifiers.boosting.WaggingNormalTest
Running jsat.classifiers.boosting.BaggingTest
train
train
clone
trainC
trainC
Tests run: 5, Failures: 0, Errors: 0, Skipped: 0, Time elapsed: 4.104 sec - in jsat.classifiers.boosting.BaggingTest
Running jsat.classifiers.boosting.ArcX4Test
clone
trainC
trainC
Tests run: 3, Failures: 0, Errors: 0, Skipped: 0, Time elapsed: 0.957 sec - in jsat.classifiers.boosting.ArcX4Test
Running jsat.classifiers.imbalance.SMOTETest
trainC
trainC
Tests run: 2, Failures: 0, Errors: 0, Skipped: 0, Time elapsed: 0.012 sec - in jsat.classifiers.imbalance.SMOTETest
Running jsat.classifiers.imbalance.BorderlineSMOTETest
trainC
trainC
Tests run: 2, Failures: 0, Errors: 0, Skipped: 0, Time elapsed: 0.032 sec - in jsat.classifiers.imbalance.BorderlineSMOTETest
Running jsat.classifiers.evaluation.AUCTest
getScore
Tests run: 1, Failures: 0, Errors: 0, Skipped: 0, Time elapsed: 0.003 sec - in jsat.classifiers.evaluation.AUCTest
Running jsat.classifiers.evaluation.FbetaScoreTest
getScore
Tests run: 1, Failures: 0, Errors: 0, Skipped: 0, Time elapsed: 0.001 sec - in jsat.classifiers.evaluation.FbetaScoreTest
Running jsat.classifiers.evaluation.KappaTest
getScore
Tests run: 1, Failures: 0, Errors: 0, Skipped: 0, Time elapsed: 0 sec - in jsat.classifiers.evaluation.KappaTest
Running jsat.classifiers.evaluation.F1ScoreTest
getScore
Tests run: 1, Failures: 0, Errors: 0, Skipped: 0, Time elapsed: 0 sec - in jsat.classifiers.evaluation.F1ScoreTest
Running jsat.classifiers.evaluation.LogLossTest
getScore
Tests run: 1, Failures: 0, Errors: 0, Skipped: 0, Time elapsed: 0 sec - in jsat.classifiers.evaluation.LogLossTest
Running jsat.classifiers.evaluation.AccuracyTest
getScore
Tests run: 1, Failures: 0, Errors: 0, Skipped: 0, Time elapsed: 0 sec - in jsat.classifiers.evaluation.AccuracyTest
Running jsat.classifiers.evaluation.PrecisionTest
getScore
Tests run: 1, Failures: 0, Errors: 0, Skipped: 0, Time elapsed: 0 sec - in jsat.classifiers.evaluation.PrecisionTest
Running jsat.classifiers.evaluation.RecallTest
getScore
Tests run: 1, Failures: 0, Errors: 0, Skipped: 0, Time elapsed: 0 sec - in jsat.classifiers.evaluation.RecallTest
Running jsat.classifiers.evaluation.MatthewsCorrelationCoefficientTest
getScore
Tests run: 1, Failures: 0, Errors: 0, Skipped: 0, Time elapsed: 0.001 sec - in jsat.classifiers.evaluation.MatthewsCorrelationCoefficientTest
Running jsat.math.optimization.NelderMeadTest
optimize
optimize
optimize
Tests run: 3, Failures: 0, Errors: 0, Skipped: 0, Time elapsed: 0.001 sec - in jsat.math.optimization.NelderMeadTest
Running jsat.math.optimization.oned.GoldenSearchTest
findMin
Tests run: 1, Failures: 0, Errors: 0, Skipped: 0, Time elapsed: 0.001 sec - in jsat.math.optimization.oned.GoldenSearchTest
Running jsat.math.optimization.stochastic.SGDMomentumTest
update
update
Tests run: 2, Failures: 0, Errors: 0, Skipped: 0, Time elapsed: 0.484 sec - in jsat.math.optimization.stochastic.SGDMomentumTest
Running jsat.math.optimization.stochastic.RMSPropTest
update
update
Tests run: 2, Failures: 0, Errors: 0, Skipped: 0, Time elapsed: 0.383 sec - in jsat.math.optimization.stochastic.RMSPropTest
Running jsat.math.optimization.stochastic.AdaGradTest
update
update
Tests run: 2, Failures: 0, Errors: 0, Skipped: 0, Time elapsed: 0.321 sec - in jsat.math.optimization.stochastic.AdaGradTest
Running jsat.math.optimization.stochastic.RpropTest
update
update
Tests run: 2, Failures: 0, Errors: 0, Skipped: 0, Time elapsed: 0.112 sec - in jsat.math.optimization.stochastic.RpropTest
Running jsat.math.optimization.stochastic.AdamTest
update
update
Tests run: 2, Failures: 0, Errors: 0, Skipped: 0, Time elapsed: 1.125 sec - in jsat.math.optimization.stochastic.AdamTest
Running jsat.math.optimization.stochastic.AdaDeltaTest
update
update
Tests run: 2, Failures: 0, Errors: 0, Skipped: 0, Time elapsed: 0.377 sec - in jsat.math.optimization.stochastic.AdaDeltaTest
Running jsat.math.optimization.stochastic.NAdaGradTest
update
update
update
Tests run: 3, Failures: 0, Errors: 0, Skipped: 0, Time elapsed: 0.469 sec - in jsat.math.optimization.stochastic.NAdaGradTest
Running jsat.math.optimization.stochastic.SimpleSGDTest
update
update
Tests run: 2, Failures: 0, Errors: 0, Skipped: 0, Time elapsed: 0.137 sec - in jsat.math.optimization.stochastic.SimpleSGDTest
Running jsat.math.optimization.ModifiedOWLQNTest
optimize
optimize
optimize
Tests run: 3, Failures: 0, Errors: 0, Skipped: 0, Time elapsed: 0.17 sec - in jsat.math.optimization.ModifiedOWLQNTest
Running jsat.math.optimization.LBFGSTest
optimize
Tests run: 1, Failures: 0, Errors: 0, Skipped: 0, Time elapsed: 0.001 sec - in jsat.math.optimization.LBFGSTest
Running jsat.math.optimization.BFGSTest
optimize
Tests run: 1, Failures: 0, Errors: 0, Skipped: 0, Time elapsed: 0.001 sec - in jsat.math.optimization.BFGSTest
Running jsat.math.FastMathTest
log2
log2_2pd1
log2_c11
pow2
pow2
pow
log
exp
digamma
Tests run: 9, Failures: 0, Errors: 0, Skipped: 0, Time elapsed: 0.086 sec - in jsat.math.FastMathTest
Running jsat.math.SpecialMathTest
digamma
digamma
reLnBn
bernoulli
Tests run: 4, Failures: 0, Errors: 0, Skipped: 0, Time elapsed: 0.001 sec - in jsat.math.SpecialMathTest
Running jsat.math.ComplexTest
clone
multiply
I
getReal
getImag
mutableAdd
mutableAdd
add
mutableSubtract
mutableSubtract
subtract
cMul
mutableMultiply
mutableMultiply
cDiv
mutableDivide
mutableDivide
divide
getMagnitude
getArg
mutateConjugate
getConjugate
Tests run: 22, Failures: 0, Errors: 0, Skipped: 0, Time elapsed: 0.008 sec - in jsat.math.ComplexTest
Running jsat.math.OnLineStatisticsTest
add(double)
add(double, double)
remove
add
Tests run: 4, Failures: 0, Errors: 0, Skipped: 0, Time elapsed: 0 sec - in jsat.math.OnLineStatisticsTest
Running jsat.math.MathTricksTest
logSumExp
logSumExp
softmax
softmax
hornerPolyR
hornerPoly
Tests run: 6, Failures: 0, Errors: 0, Skipped: 0, Time elapsed: 0 sec - in jsat.math.MathTricksTest
Running jsat.math.ExponentialMovingStatisticsTest
setSmoothing
setSmoothing Drift
Tests run: 2, Failures: 0, Errors: 0, Skipped: 0, Time elapsed: 1.7 sec - in jsat.math.ExponentialMovingStatisticsTest
Running jsat.math.rootfinding.SecantTest
root
root
root
root
Tests run: 4, Failures: 0, Errors: 0, Skipped: 0, Time elapsed: 0.005 sec - in jsat.math.rootfinding.SecantTest
Running jsat.math.rootfinding.BisectionTest
root
root
root
root
Tests run: 4, Failures: 0, Errors: 0, Skipped: 0, Time elapsed: 0.004 sec - in jsat.math.rootfinding.BisectionTest
Running jsat.math.rootfinding.ZeroinTest
root
root
root
root
Tests run: 4, Failures: 0, Errors: 0, Skipped: 0, Time elapsed: 0.003 sec - in jsat.math.rootfinding.ZeroinTest
Running jsat.math.rootfinding.RiddersMethodTest
root
root
root
root
Tests run: 4, Failures: 0, Errors: 0, Skipped: 0, Time elapsed: 0.004 sec - in jsat.math.rootfinding.RiddersMethodTest
Running jsat.datatransform.JLTransformTest
transform
Tests run: 1, Failures: 0, Errors: 0, Skipped: 0, Time elapsed: 1.038 sec - in jsat.datatransform.JLTransformTest
Running jsat.datatransform.RemoveAttributeTransformTest
clone
transform
consolidate
Tests run: 3, Failures: 0, Errors: 0, Skipped: 0, Time elapsed: 0.001 sec - in jsat.datatransform.RemoveAttributeTransformTest
Running jsat.datatransform.kernel.NystromTest
clone
trainC
trainC
Tests run: 3, Failures: 0, Errors: 0, Skipped: 0, Time elapsed: 4.596 sec - in jsat.datatransform.kernel.NystromTest
Running jsat.datatransform.kernel.KernelPCATest
clone
trainC
trainC
Tests run: 3, Failures: 0, Errors: 0, Skipped: 0, Time elapsed: 0.475 sec - in jsat.datatransform.kernel.KernelPCATest
Running jsat.datatransform.kernel.RFF_RBFTest
clone
trainC
trainC
Tests run: 3, Failures: 0, Errors: 0, Skipped: 0, Time elapsed: 0.301 sec - in jsat.datatransform.kernel.RFF_RBFTest
Running jsat.datatransform.ImputerTest
fit
Tests run: 1, Failures: 0, Errors: 0, Skipped: 0, Time elapsed: 0.166 sec - in jsat.datatransform.ImputerTest
Running jsat.datatransform.visualization.MDSTest
transform
Tests run: 1, Failures: 0, Errors: 0, Skipped: 0, Time elapsed: 0.032 sec - in jsat.datatransform.visualization.MDSTest
Running jsat.datatransform.visualization.TSNETest
transform
Tests run: 1, Failures: 0, Errors: 0, Skipped: 0, Time elapsed: 2.249 sec - in jsat.datatransform.visualization.TSNETest
Running jsat.datatransform.visualization.IsomapTest
transform
Tests run: 1, Failures: 0, Errors: 0, Skipped: 0, Time elapsed: 0.954 sec - in jsat.datatransform.visualization.IsomapTest
Running jsat.datatransform.visualization.LargeVizTest
transform
transform
Tests run: 2, Failures: 0, Errors: 0, Skipped: 0, Time elapsed: 4.124 sec - in jsat.datatransform.visualization.LargeVizTest
Running jsat.datatransform.WhitenedZCATest
testTransform
Tests run: 1, Failures: 0, Errors: 0, Skipped: 0, Time elapsed: 0.005 sec - in jsat.datatransform.WhitenedZCATest
Running jsat.datatransform.WhitenedPCATest
testTransform
Tests run: 1, Failures: 0, Errors: 0, Skipped: 0, Time elapsed: 0.002 sec - in jsat.datatransform.WhitenedPCATest
Running jsat.datatransform.FastICATest
transform
transform
transform
Tests run: 3, Failures: 0, Errors: 0, Skipped: 0, Time elapsed: 0.02 sec - in jsat.datatransform.FastICATest
Running jsat.datatransform.featureselection.SBSTest
transformC
transformR
Tests run: 2, Failures: 0, Errors: 0, Skipped: 0, Time elapsed: 0.25 sec - in jsat.datatransform.featureselection.SBSTest
Running jsat.datatransform.featureselection.LRSTest
transformC
transformR
Tests run: 2, Failures: 0, Errors: 0, Skipped: 0, Time elapsed: 0.459 sec - in jsat.datatransform.featureselection.LRSTest
Running jsat.datatransform.featureselection.SFSTest
transform
transformR
Tests run: 2, Failures: 0, Errors: 0, Skipped: 0, Time elapsed: 0.06 sec - in jsat.datatransform.featureselection.SFSTest
Running jsat.datatransform.featureselection.MutualInfoFSTest
Tests run: 1, Failures: 0, Errors: 0, Skipped: 0, Time elapsed: 0.002 sec - in jsat.datatransform.featureselection.MutualInfoFSTest
Running jsat.datatransform.featureselection.ReliefFTest
transformC
Tests run: 1, Failures: 0, Errors: 0, Skipped: 0, Time elapsed: 0.011 sec - in jsat.datatransform.featureselection.ReliefFTest
Running jsat.datatransform.featureselection.BDSTest
transformC
transformR
Tests run: 2, Failures: 0, Errors: 0, Skipped: 0, Time elapsed: 0.151 sec - in jsat.datatransform.featureselection.BDSTest
Running jsat.datatransform.PCATest
transform
Tests run: 1, Failures: 0, Errors: 0, Skipped: 0, Time elapsed: 0.008 sec - in jsat.datatransform.PCATest
Running jsat.clustering.HDBSCANTest
cluster(dataset)
cluster(dataset, executorService)
Tests run: 2, Failures: 0, Errors: 0, Skipped: 0, Time elapsed: 0.114 sec - in jsat.clustering.HDBSCANTest
Running jsat.clustering.MeanShiftTest
cluster(dataset)
cluster(dataset, ExecutorService)
Tests run: 2, Failures: 0, Errors: 0, Skipped: 0, Time elapsed: 0.548 sec - in jsat.clustering.MeanShiftTest
Running jsat.clustering.FLAMETest
cluster(dataset)
cluster(dataset, ExecutorService)
Tests run: 2, Failures: 0, Errors: 0, Skipped: 0, Time elapsed: 3.183 sec - in jsat.clustering.FLAMETest
Running jsat.clustering.GapStatisticTest
cluster findK
Tests run: 1, Failures: 0, Errors: 0, Skipped: 0, Time elapsed: 19.751 sec - in jsat.clustering.GapStatisticTest
Running jsat.clustering.hierarchical.NNChainHACTest
cluster(dataset)
cluster(dataset, ExecutorService)
cluster(dataset, int)
cluster(dataset, int, int)
cluster(dataset, int, int, ExecutorService)
cluster(dataset, int, ExecutorService)
Tests run: 6, Failures: 0, Errors: 0, Skipped: 0, Time elapsed: 5.081 sec - in jsat.clustering.hierarchical.NNChainHACTest
Running jsat.clustering.hierarchical.DivisiveGlobalClustererTest
cluster(dataset)
cluster(dataset, ExecutorService)
cluster(dataset, int)
cluster(dataset, int, int)
cluster(dataset, int, int, ExecutorService)
cluster(dataset, int, ExecutorService)
Tests run: 6, Failures: 0, Errors: 0, Skipped: 0, Time elapsed: 0.432 sec - in jsat.clustering.hierarchical.DivisiveGlobalClustererTest
Running jsat.clustering.hierarchical.PriorityHACTest
cluster(dataset)
cluster(dataset, ExecutorService)
cluster(dataset, int)
cluster(dataset, int, int)
cluster(dataset, int, int, ExecutorService)
cluster(dataset, int, ExecutorService)
Tests run: 6, Failures: 0, Errors: 0, Skipped: 0, Time elapsed: 0.822 sec - in jsat.clustering.hierarchical.PriorityHACTest
Running jsat.clustering.hierarchical.SimpleHACTest
cluster(dataset)
cluster(dataset, ExecutorService)
cluster(dataset, int)
cluster(dataset, int, int)
cluster(dataset, int, int, ExecutorService)
cluster(dataset, int, ExecutorService)
Tests run: 6, Failures: 0, Errors: 0, Skipped: 0, Time elapsed: 5.785 sec - in jsat.clustering.hierarchical.SimpleHACTest
Running jsat.clustering.hierarchical.DivisiveLocalClustererTest
cluster(dataset, int)
cluster(dataset, int, ExecutorService)
Tests run: 2, Failures: 0, Errors: 0, Skipped: 0, Time elapsed: 0.319 sec - in jsat.clustering.hierarchical.DivisiveLocalClustererTest
Running jsat.clustering.DBSCANTest
cluster(dataset)
cluster(dataset, executorService)
cluster(dataset, int)
cluster(dataset, double, int, executorService)
cluster(dataset, double, int)
cluster(dataset, int, executorService)
Tests run: 6, Failures: 0, Errors: 0, Skipped: 0, Time elapsed: 0.118 sec - in jsat.clustering.DBSCANTest
Running jsat.clustering.LSDBCTest
cluster(dataset)
cluster(dataset, ExecutorService)
Tests run: 2, Failures: 0, Errors: 0, Skipped: 0, Time elapsed: 0.024 sec - in jsat.clustering.LSDBCTest
Running jsat.clustering.OPTICSTest
cluster(dataset)
cluster(dataset, ExecutorService)
Tests run: 2, Failures: 0, Errors: 0, Skipped: 0, Time elapsed: 0.11 sec - in jsat.clustering.OPTICSTest
Running jsat.clustering.PAMTest
cluster(dataset, int)
cluster(dataSet, int, ExecutorService)
Tests run: 2, Failures: 0, Errors: 0, Skipped: 0, Time elapsed: 0.246 sec - in jsat.clustering.PAMTest
Running jsat.clustering.EMGaussianMixtureTest
cluster(dataset, int, threadpool)
Tests run: 1, Failures: 0, Errors: 0, Skipped: 0, Time elapsed: 0.039 sec - in jsat.clustering.EMGaussianMixtureTest
Running jsat.clustering.TRIKMEDSTest
cluster(dataset, int)
cluster(dataset, int)
cluster(dataSet, int, ExecutorService)
cluster(dataset, int)
Tests run: 4, Failures: 0, Errors: 1, Skipped: 0, Time elapsed: 0.673 sec <<< FAILURE! - in jsat.clustering.TRIKMEDSTest
testCluster_3args_1(jsat.clustering.TRIKMEDSTest)  Time elapsed: 0.057 sec  <<< ERROR!
java.lang.IndexOutOfBoundsException: Index: 0, Size: 0
	at java.util.ArrayList.rangeCheck(ArrayList.java:653)
	at java.util.ArrayList.get(ArrayList.java:429)
	at jsat.TestTools.checkClusteringByCat(TestTools.java:87)
	at jsat.clustering.TRIKMEDSTest.testCluster_3args_1(TRIKMEDSTest.java:80)

Running jsat.clustering.CLARATest
cluster(dataset, int, ExecutorService)
cluster(dataset, int)
cluster(dataset, int, ExecutorService)
Tests run: 3, Failures: 0, Errors: 0, Skipped: 0, Time elapsed: 0.844 sec - in jsat.clustering.CLARATest
Running jsat.clustering.kmeans.ElkanKMeansTest
cluster(dataset, int)
cluster(dataset, int, threadpool)
cluster(dataset, int, threadpool)
Tests run: 3, Failures: 0, Errors: 0, Skipped: 0, Time elapsed: 0.16 sec - in jsat.clustering.kmeans.ElkanKMeansTest
Running jsat.clustering.kmeans.NaiveKMeansTest
cluster
cluster(dataset, int, threadpool)
cluster
Tests run: 3, Failures: 0, Errors: 0, Skipped: 0, Time elapsed: 0.11 sec - in jsat.clustering.kmeans.NaiveKMeansTest
Running jsat.clustering.kmeans.HamerlyKMeansTest
cluster
cluster(dataset, int, threadpool)
cluster
Tests run: 3, Failures: 0, Errors: 0, Skipped: 0, Time elapsed: 0.117 sec - in jsat.clustering.kmeans.HamerlyKMeansTest
Running jsat.clustering.kmeans.MiniBatchKMeansTest
cluster
cluster
Tests run: 2, Failures: 0, Errors: 0, Skipped: 0, Time elapsed: 0.168 sec - in jsat.clustering.kmeans.MiniBatchKMeansTest
Running jsat.clustering.kmeans.XMeansTest
cluster findK
cluster findK
Tests run: 2, Failures: 0, Errors: 0, Skipped: 0, Time elapsed: 0.134 sec - in jsat.clustering.kmeans.XMeansTest
Running jsat.clustering.kmeans.LloydKernelKMeansTest
cluster
cluster(dataset, int, threadpool)
cluster
Tests run: 3, Failures: 0, Errors: 0, Skipped: 0, Time elapsed: 1.211 sec - in jsat.clustering.kmeans.LloydKernelKMeansTest
Running jsat.clustering.kmeans.KMeansPDNTest
cluster findK
cluster findK
Tests run: 2, Failures: 0, Errors: 0, Skipped: 0, Time elapsed: 0.763 sec - in jsat.clustering.kmeans.KMeansPDNTest
Running jsat.clustering.kmeans.GMeansTest
cluster findK
cluster findK
Tests run: 2, Failures: 0, Errors: 0, Skipped: 0, Time elapsed: 0.058 sec - in jsat.clustering.kmeans.GMeansTest
Running jsat.clustering.kmeans.ElkanKernelKMeansTest
cluster
cluster(dataset, int, threadpool)
cluster
Tests run: 3, Failures: 0, Errors: 0, Skipped: 0, Time elapsed: 1.087 sec - in jsat.clustering.kmeans.ElkanKernelKMeansTest
Running jsat.clustering.evaluation.NormalizedMutualInformationTest
evaluate
Tests run: 1, Failures: 0, Errors: 0, Skipped: 0, Time elapsed: 0.001 sec - in jsat.clustering.evaluation.NormalizedMutualInformationTest
Running jsat.clustering.evaluation.AdjustedRandIndexTest
evaluate
Tests run: 1, Failures: 0, Errors: 0, Skipped: 0, Time elapsed: 0.001 sec - in jsat.clustering.evaluation.AdjustedRandIndexTest
Running jsat.clustering.evaluation.intra.SumOfSqrdPairwiseDistancesTest
evaluate
evaluate
Tests run: 2, Failures: 0, Errors: 0, Skipped: 0, Time elapsed: 0 sec - in jsat.clustering.evaluation.intra.SumOfSqrdPairwiseDistancesTest
Running jsat.io.LIBSVMLoaderTest
loadR
Tests run: 1, Failures: 0, Errors: 0, Skipped: 0, Time elapsed: 0.198 sec - in jsat.io.LIBSVMLoaderTest
Running jsat.io.JSATDataTest
ReadWriteSimple
ReadWriteSimple
ReadWriteClassification
ReadWriteRegression
Tests run: 4, Failures: 0, Errors: 0, Skipped: 0, Time elapsed: 0.075 sec - in jsat.io.JSATDataTest
Running jsat.io.CSVTest
read (numeric only features)
read
Tests run: 3, Failures: 0, Errors: 0, Skipped: 0, Time elapsed: 0.246 sec - in jsat.io.CSVTest
Running jsat.utils.SimpleListTest
set
get
add
size
Tests run: 4, Failures: 0, Errors: 0, Skipped: 0, Time elapsed: 0.001 sec - in jsat.utils.SimpleListTest
Running jsat.utils.LongDoubleMapTest
increment
put
put
remove
remove
containsKey
containsKey
Tests run: 7, Failures: 0, Errors: 0, Skipped: 0, Time elapsed: 0.34 sec - in jsat.utils.LongDoubleMapTest
Running jsat.utils.IntDoubleMapTest
increment
remove
containsKey
put
put
remove
containsKey
Tests run: 7, Failures: 0, Errors: 0, Skipped: 0, Time elapsed: 0.069 sec - in jsat.utils.IntDoubleMapTest
Running jsat.utils.IndexTableTest
swap
Tests run: 7, Failures: 0, Errors: 0, Skipped: 0, Time elapsed: 0.001 sec - in jsat.utils.IndexTableTest
Running jsat.utils.IntDoubleMapArrayTest
increment
remove
containsKey
put
put
remove
containsKey
Tests run: 7, Failures: 0, Errors: 0, Skipped: 0, Time elapsed: 0.062 sec - in jsat.utils.IntDoubleMapArrayTest
Running jsat.utils.ListUtilsTest
swap
splitList
Tests run: 2, Failures: 0, Errors: 0, Skipped: 0, Time elapsed: 0.001 sec - in jsat.utils.ListUtilsTest
Running jsat.utils.LongListTest
clear
Tests run: 1, Failures: 0, Errors: 0, Skipped: 0, Time elapsed: 0.01 sec - in jsat.utils.LongListTest
Running jsat.utils.QuickSortTest
sort
sort
sort
Tests run: 3, Failures: 0, Errors: 0, Skipped: 0, Time elapsed: 0.045 sec - in jsat.utils.QuickSortTest
Running jsat.utils.IntPriorityQueueTest
Tests run: 3, Failures: 0, Errors: 0, Skipped: 0, Time elapsed: 0.004 sec - in jsat.utils.IntPriorityQueueTest
Running jsat.utils.IntSetFixedSizeTest
size
add
add
contains
contains
iterator
Tests run: 6, Failures: 0, Errors: 0, Skipped: 0, Time elapsed: 0.002 sec - in jsat.utils.IntSetFixedSizeTest
Running jsat.utils.IntListTest
clear
Tests run: 1, Failures: 0, Errors: 0, Skipped: 0, Time elapsed: 0.005 sec - in jsat.utils.IntListTest
Running jsat.utils.IntSetTest
add
size
iterator
Tests run: 3, Failures: 0, Errors: 0, Skipped: 0, Time elapsed: 0.001 sec - in jsat.utils.IntSetTest
Running jsat.utils.IntSortedSetTest
add
size
iterator
subset
Tests run: 4, Failures: 0, Errors: 0, Skipped: 0, Time elapsed: 0.029 sec - in jsat.utils.IntSortedSetTest
Running jsat.utils.StringUtilsTest
parseInt
parseDouble
Tests run: 2, Failures: 0, Errors: 0, Skipped: 0, Time elapsed: 0.643 sec - in jsat.utils.StringUtilsTest
Running jsat.utils.FibHeapTest
testRandp,
union
getMinKey
decreaseKey
Tests run: 4, Failures: 0, Errors: 0, Skipped: 0, Time elapsed: 0.442 sec - in jsat.utils.FibHeapTest
Running jsat.distributions.LogUniformTest
min
max
pdf
pdf
cdf
invCdf
skewness
Tests run: 7, Failures: 0, Errors: 0, Skipped: 0, Time elapsed: 0.002 sec - in jsat.distributions.LogUniformTest
Running jsat.distributions.ExponentialTest
variance
median
skewness
hashCode
min
max
mean
pdf
logPdf
cdf
invCdf
mode
equals
Tests run: 13, Failures: 0, Errors: 0, Skipped: 0, Time elapsed: 0.004 sec - in jsat.distributions.ExponentialTest
Running jsat.distributions.StudentTTest
hashCode
equals
Tests run: 2, Failures: 0, Errors: 0, Skipped: 0, Time elapsed: 0 sec - in jsat.distributions.StudentTTest
Running jsat.distributions.LogisticTest
hashCode
equals
Tests run: 2, Failures: 0, Errors: 0, Skipped: 0, Time elapsed: 0 sec - in jsat.distributions.LogisticTest
Running jsat.distributions.empirical.KernelDensityEstimatorTest
hashCode
equals
Tests run: 2, Failures: 0, Errors: 0, Skipped: 0, Time elapsed: 0.013 sec - in jsat.distributions.empirical.KernelDensityEstimatorTest
Running jsat.distributions.ContinuousDistributionTest
variance
skewness
mean
logPdf
cdf
invCdf
Tests run: 6, Failures: 0, Errors: 0, Skipped: 0, Time elapsed: 1.385 sec - in jsat.distributions.ContinuousDistributionTest
Running jsat.distributions.UniformTest
hashCode
equals
Tests run: 2, Failures: 0, Errors: 0, Skipped: 0, Time elapsed: 0.002 sec - in jsat.distributions.UniformTest
Running jsat.distributions.TruncatedDistributionTest
variance
median
skewness
min
max
mean
pdf
cdf
invCdf
mode
Tests run: 10, Failures: 0, Errors: 0, Skipped: 0, Time elapsed: 0.007 sec - in jsat.distributions.TruncatedDistributionTest
Running jsat.distributions.ParetoTest
hashCode
equals
Tests run: 2, Failures: 0, Errors: 0, Skipped: 0, Time elapsed: 0.002 sec - in jsat.distributions.ParetoTest
Running jsat.distributions.multivariate.NormalMTest
pdf
logPdf
setCovariance
Tests run: 3, Failures: 0, Errors: 0, Skipped: 0, Time elapsed: 0 sec - in jsat.distributions.multivariate.NormalMTest
Running jsat.distributions.multivariate.SymmetricDirichletTest
clone
pdf
logPdf
setUsingData
Tests run: 4, Failures: 0, Errors: 0, Skipped: 0, Time elapsed: 0.037 sec - in jsat.distributions.multivariate.SymmetricDirichletTest
Running jsat.distributions.multivariate.DirichletTest
pdf
logPdf
setUsingData
Tests run: 3, Failures: 0, Errors: 0, Skipped: 0, Time elapsed: 0.039 sec - in jsat.distributions.multivariate.DirichletTest
Running jsat.distributions.BetaTest
variance
median
skewness
hashCode
min
max
mean
pdf
cdf
invCdf
mode
equals
Tests run: 12, Failures: 0, Errors: 0, Skipped: 0, Time elapsed: 0.004 sec - in jsat.distributions.BetaTest
Running jsat.distributions.LaplaceTest
hashCode
equals
Tests run: 2, Failures: 0, Errors: 0, Skipped: 0, Time elapsed: 0 sec - in jsat.distributions.LaplaceTest
Running jsat.distributions.LogNormalTest
hashCode
equals
Tests run: 2, Failures: 0, Errors: 0, Skipped: 0, Time elapsed: 0 sec - in jsat.distributions.LogNormalTest
Running jsat.distributions.CauchyTest
variance
median
skewness
hashCode
min
max
mean
standardDeviation
pdf
cdf
invCdf
mode
equals
Tests run: 13, Failures: 0, Errors: 0, Skipped: 0, Time elapsed: 0.002 sec - in jsat.distributions.CauchyTest
Running jsat.distributions.WeibullTest
hashCode
equals
Tests run: 2, Failures: 0, Errors: 0, Skipped: 0, Time elapsed: 0 sec - in jsat.distributions.WeibullTest
Running jsat.distributions.LevyTest
hashCode
equals
Tests run: 2, Failures: 0, Errors: 0, Skipped: 0, Time elapsed: 0 sec - in jsat.distributions.LevyTest
Running jsat.distributions.FisherSendorTest
variance
median
skewness
hashCode
min
max
mean
pdf
logPdf
cdf
invCdf
mode
equals
Tests run: 13, Failures: 0, Errors: 0, Skipped: 0, Time elapsed: 0.005 sec - in jsat.distributions.FisherSendorTest
Running jsat.distributions.GammaTest
hashCode
equals
Tests run: 2, Failures: 0, Errors: 0, Skipped: 0, Time elapsed: 0.001 sec - in jsat.distributions.GammaTest
Running jsat.distributions.NormalTest
variance
median
skewness
hashCode
min
max
mean
standardDeviation
invCdf
mode
equals
setMean
setStndDev
cdf
cdf
invcdf
pdf
pdf
Tests run: 20, Failures: 0, Errors: 0, Skipped: 0, Time elapsed: 0.003 sec - in jsat.distributions.NormalTest
Running jsat.distributions.discrete.PoissonTest
cdf
logPmf
pmf
stats
sample
Tests run: 5, Failures: 0, Errors: 0, Skipped: 0, Time elapsed: 0.024 sec - in jsat.distributions.discrete.PoissonTest
Running jsat.distributions.discrete.UniformDiscreteTest
cdf
logPmf
pmf
stats
sample
Tests run: 5, Failures: 0, Errors: 0, Skipped: 0, Time elapsed: 0.003 sec - in jsat.distributions.discrete.UniformDiscreteTest
Running jsat.distributions.discrete.BinomialTest
cdf
logPmf
pmf
stats
sample
Tests run: 5, Failures: 0, Errors: 0, Skipped: 0, Time elapsed: 0.69 sec - in jsat.distributions.discrete.BinomialTest
Running jsat.distributions.MaxwellBoltzmannTest
variance
median
skewness
hashCode
min
max
mean
pdf
pdf
cdf
invCdf
mode
equals
setSigma
Tests run: 14, Failures: 0, Errors: 0, Skipped: 0, Time elapsed: 0.003 sec - in jsat.distributions.MaxwellBoltzmannTest
Running jsat.distributions.RayleighTest
variance
median
skewness
hashCode
min
max
mean
pdf
cdf
invCdf
mode
equals
setSig
Tests run: 13, Failures: 0, Errors: 0, Skipped: 0, Time elapsed: 0.003 sec - in jsat.distributions.RayleighTest
Running jsat.distributions.KolmogorovTest
hashCode
equals
Tests run: 2, Failures: 0, Errors: 0, Skipped: 0, Time elapsed: 0 sec - in jsat.distributions.KolmogorovTest
Running jsat.distributions.ChiSquaredTest
variance
median
skewness
hashCode
min
max
mean
pdf
cdf
invCdf
mode
equals
Tests run: 12, Failures: 0, Errors: 0, Skipped: 0, Time elapsed: 0.002 sec - in jsat.distributions.ChiSquaredTest
Running jsat.text.topicmodel.OnlineLDAsviTest
model
Tests run: 1, Failures: 0, Errors: 0, Skipped: 0, Time elapsed: 21.502 sec - in jsat.text.topicmodel.OnlineLDAsviTest
Running jsat.text.tokenizer.NGramTokenizerTest
tokenize
Tests run: 1, Failures: 0, Errors: 0, Skipped: 0, Time elapsed: 0.056 sec - in jsat.text.tokenizer.NGramTokenizerTest
Running jsat.text.stemming.LovinsStemmerTest
stem
Tests run: 1, Failures: 0, Errors: 0, Skipped: 0, Time elapsed: 0.023 sec - in jsat.text.stemming.LovinsStemmerTest
Running jsat.text.stemming.PaiceHuskStemmerTest
stem
Tests run: 1, Failures: 0, Errors: 0, Skipped: 0, Time elapsed: 0.004 sec - in jsat.text.stemming.PaiceHuskStemmerTest
Running jsat.text.stemming.PorterStemmerTest
stem
Tests run: 1, Failures: 0, Errors: 0, Skipped: 0, Time elapsed: 0.003 sec - in jsat.text.stemming.PorterStemmerTest

Results :

Failed tests: 
  PegasosTest.testTrainC_ClassificationDataSet_ExecutorService:73 expected:<1> but was:<0>
Tests in error: 
  TRIKMEDSTest.testCluster_3args_1:80  IndexOutOfBounds Index: 0, Size: 0
  KDTreeTest.testSearch_Vec_double:97  NullPointer

Tests run: 1130, Failures: 1, Errors: 2, Skipped: 0

[INFO] ------------------------------------------------------------------------
[INFO] BUILD FAILURE
[INFO] ------------------------------------------------------------------------
[INFO] Total time: 05:11 min
[INFO] Finished at: 2018-01-14T00:12:51+01:00
[INFO] Final Memory: 15M/480M
[INFO] ------------------------------------------------------------------------
[ERROR] Failed to execute goal org.apache.maven.plugins:maven-surefire-plugin:2.18.1:test (default-test) on project JSAT: There are test failures.
[ERROR] 
[ERROR] Please refer to /root/workspace/EdwardRaff/JSAT/328568857/JSAT/target/surefire-reports for the individual test results.
[ERROR] -> [Help 1]
[ERROR] 
[ERROR] To see the full stack trace of the errors, re-run Maven with the -e switch.
[ERROR] Re-run Maven using the -X switch to enable full debug logging.
[ERROR] 
[ERROR] For more information about the errors and possible solutions, please read the following articles:
[ERROR] [Help 1] http://cwiki.apache.org/confluence/display/MAVEN/MojoFailureException
