[INFO] Scanning for projects...
[INFO] ------------------------------------------------------------------------
[INFO] Reactor Build Order:
[INFO] 
[INFO] GeoServer
[INFO] Core Platform Module
[INFO] Open Web Service Module
[INFO] Main Module
[INFO] GeoServer Security Modules
[INFO] GeoServer JDBC Security Module
[INFO] GeoServer LDAP Security Module
[INFO] Web Coverage Service Module
[INFO] Web Coverage Service 1.0 Module
[INFO] Web Coverage Service 1.1 Module
[INFO] Web Coverage Service 2.0 Module
[INFO] Web Feature Service Module
[INFO] Web Map Service Module
[INFO] KML support for GeoServer
[INFO] gs-rest
[INFO] gs-restconfig
[INFO] GeoWebCache (GWC) Module
[INFO] GeoServer Web Modules
[INFO] Core UI Module
[INFO] WMS UI Module
[INFO] GWC UI Module
[INFO] WFS UI Module
[INFO] Demos Module
[INFO] WCS UI Module
[INFO] Security UI Modules
[INFO] Security UI Core Module
[INFO] Security UI JDBC Module
[INFO] Security UI LDAP Module
[INFO] REST UI Module
[INFO] GeoServer Web Application
[INFO] Community Space
[INFO] GeoServer Extensions
[INFO]                                                                         
[INFO] ------------------------------------------------------------------------
[INFO] Building GeoServer 2.12-SNAPSHOT
[INFO] ------------------------------------------------------------------------
[INFO] 
[INFO] --- git-commit-id-plugin:2.1.15:revision (default) @ geoserver ---
[INFO]                                                                         
[INFO] ------------------------------------------------------------------------
[INFO] Building Core Platform Module 2.12-SNAPSHOT
[INFO] ------------------------------------------------------------------------
[INFO] 
[INFO] --- git-commit-id-plugin:2.1.15:revision (default) @ gs-platform ---
[INFO] 
[INFO] --- maven-resources-plugin:2.6:resources (default-resources) @ gs-platform ---
[INFO] Using 'UTF-8' encoding to copy filtered resources.
[INFO] Copying 0 resource
[INFO] skip non existing resourceDirectory /root/workspace/geoserver/geoserver/275134832/src/platform/src/main/resources
[INFO] 
[INFO] --- maven-compiler-plugin:2.3.2:compile (default-compile) @ gs-platform ---
[INFO] Nothing to compile - all classes are up to date
[INFO] 
[INFO] --- maven-resources-plugin:2.6:testResources (default-testResources) @ gs-platform ---
[INFO] Using 'UTF-8' encoding to copy filtered resources.
[INFO] Copying 3 resources
[INFO] skip non existing resourceDirectory /root/workspace/geoserver/geoserver/275134832/src/platform/src/test/resources
[INFO] 
[INFO] --- maven-compiler-plugin:2.3.2:testCompile (default-testCompile) @ gs-platform ---
[INFO] Nothing to compile - all classes are up to date
[INFO] 
[INFO] --- maven-surefire-plugin:2.12.3:test (default-test) @ gs-platform ---
[INFO] Surefire report directory: /root/workspace/geoserver/geoserver/275134832/src/platform/target/surefire-reports
[INFO] Downloading: https://repo.maven.apache.org/maven2/org/apache/maven/surefire/surefire-junit4/2.12.3/surefire-junit4-2.12.3.pom
[INFO] Downloaded: https://repo.maven.apache.org/maven2/org/apache/maven/surefire/surefire-junit4/2.12.3/surefire-junit4-2.12.3.pom (3 KB at 3.9 KB/sec)
[INFO] Downloading: https://repo.maven.apache.org/maven2/org/apache/maven/surefire/surefire-providers/2.12.3/surefire-providers-2.12.3.pom
[INFO] Downloaded: https://repo.maven.apache.org/maven2/org/apache/maven/surefire/surefire-providers/2.12.3/surefire-providers-2.12.3.pom (3 KB at 69.5 KB/sec)
[INFO] Downloading: https://repo.maven.apache.org/maven2/org/apache/maven/surefire/surefire-junit4/2.12.3/surefire-junit4-2.12.3.jar
[INFO] Downloaded: https://repo.maven.apache.org/maven2/org/apache/maven/surefire/surefire-junit4/2.12.3/surefire-junit4-2.12.3.jar (36 KB at 472.7 KB/sec)

-------------------------------------------------------
 T E S T S
-------------------------------------------------------
Running org.geoserver.platform.AdvancedDispatchFilterTest
Tests run: 2, Failures: 0, Errors: 0, Skipped: 0, Time elapsed: 0.127 sec
Running org.geoserver.platform.GeoServerEnvironmentTest
Tests run: 1, Failures: 0, Errors: 0, Skipped: 0, Time elapsed: 1.246 sec
Running org.geoserver.platform.GeoServerExtensionsTest
Tests run: 9, Failures: 0, Errors: 0, Skipped: 0, Time elapsed: 0.02 sec
Running org.geoserver.platform.GeoServerResourceLoaderTest
Tests run: 8, Failures: 0, Errors: 0, Skipped: 0, Time elapsed: 0.072 sec
Running org.geoserver.platform.ModuleStatusTest
test
default
Tests run: 2, Failures: 0, Errors: 0, Skipped: 0, Time elapsed: 0.004 sec
Running org.geoserver.platform.RenderingEngineStatusTest
Tests run: 1, Failures: 0, Errors: 0, Skipped: 0, Time elapsed: 0.042 sec
Running org.geoserver.platform.SystemEnvironmentTest
Tests run: 2, Failures: 0, Errors: 0, Skipped: 0, Time elapsed: 0.016 sec
Running org.geoserver.platform.SystemPropertiesStatusTest
Tests run: 1, Failures: 0, Errors: 0, Skipped: 0, Time elapsed: 0.005 sec
Running org.geoserver.platform.exception.ExceptionLocalizeTest
Tests run: 6, Failures: 0, Errors: 0, Skipped: 0, Time elapsed: 0.019 sec
Running org.geoserver.platform.exception.GeoServerExceptionsTest
Tests run: 5, Failures: 0, Errors: 0, Skipped: 0, Time elapsed: 0.01 sec
Running org.geoserver.platform.resource.FileSystemResourceStoreTest
Tests run: 6, Failures: 0, Errors: 0, Skipped: 0, Time elapsed: 0.044 sec
Running org.geoserver.platform.resource.FileSystemResourceTheoryTest
Tests run: 37, Failures: 0, Errors: 0, Skipped: 0, Time elapsed: 5.702 sec
Running org.geoserver.platform.resource.FileWrapperResourceTheoryTest
Tests run: 33, Failures: 0, Errors: 0, Skipped: 0, Time elapsed: 0.379 sec
Running org.geoserver.platform.resource.PathsTest
Tests run: 6, Failures: 0, Errors: 0, Skipped: 0, Time elapsed: 0.003 sec
Running org.geoserver.platform.resource.ResourcesTest
Tests run: 34, Failures: 0, Errors: 0, Skipped: 0, Time elapsed: 0.344 sec
Running org.geoserver.platform.resource.SimpleResourceNotificationDispatcherTest
Tests run: 6, Failures: 0, Errors: 0, Skipped: 0, Time elapsed: 0.01 sec
Running org.geoserver.platform.util.GeoServerPropertyFactoryBeanTest
Tests run: 5, Failures: 0, Errors: 0, Skipped: 0, Time elapsed: 0.008 sec
Running org.geoserver.util.IOUtilsTest
Tests run: 1, Failures: 0, Errors: 0, Skipped: 0, Time elapsed: 0.014 sec
Running org.geoserver.util.LoggerRuleTest
Tests run: 7, Failures: 0, Errors: 0, Skipped: 0, Time elapsed: 0.092 sec

Results :

Tests run: 172, Failures: 0, Errors: 0, Skipped: 0

[INFO]                                                                         
[INFO] ------------------------------------------------------------------------
[INFO] Building Open Web Service Module 2.12-SNAPSHOT
[INFO] ------------------------------------------------------------------------
[INFO] 
[INFO] --- git-commit-id-plugin:2.1.15:revision (default) @ gs-ows ---
[INFO] 
[INFO] --- maven-resources-plugin:2.6:resources (default-resources) @ gs-ows ---
[INFO] Using 'UTF-8' encoding to copy filtered resources.
[INFO] Copying 9 resources
[INFO] skip non existing resourceDirectory /root/workspace/geoserver/geoserver/275134832/src/ows/src/main/resources
[INFO] 
[INFO] --- maven-compiler-plugin:2.3.2:compile (default-compile) @ gs-ows ---
[INFO] Nothing to compile - all classes are up to date
[INFO] 
[INFO] --- maven-resources-plugin:2.6:testResources (default-testResources) @ gs-ows ---
[INFO] Using 'UTF-8' encoding to copy filtered resources.
[INFO] Copying 7 resources
[INFO] skip non existing resourceDirectory /root/workspace/geoserver/geoserver/275134832/src/ows/src/test/resources
[INFO] 
[INFO] --- maven-compiler-plugin:2.3.2:testCompile (default-testCompile) @ gs-ows ---
[INFO] Nothing to compile - all classes are up to date
[INFO] 
[INFO] --- maven-surefire-plugin:2.12.3:test (default-test) @ gs-ows ---
[INFO] Surefire report directory: /root/workspace/geoserver/geoserver/275134832/src/ows/target/surefire-reports

-------------------------------------------------------
 T E S T S
-------------------------------------------------------
Running org.geoserver.ows.DefaultServiceExceptionHandlerTest
Tests run: 5, Failures: 0, Errors: 0, Skipped: 0, Time elapsed: 2.894 sec
Running org.geoserver.ows.DispatcherTest
Tests run: 29, Failures: 0, Errors: 0, Skipped: 0, Time elapsed: 1.088 sec
Running org.geoserver.ows.FilePublisherTest
Tests run: 2, Failures: 0, Errors: 0, Skipped: 0, Time elapsed: 0.122 sec
Running org.geoserver.ows.XmlObjectEncodingResponseTest
Tests run: 3, Failures: 0, Errors: 0, Skipped: 0, Time elapsed: 0.046 sec
Running org.geoserver.ows.kvp.CharsetKvpParserTest
Tests run: 2, Failures: 0, Errors: 0, Skipped: 0, Time elapsed: 0.008 sec
Running org.geoserver.ows.kvp.ElevationKvpParserTest
Tests run: 3, Failures: 0, Errors: 0, Skipped: 0, Time elapsed: 0.013 sec
Running org.geoserver.ows.kvp.FormatOptionsKvpParserTest
Tests run: 4, Failures: 0, Errors: 0, Skipped: 0, Time elapsed: 0.009 sec
Running org.geoserver.ows.kvp.KvpUtilsTest
Tests run: 10, Failures: 0, Errors: 0, Skipped: 0, Time elapsed: 0.003 sec
Running org.geoserver.ows.kvp.TimeKvpParserTest
Tests run: 13, Failures: 0, Errors: 0, Skipped: 0, Time elapsed: 0.055 sec
Running org.geoserver.ows.util.CaseInsensitiveMapTest
Tests run: 1, Failures: 0, Errors: 0, Skipped: 0, Time elapsed: 0.001 sec
Running org.geoserver.ows.util.KvpMapTest
Tests run: 1, Failures: 0, Errors: 0, Skipped: 0, Time elapsed: 0 sec
Running org.geoserver.ows.util.OwsUtilsTest
Tests run: 3, Failures: 0, Errors: 0, Skipped: 0, Time elapsed: 0.001 sec
Running org.geoserver.ows.xml.v1_0.ExceptionReportBindingTest
Tests run: 1, Failures: 0, Errors: 0, Skipped: 0, Time elapsed: 0.03 sec

Results :

Tests run: 77, Failures: 0, Errors: 0, Skipped: 0

[INFO]                                                                         
[INFO] ------------------------------------------------------------------------
[INFO] Building Main Module 2.12-SNAPSHOT
[INFO] ------------------------------------------------------------------------
[INFO] 
[INFO] --- git-commit-id-plugin:2.1.15:revision (default) @ gs-main ---
[INFO] 
[INFO] --- maven-resources-plugin:2.6:resources (default-resources) @ gs-main ---
[INFO] Using 'UTF-8' encoding to copy filtered resources.
[INFO] Copying 35 resources
[INFO] Copying 169 resources
[INFO] 
[INFO] --- maven-compiler-plugin:2.3.2:compile (default-compile) @ gs-main ---
[INFO] Compiling 2 source files to /root/workspace/geoserver/geoserver/275134832/src/main/target/classes
[INFO] 
[INFO] --- maven-resources-plugin:2.6:testResources (default-testResources) @ gs-main ---
[INFO] Using 'UTF-8' encoding to copy filtered resources.
[INFO] Copying 137 resources
[INFO] Copying 52 resources
[INFO] 
[INFO] --- maven-compiler-plugin:2.3.2:testCompile (default-testCompile) @ gs-main ---
[INFO] Nothing to compile - all classes are up to date
[INFO] 
[INFO] --- maven-surefire-plugin:2.12.3:test (default-test) @ gs-main ---
[INFO] Surefire report directory: /root/workspace/geoserver/geoserver/275134832/src/main/target/surefire-reports

-------------------------------------------------------
 T E S T S
-------------------------------------------------------
Running org.geoserver.GeoServerInitStartupListenerTest
Tests run: 2, Failures: 0, Errors: 0, Skipped: 0, Time elapsed: 1.231 sec
Running org.geoserver.GeoServerNodeDataTest
Tests run: 1, Failures: 0, Errors: 0, Skipped: 0, Time elapsed: 0.003 sec
Running org.geoserver.ManifestLoaderTest
Tests run: 6, Failures: 0, Errors: 0, Skipped: 0, Time elapsed: 6.445 sec
Running org.geoserver.ManifestLoaderTest$ManifestPropertiesTest
Tests run: 2, Failures: 0, Errors: 0, Skipped: 0, Time elapsed: 2.183 sec
Running org.geoserver.ModuleStatusTest
Tests run: 1, Failures: 0, Errors: 0, Skipped: 0, Time elapsed: 0.583 sec
Running org.geoserver.catalog.CatalogIntegrationTest
Tests run: 9, Failures: 0, Errors: 0, Skipped: 0, Time elapsed: 7.182 sec
Running org.geoserver.catalog.CoverageDimensionCustomizerReaderTest
Tests run: 5, Failures: 0, Errors: 0, Skipped: 0, Time elapsed: 0.458 sec
Running org.geoserver.catalog.CoverageViewTest
Tests run: 12, Failures: 0, Errors: 5, Skipped: 0, Time elapsed: 4.789 sec <<< FAILURE!
testHeterogeneousViewResolutionLowest(org.geoserver.catalog.CoverageViewTest)  Time elapsed: 4493 sec  <<< ERROR!
java.lang.IllegalArgumentException: The coverage gridRange should be the same for all coverages
	at org.geoserver.catalog.CoverageViewHandler$CoveragesConsistencyChecker.checkConsistency(CoverageViewHandler.java:256)
	at org.geoserver.catalog.CoverageViewHandler.<init>(CoverageViewHandler.java:355)
	at org.geoserver.catalog.CoverageViewReader.<init>(CoverageViewReader.java:121)
	at org.geoserver.catalog.StructuredCoverageViewReader.<init>(StructuredCoverageViewReader.java:279)
	at org.geoserver.catalog.CoverageViewReader.wrap(CoverageViewReader.java:512)
	at org.geoserver.catalog.ResourcePool.getGridCoverageReader(ResourcePool.java:1525)
	at org.geoserver.catalog.ResourcePool.getGridCoverageReader(ResourcePool.java:1425)
	at org.geoserver.catalog.CoverageView.buildCoverageInfo(CoverageView.java:399)
	at org.geoserver.catalog.CoverageView.createCoverageInfo(CoverageView.java:412)
	at org.geoserver.catalog.CoverageViewTest.buildHeterogeneousResolutionView(CoverageViewTest.java:524)
	at org.geoserver.catalog.CoverageViewTest.testHeterogeneousViewResolutionLowest(CoverageViewTest.java:435)
	at sun.reflect.NativeMethodAccessorImpl.invoke0(Native Method)
	at sun.reflect.NativeMethodAccessorImpl.invoke(NativeMethodAccessorImpl.java:62)
	at sun.reflect.DelegatingMethodAccessorImpl.invoke(DelegatingMethodAccessorImpl.java:43)
	at java.lang.reflect.Method.invoke(Method.java:498)
	at org.junit.runners.model.FrameworkMethod$1.runReflectiveCall(FrameworkMethod.java:47)
	at org.junit.internal.runners.model.ReflectiveCallable.run(ReflectiveCallable.java:12)
	at org.junit.runners.model.FrameworkMethod.invokeExplosively(FrameworkMethod.java:44)
	at org.junit.internal.runners.statements.InvokeMethod.evaluate(InvokeMethod.java:17)
	at org.junit.internal.runners.statements.RunBefores.evaluate(RunBefores.java:26)
	at org.junit.internal.runners.statements.RunAfters.evaluate(RunAfters.java:27)
	at org.junit.rules.RunRules.evaluate(RunRules.java:20)
	at org.junit.runners.ParentRunner.runLeaf(ParentRunner.java:271)
	at org.junit.runners.BlockJUnit4ClassRunner.runChild(BlockJUnit4ClassRunner.java:70)
	at org.junit.runners.BlockJUnit4ClassRunner.runChild(BlockJUnit4ClassRunner.java:50)
	at org.junit.runners.ParentRunner$3.run(ParentRunner.java:238)
	at org.junit.runners.ParentRunner$1.schedule(ParentRunner.java:63)
	at org.junit.runners.ParentRunner.runChildren(ParentRunner.java:236)
	at org.junit.runners.ParentRunner.access$000(ParentRunner.java:53)
	at org.junit.runners.ParentRunner$2.evaluate(ParentRunner.java:229)
	at org.junit.internal.runners.statements.RunBefores.evaluate(RunBefores.java:26)
	at org.junit.internal.runners.statements.RunAfters.evaluate(RunAfters.java:27)
	at org.junit.runners.ParentRunner.run(ParentRunner.java:309)
	at org.apache.maven.surefire.junit4.JUnit4Provider.execute(JUnit4Provider.java:252)
	at org.apache.maven.surefire.junit4.JUnit4Provider.executeTestSet(JUnit4Provider.java:141)
	at org.apache.maven.surefire.junit4.JUnit4Provider.invoke(JUnit4Provider.java:112)
	at sun.reflect.NativeMethodAccessorImpl.invoke0(Native Method)
	at sun.reflect.NativeMethodAccessorImpl.invoke(NativeMethodAccessorImpl.java:62)
	at sun.reflect.DelegatingMethodAccessorImpl.invoke(DelegatingMethodAccessorImpl.java:43)
	at java.lang.reflect.Method.invoke(Method.java:498)
	at org.apache.maven.surefire.util.ReflectionUtils.invokeMethodWithArray(ReflectionUtils.java:189)
	at org.apache.maven.surefire.booter.ProviderFactory$ProviderProxy.invoke(ProviderFactory.java:165)
	at org.apache.maven.surefire.booter.ProviderFactory.invokeProvider(ProviderFactory.java:85)
	at org.apache.maven.surefire.booter.ForkedBooter.runSuitesInProcess(ForkedBooter.java:115)
	at org.apache.maven.surefire.booter.ForkedBooter.main(ForkedBooter.java:75)

testHeterogeneousViewOutsideBounds(org.geoserver.catalog.CoverageViewTest)  Time elapsed: 2 sec  <<< ERROR!
java.lang.IllegalArgumentException: The coverage gridRange should be the same for all coverages
	at org.geoserver.catalog.CoverageViewHandler$CoveragesConsistencyChecker.checkConsistency(CoverageViewHandler.java:256)
	at org.geoserver.catalog.CoverageViewHandler.<init>(CoverageViewHandler.java:355)
	at org.geoserver.catalog.CoverageViewReader.<init>(CoverageViewReader.java:121)
	at org.geoserver.catalog.StructuredCoverageViewReader.<init>(StructuredCoverageViewReader.java:279)
	at org.geoserver.catalog.CoverageViewReader.wrap(CoverageViewReader.java:512)
	at org.geoserver.catalog.ResourcePool.getGridCoverageReader(ResourcePool.java:1525)
	at org.geoserver.catalog.ResourcePool.getGridCoverageReader(ResourcePool.java:1425)
	at org.geoserver.catalog.CoverageView.buildCoverageInfo(CoverageView.java:399)
	at org.geoserver.catalog.CoverageView.createCoverageInfo(CoverageView.java:412)
	at org.geoserver.catalog.CoverageViewTest.buildHeterogeneousResolutionView(CoverageViewTest.java:524)
	at org.geoserver.catalog.CoverageViewTest.testHeterogeneousViewOutsideBounds(CoverageViewTest.java:490)
	at sun.reflect.NativeMethodAccessorImpl.invoke0(Native Method)
	at sun.reflect.NativeMethodAccessorImpl.invoke(NativeMethodAccessorImpl.java:62)
	at sun.reflect.DelegatingMethodAccessorImpl.invoke(DelegatingMethodAccessorImpl.java:43)
	at java.lang.reflect.Method.invoke(Method.java:498)
	at org.junit.runners.model.FrameworkMethod$1.runReflectiveCall(FrameworkMethod.java:47)
	at org.junit.internal.runners.model.ReflectiveCallable.run(ReflectiveCallable.java:12)
	at org.junit.runners.model.FrameworkMethod.invokeExplosively(FrameworkMethod.java:44)
	at org.junit.internal.runners.statements.InvokeMethod.evaluate(InvokeMethod.java:17)
	at org.junit.internal.runners.statements.RunBefores.evaluate(RunBefores.java:26)
	at org.junit.internal.runners.statements.RunAfters.evaluate(RunAfters.java:27)
	at org.junit.rules.RunRules.evaluate(RunRules.java:20)
	at org.junit.runners.ParentRunner.runLeaf(ParentRunner.java:271)
	at org.junit.runners.BlockJUnit4ClassRunner.runChild(BlockJUnit4ClassRunner.java:70)
	at org.junit.runners.BlockJUnit4ClassRunner.runChild(BlockJUnit4ClassRunner.java:50)
	at org.junit.runners.ParentRunner$3.run(ParentRunner.java:238)
	at org.junit.runners.ParentRunner$1.schedule(ParentRunner.java:63)
	at org.junit.runners.ParentRunner.runChildren(ParentRunner.java:236)
	at org.junit.runners.ParentRunner.access$000(ParentRunner.java:53)
	at org.junit.runners.ParentRunner$2.evaluate(ParentRunner.java:229)
	at org.junit.internal.runners.statements.RunBefores.evaluate(RunBefores.java:26)
	at org.junit.internal.runners.statements.RunAfters.evaluate(RunAfters.java:27)
	at org.junit.runners.ParentRunner.run(ParentRunner.java:309)
	at org.apache.maven.surefire.junit4.JUnit4Provider.execute(JUnit4Provider.java:252)
	at org.apache.maven.surefire.junit4.JUnit4Provider.executeTestSet(JUnit4Provider.java:141)
	at org.apache.maven.surefire.junit4.JUnit4Provider.invoke(JUnit4Provider.java:112)
	at sun.reflect.NativeMethodAccessorImpl.invoke0(Native Method)
	at sun.reflect.NativeMethodAccessorImpl.invoke(NativeMethodAccessorImpl.java:62)
	at sun.reflect.DelegatingMethodAccessorImpl.invoke(DelegatingMethodAccessorImpl.java:43)
	at java.lang.reflect.Method.invoke(Method.java:498)
	at org.apache.maven.surefire.util.ReflectionUtils.invokeMethodWithArray(ReflectionUtils.java:189)
	at org.apache.maven.surefire.booter.ProviderFactory$ProviderProxy.invoke(ProviderFactory.java:165)
	at org.apache.maven.surefire.booter.ProviderFactory.invokeProvider(ProviderFactory.java:85)
	at org.apache.maven.surefire.booter.ForkedBooter.runSuitesInProcess(ForkedBooter.java:115)
	at org.apache.maven.surefire.booter.ForkedBooter.main(ForkedBooter.java:75)

testHeterogeneousViewDefaults(org.geoserver.catalog.CoverageViewTest)  Time elapsed: 2 sec  <<< ERROR!
java.lang.IllegalArgumentException: The coverage gridRange should be the same for all coverages
	at org.geoserver.catalog.CoverageViewHandler$CoveragesConsistencyChecker.checkConsistency(CoverageViewHandler.java:256)
	at org.geoserver.catalog.CoverageViewHandler.<init>(CoverageViewHandler.java:355)
	at org.geoserver.catalog.CoverageViewReader.<init>(CoverageViewReader.java:121)
	at org.geoserver.catalog.StructuredCoverageViewReader.<init>(StructuredCoverageViewReader.java:279)
	at org.geoserver.catalog.CoverageViewReader.wrap(CoverageViewReader.java:512)
	at org.geoserver.catalog.ResourcePool.getGridCoverageReader(ResourcePool.java:1525)
	at org.geoserver.catalog.ResourcePool.getGridCoverageReader(ResourcePool.java:1425)
	at org.geoserver.catalog.CoverageView.buildCoverageInfo(CoverageView.java:399)
	at org.geoserver.catalog.CoverageView.createCoverageInfo(CoverageView.java:412)
	at org.geoserver.catalog.CoverageViewTest.buildHeterogeneousResolutionView(CoverageViewTest.java:524)
	at org.geoserver.catalog.CoverageViewTest.testHeterogeneousViewDefaults(CoverageViewTest.java:363)
	at sun.reflect.NativeMethodAccessorImpl.invoke0(Native Method)
	at sun.reflect.NativeMethodAccessorImpl.invoke(NativeMethodAccessorImpl.java:62)
	at sun.reflect.DelegatingMethodAccessorImpl.invoke(DelegatingMethodAccessorImpl.java:43)
	at java.lang.reflect.Method.invoke(Method.java:498)
	at org.junit.runners.model.FrameworkMethod$1.runReflectiveCall(FrameworkMethod.java:47)
	at org.junit.internal.runners.model.ReflectiveCallable.run(ReflectiveCallable.java:12)
	at org.junit.runners.model.FrameworkMethod.invokeExplosively(FrameworkMethod.java:44)
	at org.junit.internal.runners.statements.InvokeMethod.evaluate(InvokeMethod.java:17)
	at org.junit.internal.runners.statements.RunBefores.evaluate(RunBefores.java:26)
	at org.junit.internal.runners.statements.RunAfters.evaluate(RunAfters.java:27)
	at org.junit.rules.RunRules.evaluate(RunRules.java:20)
	at org.junit.runners.ParentRunner.runLeaf(ParentRunner.java:271)
	at org.junit.runners.BlockJUnit4ClassRunner.runChild(BlockJUnit4ClassRunner.java:70)
	at org.junit.runners.BlockJUnit4ClassRunner.runChild(BlockJUnit4ClassRunner.java:50)
	at org.junit.runners.ParentRunner$3.run(ParentRunner.java:238)
	at org.junit.runners.ParentRunner$1.schedule(ParentRunner.java:63)
	at org.junit.runners.ParentRunner.runChildren(ParentRunner.java:236)
	at org.junit.runners.ParentRunner.access$000(ParentRunner.java:53)
	at org.junit.runners.ParentRunner$2.evaluate(ParentRunner.java:229)
	at org.junit.internal.runners.statements.RunBefores.evaluate(RunBefores.java:26)
	at org.junit.internal.runners.statements.RunAfters.evaluate(RunAfters.java:27)
	at org.junit.runners.ParentRunner.run(ParentRunner.java:309)
	at org.apache.maven.surefire.junit4.JUnit4Provider.execute(JUnit4Provider.java:252)
	at org.apache.maven.surefire.junit4.JUnit4Provider.executeTestSet(JUnit4Provider.java:141)
	at org.apache.maven.surefire.junit4.JUnit4Provider.invoke(JUnit4Provider.java:112)
	at sun.reflect.NativeMethodAccessorImpl.invoke0(Native Method)
	at sun.reflect.NativeMethodAccessorImpl.invoke(NativeMethodAccessorImpl.java:62)
	at sun.reflect.DelegatingMethodAccessorImpl.invoke(DelegatingMethodAccessorImpl.java:43)
	at java.lang.reflect.Method.invoke(Method.java:498)
	at org.apache.maven.surefire.util.ReflectionUtils.invokeMethodWithArray(ReflectionUtils.java:189)
	at org.apache.maven.surefire.booter.ProviderFactory$ProviderProxy.invoke(ProviderFactory.java:165)
	at org.apache.maven.surefire.booter.ProviderFactory.invokeProvider(ProviderFactory.java:85)
	at org.apache.maven.surefire.booter.ForkedBooter.runSuitesInProcess(ForkedBooter.java:115)
	at org.apache.maven.surefire.booter.ForkedBooter.main(ForkedBooter.java:75)

testHeterogeneousViewResolutionIndex(org.geoserver.catalog.CoverageViewTest)  Time elapsed: 3 sec  <<< ERROR!
java.lang.IllegalArgumentException: The coverage gridRange should be the same for all coverages
	at org.geoserver.catalog.CoverageViewHandler$CoveragesConsistencyChecker.checkConsistency(CoverageViewHandler.java:256)
	at org.geoserver.catalog.CoverageViewHandler.<init>(CoverageViewHandler.java:355)
	at org.geoserver.catalog.CoverageViewReader.<init>(CoverageViewReader.java:121)
	at org.geoserver.catalog.StructuredCoverageViewReader.<init>(StructuredCoverageViewReader.java:279)
	at org.geoserver.catalog.CoverageViewReader.wrap(CoverageViewReader.java:512)
	at org.geoserver.catalog.ResourcePool.getGridCoverageReader(ResourcePool.java:1525)
	at org.geoserver.catalog.ResourcePool.getGridCoverageReader(ResourcePool.java:1425)
	at org.geoserver.catalog.CoverageView.buildCoverageInfo(CoverageView.java:399)
	at org.geoserver.catalog.CoverageView.createCoverageInfo(CoverageView.java:412)
	at org.geoserver.catalog.CoverageViewTest.buildHeterogeneousResolutionView(CoverageViewTest.java:524)
	at org.geoserver.catalog.CoverageViewTest.testHeterogeneousViewResolutionIndex(CoverageViewTest.java:457)
	at sun.reflect.NativeMethodAccessorImpl.invoke0(Native Method)
	at sun.reflect.NativeMethodAccessorImpl.invoke(NativeMethodAccessorImpl.java:62)
	at sun.reflect.DelegatingMethodAccessorImpl.invoke(DelegatingMethodAccessorImpl.java:43)
	at java.lang.reflect.Method.invoke(Method.java:498)
	at org.junit.runners.model.FrameworkMethod$1.runReflectiveCall(FrameworkMethod.java:47)
	at org.junit.internal.runners.model.ReflectiveCallable.run(ReflectiveCallable.java:12)
	at org.junit.runners.model.FrameworkMethod.invokeExplosively(FrameworkMethod.java:44)
	at org.junit.internal.runners.statements.InvokeMethod.evaluate(InvokeMethod.java:17)
	at org.junit.internal.runners.statements.RunBefores.evaluate(RunBefores.java:26)
	at org.junit.internal.runners.statements.RunAfters.evaluate(RunAfters.java:27)
	at org.junit.rules.RunRules.evaluate(RunRules.java:20)
	at org.junit.runners.ParentRunner.runLeaf(ParentRunner.java:271)
	at org.junit.runners.BlockJUnit4ClassRunner.runChild(BlockJUnit4ClassRunner.java:70)
	at org.junit.runners.BlockJUnit4ClassRunner.runChild(BlockJUnit4ClassRunner.java:50)
	at org.junit.runners.ParentRunner$3.run(ParentRunner.java:238)
	at org.junit.runners.ParentRunner$1.schedule(ParentRunner.java:63)
	at org.junit.runners.ParentRunner.runChildren(ParentRunner.java:236)
	at org.junit.runners.ParentRunner.access$000(ParentRunner.java:53)
	at org.junit.runners.ParentRunner$2.evaluate(ParentRunner.java:229)
	at org.junit.internal.runners.statements.RunBefores.evaluate(RunBefores.java:26)
	at org.junit.internal.runners.statements.RunAfters.evaluate(RunAfters.java:27)
	at org.junit.runners.ParentRunner.run(ParentRunner.java:309)
	at org.apache.maven.surefire.junit4.JUnit4Provider.execute(JUnit4Provider.java:252)
	at org.apache.maven.surefire.junit4.JUnit4Provider.executeTestSet(JUnit4Provider.java:141)
	at org.apache.maven.surefire.junit4.JUnit4Provider.invoke(JUnit4Provider.java:112)
	at sun.reflect.NativeMethodAccessorImpl.invoke0(Native Method)
	at sun.reflect.NativeMethodAccessorImpl.invoke(NativeMethodAccessorImpl.java:62)
	at sun.reflect.DelegatingMethodAccessorImpl.invoke(DelegatingMethodAccessorImpl.java:43)
	at java.lang.reflect.Method.invoke(Method.java:498)
	at org.apache.maven.surefire.util.ReflectionUtils.invokeMethodWithArray(ReflectionUtils.java:189)
	at org.apache.maven.surefire.booter.ProviderFactory$ProviderProxy.invoke(ProviderFactory.java:165)
	at org.apache.maven.surefire.booter.ProviderFactory.invokeProvider(ProviderFactory.java:85)
	at org.apache.maven.surefire.booter.ForkedBooter.runSuitesInProcess(ForkedBooter.java:115)
	at org.apache.maven.surefire.booter.ForkedBooter.main(ForkedBooter.java:75)

testHeterogeneousViewIntersectionEnvelope(org.geoserver.catalog.CoverageViewTest)  Time elapsed: 3 sec  <<< ERROR!
java.lang.IllegalArgumentException: The coverage gridRange should be the same for all coverages
	at org.geoserver.catalog.CoverageViewHandler$CoveragesConsistencyChecker.checkConsistency(CoverageViewHandler.java:256)
	at org.geoserver.catalog.CoverageViewHandler.<init>(CoverageViewHandler.java:355)
	at org.geoserver.catalog.CoverageViewReader.<init>(CoverageViewReader.java:121)
	at org.geoserver.catalog.StructuredCoverageViewReader.<init>(StructuredCoverageViewReader.java:279)
	at org.geoserver.catalog.CoverageViewReader.wrap(CoverageViewReader.java:512)
	at org.geoserver.catalog.ResourcePool.getGridCoverageReader(ResourcePool.java:1525)
	at org.geoserver.catalog.ResourcePool.getGridCoverageReader(ResourcePool.java:1425)
	at org.geoserver.catalog.CoverageView.buildCoverageInfo(CoverageView.java:399)
	at org.geoserver.catalog.CoverageView.createCoverageInfo(CoverageView.java:412)
	at org.geoserver.catalog.CoverageViewTest.buildHeterogeneousResolutionView(CoverageViewTest.java:524)
	at org.geoserver.catalog.CoverageViewTest.testHeterogeneousViewIntersectionEnvelope(CoverageViewTest.java:398)
	at sun.reflect.NativeMethodAccessorImpl.invoke0(Native Method)
	at sun.reflect.NativeMethodAccessorImpl.invoke(NativeMethodAccessorImpl.java:62)
	at sun.reflect.DelegatingMethodAccessorImpl.invoke(DelegatingMethodAccessorImpl.java:43)
	at java.lang.reflect.Method.invoke(Method.java:498)
	at org.junit.runners.model.FrameworkMethod$1.runReflectiveCall(FrameworkMethod.java:47)
	at org.junit.internal.runners.model.ReflectiveCallable.run(ReflectiveCallable.java:12)
	at org.junit.runners.model.FrameworkMethod.invokeExplosively(FrameworkMethod.java:44)
	at org.junit.internal.runners.statements.InvokeMethod.evaluate(InvokeMethod.java:17)
	at org.junit.internal.runners.statements.RunBefores.evaluate(RunBefores.java:26)
	at org.junit.internal.runners.statements.RunAfters.evaluate(RunAfters.java:27)
	at org.junit.rules.RunRules.evaluate(RunRules.java:20)
	at org.junit.runners.ParentRunner.runLeaf(ParentRunner.java:271)
	at org.junit.runners.BlockJUnit4ClassRunner.runChild(BlockJUnit4ClassRunner.java:70)
	at org.junit.runners.BlockJUnit4ClassRunner.runChild(BlockJUnit4ClassRunner.java:50)
	at org.junit.runners.ParentRunner$3.run(ParentRunner.java:238)
	at org.junit.runners.ParentRunner$1.schedule(ParentRunner.java:63)
	at org.junit.runners.ParentRunner.runChildren(ParentRunner.java:236)
	at org.junit.runners.ParentRunner.access$000(ParentRunner.java:53)
	at org.junit.runners.ParentRunner$2.evaluate(ParentRunner.java:229)
	at org.junit.internal.runners.statements.RunBefores.evaluate(RunBefores.java:26)
	at org.junit.internal.runners.statements.RunAfters.evaluate(RunAfters.java:27)
	at org.junit.runners.ParentRunner.run(ParentRunner.java:309)
	at org.apache.maven.surefire.junit4.JUnit4Provider.execute(JUnit4Provider.java:252)
	at org.apache.maven.surefire.junit4.JUnit4Provider.executeTestSet(JUnit4Provider.java:141)
	at org.apache.maven.surefire.junit4.JUnit4Provider.invoke(JUnit4Provider.java:112)
	at sun.reflect.NativeMethodAccessorImpl.invoke0(Native Method)
	at sun.reflect.NativeMethodAccessorImpl.invoke(NativeMethodAccessorImpl.java:62)
	at sun.reflect.DelegatingMethodAccessorImpl.invoke(DelegatingMethodAccessorImpl.java:43)
	at java.lang.reflect.Method.invoke(Method.java:498)
	at org.apache.maven.surefire.util.ReflectionUtils.invokeMethodWithArray(ReflectionUtils.java:189)
	at org.apache.maven.surefire.booter.ProviderFactory$ProviderProxy.invoke(ProviderFactory.java:165)
	at org.apache.maven.surefire.booter.ProviderFactory.invokeProvider(ProviderFactory.java:85)
	at org.apache.maven.surefire.booter.ForkedBooter.runSuitesInProcess(ForkedBooter.java:115)
	at org.apache.maven.surefire.booter.ForkedBooter.main(ForkedBooter.java:75)

Running org.geoserver.catalog.LayerGroupHelperTest
Tests run: 10, Failures: 0, Errors: 0, Skipped: 0, Time elapsed: 3.29 sec
Running org.geoserver.catalog.PredicatesTest
Tests run: 7, Failures: 0, Errors: 0, Skipped: 0, Time elapsed: 0.01 sec
Running org.geoserver.catalog.ResourcePoolTest
Tests run: 19, Failures: 0, Errors: 0, Skipped: 0, Time elapsed: 7.623 sec
Running org.geoserver.catalog.SLDNamedLayerRenameHelperTest
Tests run: 2, Failures: 0, Errors: 0, Skipped: 0, Time elapsed: 0.505 sec
Running org.geoserver.catalog.SchemaMappingTest
Tests run: 3, Failures: 0, Errors: 0, Skipped: 0, Time elapsed: 0.72 sec
Running org.geoserver.catalog.StyleGeneratorTest
Tests run: 3, Failures: 0, Errors: 0, Skipped: 0, Time elapsed: 0.12 sec
Running org.geoserver.catalog.StylesTest
Tests run: 5, Failures: 0, Errors: 0, Skipped: 0, Time elapsed: 0.586 sec
Running org.geoserver.catalog.impl.CascadeDeleteVisitorTest
Tests run: 6, Failures: 0, Errors: 0, Skipped: 0, Time elapsed: 0.968 sec
Running org.geoserver.catalog.impl.CascadeRemovalReporterTest
Tests run: 4, Failures: 0, Errors: 0, Skipped: 0, Time elapsed: 0.817 sec
Running org.geoserver.catalog.impl.CatalogBuilderIntTest
/root/workspace/geoserver/geoserver/275134832/src/main/./target/smallMosaic
/root/workspace/geoserver/geoserver/275134832/src/main/./target/largeMosaic
Tests run: 2, Failures: 0, Errors: 0, Skipped: 0, Time elapsed: 12.334 sec
Running org.geoserver.catalog.impl.CatalogBuilderTest
Tests run: 23, Failures: 0, Errors: 0, Skipped: 0, Time elapsed: 8.664 sec
Running org.geoserver.catalog.impl.CatalogImplTest
Tests run: 101, Failures: 0, Errors: 0, Skipped: 1, Time elapsed: 0.161 sec
Running org.geoserver.catalog.impl.CatalogProxiesTest
Tests run: 2, Failures: 0, Errors: 0, Skipped: 0, Time elapsed: 0.598 sec
Running org.geoserver.catalog.impl.DataLinkInfoImplTest
Tests run: 10, Failures: 0, Errors: 0, Skipped: 0, Time elapsed: 0.011 sec
Running org.geoserver.catalog.impl.InfoObjectProxyTest
Tests run: 1, Failures: 0, Errors: 0, Skipped: 0, Time elapsed: 0.002 sec
Running org.geoserver.catalog.impl.LocalWorkspaceCatalogTest
Tests run: 9, Failures: 0, Errors: 0, Skipped: 0, Time elapsed: 0.011 sec
Running org.geoserver.catalog.impl.LocalWorkspaceLayersTest
Tests run: 7, Failures: 0, Errors: 0, Skipped: 0, Time elapsed: 0.551 sec
Running org.geoserver.catalog.impl.MetadataLinkInfoImplTest
Tests run: 10, Failures: 0, Errors: 0, Skipped: 0, Time elapsed: 0.003 sec
Running org.geoserver.catalog.impl.ModificationProxyClonerTest
Tests run: 6, Failures: 0, Errors: 0, Skipped: 0, Time elapsed: 0.008 sec
Running org.geoserver.catalog.impl.ReaderDimensionAccessorTest
Tests run: 5, Failures: 0, Errors: 0, Skipped: 0, Time elapsed: 0.01 sec
Running org.geoserver.catalog.impl.WorkspaceNamespaceConstencyTest
Tests run: 5, Failures: 0, Errors: 0, Skipped: 0, Time elapsed: 0.008 sec
Running org.geoserver.catalog.impl.util.LegacyCatalogImporterTest
Tests run: 3, Failures: 0, Errors: 0, Skipped: 0, Time elapsed: 1.959 sec
Running org.geoserver.config.DefaultGeoServerLoaderTest
Tests run: 3, Failures: 0, Errors: 0, Skipped: 0, Time elapsed: 0.078 sec
Running org.geoserver.config.GeoServerDataDirectoryTest
Tests run: 4, Failures: 0, Errors: 0, Skipped: 0, Time elapsed: 0.045 sec
Running org.geoserver.config.GeoServerImplTest
Tests run: 9, Failures: 0, Errors: 0, Skipped: 0, Time elapsed: 0.014 sec
Running org.geoserver.config.GeoServerPersisterTest
Tests run: 55, Failures: 0, Errors: 0, Skipped: 0, Time elapsed: 1.699 sec
Running org.geoserver.config.GeoServerPropertyConfigurerTest
Tests run: 2, Failures: 0, Errors: 0, Skipped: 0, Time elapsed: 0.085 sec
Running org.geoserver.config.GeoServerPropertyOverrideConfigurerTest
Tests run: 1, Failures: 0, Errors: 0, Skipped: 0, Time elapsed: 0.031 sec
Running org.geoserver.config.LegacyConfigurationImporterTest
Tests run: 1, Failures: 0, Errors: 0, Skipped: 0, Time elapsed: 0.001 sec
Running org.geoserver.config.ServicePersisterTest
Tests run: 4, Failures: 0, Errors: 0, Skipped: 0, Time elapsed: 0.841 sec
Running org.geoserver.config.UpdateSequenceListenerTest
Tests run: 2, Failures: 0, Errors: 0, Skipped: 0, Time elapsed: 0.675 sec
Running org.geoserver.config.util.AuthorityURLInfoInfoListConverterTest
Tests run: 6, Failures: 0, Errors: 0, Skipped: 0, Time elapsed: 0.095 sec
Running org.geoserver.config.util.LayerIdentifierInfoListConverterTest
[{"authority":"auth1","identifier":"IDENTIFIER_1"},{"authority":"auth2","identifier":"IDENTIFIER_2"}]
Tests run: 6, Failures: 0, Errors: 0, Skipped: 0, Time elapsed: 0.003 sec
Running org.geoserver.config.util.SecureXStreamTest
Tests run: 3, Failures: 0, Errors: 0, Skipped: 0, Time elapsed: 0.02 sec
Running org.geoserver.config.util.XStreamPersisterIntegrationTest
Tests run: 2, Failures: 0, Errors: 0, Skipped: 0, Time elapsed: 0.83 sec
Running org.geoserver.config.util.XStreamPersisterTest
Tests run: 34, Failures: 0, Errors: 0, Skipped: 1, Time elapsed: 0.372 sec
Running org.geoserver.data.jdbc.GenericUnWrapperTest
Tests run: 2, Failures: 0, Errors: 0, Skipped: 0, Time elapsed: 0.024 sec
Running org.geoserver.data.test.PropertyDataStoreRelativeUrlTest
Tests run: 1, Failures: 0, Errors: 0, Skipped: 0, Time elapsed: 0.379 sec
Running org.geoserver.data.util.CoverageUtilsTest
Tests run: 2, Failures: 0, Errors: 0, Skipped: 0, Time elapsed: 0.001 sec
Running org.geoserver.feature.ReprojectingFeatureCollectionTest
Tests run: 1, Failures: 0, Errors: 0, Skipped: 0, Time elapsed: 0.065 sec
Running org.geoserver.feature.RetypingFeatureCollectionTest
Tests run: 3, Failures: 0, Errors: 0, Skipped: 0, Time elapsed: 0.003 sec
Running org.geoserver.feature.retype.FullyRetypingDataStoreTest
Tests run: 10, Failures: 0, Errors: 0, Skipped: 0, Time elapsed: 0.067 sec
Running org.geoserver.feature.retype.RetypingDataStoreTest
Tests run: 11, Failures: 0, Errors: 0, Skipped: 0, Time elapsed: 0.032 sec
Running org.geoserver.feature.retype.RetypingFeatureSourceMockTest
Tests run: 1, Failures: 0, Errors: 0, Skipped: 0, Time elapsed: 0.006 sec
Running org.geoserver.feature.retype.RetypingFeatureSourceTest
Tests run: 2, Failures: 0, Errors: 0, Skipped: 0, Time elapsed: 0.005 sec
Running org.geoserver.filters.BufferedRequestStreamTest
Tests run: 1, Failures: 0, Errors: 0, Skipped: 0, Time elapsed: 0.001 sec
Running org.geoserver.filters.BufferedRequestWrapperTest
Tests run: 5, Failures: 0, Errors: 0, Skipped: 0, Time elapsed: 0.012 sec
Running org.geoserver.filters.FlushSafeFilterTest
Tests run: 2, Failures: 0, Errors: 0, Skipped: 0, Time elapsed: 0.015 sec
Running org.geoserver.filters.GZipFilterTest
Tests run: 3, Failures: 0, Errors: 0, Skipped: 0, Time elapsed: 0.009 sec
Running org.geoserver.filters.XFrameOptionsFilterTest
Tests run: 3, Failures: 0, Errors: 0, Skipped: 0, Time elapsed: 0.001 sec
Running org.geoserver.function.InstanceOfTest
Tests run: 5, Failures: 0, Errors: 0, Skipped: 0, Time elapsed: 0.001 sec
Running org.geoserver.logging.LegacyLoggingImporterTest
Tests run: 1, Failures: 0, Errors: 0, Skipped: 0, Time elapsed: 0.003 sec
Running org.geoserver.logging.LoggingStartupContextListenerTest
Tests run: 2, Failures: 0, Errors: 0, Skipped: 0, Time elapsed: 0.031 sec
Running org.geoserver.ows.CustomManglerTest
Tests run: 2, Failures: 0, Errors: 0, Skipped: 0, Time elapsed: 0.419 sec
Running org.geoserver.ows.LocalWorkspaceSecureCatalogTest
Tests run: 5, Failures: 0, Errors: 0, Skipped: 0, Time elapsed: 0.046 sec
Running org.geoserver.ows.OWSHandlerMappingTest
Tests run: 10, Failures: 0, Errors: 0, Skipped: 0, Time elapsed: 0.541 sec
Running org.geoserver.ows.StylePublisherTest
Tests run: 3, Failures: 0, Errors: 0, Skipped: 0, Time elapsed: 0.47 sec
Running org.geoserver.ows.URLManglersTest
Tests run: 3, Failures: 0, Errors: 0, Skipped: 0, Time elapsed: 0.536 sec
Running org.geoserver.ows.kvp.NamespaceKvpParserTest
Tests run: 5, Failures: 0, Errors: 0, Skipped: 0, Time elapsed: 0.003 sec
Running org.geoserver.platform.GeoServerExtensionsHelperTest
Tests run: 4, Failures: 0, Errors: 0, Skipped: 0, Time elapsed: 0.002 sec
Running org.geoserver.security.BruteForceAttackTest
Tests run: 3, Failures: 0, Errors: 0, Skipped: 0, Time elapsed: 8.456 sec
Running org.geoserver.security.GeoServerCustomAuthTest
Tests run: 2, Failures: 0, Errors: 0, Skipped: 0, Time elapsed: 0.757 sec
Running org.geoserver.security.GeoServerCustomFilterTest
Tests run: 5, Failures: 0, Errors: 0, Skipped: 0, Time elapsed: 0.858 sec
Running org.geoserver.security.GeoServerCustomSecurityProviderTest
Tests run: 2, Failures: 0, Errors: 0, Skipped: 0, Time elapsed: 0.543 sec
Running org.geoserver.security.GeoServerRoleFilterTest
Tests run: 2, Failures: 0, Errors: 0, Skipped: 0, Time elapsed: 0.393 sec
Running org.geoserver.security.GeoServerSecurityManagerTest
This file was created at 2017/09/13 20:22:20

The current master password is: geoserver

Test the master password by logging in as user "root"

This file should be removed after reading !!!.
Tests run: 6, Failures: 0, Errors: 0, Skipped: 0, Time elapsed: 0.608 sec
Running org.geoserver.security.GeoserverRequestMatcherTest
Tests run: 2, Failures: 0, Errors: 0, Skipped: 0, Time elapsed: 0.103 sec
Running org.geoserver.security.GroupAdminServiceTest
Tests run: 9, Failures: 0, Errors: 0, Skipped: 0, Time elapsed: 1.204 sec
Running org.geoserver.security.KeyStoreProviderTest
Tests run: 1, Failures: 0, Errors: 0, Skipped: 0, Time elapsed: 0.388 sec
Running org.geoserver.security.MigrateFrom_2_2_Test
Tests run: 2, Failures: 0, Errors: 0, Skipped: 0, Time elapsed: 0.767 sec
Running org.geoserver.security.auth.AuthenticationCacheFilterTest
Tests run: 7, Failures: 0, Errors: 0, Skipped: 0, Time elapsed: 2.513 sec
Running org.geoserver.security.auth.AuthenticationFilterTest
Tests run: 10, Failures: 0, Errors: 0, Skipped: 0, Time elapsed: 5.515 sec
Running org.geoserver.security.auth.GeoServerRootAuthenticationProviderTest
Tests run: 1, Failures: 0, Errors: 0, Skipped: 0, Time elapsed: 0.858 sec
Running org.geoserver.security.auth.GuavaAuthenticationCacheTest
Tests run: 8, Failures: 0, Errors: 0, Skipped: 0, Time elapsed: 10.011 sec
Running org.geoserver.security.auth.LRUAuthenticationCacheTest
Tests run: 11, Failures: 0, Errors: 0, Skipped: 0, Time elapsed: 7.542 sec
Running org.geoserver.security.decorators.DecoratingLayerGroupInfoTest
Tests run: 1, Failures: 0, Errors: 0, Skipped: 0, Time elapsed: 0 sec
Running org.geoserver.security.decorators.DecoratingWMSLayerInfoTest
Tests run: 1, Failures: 0, Errors: 0, Skipped: 0, Time elapsed: 0 sec
Running org.geoserver.security.decorators.ReadOnlyDataAccessTest
Tests run: 2, Failures: 0, Errors: 0, Skipped: 0, Time elapsed: 0.014 sec
Running org.geoserver.security.decorators.ReadOnlyDataStoreTest
Tests run: 3, Failures: 0, Errors: 0, Skipped: 0, Time elapsed: 0.012 sec
Running org.geoserver.security.decorators.ReadSecuredCatalogDecoratorsTest
Tests run: 7, Failures: 0, Errors: 0, Skipped: 0, Time elapsed: 0.02 sec
Running org.geoserver.security.decorators.SecuredFeatureCollectionTest
Tests run: 3, Failures: 0, Errors: 0, Skipped: 0, Time elapsed: 0.032 sec
Running org.geoserver.security.decorators.SecuredFeatureSourceTest
Tests run: 3, Failures: 0, Errors: 0, Skipped: 0, Time elapsed: 0.008 sec
Running org.geoserver.security.decorators.SecuredFeatureStoreTest
Tests run: 2, Failures: 0, Errors: 0, Skipped: 0, Time elapsed: 0.005 sec
Running org.geoserver.security.decorators.SecuredGetMapRequestTest
Tests run: 1, Failures: 0, Errors: 0, Skipped: 0, Time elapsed: 0.007 sec
Running org.geoserver.security.decorators.SecuredGridCoverage2DReaderTest
Tests run: 2, Failures: 0, Errors: 0, Skipped: 0, Time elapsed: 0.042 sec
Running org.geoserver.security.decorators.SecuredSimpleFeatureCollectionTest
Tests run: 3, Failures: 0, Errors: 0, Skipped: 0, Time elapsed: 0.058 sec
Running org.geoserver.security.file.FileTest
Tests run: 1, Failures: 0, Errors: 0, Skipped: 0, Time elapsed: 0.203 sec
Running org.geoserver.security.filter.GeoServerBasicAuthenticationFilterTest
Tests run: 1, Failures: 0, Errors: 0, Skipped: 0, Time elapsed: 0.017 sec
Running org.geoserver.security.impl.AdvertisedCatalogTest
Tests run: 3, Failures: 0, Errors: 0, Skipped: 0, Time elapsed: 0.015 sec
Running org.geoserver.security.impl.DataAccessRuleDAOTest
Tests run: 10, Failures: 0, Errors: 0, Skipped: 0, Time elapsed: 0.007 sec
Running org.geoserver.security.impl.DataAccessRuleTest
Tests run: 3, Failures: 0, Errors: 0, Skipped: 0, Time elapsed: 0.002 sec
Running org.geoserver.security.impl.DefaultDataAccessManagerTreeTest
Tests run: 4, Failures: 0, Errors: 0, Skipped: 0, Time elapsed: 0.024 sec
Running org.geoserver.security.impl.DefaultResourceAccessManagerAuthTest
Tests run: 15, Failures: 0, Errors: 0, Skipped: 0, Time elapsed: 0.079 sec
Running org.geoserver.security.impl.GeoServerJ2eeRoleServiceTest
Tests run: 2, Failures: 0, Errors: 0, Skipped: 0, Time elapsed: 0.36 sec
Running org.geoserver.security.impl.GeoServerRoleConverterImplTest
Tests run: 1, Failures: 0, Errors: 0, Skipped: 0, Time elapsed: 0.001 sec
Running org.geoserver.security.impl.GeoServerUserDaoTest
Tests run: 8, Failures: 0, Errors: 0, Skipped: 0, Time elapsed: 0.009 sec
Running org.geoserver.security.impl.LayerGroupContainmentCacheTest
Tests run: 13, Failures: 0, Errors: 0, Skipped: 0, Time elapsed: 0.201 sec
Running org.geoserver.security.impl.MemoryRoleServiceTest
Tests run: 5, Failures: 0, Errors: 0, Skipped: 0, Time elapsed: 0.358 sec
Running org.geoserver.security.impl.MemoryUserDetailsServiceTest
Tests run: 8, Failures: 0, Errors: 0, Skipped: 0, Time elapsed: 4.982 sec
Running org.geoserver.security.impl.MemoryUserGroupServiceTest
Tests run: 7, Failures: 0, Errors: 0, Skipped: 0, Time elapsed: 0.695 sec
Running org.geoserver.security.impl.RoleHierarchyHelperTest
Tests run: 3, Failures: 0, Errors: 0, Skipped: 0, Time elapsed: 0.002 sec
Running org.geoserver.security.impl.SecureCatalogImplFilterTest
Tests run: 1, Failures: 0, Errors: 0, Skipped: 0, Time elapsed: 0.017 sec
Running org.geoserver.security.impl.SecureCatalogImplGroupsTest
Tests run: 16, Failures: 0, Errors: 0, Skipped: 0, Time elapsed: 0.061 sec
Running org.geoserver.security.impl.SecureCatalogImplTest
Tests run: 28, Failures: 0, Errors: 0, Skipped: 0, Time elapsed: 0.132 sec
Running org.geoserver.security.impl.SecureCatalogIntegrationTest
Tests run: 3, Failures: 0, Errors: 0, Skipped: 0, Time elapsed: 0.544 sec
Running org.geoserver.security.impl.SecureTreeNodeTest
Tests run: 1, Failures: 0, Errors: 0, Skipped: 0, Time elapsed: 0 sec
Running org.geoserver.security.impl.SecuredLayerGroupTest
Tests run: 4, Failures: 0, Errors: 0, Skipped: 0, Time elapsed: 0.382 sec
Running org.geoserver.security.password.GeoServerMultiplexingPasswordEncoderTest
Tests run: 1, Failures: 0, Errors: 0, Skipped: 0, Time elapsed: 0.005 sec
Running org.geoserver.security.password.GeoserverPasswordEncoderTest
Tests run: 7, Failures: 0, Errors: 0, Skipped: 0, Time elapsed: 4.054 sec
Running org.geoserver.security.password.MasterPasswordChangeTest
Tests run: 1, Failures: 0, Errors: 0, Skipped: 0, Time elapsed: 1.158 sec
Running org.geoserver.security.password.URLMasterPasswordProviderTest
Tests run: 1, Failures: 0, Errors: 0, Skipped: 0, Time elapsed: 0.375 sec
Running org.geoserver.security.rememberme.RememberMeTest
Tests run: 2, Failures: 0, Errors: 0, Skipped: 0, Time elapsed: 0.741 sec
Running org.geoserver.security.validation.FilterConfigValidatorTest
Tests run: 8, Failures: 0, Errors: 0, Skipped: 0, Time elapsed: 0.022 sec
Running org.geoserver.security.validation.MasterPasswordChangeValidatorTest
Tests run: 2, Failures: 0, Errors: 0, Skipped: 0, Time elapsed: 0.005 sec
Running org.geoserver.security.validation.PasswordValidatorTest
Tests run: 1, Failures: 0, Errors: 0, Skipped: 0, Time elapsed: 0.002 sec
Running org.geoserver.security.validation.RoleStoreValidationWrapperTest
Tests run: 4, Failures: 0, Errors: 0, Skipped: 0, Time elapsed: 0.027 sec
Running org.geoserver.security.validation.SecurityConfigValidatorTest
Tests run: 6, Failures: 0, Errors: 0, Skipped: 0, Time elapsed: 0.435 sec
Running org.geoserver.security.validation.UserGroupStoreValidationWrapperTest
Tests run: 1, Failures: 0, Errors: 0, Skipped: 0, Time elapsed: 0.548 sec
Running org.geoserver.security.xml.XMLRoleServiceTest
Tests run: 8, Failures: 0, Errors: 0, Skipped: 0, Time elapsed: 0.721 sec
Running org.geoserver.security.xml.XMLSecurityConfigValidatorTest
Tests run: 6, Failures: 0, Errors: 0, Skipped: 0, Time elapsed: 0.435 sec
Running org.geoserver.security.xml.XMLUserDetailsServiceTest
Tests run: 4, Failures: 0, Errors: 0, Skipped: 0, Time elapsed: 2.551 sec
Running org.geoserver.security.xml.XMLUserGroupServiceTest
Tests run: 11, Failures: 0, Errors: 0, Skipped: 0, Time elapsed: 14.233 sec
Running org.geoserver.template.DirectFeatureWrapperTest
Tests run: 4, Failures: 0, Errors: 0, Skipped: 0, Time elapsed: 0.27 sec
Running org.geoserver.template.FeatureWrapperTest
Tests run: 4, Failures: 0, Errors: 0, Skipped: 0, Time elapsed: 0.025 sec
Running org.geoserver.template.GeoServerTemplateLoader2Test
Tests run: 5, Failures: 0, Errors: 0, Skipped: 0, Time elapsed: 0.027 sec
Running org.geoserver.threadlocals.AdminRequestThreadLocalTransferTest
Tests run: 1, Failures: 0, Errors: 0, Skipped: 0, Time elapsed: 0.005 sec
Running org.geoserver.threadlocals.AuthenticationThreadLocalTransferTest
Tests run: 1, Failures: 0, Errors: 0, Skipped: 0, Time elapsed: 0 sec
Running org.geoserver.threadlocals.LocalLayerThreadLocalTransferTest
Tests run: 1, Failures: 0, Errors: 0, Skipped: 0, Time elapsed: 0 sec
Running org.geoserver.threadlocals.LocalWorkspaceThreadLocalTransferTest
Tests run: 1, Failures: 0, Errors: 0, Skipped: 0, Time elapsed: 0.001 sec
Running org.geoserver.threadlocals.PublicThreadLocalTransferTest
Tests run: 1, Failures: 0, Errors: 0, Skipped: 0, Time elapsed: 0.002 sec
Running org.geoserver.threadlocals.ThreadLocalsTransferTest
Tests run: 1, Failures: 0, Errors: 0, Skipped: 0, Time elapsed: 0.248 sec
Running org.geoserver.util.DefaultCacheProviderTest
13 Sep 20:23:23 WARN [geoserver.util] - Multiple Cache Providers in context: testCacheProvider1, testCacheProvider2
	Using testCacheProvider1.  Override by setting system property GEOSERVER_DEFAULT_CACHE_PROVIDER
Tests run: 5, Failures: 0, Errors: 0, Skipped: 1, Time elapsed: 0.013 sec
Running org.geoserver.util.PartialBufferOutputStream2Test
Tests run: 1, Failures: 0, Errors: 0, Skipped: 0, Time elapsed: 0 sec
Running org.geoserver.util.XCQLTest
Tests run: 2, Failures: 0, Errors: 0, Skipped: 0, Time elapsed: 0.019 sec
Running org.geoserver.vfny.global.TolerantStartupTest
Tests run: 1, Failures: 0, Errors: 0, Skipped: 0, Time elapsed: 0.199 sec
Running org.geoserver.wfsng.WfsCompatibilityTest
Tests run: 1, Failures: 0, Errors: 0, Skipped: 1, Time elapsed: 0.404 sec
Running org.vfny.geoserver.ProjectionPolicyTest
Tests run: 5, Failures: 0, Errors: 0, Skipped: 0, Time elapsed: 0.58 sec
Running org.vfny.geoserver.crs.OverrideCRSTest
Tests run: 1, Failures: 0, Errors: 0, Skipped: 0, Time elapsed: 0.211 sec
Running org.vfny.geoserver.crs.OvverideTransformationsTest
Tests run: 4, Failures: 0, Errors: 0, Skipped: 0, Time elapsed: 0.868 sec
Running org.vfny.geoserver.global.GeoserverDataDirectoryTest
Tests run: 4, Failures: 0, Errors: 0, Skipped: 0, Time elapsed: 0.442 sec
Running org.vfny.geoserver.global.xml.WriterHelperTest
Tests run: 3, Failures: 0, Errors: 0, Skipped: 0, Time elapsed: 0.002 sec
Running org.vfny.geoserver.util.ResponseUtilsTest
Tests run: 6, Failures: 0, Errors: 0, Skipped: 0, Time elapsed: 0.002 sec
Running org.vfny.geoserver.util.SLDValidatorTest
Tests run: 2, Failures: 0, Errors: 0, Skipped: 0, Time elapsed: 0.039 sec

Results :

Tests in error: 
  testHeterogeneousViewResolutionLowest(org.geoserver.catalog.CoverageViewTest): The coverage gridRange should be the same for all coverages
  testHeterogeneousViewOutsideBounds(org.geoserver.catalog.CoverageViewTest): The coverage gridRange should be the same for all coverages
  testHeterogeneousViewDefaults(org.geoserver.catalog.CoverageViewTest): The coverage gridRange should be the same for all coverages
  testHeterogeneousViewResolutionIndex(org.geoserver.catalog.CoverageViewTest): The coverage gridRange should be the same for all coverages
  testHeterogeneousViewIntersectionEnvelope(org.geoserver.catalog.CoverageViewTest): The coverage gridRange should be the same for all coverages

Tests run: 853, Failures: 0, Errors: 5, Skipped: 4

[INFO] ------------------------------------------------------------------------
[INFO] Reactor Summary:
[INFO] 
[INFO] GeoServer .......................................... SUCCESS [  7.286 s]
[INFO] Core Platform Module ............................... SUCCESS [ 11.676 s]
[INFO] Open Web Service Module ............................ SUCCESS [  5.027 s]
[INFO] Main Module ........................................ FAILURE [02:30 min]
[INFO] GeoServer Security Modules ......................... SKIPPED
[INFO] GeoServer JDBC Security Module ..................... SKIPPED
[INFO] GeoServer LDAP Security Module ..................... SKIPPED
[INFO] Web Coverage Service Module ........................ SKIPPED
[INFO] Web Coverage Service 1.0 Module .................... SKIPPED
[INFO] Web Coverage Service 1.1 Module .................... SKIPPED
[INFO] Web Coverage Service 2.0 Module .................... SKIPPED
[INFO] Web Feature Service Module ......................... SKIPPED
[INFO] Web Map Service Module ............................. SKIPPED
[INFO] KML support for GeoServer .......................... SKIPPED
[INFO] gs-rest ............................................ SKIPPED
[INFO] gs-restconfig ...................................... SKIPPED
[INFO] GeoWebCache (GWC) Module ........................... SKIPPED
[INFO] GeoServer Web Modules .............................. SKIPPED
[INFO] Core UI Module ..................................... SKIPPED
[INFO] WMS UI Module ...................................... SKIPPED
[INFO] GWC UI Module ...................................... SKIPPED
[INFO] WFS UI Module ...................................... SKIPPED
[INFO] Demos Module ....................................... SKIPPED
[INFO] WCS UI Module ...................................... SKIPPED
[INFO] Security UI Modules ................................ SKIPPED
[INFO] Security UI Core Module ............................ SKIPPED
[INFO] Security UI JDBC Module ............................ SKIPPED
[INFO] Security UI LDAP Module ............................ SKIPPED
[INFO] REST UI Module ..................................... SKIPPED
[INFO] GeoServer Web Application .......................... SKIPPED
[INFO] Community Space .................................... SKIPPED
[INFO] GeoServer Extensions ............................... SKIPPED
[INFO] ------------------------------------------------------------------------
[INFO] BUILD FAILURE
[INFO] ------------------------------------------------------------------------
[INFO] Total time: 02:57 min
[INFO] Finished at: 2017-09-13T20:23:26+02:00
[INFO] Final Memory: 83M/797M
[INFO] ------------------------------------------------------------------------
[ERROR] Failed to execute goal org.apache.maven.plugins:maven-surefire-plugin:2.12.3:test (default-test) on project gs-main: There are test failures.
[ERROR] 
[ERROR] Please refer to /root/workspace/geoserver/geoserver/275134832/src/main/target/surefire-reports for the individual test results.
[ERROR] -> [Help 1]
[ERROR] 
[ERROR] To see the full stack trace of the errors, re-run Maven with the -e switch.
[ERROR] Re-run Maven using the -X switch to enable full debug logging.
[ERROR] 
[ERROR] For more information about the errors and possible solutions, please read the following articles:
[ERROR] [Help 1] http://cwiki.apache.org/confluence/display/MAVEN/MojoFailureException
[ERROR] 
[ERROR] After correcting the problems, you can resume the build with the command
[ERROR]   mvn <goals> -rf :gs-main
