[INFO] Scanning for projects...
[INFO] ------------------------------------------------------------------------
[INFO] Reactor Build Order:
[INFO] 
[INFO] JMH utils
[INFO] JMH utils :: assertions
[INFO] JMH utils :: profilers
[INFO] JMH utils :: profilers :: utils
[INFO] JMH utils :: profilers :: Flight Recorder
[INFO] JMH utils :: profilers :: Solaris Studio
[INFO] JMH utils :: profilers :: Yourkit
[INFO]                                                                         
[INFO] ------------------------------------------------------------------------
[INFO] Building JMH utils 1.0.0-SNAPSHOT
[INFO] ------------------------------------------------------------------------
[INFO] 
[INFO] --- maven-enforcer-plugin:3.0.0-M1:enforce (enforce-maven-version) @ jmh-utils ---
[INFO] Skipping Rule Enforcement.
[INFO]                                                                         
[INFO] ------------------------------------------------------------------------
[INFO] Building JMH utils :: assertions 1.0.0-SNAPSHOT
[INFO] ------------------------------------------------------------------------
[INFO] 
[INFO] --- maven-enforcer-plugin:3.0.0-M1:enforce (enforce-maven-version) @ jmh-assertions ---
[INFO] Skipping Rule Enforcement.
[INFO] 
[INFO] --- maven-resources-plugin:3.0.2:resources (default-resources) @ jmh-assertions ---
[INFO] Using 'UTF-8' encoding to copy filtered resources.
[INFO] skip non existing resourceDirectory /root/workspace/nicoulaj/jmh-utils/363459646/jmh-assertions/src/main/resources
[INFO] 
[INFO] --- maven-compiler-plugin:3.7.0:compile (default-compile) @ jmh-assertions ---
[INFO] Changes detected - recompiling the module!
[INFO] Compiling 8 source files to /root/workspace/nicoulaj/jmh-utils/363459646/jmh-assertions/target/classes
[INFO] 
[INFO] --- build-helper-maven-plugin:3.0.0:add-test-source (add-additional-test-source-roots) @ jmh-assertions ---
[INFO] Test Source directory: /root/workspace/nicoulaj/jmh-utils/363459646/jmh-assertions/src/samples/java added.
[INFO] 
[INFO] --- maven-resources-plugin:3.0.2:testResources (default-testResources) @ jmh-assertions ---
[INFO] Using 'UTF-8' encoding to copy filtered resources.
[INFO] skip non existing resourceDirectory /root/workspace/nicoulaj/jmh-utils/363459646/jmh-assertions/src/test/resources
[INFO] 
[INFO] --- maven-compiler-plugin:3.7.0:testCompile (default-testCompile) @ jmh-assertions ---
[INFO] Nothing to compile - all classes are up to date
[INFO] 
[INFO] --- maven-surefire-plugin:2.20.1:test (default-test) @ jmh-assertions ---
Downloading: https://repo.maven.apache.org/maven2/org/apache/maven/surefire/surefire-testng/2.20.1/surefire-testng-2.20.1.pom
3/3 KB   
3/3 KB   
         
Downloaded: https://repo.maven.apache.org/maven2/org/apache/maven/surefire/surefire-testng/2.20.1/surefire-testng-2.20.1.pom (3 KB at 8.7 KB/sec)
Downloading: https://repo.maven.apache.org/maven2/org/apache/maven/surefire/surefire-providers/2.20.1/surefire-providers-2.20.1.pom
3/3 KB   
3/3 KB   
         
Downloaded: https://repo.maven.apache.org/maven2/org/apache/maven/surefire/surefire-providers/2.20.1/surefire-providers-2.20.1.pom (3 KB at 136.0 KB/sec)
Downloading: https://repo.maven.apache.org/maven2/org/apache/maven/surefire/common-java5/2.20.1/common-java5-2.20.1.pom
3/3 KB   
3/3 KB   
         
Downloaded: https://repo.maven.apache.org/maven2/org/apache/maven/surefire/common-java5/2.20.1/common-java5-2.20.1.pom (3 KB at 145.2 KB/sec)
Downloading: https://repo.maven.apache.org/maven2/org/apache/maven/surefire/surefire-testng-utils/2.20.1/surefire-testng-utils-2.20.1.pom
3/3 KB   
3/3 KB   
         
Downloaded: https://repo.maven.apache.org/maven2/org/apache/maven/surefire/surefire-testng-utils/2.20.1/surefire-testng-utils-2.20.1.pom (3 KB at 165.7 KB/sec)
Downloading: https://repo.maven.apache.org/maven2/org/apache/maven/surefire/surefire-grouper/2.20.1/surefire-grouper-2.20.1.pom
3/3 KB   
3/3 KB   
         
Downloaded: https://repo.maven.apache.org/maven2/org/apache/maven/surefire/surefire-grouper/2.20.1/surefire-grouper-2.20.1.pom (3 KB at 139.3 KB/sec)
Downloading: https://repo.maven.apache.org/maven2/org/apache/maven/surefire/surefire-grouper/2.20.1/surefire-grouper-2.20.1.jar
Downloading: https://repo.maven.apache.org/maven2/org/apache/maven/surefire/surefire-testng-utils/2.20.1/surefire-testng-utils-2.20.1.jar
Downloading: https://repo.maven.apache.org/maven2/org/apache/maven/surefire/surefire-testng/2.20.1/surefire-testng-2.20.1.jar
Downloading: https://repo.maven.apache.org/maven2/org/apache/maven/surefire/common-java5/2.20.1/common-java5-2.20.1.jar
3/40 KB   
5/40 KB   
8/40 KB   
11/40 KB   
13/40 KB   
16/40 KB   
19/40 KB   
21/40 KB   
24/40 KB   
27/40 KB   
29/40 KB   
32/40 KB   
35/40 KB   
37/40 KB   
40/40 KB   
40/40 KB   2/43 KB   
40/40 KB   5/43 KB   
40/40 KB   5/43 KB   3/27 KB   
40/40 KB   6/43 KB   3/27 KB   
40/40 KB   3/49 KB   6/43 KB   3/27 KB   
40/40 KB   3/49 KB   6/43 KB   5/27 KB   
40/40 KB   5/49 KB   6/43 KB   5/27 KB   
40/40 KB   5/49 KB   9/43 KB   5/27 KB   
40/40 KB   5/49 KB   9/43 KB   8/27 KB   
40/40 KB   5/49 KB   10/43 KB   8/27 KB   
40/40 KB   8/49 KB   10/43 KB   8/27 KB   
40/40 KB   8/49 KB   10/43 KB   11/27 KB   
40/40 KB   11/49 KB   10/43 KB   11/27 KB   
40/40 KB   11/49 KB   13/43 KB   11/27 KB   
40/40 KB   11/49 KB   13/43 KB   13/27 KB   
40/40 KB   13/49 KB   13/43 KB   13/27 KB   
40/40 KB   13/49 KB   14/43 KB   13/27 KB   
40/40 KB   16/49 KB   14/43 KB   13/27 KB   
40/40 KB   16/49 KB   14/43 KB   16/27 KB   
40/40 KB   16/49 KB   17/43 KB   16/27 KB   
40/40 KB   19/49 KB   17/43 KB   16/27 KB   
40/40 KB   19/49 KB   17/43 KB   19/27 KB   
40/40 KB   19/49 KB   18/43 KB   19/27 KB   
40/40 KB   21/49 KB   18/43 KB   19/27 KB   
40/40 KB   21/49 KB   18/43 KB   21/27 KB   
40/40 KB   24/49 KB   18/43 KB   21/27 KB   
40/40 KB   24/49 KB   21/43 KB   21/27 KB   
40/40 KB   24/49 KB   21/43 KB   24/27 KB   
40/40 KB   27/49 KB   22/43 KB   24/27 KB   
40/40 KB   27/49 KB   22/43 KB   24/27 KB   
40/40 KB   27/49 KB   22/43 KB   27/27 KB   
40/40 KB   29/49 KB   22/43 KB   27/27 KB   
40/40 KB   29/49 KB   25/43 KB   27/27 KB   
40/40 KB   29/49 KB   25/43 KB   27/27 KB   
40/40 KB   29/49 KB   26/43 KB   27/27 KB   
40/40 KB   32/49 KB   26/43 KB   27/27 KB   
40/40 KB   32/49 KB   29/43 KB   27/27 KB   
40/40 KB   32/49 KB   30/43 KB   27/27 KB   
40/40 KB   32/49 KB   33/43 KB   27/27 KB   
40/40 KB   36/49 KB   33/43 KB   27/27 KB   
40/40 KB   36/49 KB   34/43 KB   27/27 KB   
40/40 KB   40/49 KB   34/43 KB   27/27 KB   
40/40 KB   44/49 KB   34/43 KB   27/27 KB   
40/40 KB   48/49 KB   37/43 KB   27/27 KB   
40/40 KB   48/49 KB   37/43 KB   27/27 KB   
40/40 KB   49/49 KB   37/43 KB   27/27 KB   
40/40 KB   49/49 KB   38/43 KB   27/27 KB   
40/40 KB   49/49 KB   41/43 KB   27/27 KB   
                                            
Downloaded: https://repo.maven.apache.org/maven2/org/apache/maven/surefire/surefire-grouper/2.20.1/surefire-grouper-2.20.1.jar (40 KB at 1114.6 KB/sec)
49/49 KB   43/43 KB   27/27 KB              
                                 
                                 
Downloaded: https://repo.maven.apache.org/maven2/org/apache/maven/surefire/common-java5/2.20.1/common-java5-2.20.1.jar (49 KB at 1107.5 KB/sec)
Downloaded: https://repo.maven.apache.org/maven2/org/apache/maven/surefire/surefire-testng-utils/2.20.1/surefire-testng-utils-2.20.1.jar (27 KB at 603.6 KB/sec)
                                 
Downloaded: https://repo.maven.apache.org/maven2/org/apache/maven/surefire/surefire-testng/2.20.1/surefire-testng-2.20.1.jar (43 KB at 931.0 KB/sec)
[INFO] 
[INFO] -------------------------------------------------------
[INFO]  T E S T S
[INFO] -------------------------------------------------------
[INFO] Running TestSuite
# JMH version: 1.19
# VM version: JDK 1.8.0_121, VM 25.121-b13
# VM invoker: /usr/lib/jvm/java-8-openjdk-amd64/jre/bin/java
# VM options: <none>
# Warmup: 1 iterations, 1 s each
# Measurement: 3 iterations, 10 ms each
# Timeout: 10 min per iteration
# Threads: 1 thread, will synchronize iterations
# Benchmark mode: Throughput, ops/time
# Benchmark: net.nicoulaj.jmh.assertions.TestBenchmark.benchmark

# Run progress: 0.00% complete, ETA 00:00:01
# Fork: 1 of 1
# Warmup Iteration   1: 0.247 ops/ns
Iteration   1: 0.170 ops/ns
Iteration   2: 0.311 ops/ns
Iteration   3: 0.312 ops/ns


Result "net.nicoulaj.jmh.assertions.TestBenchmark.benchmark":
  0.264 ±(99.9%) 1.492 ops/ns [Average]
  (min, avg, max) = (0.170, 0.264, 0.312), stdev = 0.082
  CI (99.9%): [≈ 0, 1.756] (assumes normal distribution)


# Run complete. Total time: 00:00:01

Benchmark                 Mode  Cnt  Score   Error   Units
TestBenchmark.benchmark  thrpt    3  0.264 ± 1.492  ops/ns
# JMH version: 1.19
# VM version: JDK 1.8.0_121, VM 25.121-b13
# VM invoker: /usr/lib/jvm/java-8-openjdk-amd64/jre/bin/java
# VM options: <none>
# Warmup: 1 iterations, 1 s each
# Measurement: 3 iterations, 10 ms each
# Timeout: 10 min per iteration
# Threads: 1 thread, will synchronize iterations
# Benchmark mode: Throughput, ops/time
# Benchmark: net.nicoulaj.jmh.assertions.TestBenchmark.benchmark

# Run progress: 0.00% complete, ETA 00:00:01
# Fork: 1 of 1
# Warmup Iteration   1: 0.256 ops/ns
Iteration   1: 0.136 ops/ns
Iteration   2: 0.312 ops/ns
Iteration   3: 0.310 ops/ns


Result "net.nicoulaj.jmh.assertions.TestBenchmark.benchmark":
  0.253 ±(99.9%) 1.847 ops/ns [Average]
  (min, avg, max) = (0.136, 0.253, 0.312), stdev = 0.101
  CI (99.9%): [≈ 0, 2.100] (assumes normal distribution)


# Run complete. Total time: 00:00:01

Benchmark                 Mode  Cnt  Score   Error   Units
TestBenchmark.benchmark  thrpt    3  0.253 ± 1.847  ops/ns
# JMH version: 1.19
# VM version: JDK 1.8.0_121, VM 25.121-b13
# VM invoker: /usr/lib/jvm/java-8-openjdk-amd64/jre/bin/java
# VM options: <none>
# Warmup: 1 iterations, 1 s each
# Measurement: 3 iterations, 10 ms each
# Timeout: 10 min per iteration
# Threads: 1 thread, will synchronize iterations
# Benchmark mode: Throughput, ops/time
# Benchmark: net.nicoulaj.jmh.assertions.TestBenchmark.benchmark

# Run progress: 0.00% complete, ETA 00:00:01
# Fork: 1 of 1
# Warmup Iteration   1: 0.233 ops/ns
Iteration   1: 0.167 ops/ns
Iteration   2: 0.312 ops/ns
Iteration   3: 0.311 ops/ns


Result "net.nicoulaj.jmh.assertions.TestBenchmark.benchmark":
  0.263 ±(99.9%) 1.520 ops/ns [Average]
  (min, avg, max) = (0.167, 0.263, 0.312), stdev = 0.083
  CI (99.9%): [≈ 0, 1.783] (assumes normal distribution)


# Run complete. Total time: 00:00:01

Benchmark                 Mode  Cnt  Score   Error   Units
TestBenchmark.benchmark  thrpt    3  0.263 ± 1.520  ops/ns
[INFO] Tests run: 3, Failures: 0, Errors: 0, Skipped: 0, Time elapsed: 4.587 s - in TestSuite
[INFO] 
[INFO] Results:
[INFO] 
[INFO] Tests run: 3, Failures: 0, Errors: 0, Skipped: 0
[INFO] 
[INFO]                                                                         
[INFO] ------------------------------------------------------------------------
[INFO] Building JMH utils :: profilers 1.0.0-SNAPSHOT
[INFO] ------------------------------------------------------------------------
[INFO] 
[INFO] --- maven-enforcer-plugin:3.0.0-M1:enforce (enforce-maven-version) @ jmh-profilers ---
[INFO] Skipping Rule Enforcement.
[INFO]                                                                         
[INFO] ------------------------------------------------------------------------
[INFO] Building JMH utils :: profilers :: utils 1.0.0-SNAPSHOT
[INFO] ------------------------------------------------------------------------
[INFO] 
[INFO] --- maven-enforcer-plugin:3.0.0-M1:enforce (enforce-maven-version) @ jmh-profiler-utils ---
[INFO] Skipping Rule Enforcement.
[INFO] 
[INFO] --- maven-resources-plugin:3.0.2:resources (default-resources) @ jmh-profiler-utils ---
[INFO] Using 'UTF-8' encoding to copy filtered resources.
[INFO] skip non existing resourceDirectory /root/workspace/nicoulaj/jmh-utils/363459646/jmh-profilers/jmh-profiler-utils/src/main/resources
[INFO] 
[INFO] --- maven-compiler-plugin:3.7.0:compile (default-compile) @ jmh-profiler-utils ---
[INFO] Nothing to compile - all classes are up to date
[INFO] 
[INFO] --- maven-resources-plugin:3.0.2:testResources (default-testResources) @ jmh-profiler-utils ---
[INFO] Using 'UTF-8' encoding to copy filtered resources.
[INFO] skip non existing resourceDirectory /root/workspace/nicoulaj/jmh-utils/363459646/jmh-profilers/jmh-profiler-utils/src/test/resources
[INFO] 
[INFO] --- maven-compiler-plugin:3.7.0:testCompile (default-testCompile) @ jmh-profiler-utils ---
[INFO] No sources to compile
[INFO] 
[INFO] --- maven-surefire-plugin:2.20.1:test (default-test) @ jmh-profiler-utils ---
[INFO] No tests to run.
[INFO]                                                                         
[INFO] ------------------------------------------------------------------------
[INFO] Building JMH utils :: profilers :: Flight Recorder 1.0.0-SNAPSHOT
[INFO] ------------------------------------------------------------------------
[INFO] 
[INFO] --- maven-enforcer-plugin:3.0.0-M1:enforce (enforce-maven-version) @ jmh-profiler-flight-recorder ---
[INFO] Skipping Rule Enforcement.
[INFO] 
[INFO] --- maven-resources-plugin:3.0.2:resources (default-resources) @ jmh-profiler-flight-recorder ---
[INFO] Using 'UTF-8' encoding to copy filtered resources.
[INFO] skip non existing resourceDirectory /root/workspace/nicoulaj/jmh-utils/363459646/jmh-profilers/jmh-profiler-flight-recorder/src/main/resources
[INFO] 
[INFO] --- maven-compiler-plugin:3.7.0:compile (default-compile) @ jmh-profiler-flight-recorder ---
[INFO] Changes detected - recompiling the module!
[INFO] Compiling 2 source files to /root/workspace/nicoulaj/jmh-utils/363459646/jmh-profilers/jmh-profiler-flight-recorder/target/classes
[INFO] 
[INFO] --- maven-resources-plugin:3.0.2:testResources (default-testResources) @ jmh-profiler-flight-recorder ---
[INFO] Using 'UTF-8' encoding to copy filtered resources.
[INFO] skip non existing resourceDirectory /root/workspace/nicoulaj/jmh-utils/363459646/jmh-profilers/jmh-profiler-flight-recorder/src/test/resources
[INFO] 
[INFO] --- maven-compiler-plugin:3.7.0:testCompile (default-testCompile) @ jmh-profiler-flight-recorder ---
[INFO] Nothing to compile - all classes are up to date
[INFO] 
[INFO] --- maven-surefire-plugin:2.20.1:test (default-test) @ jmh-profiler-flight-recorder ---
[INFO] 
[INFO] -------------------------------------------------------
[INFO]  T E S T S
[INFO] -------------------------------------------------------
[INFO] Running TestSuite
[ERROR] Tests run: 1, Failures: 1, Errors: 0, Skipped: 0, Time elapsed: 0.396 s <<< FAILURE! - in TestSuite
[ERROR] test001(net.nicoulaj.jmh.profilers.FlightRecorderProfilerTest)  Time elapsed: 0.132 s  <<< FAILURE!
java.lang.AssertionError: 

Expecting:
 <"# JMH version: 1.19
# VM version: JDK 1.8.0_121, VM 25.121-b13
# VM invoker: /usr/lib/jvm/java-8-openjdk-amd64/jre/bin/java
# VM options: <none>
# Warmup: 1 iterations, 1 s each
# Measurement: 3 iterations, 10 ms each
# Timeout: 10 min per iteration
# Threads: 1 thread, will synchronize iterations
# Benchmark mode: Throughput, ops/time
# Benchmark: net.nicoulaj.jmh.profilers.TestBenchmark.benchmark

# Run progress: 0.00% complete, ETA 00:00:02
# Fork: 1 of 2
# Preparing profilers: FlightRecorderProfiler 
Unrecognized VM option 'UnlockCommercialFeatures'
Error: Could not create the Java Virtual Machine.
Error: A fatal exception has occurred. Program will exit.
<forked VM failed with exit code 1>
<stdout last='20 lines'>
</stdout>
<stderr last='20 lines'>
Unrecognized VM option 'UnlockCommercialFeatures'
Error: Could not create the Java Virtual Machine.
Error: A fatal exception has occurred. Program will exit.
</stderr>

# Run complete. Total time: 00:00:00

Benchmark  Mode  Cnt  Score   Error  Units
">
to contain:
 <"# Processing profiler results: FlightRecorderProfiler"> 
	at net.nicoulaj.jmh.profilers.FlightRecorderProfilerTest.test001(FlightRecorderProfilerTest.java:67)

[INFO] 
[INFO] Results:
[INFO] 
[ERROR] Failures: 
[ERROR]   FlightRecorderProfilerTest.test001:67 
Expecting:
 <"# JMH version: 1.19
# VM version: JDK 1.8.0_121, VM 25.121-b13
# VM invoker: /usr/lib/jvm/java-8-openjdk-amd64/jre/bin/java
# VM options: <none>
# Warmup: 1 iterations, 1 s each
# Measurement: 3 iterations, 10 ms each
# Timeout: 10 min per iteration
# Threads: 1 thread, will synchronize iterations
# Benchmark mode: Throughput, ops/time
# Benchmark: net.nicoulaj.jmh.profilers.TestBenchmark.benchmark

# Run progress: 0.00% complete, ETA 00:00:02
# Fork: 1 of 2
# Preparing profilers: FlightRecorderProfiler 
Unrecognized VM option 'UnlockCommercialFeatures'
Error: Could not create the Java Virtual Machine.
Error: A fatal exception has occurred. Program will exit.
<forked VM failed with exit code 1>
<stdout last='20 lines'>
</stdout>
<stderr last='20 lines'>
Unrecognized VM option 'UnlockCommercialFeatures'
Error: Could not create the Java Virtual Machine.
Error: A fatal exception has occurred. Program will exit.
</stderr>

# Run complete. Total time: 00:00:00

Benchmark  Mode  Cnt  Score   Error  Units
">
to contain:
 <"# Processing profiler results: FlightRecorderProfiler"> 
[INFO] 
[ERROR] Tests run: 1, Failures: 1, Errors: 0, Skipped: 0
[INFO] 
[INFO] ------------------------------------------------------------------------
[INFO] Reactor Summary:
[INFO] 
[INFO] JMH utils .......................................... SUCCESS [  0.294 s]
[INFO] JMH utils :: assertions ............................ SUCCESS [  7.117 s]
[INFO] JMH utils :: profilers ............................. SUCCESS [  0.005 s]
[INFO] JMH utils :: profilers :: utils .................... SUCCESS [  0.028 s]
[INFO] JMH utils :: profilers :: Flight Recorder .......... FAILURE [  1.030 s]
[INFO] JMH utils :: profilers :: Solaris Studio ........... SKIPPED
[INFO] JMH utils :: profilers :: Yourkit .................. SKIPPED
[INFO] ------------------------------------------------------------------------
[INFO] BUILD FAILURE
[INFO] ------------------------------------------------------------------------
[INFO] Total time: 8.675 s
[INFO] Finished at: 2018-04-07T12:54:06+02:00
[INFO] Final Memory: 27M/789M
[INFO] ------------------------------------------------------------------------
[ERROR] Failed to execute goal org.apache.maven.plugins:maven-surefire-plugin:2.20.1:test (default-test) on project jmh-profiler-flight-recorder: There are test failures.
[ERROR] 
[ERROR] Please refer to /root/workspace/nicoulaj/jmh-utils/363459646/jmh-profilers/jmh-profiler-flight-recorder/target/surefire-reports for the individual test results.
[ERROR] Please refer to dump files (if any exist) [date]-jvmRun[N].dump, [date].dumpstream and [date]-jvmRun[N].dumpstream.
[ERROR] -> [Help 1]
[ERROR] 
[ERROR] To see the full stack trace of the errors, re-run Maven with the -e switch.
[ERROR] Re-run Maven using the -X switch to enable full debug logging.
[ERROR] 
[ERROR] For more information about the errors and possible solutions, please read the following articles:
[ERROR] [Help 1] http://cwiki.apache.org/confluence/display/MAVEN/MojoFailureException
[ERROR] 
[ERROR] After correcting the problems, you can resume the build with the command
[ERROR]   mvn <goals> -rf :jmh-profiler-flight-recorder
