[INFO] Scanning for projects...
[INFO]                                                                         
[INFO] ------------------------------------------------------------------------
[INFO] Building Java Statistical Analysis Tool 0.1.0-SNAPSHOT
[INFO] ------------------------------------------------------------------------
[INFO] 
[INFO] --- maven-resources-plugin:2.6:resources (default-resources) @ JSAT ---
[INFO] Using 'UTF-8' encoding to copy filtered resources.
[INFO] skip non existing resourceDirectory /root/workspace/EdwardRaff/JSAT/370695834/JSAT/src/main/resources
[INFO] 
[INFO] --- maven-compiler-plugin:3.1:compile (default-compile) @ JSAT ---
[INFO] Nothing to compile - all classes are up to date
[INFO] 
[INFO] --- maven-resources-plugin:2.6:testResources (default-testResources) @ JSAT ---
[INFO] Using 'UTF-8' encoding to copy filtered resources.
[INFO] skip non existing resourceDirectory /root/workspace/EdwardRaff/JSAT/370695834/JSAT/src/test/resources
[INFO] 
[INFO] --- maven-compiler-plugin:3.1:testCompile (default-testCompile) @ JSAT ---
[INFO] Nothing to compile - all classes are up to date
[INFO] 
[INFO] --- maven-surefire-plugin:2.18.1:test (default-test) @ JSAT ---
[INFO] Surefire report directory: /root/workspace/EdwardRaff/JSAT/370695834/JSAT/target/surefire-reports
Downloading: https://repo.maven.apache.org/maven2/org/apache/maven/surefire/surefire-junit4/2.18.1/surefire-junit4-2.18.1.pom
3/3 KB   
3/3 KB   
         
Downloaded: https://repo.maven.apache.org/maven2/org/apache/maven/surefire/surefire-junit4/2.18.1/surefire-junit4-2.18.1.pom (3 KB at 6.1 KB/sec)
Downloading: https://repo.maven.apache.org/maven2/org/apache/maven/surefire/surefire-providers/2.18.1/surefire-providers-2.18.1.pom
3/3 KB   
3/3 KB   
         
Downloaded: https://repo.maven.apache.org/maven2/org/apache/maven/surefire/surefire-providers/2.18.1/surefire-providers-2.18.1.pom (3 KB at 130.8 KB/sec)
Downloading: https://repo.maven.apache.org/maven2/org/apache/maven/surefire/surefire-junit4/2.18.1/surefire-junit4-2.18.1.jar
3/67 KB   
5/67 KB   
8/67 KB   
11/67 KB   
13/67 KB   
16/67 KB   
19/67 KB   
21/67 KB   
24/67 KB   
27/67 KB   
29/67 KB   
32/67 KB   
36/67 KB   
40/67 KB   
44/67 KB   
48/67 KB   
52/67 KB   
56/67 KB   
60/67 KB   
64/67 KB   
67/67 KB   
           
Downloaded: https://repo.maven.apache.org/maven2/org/apache/maven/surefire/surefire-junit4/2.18.1/surefire-junit4-2.18.1.jar (67 KB at 1508.9 KB/sec)

-------------------------------------------------------
 T E S T S
-------------------------------------------------------
Running jsat.distributions.ContinuousDistributionTest
logPdf
cdf
invCdf
mean
variance
skewness
Tests run: 6, Failures: 0, Errors: 0, Skipped: 0, Time elapsed: 1.162 sec - in jsat.distributions.ContinuousDistributionTest
Running jsat.distributions.MaxwellBoltzmannTest
equals
setSigma
max
median
mode
hashCode
pdf
min
pdf
cdf
invCdf
mean
variance
skewness
Tests run: 14, Failures: 0, Errors: 0, Skipped: 0, Time elapsed: 0.002 sec - in jsat.distributions.MaxwellBoltzmannTest
Running jsat.distributions.FisherSendorTest
equals
max
median
mode
hashCode
pdf
min
logPdf
cdf
invCdf
mean
variance
skewness
Tests run: 13, Failures: 0, Errors: 0, Skipped: 0, Time elapsed: 0.002 sec - in jsat.distributions.FisherSendorTest
Running jsat.distributions.LogisticTest
equals
hashCode
Tests run: 2, Failures: 0, Errors: 0, Skipped: 0, Time elapsed: 0.001 sec - in jsat.distributions.LogisticTest
Running jsat.distributions.discrete.PoissonTest
logPmf
pmf
stats
sample
2.0
20.0
40.0
200.0
cdf
Tests run: 5, Failures: 0, Errors: 0, Skipped: 0, Time elapsed: 0.031 sec - in jsat.distributions.discrete.PoissonTest
Running jsat.distributions.discrete.UniformDiscreteTest
logPmf
pmf
stats
sample
cdf
Tests run: 5, Failures: 0, Errors: 0, Skipped: 0, Time elapsed: 0.004 sec - in jsat.distributions.discrete.UniformDiscreteTest
Running jsat.distributions.discrete.ZipfTest
pmf
max
mode
min
cdf
mean
variance
skewness
setCardinality
max
Tests run: 10, Failures: 0, Errors: 0, Skipped: 0, Time elapsed: 1.594 sec - in jsat.distributions.discrete.ZipfTest
Running jsat.distributions.discrete.BinomialTest
logPmf
pmf
stats
sample
cdf
Tests run: 5, Failures: 0, Errors: 0, Skipped: 0, Time elapsed: 0.513 sec - in jsat.distributions.discrete.BinomialTest
Running jsat.distributions.RayleighTest
equals
max
median
mode
hashCode
pdf
min
cdf
invCdf
mean
variance
skewness
setSig
Tests run: 13, Failures: 0, Errors: 0, Skipped: 0, Time elapsed: 0.002 sec - in jsat.distributions.RayleighTest
Running jsat.distributions.ExponentialTest
equals
max
median
mode
hashCode
pdf
min
logPdf
cdf
invCdf
mean
variance
skewness
Tests run: 13, Failures: 0, Errors: 0, Skipped: 0, Time elapsed: 0.002 sec - in jsat.distributions.ExponentialTest
Running jsat.distributions.multivariate.NormalMTest
pdf
logPdf
setCovariance
Tests run: 3, Failures: 0, Errors: 0, Skipped: 0, Time elapsed: 0.015 sec - in jsat.distributions.multivariate.NormalMTest
Running jsat.distributions.multivariate.DirichletTest
pdf
logPdf
setUsingData
Tests run: 3, Failures: 0, Errors: 0, Skipped: 0, Time elapsed: 0.106 sec - in jsat.distributions.multivariate.DirichletTest
Running jsat.distributions.multivariate.SymmetricDirichletTest
pdf
logPdf
setUsingData
clone
Tests run: 4, Failures: 0, Errors: 0, Skipped: 0, Time elapsed: 0.015 sec - in jsat.distributions.multivariate.SymmetricDirichletTest
Running jsat.distributions.empirical.KernelDensityEstimatorTest
equals
hashCode
Tests run: 2, Failures: 0, Errors: 0, Skipped: 0, Time elapsed: 0.015 sec - in jsat.distributions.empirical.KernelDensityEstimatorTest
Running jsat.distributions.GammaTest
equals
hashCode
hashCode
Tests run: 3, Failures: 0, Errors: 0, Skipped: 0, Time elapsed: 0.512 sec - in jsat.distributions.GammaTest
Running jsat.distributions.StudentTTest
equals
hashCode
hashCode
Tests run: 3, Failures: 0, Errors: 0, Skipped: 0, Time elapsed: 0.046 sec - in jsat.distributions.StudentTTest
Running jsat.distributions.NormalTest
cdf
equals
max
median
mode
hashCode
min
invCdf
mean
variance
skewness
cdf
invcdf
pdf
pdf
standardDeviation
setStndDev
setMean
Tests run: 20, Failures: 0, Errors: 0, Skipped: 0, Time elapsed: 0.003 sec - in jsat.distributions.NormalTest
Running jsat.distributions.ParetoTest
equals
hashCode
Tests run: 2, Failures: 0, Errors: 0, Skipped: 0, Time elapsed: 0 sec - in jsat.distributions.ParetoTest
Running jsat.distributions.UniformTest
equals
hashCode
Tests run: 2, Failures: 0, Errors: 0, Skipped: 0, Time elapsed: 0 sec - in jsat.distributions.UniformTest
Running jsat.distributions.LogUniformTest
max
pdf
min
pdf
cdf
invCdf
skewness
Tests run: 7, Failures: 0, Errors: 0, Skipped: 0, Time elapsed: 0.001 sec - in jsat.distributions.LogUniformTest
Running jsat.distributions.KolmogorovTest
equals
hashCode
Tests run: 2, Failures: 0, Errors: 0, Skipped: 0, Time elapsed: 0 sec - in jsat.distributions.KolmogorovTest
Running jsat.distributions.LevyTest
equals
hashCode
Tests run: 2, Failures: 0, Errors: 0, Skipped: 0, Time elapsed: 0 sec - in jsat.distributions.LevyTest
Running jsat.distributions.CauchyTest
equals
max
median
mode
hashCode
pdf
min
cdf
invCdf
mean
variance
skewness
standardDeviation
Tests run: 13, Failures: 0, Errors: 0, Skipped: 0, Time elapsed: 0.002 sec - in jsat.distributions.CauchyTest
Running jsat.distributions.LaplaceTest
equals
hashCode
Tests run: 2, Failures: 0, Errors: 0, Skipped: 0, Time elapsed: 0 sec - in jsat.distributions.LaplaceTest
Running jsat.distributions.TruncatedDistributionTest
max
median
mode
pdf
min
cdf
invCdf
mean
variance
skewness
Tests run: 10, Failures: 0, Errors: 0, Skipped: 0, Time elapsed: 0.001 sec - in jsat.distributions.TruncatedDistributionTest
Running jsat.distributions.KumaraswamyTest
max
median
mode
pdf
min
cdf
mean
variance
skewness
Tests run: 9, Failures: 0, Errors: 0, Skipped: 0, Time elapsed: 0.005 sec - in jsat.distributions.KumaraswamyTest
Running jsat.distributions.LogNormalTest
equals
hashCode
Tests run: 2, Failures: 0, Errors: 0, Skipped: 0, Time elapsed: 0 sec - in jsat.distributions.LogNormalTest
Running jsat.distributions.ChiSquaredTest
equals
hashCode
max
median
mode
hashCode
pdf
min
cdf
invCdf
mean
variance
skewness
Tests run: 13, Failures: 0, Errors: 0, Skipped: 0, Time elapsed: 0.405 sec - in jsat.distributions.ChiSquaredTest
Running jsat.distributions.BetaTest
equals
hashCode
max
median
mode
hashCode
pdf
min
cdf
invCdf
mean
variance
skewness
Tests run: 13, Failures: 0, Errors: 0, Skipped: 0, Time elapsed: 0.811 sec - in jsat.distributions.BetaTest
Running jsat.distributions.WeibullTest
equals
hashCode
Tests run: 2, Failures: 0, Errors: 0, Skipped: 0, Time elapsed: 0 sec - in jsat.distributions.WeibullTest
Running jsat.classifiers.svm.extended.AMMTest
getSubEpochs
trainC
clone
Tests run: 3, Failures: 0, Errors: 0, Skipped: 0, Time elapsed: 0.595 sec - in jsat.classifiers.svm.extended.AMMTest
Running jsat.classifiers.svm.extended.CPMTest
trainC
clone
Tests run: 2, Failures: 0, Errors: 0, Skipped: 0, Time elapsed: 4.437 sec - in jsat.classifiers.svm.extended.CPMTest
Running jsat.classifiers.svm.PlattSMOTest
trainC
train
train
trainC
Tests run: 7, Failures: 0, Errors: 0, Skipped: 0, Time elapsed: 1.591 sec - in jsat.classifiers.svm.PlattSMOTest
Running jsat.classifiers.svm.PegasosKTest
trainC
trainC
Tests run: 2, Failures: 0, Errors: 0, Skipped: 0, Time elapsed: 3.661 sec - in jsat.classifiers.svm.PegasosKTest
Running jsat.classifiers.svm.PegasosTest
trainC
Tests run: 1, Failures: 0, Errors: 0, Skipped: 0, Time elapsed: 0.072 sec - in jsat.classifiers.svm.PegasosTest
Running jsat.classifiers.svm.SBPTest
trainC
trainC
Tests run: 2, Failures: 0, Errors: 0, Skipped: 0, Time elapsed: 0.078 sec - in jsat.classifiers.svm.SBPTest
Running jsat.classifiers.svm.DCSVMTest
trainC
trainC
Tests run: 2, Failures: 0, Errors: 0, Skipped: 0, Time elapsed: 54.39 sec - in jsat.classifiers.svm.DCSVMTest
Running jsat.classifiers.svm.LSSVMTest
trainC
train
train
trainC
Tests run: 6, Failures: 0, Errors: 0, Skipped: 0, Time elapsed: 1.884 sec - in jsat.classifiers.svm.LSSVMTest
Running jsat.classifiers.svm.SVMnoBiasTest
trainC
trainC
Tests run: 2, Failures: 0, Errors: 0, Skipped: 0, Time elapsed: 8.414 sec - in jsat.classifiers.svm.SVMnoBiasTest
Running jsat.classifiers.svm.DCDsTest
trainC
train
train
trainC
Tests run: 6, Failures: 0, Errors: 0, Skipped: 0, Time elapsed: 1.268 sec - in jsat.classifiers.svm.DCDsTest
Running jsat.classifiers.svm.DCDTest
trainC
train
train
trainC
Tests run: 4, Failures: 0, Errors: 0, Skipped: 0, Time elapsed: 0.687 sec - in jsat.classifiers.svm.DCDTest
Running jsat.classifiers.DDAGTest
trainC
trainC
clone
Tests run: 3, Failures: 0, Errors: 0, Skipped: 0, Time elapsed: 0.814 sec - in jsat.classifiers.DDAGTest
Running jsat.classifiers.boosting.StackingTest
binary classifiation
binary classifiation MT
multi class classification MT
regression
regression MT
Tests run: 6, Failures: 1, Errors: 0, Skipped: 0, Time elapsed: 46.341 sec <<< FAILURE! - in jsat.classifiers.boosting.StackingTest
testRegressionMT(jsat.classifiers.boosting.StackingTest)  Time elapsed: 7.279 sec  <<< FAILURE!
java.lang.AssertionError: expected:<0.0> but was:<0.11195841381693959>
	at org.junit.Assert.fail(Assert.java:93)
	at org.junit.Assert.failNotEquals(Assert.java:647)
	at org.junit.Assert.assertEquals(Assert.java:443)
	at org.junit.Assert.assertEquals(Assert.java:512)
	at jsat.classifiers.boosting.StackingTest.testRegressionMT(StackingTest.java:174)

Running jsat.classifiers.boosting.AdaBoostM1Test
trainC
trainC
clone
Tests run: 3, Failures: 0, Errors: 0, Skipped: 0, Time elapsed: 0.428 sec - in jsat.classifiers.boosting.AdaBoostM1Test
Running jsat.classifiers.boosting.LogitBoostPLTest
trainC
trainC
clone
Tests run: 3, Failures: 0, Errors: 0, Skipped: 0, Time elapsed: 1.032 sec - in jsat.classifiers.boosting.LogitBoostPLTest
Running jsat.classifiers.boosting.SAMMETest
trainC
trainC
clone
Tests run: 3, Failures: 0, Errors: 0, Skipped: 0, Time elapsed: 0.584 sec - in jsat.classifiers.boosting.SAMMETest
Running jsat.classifiers.boosting.UpdatableStackingTest
binary classifiation
regression
Tests run: 3, Failures: 0, Errors: 0, Skipped: 0, Time elapsed: 0.118 sec - in jsat.classifiers.boosting.UpdatableStackingTest
Running jsat.classifiers.boosting.ArcX4Test
trainC
trainC
clone
Tests run: 3, Failures: 0, Errors: 0, Skipped: 0, Time elapsed: 0.861 sec - in jsat.classifiers.boosting.ArcX4Test
Running jsat.classifiers.boosting.EmphasisBoostTest
trainC
trainC
clone
Tests run: 3, Failures: 0, Errors: 0, Skipped: 0, Time elapsed: 0.317 sec - in jsat.classifiers.boosting.EmphasisBoostTest
Running jsat.classifiers.boosting.WaggingNormalTest
trainC
trainC
clone
train
train
Tests run: 5, Failures: 0, Errors: 0, Skipped: 0, Time elapsed: 1.717 sec - in jsat.classifiers.boosting.WaggingNormalTest
Running jsat.classifiers.boosting.ModestAdaBoostTest
trainC
trainC
clone
Tests run: 3, Failures: 0, Errors: 0, Skipped: 0, Time elapsed: 0.653 sec - in jsat.classifiers.boosting.ModestAdaBoostTest
Running jsat.classifiers.boosting.BaggingTest
trainC
trainC
clone
train
train
Tests run: 5, Failures: 0, Errors: 0, Skipped: 0, Time elapsed: 3.167 sec - in jsat.classifiers.boosting.BaggingTest
Running jsat.classifiers.boosting.LogitBoostTest
trainC
trainC
clone
Tests run: 3, Failures: 0, Errors: 0, Skipped: 0, Time elapsed: 1.906 sec - in jsat.classifiers.boosting.LogitBoostTest
Running jsat.classifiers.evaluation.AUCTest
getScore
Tests run: 1, Failures: 0, Errors: 0, Skipped: 0, Time elapsed: 0 sec - in jsat.classifiers.evaluation.AUCTest
Running jsat.classifiers.evaluation.AccuracyTest
getScore
Tests run: 1, Failures: 0, Errors: 0, Skipped: 0, Time elapsed: 0 sec - in jsat.classifiers.evaluation.AccuracyTest
Running jsat.classifiers.evaluation.FbetaScoreTest
getScore
Tests run: 1, Failures: 0, Errors: 0, Skipped: 0, Time elapsed: 0 sec - in jsat.classifiers.evaluation.FbetaScoreTest
Running jsat.classifiers.evaluation.MatthewsCorrelationCoefficientTest
getScore
Tests run: 1, Failures: 0, Errors: 0, Skipped: 0, Time elapsed: 0 sec - in jsat.classifiers.evaluation.MatthewsCorrelationCoefficientTest
Running jsat.classifiers.evaluation.KappaTest
getScore
Tests run: 1, Failures: 0, Errors: 0, Skipped: 0, Time elapsed: 0 sec - in jsat.classifiers.evaluation.KappaTest
Running jsat.classifiers.evaluation.RecallTest
getScore
Tests run: 1, Failures: 0, Errors: 0, Skipped: 0, Time elapsed: 0.001 sec - in jsat.classifiers.evaluation.RecallTest
Running jsat.classifiers.evaluation.LogLossTest
getScore
Tests run: 1, Failures: 0, Errors: 0, Skipped: 0, Time elapsed: 0 sec - in jsat.classifiers.evaluation.LogLossTest
Running jsat.classifiers.evaluation.F1ScoreTest
getScore
Tests run: 1, Failures: 0, Errors: 0, Skipped: 0, Time elapsed: 0 sec - in jsat.classifiers.evaluation.F1ScoreTest
Running jsat.classifiers.evaluation.PrecisionTest
getScore
Tests run: 1, Failures: 0, Errors: 0, Skipped: 0, Time elapsed: 0 sec - in jsat.classifiers.evaluation.PrecisionTest
Running jsat.classifiers.trees.MDITest
getImportanceStats
Tests run: 1, Failures: 0, Errors: 0, Skipped: 0, Time elapsed: 8.779 sec - in jsat.classifiers.trees.MDITest
Running jsat.classifiers.trees.RandomForestTest
trainC
trainC
clone
train
train
train
trainC
Tests run: 7, Failures: 0, Errors: 0, Skipped: 0, Time elapsed: 4.721 sec - in jsat.classifiers.trees.RandomForestTest
Running jsat.classifiers.trees.DecisionStumpTest
trainC(ClassificationDataSet, ExecutorService)
trainC(ClassificationDataSet)
clone
trainC(ClassificationDataSet, ExecutorService)
trainC(ClassificationDataSet, ExecutorService)
trainR(RegressionDataSet, ExecutorService)
trainR(RegressionDataSet, ExecutorService)
trainC(List<DataPointPair>, Set<integer>)
supportsWeightedData
testInfoGainSplit
testInfoGainRatioSplit
testGiniSplit
testNumericCBinary
Tests run: 13, Failures: 0, Errors: 0, Skipped: 0, Time elapsed: 0.013 sec - in jsat.classifiers.trees.DecisionStumpTest
Running jsat.classifiers.trees.MDATest
getImportanceStats
getImportanceStatsR
Tests run: 2, Failures: 0, Errors: 0, Skipped: 0, Time elapsed: 2.847 sec - in jsat.classifiers.trees.MDATest
Running jsat.classifiers.trees.ImportanceByUsesTest
getImportanceStats
Tests run: 1, Failures: 0, Errors: 0, Skipped: 0, Time elapsed: 3.356 sec - in jsat.classifiers.trees.ImportanceByUsesTest
Running jsat.classifiers.trees.ERTreesTest
trainC
trainC
clone
train
train
Tests run: 5, Failures: 0, Errors: 0, Skipped: 0, Time elapsed: 29.091 sec - in jsat.classifiers.trees.ERTreesTest
Running jsat.classifiers.trees.DecisionTreeTest
trainC
trainC
clone
train
train
trainC
train
Tests run: 7, Failures: 0, Errors: 0, Skipped: 0, Time elapsed: 12.054 sec - in jsat.classifiers.trees.DecisionTreeTest
Running jsat.classifiers.linear.AROWTest
train_C
Tests run: 1, Failures: 0, Errors: 0, Skipped: 0, Time elapsed: 0.004 sec - in jsat.classifiers.linear.AROWTest
Running jsat.classifiers.linear.StochasticMultinomialLogisticRegressionTest
trainC
clone
Tests run: 2, Failures: 0, Errors: 0, Skipped: 0, Time elapsed: 0.054 sec - in jsat.classifiers.linear.StochasticMultinomialLogisticRegressionTest
Running jsat.classifiers.linear.kernelized.CSKLRBatchTest
trainC
trainC
clone
Serializable
Tests run: 4, Failures: 0, Errors: 0, Skipped: 0, Time elapsed: 3.483 sec - in jsat.classifiers.linear.kernelized.CSKLRBatchTest
Running jsat.classifiers.linear.kernelized.ProjectronTest
trainC
trainC
clone
Tests run: 3, Failures: 0, Errors: 0, Skipped: 0, Time elapsed: 0.047 sec - in jsat.classifiers.linear.kernelized.ProjectronTest
Running jsat.classifiers.linear.kernelized.BOGDTest
trainC
trainC
clone
Tests run: 3, Failures: 0, Errors: 0, Skipped: 0, Time elapsed: 0.047 sec - in jsat.classifiers.linear.kernelized.BOGDTest
Running jsat.classifiers.linear.kernelized.CSKLRTest
trainC
trainC
clone
Tests run: 3, Failures: 0, Errors: 0, Skipped: 0, Time elapsed: 0.135 sec - in jsat.classifiers.linear.kernelized.CSKLRTest
Running jsat.classifiers.linear.kernelized.ForgetronTest
trainC
trainC
clone
Tests run: 3, Failures: 0, Errors: 0, Skipped: 0, Time elapsed: 1.075 sec - in jsat.classifiers.linear.kernelized.ForgetronTest
Running jsat.classifiers.linear.kernelized.ALMA2KTest
trainC
trainC
clone
Tests run: 3, Failures: 0, Errors: 0, Skipped: 0, Time elapsed: 0.07 sec - in jsat.classifiers.linear.kernelized.ALMA2KTest
Running jsat.classifiers.linear.kernelized.DUOLTest
trainC
trainC
clone
Tests run: 3, Failures: 0, Errors: 0, Skipped: 0, Time elapsed: 0.06 sec - in jsat.classifiers.linear.kernelized.DUOLTest
Running jsat.classifiers.linear.kernelized.OSKLTest
trainC
trainC
clone
Tests run: 3, Failures: 0, Errors: 0, Skipped: 0, Time elapsed: 0.116 sec - in jsat.classifiers.linear.kernelized.OSKLTest
Running jsat.classifiers.linear.kernelized.KernelSGDTest
trainC
train
train
trainC
clone
trainC
trainC
Tests run: 7, Failures: 0, Errors: 0, Skipped: 0, Time elapsed: 0.311 sec - in jsat.classifiers.linear.kernelized.KernelSGDTest
Running jsat.classifiers.linear.kernelized.KernelPointTest
getSqrdNorm
dot_KernelPoint
dot_Vec
distance_Vec
distance_KernelPoint
Tests run: 5, Failures: 0, Errors: 0, Skipped: 0, Time elapsed: 0.013 sec - in jsat.classifiers.linear.kernelized.KernelPointTest
Running jsat.classifiers.linear.LinearL1SCDTest
train
trainC
Tests run: 2, Failures: 0, Errors: 0, Skipped: 0, Time elapsed: 0.232 sec - in jsat.classifiers.linear.LinearL1SCDTest
Running jsat.classifiers.linear.ROMMATest
supportsWeightedData
Tests run: 1, Failures: 0, Errors: 0, Skipped: 0, Time elapsed: 0.002 sec - in jsat.classifiers.linear.ROMMATest
Running jsat.classifiers.linear.SDCATest
trainC
trainR
trainC
testScale
train
testWarm
Tests run: 6, Failures: 0, Errors: 0, Skipped: 0, Time elapsed: 8.111 sec - in jsat.classifiers.linear.SDCATest
Running jsat.classifiers.linear.SCDTest
train
trainC
Tests run: 2, Failures: 0, Errors: 0, Skipped: 0, Time elapsed: 0.057 sec - in jsat.classifiers.linear.SCDTest
Running jsat.classifiers.linear.LinearSGDTest
binary classifiation
multi class classification
regression
Tests run: 3, Failures: 0, Errors: 0, Skipped: 0, Time elapsed: 0.165 sec - in jsat.classifiers.linear.LinearSGDTest
Running jsat.classifiers.linear.SMIDASTest
train
trainC
Tests run: 2, Failures: 0, Errors: 0, Skipped: 0, Time elapsed: 0.016 sec - in jsat.classifiers.linear.SMIDASTest
Running jsat.classifiers.linear.BBRTest
trainC
trainC
Tests run: 3, Failures: 0, Errors: 0, Skipped: 0, Time elapsed: 0.168 sec - in jsat.classifiers.linear.BBRTest
Running jsat.classifiers.linear.ALMA2Test
classify
Tests run: 1, Failures: 0, Errors: 0, Skipped: 0, Time elapsed: 0.001 sec - in jsat.classifiers.linear.ALMA2Test
Running jsat.classifiers.linear.NHERDTest
train_C
Tests run: 1, Failures: 0, Errors: 0, Skipped: 0, Time elapsed: 0.007 sec - in jsat.classifiers.linear.NHERDTest
Running jsat.classifiers.linear.LogisticRegressionDCDTest
trainC
trainC
Tests run: 2, Failures: 0, Errors: 0, Skipped: 0, Time elapsed: 0.003 sec - in jsat.classifiers.linear.LogisticRegressionDCDTest
Running jsat.classifiers.linear.STGDTest
train
trainC
Tests run: 2, Failures: 0, Errors: 0, Skipped: 0, Time elapsed: 0.004 sec - in jsat.classifiers.linear.STGDTest
Running jsat.classifiers.linear.SCWTest
TrainC_Full
TrainC_Diag
Tests run: 2, Failures: 0, Errors: 0, Skipped: 0, Time elapsed: 0.005 sec - in jsat.classifiers.linear.SCWTest
Running jsat.classifiers.linear.NewGLMNETTest
train
Tests run: 2, Failures: 0, Errors: 0, Skipped: 0, Time elapsed: 0.346 sec - in jsat.classifiers.linear.NewGLMNETTest
Running jsat.classifiers.linear.LinearBatchTest
binary classifiation
binary classifiation MT
multi class classification
multi class classification MT
regression
regression MT
testTrainWarmCMultieFast
Tests run: 9, Failures: 0, Errors: 0, Skipped: 0, Time elapsed: 4.646 sec - in jsat.classifiers.linear.LinearBatchTest
Running jsat.classifiers.linear.PassiveAggressiveTest
train
trainC
Tests run: 2, Failures: 0, Errors: 0, Skipped: 0, Time elapsed: 0.017 sec - in jsat.classifiers.linear.PassiveAggressiveTest
Running jsat.classifiers.neuralnetwork.PerceptronTest
trainC
trainC
trainCOnline
Tests run: 3, Failures: 0, Errors: 0, Skipped: 0, Time elapsed: 0.011 sec - in jsat.classifiers.neuralnetwork.PerceptronTest
Running jsat.classifiers.neuralnetwork.DReDNetSimpleTest
trainC
trainC
Tests run: 2, Failures: 0, Errors: 0, Skipped: 0, Time elapsed: 4.825 sec - in jsat.classifiers.neuralnetwork.DReDNetSimpleTest
Running jsat.classifiers.neuralnetwork.LVQLLCTest
trainC
trainC
clone
Tests run: 3, Failures: 0, Errors: 0, Skipped: 0, Time elapsed: 0.717 sec - in jsat.classifiers.neuralnetwork.LVQLLCTest
Running jsat.classifiers.neuralnetwork.RBFNetTest
trainC
train
train
trainC
Tests run: 4, Failures: 0, Errors: 0, Skipped: 0, Time elapsed: 1.643 sec - in jsat.classifiers.neuralnetwork.RBFNetTest
Running jsat.classifiers.neuralnetwork.BackPropagationNetTest
trainC
trainC
Tests run: 2, Failures: 0, Errors: 0, Skipped: 0, Time elapsed: 3.775 sec - in jsat.classifiers.neuralnetwork.BackPropagationNetTest
Running jsat.classifiers.neuralnetwork.LVQTest
trainC
trainC
clone
Tests run: 3, Failures: 0, Errors: 0, Skipped: 0, Time elapsed: 0.559 sec - in jsat.classifiers.neuralnetwork.LVQTest
Running jsat.classifiers.neuralnetwork.SOMTest
trainC
trainC
clone
Tests run: 3, Failures: 0, Errors: 0, Skipped: 0, Time elapsed: 8.636 sec - in jsat.classifiers.neuralnetwork.SOMTest
Running jsat.classifiers.OneVSOneTest
trainC
trainC
clone
Tests run: 3, Failures: 0, Errors: 0, Skipped: 0, Time elapsed: 0.692 sec - in jsat.classifiers.OneVSOneTest
Running jsat.classifiers.bayesian.MultivariateNormalsTest
trainC
trainC
clone
Tests run: 3, Failures: 0, Errors: 0, Skipped: 0, Time elapsed: 0.029 sec - in jsat.classifiers.bayesian.MultivariateNormalsTest
Running jsat.classifiers.bayesian.AODETest
trainC
getSubEpochs
trainC
clone
Tests run: 4, Failures: 0, Errors: 0, Skipped: 0, Time elapsed: 3.516 sec - in jsat.classifiers.bayesian.AODETest
Running jsat.classifiers.bayesian.MultinomialNaiveBayesTest
trainC
trainC
clone
Tests run: 3, Failures: 0, Errors: 0, Skipped: 0, Time elapsed: 0.158 sec - in jsat.classifiers.bayesian.MultinomialNaiveBayesTest
Running jsat.classifiers.bayesian.NaiveBayesTest
trainC
trainC
clone
Tests run: 3, Failures: 0, Errors: 0, Skipped: 0, Time elapsed: 0.007 sec - in jsat.classifiers.bayesian.NaiveBayesTest
Running jsat.classifiers.bayesian.NaiveBayesUpdateableTest
trainC
trainC
clone
testSetUpUpdate
Tests run: 4, Failures: 0, Errors: 0, Skipped: 0, Time elapsed: 0.004 sec - in jsat.classifiers.bayesian.NaiveBayesUpdateableTest
Running jsat.classifiers.knn.NearestNeighbourTest
trainC
trainC
clone
train
train
Tests run: 5, Failures: 0, Errors: 0, Skipped: 0, Time elapsed: 0.154 sec - in jsat.classifiers.knn.NearestNeighbourTest
Running jsat.classifiers.knn.LWLTest
trainC
trainC
clone
train
train
Tests run: 5, Failures: 0, Errors: 0, Skipped: 0, Time elapsed: 0.379 sec - in jsat.classifiers.knn.LWLTest
Running jsat.classifiers.knn.DANNTest
trainC
trainC
clone
Tests run: 3, Failures: 0, Errors: 0, Skipped: 0, Time elapsed: 0.024 sec - in jsat.classifiers.knn.DANNTest
Running jsat.classifiers.RocchioTest
trainC
trainC
clone
Tests run: 3, Failures: 0, Errors: 0, Skipped: 0, Time elapsed: 0.182 sec - in jsat.classifiers.RocchioTest
Running jsat.classifiers.OneVSAllTest
trainC
trainC
clone
Tests run: 3, Failures: 0, Errors: 0, Skipped: 0, Time elapsed: 2.84 sec - in jsat.classifiers.OneVSAllTest
Running jsat.classifiers.calibration.IsotonicCalibrationTest
clone
calibrate
Tests run: 2, Failures: 0, Errors: 0, Skipped: 0, Time elapsed: 0.126 sec - in jsat.classifiers.calibration.IsotonicCalibrationTest
Running jsat.classifiers.calibration.PlattCalibrationTest
clone
calibrate
Tests run: 2, Failures: 0, Errors: 0, Skipped: 0, Time elapsed: 0.183 sec - in jsat.classifiers.calibration.PlattCalibrationTest
Running jsat.classifiers.imbalance.SMOTETest
trainC
trainC
Tests run: 2, Failures: 0, Errors: 0, Skipped: 0, Time elapsed: 0.016 sec - in jsat.classifiers.imbalance.SMOTETest
Running jsat.classifiers.imbalance.BorderlineSMOTETest
trainC
trainC
Tests run: 2, Failures: 0, Errors: 0, Skipped: 0, Time elapsed: 0.044 sec - in jsat.classifiers.imbalance.BorderlineSMOTETest
Running jsat.math.optimization.ModifiedOWLQNTest
optimize
optimize
optimize
Tests run: 3, Failures: 0, Errors: 0, Skipped: 0, Time elapsed: 0.042 sec - in jsat.math.optimization.ModifiedOWLQNTest
Running jsat.math.optimization.stochastic.SimpleSGDTest
update
update
Tests run: 2, Failures: 0, Errors: 0, Skipped: 0, Time elapsed: 0.184 sec - in jsat.math.optimization.stochastic.SimpleSGDTest
Running jsat.math.optimization.stochastic.NAdaGradTest
update
update
update
Tests run: 3, Failures: 0, Errors: 0, Skipped: 0, Time elapsed: 0.526 sec - in jsat.math.optimization.stochastic.NAdaGradTest
Running jsat.math.optimization.stochastic.AdaDeltaTest
update
update
Tests run: 2, Failures: 0, Errors: 0, Skipped: 0, Time elapsed: 0.313 sec - in jsat.math.optimization.stochastic.AdaDeltaTest
Running jsat.math.optimization.stochastic.RpropTest
update
update
Tests run: 2, Failures: 0, Errors: 0, Skipped: 0, Time elapsed: 0.068 sec - in jsat.math.optimization.stochastic.RpropTest
Running jsat.math.optimization.stochastic.RMSPropTest
update
update
Tests run: 2, Failures: 0, Errors: 0, Skipped: 0, Time elapsed: 0.327 sec - in jsat.math.optimization.stochastic.RMSPropTest
Running jsat.math.optimization.stochastic.AdamTest
update
update
Tests run: 2, Failures: 0, Errors: 0, Skipped: 0, Time elapsed: 0.871 sec - in jsat.math.optimization.stochastic.AdamTest
Running jsat.math.optimization.stochastic.AdaGradTest
update
update
Tests run: 2, Failures: 0, Errors: 0, Skipped: 0, Time elapsed: 0.257 sec - in jsat.math.optimization.stochastic.AdaGradTest
Running jsat.math.optimization.stochastic.SGDMomentumTest
update
update
Tests run: 2, Failures: 0, Errors: 0, Skipped: 0, Time elapsed: 0.349 sec - in jsat.math.optimization.stochastic.SGDMomentumTest
Running jsat.math.optimization.NelderMeadTest
optimize
Tests run: 1, Failures: 0, Errors: 0, Skipped: 0, Time elapsed: 0 sec - in jsat.math.optimization.NelderMeadTest
Running jsat.math.optimization.LBFGSTest
optimize
Tests run: 1, Failures: 0, Errors: 0, Skipped: 0, Time elapsed: 0.001 sec - in jsat.math.optimization.LBFGSTest
Running jsat.math.optimization.oned.GoldenSearchTest
findMin
Tests run: 1, Failures: 0, Errors: 0, Skipped: 0, Time elapsed: 0 sec - in jsat.math.optimization.oned.GoldenSearchTest
Running jsat.math.optimization.BFGSTest
optimize
Tests run: 1, Failures: 0, Errors: 0, Skipped: 0, Time elapsed: 0 sec - in jsat.math.optimization.BFGSTest
Running jsat.math.rootfinding.SecantTest
root
root
root
root
Tests run: 4, Failures: 0, Errors: 0, Skipped: 0, Time elapsed: 0.001 sec - in jsat.math.rootfinding.SecantTest
Running jsat.math.rootfinding.RiddersMethodTest
root
root
root
root
Tests run: 4, Failures: 0, Errors: 0, Skipped: 0, Time elapsed: 0.001 sec - in jsat.math.rootfinding.RiddersMethodTest
Running jsat.math.rootfinding.ZeroinTest
root
root
root
root
Tests run: 4, Failures: 0, Errors: 0, Skipped: 0, Time elapsed: 0.003 sec - in jsat.math.rootfinding.ZeroinTest
Running jsat.math.rootfinding.BisectionTest
root
root
root
root
Tests run: 4, Failures: 0, Errors: 0, Skipped: 0, Time elapsed: 0.002 sec - in jsat.math.rootfinding.BisectionTest
Running jsat.math.ComplexTest
clone
I
getReal
getImag
mutableAdd
mutableAdd
add
mutableSubtract
mutableSubtract
subtract
cMul
mutableMultiply
mutableMultiply
multiply
cDiv
mutableDivide
mutableDivide
divide
getMagnitude
getArg
mutateConjugate
getConjugate
Tests run: 22, Failures: 0, Errors: 0, Skipped: 0, Time elapsed: 0.002 sec - in jsat.math.ComplexTest
Running jsat.math.MathTricksTest
logSumExp
logSumExp
softmax
softmax
hornerPolyR
hornerPoly
Tests run: 6, Failures: 0, Errors: 0, Skipped: 0, Time elapsed: 0 sec - in jsat.math.MathTricksTest
Running jsat.math.integration.AdaptiveSimpsonTest
integrate
Tests run: 1, Failures: 0, Errors: 0, Skipped: 0, Time elapsed: 0.002 sec - in jsat.math.integration.AdaptiveSimpsonTest
Running jsat.math.SpecialMathTest
zeta
HurwitzZeta
generalized harmonic
digamma
reLnBn
bernoulli
Tests run: 6, Failures: 0, Errors: 0, Skipped: 0, Time elapsed: 0.003 sec - in jsat.math.SpecialMathTest
Running jsat.math.ExponentialMovingStatisticsTest
setSmoothing
setSmoothing Drift
Tests run: 2, Failures: 0, Errors: 0, Skipped: 0, Time elapsed: 1.282 sec - in jsat.math.ExponentialMovingStatisticsTest
Running jsat.math.FunctionTest
forwardDifference
Tests run: 1, Failures: 0, Errors: 0, Skipped: 0, Time elapsed: 0.013 sec - in jsat.math.FunctionTest
Running jsat.math.FastMathTest
digamma
log2
log2_2pd1
log2_c11
pow2
pow2
pow
log
exp
Tests run: 9, Failures: 0, Errors: 0, Skipped: 0, Time elapsed: 0.093 sec - in jsat.math.FastMathTest
Running jsat.math.OnLineStatisticsTest
add(double)
add(double, double)
remove
add
Tests run: 4, Failures: 0, Errors: 0, Skipped: 0, Time elapsed: 0 sec - in jsat.math.OnLineStatisticsTest
Running jsat.datatransform.RemoveAttributeTransformTest
clone
consolidate
transform
Tests run: 3, Failures: 0, Errors: 0, Skipped: 0, Time elapsed: 0.001 sec - in jsat.datatransform.RemoveAttributeTransformTest
Running jsat.datatransform.kernel.NystromTest
trainC
trainC
clone
Tests run: 3, Failures: 0, Errors: 0, Skipped: 0, Time elapsed: 2.53 sec - in jsat.datatransform.kernel.NystromTest
Running jsat.datatransform.kernel.KernelPCATest
trainC
trainC
clone
Tests run: 3, Failures: 0, Errors: 0, Skipped: 0, Time elapsed: 0.453 sec - in jsat.datatransform.kernel.KernelPCATest
Running jsat.datatransform.kernel.RFF_RBFTest
trainC
trainC
clone
Tests run: 3, Failures: 0, Errors: 0, Skipped: 0, Time elapsed: 0.184 sec - in jsat.datatransform.kernel.RFF_RBFTest
Running jsat.datatransform.WhitenedZCATest
testTransform
Tests run: 1, Failures: 0, Errors: 0, Skipped: 0, Time elapsed: 0.004 sec - in jsat.datatransform.WhitenedZCATest
Running jsat.datatransform.featureselection.BDSTest
transformC
transformR
Tests run: 2, Failures: 0, Errors: 0, Skipped: 0, Time elapsed: 0.216 sec - in jsat.datatransform.featureselection.BDSTest
Running jsat.datatransform.featureselection.SBSTest
transformC
transformR
Tests run: 2, Failures: 0, Errors: 0, Skipped: 0, Time elapsed: 0.215 sec - in jsat.datatransform.featureselection.SBSTest
Running jsat.datatransform.featureselection.ReliefFTest
transformC
Tests run: 1, Failures: 0, Errors: 0, Skipped: 0, Time elapsed: 0.009 sec - in jsat.datatransform.featureselection.ReliefFTest
Running jsat.datatransform.featureselection.MutualInfoFSTest
Tests run: 1, Failures: 0, Errors: 0, Skipped: 0, Time elapsed: 0 sec - in jsat.datatransform.featureselection.MutualInfoFSTest
Running jsat.datatransform.featureselection.SFSTest
transform
transformR
Tests run: 2, Failures: 0, Errors: 0, Skipped: 0, Time elapsed: 0.067 sec - in jsat.datatransform.featureselection.SFSTest
Running jsat.datatransform.featureselection.LRSTest
transformC
transformR
Tests run: 2, Failures: 0, Errors: 0, Skipped: 0, Time elapsed: 0.406 sec - in jsat.datatransform.featureselection.LRSTest
Running jsat.datatransform.FastICATest
transform
transform
transform
Tests run: 3, Failures: 0, Errors: 0, Skipped: 0, Time elapsed: 0.02 sec - in jsat.datatransform.FastICATest
Running jsat.datatransform.visualization.TSNETest
transform
Tests run: 1, Failures: 0, Errors: 0, Skipped: 0, Time elapsed: 9.858 sec - in jsat.datatransform.visualization.TSNETest
Running jsat.datatransform.visualization.LargeVizTest
transform
transform
Tests run: 2, Failures: 0, Errors: 0, Skipped: 0, Time elapsed: 3.184 sec - in jsat.datatransform.visualization.LargeVizTest
Running jsat.datatransform.visualization.MDSTest
transform
Tests run: 1, Failures: 0, Errors: 0, Skipped: 0, Time elapsed: 0.302 sec - in jsat.datatransform.visualization.MDSTest
Running jsat.datatransform.visualization.IsomapTest
transform
Tests run: 1, Failures: 0, Errors: 0, Skipped: 0, Time elapsed: 1.695 sec - in jsat.datatransform.visualization.IsomapTest
Running jsat.datatransform.ImputerTest
fit
Tests run: 1, Failures: 0, Errors: 0, Skipped: 0, Time elapsed: 0.166 sec - in jsat.datatransform.ImputerTest
Running jsat.datatransform.WhitenedPCATest
testTransform
Tests run: 1, Failures: 0, Errors: 0, Skipped: 0, Time elapsed: 0 sec - in jsat.datatransform.WhitenedPCATest
Running jsat.datatransform.JLTransformTest
transform
Tests run: 1, Failures: 0, Errors: 0, Skipped: 0, Time elapsed: 0.858 sec - in jsat.datatransform.JLTransformTest
Running jsat.datatransform.PCATest
transform
Tests run: 1, Failures: 0, Errors: 0, Skipped: 0, Time elapsed: 0.005 sec - in jsat.datatransform.PCATest
Running jsat.linear.vectorcollection.lsh.RandomProjectionLSHTest
search
search
Tests run: 2, Failures: 0, Errors: 0, Skipped: 0, Time elapsed: 0.121 sec - in jsat.linear.vectorcollection.lsh.RandomProjectionLSHTest
Running jsat.linear.vectorcollection.lsh.E2LSHTest
searchR
Tests run: 1, Failures: 0, Errors: 0, Skipped: 0, Time elapsed: 0.01 sec - in jsat.linear.vectorcollection.lsh.E2LSHTest
Running jsat.linear.vectorcollection.DualTreeTest
search_radius_dt
search_knn_dt
Tests run: 2, Failures: 1, Errors: 1, Skipped: 0, Time elapsed: 7.696 sec <<< FAILURE! - in jsat.linear.vectorcollection.DualTreeTest
testSearch_Radius_DT(jsat.linear.vectorcollection.DualTreeTest)  Time elapsed: 2.054 sec  <<< FAILURE!
java.lang.AssertionError: expected:<137> but was:<2416>
	at org.junit.Assert.fail(Assert.java:93)
	at org.junit.Assert.failNotEquals(Assert.java:647)
	at org.junit.Assert.assertEquals(Assert.java:128)
	at org.junit.Assert.assertEquals(Assert.java:147)
	at jsat.linear.vectorcollection.DualTreeTest.testSearch_Radius_DT(DualTreeTest.java:146)

testSearch_knn_DT(jsat.linear.vectorcollection.DualTreeTest)  Time elapsed: 5.642 sec  <<< ERROR!
java.lang.NullPointerException: null
	at sun.reflect.NativeConstructorAccessorImpl.newInstance0(Native Method)
	at sun.reflect.NativeConstructorAccessorImpl.newInstance(NativeConstructorAccessorImpl.java:62)
	at sun.reflect.DelegatingConstructorAccessorImpl.newInstance(DelegatingConstructorAccessorImpl.java:45)
	at java.lang.reflect.Constructor.newInstance(Constructor.java:423)
	at java.util.concurrent.ForkJoinTask.getThrowableException(ForkJoinTask.java:598)
	at java.util.concurrent.ForkJoinTask.getException(ForkJoinTask.java:930)
	at java.util.concurrent.ForkJoinTask.invokeAll(ForkJoinTask.java:800)
	at java.util.concurrent.ForkJoinTask.invokeAll(ForkJoinTask.java:827)
	at jsat.linear.vectorcollection.DualTree$DualTreeTraversalAction.compute(DualTree.java:695)
	at java.util.concurrent.RecursiveAction.exec(RecursiveAction.java:189)
	at java.util.concurrent.ForkJoinTask.doExec(ForkJoinTask.java:289)
	at java.util.concurrent.ForkJoinTask.doInvoke(ForkJoinTask.java:401)
	at java.util.concurrent.ForkJoinTask.invokeAll(ForkJoinTask.java:791)
	at java.util.concurrent.ForkJoinTask.invokeAll(ForkJoinTask.java:827)
	at jsat.linear.vectorcollection.DualTree$DualTreeTraversalAction.compute(DualTree.java:695)
	at java.util.concurrent.RecursiveAction.exec(RecursiveAction.java:189)
	at java.util.concurrent.ForkJoinTask.doExec(ForkJoinTask.java:289)
	at java.util.concurrent.ForkJoinTask.externalAwaitDone(ForkJoinTask.java:326)
	at java.util.concurrent.ForkJoinTask.doJoin(ForkJoinTask.java:391)
	at java.util.concurrent.ForkJoinTask.join(ForkJoinTask.java:719)
	at java.util.concurrent.ForkJoinPool.invoke(ForkJoinPool.java:2616)
	at jsat.linear.vectorcollection.DualTree.traverse(DualTree.java:323)
	at jsat.linear.vectorcollection.DualTree.search(DualTree.java:133)
	at jsat.linear.vectorcollection.DualTreeTest.testSearch_knn_DT(DualTreeTest.java:202)
Caused by: java.lang.NullPointerException: null
	at sun.reflect.NativeConstructorAccessorImpl.newInstance0(Native Method)
	at sun.reflect.NativeConstructorAccessorImpl.newInstance(NativeConstructorAccessorImpl.java:62)
	at sun.reflect.DelegatingConstructorAccessorImpl.newInstance(DelegatingConstructorAccessorImpl.java:45)
	at java.lang.reflect.Constructor.newInstance(Constructor.java:423)
	at java.util.concurrent.ForkJoinTask.getThrowableException(ForkJoinTask.java:598)
	at java.util.concurrent.ForkJoinTask.getException(ForkJoinTask.java:930)
	at java.util.concurrent.ForkJoinTask.invokeAll(ForkJoinTask.java:800)
	at java.util.concurrent.ForkJoinTask.invokeAll(ForkJoinTask.java:827)
	at jsat.linear.vectorcollection.DualTree$DualTreeTraversalAction.compute(DualTree.java:695)
	at java.util.concurrent.RecursiveAction.exec(RecursiveAction.java:189)
	at java.util.concurrent.ForkJoinTask.doExec(ForkJoinTask.java:289)
	at java.util.concurrent.ForkJoinTask.doInvoke(ForkJoinTask.java:401)
	at java.util.concurrent.ForkJoinTask.invokeAll(ForkJoinTask.java:791)
	at java.util.concurrent.ForkJoinTask.invokeAll(ForkJoinTask.java:827)
	at jsat.linear.vectorcollection.DualTree$DualTreeTraversalAction.compute(DualTree.java:695)
	at java.util.concurrent.RecursiveAction.exec(RecursiveAction.java:189)
	at java.util.concurrent.ForkJoinTask.doExec(ForkJoinTask.java:289)
	at java.util.concurrent.ForkJoinPool$WorkQueue.runTask(ForkJoinPool.java:1056)
	at java.util.concurrent.ForkJoinPool.runWorker(ForkJoinPool.java:1692)
	at java.util.concurrent.ForkJoinWorkerThread.run(ForkJoinWorkerThread.java:157)
Caused by: java.lang.NullPointerException: null
	at sun.reflect.NativeConstructorAccessorImpl.newInstance0(Native Method)
	at sun.reflect.NativeConstructorAccessorImpl.newInstance(NativeConstructorAccessorImpl.java:62)
	at sun.reflect.DelegatingConstructorAccessorImpl.newInstance(DelegatingConstructorAccessorImpl.java:45)
	at java.lang.reflect.Constructor.newInstance(Constructor.java:423)
	at java.util.concurrent.ForkJoinTask.getThrowableException(ForkJoinTask.java:598)
	at java.util.concurrent.ForkJoinTask.getException(ForkJoinTask.java:930)
	at java.util.concurrent.ForkJoinTask.invokeAll(ForkJoinTask.java:800)
	at java.util.concurrent.ForkJoinTask.invokeAll(ForkJoinTask.java:827)
	at jsat.linear.vectorcollection.DualTree$DualTreeTraversalAction.compute(DualTree.java:695)
	at java.util.concurrent.RecursiveAction.exec(RecursiveAction.java:189)
	at java.util.concurrent.ForkJoinTask.doExec(ForkJoinTask.java:289)
	at java.util.concurrent.ForkJoinTask.doInvoke(ForkJoinTask.java:401)
	at java.util.concurrent.ForkJoinTask.invokeAll(ForkJoinTask.java:791)
	at java.util.concurrent.ForkJoinTask.invokeAll(ForkJoinTask.java:827)
	at jsat.linear.vectorcollection.DualTree$DualTreeTraversalAction.compute(DualTree.java:695)
	at java.util.concurrent.RecursiveAction.exec(RecursiveAction.java:189)
	at java.util.concurrent.ForkJoinTask.doExec(ForkJoinTask.java:289)
	at java.util.concurrent.ForkJoinTask.doInvoke(ForkJoinTask.java:401)
	at java.util.concurrent.ForkJoinTask.invokeAll(ForkJoinTask.java:791)
	at java.util.concurrent.ForkJoinTask.invokeAll(ForkJoinTask.java:827)
	at jsat.linear.vectorcollection.DualTree$DualTreeTraversalAction.compute(DualTree.java:695)
	at java.util.concurrent.RecursiveAction.exec(RecursiveAction.java:189)
	at java.util.concurrent.ForkJoinTask.doExec(ForkJoinTask.java:289)
	at java.util.concurrent.ForkJoinPool$WorkQueue.runTask(ForkJoinPool.java:1056)
	at java.util.concurrent.ForkJoinPool.runWorker(ForkJoinPool.java:1692)
	at java.util.concurrent.ForkJoinWorkerThread.run(ForkJoinWorkerThread.java:157)
Caused by: java.lang.NullPointerException: null
	at sun.reflect.NativeConstructorAccessorImpl.newInstance0(Native Method)
	at sun.reflect.NativeConstructorAccessorImpl.newInstance(NativeConstructorAccessorImpl.java:62)
	at sun.reflect.DelegatingConstructorAccessorImpl.newInstance(DelegatingConstructorAccessorImpl.java:45)
	at java.lang.reflect.Constructor.newInstance(Constructor.java:423)
	at java.util.concurrent.ForkJoinTask.getThrowableException(ForkJoinTask.java:598)
	at java.util.concurrent.ForkJoinTask.getException(ForkJoinTask.java:930)
	at java.util.concurrent.ForkJoinTask.invokeAll(ForkJoinTask.java:800)
	at java.util.concurrent.ForkJoinTask.invokeAll(ForkJoinTask.java:827)
	at jsat.linear.vectorcollection.DualTree$DualTreeTraversalAction.compute(DualTree.java:695)
	at java.util.concurrent.RecursiveAction.exec(RecursiveAction.java:189)
	at java.util.concurrent.ForkJoinTask.doExec(ForkJoinTask.java:289)
	at java.util.concurrent.ForkJoinTask.doInvoke(ForkJoinTask.java:401)
	at java.util.concurrent.ForkJoinTask.invokeAll(ForkJoinTask.java:791)
	at java.util.concurrent.ForkJoinTask.invokeAll(ForkJoinTask.java:827)
	at jsat.linear.vectorcollection.DualTree$DualTreeTraversalAction.compute(DualTree.java:695)
	at java.util.concurrent.RecursiveAction.exec(RecursiveAction.java:189)
	at java.util.concurrent.ForkJoinTask.doExec(ForkJoinTask.java:289)
	at java.util.concurrent.ForkJoinPool$WorkQueue.runTask(ForkJoinPool.java:1056)
	at java.util.concurrent.ForkJoinPool.runWorker(ForkJoinPool.java:1692)
	at java.util.concurrent.ForkJoinWorkerThread.run(ForkJoinWorkerThread.java:157)
Caused by: java.lang.NullPointerException: null
	at jsat.linear.vectorcollection.DualTree.computeKnnBound(DualTree.java:187)
	at jsat.linear.vectorcollection.DualTree.lambda$search$2(DualTree.java:119)
	at jsat.linear.vectorcollection.DualTree$DualTreeTraversalAction.compute(DualTree.java:612)
	at java.util.concurrent.RecursiveAction.exec(RecursiveAction.java:189)
	at java.util.concurrent.ForkJoinTask.doExec(ForkJoinTask.java:289)
	at java.util.concurrent.ForkJoinTask.doJoin(ForkJoinTask.java:389)
	at java.util.concurrent.ForkJoinTask.invokeAll(ForkJoinTask.java:799)
	at java.util.concurrent.ForkJoinTask.invokeAll(ForkJoinTask.java:827)
	at jsat.linear.vectorcollection.DualTree$DualTreeTraversalAction.compute(DualTree.java:695)
	at java.util.concurrent.RecursiveAction.exec(RecursiveAction.java:189)
	at java.util.concurrent.ForkJoinTask.doExec(ForkJoinTask.java:289)
	at java.util.concurrent.ForkJoinTask.doInvoke(ForkJoinTask.java:401)
	at java.util.concurrent.ForkJoinTask.invokeAll(ForkJoinTask.java:791)
	at java.util.concurrent.ForkJoinTask.invokeAll(ForkJoinTask.java:827)
	at jsat.linear.vectorcollection.DualTree$DualTreeTraversalAction.compute(DualTree.java:695)
	at java.util.concurrent.RecursiveAction.exec(RecursiveAction.java:189)
	at java.util.concurrent.ForkJoinTask.doExec(ForkJoinTask.java:289)
	at java.util.concurrent.ForkJoinTask.doInvoke(ForkJoinTask.java:401)
	at java.util.concurrent.ForkJoinTask.invokeAll(ForkJoinTask.java:791)
	at java.util.concurrent.ForkJoinTask.invokeAll(ForkJoinTask.java:827)
	at jsat.linear.vectorcollection.DualTree$DualTreeTraversalAction.compute(DualTree.java:695)
	at java.util.concurrent.RecursiveAction.exec(RecursiveAction.java:189)
	at java.util.concurrent.ForkJoinTask.doExec(ForkJoinTask.java:289)
	at java.util.concurrent.ForkJoinTask.doInvoke(ForkJoinTask.java:401)
	at java.util.concurrent.ForkJoinTask.invokeAll(ForkJoinTask.java:791)
	at java.util.concurrent.ForkJoinTask.invokeAll(ForkJoinTask.java:827)
	at jsat.linear.vectorcollection.DualTree$DualTreeTraversalAction.compute(DualTree.java:695)
	at java.util.concurrent.RecursiveAction.exec(RecursiveAction.java:189)
	at java.util.concurrent.ForkJoinTask.doExec(ForkJoinTask.java:289)
	at java.util.concurrent.ForkJoinTask.doInvoke(ForkJoinTask.java:401)
	at java.util.concurrent.ForkJoinTask.invokeAll(ForkJoinTask.java:791)
	at java.util.concurrent.ForkJoinTask.invokeAll(ForkJoinTask.java:827)
	at jsat.linear.vectorcollection.DualTree$DualTreeTraversalAction.compute(DualTree.java:695)
	at java.util.concurrent.RecursiveAction.exec(RecursiveAction.java:189)
	at java.util.concurrent.ForkJoinTask.doExec(ForkJoinTask.java:289)
	at java.util.concurrent.ForkJoinTask.doInvoke(ForkJoinTask.java:401)
	at java.util.concurrent.ForkJoinTask.invokeAll(ForkJoinTask.java:791)
	at java.util.concurrent.ForkJoinTask.invokeAll(ForkJoinTask.java:827)
	at jsat.linear.vectorcollection.DualTree$DualTreeTraversalAction.compute(DualTree.java:695)
	at java.util.concurrent.RecursiveAction.exec(RecursiveAction.java:189)
	at java.util.concurrent.ForkJoinTask.doExec(ForkJoinTask.java:289)
	at java.util.concurrent.ForkJoinTask.doJoin(ForkJoinTask.java:389)
	at java.util.concurrent.ForkJoinTask.invokeAll(ForkJoinTask.java:799)
	at java.util.concurrent.ForkJoinTask.invokeAll(ForkJoinTask.java:827)
	at jsat.linear.vectorcollection.DualTree$DualTreeTraversalAction.compute(DualTree.java:695)
	at java.util.concurrent.RecursiveAction.exec(RecursiveAction.java:189)
	at java.util.concurrent.ForkJoinTask.doExec(ForkJoinTask.java:289)
	at java.util.concurrent.ForkJoinTask.doInvoke(ForkJoinTask.java:401)
	at java.util.concurrent.ForkJoinTask.invokeAll(ForkJoinTask.java:791)
	at java.util.concurrent.ForkJoinTask.invokeAll(ForkJoinTask.java:827)
	at jsat.linear.vectorcollection.DualTree$DualTreeTraversalAction.compute(DualTree.java:695)
	at java.util.concurrent.RecursiveAction.exec(RecursiveAction.java:189)
	at java.util.concurrent.ForkJoinTask.doExec(ForkJoinTask.java:289)
	at java.util.concurrent.ForkJoinPool$WorkQueue.runTask(ForkJoinPool.java:1056)
	at java.util.concurrent.ForkJoinPool.runWorker(ForkJoinPool.java:1692)
	at java.util.concurrent.ForkJoinWorkerThread.run(ForkJoinWorkerThread.java:157)

Running jsat.linear.vectorcollection.RandomBallCoverTest
search
search
search
Tests run: 3, Failures: 0, Errors: 0, Skipped: 0, Time elapsed: 0.23 sec - in jsat.linear.vectorcollection.RandomBallCoverTest
Running jsat.linear.vectorcollection.KDTreeTest
search
search
search
Tests run: 3, Failures: 0, Errors: 0, Skipped: 0, Time elapsed: 1.855 sec - in jsat.linear.vectorcollection.KDTreeTest
Running jsat.linear.vectorcollection.VPTreeMVTest
search
search
search
Tests run: 3, Failures: 0, Errors: 0, Skipped: 0, Time elapsed: 0.458 sec - in jsat.linear.vectorcollection.VPTreeMVTest
Running jsat.linear.vectorcollection.RTreeTest
search
Tests run: 1, Failures: 0, Errors: 0, Skipped: 0, Time elapsed: 0.037 sec - in jsat.linear.vectorcollection.RTreeTest
Running jsat.linear.vectorcollection.VectorArrayTest
search
search_radius_dt
search_knn_dt
search
Tests run: 4, Failures: 0, Errors: 0, Skipped: 0, Time elapsed: 1.88 sec - in jsat.linear.vectorcollection.VectorArrayTest
Running jsat.linear.vectorcollection.VPTreeTest
search
search
search
Tests run: 3, Failures: 0, Errors: 0, Skipped: 0, Time elapsed: 0.416 sec - in jsat.linear.vectorcollection.VPTreeTest
Running jsat.linear.vectorcollection.BallTreeTest
search
search
search
Tests run: 3, Failures: 0, Errors: 0, Skipped: 0, Time elapsed: 4.643 sec - in jsat.linear.vectorcollection.BallTreeTest
Running jsat.linear.vectorcollection.CoverTreeTest
search
search
search_inc
Tests run: 3, Failures: 0, Errors: 0, Skipped: 0, Time elapsed: 0.216 sec - in jsat.linear.vectorcollection.CoverTreeTest
Running jsat.linear.SubVectorTest
set
clone
length
get
isSparse
getNonZeroIterator
Tests run: 6, Failures: 0, Errors: 0, Skipped: 0, Time elapsed: 0.001 sec - in jsat.linear.SubVectorTest
Running jsat.linear.solvers.ConjugateGradientTest
solve
solve
solveCGNR
solveCGNR
solve
Tests run: 5, Failures: 0, Errors: 0, Skipped: 0, Time elapsed: 0.005 sec - in jsat.linear.solvers.ConjugateGradientTest
Running jsat.linear.distancemetrics.SquaredEuclideanDistanceTest
dist
isSymmetric
metricBound
Tests run: 3, Failures: 0, Errors: 0, Skipped: 0, Time elapsed: 0.006 sec - in jsat.linear.distancemetrics.SquaredEuclideanDistanceTest
Running jsat.linear.distancemetrics.MahalanobisDistanceTest
dist
isSymmetric
metricBound
dist
Tests run: 4, Failures: 0, Errors: 0, Skipped: 0, Time elapsed: 0.017 sec - in jsat.linear.distancemetrics.MahalanobisDistanceTest
Running jsat.linear.distancemetrics.MinkowskiDistanceTest
dist
isSymmetric
metricBound
Tests run: 3, Failures: 0, Errors: 0, Skipped: 0, Time elapsed: 0.003 sec - in jsat.linear.distancemetrics.MinkowskiDistanceTest
Running jsat.linear.distancemetrics.PearsonDistanceTest
correlation
correlation
Tests run: 2, Failures: 0, Errors: 0, Skipped: 0, Time elapsed: 0.001 sec - in jsat.linear.distancemetrics.PearsonDistanceTest
Running jsat.linear.distancemetrics.ChebyshevDistanceTest
dist
isSymmetric
metricBound
Tests run: 3, Failures: 0, Errors: 0, Skipped: 0, Time elapsed: 0 sec - in jsat.linear.distancemetrics.ChebyshevDistanceTest
Running jsat.linear.distancemetrics.ManhattanDistanceTest
dist
isSymmetric
metricBound
Tests run: 3, Failures: 0, Errors: 0, Skipped: 0, Time elapsed: 0 sec - in jsat.linear.distancemetrics.ManhattanDistanceTest
Running jsat.linear.distancemetrics.EuclideanDistanceTest
dist
isSymmetric
metricBound
Tests run: 3, Failures: 0, Errors: 0, Skipped: 0, Time elapsed: 0.001 sec - in jsat.linear.distancemetrics.EuclideanDistanceTest
Running jsat.linear.distancemetrics.CosineDistanceTest
dist
isSymmetric
metricBound
Tests run: 3, Failures: 0, Errors: 0, Skipped: 0, Time elapsed: 0.002 sec - in jsat.linear.distancemetrics.CosineDistanceTest
Running jsat.linear.distancemetrics.WeightedEuclideanDistanceTest
dist
isSymmetric
metricBound
Tests run: 3, Failures: 0, Errors: 0, Skipped: 0, Time elapsed: 0.004 sec - in jsat.linear.distancemetrics.WeightedEuclideanDistanceTest
Running jsat.linear.distancemetrics.JaccardDistanceTest
dist
metricBound
isSymmetric
isSubadditive
isIndiscemible
supportsAcceleration
getAccelerationCache
getAccelerationCache
getQueryInfo
normalized
Tests run: 10, Failures: 0, Errors: 0, Skipped: 0, Time elapsed: 0.002 sec - in jsat.linear.distancemetrics.JaccardDistanceTest
Running jsat.linear.distancemetrics.NormalizedEuclideanDistanceTest
dist
isSymmetric
metricBound
dist
Tests run: 4, Failures: 0, Errors: 0, Skipped: 0, Time elapsed: 0.064 sec - in jsat.linear.distancemetrics.NormalizedEuclideanDistanceTest
Running jsat.linear.QRDecompositionTest
absDet
solve
solve
solve
Tests run: 4, Failures: 0, Errors: 0, Skipped: 0, Time elapsed: 0.005 sec - in jsat.linear.QRDecompositionTest
Running jsat.linear.CholeskyDecompositionTest
Tests run: 5, Failures: 0, Errors: 0, Skipped: 0, Time elapsed: 0.006 sec - in jsat.linear.CholeskyDecompositionTest
Running jsat.linear.MatrixTest
eye
OuterProductUpdate
OuterProductUpdate
random
diag
diagMult
diagMult
isSymmetric
isSymmetric
pascal
Tests run: 10, Failures: 0, Errors: 0, Skipped: 0, Time elapsed: 0.008 sec - in jsat.linear.MatrixTest
Running jsat.linear.ConcatenatedVecTest
set
clone
length
get
isSparse
getNonZeroIterator
mutableAdd
Tests run: 7, Failures: 0, Errors: 0, Skipped: 0, Time elapsed: 0 sec - in jsat.linear.ConcatenatedVecTest
Running jsat.linear.SingularValueDecompositionTest
solve
solve
solve
getSingularValues
getNorm2
getCondition
getRank
getRank
getInverseSingularValues
getInverseSingularValues
getPseudoInverse
getPseudoDet
Tests run: 12, Failures: 0, Errors: 0, Skipped: 0, Time elapsed: 0.013 sec - in jsat.linear.SingularValueDecompositionTest
Running jsat.linear.DenseMatrixTest
swapRows
zeroOut
lup
lup
mutableTranspose
qr
qr
Tests run: 36, Failures: 0, Errors: 0, Skipped: 0, Time elapsed: 0.021 sec - in jsat.linear.DenseMatrixTest
Running jsat.linear.LUPDecompositionTest
solve
solve
solve
isSquare
det
forwardSub
forwardSub
forwardSub
backSub
backSub
backSub
Tests run: 11, Failures: 0, Errors: 0, Skipped: 0, Time elapsed: 0.008 sec - in jsat.linear.LUPDecompositionTest
Running jsat.linear.SparseMatrixTest
set
clone
get
mutableAdd
mutableAdd
multiply
mutableAdd
mutableAdd
multiply
multiply
multiplyTranspose
multiplyTranspose_Executor
0 fin
1 fin
2 fin
3 fin
4 fin
5 fin
6 fin
7 fin
8 fin
9 fin
10 fin
11 fin
12 fin
13 fin
14 fin
15 fin
16 fin
17 fin
18 fin
19 fin
20 fin
21 fin
22 fin
23 fin
24 fin
25 fin
26 fin
27 fin
28 fin
29 fin
30 fin
31 fin
transposeMultiply
transposeMultiply
getRowView
increment
mutableMultiply
mutableMultiply
transpose
rows
cols
isSparce
mutableAdd
swapRows
zeroOut
mutableTranspose
transposeMultiply
changeSize
Tests run: 28, Failures: 0, Errors: 0, Skipped: 0, Time elapsed: 0.016 sec - in jsat.linear.SparseMatrixTest
Running jsat.linear.MatrixStatisticsTest
Tests run: 1, Failures: 0, Errors: 0, Skipped: 0, Time elapsed: 15.193 sec - in jsat.linear.MatrixStatisticsTest
Running jsat.linear.HessenbergFormTest
hess
hess
Tests run: 2, Failures: 0, Errors: 0, Skipped: 0, Time elapsed: 0.005 sec - in jsat.linear.HessenbergFormTest
Running jsat.linear.ShiftedVecTest
set
max
median
min
mean
variance
standardDeviation
clone
length
get
isSparse
getNonZeroIterator
mutableAdd
increment
setShift
embedShift
mutableAdd
mutableAdd
mutableDivide
mutableMultiply
mutablePairwiseDivide
mutablePairwiseMultiply
dot
pNorm
kurtosis
zeroOut
Tests run: 26, Failures: 0, Errors: 0, Skipped: 0, Time elapsed: 0.006 sec - in jsat.linear.ShiftedVecTest
Running jsat.linear.GenericMatrixTest
swapRows
zeroOut
lup
lup
mutableTranspose
qr
qr
Tests run: 37, Failures: 0, Errors: 0, Skipped: 0, Time elapsed: 0.033 sec - in jsat.linear.GenericMatrixTest
Running jsat.linear.SparseVectorTest
set
max
median
hashCode
min
variance
skewness
clone
multiply
length
get
isSparse
getNonZeroIterator
mutableAdd
increment
equals
equals
arrayCopy
applyFunction
applyIndexFunction
mutableAdd
mutableDivide
mutableMultiply
mutablePairwiseDivide
mutablePairwiseMultiply
dot
pNorm
kurtosis
setLength
sortedCopy
sum
pNormDist
normalize
nnz
zeroOut
Tests run: 35, Failures: 0, Errors: 0, Skipped: 0, Time elapsed: 0.006 sec - in jsat.linear.SparseVectorTest
Running jsat.linear.VecWithNormTest
set
clone
length
get
mutableAdd
mutableAdd
mutableDivide
mutableMultiply
mutablePairwiseMultiply
nnz
zeroOut
Tests run: 11, Failures: 0, Errors: 0, Skipped: 0, Time elapsed: 0 sec - in jsat.linear.VecWithNormTest
Running jsat.linear.MatrixOfVecsTest
swapRows
zeroOut
lup
lup
mutableTranspose
qr
qr
Tests run: 36, Failures: 0, Errors: 0, Skipped: 0, Time elapsed: 0.024 sec - in jsat.linear.MatrixOfVecsTest
Running jsat.linear.EigenvalueDecompositionTest
testImageEigen5
testRealEigen3
testPascal5
testSymmetric70
testRealRandomGenerated
testRealRandomGeneratedLarge
testNonSquare
Tests run: 7, Failures: 0, Errors: 0, Skipped: 0, Time elapsed: 0.117 sec - in jsat.linear.EigenvalueDecompositionTest
Running jsat.linear.Poly2VecTest
set
clone
length
get
isSparse
getNonZeroIterator
nnz
Tests run: 7, Failures: 0, Errors: 0, Skipped: 0, Time elapsed: 0.003 sec - in jsat.linear.Poly2VecTest
Running jsat.regression.evaluation.CoefficientOfDeterminationTest
getScore
Tests run: 1, Failures: 0, Errors: 0, Skipped: 0, Time elapsed: 0.006 sec - in jsat.regression.evaluation.CoefficientOfDeterminationTest
Running jsat.regression.evaluation.MeanAbsoluteErrorTest
getScore
Tests run: 1, Failures: 0, Errors: 0, Skipped: 0, Time elapsed: 0 sec - in jsat.regression.evaluation.MeanAbsoluteErrorTest
Running jsat.regression.evaluation.RelativeAbsoluteErrorTest
getScore
Tests run: 1, Failures: 0, Errors: 0, Skipped: 0, Time elapsed: 0 sec - in jsat.regression.evaluation.RelativeAbsoluteErrorTest
Running jsat.regression.evaluation.MeanSquaredErrorTest
getScore
Tests run: 1, Failures: 0, Errors: 0, Skipped: 0, Time elapsed: 0 sec - in jsat.regression.evaluation.MeanSquaredErrorTest
Running jsat.regression.evaluation.RelativeSquaredErrorTest
getScore
Tests run: 1, Failures: 0, Errors: 0, Skipped: 0, Time elapsed: 0 sec - in jsat.regression.evaluation.RelativeSquaredErrorTest
Running jsat.regression.StochasticGradientBoostingTest
clone
train
train
Tests run: 3, Failures: 0, Errors: 0, Skipped: 0, Time elapsed: 1.066 sec - in jsat.regression.StochasticGradientBoostingTest
Running jsat.regression.OrdinaryKrigingTest
clone
train
train
Tests run: 3, Failures: 0, Errors: 0, Skipped: 0, Time elapsed: 0.526 sec - in jsat.regression.OrdinaryKrigingTest
Running jsat.regression.KernelRidgeRegressionTest
clone
train
train
Tests run: 3, Failures: 0, Errors: 0, Skipped: 0, Time elapsed: 0.169 sec - in jsat.regression.KernelRidgeRegressionTest
Running jsat.regression.RANSACTest
clone
train
train
Tests run: 3, Failures: 0, Errors: 0, Skipped: 0, Time elapsed: 0.088 sec - in jsat.regression.RANSACTest
Running jsat.regression.RidgeRegressionTest
train
train
Tests run: 2, Failures: 0, Errors: 0, Skipped: 0, Time elapsed: 0.013 sec - in jsat.regression.RidgeRegressionTest
Running jsat.regression.KernelRLSTest
clone
train
train
Tests run: 3, Failures: 0, Errors: 0, Skipped: 0, Time elapsed: 0.008 sec - in jsat.regression.KernelRLSTest
Running jsat.regression.NadarayaWatsonTest
clone
train
train
Tests run: 3, Failures: 0, Errors: 0, Skipped: 0, Time elapsed: 0.582 sec - in jsat.regression.NadarayaWatsonTest
Running jsat.regression.StochasticRidgeRegressionTest
clone
train
train
Tests run: 3, Failures: 0, Errors: 0, Skipped: 0, Time elapsed: 2.884 sec - in jsat.regression.StochasticRidgeRegressionTest
Running jsat.regression.AveragedRegressorTest
clone
train
train
Tests run: 3, Failures: 0, Errors: 0, Skipped: 0, Time elapsed: 0.02 sec - in jsat.regression.AveragedRegressorTest
Running jsat.clustering.FLAMETest
cluster(dataset)
cluster(dataset, ExecutorService)
Tests run: 2, Failures: 0, Errors: 0, Skipped: 0, Time elapsed: 4.51 sec - in jsat.clustering.FLAMETest
Running jsat.clustering.kmeans.MiniBatchKMeansTest
cluster
cluster
Tests run: 2, Failures: 0, Errors: 0, Skipped: 0, Time elapsed: 0.292 sec - in jsat.clustering.kmeans.MiniBatchKMeansTest
Running jsat.clustering.kmeans.GMeansTest
cluster findK
cluster findK
Tests run: 2, Failures: 0, Errors: 0, Skipped: 0, Time elapsed: 0.142 sec - in jsat.clustering.kmeans.GMeansTest
Running jsat.clustering.kmeans.XMeansTest
cluster findK
cluster findK
Tests run: 2, Failures: 0, Errors: 0, Skipped: 0, Time elapsed: 0.239 sec - in jsat.clustering.kmeans.XMeansTest
Running jsat.clustering.kmeans.HamerlyKMeansTest
cluster
cluster
cluster(dataset, int, threadpool)
Tests run: 3, Failures: 0, Errors: 0, Skipped: 0, Time elapsed: 0.073 sec - in jsat.clustering.kmeans.HamerlyKMeansTest
Running jsat.clustering.kmeans.ElkanKernelKMeansTest
cluster(dataset, int, threadpool)
cluster
cluster
Tests run: 3, Failures: 0, Errors: 0, Skipped: 0, Time elapsed: 0.808 sec - in jsat.clustering.kmeans.ElkanKernelKMeansTest
Running jsat.clustering.kmeans.KMeansPDNTest
cluster findK
cluster findK
Tests run: 2, Failures: 0, Errors: 0, Skipped: 0, Time elapsed: 1.13 sec - in jsat.clustering.kmeans.KMeansPDNTest
Running jsat.clustering.kmeans.NaiveKMeansTest
cluster
cluster
cluster(dataset, int, threadpool)
Tests run: 3, Failures: 0, Errors: 0, Skipped: 0, Time elapsed: 0.101 sec - in jsat.clustering.kmeans.NaiveKMeansTest
Running jsat.clustering.kmeans.LloydKernelKMeansTest
cluster(dataset, int, threadpool)
cluster
cluster
Tests run: 3, Failures: 0, Errors: 0, Skipped: 0, Time elapsed: 0.377 sec - in jsat.clustering.kmeans.LloydKernelKMeansTest
Running jsat.clustering.kmeans.ElkanKMeansTest
cluster(dataset, int, threadpool)
cluster(dataset, int)
cluster(dataset, int, threadpool)
Tests run: 3, Failures: 0, Errors: 0, Skipped: 0, Time elapsed: 0.187 sec - in jsat.clustering.kmeans.ElkanKMeansTest
Running jsat.clustering.MEDDITTest
cluster(dataSet, int, ExecutorService)
cluster(dataset, int)
cluster(dataset, int)
Tests run: 3, Failures: 0, Errors: 0, Skipped: 0, Time elapsed: 19.993 sec - in jsat.clustering.MEDDITTest
Running jsat.clustering.EMGaussianMixtureTest
cluster(dataset, int, threadpool)
Tests run: 1, Failures: 0, Errors: 0, Skipped: 0, Time elapsed: 0.071 sec - in jsat.clustering.EMGaussianMixtureTest
Running jsat.clustering.hierarchical.NNChainHACTest
cluster(dataset)
cluster(dataset, ExecutorService)
cluster(dataset, int, int)
cluster(dataset, int, int, ExecutorService)
cluster(dataset, int, ExecutorService)
cluster(dataset, int)
Tests run: 6, Failures: 0, Errors: 0, Skipped: 0, Time elapsed: 13.125 sec - in jsat.clustering.hierarchical.NNChainHACTest
Running jsat.clustering.hierarchical.DivisiveGlobalClustererTest
cluster(dataset)
cluster(dataset, ExecutorService)
cluster(dataset, int, int)
cluster(dataset, int, int, ExecutorService)
cluster(dataset, int, ExecutorService)
cluster(dataset, int)
Tests run: 6, Failures: 0, Errors: 0, Skipped: 0, Time elapsed: 0.688 sec - in jsat.clustering.hierarchical.DivisiveGlobalClustererTest
Running jsat.clustering.hierarchical.PriorityHACTest
cluster(dataset)
cluster(dataset, ExecutorService)
cluster(dataset, int, int)
cluster(dataset, int, int, ExecutorService)
cluster(dataset, int, ExecutorService)
cluster(dataset, int)
Tests run: 6, Failures: 0, Errors: 0, Skipped: 0, Time elapsed: 0.712 sec - in jsat.clustering.hierarchical.PriorityHACTest
Running jsat.clustering.hierarchical.SimpleHACTest
cluster(dataset)
cluster(dataset, ExecutorService)
cluster(dataset, int, int)
cluster(dataset, int, int, ExecutorService)
cluster(dataset, int, ExecutorService)
cluster(dataset, int)
Tests run: 6, Failures: 0, Errors: 0, Skipped: 0, Time elapsed: 5.33 sec - in jsat.clustering.hierarchical.SimpleHACTest
Running jsat.clustering.hierarchical.DivisiveLocalClustererTest
cluster(dataset, int, ExecutorService)
cluster(dataset, int)
Tests run: 2, Failures: 0, Errors: 0, Skipped: 0, Time elapsed: 0.656 sec - in jsat.clustering.hierarchical.DivisiveLocalClustererTest
Running jsat.clustering.MeanShiftTest
cluster(dataset)
cluster(dataset, ExecutorService)
Tests run: 2, Failures: 0, Errors: 0, Skipped: 0, Time elapsed: 0.614 sec - in jsat.clustering.MeanShiftTest
Running jsat.clustering.CLARATest
cluster(dataset, int, ExecutorService)
cluster(dataset, int, ExecutorService)
cluster(dataset, int)
Tests run: 3, Failures: 1, Errors: 0, Skipped: 0, Time elapsed: 1.272 sec <<< FAILURE! - in jsat.clustering.CLARATest
testCluster_DataSet_int(jsat.clustering.CLARATest)  Time elapsed: 0.012 sec  <<< FAILURE!
java.lang.AssertionError: expected:<1> but was:<4>
	at org.junit.Assert.fail(Assert.java:93)
	at org.junit.Assert.failNotEquals(Assert.java:647)
	at org.junit.Assert.assertEquals(Assert.java:128)
	at org.junit.Assert.assertEquals(Assert.java:472)
	at org.junit.Assert.assertEquals(Assert.java:456)
	at jsat.clustering.CLARATest.testCluster_DataSet_int(CLARATest.java:70)

Running jsat.clustering.evaluation.NormalizedMutualInformationTest
evaluate
Tests run: 1, Failures: 0, Errors: 0, Skipped: 0, Time elapsed: 0.007 sec - in jsat.clustering.evaluation.NormalizedMutualInformationTest
Running jsat.clustering.evaluation.intra.SumOfSqrdPairwiseDistancesTest
evaluate
evaluate
Tests run: 2, Failures: 0, Errors: 0, Skipped: 0, Time elapsed: 0.001 sec - in jsat.clustering.evaluation.intra.SumOfSqrdPairwiseDistancesTest
Running jsat.clustering.evaluation.AdjustedRandIndexTest
evaluate
Tests run: 1, Failures: 0, Errors: 0, Skipped: 0, Time elapsed: 0.001 sec - in jsat.clustering.evaluation.AdjustedRandIndexTest
Running jsat.clustering.PAMTest
cluster(dataSet, int, ExecutorService)
cluster(dataset, int)
Tests run: 2, Failures: 0, Errors: 0, Skipped: 0, Time elapsed: 0.282 sec - in jsat.clustering.PAMTest
Running jsat.clustering.TRIKMEDSTest
cluster(dataSet, int, ExecutorService)
cluster(dataset, int)
cluster(dataset, int)
cluster(dataset, int)
Tests run: 4, Failures: 0, Errors: 0, Skipped: 0, Time elapsed: 0.697 sec - in jsat.clustering.TRIKMEDSTest
Running jsat.clustering.GapStatisticTest
cluster findK
Tests run: 1, Failures: 0, Errors: 0, Skipped: 0, Time elapsed: 29.942 sec - in jsat.clustering.GapStatisticTest
Running jsat.clustering.LSDBCTest
cluster(dataset)
cluster(dataset, ExecutorService)
Tests run: 2, Failures: 0, Errors: 0, Skipped: 0, Time elapsed: 0.025 sec - in jsat.clustering.LSDBCTest
Running jsat.clustering.DBSCANTest
cluster(dataset)
cluster(dataset, double, int)
cluster(dataset, executorService)
cluster(dataset, double, int, executorService)
cluster(dataset, int)
cluster(dataset, int, executorService)
Tests run: 6, Failures: 0, Errors: 0, Skipped: 0, Time elapsed: 0.107 sec - in jsat.clustering.DBSCANTest
Running jsat.clustering.OPTICSTest
cluster(dataset)
cluster(dataset, ExecutorService)
Tests run: 2, Failures: 0, Errors: 0, Skipped: 0, Time elapsed: 0.117 sec - in jsat.clustering.OPTICSTest
Running jsat.clustering.HDBSCANTest
cluster(dataset)
cluster(dataset, executorService)
Tests run: 2, Failures: 0, Errors: 0, Skipped: 0, Time elapsed: 0.066 sec - in jsat.clustering.HDBSCANTest
Running jsat.text.stemming.LovinsStemmerTest
stem
Tests run: 1, Failures: 0, Errors: 0, Skipped: 0, Time elapsed: 0.017 sec - in jsat.text.stemming.LovinsStemmerTest
Running jsat.text.stemming.PaiceHuskStemmerTest
stem
Tests run: 1, Failures: 0, Errors: 0, Skipped: 0, Time elapsed: 0.002 sec - in jsat.text.stemming.PaiceHuskStemmerTest
Running jsat.text.stemming.PorterStemmerTest
stem
Tests run: 1, Failures: 0, Errors: 0, Skipped: 0, Time elapsed: 0.002 sec - in jsat.text.stemming.PorterStemmerTest
Running jsat.text.tokenizer.NGramTokenizerTest
tokenize
Tests run: 1, Failures: 0, Errors: 0, Skipped: 0, Time elapsed: 0 sec - in jsat.text.tokenizer.NGramTokenizerTest
Running jsat.text.topicmodel.OnlineLDAsviTest
model
Tests run: 1, Failures: 0, Errors: 0, Skipped: 0, Time elapsed: 11.751 sec - in jsat.text.topicmodel.OnlineLDAsviTest
Running jsat.parameters.GridSearchTest
setUseWarmStarts
setUseWarmStarts
setUseWarmStarts
setUseWarmStarts
classificationAutoAdd
setUseWarmStarts
setUseWarmStarts
setUseWarmStarts
setUseWarmStarts
Tests run: 9, Failures: 0, Errors: 0, Skipped: 0, Time elapsed: 0.315 sec - in jsat.parameters.GridSearchTest
Running jsat.parameters.RandomSearchTest
testRegression
testClassificationEx
testClassification
testClassificationAutoAdd
testRegressionEx
Tests run: 5, Failures: 0, Errors: 0, Skipped: 0, Time elapsed: 1.029 sec - in jsat.parameters.RandomSearchTest
Running jsat.utils.IntDoubleMapArrayTest
increment
put
remove
remove
containsKey
containsKey
put
Tests run: 7, Failures: 0, Errors: 0, Skipped: 0, Time elapsed: 0.046 sec - in jsat.utils.IntDoubleMapArrayTest
Running jsat.utils.IntPriorityQueueTest
Tests run: 3, Failures: 0, Errors: 0, Skipped: 0, Time elapsed: 0.003 sec - in jsat.utils.IntPriorityQueueTest
Running jsat.utils.StringUtilsTest
parseInt
parseDouble
Tests run: 2, Failures: 0, Errors: 0, Skipped: 0, Time elapsed: 0.335 sec - in jsat.utils.StringUtilsTest
Running jsat.utils.IndexTableTest
swap
Tests run: 7, Failures: 0, Errors: 0, Skipped: 0, Time elapsed: 0 sec - in jsat.utils.IndexTableTest
Running jsat.utils.SimpleListTest
set
add
get
size
Tests run: 4, Failures: 0, Errors: 0, Skipped: 0, Time elapsed: 0 sec - in jsat.utils.SimpleListTest
Running jsat.utils.ListUtilsTest
splitList
swap
Tests run: 2, Failures: 0, Errors: 0, Skipped: 0, Time elapsed: 0 sec - in jsat.utils.ListUtilsTest
Running jsat.utils.QuickSortTest
sort
sort
sort
Tests run: 3, Failures: 0, Errors: 0, Skipped: 0, Time elapsed: 0.032 sec - in jsat.utils.QuickSortTest
Running jsat.utils.FibHeapTest
testRandp,
union
getMinKey
decreaseKey
Tests run: 4, Failures: 0, Errors: 0, Skipped: 0, Time elapsed: 0.428 sec - in jsat.utils.FibHeapTest
Running jsat.utils.IntSortedSetTest
add
iterator
subset
size
Tests run: 4, Failures: 0, Errors: 0, Skipped: 0, Time elapsed: 0.012 sec - in jsat.utils.IntSortedSetTest
Running jsat.utils.IntListTest
clear
Tests run: 1, Failures: 0, Errors: 0, Skipped: 0, Time elapsed: 0.002 sec - in jsat.utils.IntListTest
Running jsat.utils.LongListTest
clear
Tests run: 1, Failures: 0, Errors: 0, Skipped: 0, Time elapsed: 0.004 sec - in jsat.utils.LongListTest
Running jsat.utils.IntDoubleMapTest
increment
put
remove
remove
containsKey
containsKey
put
Tests run: 7, Failures: 0, Errors: 0, Skipped: 0, Time elapsed: 0.04 sec - in jsat.utils.IntDoubleMapTest
Running jsat.utils.IntSetFixedSizeTest
iterator
size
add
add
contains
contains
Tests run: 6, Failures: 0, Errors: 0, Skipped: 0, Time elapsed: 0.001 sec - in jsat.utils.IntSetFixedSizeTest
Running jsat.utils.LongDoubleMapTest
increment
remove
containsKey
put
containsKey
put
remove
Tests run: 7, Failures: 0, Errors: 0, Skipped: 0, Time elapsed: 0.452 sec - in jsat.utils.LongDoubleMapTest
Running jsat.utils.IntSetTest
add
iterator
size
Tests run: 3, Failures: 0, Errors: 0, Skipped: 0, Time elapsed: 0 sec - in jsat.utils.IntSetTest
Running jsat.io.JSATDataTest
ReadWriteSimple
ReadWriteSimple
ReadWriteClassification
ReadWriteRegression
Tests run: 4, Failures: 0, Errors: 0, Skipped: 0, Time elapsed: 0.131 sec - in jsat.io.JSATDataTest
Running jsat.io.LIBSVMLoaderTest
loadR
Tests run: 1, Failures: 0, Errors: 0, Skipped: 0, Time elapsed: 0.435 sec - in jsat.io.LIBSVMLoaderTest
Running jsat.io.CSVTest
read (numeric only features)
read
Tests run: 3, Failures: 0, Errors: 0, Skipped: 0, Time elapsed: 0.285 sec - in jsat.io.CSVTest
Running jsat.outlire.IsolationForestTest
fit
Tests run: 1, Failures: 0, Errors: 0, Skipped: 0, Time elapsed: 0.847 sec - in jsat.outlire.IsolationForestTest
Running jsat.outlire.LinearOCSVMTest
fit
Tests run: 1, Failures: 0, Errors: 0, Skipped: 0, Time elapsed: 11.846 sec - in jsat.outlire.LinearOCSVMTest
Running jsat.driftdetectors.ADWINTest
addSample
Tests run: 1, Failures: 0, Errors: 0, Skipped: 0, Time elapsed: 0.014 sec - in jsat.driftdetectors.ADWINTest
Running jsat.driftdetectors.DDMTest
addSample
Tests run: 1, Failures: 0, Errors: 0, Skipped: 0, Time elapsed: 0 sec - in jsat.driftdetectors.DDMTest

Results :

Failed tests: 
  StackingTest.testRegressionMT:174 expected:<0.0> but was:<0.11195841381693959>
  CLARATest.testCluster_DataSet_int:70 expected:<1> but was:<4>
  DualTreeTest.testSearch_Radius_DT:146 expected:<137> but was:<2416>
Tests in error: 
  DualTreeTest.testSearch_knn_DT:202  NullPointer

Tests run: 1162, Failures: 3, Errors: 1, Skipped: 0

[INFO] ------------------------------------------------------------------------
[INFO] BUILD FAILURE
[INFO] ------------------------------------------------------------------------
[INFO] Total time: 07:04 min
[INFO] Finished at: 2018-04-24T20:20:09+02:00
[INFO] Final Memory: 20M/895M
[INFO] ------------------------------------------------------------------------
[ERROR] Failed to execute goal org.apache.maven.plugins:maven-surefire-plugin:2.18.1:test (default-test) on project JSAT: There are test failures.
[ERROR] 
[ERROR] Please refer to /root/workspace/EdwardRaff/JSAT/370695834/JSAT/target/surefire-reports for the individual test results.
[ERROR] -> [Help 1]
[ERROR] 
[ERROR] To see the full stack trace of the errors, re-run Maven with the -e switch.
[ERROR] Re-run Maven using the -X switch to enable full debug logging.
[ERROR] 
[ERROR] For more information about the errors and possible solutions, please read the following articles:
[ERROR] [Help 1] http://cwiki.apache.org/confluence/display/MAVEN/MojoFailureException
