[INFO] Scanning for projects...
[WARNING] 
[WARNING] Some problems were encountered while building the effective model for com.softserve.academy:Spaced.Repetition:jar:1.0-SNAPSHOT
[WARNING] 'dependencies.dependency.(groupId:artifactId:type:classifier)' must be unique: org.springframework.boot:spring-boot-starter-test:jar -> duplicate declaration of version (?) @ line 144, column 21
[WARNING] 'dependencies.dependency.(groupId:artifactId:type:classifier)' must be unique: com.jayway.jsonpath:json-path:jar -> version (?) vs 2.4.0 @ line 173, column 21
[WARNING] 
[WARNING] It is highly recommended to fix these problems because they threaten the stability of your build.
[WARNING] 
[WARNING] For this reason, future Maven versions might no longer support building such malformed projects.
[WARNING] 
[INFO]                                                                         
[INFO] ------------------------------------------------------------------------
[INFO] Building Spaced.Repetition 1.0-SNAPSHOT
[INFO] ------------------------------------------------------------------------
[INFO] 
[INFO] --- maven-resources-plugin:2.6:resources (default-resources) @ Spaced.Repetition ---
[INFO] Using 'UTF-8' encoding to copy filtered resources.
[INFO] Copying 1 resource
[INFO] Copying 35 resources
[INFO] 
[INFO] --- maven-compiler-plugin:3.1:compile (default-compile) @ Spaced.Repetition ---
[INFO] Nothing to compile - all classes are up to date
[INFO] 
[INFO] --- maven-resources-plugin:2.6:testResources (default-testResources) @ Spaced.Repetition ---
[INFO] Using 'UTF-8' encoding to copy filtered resources.
[INFO] Copying 1 resource
[INFO] 
[INFO] --- maven-compiler-plugin:3.1:testCompile (default-testCompile) @ Spaced.Repetition ---
[INFO] Changes detected - recompiling the module!
[INFO] Compiling 30 source files to /root/workspace/koldovsky/orlp-server/331792512/target/test-classes
[WARNING] /root/workspace/koldovsky/orlp-server/331792512/src/test/java/com/softserve/academy/spaced/repetition/service/CourseServiceImplTest.java: Some input files use unchecked or unsafe operations.
[WARNING] /root/workspace/koldovsky/orlp-server/331792512/src/test/java/com/softserve/academy/spaced/repetition/service/CourseServiceImplTest.java: Recompile with -Xlint:unchecked for details.
[INFO] 
[INFO] --- maven-surefire-plugin:2.18.1:test (default-test) @ Spaced.Repetition ---
[INFO] Surefire report directory: /root/workspace/koldovsky/orlp-server/331792512/target/surefire-reports
[INFO] Downloading: https://repo.spring.io/libs-release/org/apache/maven/surefire/surefire-junit4/2.18.1/surefire-junit4-2.18.1.pom
[INFO] Downloaded: https://repo.spring.io/libs-release/org/apache/maven/surefire/surefire-junit4/2.18.1/surefire-junit4-2.18.1.pom (3 KB at 4.2 KB/sec)
[INFO] Downloading: https://repo.spring.io/libs-release/org/apache/maven/surefire/surefire-providers/2.18.1/surefire-providers-2.18.1.pom
[INFO] Downloaded: https://repo.spring.io/libs-release/org/apache/maven/surefire/surefire-providers/2.18.1/surefire-providers-2.18.1.pom (3 KB at 11.3 KB/sec)
[INFO] Downloading: https://repo.spring.io/libs-release/org/apache/maven/surefire/surefire-junit4/2.18.1/surefire-junit4-2.18.1.jar
[INFO] Downloaded: https://repo.spring.io/libs-release/org/apache/maven/surefire/surefire-junit4/2.18.1/surefire-junit4-2.18.1.jar (67 KB at 160.4 KB/sec)

-------------------------------------------------------
 T E S T S
-------------------------------------------------------
Running com.softserve.academy.spaced.repetition.security.JwtTokenUtilTest
eyJhbGciOiJIUzUxMiJ9.eyJzdWIiOiJ0ZXN0QGdtYWlsLmNvbSIsImF1ZGllbmNlIjoibW9iaWxlIiwiY3JlYXRlZCI6MTUxNjYyNjI2ODI0NCwiZXhwIjoxNTE2NjI3MjYzfQ.8iNXMJC86i3Y3marEik1rboC4JzQ_vr4lYNyysxwk2q3TdNtIZOy1yptlreBr5SPMULDesEzpzPme2V_IJHdmg
Tests run: 7, Failures: 0, Errors: 0, Skipped: 0, Time elapsed: 1.531 sec - in com.softserve.academy.spaced.repetition.security.JwtTokenUtilTest
Running com.softserve.academy.spaced.repetition.security.service.AuthenticationRestServiceTest
Tests run: 4, Failures: 0, Errors: 0, Skipped: 0, Time elapsed: 0.119 sec - in com.softserve.academy.spaced.repetition.security.service.AuthenticationRestServiceTest
Running com.softserve.academy.spaced.repetition.controller.CourseRatingControllerTest
Tests run: 4, Failures: 0, Errors: 0, Skipped: 0, Time elapsed: 1.504 sec - in com.softserve.academy.spaced.repetition.controller.CourseRatingControllerTest
Running com.softserve.academy.spaced.repetition.controller.UserControllerTest
Tests run: 2, Failures: 0, Errors: 0, Skipped: 0, Time elapsed: 0.279 sec - in com.softserve.academy.spaced.repetition.controller.UserControllerTest
Running com.softserve.academy.spaced.repetition.controller.CourseControllerTest
Tests run: 3, Failures: 0, Errors: 0, Skipped: 0, Time elapsed: 0.378 sec - in com.softserve.academy.spaced.repetition.controller.CourseControllerTest
Running com.softserve.academy.spaced.repetition.controller.UserCardQueueControllerTest
Tests run: 6, Failures: 0, Errors: 0, Skipped: 0, Time elapsed: 0.208 sec - in com.softserve.academy.spaced.repetition.controller.UserCardQueueControllerTest
Running com.softserve.academy.spaced.repetition.controller.UserProfileControllerTest
Tests run: 5, Failures: 0, Errors: 0, Skipped: 0, Time elapsed: 0.239 sec - in com.softserve.academy.spaced.repetition.controller.UserProfileControllerTest
Running com.softserve.academy.spaced.repetition.controller.AuditControllerTest
Tests run: 1, Failures: 0, Errors: 0, Skipped: 0, Time elapsed: 0.039 sec - in com.softserve.academy.spaced.repetition.controller.AuditControllerTest
Running com.softserve.academy.spaced.repetition.controller.DeckControllerTest
Tests run: 3, Failures: 0, Errors: 0, Skipped: 0, Time elapsed: 0.241 sec - in com.softserve.academy.spaced.repetition.controller.DeckControllerTest
Running com.softserve.academy.spaced.repetition.controller.CourseCommentControllerTest
Tests run: 5, Failures: 0, Errors: 0, Skipped: 0, Time elapsed: 0.233 sec - in com.softserve.academy.spaced.repetition.controller.CourseCommentControllerTest
Running com.softserve.academy.spaced.repetition.controller.CardControllerTest
Tests run: 2, Failures: 0, Errors: 0, Skipped: 0, Time elapsed: 0.087 sec - in com.softserve.academy.spaced.repetition.controller.CardControllerTest
Running com.softserve.academy.spaced.repetition.controller.DeckRatingControllerTest
Tests run: 4, Failures: 0, Errors: 0, Skipped: 0, Time elapsed: 0.141 sec - in com.softserve.academy.spaced.repetition.controller.DeckRatingControllerTest
Running com.softserve.academy.spaced.repetition.service.AccessToUrlServiceImplTest
Tests run: 20, Failures: 0, Errors: 0, Skipped: 0, Time elapsed: 0.122 sec - in com.softserve.academy.spaced.repetition.service.AccessToUrlServiceImplTest
Running com.softserve.academy.spaced.repetition.service.AccountVerificationByEmailServiceImplTest
Tests run: 2, Failures: 0, Errors: 0, Skipped: 0, Time elapsed: 0.036 sec - in com.softserve.academy.spaced.repetition.service.AccountVerificationByEmailServiceImplTest
Running com.softserve.academy.spaced.repetition.service.CardRatingServiceImplTest
Tests run: 3, Failures: 0, Errors: 0, Skipped: 0, Time elapsed: 0.017 sec - in com.softserve.academy.spaced.repetition.service.CardRatingServiceImplTest
Running com.softserve.academy.spaced.repetition.service.CourseRatingServiceImplTest
Tests run: 4, Failures: 0, Errors: 0, Skipped: 0, Time elapsed: 0.017 sec - in com.softserve.academy.spaced.repetition.service.CourseRatingServiceImplTest
Running com.softserve.academy.spaced.repetition.service.UserServiceTest
 .----------------.  .----------------.  .----------------.  .----------------.
| .--------------. || .--------------. || .--------------. || .--------------. |
| |     ____     | || |  _______     | || |   _____      | || |   ______     | |
| |   .'    `.   | || | |_   __ \    | || |  |_   _|     | || |  |_   __ \   | |
| |  /  .--.  \  | || |   | |__) |   | || |    | |       | || |    | |__) |  | |
| |  | |    | |  | || |   |  __ /    | || |    | |   _   | || |    |  ___/   | |
| |  \  `--'  /  | || |  _| |  \ \_  | || |   _| |__/ |  | || |   _| |_      | |
| |   `.____.'   | || | |____| |___| | || |  |________|  | || |  |_____|     | |
| |              | || |              | || |              | || |              | |
| '--------------' || '--------------' || '--------------' || '--------------' |
 '----------------'  '----------------'  '----------------'  '----------------'
2018-01-22 14:04:27.614  INFO 212 --- [           main] c.s.a.s.r.service.UserServiceTest        : Starting UserServiceTest on spirals-librepair with PID 212 (started by root in /root/workspace/koldovsky/orlp-server/331792512)
2018-01-22 14:04:27.618  INFO 212 --- [           main] c.s.a.s.r.service.UserServiceTest        : The following profiles are active: testdatabase
2018-01-22 14:04:32.252  INFO 212 --- [           main] o.f.core.internal.util.VersionPrinter    : Flyway Community Edition 5.0.3 by Boxfuse
2018-01-22 14:04:32.267  INFO 212 --- [           main] o.f.c.internal.database.DatabaseFactory  : Database: jdbc:h2:mem:testdb (H2 1.4)
2018-01-22 14:04:32.409  INFO 212 --- [           main] o.f.core.internal.command.DbValidate     : Successfully validated 2 migrations (execution time 00:00.061s)
2018-01-22 14:04:32.425  INFO 212 --- [           main] o.f.c.i.s.JdbcTableSchemaHistory         : Creating Schema History table: "PUBLIC"."flyway_schema_history"
2018-01-22 14:04:32.452  INFO 212 --- [           main] o.f.core.internal.command.DbMigrate      : Current version of schema "PUBLIC": << Empty Schema >>
2018-01-22 14:04:32.466  INFO 212 --- [           main] o.f.core.internal.command.DbMigrate      : Migrating schema "PUBLIC" to version 1.0 - Create initial schema
2018-01-22 14:04:32.850  INFO 212 --- [           main] o.f.core.internal.command.DbMigrate      : Migrating schema "PUBLIC" to version 1.1 - Fill tables
2018-01-22 14:04:33.266  INFO 212 --- [           main] o.f.core.internal.command.DbMigrate      : Successfully applied 2 migrations to schema "PUBLIC" (execution time 00:00.844s)
2018-01-22 14:04:50.646  INFO 212 --- [           main] c.s.a.s.r.service.UserServiceTest        : Started UserServiceTest in 23.561 seconds (JVM running for 31.155)
Tests run: 8, Failures: 0, Errors: 0, Skipped: 0, Time elapsed: 25.263 sec - in com.softserve.academy.spaced.repetition.service.UserServiceTest
Running com.softserve.academy.spaced.repetition.service.DeckServiceTest
Tests run: 2, Failures: 0, Errors: 0, Skipped: 0, Time elapsed: 0.301 sec - in com.softserve.academy.spaced.repetition.service.DeckServiceTest
Running com.softserve.academy.spaced.repetition.service.UserCardQueueServiceTest
Tests run: 14, Failures: 0, Errors: 0, Skipped: 0, Time elapsed: 1.508 sec - in com.softserve.academy.spaced.repetition.service.UserCardQueueServiceTest
Running com.softserve.academy.spaced.repetition.service.DeckRatingServiceTest
Tests run: 2, Failures: 0, Errors: 0, Skipped: 0, Time elapsed: 0.248 sec - in com.softserve.academy.spaced.repetition.service.DeckRatingServiceTest
Running com.softserve.academy.spaced.repetition.service.CardServiceTest
Tests run: 5, Failures: 2, Errors: 0, Skipped: 0, Time elapsed: 0.026 sec <<< FAILURE! - in com.softserve.academy.spaced.repetition.service.CardServiceTest
testGetLearningCards(com.softserve.academy.spaced.repetition.service.CardServiceTest)  Time elapsed: 0.012 sec  <<< FAILURE!
org.mockito.exceptions.verification.WantedButNotInvoked: 
Wanted but not invoked:
cardRepository.cardsQueueForLearningWithStatus(
    1,
    1,
    11
);
-> at com.softserve.academy.spaced.repetition.service.CardServiceTest.testGetLearningCards(CardServiceTest.java:84)

However, there were other interactions with this mock:
cardRepository.cardsForLearningWithOutStatus(
    1,
    1,
    10
);
-> at com.softserve.academy.spaced.repetition.service.impl.CardServiceImpl.getLearningCards(CardServiceImpl.java:53)


	at com.softserve.academy.spaced.repetition.service.CardServiceTest.testGetLearningCards(CardServiceTest.java:84)

exceptionTestGetLearningCards(com.softserve.academy.spaced.repetition.service.CardServiceTest)  Time elapsed: 0.004 sec  <<< FAILURE!
java.lang.AssertionError: Expected exception: com.softserve.academy.spaced.repetition.utils.exceptions.NotAuthorisedUserException
	at org.junit.internal.runners.statements.ExpectException.evaluate(ExpectException.java:32)
	at org.junit.runners.ParentRunner.runLeaf(ParentRunner.java:325)
	at org.junit.runners.BlockJUnit4ClassRunner.runChild(BlockJUnit4ClassRunner.java:78)
	at org.junit.runners.BlockJUnit4ClassRunner.runChild(BlockJUnit4ClassRunner.java:57)
	at org.junit.runners.ParentRunner$3.run(ParentRunner.java:290)
	at org.junit.runners.ParentRunner$1.schedule(ParentRunner.java:71)
	at org.junit.runners.ParentRunner.runChildren(ParentRunner.java:288)
	at org.junit.runners.ParentRunner.access$000(ParentRunner.java:58)
	at org.junit.runners.ParentRunner$2.evaluate(ParentRunner.java:268)
	at org.junit.runners.ParentRunner.run(ParentRunner.java:363)
	at org.mockito.internal.runners.JUnit45AndHigherRunnerImpl.run(JUnit45AndHigherRunnerImpl.java:37)
	at org.mockito.runners.MockitoJUnitRunner.run(MockitoJUnitRunner.java:62)
	at org.apache.maven.surefire.junit4.JUnit4Provider.execute(JUnit4Provider.java:283)
	at org.apache.maven.surefire.junit4.JUnit4Provider.executeWithRerun(JUnit4Provider.java:173)
	at org.apache.maven.surefire.junit4.JUnit4Provider.executeTestSet(JUnit4Provider.java:153)
	at org.apache.maven.surefire.junit4.JUnit4Provider.invoke(JUnit4Provider.java:128)
	at org.apache.maven.surefire.booter.ForkedBooter.invokeProviderInSameClassLoader(ForkedBooter.java:203)
	at org.apache.maven.surefire.booter.ForkedBooter.runSuitesInProcess(ForkedBooter.java:155)
	at org.apache.maven.surefire.booter.ForkedBooter.main(ForkedBooter.java:103)

Running com.softserve.academy.spaced.repetition.service.validator.ValidatorsTest
Tests run: 6, Failures: 0, Errors: 0, Skipped: 0, Time elapsed: 0.746 sec - in com.softserve.academy.spaced.repetition.service.validator.ValidatorsTest
Running com.softserve.academy.spaced.repetition.service.CourseServiceImplTest
Tests run: 22, Failures: 0, Errors: 0, Skipped: 0, Time elapsed: 0.054 sec - in com.softserve.academy.spaced.repetition.service.CourseServiceImplTest
Running com.softserve.academy.spaced.repetition.service.AuditServiceImplTest
Tests run: 12, Failures: 0, Errors: 0, Skipped: 0, Time elapsed: 0.018 sec - in com.softserve.academy.spaced.repetition.service.AuditServiceImplTest
Running com.softserve.academy.spaced.repetition.service.CourseCommentServiceTest
Tests run: 1, Failures: 0, Errors: 1, Skipped: 0, Time elapsed: 0 sec <<< FAILURE! - in com.softserve.academy.spaced.repetition.service.CourseCommentServiceTest
initializationError(com.softserve.academy.spaced.repetition.service.CourseCommentServiceTest)  Time elapsed: 0 sec  <<< ERROR!
org.mockito.exceptions.base.MockitoException: 

No tests found in CourseCommentServiceTest
Haven't you forgot @Test annotation?

	at org.mockito.internal.runners.RunnerFactory.create(RunnerFactory.java:34)
	at org.mockito.runners.MockitoJUnitRunner.<init>(MockitoJUnitRunner.java:57)
	at sun.reflect.GeneratedConstructorAccessor10.newInstance(Unknown Source)
	at sun.reflect.DelegatingConstructorAccessorImpl.newInstance(DelegatingConstructorAccessorImpl.java:45)
	at java.lang.reflect.Constructor.newInstance(Constructor.java:423)
	at org.junit.internal.builders.AnnotatedBuilder.buildRunner(AnnotatedBuilder.java:104)
	at org.junit.internal.builders.AnnotatedBuilder.runnerForClass(AnnotatedBuilder.java:86)
	at org.junit.runners.model.RunnerBuilder.safeRunnerForClass(RunnerBuilder.java:59)
	at org.junit.internal.builders.AllDefaultPossibilitiesBuilder.runnerForClass(AllDefaultPossibilitiesBuilder.java:26)
	at org.junit.runners.model.RunnerBuilder.safeRunnerForClass(RunnerBuilder.java:59)
	at org.junit.internal.requests.ClassRequest.getRunner(ClassRequest.java:33)
	at org.apache.maven.surefire.junit4.JUnit4Provider.execute(JUnit4Provider.java:283)
	at org.apache.maven.surefire.junit4.JUnit4Provider.executeWithRerun(JUnit4Provider.java:173)
	at org.apache.maven.surefire.junit4.JUnit4Provider.executeTestSet(JUnit4Provider.java:153)
	at org.apache.maven.surefire.junit4.JUnit4Provider.invoke(JUnit4Provider.java:128)
	at org.apache.maven.surefire.booter.ForkedBooter.invokeProviderInSameClassLoader(ForkedBooter.java:203)
	at org.apache.maven.surefire.booter.ForkedBooter.runSuitesInProcess(ForkedBooter.java:155)
	at org.apache.maven.surefire.booter.ForkedBooter.main(ForkedBooter.java:103)
Caused by: java.lang.reflect.InvocationTargetException: null
	at sun.reflect.GeneratedConstructorAccessor11.newInstance(Unknown Source)
	at sun.reflect.DelegatingConstructorAccessorImpl.newInstance(DelegatingConstructorAccessorImpl.java:45)
	at java.lang.reflect.Constructor.newInstance(Constructor.java:423)
	at org.mockito.internal.runners.util.RunnerProvider.newInstance(RunnerProvider.java:39)
	at org.mockito.internal.runners.RunnerFactory.create(RunnerFactory.java:28)
	at org.mockito.runners.MockitoJUnitRunner.<init>(MockitoJUnitRunner.java:57)
	at sun.reflect.GeneratedConstructorAccessor10.newInstance(Unknown Source)
	at sun.reflect.DelegatingConstructorAccessorImpl.newInstance(DelegatingConstructorAccessorImpl.java:45)
	at java.lang.reflect.Constructor.newInstance(Constructor.java:423)
	at org.junit.internal.builders.AnnotatedBuilder.buildRunner(AnnotatedBuilder.java:104)
	at org.junit.internal.builders.AnnotatedBuilder.runnerForClass(AnnotatedBuilder.java:86)
	at org.junit.runners.model.RunnerBuilder.safeRunnerForClass(RunnerBuilder.java:59)
	at org.junit.internal.builders.AllDefaultPossibilitiesBuilder.runnerForClass(AllDefaultPossibilitiesBuilder.java:26)
	at org.junit.runners.model.RunnerBuilder.safeRunnerForClass(RunnerBuilder.java:59)
	at org.junit.internal.requests.ClassRequest.getRunner(ClassRequest.java:33)
	at org.apache.maven.surefire.junit4.JUnit4Provider.execute(JUnit4Provider.java:283)
	at org.apache.maven.surefire.junit4.JUnit4Provider.executeWithRerun(JUnit4Provider.java:173)
	at org.apache.maven.surefire.junit4.JUnit4Provider.executeTestSet(JUnit4Provider.java:153)
	at org.apache.maven.surefire.junit4.JUnit4Provider.invoke(JUnit4Provider.java:128)
	at org.apache.maven.surefire.booter.ForkedBooter.invokeProviderInSameClassLoader(ForkedBooter.java:203)
	at org.apache.maven.surefire.booter.ForkedBooter.runSuitesInProcess(ForkedBooter.java:155)
	at org.apache.maven.surefire.booter.ForkedBooter.main(ForkedBooter.java:103)
Caused by: org.junit.runners.model.InitializationError: null
	at org.junit.runners.ParentRunner.validate(ParentRunner.java:418)
	at org.junit.runners.ParentRunner.<init>(ParentRunner.java:84)
	at org.junit.runners.BlockJUnit4ClassRunner.<init>(BlockJUnit4ClassRunner.java:65)
	at org.mockito.internal.runners.JUnit45AndHigherRunnerImpl$1.<init>(JUnit45AndHigherRunnerImpl.java:23)
	at org.mockito.internal.runners.JUnit45AndHigherRunnerImpl.<init>(JUnit45AndHigherRunnerImpl.java:23)
	at sun.reflect.GeneratedConstructorAccessor11.newInstance(Unknown Source)
	at sun.reflect.DelegatingConstructorAccessorImpl.newInstance(DelegatingConstructorAccessorImpl.java:45)
	at java.lang.reflect.Constructor.newInstance(Constructor.java:423)
	at org.mockito.internal.runners.util.RunnerProvider.newInstance(RunnerProvider.java:39)
	at org.mockito.internal.runners.RunnerFactory.create(RunnerFactory.java:28)
	at org.mockito.runners.MockitoJUnitRunner.<init>(MockitoJUnitRunner.java:57)
	at sun.reflect.GeneratedConstructorAccessor10.newInstance(Unknown Source)
	at sun.reflect.DelegatingConstructorAccessorImpl.newInstance(DelegatingConstructorAccessorImpl.java:45)
	at java.lang.reflect.Constructor.newInstance(Constructor.java:423)
	at org.junit.internal.builders.AnnotatedBuilder.buildRunner(AnnotatedBuilder.java:104)
	at org.junit.internal.builders.AnnotatedBuilder.runnerForClass(AnnotatedBuilder.java:86)
	at org.junit.runners.model.RunnerBuilder.safeRunnerForClass(RunnerBuilder.java:59)
	at org.junit.internal.builders.AllDefaultPossibilitiesBuilder.runnerForClass(AllDefaultPossibilitiesBuilder.java:26)
	at org.junit.runners.model.RunnerBuilder.safeRunnerForClass(RunnerBuilder.java:59)
	at org.junit.internal.requests.ClassRequest.getRunner(ClassRequest.java:33)
	at org.apache.maven.surefire.junit4.JUnit4Provider.execute(JUnit4Provider.java:283)
	at org.apache.maven.surefire.junit4.JUnit4Provider.executeWithRerun(JUnit4Provider.java:173)
	at org.apache.maven.surefire.junit4.JUnit4Provider.executeTestSet(JUnit4Provider.java:153)
	at org.apache.maven.surefire.junit4.JUnit4Provider.invoke(JUnit4Provider.java:128)
	at org.apache.maven.surefire.booter.ForkedBooter.invokeProviderInSameClassLoader(ForkedBooter.java:203)
	at org.apache.maven.surefire.booter.ForkedBooter.runSuitesInProcess(ForkedBooter.java:155)
	at org.apache.maven.surefire.booter.ForkedBooter.main(ForkedBooter.java:103)

Running com.softserve.academy.spaced.repetition.service.AccountServiceImplTest
Tests run: 15, Failures: 0, Errors: 0, Skipped: 0, Time elapsed: 0.032 sec - in com.softserve.academy.spaced.repetition.service.AccountServiceImplTest
Running com.softserve.academy.spaced.repetition.service.CategoryServiceImplTest
Tests run: 6, Failures: 0, Errors: 0, Skipped: 0, Time elapsed: 0.005 sec - in com.softserve.academy.spaced.repetition.service.CategoryServiceImplTest

Results :

Failed tests: 
  CardServiceTest.exceptionTestGetLearningCards Expected exception: com.softserve.academy.spaced.repetition.utils.exceptions.NotAuthorisedUserException
  CardServiceTest.testGetLearningCards:84 
Wanted but not invoked:
cardRepository.cardsQueueForLearningWithStatus(
    1,
    1,
    11
);
-> at com.softserve.academy.spaced.repetition.service.CardServiceTest.testGetLearningCards(CardServiceTest.java:84)

However, there were other interactions with this mock:
cardRepository.cardsForLearningWithOutStatus(
    1,
    1,
    10
);
-> at com.softserve.academy.spaced.repetition.service.impl.CardServiceImpl.getLearningCards(CardServiceImpl.java:53)


Tests in error: 
  CourseCommentServiceTest.initializationError » Mockito 

No tests found in Cou...

Tests run: 168, Failures: 2, Errors: 1, Skipped: 0

[INFO] ------------------------------------------------------------------------
[INFO] BUILD FAILURE
[INFO] ------------------------------------------------------------------------
[INFO] Total time: 42.430 s
[INFO] Finished at: 2018-01-22T14:04:55+01:00
[INFO] Final Memory: 37M/417M
[INFO] ------------------------------------------------------------------------
[ERROR] Failed to execute goal org.apache.maven.plugins:maven-surefire-plugin:2.18.1:test (default-test) on project Spaced.Repetition: There are test failures.
[ERROR] 
[ERROR] Please refer to /root/workspace/koldovsky/orlp-server/331792512/target/surefire-reports for the individual test results.
[ERROR] -> [Help 1]
[ERROR] 
[ERROR] To see the full stack trace of the errors, re-run Maven with the -e switch.
[ERROR] Re-run Maven using the -X switch to enable full debug logging.
[ERROR] 
[ERROR] For more information about the errors and possible solutions, please read the following articles:
[ERROR] [Help 1] http://cwiki.apache.org/confluence/display/MAVEN/MojoFailureException
