[INFO] Scanning for projects...
[INFO]                                                                         
[INFO] ------------------------------------------------------------------------
[INFO] Building Elasticsearch Data Format 6.3.2-SNAPSHOT
[INFO] ------------------------------------------------------------------------
[INFO] 
[INFO] --- maven-enforcer-plugin:1.2:enforce (enforce-maven) @ elasticsearch-dataformat ---
[INFO] Skipping Rule Enforcement.
[INFO] 
[INFO] --- maven-resources-plugin:2.6:resources (default-resources) @ elasticsearch-dataformat ---
[INFO] Using 'UTF-8' encoding to copy filtered resources.
[INFO] skip non existing resourceDirectory /root/workspace/codelibs/elasticsearch-dataformat/412034544/src/main/resources
[INFO] 
[INFO] --- maven-compiler-plugin:3.6.0:compile (default-compile) @ elasticsearch-dataformat ---
[INFO] Nothing to compile - all classes are up to date
[INFO] 
[INFO] --- maven-resources-plugin:2.6:testResources (default-testResources) @ elasticsearch-dataformat ---
[INFO] Using 'UTF-8' encoding to copy filtered resources.
[INFO] skip non existing resourceDirectory /root/workspace/codelibs/elasticsearch-dataformat/412034544/src/test/resources
[INFO] 
[INFO] --- maven-compiler-plugin:3.6.0:testCompile (default-testCompile) @ elasticsearch-dataformat ---
[INFO] Nothing to compile - all classes are up to date
[INFO] 
[INFO] --- maven-surefire-plugin:2.19.1:test (default-test) @ elasticsearch-dataformat ---
[INFO] Downloading: https://repo.maven.apache.org/maven2/org/apache/maven/surefire/surefire-junit4/2.19.1/surefire-junit4-2.19.1.pom
[INFO] Downloaded: https://repo.maven.apache.org/maven2/org/apache/maven/surefire/surefire-junit4/2.19.1/surefire-junit4-2.19.1.pom (4 KB at 6.0 KB/sec)
[INFO] Downloading: https://repo.maven.apache.org/maven2/org/apache/maven/surefire/surefire-providers/2.19.1/surefire-providers-2.19.1.pom
[INFO] Downloaded: https://repo.maven.apache.org/maven2/org/apache/maven/surefire/surefire-providers/2.19.1/surefire-providers-2.19.1.pom (3 KB at 113.8 KB/sec)
[INFO] Downloading: https://repo.maven.apache.org/maven2/org/apache/maven/surefire/surefire-junit4/2.19.1/surefire-junit4-2.19.1.jar
[INFO] Downloaded: https://repo.maven.apache.org/maven2/org/apache/maven/surefire/surefire-junit4/2.19.1/surefire-junit4-2.19.1.jar (74 KB at 876.8 KB/sec)

-------------------------------------------------------
 T E S T S
-------------------------------------------------------
Running org.codelibs.elasticsearch.df.DataFormatPluginTest
----------------------------------------
Cluster Name: es-dataformat-1533370574482
Base Path:    /tmp/es-cluster154704049712261168
Num Of Node:  1
----------------------------------------
Creating /tmp/es-cluster154704049712261168/node_1
Creating /tmp/es-cluster154704049712261168/node_1/config
Creating /tmp/es-cluster154704049712261168/node_1/logs
Creating /tmp/es-cluster154704049712261168/node_1/data
Node Name:      Node 1
HTTP Port:      9201
Transport Port: 9301
Data Directory: /tmp/es-cluster154704049712261168/node_1/data
Log Directory:  /tmp/es-cluster154704049712261168/node_1/logs
----------------------------------------
Creating /tmp/es-cluster154704049712261168/node_1/modules
Creating /tmp/es-cluster154704049712261168/node_1/plugins
[2018-08-04T10:16:16,306][INFO ][o.e.n.Node               ] [Node 1] initializing ...
[2018-08-04T10:16:16,578][INFO ][o.e.e.NodeEnvironment    ] [Node 1] using [1] data paths, mounts [[/ (none)]], net usable_space [96.8gb], net total_space [108.1gb], types [aufs]
[2018-08-04T10:16:16,586][INFO ][o.e.e.NodeEnvironment    ] [Node 1] heap size [3.4gb], compressed ordinary object pointers [true]
[2018-08-04T10:16:16,588][INFO ][o.e.n.Node               ] [Node 1] node name [Node 1], node ID [XusreA8RRjKF5hcAy8-leg]
[2018-08-04T10:16:16,589][INFO ][o.e.n.Node               ] [Node 1] version[6.3.2], pid[163], build[unknown/unknown/053779d/2018-07-20T05:20:23.451332Z], OS[Linux/4.9.0-6-amd64/amd64], JVM[Oracle Corporation/OpenJDK 64-Bit Server VM/1.8.0_121/25.121-b13]
[2018-08-04T10:16:16,590][INFO ][o.e.n.Node               ] [Node 1] JVM arguments []
[2018-08-04T10:16:16,614][INFO ][o.e.p.PluginsService     ] [Node 1] no modules loaded
[2018-08-04T10:16:16,617][INFO ][o.e.p.PluginsService     ] [Node 1] loaded plugin [org.codelibs.elasticsearch.df.DataFormatPlugin]
[2018-08-04T10:16:16,617][INFO ][o.e.p.PluginsService     ] [Node 1] loaded plugin [org.elasticsearch.analysis.common.CommonAnalysisPlugin]
[2018-08-04T10:16:16,617][INFO ][o.e.p.PluginsService     ] [Node 1] loaded plugin [org.elasticsearch.index.mapper.MapperExtrasPlugin]
[2018-08-04T10:16:16,618][INFO ][o.e.p.PluginsService     ] [Node 1] loaded plugin [org.elasticsearch.index.rankeval.RankEvalPlugin]
[2018-08-04T10:16:16,621][INFO ][o.e.p.PluginsService     ] [Node 1] loaded plugin [org.elasticsearch.index.reindex.ReindexPlugin]
[2018-08-04T10:16:16,621][INFO ][o.e.p.PluginsService     ] [Node 1] loaded plugin [org.elasticsearch.ingest.common.IngestCommonPlugin]
[2018-08-04T10:16:16,622][INFO ][o.e.p.PluginsService     ] [Node 1] loaded plugin [org.elasticsearch.join.ParentJoinPlugin]
[2018-08-04T10:16:16,622][INFO ][o.e.p.PluginsService     ] [Node 1] loaded plugin [org.elasticsearch.painless.PainlessPlugin]
[2018-08-04T10:16:16,622][INFO ][o.e.p.PluginsService     ] [Node 1] loaded plugin [org.elasticsearch.percolator.PercolatorPlugin]
[2018-08-04T10:16:16,623][INFO ][o.e.p.PluginsService     ] [Node 1] loaded plugin [org.elasticsearch.plugin.repository.url.URLRepositoryPlugin]
[2018-08-04T10:16:16,623][INFO ][o.e.p.PluginsService     ] [Node 1] loaded plugin [org.elasticsearch.script.expression.ExpressionPlugin]
[2018-08-04T10:16:16,623][INFO ][o.e.p.PluginsService     ] [Node 1] loaded plugin [org.elasticsearch.script.mustache.MustachePlugin]
[2018-08-04T10:16:16,624][INFO ][o.e.p.PluginsService     ] [Node 1] loaded plugin [org.elasticsearch.search.aggregations.matrix.MatrixAggregationPlugin]
[2018-08-04T10:16:16,624][INFO ][o.e.p.PluginsService     ] [Node 1] loaded plugin [org.elasticsearch.transport.Netty4Plugin]
[2018-08-04T10:16:16,624][INFO ][o.e.p.PluginsService     ] [Node 1] loaded plugin [org.elasticsearch.tribe.TribePlugin]
[2018-08-04T10:16:20,983][INFO ][o.e.d.DiscoveryModule    ] [Node 1] using discovery type [zen]
[2018-08-04T10:16:21,771][INFO ][o.e.n.Node               ] [Node 1] initialized
[2018-08-04T10:16:21,771][INFO ][o.e.n.Node               ] [Node 1] starting ...
[2018-08-04T10:16:21,985][INFO ][o.e.t.TransportService   ] [Node 1] publish_address {127.0.0.1:9301}, bound_addresses {[::1]:9301}, {127.0.0.1:9301}
[2018-08-04T10:16:25,125][INFO ][o.e.c.s.MasterService    ] [Node 1] zen-disco-elected-as-master ([0] nodes joined)[, ], reason: new_master {Node 1}{XusreA8RRjKF5hcAy8-leg}{Es4JIK2OQKa4UNknWx4WdQ}{127.0.0.1}{127.0.0.1:9301}
[2018-08-04T10:16:25,144][INFO ][o.e.c.s.ClusterApplierService] [Node 1] new_master {Node 1}{XusreA8RRjKF5hcAy8-leg}{Es4JIK2OQKa4UNknWx4WdQ}{127.0.0.1}{127.0.0.1:9301}, reason: apply cluster state (from master [master {Node 1}{XusreA8RRjKF5hcAy8-leg}{Es4JIK2OQKa4UNknWx4WdQ}{127.0.0.1}{127.0.0.1:9301} committed version [1] source [zen-disco-elected-as-master ([0] nodes joined)[, ]]])
[2018-08-04T10:16:25,201][INFO ][o.e.h.n.Netty4HttpServerTransport] [Node 1] publish_address {127.0.0.1:9201}, bound_addresses {[::1]:9201}, {127.0.0.1:9201}
[2018-08-04T10:16:25,207][INFO ][o.e.n.Node               ] [Node 1] started
[2018-08-04T10:16:25,213][INFO ][o.e.g.GatewayService     ] [Node 1] recovered [0] indices into cluster_state
[2018-08-04T10:16:25,495][INFO ][o.e.c.m.MetaDataCreateIndexService] [Node 1] [dataset0] creating index, cause [api], templates [], shards [5]/[1], mappings []
[2018-08-04T10:16:26,721][INFO ][o.e.c.m.MetaDataMappingService] [Node 1] [dataset0/a0_8WC8LS-e64F2kZLEoxA] create_mapping [item0]
[2018-08-04T10:16:29,234][WARN ][r.suppressed             ] path: /dataset0/item0/_data, params: {format=csv, limit=0, index=dataset0, type=item0}
org.elasticsearch.ElasticsearchException: Content size is too large 1572
	at org.codelibs.elasticsearch.df.rest.RestDataAction$SearchResponseListener.writeResponse(RestDataAction.java:235) ~[classes/:?]
	at org.codelibs.elasticsearch.df.rest.RestDataAction$SearchResponseListener.access$700(RestDataAction.java:128) ~[classes/:?]
	at org.codelibs.elasticsearch.df.rest.RestDataAction$SearchResponseListener$1.onResponse(RestDataAction.java:179) ~[classes/:?]
	at org.codelibs.elasticsearch.df.rest.RestDataAction$SearchResponseListener$1.onResponse(RestDataAction.java:165) ~[classes/:?]
	at org.codelibs.elasticsearch.df.content.csv.CsvContent$OnLoadListener.onResponse(CsvContent.java:190) ~[classes/:?]
	at org.codelibs.elasticsearch.df.content.csv.CsvContent.write(CsvContent.java:103) ~[classes/:?]
	at org.codelibs.elasticsearch.df.rest.RestDataAction$SearchResponseListener.onResponse(RestDataAction.java:164) ~[classes/:?]
	at org.codelibs.elasticsearch.df.rest.RestDataAction$SearchResponseListener.onResponse(RestDataAction.java:128) ~[classes/:?]
	at org.elasticsearch.action.support.TransportAction$1.onResponse(TransportAction.java:85) ~[elasticsearch-6.3.2.jar:6.3.2]
	at org.elasticsearch.action.support.TransportAction$1.onResponse(TransportAction.java:81) ~[elasticsearch-6.3.2.jar:6.3.2]
	at org.elasticsearch.action.search.AbstractSearchAsyncAction.onResponse(AbstractSearchAsyncAction.java:308) ~[elasticsearch-6.3.2.jar:6.3.2]
	at org.elasticsearch.action.search.AbstractSearchAsyncAction.onResponse(AbstractSearchAsyncAction.java:48) ~[elasticsearch-6.3.2.jar:6.3.2]
	at org.elasticsearch.action.search.FetchSearchPhase$3.run(FetchSearchPhase.java:212) ~[elasticsearch-6.3.2.jar:6.3.2]
	at org.elasticsearch.action.search.AbstractSearchAsyncAction.executePhase(AbstractSearchAsyncAction.java:155) ~[elasticsearch-6.3.2.jar:6.3.2]
	at org.elasticsearch.action.search.AbstractSearchAsyncAction.executeNextPhase(AbstractSearchAsyncAction.java:148) ~[elasticsearch-6.3.2.jar:6.3.2]
	at org.elasticsearch.action.search.ExpandSearchPhase.run(ExpandSearchPhase.java:118) ~[elasticsearch-6.3.2.jar:6.3.2]
	at org.elasticsearch.action.search.AbstractSearchAsyncAction.executePhase(AbstractSearchAsyncAction.java:155) ~[elasticsearch-6.3.2.jar:6.3.2]
	at org.elasticsearch.action.search.AbstractSearchAsyncAction.executeNextPhase(AbstractSearchAsyncAction.java:148) ~[elasticsearch-6.3.2.jar:6.3.2]
	at org.elasticsearch.action.search.FetchSearchPhase.moveToNextPhase(FetchSearchPhase.java:205) ~[elasticsearch-6.3.2.jar:6.3.2]
	at org.elasticsearch.action.search.FetchSearchPhase.lambda$innerRun$2(FetchSearchPhase.java:104) ~[elasticsearch-6.3.2.jar:6.3.2]
	at org.elasticsearch.action.search.CountedCollector.countDown(CountedCollector.java:53) [elasticsearch-6.3.2.jar:6.3.2]
	at org.elasticsearch.action.search.CountedCollector.onResult(CountedCollector.java:64) [elasticsearch-6.3.2.jar:6.3.2]
	at org.elasticsearch.action.search.FetchSearchPhase$2.innerOnResponse(FetchSearchPhase.java:165) [elasticsearch-6.3.2.jar:6.3.2]
	at org.elasticsearch.action.search.FetchSearchPhase$2.innerOnResponse(FetchSearchPhase.java:162) [elasticsearch-6.3.2.jar:6.3.2]
	at org.elasticsearch.action.search.SearchActionListener.onResponse(SearchActionListener.java:45) [elasticsearch-6.3.2.jar:6.3.2]
	at org.elasticsearch.action.search.SearchActionListener.onResponse(SearchActionListener.java:29) [elasticsearch-6.3.2.jar:6.3.2]
	at org.elasticsearch.action.ActionListenerResponseHandler.handleResponse(ActionListenerResponseHandler.java:46) [elasticsearch-6.3.2.jar:6.3.2]
	at org.elasticsearch.action.search.SearchTransportService$ConnectionCountingHandler.handleResponse(SearchTransportService.java:518) [elasticsearch-6.3.2.jar:6.3.2]
	at org.elasticsearch.transport.TransportService$ContextRestoreResponseHandler.handleResponse(TransportService.java:1096) [elasticsearch-6.3.2.jar:6.3.2]
	at org.elasticsearch.transport.TransportService$DirectResponseChannel.processResponse(TransportService.java:1165) [elasticsearch-6.3.2.jar:6.3.2]
	at org.elasticsearch.transport.TransportService$DirectResponseChannel.sendResponse(TransportService.java:1155) [elasticsearch-6.3.2.jar:6.3.2]
	at org.elasticsearch.transport.TransportService$DirectResponseChannel.sendResponse(TransportService.java:1144) [elasticsearch-6.3.2.jar:6.3.2]
	at org.elasticsearch.transport.TaskTransportChannel.sendResponse(TaskTransportChannel.java:54) [elasticsearch-6.3.2.jar:6.3.2]
	at org.elasticsearch.action.search.SearchTransportService$11.messageReceived(SearchTransportService.java:441) [elasticsearch-6.3.2.jar:6.3.2]
	at org.elasticsearch.action.search.SearchTransportService$11.messageReceived(SearchTransportService.java:437) [elasticsearch-6.3.2.jar:6.3.2]
	at org.elasticsearch.transport.RequestHandlerRegistry.processMessageReceived(RequestHandlerRegistry.java:66) [elasticsearch-6.3.2.jar:6.3.2]
	at org.elasticsearch.transport.TransportService$7.doRun(TransportService.java:664) [elasticsearch-6.3.2.jar:6.3.2]
	at org.elasticsearch.common.util.concurrent.ThreadContext$ContextPreservingAbstractRunnable.doRun(ThreadContext.java:725) [elasticsearch-6.3.2.jar:6.3.2]
	at org.elasticsearch.common.util.concurrent.AbstractRunnable.run(AbstractRunnable.java:37) [elasticsearch-6.3.2.jar:6.3.2]
	at org.elasticsearch.common.util.concurrent.TimedRunnable.doRun(TimedRunnable.java:41) [elasticsearch-6.3.2.jar:6.3.2]
	at org.elasticsearch.common.util.concurrent.AbstractRunnable.run(AbstractRunnable.java:37) [elasticsearch-6.3.2.jar:6.3.2]
	at java.util.concurrent.ThreadPoolExecutor.runWorker(ThreadPoolExecutor.java:1142) [?:1.8.0_121]
	at java.util.concurrent.ThreadPoolExecutor$Worker.run(ThreadPoolExecutor.java:617) [?:1.8.0_121]
	at java.lang.Thread.run(Thread.java:745) [?:1.8.0_121]
[2018-08-04T10:16:29,283][WARN ][o.c.e.d.r.RestDataAction ] [Node 1] Failed to delete: /tmp/es_df_output_1428506518365131031.dat
[2018-08-04T10:16:30,012][INFO ][o.e.m.j.JvmGcMonitorService] [Node 1] [gc][8] overhead, spent [452ms] collecting in the last [1.2s]
[2018-08-04T10:16:30,701][INFO ][o.e.n.Node               ] [Node 1] stopping ...
[2018-08-04T10:16:31,654][INFO ][o.e.n.Node               ] [Node 1] stopped
[2018-08-04T10:16:31,654][INFO ][o.e.n.Node               ] [Node 1] closing ...
[2018-08-04T10:16:31,676][INFO ][o.e.n.Node               ] [Node 1] closed
Closed all nodes.
Deleted /tmp/es-cluster154704049712261168
Tests run: 15, Failures: 1, Errors: 0, Skipped: 0, Time elapsed: 17.354 sec <<< FAILURE! - in org.codelibs.elasticsearch.df.DataFormatPluginTest
dumpSizeLimit(org.codelibs.elasticsearch.df.DataFormatPluginTest)  Time elapsed: 0.148 sec  <<< FAILURE!
java.lang.AssertionError
	at org.codelibs.elasticsearch.df.DataFormatPluginTest.dumpSizeLimit(DataFormatPluginTest.java:449)


Results :

Failed tests: 
  DataFormatPluginTest.dumpSizeLimit:449

Tests run: 15, Failures: 1, Errors: 0, Skipped: 0

[INFO] ------------------------------------------------------------------------
[INFO] BUILD FAILURE
[INFO] ------------------------------------------------------------------------
[INFO] Total time: 21.981 s
[INFO] Finished at: 2018-08-04T10:16:32+02:00
[INFO] Final Memory: 21M/367M
[INFO] ------------------------------------------------------------------------
[ERROR] Failed to execute goal org.apache.maven.plugins:maven-surefire-plugin:2.19.1:test (default-test) on project elasticsearch-dataformat: There are test failures.
[ERROR] 
[ERROR] Please refer to /root/workspace/codelibs/elasticsearch-dataformat/412034544/target/surefire-reports for the individual test results.
[ERROR] -> [Help 1]
[ERROR] 
[ERROR] To see the full stack trace of the errors, re-run Maven with the -e switch.
[ERROR] Re-run Maven using the -X switch to enable full debug logging.
[ERROR] 
[ERROR] For more information about the errors and possible solutions, please read the following articles:
[ERROR] [Help 1] http://cwiki.apache.org/confluence/display/MAVEN/MojoFailureException
