[INFO] Scanning for projects...
[INFO]                                                                         
[INFO] ------------------------------------------------------------------------
[INFO] Building SonarQube SpotBugs Plugin 3.7.0-SNAPSHOT
[INFO] ------------------------------------------------------------------------
[INFO] 
[INFO] --- sonar-packaging-maven-plugin:1.18.0.372:check (default-check) @ sonar-findbugs-plugin ---
[INFO] 
[INFO] --- maven-resources-plugin:3.0.2:resources (default-resources) @ sonar-findbugs-plugin ---
[WARNING] File encoding has not been set, using platform encoding UTF-8, i.e. build is platform dependent!
[WARNING] Using platform encoding (UTF-8 actually) to copy filtered resources, i.e. build is platform dependent!
[INFO] Copying 11 resources
[INFO] 
[INFO] --- maven-dependency-plugin:2.8:copy-dependencies (copy-dependencies) @ sonar-findbugs-plugin ---
[INFO] fb-contrib-7.2.0.sb.jar already exists in destination.
[INFO] findsecbugs-plugin-1.7.1.jar already exists in destination.
[INFO] jsr305-1.3.9.jar already exists in destination.
[INFO] 
[INFO] --- maven-compiler-plugin:3.7.0:compile (default-compile) @ sonar-findbugs-plugin ---
[INFO] Changes detected - recompiling the module!
[WARNING] File encoding has not been set, using platform encoding UTF-8, i.e. build is platform dependent!
[INFO] Compiling 70 source files to /root/workspace/spotbugs/sonar-findbugs/348862101/target/classes
[INFO] /root/workspace/spotbugs/sonar-findbugs/348862101/src/main/java/org/sonar/plugins/findbugs/resource/ByteCodeResourceLocator.java: Some input files use or override a deprecated API.
[INFO] /root/workspace/spotbugs/sonar-findbugs/348862101/src/main/java/org/sonar/plugins/findbugs/resource/ByteCodeResourceLocator.java: Recompile with -Xlint:deprecation for details.
[INFO] 
[INFO] --- maven-resources-plugin:3.0.2:testResources (default-testResources) @ sonar-findbugs-plugin ---
[WARNING] Using platform encoding (UTF-8 actually) to copy filtered resources, i.e. build is platform dependent!
[INFO] Copying 11 resources
[INFO] Copying 21 resources
[INFO] 
[INFO] --- maven-compiler-plugin:3.7.0:testCompile (default-testCompile) @ sonar-findbugs-plugin ---
[INFO] Nothing to compile - all classes are up to date
[INFO] 
[INFO] --- maven-surefire-plugin:2.20.1:test (default-test) @ sonar-findbugs-plugin ---
[INFO] Downloading: https://repo.maven.apache.org/maven2/org/apache/maven/surefire/surefire-junit4/2.20.1/surefire-junit4-2.20.1.pom
[INFO] Downloaded: https://repo.maven.apache.org/maven2/org/apache/maven/surefire/surefire-junit4/2.20.1/surefire-junit4-2.20.1.pom (4 KB at 10.6 KB/sec)
[INFO] Downloading: https://repo.maven.apache.org/maven2/org/apache/maven/surefire/surefire-providers/2.20.1/surefire-providers-2.20.1.pom
[INFO] Downloaded: https://repo.maven.apache.org/maven2/org/apache/maven/surefire/surefire-providers/2.20.1/surefire-providers-2.20.1.pom (3 KB at 129.2 KB/sec)
[INFO] Downloading: https://repo.maven.apache.org/maven2/org/apache/maven/surefire/surefire-junit4/2.20.1/surefire-junit4-2.20.1.jar
[INFO] Downloaded: https://repo.maven.apache.org/maven2/org/apache/maven/surefire/surefire-junit4/2.20.1/surefire-junit4-2.20.1.jar (81 KB at 1361.8 KB/sec)
[INFO] 
[INFO] -------------------------------------------------------
[INFO]  T E S T S
[INFO] -------------------------------------------------------
[INFO] Running org.sonar.plugins.findbugs.FbContribRulesDefinitionTest
[INFO] Tests run: 1, Failures: 0, Errors: 0, Skipped: 0, Time elapsed: 0.198 s - in org.sonar.plugins.findbugs.FbContribRulesDefinitionTest
[INFO] Running org.sonar.plugins.findbugs.FindbugsCategoryTest
[INFO] Tests run: 1, Failures: 0, Errors: 0, Skipped: 0, Time elapsed: 0.001 s - in org.sonar.plugins.findbugs.FindbugsCategoryTest
[INFO] Running org.sonar.plugins.findbugs.FindbugsExecutorTest
[INFO] Tests run: 4, Failures: 0, Errors: 0, Skipped: 0, Time elapsed: 5.027 s - in org.sonar.plugins.findbugs.FindbugsExecutorTest
[INFO] Running org.sonar.plugins.findbugs.FindbugsVersionTest
[INFO] Tests run: 1, Failures: 0, Errors: 0, Skipped: 0, Time elapsed: 0.001 s - in org.sonar.plugins.findbugs.FindbugsVersionTest
[INFO] Running org.sonar.plugins.findbugs.FindbugsPluginTest
[INFO] Tests run: 1, Failures: 0, Errors: 0, Skipped: 0, Time elapsed: 0.018 s - in org.sonar.plugins.findbugs.FindbugsPluginTest
[INFO] Running org.sonar.plugins.findbugs.profiles.FindbugsContribProfileTest
[INFO] Tests run: 1, Failures: 0, Errors: 0, Skipped: 0, Time elapsed: 0.409 s - in org.sonar.plugins.findbugs.profiles.FindbugsContribProfileTest
[INFO] Running org.sonar.plugins.findbugs.profiles.FindbugsSecurityAuditProfileTest
[INFO] Tests run: 1, Failures: 0, Errors: 0, Skipped: 0, Time elapsed: 0.059 s - in org.sonar.plugins.findbugs.profiles.FindbugsSecurityAuditProfileTest
[INFO] Running org.sonar.plugins.findbugs.profiles.FindbugsSecurityMinimalProfileTest
[INFO] Tests run: 1, Failures: 0, Errors: 0, Skipped: 0, Time elapsed: 0.028 s - in org.sonar.plugins.findbugs.profiles.FindbugsSecurityMinimalProfileTest
[INFO] Running org.sonar.plugins.findbugs.profiles.FindbugsSecurityJspProfileTest
[INFO] Tests run: 1, Failures: 0, Errors: 0, Skipped: 0, Time elapsed: 0.021 s - in org.sonar.plugins.findbugs.profiles.FindbugsSecurityJspProfileTest
[INFO] Running org.sonar.plugins.findbugs.profiles.FindbugsProfileTest
[INFO] Tests run: 1, Failures: 0, Errors: 0, Skipped: 0, Time elapsed: 0.039 s - in org.sonar.plugins.findbugs.profiles.FindbugsProfileTest
[INFO] Running org.sonar.plugins.findbugs.FindbugsConfigurationTest
[ERROR] Tests run: 11, Failures: 0, Errors: 5, Skipped: 0, Time elapsed: 0.086 s <<< FAILURE! - in org.sonar.plugins.findbugs.FindbugsConfigurationTest
[ERROR] should_copy_lib_in_working_dir(org.sonar.plugins.findbugs.FindbugsConfigurationTest)  Time elapsed: 0.008 s  <<< ERROR!
java.lang.NullPointerException
	at org.sonar.plugins.findbugs.FindbugsConfigurationTest.should_copy_lib_in_working_dir(FindbugsConfigurationTest.java:134)

[ERROR] should_get_fbcontrib(org.sonar.plugins.findbugs.FindbugsConfigurationTest)  Time elapsed: 0 s  <<< ERROR!
java.lang.NullPointerException
	at org.sonar.plugins.findbugs.FindbugsConfigurationTest.should_get_fbcontrib(FindbugsConfigurationTest.java:151)

[ERROR] should_get_findSecBugs(org.sonar.plugins.findbugs.FindbugsConfigurationTest)  Time elapsed: 0.002 s  <<< ERROR!
java.lang.NullPointerException
	at org.sonar.plugins.findbugs.FindbugsConfigurationTest.should_get_findSecBugs(FindbugsConfigurationTest.java:157)

[ERROR] should_set_class_files(org.sonar.plugins.findbugs.FindbugsConfigurationTest)  Time elapsed: 0.004 s  <<< ERROR!
java.lang.NullPointerException
	at org.sonar.plugins.findbugs.FindbugsConfigurationTest.should_set_class_files(FindbugsConfigurationTest.java:108)

[ERROR] should_set_class_path(org.sonar.plugins.findbugs.FindbugsConfigurationTest)  Time elapsed: 0.007 s  <<< ERROR!
java.lang.NullPointerException
	at org.sonar.plugins.findbugs.FindbugsConfigurationTest.should_set_class_path(FindbugsConfigurationTest.java:118)

[INFO] Running org.sonar.plugins.findbugs.FindbugsSensorTest
[INFO] Tests run: 8, Failures: 0, Errors: 0, Skipped: 0, Time elapsed: 0.525 s - in org.sonar.plugins.findbugs.FindbugsSensorTest
[INFO] Running org.sonar.plugins.findbugs.resource.DebugExtensionExtractorTest
[INFO] Tests run: 2, Failures: 0, Errors: 0, Skipped: 0, Time elapsed: 0.001 s - in org.sonar.plugins.findbugs.resource.DebugExtensionExtractorTest
[INFO] Running org.sonar.plugins.findbugs.resource.ByteCodeResourceLocatorTest
Compiled class name: org.apache.jsp.WEB_002dINF.pages.widgets.cookies_005fand_005fparams_jsp
Expecting: src/main/webapp/org/apache/jsp/WEB-INF/pages/widgets/cookies_and_params.jsp
Compiled class name: org.apache.jsp.lessons.DBCrossSiteScripting.DBCrossSiteScripting_jsp
Expecting: src/main/webapp/org/apache/jsp/lessons/DBCrossSiteScripting/DBCrossSiteScripting.jsp
[INFO] Tests run: 6, Failures: 0, Errors: 0, Skipped: 0, Time elapsed: 0.006 s - in org.sonar.plugins.findbugs.resource.ByteCodeResourceLocatorTest
[INFO] Running org.sonar.plugins.findbugs.FindbugsProfileImporterTest
[INFO] Tests run: 11, Failures: 0, Errors: 0, Skipped: 0, Time elapsed: 0.154 s - in org.sonar.plugins.findbugs.FindbugsProfileImporterTest
[INFO] Running org.sonar.plugins.findbugs.FindSecurityBugsRulesDefinitionTest
[INFO] Tests run: 1, Failures: 0, Errors: 0, Skipped: 0, Time elapsed: 0.001 s - in org.sonar.plugins.findbugs.FindSecurityBugsRulesDefinitionTest
[INFO] Running org.sonar.plugins.findbugs.FindbugsXmlReportParserTest
[INFO] Tests run: 3, Failures: 0, Errors: 0, Skipped: 0, Time elapsed: 0.016 s - in org.sonar.plugins.findbugs.FindbugsXmlReportParserTest
[INFO] Running org.sonar.plugins.findbugs.FindbugsRulesDefinitionTest
[INFO] Tests run: 1, Failures: 0, Errors: 0, Skipped: 0, Time elapsed: 0.009 s - in org.sonar.plugins.findbugs.FindbugsRulesDefinitionTest
[INFO] Running org.sonar.plugins.findbugs.FindbugsProfileExporterTest
[INFO] Tests run: 7, Failures: 0, Errors: 0, Skipped: 0, Time elapsed: 0.042 s - in org.sonar.plugins.findbugs.FindbugsProfileExporterTest
[INFO] 
[INFO] Results:
[INFO] 
[ERROR] Errors: 
[ERROR]   FindbugsConfigurationTest.should_copy_lib_in_working_dir:134 » NullPointer
[ERROR]   FindbugsConfigurationTest.should_get_fbcontrib:151 » NullPointer
[ERROR]   FindbugsConfigurationTest.should_get_findSecBugs:157 » NullPointer
[ERROR]   FindbugsConfigurationTest.should_set_class_files:108 » NullPointer
[ERROR]   FindbugsConfigurationTest.should_set_class_path:118 » NullPointer
[INFO] 
[ERROR] Tests run: 63, Failures: 0, Errors: 5, Skipped: 0
[INFO] 
[INFO] ------------------------------------------------------------------------
[INFO] BUILD FAILURE
[INFO] ------------------------------------------------------------------------
[INFO] Total time: 11.546 s
[INFO] Finished at: 2018-03-04T09:32:06+01:00
[INFO] Final Memory: 37M/950M
[INFO] ------------------------------------------------------------------------
[ERROR] Failed to execute goal org.apache.maven.plugins:maven-surefire-plugin:2.20.1:test (default-test) on project sonar-findbugs-plugin: There are test failures.
[ERROR] 
[ERROR] Please refer to /root/workspace/spotbugs/sonar-findbugs/348862101/target/surefire-reports for the individual test results.
[ERROR] Please refer to dump files (if any exist) [date]-jvmRun[N].dump, [date].dumpstream and [date]-jvmRun[N].dumpstream.
[ERROR] -> [Help 1]
[ERROR] 
[ERROR] To see the full stack trace of the errors, re-run Maven with the -e switch.
[ERROR] Re-run Maven using the -X switch to enable full debug logging.
[ERROR] 
[ERROR] For more information about the errors and possible solutions, please read the following articles:
[ERROR] [Help 1] http://cwiki.apache.org/confluence/display/MAVEN/MojoFailureException
