[INFO] Scanning for projects...
[INFO]                                                                         
[INFO] ------------------------------------------------------------------------
[INFO] Building farm 1.0-SNAPSHOT
[INFO] ------------------------------------------------------------------------
[WARNING] The artifact org.hibernate:hibernate-validator:jar:6.0.2.Final has been relocated to org.hibernate.validator:hibernate-validator:jar:6.0.2.Final
[INFO] 
[INFO] --- maven-enforcer-plugin:1.4.1:enforce (enforce-maven) @ farm ---
[INFO] Skipping Rule Enforcement.
[INFO] 
[INFO] --- buildnumber-maven-plugin:1.4:create (jcabi-build-number) @ farm ---
[INFO] ShortRevision tag detected. The value is '7'.
[INFO] Executing: /bin/sh -c cd '/root/workspace/zerocracy/farm/418306590' && 'git' 'rev-parse' '--verify' '--short=7' 'HEAD'
[INFO] Working directory: /root/workspace/zerocracy/farm/418306590
[INFO] Storing buildNumber: ea73623 at timestamp: 2018-08-20T18:36:37
[WARNING] Cannot get the branch information from the git repository: 
Detecting the current branch failed: fatal: ref HEAD is not a symbolic ref

[INFO] ShortRevision tag detected. The value is '7'.
[INFO] Executing: /bin/sh -c cd '/root/workspace/zerocracy/farm/418306590' && 'git' 'rev-parse' '--verify' '--short=7' 'HEAD'
[INFO] Working directory: /root/workspace/zerocracy/farm/418306590
[INFO] Storing buildScmBranch: UNKNOWN
[INFO] 
[INFO] --- buildnumber-maven-plugin:1.4:create-timestamp (jcabi-build-number) @ farm ---
[INFO] 
[INFO] --- maven-dependency-plugin:2.10:unpack (unpack-dynamodb-local) @ farm ---
[INFO] Configured Artifact: com.jcabi:DynamoDBLocal:2015-07-16:zip
[INFO] DynamoDBLocal-2015-07-16.zip already unpacked.
[INFO] 
[INFO] --- sass-maven-plugin:2.25:update-stylesheets (generate-css) @ farm ---
[INFO] Checked 1 files for /root/workspace/zerocracy/farm/418306590/src/main/scss
[INFO] Checked 1 filtered (**/*.css) files for /root/workspace/zerocracy/farm/418306590/target/css
[INFO] Skip compiling Sass templates, no changes.
[INFO] 
[INFO] --- htmlcompressor-maven-plugin:1.3:xml (compress-xsl) @ farm ---
[INFO] Compressing /root/workspace/zerocracy/farm/418306590/src/main/resources/xsl
[INFO] XML compression completed.
[INFO] 
[INFO] --- maven-resources-plugin:3.0.1:resources (default-resources) @ farm ---
[INFO] Using 'UTF-8' encoding to copy filtered resources.
[INFO] Copying 63 resources
[INFO] 
[INFO] --- minify-maven-plugin:1.7.2:minify (minify-css) @ farm ---
[INFO] Starting CSS task:
[INFO] Skipping the merge step...
[INFO] Creating the minified file [main.css].
[INFO] Uncompressed size: 1505 bytes.
[INFO] Compressed size: 1165 bytes minified (554 bytes gzipped).
[INFO] 
[INFO] Starting JavaScript task:
[INFO] 
[INFO] --- maven-compiler-plugin:3.6.0:compile (default-compile) @ farm ---
[INFO] Changes detected - recompiling the module!
[INFO] Compiling 370 source files to /root/workspace/zerocracy/farm/418306590/target/classes
[INFO] 
[INFO] --- gmavenplus-plugin:1.5:compile (jcabi-groovy) @ farm ---
[INFO] Using Groovy 2.4.15 to perform compile.
[INFO] Compiled 189 files.
[INFO] 
[INFO] --- maven-resources-plugin:3.0.1:testResources (default-testResources) @ farm ---
[INFO] Using 'UTF-8' encoding to copy filtered resources.
[INFO] Copying 391 resources
[INFO] 
[INFO] --- maven-compiler-plugin:3.6.0:testCompile (default-testCompile) @ farm ---
[INFO] Nothing to compile - all classes are up to date
[INFO] 
[INFO] --- gmavenplus-plugin:1.5:testCompile (jcabi-groovy) @ farm ---
[INFO] No sources specified for compilation.  Skipping.
[INFO] 
[INFO] --- maven-surefire-plugin:2.19.1:test (default-test) @ farm ---
[INFO] Downloading: https://oss.sonatype.org/content/groups/public/org/apache/maven/surefire/surefire-junit47/2.19.1/surefire-junit47-2.19.1.pom
[INFO] Downloading: https://repo.maven.apache.org/maven2/org/apache/maven/surefire/surefire-junit47/2.19.1/surefire-junit47-2.19.1.pom
[INFO] Downloaded: https://repo.maven.apache.org/maven2/org/apache/maven/surefire/surefire-junit47/2.19.1/surefire-junit47-2.19.1.pom (7 KB at 53.9 KB/sec)
[INFO] Downloading: https://oss.sonatype.org/content/groups/public/org/apache/maven/surefire/surefire-providers/2.19.1/surefire-providers-2.19.1.pom
[INFO] Downloading: https://repo.maven.apache.org/maven2/org/apache/maven/surefire/surefire-providers/2.19.1/surefire-providers-2.19.1.pom
[INFO] Downloaded: https://repo.maven.apache.org/maven2/org/apache/maven/surefire/surefire-providers/2.19.1/surefire-providers-2.19.1.pom (3 KB at 108.8 KB/sec)
[INFO] Downloading: https://oss.sonatype.org/content/groups/public/org/apache/maven/surefire/common-junit48/2.19.1/common-junit48-2.19.1.pom
[INFO] Downloading: https://repo.maven.apache.org/maven2/org/apache/maven/surefire/common-junit48/2.19.1/common-junit48-2.19.1.pom
[INFO] Downloaded: https://repo.maven.apache.org/maven2/org/apache/maven/surefire/common-junit48/2.19.1/common-junit48-2.19.1.pom (4 KB at 86.0 KB/sec)
[INFO] Downloading: https://oss.sonatype.org/content/groups/public/org/apache/maven/surefire/common-junit4/2.19.1/common-junit4-2.19.1.pom
[INFO] Downloading: https://repo.maven.apache.org/maven2/org/apache/maven/surefire/common-junit4/2.19.1/common-junit4-2.19.1.pom
[INFO] Downloaded: https://repo.maven.apache.org/maven2/org/apache/maven/surefire/common-junit4/2.19.1/common-junit4-2.19.1.pom (3 KB at 99.2 KB/sec)
[INFO] Downloading: https://oss.sonatype.org/content/groups/public/org/apache/maven/surefire/common-junit3/2.19.1/common-junit3-2.19.1.pom
[INFO] Downloading: https://repo.maven.apache.org/maven2/org/apache/maven/surefire/common-junit3/2.19.1/common-junit3-2.19.1.pom
[INFO] Downloaded: https://repo.maven.apache.org/maven2/org/apache/maven/surefire/common-junit3/2.19.1/common-junit3-2.19.1.pom (2 KB at 67.0 KB/sec)
[INFO] Downloading: https://oss.sonatype.org/content/groups/public/org/apache/maven/surefire/common-java5/2.19.1/common-java5-2.19.1.pom
[INFO] Downloading: https://repo.maven.apache.org/maven2/org/apache/maven/surefire/common-java5/2.19.1/common-java5-2.19.1.pom
[INFO] Downloaded: https://repo.maven.apache.org/maven2/org/apache/maven/surefire/common-java5/2.19.1/common-java5-2.19.1.pom (3 KB at 113.7 KB/sec)
[INFO] Downloading: https://oss.sonatype.org/content/groups/public/org/apache/maven/shared/maven-shared-utils/0.9/maven-shared-utils-0.9.pom
[INFO] Downloading: https://repo.maven.apache.org/maven2/org/apache/maven/shared/maven-shared-utils/0.9/maven-shared-utils-0.9.pom
[INFO] Downloaded: https://repo.maven.apache.org/maven2/org/apache/maven/shared/maven-shared-utils/0.9/maven-shared-utils-0.9.pom (7 KB at 225.2 KB/sec)
[INFO] Downloading: https://oss.sonatype.org/content/groups/public/org/apache/maven/surefire/surefire-grouper/2.19.1/surefire-grouper-2.19.1.pom
[INFO] Downloading: https://repo.maven.apache.org/maven2/org/apache/maven/surefire/surefire-grouper/2.19.1/surefire-grouper-2.19.1.pom
[INFO] Downloaded: https://repo.maven.apache.org/maven2/org/apache/maven/surefire/surefire-grouper/2.19.1/surefire-grouper-2.19.1.pom (3 KB at 75.5 KB/sec)
[INFO] Downloading: https://oss.sonatype.org/content/groups/public/org/apache/maven/surefire/surefire-junit47/2.19.1/surefire-junit47-2.19.1.jar
[INFO] Downloading: https://oss.sonatype.org/content/groups/public/org/apache/maven/surefire/common-junit48/2.19.1/common-junit48-2.19.1.jar
[INFO] Downloading: https://oss.sonatype.org/content/groups/public/org/apache/maven/surefire/common-junit3/2.19.1/common-junit3-2.19.1.jar
[INFO] Downloading: https://oss.sonatype.org/content/groups/public/org/apache/maven/surefire/common-java5/2.19.1/common-java5-2.19.1.jar
[INFO] Downloading: https://oss.sonatype.org/content/groups/public/org/apache/maven/surefire/common-junit4/2.19.1/common-junit4-2.19.1.jar
[INFO] Downloading: https://repo.maven.apache.org/maven2/org/apache/maven/surefire/common-java5/2.19.1/common-java5-2.19.1.jar
[INFO] Downloading: https://repo.maven.apache.org/maven2/org/apache/maven/surefire/common-junit48/2.19.1/common-junit48-2.19.1.jar
[INFO] Downloading: https://repo.maven.apache.org/maven2/org/apache/maven/surefire/common-junit3/2.19.1/common-junit3-2.19.1.jar
[INFO] Downloading: https://repo.maven.apache.org/maven2/org/apache/maven/surefire/surefire-junit47/2.19.1/surefire-junit47-2.19.1.jar
[INFO] Downloading: https://repo.maven.apache.org/maven2/org/apache/maven/surefire/common-junit4/2.19.1/common-junit4-2.19.1.jar
[INFO] Downloaded: https://repo.maven.apache.org/maven2/org/apache/maven/surefire/common-junit3/2.19.1/common-junit3-2.19.1.jar (12 KB at 103.1 KB/sec)
[INFO] Downloaded: https://repo.maven.apache.org/maven2/org/apache/maven/surefire/common-junit48/2.19.1/common-junit48-2.19.1.jar (23 KB at 192.5 KB/sec)
[INFO] Downloaded: https://repo.maven.apache.org/maven2/org/apache/maven/surefire/common-java5/2.19.1/common-java5-2.19.1.jar (44 KB at 362.1 KB/sec)
[INFO] Downloading: https://oss.sonatype.org/content/groups/public/org/apache/maven/shared/maven-shared-utils/0.9/maven-shared-utils-0.9.jar
[INFO] Downloading: https://oss.sonatype.org/content/groups/public/org/apache/maven/surefire/surefire-grouper/2.19.1/surefire-grouper-2.19.1.jar
[INFO] Downloaded: https://repo.maven.apache.org/maven2/org/apache/maven/surefire/common-junit4/2.19.1/common-junit4-2.19.1.jar (26 KB at 253.0 KB/sec)
[INFO] Downloaded: https://repo.maven.apache.org/maven2/org/apache/maven/surefire/surefire-junit47/2.19.1/surefire-junit47-2.19.1.jar (150 KB at 924.8 KB/sec)
[INFO] Downloading: https://repo.maven.apache.org/maven2/org/apache/maven/surefire/surefire-grouper/2.19.1/surefire-grouper-2.19.1.jar
[INFO] Downloading: https://repo.maven.apache.org/maven2/org/apache/maven/shared/maven-shared-utils/0.9/maven-shared-utils-0.9.jar
[INFO] Downloaded: https://repo.maven.apache.org/maven2/org/apache/maven/surefire/surefire-grouper/2.19.1/surefire-grouper-2.19.1.jar (38 KB at 720.6 KB/sec)
[INFO] Downloaded: https://repo.maven.apache.org/maven2/org/apache/maven/shared/maven-shared-utils/0.9/maven-shared-utils-0.9.jar (168 KB at 2661.1 KB/sec)

-------------------------------------------------------
 T E S T S
-------------------------------------------------------
Running com.zerocracy.pmo.banks.FkBankTest
Tests run: 8, Failures: 0, Errors: 0, Skipped: 0, Time elapsed: 1.536 sec - in com.zerocracy.pmo.banks.FkBankTest
Running [/add_to_slack]
Tests run: 1, Failures: 0, Errors: 0, Skipped: 0, Time elapsed: 1.224 sec - in [/add_to_slack]
Running com.zerocracy.radars.viber.VbBotTest
Tests run: 1, Failures: 0, Errors: 0, Skipped: 0, Time elapsed: 1.668 sec - in com.zerocracy.radars.viber.VbBotTest
Running [modifies_vacation_mode on]
Tests run: 2, Failures: 0, Errors: 0, Skipped: 0, Time elapsed: 4.217 sec - in [modifies_vacation_mode on]
Running com.zerocracy.pm.cost.VestingTest
Tests run: 2, Failures: 0, Errors: 0, Skipped: 0, Time elapsed: 0.245 sec - in com.zerocracy.pm.cost.VestingTest
Running com.zerocracy.pmo.DebtsTest
Tests run: 4, Failures: 0, Errors: 0, Skipped: 0, Time elapsed: 0.919 sec - in com.zerocracy.pmo.DebtsTest
Running com.zerocracy.entry.ExtMongoTest
Tests run: 3, Failures: 0, Errors: 0, Skipped: 1, Time elapsed: 0.42 sec - in com.zerocracy.entry.ExtMongoTest
Running com.zerocracy.ParTest
Tests run: 5, Failures: 0, Errors: 0, Skipped: 0, Time elapsed: 0.01 sec - in com.zerocracy.ParTest
Running com.zerocracy.entry.HeapDumpTest
Tests run: 5, Failures: 0, Errors: 0, Skipped: 0, Time elapsed: 0.22 sec - in com.zerocracy.entry.HeapDumpTest
Running com.zerocracy.farm.fake.FkProjectTest
Tests run: 4, Failures: 0, Errors: 0, Skipped: 0, Time elapsed: 0.019 sec - in com.zerocracy.farm.fake.FkProjectTest
Running com.zerocracy.pmo.BotsTest
Tests run: 1, Failures: 0, Errors: 0, Skipped: 0, Time elapsed: 0.252 sec - in com.zerocracy.pmo.BotsTest
Running com.zerocracy.pm.staff.votes.VsNoRoomTest
Tests run: 1, Failures: 0, Errors: 0, Skipped: 0, Time elapsed: 0.634 sec - in com.zerocracy.pm.staff.votes.VsNoRoomTest
Running com.zerocracy.pmo.CatalogTest
Tests run: 7, Failures: 0, Errors: 0, Skipped: 0, Time elapsed: 0.439 sec - in com.zerocracy.pmo.CatalogTest
Running com.zerocracy.farm.SmartFarmTest
swallowed exception: java.lang.IllegalStateException('http://datum.zerocracy.com/latest/rules/pm/no-lost-orders.xsl says: The order for job "gh:test/test#22" exists in orders.xml, but the job is absent in the WBS among 0 jobs.')
Tests run: 6, Failures: 0, Errors: 0, Skipped: 0, Time elapsed: 9.216 sec - in com.zerocracy.farm.SmartFarmTest
Running com.zerocracy.radars.slack.RealSkSessionTest
Tests run: 1, Failures: 0, Errors: 0, Skipped: 0, Time elapsed: 9.063 sec - in com.zerocracy.radars.slack.RealSkSessionTest
Running com.zerocracy.pm.staff.ElectionsTest
Tests run: 7, Failures: 0, Errors: 0, Skipped: 0, Time elapsed: 2.174 sec - in com.zerocracy.pm.staff.ElectionsTest
Running com.zerocracy.farm.StkSafeTest
error: java.lang.IllegalArgumentException: Claim #2321839265 "hello you" has no token in hello
	at com.zerocracy.farm.StkSafe.process(StkSafe.java:107)
	at com.zerocracy.farm.StkSafeTest.catchesSoftException(StkSafeTest.java:55)
	at sun.reflect.NativeMethodAccessorImpl.invoke0(Native Method)
	at sun.reflect.NativeMethodAccessorImpl.invoke(NativeMethodAccessorImpl.java:62)
	at sun.reflect.DelegatingMethodAccessorImpl.invoke(DelegatingMethodAccessorImpl.java:43)
	at java.lang.reflect.Method.invoke(Method.java:498)
	at org.junit.runners.model.FrameworkMethod$1.runReflectiveCall(FrameworkMethod.java:50)
	at org.junit.internal.runners.model.ReflectiveCallable.run(ReflectiveCallable.java:12)
	at org.junit.runners.model.FrameworkMethod.invokeExplosively(FrameworkMethod.java:47)
	at org.junit.internal.runners.statements.InvokeMethod.evaluate(InvokeMethod.java:17)
	at org.junit.runners.ParentRunner.runLeaf(ParentRunner.java:325)
	at org.junit.runners.BlockJUnit4ClassRunner.runChild(BlockJUnit4ClassRunner.java:78)
	at org.junit.runners.BlockJUnit4ClassRunner.runChild(BlockJUnit4ClassRunner.java:57)
	at org.junit.runners.ParentRunner$3.run(ParentRunner.java:290)
	at org.apache.maven.surefire.junitcore.pc.Scheduler$1.run(Scheduler.java:393)
	at java.util.concurrent.Executors$RunnableAdapter.call(Executors.java:511)
	at java.util.concurrent.FutureTask.run(FutureTask.java:266)
	at java.util.concurrent.ThreadPoolExecutor.runWorker(ThreadPoolExecutor.java:1142)
	at java.util.concurrent.ThreadPoolExecutor$Worker.run(ThreadPoolExecutor.java:617)
	at java.lang.Thread.run(Thread.java:745)
Caused by: com.zerocracy.SoftException: 
	at com.zerocracy.farm.StkSafe.process(StkSafe.java:96)
	... 19 more

error: java.lang.IllegalStateException: error
	at com.zerocracy.farm.StkSafeTest$StkError.process(StkSafeTest.java:105)
	at com.zerocracy.farm.StkSafe.process(StkSafe.java:96)
	at com.zerocracy.farm.StkSafeTest.dontRepostNotifyFailures(StkSafeTest.java:70)
	at sun.reflect.NativeMethodAccessorImpl.invoke0(Native Method)
	at sun.reflect.NativeMethodAccessorImpl.invoke(NativeMethodAccessorImpl.java:62)
	at sun.reflect.DelegatingMethodAccessorImpl.invoke(DelegatingMethodAccessorImpl.java:43)
	at java.lang.reflect.Method.invoke(Method.java:498)
	at org.junit.runners.model.FrameworkMethod$1.runReflectiveCall(FrameworkMethod.java:50)
	at org.junit.internal.runners.model.ReflectiveCallable.run(ReflectiveCallable.java:12)
	at org.junit.runners.model.FrameworkMethod.invokeExplosively(FrameworkMethod.java:47)
	at org.junit.internal.runners.statements.InvokeMethod.evaluate(InvokeMethod.java:17)
	at org.junit.runners.ParentRunner.runLeaf(ParentRunner.java:325)
	at org.junit.runners.BlockJUnit4ClassRunner.runChild(BlockJUnit4ClassRunner.java:78)
	at org.junit.runners.BlockJUnit4ClassRunner.runChild(BlockJUnit4ClassRunner.java:57)
	at org.junit.runners.ParentRunner$3.run(ParentRunner.java:290)
	at org.apache.maven.surefire.junitcore.pc.Scheduler$1.run(Scheduler.java:393)
	at java.util.concurrent.Executors$RunnableAdapter.call(Executors.java:511)
	at java.util.concurrent.FutureTask.run(FutureTask.java:266)
	at java.util.concurrent.ThreadPoolExecutor.runWorker(ThreadPoolExecutor.java:1142)
	at java.util.concurrent.ThreadPoolExecutor$Worker.run(ThreadPoolExecutor.java:617)
	at java.lang.Thread.run(Thread.java:745)

error: java.lang.IllegalStateException: error
	at com.zerocracy.farm.StkSafeTest$StkError.process(StkSafeTest.java:105)
	at com.zerocracy.farm.StkSafe.process(StkSafe.java:96)
	at com.zerocracy.farm.StkSafeTest.dontRepeatErrorClaims(StkSafeTest.java:89)
	at sun.reflect.NativeMethodAccessorImpl.invoke0(Native Method)
	at sun.reflect.NativeMethodAccessorImpl.invoke(NativeMethodAccessorImpl.java:62)
	at sun.reflect.DelegatingMethodAccessorImpl.invoke(DelegatingMethodAccessorImpl.java:43)
	at java.lang.reflect.Method.invoke(Method.java:498)
	at org.junit.runners.model.FrameworkMethod$1.runReflectiveCall(FrameworkMethod.java:50)
	at org.junit.internal.runners.model.ReflectiveCallable.run(ReflectiveCallable.java:12)
	at org.junit.runners.model.FrameworkMethod.invokeExplosively(FrameworkMethod.java:47)
	at org.junit.internal.runners.statements.InvokeMethod.evaluate(InvokeMethod.java:17)
	at org.junit.runners.ParentRunner.runLeaf(ParentRunner.java:325)
	at org.junit.runners.BlockJUnit4ClassRunner.runChild(BlockJUnit4ClassRunner.java:78)
	at org.junit.runners.BlockJUnit4ClassRunner.runChild(BlockJUnit4ClassRunner.java:57)
	at org.junit.runners.ParentRunner$3.run(ParentRunner.java:290)
	at org.apache.maven.surefire.junitcore.pc.Scheduler$1.run(Scheduler.java:393)
	at java.util.concurrent.Executors$RunnableAdapter.call(Executors.java:511)
	at java.util.concurrent.FutureTask.run(FutureTask.java:266)
	at java.util.concurrent.ThreadPoolExecutor.runWorker(ThreadPoolExecutor.java:1142)
	at java.util.concurrent.ThreadPoolExecutor$Worker.run(ThreadPoolExecutor.java:617)
	at java.lang.Thread.run(Thread.java:745)

Tests run: 3, Failures: 0, Errors: 0, Skipped: 0, Time elapsed: 1.509 sec - in com.zerocracy.farm.StkSafeTest
Running com.zerocracy.tk.TkDumpTest
Tests run: 1, Failures: 0, Errors: 0, Skipped: 0, Time elapsed: 0.015 sec - in com.zerocracy.tk.TkDumpTest
Running com.zerocracy.pmo.ResumesTest
Tests run: 2, Failures: 0, Errors: 0, Skipped: 0, Time elapsed: 0.288 sec - in com.zerocracy.pmo.ResumesTest
Running com.zerocracy.radars.github.ReQuestionTest
Tests run: 1, Failures: 0, Errors: 0, Skipped: 0, Time elapsed: 0.437 sec - in com.zerocracy.radars.github.ReQuestionTest
Running com.zerocracy.radars.github.RbPingArchitectTest
Tests run: 3, Failures: 0, Errors: 0, Skipped: 0, Time elapsed: 0.181 sec - in com.zerocracy.radars.github.RbPingArchitectTest
Running com.zerocracy.tk.project.TkClaimTest
Tests run: 3, Failures: 0, Errors: 0, Skipped: 0, Time elapsed: 90.828 sec - in com.zerocracy.tk.project.TkClaimTest
Running com.zerocracy.pm.staff.BansTest
Tests run: 2, Failures: 0, Errors: 0, Skipped: 0, Time elapsed: 0.013 sec - in com.zerocracy.pm.staff.BansTest
Running com.zerocracy.pmo.OptionsTest
Tests run: 9, Failures: 0, Errors: 0, Skipped: 0, Time elapsed: 0.23 sec - in com.zerocracy.pmo.OptionsTest
Running com.zerocracy.farm.footprint.FtFarmTest
Tests run: 1, Failures: 0, Errors: 0, Skipped: 0, Time elapsed: 2.372 sec - in com.zerocracy.farm.footprint.FtFarmTest
Running com.zerocracy.tk.TkBoardTest
Tests run: 3, Failures: 0, Errors: 0, Skipped: 0, Time elapsed: 1.472 sec - in com.zerocracy.tk.TkBoardTest
Running com.zerocracy.pmo.SpeedTest
Tests run: 3, Failures: 0, Errors: 0, Skipped: 0, Time elapsed: 0.073 sec - in com.zerocracy.pmo.SpeedTest
Running com.zerocracy.entry.PingTest
Sentry threw an error: java.lang.IllegalStateException: Farm error
	at com.zerocracy.entry.PingTest.lambda$throwJobExecutionExceptionOnClaimFail$1(PingTest.java:144)
	at com.zerocracy.pmo.Pmo.lambda$new$0(Pmo.java:51)
	at org.cactoos.scalar.SolidScalar.lambda$new$0(SolidScalar.java:55)
	at org.cactoos.func.StickyFunc.lambda$new$0(StickyFunc.java:72)
	at org.cactoos.func.StickyBiFunc.apply(StickyBiFunc.java:95)
	at org.cactoos.func.StickyFunc.apply(StickyFunc.java:79)
	at org.cactoos.func.SyncFunc.apply(SyncFunc.java:101)
	at org.cactoos.func.SolidFunc.apply(SolidFunc.java:66)
	at org.cactoos.scalar.SolidScalar.value(SolidScalar.java:61)
	at org.cactoos.scalar.IoCheckedScalar.value(IoCheckedScalar.java:70)
	at com.zerocracy.pmo.Pmo.acq(Pmo.java:62)
	at com.zerocracy.farm.props.Props.item(Props.java:135)
	at com.zerocracy.farm.props.Props.values(Props.java:122)
	at com.zerocracy.farm.props.Props.has(Props.java:112)
	at com.zerocracy.sentry.SentryOf.lambda$static$0(SentryOf.java:46)
	at org.cactoos.func.StickyFunc.lambda$new$0(StickyFunc.java:72)
	at org.cactoos.func.StickyBiFunc.apply(StickyBiFunc.java:95)
	at org.cactoos.func.StickyFunc.apply(StickyFunc.java:79)
	at org.cactoos.func.SyncFunc.apply(SyncFunc.java:101)
	at org.cactoos.func.SolidFunc.apply(SolidFunc.java:66)
	at org.cactoos.func.UncheckedFunc.lambda$apply$0(UncheckedFunc.java:58)
	at org.cactoos.scalar.IoCheckedScalar.value(IoCheckedScalar.java:70)
	at org.cactoos.scalar.UncheckedScalar.value(UncheckedScalar.java:58)
	at org.cactoos.func.UncheckedFunc.apply(UncheckedFunc.java:59)
	at com.zerocracy.sentry.SentryOf.capture(SentryOf.java:76)
	at com.zerocracy.sentry.SafeSentry.capture(SafeSentry.java:59)
	at com.zerocracy.entry.Ping.execute(Ping.java:74)
	at com.zerocracy.entry.PingTest.throwJobExecutionExceptionOnClaimFail(PingTest.java:147)
	at sun.reflect.NativeMethodAccessorImpl.invoke0(Native Method)
	at sun.reflect.NativeMethodAccessorImpl.invoke(NativeMethodAccessorImpl.java:62)
	at sun.reflect.DelegatingMethodAccessorImpl.invoke(DelegatingMethodAccessorImpl.java:43)
	at java.lang.reflect.Method.invoke(Method.java:498)
	at org.junit.runners.model.FrameworkMethod$1.runReflectiveCall(FrameworkMethod.java:50)
	at org.junit.internal.runners.model.ReflectiveCallable.run(ReflectiveCallable.java:12)
	at org.junit.runners.model.FrameworkMethod.invokeExplosively(FrameworkMethod.java:47)
	at org.junit.internal.runners.statements.InvokeMethod.evaluate(InvokeMethod.java:17)
	at org.junit.internal.runners.statements.ExpectException.evaluate(ExpectException.java:19)
	at org.junit.runners.ParentRunner.runLeaf(ParentRunner.java:325)
	at org.junit.runners.BlockJUnit4ClassRunner.runChild(BlockJUnit4ClassRunner.java:78)
	at org.junit.runners.BlockJUnit4ClassRunner.runChild(BlockJUnit4ClassRunner.java:57)
	at org.junit.runners.ParentRunner$3.run(ParentRunner.java:290)
	at org.apache.maven.surefire.junitcore.pc.Scheduler$1.run(Scheduler.java:393)
	at java.util.concurrent.Executors$RunnableAdapter.call(Executors.java:511)
	at java.util.concurrent.FutureTask.run(FutureTask.java:266)
	at java.util.concurrent.ThreadPoolExecutor.runWorker(ThreadPoolExecutor.java:1142)
	at java.util.concurrent.ThreadPoolExecutor$Worker.run(ThreadPoolExecutor.java:617)
	at java.lang.Thread.run(Thread.java:745)

Tests run: 3, Failures: 0, Errors: 0, Skipped: 0, Time elapsed: 2.095 sec - in com.zerocracy.entry.PingTest
Running com.zerocracy.pm.ClaimOutTest
#error(): Claim param name "author" is prohibited to use in "Hello dude", since it will clash with other claim attributes
#fatalError(): Processing terminated by xsl:message at line 26 in file:///; SystemID: file:///; Line#: 26; Column#: 5
#error(): Duplicated flow detected, something is wrong: "Hey; Hey; Hey", seems to be an endless recursion in claims
#fatalError(): Processing terminated by xsl:message at line 28 in file:///; SystemID: file:///; Line#: 28
#error(): Claim cause "some text while a number expected" is not valid number
#fatalError(): Processing terminated by xsl:message at line 26 in file:///; SystemID: file:///; Line#: 26; Column#: 6
#error(): Job name "this is not a job" is not valid
#fatalError(): Processing terminated by xsl:message at line 27 in file:///; SystemID: file:///; Line#: 27; Column#: 6
#error(): Role name "this is not a role" is not valid
#fatalError(): Processing terminated by xsl:message at line 27 in file:///; SystemID: file:///; Line#: 27; Column#: 6
Tests run: 3, Failures: 0, Errors: 0, Skipped: 0, Time elapsed: 0.515 sec - in com.zerocracy.pm.ClaimOutTest
Running com.zerocracy.pm.time.PrecedencesTest
Tests run: 1, Failures: 0, Errors: 0, Skipped: 0, Time elapsed: 0.154 sec - in com.zerocracy.pm.time.PrecedencesTest
Running com.zerocracy.pmo.HintTest
Tests run: 1, Failures: 0, Errors: 0, Skipped: 0, Time elapsed: 1.513 sec - in com.zerocracy.pmo.HintTest
Running com.zerocracy.tk.TkJoinPostTest
Tests run: 4, Failures: 0, Errors: 0, Skipped: 0, Time elapsed: 0.729 sec - in com.zerocracy.tk.TkJoinPostTest
Running com.zerocracy.pm.time.MilestonesTest
Tests run: 1, Failures: 0, Errors: 0, Skipped: 0, Time elapsed: 0.012 sec - in com.zerocracy.pm.time.MilestonesTest
Running com.zerocracy.claims.BatchClaimsTest
Tests run: 1, Failures: 0, Errors: 0, Skipped: 0, Time elapsed: 1.476 sec - in com.zerocracy.claims.BatchClaimsTest
Running com.zerocracy.tk.profile.TkProfileTest
Tests run: 6, Failures: 0, Errors: 0, Skipped: 0, Time elapsed: 0.974 sec - in com.zerocracy.tk.profile.TkProfileTest
Running com.zerocracy.tk.RsPageTest
Tests run: 1, Failures: 0, Errors: 0, Skipped: 0, Time elapsed: 0.071 sec - in com.zerocracy.tk.RsPageTest
Running com.zerocracy.pm.FootprintTest
Duplicate claims are not allowed in FOOTPRNTZ, can't add this XML to 1 existing ones:
<?xml version="1.0" encoding="UTF-8"?>
<claim id="2321840561">
   <created>2018-08-20T16:40:56.408Z</created>
   <type>Hello</type>
</claim>

Tests run: 4, Failures: 0, Errors: 0, Skipped: 0, Time elapsed: 5.486 sec - in com.zerocracy.pm.FootprintTest
Running com.zerocracy.pm.staff.votes.VsReputationTest
Tests run: 1, Failures: 0, Errors: 0, Skipped: 0, Time elapsed: 0.077 sec - in com.zerocracy.pm.staff.votes.VsReputationTest
Running com.zerocracy.farm.sync.SyncProjectTest
Tests run: 1, Failures: 0, Errors: 0, Skipped: 0, Time elapsed: 0.031 sec - in com.zerocracy.farm.sync.SyncProjectTest
Running com.zerocracy.radars.github.RbOnBugTest
Tests run: 1, Failures: 0, Errors: 0, Skipped: 0, Time elapsed: 0.313 sec - in com.zerocracy.radars.github.RbOnBugTest
Running com.zerocracy.tk.project.TkFootprintTest
Tests run: 2, Failures: 0, Errors: 0, Skipped: 0, Time elapsed: 2.288 sec - in com.zerocracy.tk.project.TkFootprintTest
Running com.zerocracy.XocumentTest
Tests run: 2, Failures: 0, Errors: 0, Skipped: 1, Time elapsed: 1.204 sec - in com.zerocracy.XocumentTest
Running com.zerocracy.pmo.ProjectsTest
Tests run: 1, Failures: 0, Errors: 0, Skipped: 0, Time elapsed: 0.01 sec - in com.zerocracy.pmo.ProjectsTest
Running com.zerocracy.pm.in.ImpedimentsTest
Tests run: 3, Failures: 0, Errors: 0, Skipped: 0, Time elapsed: 0.134 sec - in com.zerocracy.pm.in.ImpedimentsTest
Running com.zerocracy.pm.in.OrdersTest
Tests run: 3, Failures: 0, Errors: 0, Skipped: 0, Time elapsed: 0.505 sec - in com.zerocracy.pm.in.OrdersTest
Running com.zerocracy.farm.reactive.RvAliveTest
Tests run: 1, Failures: 0, Errors: 0, Skipped: 0, Time elapsed: 0.043 sec - in com.zerocracy.farm.reactive.RvAliveTest
Running com.zerocracy.pmo.PeopleTest
Tests run: 46, Failures: 0, Errors: 0, Skipped: 0, Time elapsed: 7.106 sec - in com.zerocracy.pmo.PeopleTest
Running com.zerocracy.tk.TkPulseTest
Tests run: 1, Failures: 0, Errors: 0, Skipped: 0, Time elapsed: 1.267 sec - in com.zerocracy.tk.TkPulseTest
Running com.zerocracy.radars.gitlab.TkGitlabTest
Tests run: 3, Failures: 0, Errors: 0, Skipped: 0, Time elapsed: 0.015 sec - in com.zerocracy.radars.gitlab.TkGitlabTest
Running com.zerocracy.tk.profile.TkIdentifyTest
Tests run: 1, Failures: 0, Errors: 0, Skipped: 0, Time elapsed: 1.265 sec - in com.zerocracy.tk.profile.TkIdentifyTest
Running com.zerocracy.tk.project.TkReportTest
Tests run: 1, Failures: 0, Errors: 0, Skipped: 0, Time elapsed: 0.511 sec - in com.zerocracy.tk.project.TkReportTest
Running com.zerocracy.cash.PairTest
Tests run: 10, Failures: 0, Errors: 0, Skipped: 0, Time elapsed: 0.326 sec - in com.zerocracy.cash.PairTest
Running com.zerocracy.cash.CurrencyTest
Tests run: 2, Failures: 0, Errors: 0, Skipped: 0, Time elapsed: 0.001 sec - in com.zerocracy.cash.CurrencyTest
Running com.zerocracy.XsdResolverTest
Tests run: 6, Failures: 0, Errors: 0, Skipped: 0, Time elapsed: 0.346 sec - in com.zerocracy.XsdResolverTest
Running com.zerocracy.radars.viber.TkViberTest
Tests run: 3, Failures: 0, Errors: 0, Skipped: 0, Time elapsed: 0.251 sec - in com.zerocracy.radars.viber.TkViberTest
Running com.zerocracy.radars.github.RbOnCloseTest
Tests run: 2, Failures: 0, Errors: 0, Skipped: 0, Time elapsed: 0.295 sec - in com.zerocracy.radars.github.RbOnCloseTest
Running com.zerocracy.tk.TkJoinTest
Tests run: 2, Failures: 0, Errors: 0, Skipped: 1, Time elapsed: 0.804 sec - in com.zerocracy.tk.TkJoinTest
Running com.zerocracy.pm.ClaimOutSafeTest
Failed to post claim: java.lang.IllegalStateException: submit failed
	at com.zerocracy.pm.ClaimOutSafeTest.lambda$swallowAllExceptions$0(ClaimOutSafeTest.java:41)
	at com.zerocracy.claims.ClaimOut.postTo(ClaimOut.java:105)
	at com.zerocracy.claims.ClaimOutSafe.postTo(ClaimOutSafe.java:51)
	at com.zerocracy.pm.ClaimOutSafeTest.swallowAllExceptions(ClaimOutSafeTest.java:39)
	at sun.reflect.NativeMethodAccessorImpl.invoke0(Native Method)
	at sun.reflect.NativeMethodAccessorImpl.invoke(NativeMethodAccessorImpl.java:62)
	at sun.reflect.DelegatingMethodAccessorImpl.invoke(DelegatingMethodAccessorImpl.java:43)
	at java.lang.reflect.Method.invoke(Method.java:498)
	at org.junit.runners.model.FrameworkMethod$1.runReflectiveCall(FrameworkMethod.java:50)
	at org.junit.internal.runners.model.ReflectiveCallable.run(ReflectiveCallable.java:12)
	at org.junit.runners.model.FrameworkMethod.invokeExplosively(FrameworkMethod.java:47)
	at org.junit.internal.runners.statements.InvokeMethod.evaluate(InvokeMethod.java:17)
	at org.junit.rules.ExpectedException$ExpectedExceptionStatement.evaluate(ExpectedException.java:239)
	at org.junit.rules.RunRules.evaluate(RunRules.java:20)
	at org.junit.runners.ParentRunner.runLeaf(ParentRunner.java:325)
	at org.junit.runners.BlockJUnit4ClassRunner.runChild(BlockJUnit4ClassRunner.java:78)
	at org.junit.runners.BlockJUnit4ClassRunner.runChild(BlockJUnit4ClassRunner.java:57)
	at org.junit.runners.ParentRunner$3.run(ParentRunner.java:290)
	at org.apache.maven.surefire.junitcore.pc.Scheduler$1.run(Scheduler.java:393)
	at java.util.concurrent.Executors$RunnableAdapter.call(Executors.java:511)
	at java.util.concurrent.FutureTask.run(FutureTask.java:266)
	at java.util.concurrent.ThreadPoolExecutor.runWorker(ThreadPoolExecutor.java:1142)
	at java.util.concurrent.ThreadPoolExecutor$Worker.run(ThreadPoolExecutor.java:617)
	at java.lang.Thread.run(Thread.java:745)

Tests run: 1, Failures: 0, Errors: 0, Skipped: 0, Time elapsed: 0.076 sec - in com.zerocracy.pm.ClaimOutSafeTest
Running com.zerocracy.pm.cost.BoostsTest
Tests run: 3, Failures: 0, Errors: 0, Skipped: 0, Time elapsed: 0.095 sec - in com.zerocracy.pm.cost.BoostsTest
Running com.zerocracy.pm.ClaimsItemTest
Duplicate claims are not allowed in FAKEPRJCT, can't add this XML to 1 existing ones:
<?xml version="1.0" encoding="UTF-8"?>
<claim id="2321842777">
   <created>2018-08-20T16:42:13.423Z</created>
   <type>hello future</type>
</claim>

Tests run: 6, Failures: 0, Errors: 0, Skipped: 2, Time elapsed: 0.06 sec - in com.zerocracy.pm.ClaimsItemTest
Running com.zerocracy.tk.TkTicksTest
Tests run: 2, Failures: 0, Errors: 0, Skipped: 0, Time elapsed: 5.11 sec - in com.zerocracy.tk.TkTicksTest
Running com.zerocracy.pm.staff.ranks.RnkRevTest
Tests run: 1, Failures: 0, Errors: 0, Skipped: 0, Time elapsed: 0.249 sec - in com.zerocracy.pm.staff.ranks.RnkRevTest
Running com.zerocracy.pm.cost.EstimatesTest
Tests run: 3, Failures: 0, Errors: 0, Skipped: 0, Time elapsed: 0.514 sec - in com.zerocracy.pm.cost.EstimatesTest
Running com.zerocracy.radars.github.RbMilestoneTest
Tests run: 1, Failures: 0, Errors: 0, Skipped: 0, Time elapsed: 0.08 sec - in com.zerocracy.radars.github.RbMilestoneTest
Running com.zerocracy.pm.ClaimInTest
Tests run: 4, Failures: 0, Errors: 0, Skipped: 0, Time elapsed: 0.009 sec - in com.zerocracy.pm.ClaimInTest
Running com.zerocracy.pmo.AgendaTest
Tests run: 9, Failures: 0, Errors: 0, Skipped: 0, Time elapsed: 0.23 sec - in com.zerocracy.pmo.AgendaTest
Running com.zerocracy.tk.TkShutdownTest
Tests run: 1, Failures: 0, Errors: 0, Skipped: 0, Time elapsed: 0.017 sec - in com.zerocracy.tk.TkShutdownTest
Running com.zerocracy.farm.SmartLockTest
Tests run: 4, Failures: 0, Errors: 0, Skipped: 0, Time elapsed: 0.032 sec - in com.zerocracy.farm.SmartLockTest
Running com.zerocracy.cash.CashTest
From EUR to USD: 0.800000
Tests run: 16, Failures: 0, Errors: 0, Skipped: 0, Time elapsed: 2.2 sec - in com.zerocracy.cash.CashTest
Running com.zerocracy.tk.project.reports.OrderChampionsTest
Tests run: 1, Failures: 0, Errors: 0, Skipped: 0, Time elapsed: 0.21 sec - in com.zerocracy.tk.project.reports.OrderChampionsTest
Running com.zerocracy.cash.ApiLayerQuotesTest
From EUR to USD: 0.800000
Tests run: 2, Failures: 0, Errors: 0, Skipped: 0, Time elapsed: 2.042 sec - in com.zerocracy.cash.ApiLayerQuotesTest
Running com.zerocracy.TxnTest
Tests run: 3, Failures: 0, Errors: 0, Skipped: 1, Time elapsed: 0.011 sec - in com.zerocracy.TxnTest
Running com.zerocracy.pm.staff.votes.VsLosersTest
Tests run: 1, Failures: 0, Errors: 0, Skipped: 0, Time elapsed: 0.017 sec - in com.zerocracy.pm.staff.votes.VsLosersTest
Running com.zerocracy.farm.ruled.RdFarmTest
Tests run: 2, Failures: 0, Errors: 0, Skipped: 0, Time elapsed: 1.557 sec - in com.zerocracy.farm.ruled.RdFarmTest
Running com.zerocracy.radars.slack.SlackRadarTest
Tests run: 2, Failures: 0, Errors: 0, Skipped: 0, Time elapsed: 1.621 sec - in com.zerocracy.radars.slack.SlackRadarTest
Running com.zerocracy.pm.time.ReleasesTest
Tests run: 2, Failures: 0, Errors: 0, Skipped: 0, Time elapsed: 0.304 sec - in com.zerocracy.pm.time.ReleasesTest
Running com.zerocracy.tk.TkTeamTest
Tests run: 2, Failures: 0, Errors: 0, Skipped: 0, Time elapsed: 0.981 sec - in com.zerocracy.tk.TkTeamTest
Running com.zerocracy.radars.viber.VbEventTest
Tests run: 2, Failures: 0, Errors: 0, Skipped: 0, Time elapsed: 0.003 sec - in com.zerocracy.radars.viber.VbEventTest
Running com.zerocracy.pm.staff.votes.VsOverElectedTest
Tests run: 3, Failures: 0, Errors: 0, Skipped: 0, Time elapsed: 0.315 sec - in com.zerocracy.pm.staff.votes.VsOverElectedTest
Running com.zerocracy.MeasuredTest
Tests run: 1, Failures: 0, Errors: 0, Skipped: 0, Time elapsed: 0.041 sec - in com.zerocracy.MeasuredTest
Running com.zerocracy.pm.staff.ranks.RnkGithubMilestoneTest
Tests run: 2, Failures: 0, Errors: 0, Skipped: 0, Time elapsed: 0.644 sec - in com.zerocracy.pm.staff.ranks.RnkGithubMilestoneTest
Running com.zerocracy.farm.S3ItemTest
Tests run: 5, Failures: 0, Errors: 0, Skipped: 0, Time elapsed: 0.15 sec - in com.zerocracy.farm.S3ItemTest
Running com.zerocracy.radars.github.RbByLabelTest
Tests run: 2, Failures: 0, Errors: 0, Skipped: 0, Time elapsed: 0.494 sec - in com.zerocracy.radars.github.RbByLabelTest
Running com.zerocracy.pm.cost.LedgerTest
Tests run: 3, Failures: 0, Errors: 0, Skipped: 0, Time elapsed: 0.358 sec - in com.zerocracy.pm.cost.LedgerTest
Running com.zerocracy.farm.sync.SyncFarmTest
Thread 16332/Thread-419 interrupted because of too long hold of "expectedfailure.xml" in PMO (over 1000 msec), 53b050d8b71f/1s/0/1/true/false by Thread-419: java.lang.IllegalStateException: Here!
	at com.zerocracy.farm.sync.Terminator.killer(Terminator.java:138)
	at com.zerocracy.farm.sync.Terminator.submit(Terminator.java:116)
	at com.zerocracy.farm.sync.SyncProject.acq(SyncProject.java:95)
	at com.zerocracy.pmo.Pmo.acq(Pmo.java:62)
	at com.zerocracy.farm.sync.SyncFarmTest.lambda$interruptsTooLongThread$1(SyncFarmTest.java:89)
	at org.cactoos.func.FuncOf.lambda$new$3(FuncOf.java:88)
	at org.cactoos.func.FuncOf.apply(FuncOf.java:104)
	at org.cactoos.func.UncheckedFunc.lambda$apply$0(UncheckedFunc.java:58)
	at org.cactoos.scalar.IoCheckedScalar.value(IoCheckedScalar.java:70)
	at org.cactoos.scalar.UncheckedScalar.value(UncheckedScalar.java:58)
	at org.cactoos.func.UncheckedFunc.apply(UncheckedFunc.java:59)
	at org.cactoos.func.RunnableOf.run(RunnableOf.java:89)
	at java.lang.Thread.run(Thread.java:745)

Sentry threw an error: java.lang.IllegalArgumentException: Unacceptable file name: "_props.xml"
	at com.zerocracy.farm.S3Project.acq(S3Project.java:129)
	at com.zerocracy.pmo.Pmo.acq(Pmo.java:62)
	at com.zerocracy.farm.props.Props.item(Props.java:135)
	at com.zerocracy.farm.props.Props.values(Props.java:122)
	at com.zerocracy.farm.props.Props.has(Props.java:112)
	at com.zerocracy.sentry.SentryOf.lambda$static$0(SentryOf.java:46)
	at org.cactoos.func.StickyFunc.lambda$new$0(StickyFunc.java:72)
	at org.cactoos.func.StickyBiFunc.apply(StickyBiFunc.java:95)
	at org.cactoos.func.StickyFunc.apply(StickyFunc.java:79)
	at org.cactoos.func.SyncFunc.apply(SyncFunc.java:101)
	at org.cactoos.func.SolidFunc.apply(SolidFunc.java:66)
	at org.cactoos.func.UncheckedFunc.lambda$apply$0(UncheckedFunc.java:58)
	at org.cactoos.scalar.IoCheckedScalar.value(IoCheckedScalar.java:70)
	at org.cactoos.scalar.UncheckedScalar.value(UncheckedScalar.java:58)
	at org.cactoos.func.UncheckedFunc.apply(UncheckedFunc.java:59)
	at com.zerocracy.sentry.SentryOf.capture(SentryOf.java:76)
	at com.zerocracy.sentry.SafeSentry.capture(SafeSentry.java:59)
	at com.zerocracy.farm.sync.Terminator.lambda$killer$1(Terminator.java:163)
	at org.cactoos.func.FuncOf.lambda$new$3(FuncOf.java:88)
	at org.cactoos.func.FuncOf.apply(FuncOf.java:104)
	at org.cactoos.func.UncheckedFunc.lambda$apply$0(UncheckedFunc.java:58)
	at org.cactoos.scalar.IoCheckedScalar.value(IoCheckedScalar.java:70)
	at org.cactoos.scalar.UncheckedScalar.value(UncheckedScalar.java:58)
	at org.cactoos.func.UncheckedFunc.apply(UncheckedFunc.java:59)
	at org.cactoos.func.RunnableOf.run(RunnableOf.java:89)
	at com.jcabi.log.VerboseRunnable.run(VerboseRunnable.java:190)
	at java.util.concurrent.Executors$RunnableAdapter.call(Executors.java:511)
	at java.util.concurrent.FutureTask.run(FutureTask.java:266)
	at java.util.concurrent.ThreadPoolExecutor.runWorker(ThreadPoolExecutor.java:1142)
	at java.util.concurrent.ThreadPoolExecutor$Worker.run(ThreadPoolExecutor.java:617)
	at com.jcabi.log.VerboseThreads$Wrap.run(VerboseThreads.java:221)
	at java.lang.Thread.run(Thread.java:745)

Tests run: 2, Failures: 0, Errors: 0, Skipped: 0, Time elapsed: 1.077 sec - in com.zerocracy.farm.sync.SyncFarmTest
Running com.zerocracy.radars.github.RbReleaseTest
Tests run: 1, Failures: 0, Errors: 0, Skipped: 0, Time elapsed: 0.233 sec - in com.zerocracy.radars.github.RbReleaseTest
Running com.zerocracy.farm.props.PropsFarmTest
Tests run: 2, Failures: 0, Errors: 0, Skipped: 0, Time elapsed: 0.002 sec - in com.zerocracy.farm.props.PropsFarmTest
Running com.zerocracy.tk.CcSecureTest
Tests run: 1, Failures: 0, Errors: 0, Skipped: 0, Time elapsed: 0.006 sec - in com.zerocracy.tk.CcSecureTest
Running com.zerocracy.radars.github.ReIfAddressedTest
Tests run: 3, Failures: 0, Errors: 0, Skipped: 0, Time elapsed: 0.166 sec - in com.zerocracy.radars.github.ReIfAddressedTest
Running com.zerocracy.tk.project.TkArtifactTest
Tests run: 3, Failures: 0, Errors: 0, Skipped: 0, Time elapsed: 1.292 sec - in com.zerocracy.tk.project.TkArtifactTest
Running com.zerocracy.farm.S3FarmTest
Tests run: 4, Failures: 0, Errors: 0, Skipped: 0, Time elapsed: 1.519 sec - in com.zerocracy.farm.S3FarmTest
Running com.zerocracy.pm.staff.ranks.RnkBoostTest
Tests run: 1, Failures: 0, Errors: 0, Skipped: 0, Time elapsed: 0.802 sec - in com.zerocracy.pm.staff.ranks.RnkBoostTest
Running com.zerocracy.cash.QuotesTest
Tests run: 1, Failures: 0, Errors: 0, Skipped: 0, Time elapsed: 0 sec - in com.zerocracy.cash.QuotesTest
Running com.zerocracy.farm.reactive.BrigadeTest
Tests run: 3, Failures: 0, Errors: 0, Skipped: 0, Time elapsed: 1.379 sec - in com.zerocracy.farm.reactive.BrigadeTest
Running com.zerocracy.tk.RqUserTest
Tests run: 1, Failures: 0, Errors: 0, Skipped: 0, Time elapsed: 0.087 sec - in com.zerocracy.tk.RqUserTest
Running com.zerocracy.pmo.banks.PayrollTest
Tests run: 4, Failures: 0, Errors: 0, Skipped: 0, Time elapsed: 0.008 sec - in com.zerocracy.pmo.banks.PayrollTest
Running com.zerocracy.pmo.recharge.RechargeTest
Tests run: 1, Failures: 0, Errors: 0, Skipped: 0, Time elapsed: 0.589 sec - in com.zerocracy.pmo.recharge.RechargeTest
Running com.zerocracy.radars.github.AcceptInvitationsTest
GitHub API is over quota. Cancelling AcceptInvitations execution.
Tests run: 1, Failures: 0, Errors: 0, Skipped: 0, Time elapsed: 1.364 sec - in com.zerocracy.radars.github.AcceptInvitationsTest
Running com.zerocracy.farm.ruled.RdIndexTest
Tests run: 1, Failures: 0, Errors: 0, Skipped: 0, Time elapsed: 0.026 sec - in com.zerocracy.farm.ruled.RdIndexTest
Running com.zerocracy.farm.S3ProjectTest
Tests run: 2, Failures: 0, Errors: 0, Skipped: 0, Time elapsed: 0.1 sec - in com.zerocracy.farm.S3ProjectTest
Running com.zerocracy.claims.proc.CountingProcTest
Tests run: 2, Failures: 0, Errors: 0, Skipped: 0, Time elapsed: 0.74 sec - in com.zerocracy.claims.proc.CountingProcTest
Running com.zerocracy.pmo.RfpsTest
Tests run: 3, Failures: 0, Errors: 0, Skipped: 0, Time elapsed: 0.418 sec - in com.zerocracy.pmo.RfpsTest
Running com.zerocracy.pm.staff.votes.VsVacationTest
Tests run: 1, Failures: 0, Errors: 0, Skipped: 0, Time elapsed: 0.724 sec - in com.zerocracy.pm.staff.votes.VsVacationTest
Running com.zerocracy.farm.reactive.DefaultFlushTest
Tests run: 1, Failures: 0, Errors: 0, Skipped: 0, Time elapsed: 0.006 sec - in com.zerocracy.farm.reactive.DefaultFlushTest
Running com.zerocracy.PolicyTest
Tests run: 1, Failures: 0, Errors: 0, Skipped: 0, Time elapsed: 0.013 sec - in com.zerocracy.PolicyTest
Running com.zerocracy.pm.staff.RolesTest
Tests run: 2, Failures: 0, Errors: 0, Skipped: 0, Time elapsed: 0.216 sec - in com.zerocracy.pm.staff.RolesTest
Running com.zerocracy.pm.staff.votes.VsRandomTest
Tests run: 1, Failures: 0, Errors: 0, Skipped: 0, Time elapsed: 0.607 sec - in com.zerocracy.pm.staff.votes.VsRandomTest
Running com.zerocracy.pm.staff.ranks.RnkGithubBugTest
Tests run: 2, Failures: 0, Errors: 0, Skipped: 0, Time elapsed: 0.485 sec - in com.zerocracy.pm.staff.ranks.RnkGithubBugTest
Running com.zerocracy.entry.ExtGithubTest
Tests run: 1, Failures: 0, Errors: 0, Skipped: 0, Time elapsed: 0.017 sec - in com.zerocracy.entry.ExtGithubTest
Running com.zerocracy.claims.proc.BrigadeProcTest
Tests run: 1, Failures: 0, Errors: 0, Skipped: 0, Time elapsed: 0.248 sec - in com.zerocracy.claims.proc.BrigadeProcTest
Running com.zerocracy.farm.guts.TkGutsTest
Tests run: 1, Failures: 0, Errors: 0, Skipped: 0, Time elapsed: 3.212 sec - in com.zerocracy.farm.guts.TkGutsTest
Running com.zerocracy.entry.PingsTest
Tests run: 1, Failures: 0, Errors: 0, Skipped: 0, Time elapsed: 0.518 sec - in com.zerocracy.entry.PingsTest
Running com.zerocracy.pm.cost.RatesTest
Tests run: 1, Failures: 0, Errors: 0, Skipped: 0, Time elapsed: 0.491 sec - in com.zerocracy.pm.cost.RatesTest
Running com.zerocracy.farm.fake.FkFarmTest
Tests run: 7, Failures: 0, Errors: 0, Skipped: 0, Time elapsed: 0.026 sec - in com.zerocracy.farm.fake.FkFarmTest
Running com.zerocracy.SafeSentryTest
Sentry threw an error: java.lang.IllegalStateException: Exceptional!
	at com.zerocracy.SafeSentryTest.lambda$logsThrownException$0(SafeSentryTest.java:46)
	at com.zerocracy.sentry.SafeSentry.capture(SafeSentry.java:59)
	at com.zerocracy.SafeSentryTest.logsThrownException(SafeSentryTest.java:48)
	at sun.reflect.NativeMethodAccessorImpl.invoke0(Native Method)
	at sun.reflect.NativeMethodAccessorImpl.invoke(NativeMethodAccessorImpl.java:62)
	at sun.reflect.DelegatingMethodAccessorImpl.invoke(DelegatingMethodAccessorImpl.java:43)
	at java.lang.reflect.Method.invoke(Method.java:498)
	at org.junit.runners.model.FrameworkMethod$1.runReflectiveCall(FrameworkMethod.java:50)
	at org.junit.internal.runners.model.ReflectiveCallable.run(ReflectiveCallable.java:12)
	at org.junit.runners.model.FrameworkMethod.invokeExplosively(FrameworkMethod.java:47)
	at org.junit.internal.runners.statements.InvokeMethod.evaluate(InvokeMethod.java:17)
	at org.junit.runners.ParentRunner.runLeaf(ParentRunner.java:325)
	at org.junit.runners.BlockJUnit4ClassRunner.runChild(BlockJUnit4ClassRunner.java:78)
	at org.junit.runners.BlockJUnit4ClassRunner.runChild(BlockJUnit4ClassRunner.java:57)
	at org.junit.runners.ParentRunner$3.run(ParentRunner.java:290)
	at org.apache.maven.surefire.junitcore.pc.Scheduler$1.run(Scheduler.java:393)
	at java.util.concurrent.Executors$RunnableAdapter.call(Executors.java:511)
	at java.util.concurrent.FutureTask.run(FutureTask.java:266)
	at java.util.concurrent.ThreadPoolExecutor.runWorker(ThreadPoolExecutor.java:1142)
	at java.util.concurrent.ThreadPoolExecutor$Worker.run(ThreadPoolExecutor.java:617)
	at java.lang.Thread.run(Thread.java:745)

Tests run: 1, Failures: 0, Errors: 0, Skipped: 0, Time elapsed: 0.001 sec - in com.zerocracy.SafeSentryTest
Running com.zerocracy.farm.ruled.RdItemTest
swallowed exception: java.lang.IllegalStateException('http://datum.zerocracy.com/latest/rules/pm/no-lost-boosts.xsl says: The boost for job "gh:test/test#55" exists in boosts.xml, but the job is absent in the WBS among 0 jobs.')
Tests run: 5, Failures: 0, Errors: 0, Skipped: 0, Time elapsed: 2.665 sec - in com.zerocracy.farm.ruled.RdItemTest
Running com.zerocracy.tk.project.TkProjectTest
Tests run: 1, Failures: 0, Errors: 0, Skipped: 0, Time elapsed: 0.805 sec - in com.zerocracy.tk.project.TkProjectTest
Running com.zerocracy.tk.profile.TkAgendaTest
Tests run: 4, Failures: 0, Errors: 0, Skipped: 0, Time elapsed: 1.059 sec - in com.zerocracy.tk.profile.TkAgendaTest
Running com.zerocracy.pm.time.NegligenceTest
Tests run: 3, Failures: 0, Errors: 0, Skipped: 0, Time elapsed: 0.228 sec - in com.zerocracy.pm.time.NegligenceTest
Running com.zerocracy.tk.project.RqProjectTest
Tests run: 2, Failures: 0, Errors: 0, Skipped: 0, Time elapsed: 0.937 sec - in com.zerocracy.tk.project.RqProjectTest
Running com.zerocracy.radars.slack.ReProfileTest
Tests run: 2, Failures: 0, Errors: 0, Skipped: 0, Time elapsed: 0.452 sec - in com.zerocracy.radars.slack.ReProfileTest
Running com.zerocracy.radars.github.RbOnUnassignTest
Tests run: 1, Failures: 0, Errors: 0, Skipped: 0, Time elapsed: 0.231 sec - in com.zerocracy.radars.github.RbOnUnassignTest
Running com.zerocracy.pm.staff.votes.VsWorkloadTest
Tests run: 2, Failures: 0, Errors: 0, Skipped: 0, Time elapsed: 0.473 sec - in com.zerocracy.pm.staff.votes.VsWorkloadTest
Running com.zerocracy.pmo.BlanksTest
Tests run: 1, Failures: 0, Errors: 0, Skipped: 0, Time elapsed: 0.28 sec - in com.zerocracy.pmo.BlanksTest
Running com.zerocracy.pm.scope.WbsTest
Tests run: 2, Failures: 0, Errors: 0, Skipped: 0, Time elapsed: 0.346 sec - in com.zerocracy.pm.scope.WbsTest
Running com.zerocracy.pm.staff.votes.VsSpeedTest
Tests run: 2, Failures: 0, Errors: 0, Skipped: 0, Time elapsed: 0.398 sec - in com.zerocracy.pm.staff.votes.VsSpeedTest
Running com.zerocracy.shutdown.ShutdownFarmTest
Tests run: 1, Failures: 0, Errors: 0, Skipped: 0, Time elapsed: 1.034 sec - in com.zerocracy.shutdown.ShutdownFarmTest
Running com.zerocracy.pm.staff.votes.VsBannedTest
Tests run: 2, Failures: 0, Errors: 0, Skipped: 0, Time elapsed: 0.226 sec - in com.zerocracy.pm.staff.votes.VsBannedTest
Running com.zerocracy.tk.project.reports.OrdersGivenByWeekTest
Tests run: 2, Failures: 0, Errors: 0, Skipped: 0, Time elapsed: 0.679 sec - in com.zerocracy.tk.project.reports.OrdersGivenByWeekTest
Running com.zerocracy.pm.time.votes.VsNegligenceTest
Tests run: 1, Failures: 0, Errors: 0, Skipped: 0, Time elapsed: 0.001 sec - in com.zerocracy.pm.time.votes.VsNegligenceTest
Running com.zerocracy.claims.ClaimSignatureTest
Tests run: 5, Failures: 0, Errors: 0, Skipped: 0, Time elapsed: 0.26 sec - in com.zerocracy.claims.ClaimSignatureTest
Running com.zerocracy.tk.profile.TkAwardsTest
Tests run: 2, Failures: 0, Errors: 0, Skipped: 0, Time elapsed: 0.869 sec - in com.zerocracy.tk.profile.TkAwardsTest
Running com.zerocracy.pmo.VerbosityTest
Tests run: 2, Failures: 0, Errors: 0, Skipped: 1, Time elapsed: 0.01 sec - in com.zerocracy.pmo.VerbosityTest
Running com.zerocracy.pmo.AwardsTest
Tests run: 1, Failures: 0, Errors: 0, Skipped: 0, Time elapsed: 0.342 sec - in com.zerocracy.pmo.AwardsTest
Running com.zerocracy.pm.cost.EquityTest
Tests run: 3, Failures: 0, Errors: 0, Skipped: 1, Time elapsed: 0.922 sec - in com.zerocracy.pm.cost.EquityTest
Running com.zerocracy.radars.QuestionTest
Tests run: 5, Failures: 0, Errors: 0, Skipped: 0, Time elapsed: 0.199 sec - in com.zerocracy.radars.QuestionTest
Running com.zerocracy.pm.in.JobExpiredTest
Tests run: 2, Failures: 0, Errors: 0, Skipped: 0, Time elapsed: 0.394 sec - in com.zerocracy.pm.in.JobExpiredTest
Running com.zerocracy.tk.TkIndexTest
Tests run: 1, Failures: 0, Errors: 0, Skipped: 0, Time elapsed: 0.615 sec - in com.zerocracy.tk.TkIndexTest
Running com.zerocracy.radars.github.RbAddToMilestoneTest
Tests run: 1, Failures: 0, Errors: 0, Skipped: 0, Time elapsed: 0.975 sec - in com.zerocracy.radars.github.RbAddToMilestoneTest
Running com.zerocracy.pm.staff.votes.VsOptionsMaxJobsTest
Tests run: 2, Failures: 0, Errors: 0, Skipped: 0, Time elapsed: 0.562 sec - in com.zerocracy.pm.staff.votes.VsOptionsMaxJobsTest
Running com.zerocracy.farm.guts.GsProjectTest
Tests run: 1, Failures: 0, Errors: 0, Skipped: 0, Time elapsed: 0.211 sec - in com.zerocracy.farm.guts.GsProjectTest
Running com.zerocracy.tk.project.reports.AwardChampionsTest
Tests run: 1, Failures: 0, Errors: 0, Skipped: 0, Time elapsed: 0.529 sec - in com.zerocracy.tk.project.reports.AwardChampionsTest
Running com.zerocracy.tk.TkAppTest
Tests run: 3, Failures: 0, Errors: 0, Skipped: 1, Time elapsed: 2.381 sec - in com.zerocracy.tk.TkAppTest
Running com.zerocracy.radars.github.TkGithubTest
Tests run: 2, Failures: 0, Errors: 0, Skipped: 0, Time elapsed: 0.011 sec - in com.zerocracy.radars.github.TkGithubTest
Running com.zerocracy.pm.qa.ReviewsTest
Tests run: 5, Failures: 0, Errors: 0, Skipped: 0, Time elapsed: 0.301 sec - in com.zerocracy.pm.qa.ReviewsTest
Running com.zerocracy.farm.fake.FkItemTest
Tests run: 4, Failures: 0, Errors: 0, Skipped: 0, Time elapsed: 0.049 sec - in com.zerocracy.farm.fake.FkItemTest
Running com.zerocracy.pm.staff.votes.VsBalanceTest
Tests run: 3, Failures: 0, Errors: 0, Skipped: 0, Time elapsed: 0.436 sec - in com.zerocracy.pm.staff.votes.VsBalanceTest
Running com.zerocracy.entry.ExtMongobeeTest
Tests run: 1, Failures: 0, Errors: 0, Skipped: 0, Time elapsed: 3.272 sec - in com.zerocracy.entry.ExtMongobeeTest
Running com.zerocracy.farm.reactive.StkSmartTest
Tests run: 3, Failures: 0, Errors: 0, Skipped: 0, Time elapsed: 0.033 sec - in com.zerocracy.farm.reactive.StkSmartTest
Running com.zerocracy.pm.staff.ranks.RnkEstimatesTest
Tests run: 2, Failures: 0, Errors: 0, Skipped: 0, Time elapsed: 3.125 sec - in com.zerocracy.pm.staff.ranks.RnkEstimatesTest
Running com.zerocracy.farm.sync.TerminatorTest
Thread 16756/Thread-513 interrupted because of too long hold of "foo" in FAKEPRJCT (over 1 msec), Mock for Lock, hashCode: 1652799405: java.lang.IllegalStateException: Here!
	at com.zerocracy.farm.sync.Terminator.killer(Terminator.java:138)
	at com.zerocracy.farm.sync.Terminator.submit(Terminator.java:116)
	at com.zerocracy.farm.sync.TerminatorTest.lambda$interruptsThreadAfterLockTimeoutAndChecksLockAgain$0(TerminatorTest.java:56)
	at java.lang.Thread.run(Thread.java:745)

error: java.lang.Exception: Thread 16756/Thread-513 interrupted because of too long hold of "foo" in FAKEPRJCT (over 1 msec), Mock for Lock, hashCode: 1652799405
	at com.zerocracy.farm.sync.Terminator.lambda$killer$1(Terminator.java:165)
	at org.cactoos.func.FuncOf.lambda$new$3(FuncOf.java:88)
	at org.cactoos.func.FuncOf.apply(FuncOf.java:104)
	at org.cactoos.func.UncheckedFunc.lambda$apply$0(UncheckedFunc.java:58)
	at org.cactoos.scalar.IoCheckedScalar.value(IoCheckedScalar.java:70)
	at org.cactoos.scalar.UncheckedScalar.value(UncheckedScalar.java:58)
	at org.cactoos.func.UncheckedFunc.apply(UncheckedFunc.java:59)
	at org.cactoos.func.RunnableOf.run(RunnableOf.java:89)
	at com.jcabi.log.VerboseRunnable.run(VerboseRunnable.java:190)
	at java.util.concurrent.Executors$RunnableAdapter.call(Executors.java:511)
	at java.util.concurrent.FutureTask.run(FutureTask.java:266)
	at java.util.concurrent.ThreadPoolExecutor.runWorker(ThreadPoolExecutor.java:1142)
	at java.util.concurrent.ThreadPoolExecutor$Worker.run(ThreadPoolExecutor.java:617)
	at com.jcabi.log.VerboseThreads$Wrap.run(VerboseThreads.java:221)
	at java.lang.Thread.run(Thread.java:745)
Caused by: java.lang.IllegalStateException: Here!
	at com.zerocracy.farm.sync.Terminator.killer(Terminator.java:138)
	at com.zerocracy.farm.sync.Terminator.submit(Terminator.java:116)
	at com.zerocracy.farm.sync.TerminatorTest.lambda$interruptsThreadAfterLockTimeoutAndChecksLockAgain$0(TerminatorTest.java:56)
	... 1 more

Tests run: 1, Failures: 0, Errors: 0, Skipped: 0, Time elapsed: 1.236 sec - in com.zerocracy.farm.sync.TerminatorTest
Running com.zerocracy.claims.proc.ExpiryProcTest
Tests run: 3, Failures: 0, Errors: 0, Skipped: 0, Time elapsed: 0.019 sec - in com.zerocracy.claims.proc.ExpiryProcTest
Running com.zerocracy.pmo.VacanciesTest
Tests run: 4, Failures: 0, Errors: 0, Skipped: 0, Time elapsed: 0.255 sec - in com.zerocracy.pmo.VacanciesTest
Running com.zerocracy.entry.PingsITTest
Tests run: 1, Failures: 0, Errors: 0, Skipped: 1, Time elapsed: 0 sec - in com.zerocracy.entry.PingsITTest
Running com.zerocracy.farm.reactive.RvProjectTest
Tests run: 2, Failures: 0, Errors: 0, Skipped: 0, Time elapsed: 15.844 sec - in com.zerocracy.farm.reactive.RvProjectTest
Running com.zerocracy.tk.TkVacanciesTest
Tests run: 1, Failures: 0, Errors: 0, Skipped: 0, Time elapsed: 1.288 sec - in com.zerocracy.tk.TkVacanciesTest
Running [com/zerocracy/bundles/zerocrat_assignment_adds_to_wbs]
error: java.lang.IllegalArgumentException: Claim #100 "Invite a friend" has no token in invite_friend
	at com.zerocracy.farm.StkSafe.process(StkSafe.java:107)
	at com.zerocracy.farm.reactive.StkSmart.process(StkSmart.java:64)
	at com.zerocracy.farm.reactive.Brigade.process(Brigade.java:80)
	at com.zerocracy.farm.reactive.Brigade.lambda$apply$0(Brigade.java:62)
	at org.cactoos.func.UncheckedFunc.lambda$apply$0(UncheckedFunc.java:58)
	at org.cactoos.scalar.IoCheckedScalar.value(IoCheckedScalar.java:70)
	at org.cactoos.scalar.UncheckedScalar.value(UncheckedScalar.java:58)
	at org.cactoos.func.UncheckedFunc.apply(UncheckedFunc.java:59)
	at org.cactoos.iterator.Filtered.hasNext(Filtered.java:90)
	at org.cactoos.iterator.LengthOf.lambda$new$0(LengthOf.java:52)
	at org.cactoos.scalar.IoCheckedScalar.value(IoCheckedScalar.java:70)
	at org.cactoos.scalar.UncheckedScalar.value(UncheckedScalar.java:58)
	at org.cactoos.scalar.NumberEnvelope.doubleValue(NumberEnvelope.java:113)
	at org.cactoos.iterable.LengthOf.lambda$new$0(LengthOf.java:51)
	at org.cactoos.scalar.NumberEnvelope.lambda$new$1(NumberEnvelope.java:73)
	at org.cactoos.scalar.IoCheckedScalar.value(IoCheckedScalar.java:70)
	at org.cactoos.scalar.UncheckedScalar.value(UncheckedScalar.java:58)
	at org.cactoos.scalar.NumberEnvelope.intValue(NumberEnvelope.java:98)
	at com.zerocracy.farm.reactive.Brigade.apply(Brigade.java:65)
	at com.zerocracy.farm.reactive.Brigade.apply(Brigade.java:35)
	at org.cactoos.func.IoCheckedBiFunc.lambda$apply$0(IoCheckedBiFunc.java:60)
	at org.cactoos.scalar.IoCheckedScalar.value(IoCheckedScalar.java:70)
	at org.cactoos.func.IoCheckedBiFunc.apply(IoCheckedBiFunc.java:61)
	at com.zerocracy.farm.reactive.DefaultFlush.process(DefaultFlush.java:98)
	at com.zerocracy.farm.reactive.DefaultFlush.lambda$exec$0(DefaultFlush.java:66)
	at org.cactoos.func.FuncOf.lambda$new$3(FuncOf.java:88)
	at org.cactoos.func.FuncOf.apply(FuncOf.java:104)
	at org.cactoos.func.IoCheckedFunc.lambda$apply$0(IoCheckedFunc.java:59)
	at org.cactoos.scalar.IoCheckedScalar.value(IoCheckedScalar.java:70)
	at org.cactoos.func.IoCheckedFunc.apply(IoCheckedFunc.java:59)
	at org.cactoos.func.IoCheckedProc.exec(IoCheckedProc.java:57)
	at com.zerocracy.claims.ClaimsItem.take(ClaimsItem.java:170)
	at com.zerocracy.claims.ClaimsXml.lambda$take$0(ClaimsXml.java:69)
	at org.cactoos.scalar.And.value(And.java:167)
	at org.cactoos.scalar.And.value(And.java:60)
	at org.cactoos.scalar.IoCheckedScalar.value(IoCheckedScalar.java:70)
	at com.zerocracy.claims.ClaimsXml.take(ClaimsXml.java:72)
	at com.zerocracy.farm.reactive.DefaultFlush.exec(DefaultFlush.java:65)
	at com.zerocracy.farm.reactive.DefaultFlush.exec(DefaultFlush.java:41)
	at com.zerocracy.farm.reactive.AsyncFlush.lambda$exec$2(AsyncFlush.java:117)
	at com.jcabi.log.VerboseCallable.call(VerboseCallable.java:173)
	at java.util.concurrent.FutureTask.run(FutureTask.java:266)
	at java.util.concurrent.ThreadPoolExecutor.runWorker(ThreadPoolExecutor.java:1142)
	at java.util.concurrent.ThreadPoolExecutor$Worker.run(ThreadPoolExecutor.java:617)
	at com.jcabi.log.VerboseThreads$Wrap.run(VerboseThreads.java:221)
	at java.lang.Thread.run(Thread.java:745)
Caused by: com.zerocracy.SoftException: You are not the examiner of friend, see [1](http://www.zerocracy.com/policy.html#1)
	at sun.reflect.NativeConstructorAccessorImpl.newInstance0(Native Method)
	at sun.reflect.NativeConstructorAccessorImpl.newInstance(NativeConstructorAccessorImpl.java:62)
	at sun.reflect.DelegatingConstructorAccessorImpl.newInstance(DelegatingConstructorAccessorImpl.java:45)
	at java.lang.reflect.Constructor.newInstance(Constructor.java:423)
	at org.codehaus.groovy.reflection.CachedConstructor.invoke(CachedConstructor.java:83)
	at org.codehaus.groovy.runtime.callsite.ConstructorSite$ConstructorSiteNoUnwrapNoCoerce.callConstructor(ConstructorSite.java:105)
	at org.codehaus.groovy.runtime.callsite.CallSiteArray.defaultCallConstructor(CallSiteArray.java:59)
	at org.codehaus.groovy.runtime.callsite.AbstractCallSite.callConstructor(AbstractCallSite.java:238)
	at org.codehaus.groovy.runtime.callsite.AbstractCallSite.callConstructor(AbstractCallSite.java:250)
	at com.zerocracy.stk.pmo.profile.invite_friend.exec(invite_friend.groovy:73)
	at sun.reflect.GeneratedMethodAccessor80.invoke(Unknown Source)
	at sun.reflect.DelegatingMethodAccessorImpl.invoke(DelegatingMethodAccessorImpl.java:43)
	at java.lang.reflect.Method.invoke(Method.java:498)
	at org.codehaus.groovy.reflection.CachedMethod.invoke(CachedMethod.java:98)
	at groovy.lang.MetaMethod.doMethodInvoke(MetaMethod.java:325)
	at groovy.lang.MetaClassImpl.invokeMethod(MetaClassImpl.java:1225)
	at groovy.lang.MetaClassImpl.invokeMethod(MetaClassImpl.java:1034)
	at groovy.lang.MetaClassImpl.invokeMethod(MetaClassImpl.java:822)
	at groovy.lang.GroovyObjectSupport.invokeMethod(GroovyObjectSupport.java:46)
	at groovy.lang.Script.invokeMethod(Script.java:80)
	at com.zerocracy.farm.reactive.StkRuntime.process(StkRuntime.java:63)
	at com.zerocracy.farm.StkSafe.process(StkSafe.java:96)
	... 45 more

Tests run: 82, Failures: 0, Errors: 0, Skipped: 0, Time elapsed: 378.2 sec - in [com/zerocracy/bundles/zerocrat_assignment_adds_to_wbs]
Running com.zerocracy.farm.reactive.StkGroovyTest
Tests run: 4, Failures: 0, Errors: 0, Skipped: 0, Time elapsed: 0.97 sec - in com.zerocracy.farm.reactive.StkGroovyTest
Running com.zerocracy.claims.proc.FootprintProcTest
Tests run: 1, Failures: 1, Errors: 0, Skipped: 0, Time elapsed: 0.861 sec <<< FAILURE! - in com.zerocracy.claims.proc.FootprintProcTest
footprintClaim(com.zerocracy.claims.proc.FootprintProcTest)  Time elapsed: 0.861 sec  <<< FAILURE!
java.lang.AssertionError: 

Expected: an iterable with size <10>
     but: iterable size was <17>
	at org.hamcrest.MatcherAssert.assertThat(MatcherAssert.java:20)
	at org.hamcrest.MatcherAssert.assertThat(MatcherAssert.java:8)
	at com.zerocracy.claims.proc.FootprintProcTest.footprintClaim(FootprintProcTest.java:100)
	at sun.reflect.NativeMethodAccessorImpl.invoke0(Native Method)
	at sun.reflect.NativeMethodAccessorImpl.invoke(NativeMethodAccessorImpl.java:62)
	at sun.reflect.DelegatingMethodAccessorImpl.invoke(DelegatingMethodAccessorImpl.java:43)
	at java.lang.reflect.Method.invoke(Method.java:498)
	at org.junit.runners.model.FrameworkMethod$1.runReflectiveCall(FrameworkMethod.java:50)
	at org.junit.internal.runners.model.ReflectiveCallable.run(ReflectiveCallable.java:12)
	at org.junit.runners.model.FrameworkMethod.invokeExplosively(FrameworkMethod.java:47)
	at org.junit.internal.runners.statements.InvokeMethod.evaluate(InvokeMethod.java:17)
	at org.junit.runners.ParentRunner.runLeaf(ParentRunner.java:325)
	at org.junit.runners.BlockJUnit4ClassRunner.runChild(BlockJUnit4ClassRunner.java:78)
	at org.junit.runners.BlockJUnit4ClassRunner.runChild(BlockJUnit4ClassRunner.java:57)
	at org.junit.runners.ParentRunner$3.run(ParentRunner.java:290)
	at org.apache.maven.surefire.junitcore.pc.Scheduler$1.run(Scheduler.java:393)
	at java.util.concurrent.Executors$RunnableAdapter.call(Executors.java:511)
	at java.util.concurrent.FutureTask.run(FutureTask.java:266)
	at java.util.concurrent.ThreadPoolExecutor.runWorker(ThreadPoolExecutor.java:1142)
	at java.util.concurrent.ThreadPoolExecutor$Worker.run(ThreadPoolExecutor.java:617)
	at java.lang.Thread.run(Thread.java:745)

Running com.zerocracy.farm.reactive.AsyncFlushTest
Tests run: 1, Failures: 0, Errors: 0, Skipped: 0, Time elapsed: 10.193 sec - in com.zerocracy.farm.reactive.AsyncFlushTest
Running com.zerocracy.tk.project.TkXmlTest
Tests run: 1, Failures: 0, Errors: 0, Skipped: 0, Time elapsed: 0.911 sec - in com.zerocracy.tk.project.TkXmlTest
Running com.zerocracy.tools.SignatureTest
Tests run: 1, Failures: 0, Errors: 0, Skipped: 1, Time elapsed: 0 sec - in com.zerocracy.tools.SignatureTest

Results :

Failed tests: 
  FootprintProcTest.footprintClaim:100 
Expected: an iterable with size <10>
     but: iterable size was <17>

Tests run: 529, Failures: 1, Errors: 0, Skipped: 11

[INFO] ------------------------------------------------------------------------
[INFO] BUILD FAILURE
[INFO] ------------------------------------------------------------------------
[INFO] Total time: 06:55 min
[INFO] Finished at: 2018-08-20T18:43:28+02:00
[INFO] Final Memory: 61M/984M
[INFO] ------------------------------------------------------------------------
[ERROR] Failed to execute goal org.apache.maven.plugins:maven-surefire-plugin:2.19.1:test (default-test) on project farm: There are test failures.
[ERROR] 
[ERROR] Please refer to /root/workspace/zerocracy/farm/418306590/target/surefire-reports for the individual test results.
[ERROR] -> [Help 1]
[ERROR] 
[ERROR] To see the full stack trace of the errors, re-run Maven with the -e switch.
[ERROR] Re-run Maven using the -X switch to enable full debug logging.
[ERROR] 
[ERROR] For more information about the errors and possible solutions, please read the following articles:
[ERROR] [Help 1] http://cwiki.apache.org/confluence/display/MAVEN/MojoFailureException
