[INFO] Scanning for projects...
[INFO]                                                                         
[INFO] ------------------------------------------------------------------------
[INFO] Building EXIficient 1.0.0-SNAPSHOT
[INFO] ------------------------------------------------------------------------
[INFO] 
[INFO] --- maven-enforcer-plugin:1.0:enforce (enforce-maven) @ exificient ---
[INFO] Skipping Rule Enforcement.
[INFO] 
[INFO] --- maven-resources-plugin:2.6:resources (default-resources) @ exificient ---
[INFO] Using 'UTF-8' encoding to copy filtered resources.
[INFO] skip non existing resourceDirectory /root/workspace/EXIficient/exificient/349747662/src/main/resources
[INFO] 
[INFO] --- maven-compiler-plugin:3.1:compile (default-compile) @ exificient ---
[INFO] Nothing to compile - all classes are up to date
[INFO] 
[INFO] --- maven-resources-plugin:2.6:testResources (default-testResources) @ exificient ---
[INFO] Using 'UTF-8' encoding to copy filtered resources.
[INFO] skip non existing resourceDirectory /root/workspace/EXIficient/exificient/349747662/src/test/resources
[INFO] 
[INFO] --- maven-compiler-plugin:3.1:testCompile (default-testCompile) @ exificient ---
[INFO] Nothing to compile - all classes are up to date
[INFO] 
[INFO] --- maven-surefire-plugin:2.19:test (default-test) @ exificient ---
[INFO] Downloading: https://repo.maven.apache.org/maven2/org/apache/maven/surefire/surefire-junit4/2.19/surefire-junit4-2.19.pom
[INFO] Downloaded: https://repo.maven.apache.org/maven2/org/apache/maven/surefire/surefire-junit4/2.19/surefire-junit4-2.19.pom (4 KB at 6.9 KB/sec)
[INFO] Downloading: https://repo.maven.apache.org/maven2/org/apache/maven/surefire/surefire-providers/2.19/surefire-providers-2.19.pom
[INFO] Downloaded: https://repo.maven.apache.org/maven2/org/apache/maven/surefire/surefire-providers/2.19/surefire-providers-2.19.pom (3 KB at 100.0 KB/sec)
[INFO] Downloading: https://repo.maven.apache.org/maven2/org/apache/maven/surefire/surefire-junit4/2.19/surefire-junit4-2.19.jar
[INFO] Downloaded: https://repo.maven.apache.org/maven2/org/apache/maven/surefire/surefire-junit4/2.19/surefire-junit4-2.19.jar (75 KB at 1193.7 KB/sec)

-------------------------------------------------------
 T E S T S
-------------------------------------------------------
Running com.siemens.ct.exi.main.data.W3CTestCase
Tests run: 5, Failures: 0, Errors: 0, Skipped: 0, Time elapsed: 2.356 sec - in com.siemens.ct.exi.main.data.W3CTestCase
Running com.siemens.ct.exi.main.data.SchemaTestCase
Tests run: 43, Failures: 0, Errors: 0, Skipped: 0, Time elapsed: 7.456 sec - in com.siemens.ct.exi.main.data.SchemaTestCase
Running com.siemens.ct.exi.main.data.BugTestCase
Tests run: 2, Failures: 0, Errors: 0, Skipped: 0, Time elapsed: 17.394 sec - in com.siemens.ct.exi.main.data.BugTestCase
Running com.siemens.ct.exi.main.data.EXIOptionsHeaderTestCase
Tests run: 6, Failures: 0, Errors: 0, Skipped: 0, Time elapsed: 0.527 sec - in com.siemens.ct.exi.main.data.EXIOptionsHeaderTestCase
Running com.siemens.ct.exi.main.data.GeneralTestCase
Tests run: 33, Failures: 0, Errors: 0, Skipped: 0, Time elapsed: 41.169 sec - in com.siemens.ct.exi.main.data.GeneralTestCase
Running com.siemens.ct.exi.main.data.BuiltInXSDTestCase
Tests run: 3, Failures: 0, Errors: 0, Skipped: 0, Time elapsed: 0.252 sec - in com.siemens.ct.exi.main.data.BuiltInXSDTestCase
Running com.siemens.ct.exi.main.data.MultipleStreamTest
Tests run: 4, Failures: 0, Errors: 0, Skipped: 0, Time elapsed: 3.021 sec - in com.siemens.ct.exi.main.data.MultipleStreamTest
Running com.siemens.ct.exi.main.data.DeviationsTestCase
Tests run: 8, Failures: 0, Errors: 0, Skipped: 0, Time elapsed: 0.714 sec - in com.siemens.ct.exi.main.data.DeviationsTestCase
Running com.siemens.ct.exi.main.data.FragmentTestCase
Tests run: 4, Failures: 0, Errors: 0, Skipped: 0, Time elapsed: 0.304 sec - in com.siemens.ct.exi.main.data.FragmentTestCase
Running com.siemens.ct.exi.main.api.sax.TransformerEncodeTest
Tests run: 2, Failures: 0, Errors: 0, Skipped: 0, Time elapsed: 0.01 sec - in com.siemens.ct.exi.main.api.sax.TransformerEncodeTest
Running com.siemens.ct.exi.main.api.xmlpull.XmlPullCoderTestCase
Tests run: 3, Failures: 0, Errors: 0, Skipped: 0, Time elapsed: 0.029 sec - in com.siemens.ct.exi.main.api.xmlpull.XmlPullCoderTestCase
Running com.siemens.ct.exi.main.api.jaxb.JAXBNotebookTest
Tests run: 2, Failures: 0, Errors: 0, Skipped: 0, Time elapsed: 0.101 sec - in com.siemens.ct.exi.main.api.jaxb.JAXBNotebookTest
Running com.siemens.ct.exi.main.api.stream.StAXCoderTestCase
Tests run: 3, Failures: 0, Errors: 0, Skipped: 0, Time elapsed: 0.024 sec - in com.siemens.ct.exi.main.api.stream.StAXCoderTestCase
Running com.siemens.ct.exi.main.datatype.StringTableTest
Tests run: 8, Failures: 0, Errors: 0, Skipped: 0, Time elapsed: 0.002 sec - in com.siemens.ct.exi.main.datatype.StringTableTest
Running com.siemens.ct.exi.main.datatype.IntegerTest
Tests run: 11, Failures: 0, Errors: 0, Skipped: 0, Time elapsed: 0.048 sec - in com.siemens.ct.exi.main.datatype.IntegerTest
Running com.siemens.ct.exi.main.datatype.FloatTest
Tests run: 49, Failures: 0, Errors: 0, Skipped: 0, Time elapsed: 0.005 sec - in com.siemens.ct.exi.main.datatype.FloatTest
Running com.siemens.ct.exi.main.datatype.NBitUnsignedIntegerTest
Tests run: 12, Failures: 0, Errors: 0, Skipped: 0, Time elapsed: 0.167 sec - in com.siemens.ct.exi.main.datatype.NBitUnsignedIntegerTest
Running com.siemens.ct.exi.main.datatype.UnsignedIntegerTest
Tests run: 20, Failures: 0, Errors: 0, Skipped: 0, Time elapsed: 0.03 sec - in com.siemens.ct.exi.main.datatype.UnsignedIntegerTest
Running com.siemens.ct.exi.main.datatype.DecimalTest
Tests run: 15, Failures: 0, Errors: 0, Skipped: 0, Time elapsed: 0 sec - in com.siemens.ct.exi.main.datatype.DecimalTest
Running com.siemens.ct.exi.main.datatype.EnumerationTest
Tests run: 9, Failures: 0, Errors: 0, Skipped: 0, Time elapsed: 0.011 sec - in com.siemens.ct.exi.main.datatype.EnumerationTest
Running com.siemens.ct.exi.main.datatype.BooleanTest
Tests run: 8, Failures: 0, Errors: 0, Skipped: 0, Time elapsed: 0 sec - in com.siemens.ct.exi.main.datatype.BooleanTest
Running com.siemens.ct.exi.main.datatype.WhiteSpaceTestCase
Tests run: 15, Failures: 0, Errors: 0, Skipped: 0, Time elapsed: 0.009 sec - in com.siemens.ct.exi.main.datatype.WhiteSpaceTestCase
Running com.siemens.ct.exi.main.datatype.RegularExpressionTest
Tests run: 65, Failures: 0, Errors: 0, Skipped: 0, Time elapsed: 0.032 sec - in com.siemens.ct.exi.main.datatype.RegularExpressionTest
Running com.siemens.ct.exi.main.datatype.StringTest
Tests run: 12, Failures: 0, Errors: 0, Skipped: 0, Time elapsed: 0 sec - in com.siemens.ct.exi.main.datatype.StringTest
Running com.siemens.ct.exi.main.datatype.BinaryTest
Tests run: 18, Failures: 0, Errors: 0, Skipped: 0, Time elapsed: 0 sec - in com.siemens.ct.exi.main.datatype.BinaryTest
Running com.siemens.ct.exi.main.datatype.ListTest
Tests run: 9, Failures: 0, Errors: 0, Skipped: 0, Time elapsed: 0.001 sec - in com.siemens.ct.exi.main.datatype.ListTest
Running com.siemens.ct.exi.main.datatype.DatetimeTest
Tests run: 36, Failures: 0, Errors: 0, Skipped: 0, Time elapsed: 0.003 sec - in com.siemens.ct.exi.main.datatype.DatetimeTest
Running com.siemens.ct.exi.main.core.CanonicalEXITestCase
Tests run: 48, Failures: 0, Errors: 0, Skipped: 0, Time elapsed: 0.282 sec - in com.siemens.ct.exi.main.core.CanonicalEXITestCase
Running com.siemens.ct.exi.main.core.FragmentsTestCase
Tests run: 1, Failures: 0, Errors: 0, Skipped: 0, Time elapsed: 0 sec - in com.siemens.ct.exi.main.core.FragmentsTestCase
Running com.siemens.ct.exi.main.core.InitialEntriesStringTablePartitionsTestCase
Tests run: 6, Failures: 0, Errors: 0, Skipped: 0, Time elapsed: 0.04 sec - in com.siemens.ct.exi.main.core.InitialEntriesStringTablePartitionsTestCase
Running com.siemens.ct.exi.main.core.RoundtripTestCase
Tests run: 6, Failures: 0, Errors: 0, Skipped: 0, Time elapsed: 0.01 sec - in com.siemens.ct.exi.main.core.RoundtripTestCase
Running com.siemens.ct.exi.main.core.sax.SAXDecoderTestCase
Tests run: 6, Failures: 0, Errors: 0, Skipped: 0, Time elapsed: 2.233 sec - in com.siemens.ct.exi.main.core.sax.SAXDecoderTestCase
Running com.siemens.ct.exi.main.core.EXIHeaderTestCase
Tests run: 17, Failures: 0, Errors: 0, Skipped: 0, Time elapsed: 0.014 sec - in com.siemens.ct.exi.main.core.EXIHeaderTestCase
Running com.siemens.ct.exi.main.core.EXIProfileTest
Tests run: 9, Failures: 0, Errors: 0, Skipped: 0, Time elapsed: 0.007 sec - in com.siemens.ct.exi.main.core.EXIProfileTest
Running com.siemens.ct.exi.main.core.BlockSizeTestCase
Tests run: 4, Failures: 0, Errors: 0, Skipped: 0, Time elapsed: 0.004 sec - in com.siemens.ct.exi.main.core.BlockSizeTestCase
Running com.siemens.ct.exi.main.core.SchemaInformedTest
Tests run: 4, Failures: 0, Errors: 0, Skipped: 0, Time elapsed: 0.001 sec - in com.siemens.ct.exi.main.core.SchemaInformedTest
Running com.siemens.ct.exi.main.core.SchemaLessTest
Tests run: 8, Failures: 0, Errors: 0, Skipped: 0, Time elapsed: 0.002 sec - in com.siemens.ct.exi.main.core.SchemaLessTest
Running com.siemens.ct.exi.main.core.BoundedTableTestCase
Tests run: 1, Failures: 0, Errors: 0, Skipped: 0, Time elapsed: 0.002 sec - in com.siemens.ct.exi.main.core.BoundedTableTestCase
Running com.siemens.ct.exi.main.core.SelfContainedTestCase
Tests run: 5, Failures: 0, Errors: 0, Skipped: 0, Time elapsed: 0.005 sec - in com.siemens.ct.exi.main.core.SelfContainedTestCase
Running com.siemens.ct.exi.main.util.SimpleDocTypeParserTest
Tests run: 3, Failures: 0, Errors: 0, Skipped: 0, Time elapsed: 0.001 sec - in com.siemens.ct.exi.main.util.SimpleDocTypeParserTest
Running com.siemens.ct.exi.main.cmd.EXIficientCMDTest
Tests run: 14, Failures: 0, Errors: 0, Skipped: 0, Time elapsed: 0.023 sec - in com.siemens.ct.exi.main.cmd.EXIficientCMDTest
Running com.siemens.ct.exi.main.ParallelTest
Tests run: 6, Failures: 2, Errors: 1, Skipped: 0, Time elapsed: 41.136 sec <<< FAILURE! - in com.siemens.ct.exi.main.ParallelTest
testParallelEncodeWithThreadLocalFactory(com.siemens.ct.exi.main.ParallelTest)  Time elapsed: 1.66 sec  <<< FAILURE!
junit.framework.AssertionFailedError: expected:<0> but was:<5>
	at com.siemens.ct.exi.main.ParallelTest.testParallelEncode(ParallelTest.java:157)
	at com.siemens.ct.exi.main.ParallelTest.testParallelEncodeWithThreadLocalFactory(ParallelTest.java:113)

testParallelDecodeWithSingleFactory(com.siemens.ct.exi.main.ParallelTest)  Time elapsed: 9.278 sec  <<< ERROR!
java.util.concurrent.ExecutionException: 
com.siemens.ct.exi.core.exceptions.EXIException: org.xml.sax.SAXException: EXI com.siemens.ct.exi.main.helpers.DefaultSchemaIdResolver failed to retrieve schemaId == ./data/XSLT/schema-for-xslt20.xsd
com.siemens.ct.exi.core.exceptions.EXIException: com.siemens.ct.exi.main.helpers.DefaultSchemaIdResolver failed to retrieve schemaId == ./data/XSLT/schema-for-xslt20.xsd
	at com.siemens.ct.exi.main.ParallelTest.testParallelDecode(ParallelTest.java:190)
	at com.siemens.ct.exi.main.ParallelTest.testParallelDecodeWithSingleFactory(ParallelTest.java:161)
Caused by: com.siemens.ct.exi.core.exceptions.EXIException: 
org.xml.sax.SAXException: EXI com.siemens.ct.exi.main.helpers.DefaultSchemaIdResolver failed to retrieve schemaId == ./data/XSLT/schema-for-xslt20.xsd
com.siemens.ct.exi.core.exceptions.EXIException: com.siemens.ct.exi.main.helpers.DefaultSchemaIdResolver failed to retrieve schemaId == ./data/XSLT/schema-for-xslt20.xsd
	at com.siemens.ct.exi.main.ParallelTest.decodeExiToDoc(ParallelTest.java:73)
Caused by: org.xml.sax.SAXException: EXI com.siemens.ct.exi.main.helpers.DefaultSchemaIdResolver failed to retrieve schemaId == ./data/XSLT/schema-for-xslt20.xsd
	at com.siemens.ct.exi.main.ParallelTest.decodeExiToDoc(ParallelTest.java:73)
Caused by: com.siemens.ct.exi.core.exceptions.EXIException: com.siemens.ct.exi.main.helpers.DefaultSchemaIdResolver failed to retrieve schemaId == ./data/XSLT/schema-for-xslt20.xsd
	at com.siemens.ct.exi.main.ParallelTest.decodeExiToDoc(ParallelTest.java:73)
Caused by: java.lang.NullPointerException
	at com.siemens.ct.exi.main.ParallelTest.decodeExiToDoc(ParallelTest.java:73)

testParallelEncodeWithSingleFactory(com.siemens.ct.exi.main.ParallelTest)  Time elapsed: 0.774 sec  <<< FAILURE!
junit.framework.AssertionFailedError: expected:<0> but was:<21>
	at com.siemens.ct.exi.main.ParallelTest.testParallelEncode(ParallelTest.java:157)
	at com.siemens.ct.exi.main.ParallelTest.testParallelEncodeWithSingleFactory(ParallelTest.java:109)

Running com.siemens.ct.exi.main.grammars.TypeEmptyTest
Tests run: 1, Failures: 0, Errors: 0, Skipped: 0, Time elapsed: 0.008 sec - in com.siemens.ct.exi.main.grammars.TypeEmptyTest
Running com.siemens.ct.exi.main.types.DtrMapTestCase
Tests run: 34, Failures: 0, Errors: 0, Skipped: 0, Time elapsed: 0.093 sec - in com.siemens.ct.exi.main.types.DtrMapTestCase
Running com.siemens.ct.exi.main.types.DatatypeMappingTest
Tests run: 40, Failures: 0, Errors: 0, Skipped: 0, Time elapsed: 0.029 sec - in com.siemens.ct.exi.main.types.DatatypeMappingTest
Running com.siemens.ct.exi.main.attributes.AttributeListTest
Tests run: 5, Failures: 0, Errors: 0, Skipped: 0, Time elapsed: 0 sec - in com.siemens.ct.exi.main.attributes.AttributeListTest

Results :

Failed tests: 
  ParallelTest.testParallelEncodeWithSingleFactory:109->testParallelEncode:157 expected:<0> but was:<21>
  ParallelTest.testParallelEncodeWithThreadLocalFactory:113->testParallelEncode:157 expected:<0> but was:<5>
Tests in error: 
  ParallelTest.testParallelDecodeWithSingleFactory:161->testParallelDecode:190 » Execution

Tests run: 623, Failures: 2, Errors: 1, Skipped: 0

[INFO] ------------------------------------------------------------------------
[INFO] BUILD FAILURE
[INFO] ------------------------------------------------------------------------
[INFO] Total time: 02:00 min
[INFO] Finished at: 2018-03-06T14:38:34+01:00
[INFO] Final Memory: 22M/886M
[INFO] ------------------------------------------------------------------------
[ERROR] Failed to execute goal org.apache.maven.plugins:maven-surefire-plugin:2.19:test (default-test) on project exificient: There are test failures.
[ERROR] 
[ERROR] Please refer to /root/workspace/EXIficient/exificient/349747662/target/surefire-reports for the individual test results.
[ERROR] -> [Help 1]
[ERROR] 
[ERROR] To see the full stack trace of the errors, re-run Maven with the -e switch.
[ERROR] Re-run Maven using the -X switch to enable full debug logging.
[ERROR] 
[ERROR] For more information about the errors and possible solutions, please read the following articles:
[ERROR] [Help 1] http://cwiki.apache.org/confluence/display/MAVEN/MojoFailureException
