[INFO] Scanning for projects...
[INFO]                                                                         
[INFO] ------------------------------------------------------------------------
[INFO] Building Apache Commons IO 2.7-SNAPSHOT
[INFO] ------------------------------------------------------------------------
[INFO] 
[INFO] --- maven-enforcer-plugin:1.4.1:enforce (enforce-maven-3) @ commons-io ---
[INFO] Skipping Rule Enforcement.
[INFO] 
[INFO] --- build-helper-maven-plugin:3.0.0:parse-version (parse-version) @ commons-io ---
[INFO] 
[INFO] --- maven-antrun-plugin:1.8:run (javadoc.resources) @ commons-io ---
[INFO] Executing tasks

main:
[INFO] Executed tasks
[INFO] 
[INFO] --- maven-remote-resources-plugin:1.5:process (process-resource-bundles) @ commons-io ---
[INFO] 
[INFO] --- buildnumber-maven-plugin:1.4:create (default) @ commons-io ---
[INFO] Executing: /bin/sh -c cd '/root/workspace/apache/commons-io/338938904' && 'git' 'rev-parse' '--verify' 'HEAD'
[INFO] Working directory: /root/workspace/apache/commons-io/338938904
[INFO] Storing buildNumber: 7c042b8d677ee3019de72e7e5c34c4d78d375ef9 at timestamp: 1518090741519
[WARNING] Cannot get the branch information from the git repository: 
Detecting the current branch failed: fatal: ref HEAD is not a symbolic ref

[INFO] Executing: /bin/sh -c cd '/root/workspace/apache/commons-io/338938904' && 'git' 'rev-parse' '--verify' 'HEAD'
[INFO] Working directory: /root/workspace/apache/commons-io/338938904
[INFO] Storing buildScmBranch: UNKNOWN
[INFO] 
[INFO] --- maven-resources-plugin:2.7:resources (default-resources) @ commons-io ---
[INFO] Using 'iso-8859-1' encoding to copy filtered resources.
[INFO] skip non existing resourceDirectory /root/workspace/apache/commons-io/338938904/src/main/resources
[INFO] Copying 2 resources to META-INF
[INFO] 
[INFO] --- maven-compiler-plugin:3.7.0:compile (default-compile) @ commons-io ---
[INFO] Nothing to compile - all classes are up to date
[INFO] 
[INFO] --- maven-bundle-plugin:3.4.0:manifest (bundle-manifest) @ commons-io ---
[INFO] 
[INFO] --- animal-sniffer-maven-plugin:1.16:check (checkAPIcompatibility) @ commons-io ---
[INFO] Checking unresolved references to org.codehaus.mojo.signature:java17:1.0
[INFO] 
[INFO] --- maven-resources-plugin:2.7:testResources (default-testResources) @ commons-io ---
[INFO] Using 'iso-8859-1' encoding to copy filtered resources.
[INFO] Copying 20 resources
[INFO] Copying 2 resources to META-INF
[INFO] 
[INFO] --- maven-compiler-plugin:3.7.0:testCompile (default-testCompile) @ commons-io ---
[INFO] Nothing to compile - all classes are up to date
[INFO] 
[INFO] --- maven-surefire-plugin:2.20.1:test (default-test) @ commons-io ---
[INFO] Downloading: https://repo.maven.apache.org/maven2/org/apache/maven/surefire/surefire-junit4/2.20.1/surefire-junit4-2.20.1.pom
[INFO] Downloaded: https://repo.maven.apache.org/maven2/org/apache/maven/surefire/surefire-junit4/2.20.1/surefire-junit4-2.20.1.pom (4 KB at 7.3 KB/sec)
[INFO] Downloading: https://repo.maven.apache.org/maven2/org/apache/maven/surefire/surefire-providers/2.20.1/surefire-providers-2.20.1.pom
[INFO] Downloaded: https://repo.maven.apache.org/maven2/org/apache/maven/surefire/surefire-providers/2.20.1/surefire-providers-2.20.1.pom (3 KB at 117.5 KB/sec)
[INFO] Downloading: https://repo.maven.apache.org/maven2/org/apache/maven/surefire/surefire-junit4/2.20.1/surefire-junit4-2.20.1.jar
[INFO] Downloaded: https://repo.maven.apache.org/maven2/org/apache/maven/surefire/surefire-junit4/2.20.1/surefire-junit4-2.20.1.jar (81 KB at 1516.0 KB/sec)
[INFO] 
[INFO] -------------------------------------------------------
[INFO]  T E S T S
[INFO] -------------------------------------------------------
[INFO] Running org.apache.commons.io.ByteOrderMarkTestCase
[INFO] Tests run: 9, Failures: 0, Errors: 0, Skipped: 0, Time elapsed: 0.073 s - in org.apache.commons.io.ByteOrderMarkTestCase
[INFO] Running org.apache.commons.io.FileCleanerTestCase
[INFO] Tests run: 9, Failures: 0, Errors: 0, Skipped: 0, Time elapsed: 4.32 s - in org.apache.commons.io.FileCleanerTestCase
[INFO] Running org.apache.commons.io.monitor.FileAlterationMonitorTestCase
[INFO] Tests run: 4, Failures: 0, Errors: 0, Skipped: 0, Time elapsed: 1.296 s - in org.apache.commons.io.monitor.FileAlterationMonitorTestCase
[INFO] Running org.apache.commons.io.monitor.FileAlterationObserverTestCase
[INFO] Tests run: 7, Failures: 0, Errors: 0, Skipped: 0, Time elapsed: 14.035 s - in org.apache.commons.io.monitor.FileAlterationObserverTestCase
[INFO] Running org.apache.commons.io.EndianUtilsTest
[INFO] Tests run: 22, Failures: 0, Errors: 0, Skipped: 0, Time elapsed: 0.104 s - in org.apache.commons.io.EndianUtilsTest
[INFO] Running org.apache.commons.io.IOUtilsTestCase
[INFO] Tests run: 107, Failures: 0, Errors: 0, Skipped: 0, Time elapsed: 0.332 s - in org.apache.commons.io.IOUtilsTestCase
[INFO] Running org.apache.commons.io.IOUtilsCopyTestCase
[INFO] Tests run: 23, Failures: 0, Errors: 0, Skipped: 0, Time elapsed: 0.192 s - in org.apache.commons.io.IOUtilsCopyTestCase
[INFO] Running org.apache.commons.io.IOCaseTestCase
[INFO] Tests run: 17, Failures: 0, Errors: 0, Skipped: 0, Time elapsed: 0.103 s - in org.apache.commons.io.IOCaseTestCase
[INFO] Running org.apache.commons.io.FileUtilsWaitForTestCase
[INFO] Tests run: 2, Failures: 0, Errors: 0, Skipped: 0, Time elapsed: 4.094 s - in org.apache.commons.io.FileUtilsWaitForTestCase
[INFO] Running org.apache.commons.io.FileCleaningTrackerTestCase
[INFO] Tests run: 9, Failures: 0, Errors: 0, Skipped: 0, Time elapsed: 4.42 s - in org.apache.commons.io.FileCleaningTrackerTestCase
[INFO] Running org.apache.commons.io.FilenameUtilsTestCase
[INFO] Tests run: 37, Failures: 0, Errors: 0, Skipped: 0, Time elapsed: 0.265 s - in org.apache.commons.io.FilenameUtilsTestCase
[INFO] Running org.apache.commons.io.HexDumpTest
[INFO] Tests run: 1, Failures: 0, Errors: 0, Skipped: 0, Time elapsed: 0.133 s - in org.apache.commons.io.HexDumpTest
[INFO] Running org.apache.commons.io.LineIteratorTestCase
[INFO] Tests run: 16, Failures: 0, Errors: 0, Skipped: 0, Time elapsed: 0.26 s - in org.apache.commons.io.LineIteratorTestCase
[INFO] Running org.apache.commons.io.FileUtilsDirectoryContainsTestCase
[INFO] Tests run: 11, Failures: 0, Errors: 0, Skipped: 0, Time elapsed: 0.217 s - in org.apache.commons.io.FileUtilsDirectoryContainsTestCase
[INFO] Running org.apache.commons.io.FileUtilsCleanDirectoryTestCase
[ERROR] Tests run: 5, Failures: 2, Errors: 0, Skipped: 0, Time elapsed: 0.155 s <<< FAILURE! - in org.apache.commons.io.FileUtilsCleanDirectoryTestCase
[ERROR] testThrowsOnNullList(org.apache.commons.io.FileUtilsCleanDirectoryTestCase)  Time elapsed: 0.013 s  <<< FAILURE!
java.lang.AssertionError: expected IOException
	at org.apache.commons.io.FileUtilsCleanDirectoryTestCase.testThrowsOnNullList(FileUtilsCleanDirectoryTestCase.java:96)

[ERROR] testThrowsOnCannotDeleteFile(org.apache.commons.io.FileUtilsCleanDirectoryTestCase)  Time elapsed: 0.004 s  <<< FAILURE!
java.lang.AssertionError: expected IOException
	at org.apache.commons.io.FileUtilsCleanDirectoryTestCase.testThrowsOnCannotDeleteFile(FileUtilsCleanDirectoryTestCase.java:116)

[INFO] Running org.apache.commons.io.FileDeleteStrategyTestCase
[INFO] Tests run: 5, Failures: 0, Errors: 0, Skipped: 0, Time elapsed: 0.149 s - in org.apache.commons.io.FileDeleteStrategyTestCase
[INFO] Running org.apache.commons.io.comparator.CompositeFileComparatorTest
[INFO] Tests run: 10, Failures: 0, Errors: 0, Skipped: 0, Time elapsed: 0.12 s - in org.apache.commons.io.comparator.CompositeFileComparatorTest
[INFO] Running org.apache.commons.io.comparator.ExtensionFileComparatorTest
[INFO] Tests run: 8, Failures: 0, Errors: 0, Skipped: 0, Time elapsed: 0.181 s - in org.apache.commons.io.comparator.ExtensionFileComparatorTest
[INFO] Running org.apache.commons.io.comparator.NameFileComparatorTest
[INFO] Tests run: 8, Failures: 0, Errors: 0, Skipped: 0, Time elapsed: 0.233 s - in org.apache.commons.io.comparator.NameFileComparatorTest
[INFO] Running org.apache.commons.io.comparator.LastModifiedFileComparatorTest
[INFO] Tests run: 7, Failures: 0, Errors: 0, Skipped: 0, Time elapsed: 13.957 s - in org.apache.commons.io.comparator.LastModifiedFileComparatorTest
[INFO] Running org.apache.commons.io.comparator.DefaultFileComparatorTest
[INFO] Tests run: 7, Failures: 0, Errors: 0, Skipped: 0, Time elapsed: 0.171 s - in org.apache.commons.io.comparator.DefaultFileComparatorTest
[INFO] Running org.apache.commons.io.comparator.DirectoryFileComparatorTest
[INFO] Tests run: 7, Failures: 0, Errors: 0, Skipped: 0, Time elapsed: 0.18 s - in org.apache.commons.io.comparator.DirectoryFileComparatorTest
[INFO] Running org.apache.commons.io.comparator.PathFileComparatorTest
[INFO] Tests run: 8, Failures: 0, Errors: 0, Skipped: 0, Time elapsed: 0.176 s - in org.apache.commons.io.comparator.PathFileComparatorTest
[INFO] Running org.apache.commons.io.comparator.SizeFileComparatorTest
[INFO] Tests run: 9, Failures: 0, Errors: 0, Skipped: 0, Time elapsed: 0.217 s - in org.apache.commons.io.comparator.SizeFileComparatorTest
[INFO] Running org.apache.commons.io.filefilter.AndFileFilterTestCase
[INFO] Tests run: 5, Failures: 0, Errors: 0, Skipped: 0, Time elapsed: 0.15 s - in org.apache.commons.io.filefilter.AndFileFilterTestCase
[INFO] Running org.apache.commons.io.filefilter.RegexFileFilterTestCase
[INFO] Tests run: 1, Failures: 0, Errors: 0, Skipped: 0, Time elapsed: 0.161 s - in org.apache.commons.io.filefilter.RegexFileFilterTestCase
[INFO] Running org.apache.commons.io.filefilter.FileFilterTestCase
[ERROR] Tests run: 47, Failures: 2, Errors: 0, Skipped: 0, Time elapsed: 2.208 s <<< FAILURE! - in org.apache.commons.io.filefilter.FileFilterTestCase
[ERROR] testCanRead(org.apache.commons.io.filefilter.FileFilterTestCase)  Time elapsed: 0.008 s  <<< FAILURE!
java.lang.AssertionError: Filter(File) org.apache.commons.io.filefilter.AndFileFilter not true for /tmp/junit126726255574824202/read-only-file1.txt expected:<true> but was:<false>
	at org.apache.commons.io.filefilter.FileFilterTestCase.assertFiltering(FileFilterTestCase.java:72)
	at org.apache.commons.io.filefilter.FileFilterTestCase.testCanRead(FileFilterTestCase.java:956)

[ERROR] testCanWrite(org.apache.commons.io.filefilter.FileFilterTestCase)  Time elapsed: 0.002 s  <<< FAILURE!
java.lang.AssertionError: Filter(File) org.apache.commons.io.filefilter.CanWriteFileFilter not false for /tmp/junit7143670524753058041/read-only-file2.txt expected:<false> but was:<true>
	at org.apache.commons.io.filefilter.FileFilterTestCase.assertFiltering(FileFilterTestCase.java:72)
	at org.apache.commons.io.filefilter.FileFilterTestCase.testCanWrite(FileFilterTestCase.java:974)

[INFO] Running org.apache.commons.io.filefilter.OrFileFilterTestCase
[INFO] Tests run: 5, Failures: 0, Errors: 0, Skipped: 0, Time elapsed: 0.149 s - in org.apache.commons.io.filefilter.OrFileFilterTestCase
[INFO] Running org.apache.commons.io.output.TaggedOutputStreamTest
[INFO] Tests run: 3, Failures: 0, Errors: 0, Skipped: 0, Time elapsed: 0.164 s - in org.apache.commons.io.output.TaggedOutputStreamTest
[INFO] Running org.apache.commons.io.output.ChunkedWriterTest
[INFO] Tests run: 3, Failures: 0, Errors: 0, Skipped: 0, Time elapsed: 0.144 s - in org.apache.commons.io.output.ChunkedWriterTest
[INFO] Running org.apache.commons.io.output.XmlStreamWriterTest
[INFO] Tests run: 13, Failures: 0, Errors: 0, Skipped: 0, Time elapsed: 0.15 s - in org.apache.commons.io.output.XmlStreamWriterTest
[INFO] Running org.apache.commons.io.output.WriterOutputStreamTest
[INFO] Tests run: 12, Failures: 0, Errors: 0, Skipped: 0, Time elapsed: 0.19 s - in org.apache.commons.io.output.WriterOutputStreamTest
[INFO] Running org.apache.commons.io.output.FileWriterWithEncodingTest
[INFO] Tests run: 12, Failures: 0, Errors: 0, Skipped: 0, Time elapsed: 0.17 s - in org.apache.commons.io.output.FileWriterWithEncodingTest
[INFO] Running org.apache.commons.io.output.ProxyWriterTest
[INFO] Tests run: 21, Failures: 0, Errors: 0, Skipped: 0, Time elapsed: 0.126 s - in org.apache.commons.io.output.ProxyWriterTest
[INFO] Running org.apache.commons.io.output.LockableFileWriterTest
[INFO] Tests run: 7, Failures: 0, Errors: 0, Skipped: 0, Time elapsed: 0.124 s - in org.apache.commons.io.output.LockableFileWriterTest
[INFO] Running org.apache.commons.io.output.StringBuilderWriterTest
[INFO] Tests run: 12, Failures: 0, Errors: 0, Skipped: 0, Time elapsed: 0.138 s - in org.apache.commons.io.output.StringBuilderWriterTest
[INFO] Running org.apache.commons.io.output.BrokenOutputStreamTest
[INFO] Tests run: 3, Failures: 0, Errors: 0, Skipped: 0, Time elapsed: 0.126 s - in org.apache.commons.io.output.BrokenOutputStreamTest
[INFO] Running org.apache.commons.io.output.ThresholdingOutputStreamTest
[INFO] Tests run: 1, Failures: 0, Errors: 0, Skipped: 0, Time elapsed: 0.117 s - in org.apache.commons.io.output.ThresholdingOutputStreamTest
[INFO] Running org.apache.commons.io.output.ClosedOutputStreamTest
[INFO] Tests run: 2, Failures: 0, Errors: 0, Skipped: 0, Time elapsed: 0.141 s - in org.apache.commons.io.output.ClosedOutputStreamTest
[INFO] Running org.apache.commons.io.output.NullWriterTest
[INFO] Tests run: 1, Failures: 0, Errors: 0, Skipped: 0, Time elapsed: 0.119 s - in org.apache.commons.io.output.NullWriterTest
[INFO] Running org.apache.commons.io.output.AppendableOutputStreamTest
[INFO] Tests run: 2, Failures: 0, Errors: 0, Skipped: 0, Time elapsed: 0.134 s - in org.apache.commons.io.output.AppendableOutputStreamTest
[INFO] Running org.apache.commons.io.output.DeferredFileOutputStreamTest
[INFO] Tests run: 130, Failures: 0, Errors: 0, Skipped: 0, Time elapsed: 0.35 s - in org.apache.commons.io.output.DeferredFileOutputStreamTest
[INFO] Running org.apache.commons.io.output.ProxyOutputStreamTest
[INFO] Tests run: 2, Failures: 0, Errors: 0, Skipped: 0, Time elapsed: 0.127 s - in org.apache.commons.io.output.ProxyOutputStreamTest
[INFO] Running org.apache.commons.io.output.TeeOutputStreamTest
[INFO] Tests run: 3, Failures: 0, Errors: 0, Skipped: 0, Time elapsed: 0.183 s - in org.apache.commons.io.output.TeeOutputStreamTest
[INFO] Running org.apache.commons.io.output.CloseShieldOutputStreamTest
[INFO] Tests run: 1, Failures: 0, Errors: 0, Skipped: 0, Time elapsed: 0.14 s - in org.apache.commons.io.output.CloseShieldOutputStreamTest
[INFO] Running org.apache.commons.io.output.ByteArrayOutputStreamTestCase
[INFO] Tests run: 3, Failures: 0, Errors: 0, Skipped: 0, Time elapsed: 0.176 s - in org.apache.commons.io.output.ByteArrayOutputStreamTestCase
[INFO] Running org.apache.commons.io.output.ChunkedOutputStreamTest
[INFO] Tests run: 3, Failures: 0, Errors: 0, Skipped: 0, Time elapsed: 0.119 s - in org.apache.commons.io.output.ChunkedOutputStreamTest
[INFO] Running org.apache.commons.io.output.CountingOutputStreamTest
[INFO] Tests run: 2, Failures: 0, Errors: 0, Skipped: 0, Time elapsed: 0.142 s - in org.apache.commons.io.output.CountingOutputStreamTest
[INFO] Running org.apache.commons.io.output.NullOutputStreamTest
[INFO] Tests run: 1, Failures: 0, Errors: 0, Skipped: 0, Time elapsed: 0.091 s - in org.apache.commons.io.output.NullOutputStreamTest
[INFO] Running org.apache.commons.io.IOExceptionWithCauseTestCase
[INFO] Tests run: 2, Failures: 0, Errors: 0, Skipped: 0, Time elapsed: 0.11 s - in org.apache.commons.io.IOExceptionWithCauseTestCase
[INFO] Running org.apache.commons.io.FilenameUtilsWildcardTestCase
[INFO] Tests run: 7, Failures: 0, Errors: 0, Skipped: 0, Time elapsed: 0.168 s - in org.apache.commons.io.FilenameUtilsWildcardTestCase
[INFO] Running org.apache.commons.io.CharsetsTestCase
[INFO] Tests run: 8, Failures: 0, Errors: 0, Skipped: 0, Time elapsed: 0.137 s - in org.apache.commons.io.CharsetsTestCase
[INFO] Running org.apache.commons.io.FileSystemTestCase
[INFO] Tests run: 5, Failures: 0, Errors: 0, Skipped: 0, Time elapsed: 0.171 s - in org.apache.commons.io.FileSystemTestCase
[INFO] Running org.apache.commons.io.ByteOrderParserTest
[INFO] Tests run: 3, Failures: 0, Errors: 0, Skipped: 0, Time elapsed: 0.127 s - in org.apache.commons.io.ByteOrderParserTest
[INFO] Running org.apache.commons.io.FileUtilsFileNewerTestCase
[INFO] Tests run: 5, Failures: 0, Errors: 0, Skipped: 0, Time elapsed: 0.214 s - in org.apache.commons.io.FileUtilsFileNewerTestCase
[INFO] Running org.apache.commons.io.TaggedIOExceptionTest
[INFO] Tests run: 1, Failures: 0, Errors: 0, Skipped: 0, Time elapsed: 0.126 s - in org.apache.commons.io.TaggedIOExceptionTest
[INFO] Running org.apache.commons.io.IOUtilsWriteTestCase
[INFO] Tests run: 53, Failures: 0, Errors: 0, Skipped: 0, Time elapsed: 0.247 s - in org.apache.commons.io.IOUtilsWriteTestCase
[INFO] Running org.apache.commons.io.FileUtilsTestCase
[WARNING] Tests run: 142, Failures: 0, Errors: 0, Skipped: 1, Time elapsed: 2.645 s - in org.apache.commons.io.FileUtilsTestCase
[INFO] Running org.apache.commons.io.DirectoryWalkerTestCase
[INFO] Tests run: 15, Failures: 0, Errors: 0, Skipped: 0, Time elapsed: 0.139 s - in org.apache.commons.io.DirectoryWalkerTestCase
[INFO] Running org.apache.commons.io.DirectoryWalkerTestCaseJava4
[INFO] Tests run: 14, Failures: 0, Errors: 0, Skipped: 0, Time elapsed: 0.212 s - in org.apache.commons.io.DirectoryWalkerTestCaseJava4
[INFO] Running org.apache.commons.io.serialization.FullClassNameMatcherTest
[INFO] Tests run: 2, Failures: 0, Errors: 0, Skipped: 0, Time elapsed: 0.071 s - in org.apache.commons.io.serialization.FullClassNameMatcherTest
[INFO] Running org.apache.commons.io.serialization.WildcardClassNameMatcherTest
[INFO] Tests run: 3, Failures: 0, Errors: 0, Skipped: 0, Time elapsed: 0.079 s - in org.apache.commons.io.serialization.WildcardClassNameMatcherTest
[INFO] Running org.apache.commons.io.serialization.MoreComplexObjectTest
[INFO] Tests run: 3, Failures: 0, Errors: 0, Skipped: 0, Time elapsed: 0.176 s - in org.apache.commons.io.serialization.MoreComplexObjectTest
[INFO] Running org.apache.commons.io.serialization.ValidatingObjectInputStreamTest
[INFO] Tests run: 18, Failures: 0, Errors: 0, Skipped: 0, Time elapsed: 0.138 s - in org.apache.commons.io.serialization.ValidatingObjectInputStreamTest
[INFO] Running org.apache.commons.io.serialization.RegexpClassNameMatcherTest
[INFO] Tests run: 5, Failures: 0, Errors: 0, Skipped: 0, Time elapsed: 0.091 s - in org.apache.commons.io.serialization.RegexpClassNameMatcherTest
[INFO] Running org.apache.commons.io.DemuxTestCase
[INFO] Tests run: 2, Failures: 0, Errors: 0, Skipped: 0, Time elapsed: 0.27 s - in org.apache.commons.io.DemuxTestCase
[INFO] Running org.apache.commons.io.FileUtilsListFilesTestCase
[INFO] Tests run: 3, Failures: 0, Errors: 0, Skipped: 0, Time elapsed: 0.137 s - in org.apache.commons.io.FileUtilsListFilesTestCase
[INFO] Running org.apache.commons.io.CopyUtilsTest
[INFO] Tests run: 11, Failures: 0, Errors: 0, Skipped: 0, Time elapsed: 0.108 s - in org.apache.commons.io.CopyUtilsTest
[INFO] Running org.apache.commons.io.input.NullReaderTest
[INFO] Tests run: 6, Failures: 0, Errors: 0, Skipped: 0, Time elapsed: 0.08 s - in org.apache.commons.io.input.NullReaderTest
[INFO] Running org.apache.commons.io.input.CloseShieldInputStreamTest
[INFO] Tests run: 1, Failures: 0, Errors: 0, Skipped: 0, Time elapsed: 0.094 s - in org.apache.commons.io.input.CloseShieldInputStreamTest
[INFO] Running org.apache.commons.io.input.SwappedDataInputStreamTest
[INFO] Tests run: 14, Failures: 0, Errors: 0, Skipped: 0, Time elapsed: 0.148 s - in org.apache.commons.io.input.SwappedDataInputStreamTest
[INFO] Running org.apache.commons.io.input.TaggedInputStreamTest
[INFO] Tests run: 4, Failures: 0, Errors: 0, Skipped: 0, Time elapsed: 0.098 s - in org.apache.commons.io.input.TaggedInputStreamTest
[INFO] Running org.apache.commons.io.input.TeeInputStreamTest
[INFO] Tests run: 7, Failures: 0, Errors: 0, Skipped: 0, Time elapsed: 0.1 s - in org.apache.commons.io.input.TeeInputStreamTest
[INFO] Running org.apache.commons.io.input.ProxyReaderTest
[INFO] Tests run: 2, Failures: 0, Errors: 0, Skipped: 0, Time elapsed: 0.106 s - in org.apache.commons.io.input.ProxyReaderTest
[INFO] Running org.apache.commons.io.input.ObservableInputStreamTest
[INFO] Tests run: 2, Failures: 0, Errors: 0, Skipped: 0, Time elapsed: 0.111 s - in org.apache.commons.io.input.ObservableInputStreamTest
[INFO] Running org.apache.commons.io.input.CharSequenceReaderTest
[INFO] Tests run: 7, Failures: 0, Errors: 0, Skipped: 0, Time elapsed: 0.083 s - in org.apache.commons.io.input.CharSequenceReaderTest
[INFO] Running org.apache.commons.io.input.ReversedLinesFileReaderTestParamBlockSize
[INFO] Tests run: 85, Failures: 0, Errors: 0, Skipped: 0, Time elapsed: 0.297 s - in org.apache.commons.io.input.ReversedLinesFileReaderTestParamBlockSize
[INFO] Running org.apache.commons.io.input.ReversedLinesFileReaderTestSimple
[INFO] Tests run: 3, Failures: 0, Errors: 0, Skipped: 0, Time elapsed: 0.117 s - in org.apache.commons.io.input.ReversedLinesFileReaderTestSimple
[INFO] Running org.apache.commons.io.input.BOMInputStreamTest
[WARNING] Tests run: 44, Failures: 0, Errors: 0, Skipped: 1, Time elapsed: 0.23 s - in org.apache.commons.io.input.BOMInputStreamTest
[INFO] Running org.apache.commons.io.input.XmlStreamReaderUtilitiesTest
[INFO] Tests run: 11, Failures: 0, Errors: 0, Skipped: 0, Time elapsed: 0.115 s - in org.apache.commons.io.input.XmlStreamReaderUtilitiesTest
[INFO] Running org.apache.commons.io.input.WindowsLineEndingInputStreamTest
[INFO] Tests run: 7, Failures: 0, Errors: 0, Skipped: 0, Time elapsed: 0.077 s - in org.apache.commons.io.input.WindowsLineEndingInputStreamTest
[INFO] Running org.apache.commons.io.input.ClosedInputStreamTest
[INFO] Tests run: 1, Failures: 0, Errors: 0, Skipped: 0, Time elapsed: 0.08 s - in org.apache.commons.io.input.ClosedInputStreamTest
[INFO] Running org.apache.commons.io.input.ReversedLinesFileReaderTestParamFile
[INFO] Tests run: 17, Failures: 0, Errors: 0, Skipped: 0, Time elapsed: 0.204 s - in org.apache.commons.io.input.ReversedLinesFileReaderTestParamFile
[INFO] Running org.apache.commons.io.input.MessageDigestCalculatingInputStreamTest
[INFO] Tests run: 1, Failures: 0, Errors: 0, Skipped: 0, Time elapsed: 0.104 s - in org.apache.commons.io.input.MessageDigestCalculatingInputStreamTest
[INFO] Running org.apache.commons.io.input.XmlStreamReaderTest
[INFO] Tests run: 16, Failures: 0, Errors: 0, Skipped: 0, Time elapsed: 0.739 s - in org.apache.commons.io.input.XmlStreamReaderTest
[INFO] Running org.apache.commons.io.input.CharSequenceInputStreamTest
[WARNING] Tests run: 30, Failures: 0, Errors: 0, Skipped: 2, Time elapsed: 0.573 s - in org.apache.commons.io.input.CharSequenceInputStreamTest
[INFO] Running org.apache.commons.io.input.BoundedReaderTest
[INFO] Tests run: 12, Failures: 0, Errors: 0, Skipped: 0, Time elapsed: 0.097 s - in org.apache.commons.io.input.BoundedReaderTest
[INFO] Running org.apache.commons.io.input.ClassLoaderObjectInputStreamTest
[INFO] Tests run: 7, Failures: 0, Errors: 0, Skipped: 0, Time elapsed: 0.092 s - in org.apache.commons.io.input.ClassLoaderObjectInputStreamTest
[INFO] Running org.apache.commons.io.input.NullInputStreamTest
[INFO] Tests run: 6, Failures: 0, Errors: 0, Skipped: 0, Time elapsed: 0.11 s - in org.apache.commons.io.input.NullInputStreamTest
[INFO] Running org.apache.commons.io.input.UnixLineEndingInputStreamTest
[INFO] Tests run: 8, Failures: 0, Errors: 0, Skipped: 0, Time elapsed: 0.082 s - in org.apache.commons.io.input.UnixLineEndingInputStreamTest
[INFO] Running org.apache.commons.io.input.BoundedInputStreamTest
[INFO] Tests run: 2, Failures: 0, Errors: 0, Skipped: 0, Time elapsed: 0.153 s - in org.apache.commons.io.input.BoundedInputStreamTest
[INFO] Running org.apache.commons.io.input.CountingInputStreamTest
[INFO] Tests run: 10, Failures: 0, Errors: 0, Skipped: 0, Time elapsed: 0.147 s - in org.apache.commons.io.input.CountingInputStreamTest
[INFO] Running org.apache.commons.io.input.InfiniteCircularInputStreamTest
[INFO] Tests run: 2, Failures: 0, Errors: 0, Skipped: 0, Time elapsed: 0.083 s - in org.apache.commons.io.input.InfiniteCircularInputStreamTest
[INFO] Running org.apache.commons.io.input.TailerTest
Elapsed: 1463
testMultiByteBreak() Default charset: UTF-8
[INFO] Tests run: 10, Failures: 0, Errors: 0, Skipped: 0, Time elapsed: 11.544 s - in org.apache.commons.io.input.TailerTest
[INFO] Running org.apache.commons.io.input.AutoCloseInputStreamTest
[INFO] Tests run: 6, Failures: 0, Errors: 0, Skipped: 0, Time elapsed: 0.092 s - in org.apache.commons.io.input.AutoCloseInputStreamTest
[INFO] Running org.apache.commons.io.input.ReaderInputStreamTest
[INFO] Tests run: 8, Failures: 0, Errors: 0, Skipped: 0, Time elapsed: 0.162 s - in org.apache.commons.io.input.ReaderInputStreamTest
[INFO] Running org.apache.commons.io.input.BrokenInputStreamTest
[INFO] Tests run: 5, Failures: 0, Errors: 0, Skipped: 0, Time elapsed: 0.103 s - in org.apache.commons.io.input.BrokenInputStreamTest
[INFO] Running org.apache.commons.io.input.compatibility.XmlStreamReaderUtilitiesCompatibilityTest
[INFO] Tests run: 11, Failures: 0, Errors: 0, Skipped: 0, Time elapsed: 0.289 s - in org.apache.commons.io.input.compatibility.XmlStreamReaderUtilitiesCompatibilityTest
[INFO] Running org.apache.commons.io.FileUtilsCleanSymlinksTestCase
[INFO] Tests run: 8, Failures: 0, Errors: 0, Skipped: 0, Time elapsed: 0.184 s - in org.apache.commons.io.FileUtilsCleanSymlinksTestCase
[INFO] Running org.apache.commons.io.ThreadMonitorTestCase
[INFO] Tests run: 3, Failures: 0, Errors: 0, Skipped: 0, Time elapsed: 0.503 s - in org.apache.commons.io.ThreadMonitorTestCase
[INFO] Running org.apache.commons.io.FileSystemUtilsTestCase
[INFO] Tests run: 28, Failures: 0, Errors: 0, Skipped: 0, Time elapsed: 0.142 s - in org.apache.commons.io.FileSystemUtilsTestCase
[INFO] 
[INFO] Results:
[INFO] 
[ERROR] Failures: 
[ERROR]   FileUtilsCleanDirectoryTestCase.testThrowsOnCannotDeleteFile:116 expected IOException
[ERROR]   FileUtilsCleanDirectoryTestCase.testThrowsOnNullList:96 expected IOException
[ERROR]   FileFilterTestCase.testCanRead:956->assertFiltering:72 Filter(File) org.apache.commons.io.filefilter.AndFileFilter not true for /tmp/junit126726255574824202/read-only-file1.txt expected:<true> but was:<false>
[ERROR]   FileFilterTestCase.testCanWrite:974->assertFiltering:72 Filter(File) org.apache.commons.io.filefilter.CanWriteFileFilter not false for /tmp/junit7143670524753058041/read-only-file2.txt expected:<false> but was:<true>
[INFO] 
[ERROR] Tests run: 1329, Failures: 4, Errors: 0, Skipped: 4
[INFO] 
[INFO] ------------------------------------------------------------------------
[INFO] BUILD FAILURE
[INFO] ------------------------------------------------------------------------
[INFO] Total time: 02:30 min
[INFO] Finished at: 2018-02-08T12:54:48+01:00
[INFO] Final Memory: 22M/654M
[INFO] ------------------------------------------------------------------------
[ERROR] Failed to execute goal org.apache.maven.plugins:maven-surefire-plugin:2.20.1:test (default-test) on project commons-io: There are test failures.
[ERROR] 
[ERROR] Please refer to /root/workspace/apache/commons-io/338938904/target/surefire-reports for the individual test results.
[ERROR] Please refer to dump files (if any exist) [date]-jvmRun[N].dump, [date].dumpstream and [date]-jvmRun[N].dumpstream.
[ERROR] -> [Help 1]
[ERROR] 
[ERROR] To see the full stack trace of the errors, re-run Maven with the -e switch.
[ERROR] Re-run Maven using the -X switch to enable full debug logging.
[ERROR] 
[ERROR] For more information about the errors and possible solutions, please read the following articles:
[ERROR] [Help 1] http://cwiki.apache.org/confluence/display/MAVEN/MojoFailureException
