[INFO] Scanning for projects...
[INFO] ------------------------------------------------------------------------
[INFO] Reactor Build Order:
[INFO] 
[INFO] replicator
[INFO] mysql-replicator-commons
[INFO] mysql-replicator-streams
[INFO] mysql-replicator-coordinator
[INFO] mysql-replicator-supplier-model
[INFO] mysql-replicator-supplier
[INFO] mysql-replicator-augmenter-model
[INFO] mysql-replicator-augmenter
[INFO] mysql-replicator-applier
[INFO] mysql-replicator
[INFO]                                                                         
[INFO] ------------------------------------------------------------------------
[INFO] Building replicator 0.16.0-alpha-1-SNAPSHOT
[INFO] ------------------------------------------------------------------------
[INFO] 
[INFO] --- maven-checkstyle-plugin:3.0.0:check (validate) @ replicator ---
[INFO] 
[INFO] --- jacoco-maven-plugin:0.8.0:prepare-agent (default) @ replicator ---
[INFO] tests.arguments set to -javaagent:/root/./workspace/mysql-time-machine/replicator/414633841/.m2/org/jacoco/org.jacoco.agent/0.8.0/org.jacoco.agent-0.8.0-runtime.jar=destfile=/root/workspace/mysql-time-machine/replicator/414633841/target/jacoco.exec -Djava.util.logging.schema=org.apache.logging.log4j.jul.LogManager
[INFO] 
[INFO] --- jacoco-maven-plugin:0.8.0:report (report) @ replicator ---
[INFO] Skipping JaCoCo execution due to missing execution data file.
[INFO]                                                                         
[INFO] ------------------------------------------------------------------------
[INFO] Building mysql-replicator-commons 0.16.0-alpha-1-SNAPSHOT
[INFO] ------------------------------------------------------------------------
[INFO] 
[INFO] --- maven-checkstyle-plugin:3.0.0:check (validate) @ mysql-replicator-commons ---
[INFO] 
[INFO] --- jacoco-maven-plugin:0.8.0:prepare-agent (default) @ mysql-replicator-commons ---
[INFO] tests.arguments set to -javaagent:/root/./workspace/mysql-time-machine/replicator/414633841/.m2/org/jacoco/org.jacoco.agent/0.8.0/org.jacoco.agent-0.8.0-runtime.jar=destfile=/root/workspace/mysql-time-machine/replicator/414633841/mysql-replicator-commons/target/jacoco.exec -Djava.util.logging.schema=org.apache.logging.log4j.jul.LogManager
[INFO] 
[INFO] --- maven-resources-plugin:2.6:resources (default-resources) @ mysql-replicator-commons ---
[INFO] Using 'UTF-8' encoding to copy filtered resources.
[INFO] skip non existing resourceDirectory /root/workspace/mysql-time-machine/replicator/414633841/mysql-replicator-commons/src/main/resources
[INFO] 
[INFO] --- maven-compiler-plugin:3.7.0:compile (default-compile) @ mysql-replicator-commons ---
[INFO] Nothing to compile - all classes are up to date
[INFO] 
[INFO] --- maven-resources-plugin:2.6:testResources (default-testResources) @ mysql-replicator-commons ---
[INFO] Using 'UTF-8' encoding to copy filtered resources.
[INFO] Copying 2 resources
[INFO] 
[INFO] --- maven-compiler-plugin:3.7.0:testCompile (default-testCompile) @ mysql-replicator-commons ---
[INFO] Nothing to compile - all classes are up to date
[INFO] 
[INFO] --- maven-surefire-plugin:2.20.1:test (default-test) @ mysql-replicator-commons ---
[INFO] 
[INFO] --- jacoco-maven-plugin:0.8.0:report (report) @ mysql-replicator-commons ---
[INFO] Skipping JaCoCo execution due to missing execution data file.
[INFO]                                                                         
[INFO] ------------------------------------------------------------------------
[INFO] Building mysql-replicator-streams 0.16.0-alpha-1-SNAPSHOT
[INFO] ------------------------------------------------------------------------
[INFO] 
[INFO] --- maven-checkstyle-plugin:3.0.0:check (validate) @ mysql-replicator-streams ---
[INFO] 
[INFO] --- jacoco-maven-plugin:0.8.0:prepare-agent (default) @ mysql-replicator-streams ---
[INFO] tests.arguments set to -javaagent:/root/./workspace/mysql-time-machine/replicator/414633841/.m2/org/jacoco/org.jacoco.agent/0.8.0/org.jacoco.agent-0.8.0-runtime.jar=destfile=/root/workspace/mysql-time-machine/replicator/414633841/mysql-replicator-streams/target/jacoco.exec -Djava.util.logging.schema=org.apache.logging.log4j.jul.LogManager
[INFO] 
[INFO] --- maven-resources-plugin:2.6:resources (default-resources) @ mysql-replicator-streams ---
[INFO] Using 'UTF-8' encoding to copy filtered resources.
[INFO] skip non existing resourceDirectory /root/workspace/mysql-time-machine/replicator/414633841/mysql-replicator-streams/src/main/resources
[INFO] 
[INFO] --- maven-compiler-plugin:3.7.0:compile (default-compile) @ mysql-replicator-streams ---
[INFO] Nothing to compile - all classes are up to date
[INFO] 
[INFO] --- maven-resources-plugin:2.6:testResources (default-testResources) @ mysql-replicator-streams ---
[INFO] Using 'UTF-8' encoding to copy filtered resources.
[INFO] Copying 1 resource
[INFO] 
[INFO] --- maven-compiler-plugin:3.7.0:testCompile (default-testCompile) @ mysql-replicator-streams ---
[INFO] Nothing to compile - all classes are up to date
[INFO] 
[INFO] --- maven-surefire-plugin:2.20.1:test (default-test) @ mysql-replicator-streams ---
[INFO] Downloading: https://repo.maven.apache.org/maven2/org/apache/maven/surefire/surefire-junit4/2.20.1/surefire-junit4-2.20.1.pom
[INFO] Downloaded: https://repo.maven.apache.org/maven2/org/apache/maven/surefire/surefire-junit4/2.20.1/surefire-junit4-2.20.1.pom (4 KB at 5.4 KB/sec)
[INFO] Downloading: https://repo.maven.apache.org/maven2/org/apache/maven/surefire/surefire-providers/2.20.1/surefire-providers-2.20.1.pom
[INFO] Downloaded: https://repo.maven.apache.org/maven2/org/apache/maven/surefire/surefire-providers/2.20.1/surefire-providers-2.20.1.pom (3 KB at 76.0 KB/sec)
[INFO] Downloading: https://repo.maven.apache.org/maven2/org/apache/maven/surefire/surefire-junit4/2.20.1/surefire-junit4-2.20.1.jar
[INFO] Downloaded: https://repo.maven.apache.org/maven2/org/apache/maven/surefire/surefire-junit4/2.20.1/surefire-junit4-2.20.1.jar (81 KB at 913.1 KB/sec)
[INFO] 
[INFO] -------------------------------------------------------
[INFO]  T E S T S
[INFO] -------------------------------------------------------
[INFO] Running com.booking.replication.streams.StreamsTest
[INFO] Tests run: 10, Failures: 0, Errors: 0, Skipped: 0, Time elapsed: 8.522 s - in com.booking.replication.streams.StreamsTest
[INFO] 
[INFO] Results:
[INFO] 
[INFO] Tests run: 10, Failures: 0, Errors: 0, Skipped: 0
[INFO] 
[INFO] 
[INFO] --- jacoco-maven-plugin:0.8.0:report (report) @ mysql-replicator-streams ---
[INFO] Skipping JaCoCo execution due to missing execution data file.
[INFO]                                                                         
[INFO] ------------------------------------------------------------------------
[INFO] Building mysql-replicator-coordinator 0.16.0-alpha-1-SNAPSHOT
[INFO] ------------------------------------------------------------------------
[INFO] 
[INFO] --- maven-checkstyle-plugin:3.0.0:check (validate) @ mysql-replicator-coordinator ---
[INFO] 
[INFO] --- jacoco-maven-plugin:0.8.0:prepare-agent (default) @ mysql-replicator-coordinator ---
[INFO] tests.arguments set to -javaagent:/root/./workspace/mysql-time-machine/replicator/414633841/.m2/org/jacoco/org.jacoco.agent/0.8.0/org.jacoco.agent-0.8.0-runtime.jar=destfile=/root/workspace/mysql-time-machine/replicator/414633841/mysql-replicator-coordinator/target/jacoco.exec -Djava.util.logging.schema=org.apache.logging.log4j.jul.LogManager
[INFO] 
[INFO] --- maven-resources-plugin:2.6:resources (default-resources) @ mysql-replicator-coordinator ---
[INFO] Using 'UTF-8' encoding to copy filtered resources.
[INFO] skip non existing resourceDirectory /root/workspace/mysql-time-machine/replicator/414633841/mysql-replicator-coordinator/src/main/resources
[INFO] 
[INFO] --- maven-compiler-plugin:3.7.0:compile (default-compile) @ mysql-replicator-coordinator ---
[INFO] Nothing to compile - all classes are up to date
[INFO] 
[INFO] --- maven-resources-plugin:2.6:testResources (default-testResources) @ mysql-replicator-coordinator ---
[INFO] Using 'UTF-8' encoding to copy filtered resources.
[INFO] Copying 1 resource
[INFO] 
[INFO] --- maven-compiler-plugin:3.7.0:testCompile (default-testCompile) @ mysql-replicator-coordinator ---
[INFO] Nothing to compile - all classes are up to date
[INFO] 
[INFO] --- maven-surefire-plugin:2.20.1:test (default-test) @ mysql-replicator-coordinator ---
[INFO] 
[INFO] -------------------------------------------------------
[INFO]  T E S T S
[INFO] -------------------------------------------------------
[INFO] Running com.booking.replication.coordinator.ZookeeperCoordinatorTest
2018-08-10 20:15:06 [INFO ] DockerClientProviderStrategy:182 - Will use 'netty' transport
2018-08-10 20:15:17 [ERROR] EnvironmentAndSystemPropertyClientProviderStrategy:44 - ping failed with configuration Environment variables, system properties and defaults. Resolved: 
    dockerHost=unix:///var/run/docker.sock
    apiVersion='{UNKNOWN_VERSION}'
    registryUrl='https://index.docker.io/v1/'
    registryUsername='root'
    registryPassword='null'
    registryEmail='null'
    dockerConfig='DefaultDockerClientConfig[dockerHost=unix:///var/run/docker.sock,registryUsername=root,registryPassword=<null>,registryEmail=<null>,registryUrl=https://index.docker.io/v1/,dockerConfigPath=/root/.docker,sslConfig=<null>,apiVersion={UNKNOWN_VERSION},dockerConfig=<null>]'
 due to org.rnorth.ducttape.TimeoutException: Timeout waiting for result with exception
org.rnorth.ducttape.TimeoutException: Timeout waiting for result with exception
	at org.rnorth.ducttape.unreliables.Unreliables.retryUntilSuccess(Unreliables.java:51) ~[duct-tape-1.0.7.jar:?]
	at org.testcontainers.dockerclient.DockerClientProviderStrategy.ping(DockerClientProviderStrategy.java:189) ~[testcontainers-1.8.0.jar:?]
	at org.testcontainers.dockerclient.EnvironmentAndSystemPropertyClientProviderStrategy.test(EnvironmentAndSystemPropertyClientProviderStrategy.java:42) ~[testcontainers-1.8.0.jar:?]
	at org.testcontainers.dockerclient.DockerClientProviderStrategy.lambda$getFirstValidStrategy$2(DockerClientProviderStrategy.java:112) ~[testcontainers-1.8.0.jar:?]
	at java.util.stream.ReferencePipeline$7$1.accept(ReferencePipeline.java:267) [?:1.8.0_121]
	at java.util.stream.StreamSpliterators$WrappingSpliterator.tryAdvance(StreamSpliterators.java:302) [?:1.8.0_121]
	at java.util.stream.Streams$ConcatSpliterator.tryAdvance(Streams.java:731) [?:1.8.0_121]
	at java.util.stream.ReferencePipeline.forEachWithCancel(ReferencePipeline.java:126) [?:1.8.0_121]
	at java.util.stream.AbstractPipeline.copyIntoWithCancel(AbstractPipeline.java:498) [?:1.8.0_121]
	at java.util.stream.AbstractPipeline.copyInto(AbstractPipeline.java:485) [?:1.8.0_121]
	at java.util.stream.AbstractPipeline.wrapAndCopyInto(AbstractPipeline.java:471) [?:1.8.0_121]
	at java.util.stream.FindOps$FindOp.evaluateSequential(FindOps.java:152) [?:1.8.0_121]
	at java.util.stream.AbstractPipeline.evaluate(AbstractPipeline.java:234) [?:1.8.0_121]
	at java.util.stream.ReferencePipeline.findAny(ReferencePipeline.java:469) [?:1.8.0_121]
	at org.testcontainers.dockerclient.DockerClientProviderStrategy.getFirstValidStrategy(DockerClientProviderStrategy.java:147) [testcontainers-1.8.0.jar:?]
	at org.testcontainers.DockerClientFactory.client(DockerClientFactory.java:100) [testcontainers-1.8.0.jar:?]
	at org.testcontainers.containers.GenericContainer.<init>(GenericContainer.java:149) [testcontainers-1.8.0.jar:?]
	at com.booking.replication.commons.services.ContainersProvider.getContainer(ContainersProvider.java:58) [test-classes/:?]
	at com.booking.replication.commons.services.ContainersProvider.getZookeeper(ContainersProvider.java:90) [test-classes/:?]
	at com.booking.replication.commons.services.ContainersProvider.startZookeeper(ContainersProvider.java:135) [test-classes/:?]
	at com.booking.replication.coordinator.ZookeeperCoordinatorTest.before(ZookeeperCoordinatorTest.java:30) [test-classes/:?]
	at sun.reflect.NativeMethodAccessorImpl.invoke0(Native Method) ~[?:1.8.0_121]
	at sun.reflect.NativeMethodAccessorImpl.invoke(NativeMethodAccessorImpl.java:62) ~[?:1.8.0_121]
	at sun.reflect.DelegatingMethodAccessorImpl.invoke(DelegatingMethodAccessorImpl.java:43) ~[?:1.8.0_121]
	at java.lang.reflect.Method.invoke(Method.java:498) ~[?:1.8.0_121]
	at org.junit.runners.model.FrameworkMethod$1.runReflectiveCall(FrameworkMethod.java:50) [junit-4.12.jar:4.12]
	at org.junit.internal.runners.model.ReflectiveCallable.run(ReflectiveCallable.java:12) [junit-4.12.jar:4.12]
	at org.junit.runners.model.FrameworkMethod.invokeExplosively(FrameworkMethod.java:47) [junit-4.12.jar:4.12]
	at org.junit.internal.runners.statements.RunBefores.evaluate(RunBefores.java:24) [junit-4.12.jar:4.12]
	at org.junit.internal.runners.statements.RunAfters.evaluate(RunAfters.java:27) [junit-4.12.jar:4.12]
	at org.junit.runners.ParentRunner.run(ParentRunner.java:363) [junit-4.12.jar:4.12]
	at org.apache.maven.surefire.junit4.JUnit4Provider.execute(JUnit4Provider.java:369) [surefire-junit4-2.20.1.jar:2.20.1]
	at org.apache.maven.surefire.junit4.JUnit4Provider.executeWithRerun(JUnit4Provider.java:275) [surefire-junit4-2.20.1.jar:2.20.1]
	at org.apache.maven.surefire.junit4.JUnit4Provider.executeTestSet(JUnit4Provider.java:239) [surefire-junit4-2.20.1.jar:2.20.1]
	at org.apache.maven.surefire.junit4.JUnit4Provider.invoke(JUnit4Provider.java:160) [surefire-junit4-2.20.1.jar:2.20.1]
	at org.apache.maven.surefire.booter.ForkedBooter.invokeProviderInSameClassLoader(ForkedBooter.java:373) [surefire-booter-2.20.1.jar:2.20.1]
	at org.apache.maven.surefire.booter.ForkedBooter.runSuitesInProcess(ForkedBooter.java:334) [surefire-booter-2.20.1.jar:2.20.1]
	at org.apache.maven.surefire.booter.ForkedBooter.execute(ForkedBooter.java:119) [surefire-booter-2.20.1.jar:2.20.1]
	at org.apache.maven.surefire.booter.ForkedBooter.main(ForkedBooter.java:407) [surefire-booter-2.20.1.jar:2.20.1]
Caused by: org.testcontainers.shaded.io.netty.channel.AbstractChannel$AnnotatedConnectException: connect(..) failed: No such file or directory: /var/run/docker.sock
	at org.testcontainers.shaded.io.netty.channel.unix.Errors.throwConnectException(Errors.java:107) ~[testcontainers-1.8.0.jar:?]
	at org.testcontainers.shaded.io.netty.channel.unix.Socket.connect(Socket.java:243) ~[testcontainers-1.8.0.jar:?]
	at org.testcontainers.shaded.io.netty.channel.epoll.AbstractEpollStreamChannel.doConnect(AbstractEpollStreamChannel.java:734) ~[testcontainers-1.8.0.jar:?]
	at org.testcontainers.shaded.io.netty.channel.epoll.EpollDomainSocketChannel.doConnect(EpollDomainSocketChannel.java:87) ~[testcontainers-1.8.0.jar:?]
	at org.testcontainers.shaded.io.netty.channel.epoll.AbstractEpollStreamChannel$EpollStreamUnsafe.connect(AbstractEpollStreamChannel.java:797) ~[testcontainers-1.8.0.jar:?]
	at org.testcontainers.shaded.io.netty.channel.DefaultChannelPipeline$HeadContext.connect(DefaultChannelPipeline.java:1274) ~[testcontainers-1.8.0.jar:?]
	at org.testcontainers.shaded.io.netty.channel.AbstractChannelHandlerContext.invokeConnect(AbstractChannelHandlerContext.java:545) ~[testcontainers-1.8.0.jar:?]
	at org.testcontainers.shaded.io.netty.channel.AbstractChannelHandlerContext.connect(AbstractChannelHandlerContext.java:530) ~[testcontainers-1.8.0.jar:?]
	at org.testcontainers.shaded.io.netty.channel.CombinedChannelDuplexHandler$DelegatingChannelHandlerContext.connect(CombinedChannelDuplexHandler.java:497) ~[testcontainers-1.8.0.jar:?]
	at org.testcontainers.shaded.io.netty.channel.ChannelOutboundHandlerAdapter.connect(ChannelOutboundHandlerAdapter.java:47) ~[testcontainers-1.8.0.jar:?]
	at org.testcontainers.shaded.io.netty.channel.CombinedChannelDuplexHandler.connect(CombinedChannelDuplexHandler.java:298) ~[testcontainers-1.8.0.jar:?]
	at org.testcontainers.shaded.io.netty.channel.AbstractChannelHandlerContext.invokeConnect(AbstractChannelHandlerContext.java:545) ~[testcontainers-1.8.0.jar:?]
	at org.testcontainers.shaded.io.netty.channel.AbstractChannelHandlerContext.connect(AbstractChannelHandlerContext.java:530) ~[testcontainers-1.8.0.jar:?]
	at org.testcontainers.shaded.io.netty.channel.AbstractChannelHandlerContext.connect(AbstractChannelHandlerContext.java:512) ~[testcontainers-1.8.0.jar:?]
	at org.testcontainers.shaded.io.netty.channel.DefaultChannelPipeline.connect(DefaultChannelPipeline.java:993) ~[testcontainers-1.8.0.jar:?]
	at org.testcontainers.shaded.io.netty.channel.AbstractChannel.connect(AbstractChannel.java:255) ~[testcontainers-1.8.0.jar:?]
	at org.testcontainers.shaded.io.netty.bootstrap.Bootstrap$3.run(Bootstrap.java:252) ~[testcontainers-1.8.0.jar:?]
	at org.testcontainers.shaded.io.netty.util.concurrent.AbstractEventExecutor.safeExecute(AbstractEventExecutor.java:163) ~[testcontainers-1.8.0.jar:?]
	at org.testcontainers.shaded.io.netty.util.concurrent.SingleThreadEventExecutor.runAllTasks(SingleThreadEventExecutor.java:403) ~[testcontainers-1.8.0.jar:?]
	at org.testcontainers.shaded.io.netty.channel.epoll.EpollEventLoop.run(EpollEventLoop.java:312) ~[testcontainers-1.8.0.jar:?]
	at org.testcontainers.shaded.io.netty.util.concurrent.SingleThreadEventExecutor$5.run(SingleThreadEventExecutor.java:858) ~[testcontainers-1.8.0.jar:?]
	at org.testcontainers.shaded.io.netty.util.concurrent.DefaultThreadFactory$DefaultRunnableDecorator.run(DefaultThreadFactory.java:138) ~[testcontainers-1.8.0.jar:?]
	at java.lang.Thread.run(Thread.java:745) ~[?:1.8.0_121]
Caused by: java.net.ConnectException: connect(..) failed: No such file or directory
	at org.testcontainers.shaded.io.netty.channel.unix.Errors.throwConnectException(Errors.java:107) ~[testcontainers-1.8.0.jar:?]
	at org.testcontainers.shaded.io.netty.channel.unix.Socket.connect(Socket.java:243) ~[testcontainers-1.8.0.jar:?]
	at org.testcontainers.shaded.io.netty.channel.epoll.AbstractEpollStreamChannel.doConnect(AbstractEpollStreamChannel.java:734) ~[testcontainers-1.8.0.jar:?]
	at org.testcontainers.shaded.io.netty.channel.epoll.EpollDomainSocketChannel.doConnect(EpollDomainSocketChannel.java:87) ~[testcontainers-1.8.0.jar:?]
	at org.testcontainers.shaded.io.netty.channel.epoll.AbstractEpollStreamChannel$EpollStreamUnsafe.connect(AbstractEpollStreamChannel.java:797) ~[testcontainers-1.8.0.jar:?]
	at org.testcontainers.shaded.io.netty.channel.DefaultChannelPipeline$HeadContext.connect(DefaultChannelPipeline.java:1274) ~[testcontainers-1.8.0.jar:?]
	at org.testcontainers.shaded.io.netty.channel.AbstractChannelHandlerContext.invokeConnect(AbstractChannelHandlerContext.java:545) ~[testcontainers-1.8.0.jar:?]
	at org.testcontainers.shaded.io.netty.channel.AbstractChannelHandlerContext.connect(AbstractChannelHandlerContext.java:530) ~[testcontainers-1.8.0.jar:?]
	at org.testcontainers.shaded.io.netty.channel.CombinedChannelDuplexHandler$DelegatingChannelHandlerContext.connect(CombinedChannelDuplexHandler.java:497) ~[testcontainers-1.8.0.jar:?]
	at org.testcontainers.shaded.io.netty.channel.ChannelOutboundHandlerAdapter.connect(ChannelOutboundHandlerAdapter.java:47) ~[testcontainers-1.8.0.jar:?]
	at org.testcontainers.shaded.io.netty.channel.CombinedChannelDuplexHandler.connect(CombinedChannelDuplexHandler.java:298) ~[testcontainers-1.8.0.jar:?]
	at org.testcontainers.shaded.io.netty.channel.AbstractChannelHandlerContext.invokeConnect(AbstractChannelHandlerContext.java:545) ~[testcontainers-1.8.0.jar:?]
	at org.testcontainers.shaded.io.netty.channel.AbstractChannelHandlerContext.connect(AbstractChannelHandlerContext.java:530) ~[testcontainers-1.8.0.jar:?]
	at org.testcontainers.shaded.io.netty.channel.AbstractChannelHandlerContext.connect(AbstractChannelHandlerContext.java:512) ~[testcontainers-1.8.0.jar:?]
	at org.testcontainers.shaded.io.netty.channel.DefaultChannelPipeline.connect(DefaultChannelPipeline.java:993) ~[testcontainers-1.8.0.jar:?]
	at org.testcontainers.shaded.io.netty.channel.AbstractChannel.connect(AbstractChannel.java:255) ~[testcontainers-1.8.0.jar:?]
	at org.testcontainers.shaded.io.netty.bootstrap.Bootstrap$3.run(Bootstrap.java:252) ~[testcontainers-1.8.0.jar:?]
	at org.testcontainers.shaded.io.netty.util.concurrent.AbstractEventExecutor.safeExecute(AbstractEventExecutor.java:163) ~[testcontainers-1.8.0.jar:?]
	at org.testcontainers.shaded.io.netty.util.concurrent.SingleThreadEventExecutor.runAllTasks(SingleThreadEventExecutor.java:403) ~[testcontainers-1.8.0.jar:?]
	at org.testcontainers.shaded.io.netty.channel.epoll.EpollEventLoop.run(EpollEventLoop.java:312) ~[testcontainers-1.8.0.jar:?]
	at org.testcontainers.shaded.io.netty.util.concurrent.SingleThreadEventExecutor$5.run(SingleThreadEventExecutor.java:858) ~[testcontainers-1.8.0.jar:?]
	at org.testcontainers.shaded.io.netty.util.concurrent.DefaultThreadFactory$DefaultRunnableDecorator.run(DefaultThreadFactory.java:138) ~[testcontainers-1.8.0.jar:?]
	at java.lang.Thread.run(Thread.java:745) ~[?:1.8.0_121]
2018-08-10 20:15:17 [ERROR] DockerClientProviderStrategy:149 - Could not find a valid Docker environment. Please check configuration. Attempted configurations were:
2018-08-10 20:15:17 [ERROR] DockerClientProviderStrategy:151 -     EnvironmentAndSystemPropertyClientProviderStrategy: failed with exception InvalidConfigurationException (ping failed)
2018-08-10 20:15:17 [ERROR] DockerClientProviderStrategy:151 -     UnixSocketClientProviderStrategy: failed with exception InvalidConfigurationException (ping failed). Root cause NoSuchFileException (/var/run/docker.sock)
2018-08-10 20:15:17 [ERROR] DockerClientProviderStrategy:153 - As no valid configuration was found, execution cannot continue
[ERROR] Tests run: 2, Failures: 0, Errors: 2, Skipped: 0, Time elapsed: 12.186 s <<< FAILURE! - in com.booking.replication.coordinator.ZookeeperCoordinatorTest
[ERROR] com.booking.replication.coordinator.ZookeeperCoordinatorTest  Time elapsed: 12.186 s  <<< ERROR!
java.lang.IllegalStateException: Could not find a valid Docker environment. Please see logs and check configuration
	at com.booking.replication.coordinator.ZookeeperCoordinatorTest.before(ZookeeperCoordinatorTest.java:30)

[ERROR] com.booking.replication.coordinator.ZookeeperCoordinatorTest  Time elapsed: 12.186 s  <<< ERROR!
java.lang.NullPointerException
	at com.booking.replication.coordinator.ZookeeperCoordinatorTest.after(ZookeeperCoordinatorTest.java:92)

[INFO] Running com.booking.replication.coordinator.FileCoordinatorTest
[INFO] Tests run: 2, Failures: 0, Errors: 0, Skipped: 0, Time elapsed: 11.457 s - in com.booking.replication.coordinator.FileCoordinatorTest
[INFO] 
[INFO] Results:
[INFO] 
[ERROR] Errors: 
[ERROR] com.booking.replication.coordinator.ZookeeperCoordinatorTest.com.booking.replication.coordinator.ZookeeperCoordinatorTest
[ERROR]   Run 1: ZookeeperCoordinatorTest.before:30 » IllegalState Could not find a valid Docke...
[ERROR]   Run 2: ZookeeperCoordinatorTest.after:92 NullPointer
[INFO] 
[INFO] 
[ERROR] Tests run: 3, Failures: 0, Errors: 1, Skipped: 0
[INFO] 
[INFO] ------------------------------------------------------------------------
[INFO] Reactor Summary:
[INFO] 
[INFO] replicator ......................................... SUCCESS [  2.902 s]
[INFO] mysql-replicator-commons ........................... SUCCESS [  1.675 s]
[INFO] mysql-replicator-streams ........................... SUCCESS [ 11.645 s]
[INFO] mysql-replicator-coordinator ....................... FAILURE [ 24.875 s]
[INFO] mysql-replicator-supplier-model .................... SKIPPED
[INFO] mysql-replicator-supplier .......................... SKIPPED
[INFO] mysql-replicator-augmenter-model ................... SKIPPED
[INFO] mysql-replicator-augmenter ......................... SKIPPED
[INFO] mysql-replicator-applier ........................... SKIPPED
[INFO] mysql-replicator ................................... SKIPPED
[INFO] ------------------------------------------------------------------------
[INFO] BUILD FAILURE
[INFO] ------------------------------------------------------------------------
[INFO] Total time: 41.550 s
[INFO] Finished at: 2018-08-10T20:15:28+02:00
[INFO] Final Memory: 25M/377M
[INFO] ------------------------------------------------------------------------
[ERROR] Failed to execute goal org.apache.maven.plugins:maven-surefire-plugin:2.20.1:test (default-test) on project mysql-replicator-coordinator: There are test failures.
[ERROR] 
[ERROR] Please refer to /root/workspace/mysql-time-machine/replicator/414633841/mysql-replicator-coordinator/target/surefire-reports for the individual test results.
[ERROR] Please refer to dump files (if any exist) [date]-jvmRun[N].dump, [date].dumpstream and [date]-jvmRun[N].dumpstream.
[ERROR] -> [Help 1]
[ERROR] 
[ERROR] To see the full stack trace of the errors, re-run Maven with the -e switch.
[ERROR] Re-run Maven using the -X switch to enable full debug logging.
[ERROR] 
[ERROR] For more information about the errors and possible solutions, please read the following articles:
[ERROR] [Help 1] http://cwiki.apache.org/confluence/display/MAVEN/MojoFailureException
[ERROR] 
[ERROR] After correcting the problems, you can resume the build with the command
[ERROR]   mvn <goals> -rf :mysql-replicator-coordinator
