[INFO] Scanning for projects...
[INFO]                                                                         
[INFO] ------------------------------------------------------------------------
[INFO] Building Nukleus Maven Plugin develop-SNAPSHOT
[INFO] ------------------------------------------------------------------------
[INFO] 
[INFO] --- license-maven-plugin:3.0:check (default) @ nukleus-maven-plugin ---
[INFO] 
[INFO] --- maven-checkstyle-plugin:2.17:check (default) @ nukleus-maven-plugin ---
[INFO] 
[INFO] --- jacoco-maven-plugin:0.7.9:prepare-agent (default) @ nukleus-maven-plugin ---
[INFO] argLine set to -javaagent:/root/./workspace/reaktivity/nukleus-maven-plugin/332057229/.m2/org/jacoco/org.jacoco.agent/0.7.9/org.jacoco.agent-0.7.9-runtime.jar=destfile=/root/workspace/reaktivity/nukleus-maven-plugin/332057229/target/jacoco.exec
[INFO] 
[INFO] --- antlr4-maven-plugin:4.7:antlr4 (default) @ nukleus-maven-plugin ---
[INFO] No grammars to process
[INFO] ANTLR 4: Processing source directory /root/workspace/reaktivity/nukleus-maven-plugin/332057229/src/main/antlr4
[INFO] 
[INFO] --- maven-resources-plugin:2.6:resources (default-resources) @ nukleus-maven-plugin ---
[INFO] Using 'UTF-8' encoding to copy filtered resources.
[INFO] Copying 1 resource
[INFO] 
[INFO] --- maven-compiler-plugin:3.6.1:compile (default-compile) @ nukleus-maven-plugin ---
[INFO] Nothing to compile - all classes are up to date
[INFO] 
[INFO] --- maven-plugin-plugin:3.5:descriptor (default-descriptor) @ nukleus-maven-plugin ---
[INFO] Using 'UTF-8' encoding to read mojo source files.
[INFO] java-javadoc mojo extractor found 0 mojo descriptor.
[INFO] java-annotations mojo extractor found 2 mojo descriptors.
[INFO] 
[INFO] --- exec-maven-plugin:1.6.0:java (default) @ nukleus-maven-plugin ---
loading: test.idl
referenced types: [test::inner::FlatParent]
referenced scopes: [test::inner]
Generating to /root/workspace/reaktivity/nukleus-maven-plugin/332057229/target/generated-test-sources/test-reaktivity
[INFO] Registering compile test source root /root/workspace/reaktivity/nukleus-maven-plugin/332057229/target/generated-test-sources/test-reaktivity
[INFO] 
[INFO] --- maven-resources-plugin:2.6:testResources (default-testResources) @ nukleus-maven-plugin ---
[INFO] Using 'UTF-8' encoding to copy filtered resources.
[INFO] Copying 8 resources
[INFO] 
[INFO] --- maven-compiler-plugin:3.6.1:testCompile (default-testCompile) @ nukleus-maven-plugin ---
[INFO] Changes detected - recompiling the module!
[INFO] Compiling 40 source files to /root/workspace/reaktivity/nukleus-maven-plugin/332057229/target/test-classes
[INFO] 
[INFO] --- build-helper-maven-plugin:3.0.0:add-test-source (default) @ nukleus-maven-plugin ---
[INFO] Test Source directory: /root/workspace/reaktivity/nukleus-maven-plugin/332057229/target/generated-test-sources/test-reaktivity added.
[INFO] 
[INFO] --- maven-surefire-plugin:2.17:test (default-test) @ nukleus-maven-plugin ---
[INFO] Surefire report directory: /root/workspace/reaktivity/nukleus-maven-plugin/332057229/target/surefire-reports
[INFO] Downloading: https://repo.maven.apache.org/maven2/org/apache/maven/surefire/surefire-junit4/2.17/surefire-junit4-2.17.pom
[INFO] Downloaded: https://repo.maven.apache.org/maven2/org/apache/maven/surefire/surefire-junit4/2.17/surefire-junit4-2.17.pom (3 KB at 5.9 KB/sec)
[INFO] Downloading: https://repo.maven.apache.org/maven2/org/apache/maven/surefire/surefire-providers/2.17/surefire-providers-2.17.pom
[INFO] Downloaded: https://repo.maven.apache.org/maven2/org/apache/maven/surefire/surefire-providers/2.17/surefire-providers-2.17.pom (3 KB at 59.5 KB/sec)
[INFO] Downloading: https://repo.maven.apache.org/maven2/org/apache/maven/surefire/surefire-junit4/2.17/surefire-junit4-2.17.jar
[INFO] Downloaded: https://repo.maven.apache.org/maven2/org/apache/maven/surefire/surefire-junit4/2.17/surefire-junit4-2.17.jar (63 KB at 506.5 KB/sec)

-------------------------------------------------------
 T E S T S
-------------------------------------------------------
Running org.reaktivity.nukleus.maven.plugin.internal.ast.parse.AstParserTest
Tests run: 35, Failures: 0, Errors: 0, Skipped: 0, Time elapsed: 1.361 sec - in org.reaktivity.nukleus.maven.plugin.internal.ast.parse.AstParserTest
Running org.reaktivity.nukleus.maven.plugin.internal.generated.Varint32FWTest
Tests run: 13, Failures: 0, Errors: 0, Skipped: 0, Time elapsed: 0.022 sec - in org.reaktivity.nukleus.maven.plugin.internal.generated.Varint32FWTest
Running org.reaktivity.nukleus.maven.plugin.internal.generated.FlatWithOctetsFWTest
Tests run: 20, Failures: 2, Errors: 1, Skipped: 0, Time elapsed: 0.118 sec <<< FAILURE! - in org.reaktivity.nukleus.maven.plugin.internal.generated.FlatWithOctetsFWTest
shouldSetAllValues(org.reaktivity.nukleus.maven.plugin.internal.generated.FlatWithOctetsFWTest)  Time elapsed: 0.025 sec  <<< FAILURE!
java.lang.AssertionError: expected:<org.reaktivity.nukleus.maven.plugin.internal.generated.FlatWithOctetsFWTest$2@43b653c8> but was:<org.reaktivity.nukleus.maven.plugin.internal.generated.FlatWithOctetsFWTest$1@43b653c8>
	at org.junit.Assert.fail(Assert.java:88)
	at org.junit.Assert.failNotEquals(Assert.java:834)
	at org.junit.Assert.assertEquals(Assert.java:118)
	at org.junit.Assert.assertEquals(Assert.java:144)
	at org.reaktivity.nukleus.maven.plugin.internal.generated.FlatWithOctetsFWTest.shouldSetAllValues(FlatWithOctetsFWTest.java:100)

shouldReadDefaultedValues(org.reaktivity.nukleus.maven.plugin.internal.generated.FlatWithOctetsFWTest)  Time elapsed: 0.002 sec  <<< FAILURE!
java.lang.AssertionError: expected null, but was:<octets[60]>
	at org.junit.Assert.fail(Assert.java:88)
	at org.junit.Assert.failNotNull(Assert.java:755)
	at org.junit.Assert.assertNull(Assert.java:737)
	at org.junit.Assert.assertNull(Assert.java:747)
	at org.reaktivity.nukleus.maven.plugin.internal.generated.FlatWithOctetsFWTest.assertRequiredValuesAndDefaults(FlatWithOctetsFWTest.java:325)
	at org.reaktivity.nukleus.maven.plugin.internal.generated.FlatWithOctetsFWTest.shouldReadDefaultedValues(FlatWithOctetsFWTest.java:88)

shouldDefaultValues(org.reaktivity.nukleus.maven.plugin.internal.generated.FlatWithOctetsFWTest)  Time elapsed: 0.031 sec  <<< ERROR!
java.lang.IndexOutOfBoundsException: limit=50 is beyond maxLimit=48
	at org.reaktivity.reaktor.internal.test.types.Flyweight.checkLimit(Flyweight.java:43)
	at org.reaktivity.reaktor.internal.test.types.OctetsFW$Builder.put(OctetsFW.java:97)
	at org.reaktivity.nukleus.maven.plugin.internal.generated.FlatWithOctetsFWTest.lambda$setRequiredValues$22(FlatWithOctetsFWTest.java:388)

Running org.reaktivity.nukleus.maven.plugin.internal.generated.IntegerVariableArraysFWTest
Tests run: 14, Failures: 0, Errors: 0, Skipped: 0, Time elapsed: 0.171 sec - in org.reaktivity.nukleus.maven.plugin.internal.generated.IntegerVariableArraysFWTest
Running org.reaktivity.nukleus.maven.plugin.internal.generated.UnionOctetsFWTest
Tests run: 9, Failures: 0, Errors: 0, Skipped: 0, Time elapsed: 0.044 sec - in org.reaktivity.nukleus.maven.plugin.internal.generated.UnionOctetsFWTest
Running org.reaktivity.nukleus.maven.plugin.internal.generated.RollFWTest
Tests run: 5, Failures: 0, Errors: 0, Skipped: 0, Time elapsed: 0.018 sec - in org.reaktivity.nukleus.maven.plugin.internal.generated.RollFWTest
Running org.reaktivity.nukleus.maven.plugin.internal.generated.Varint64FWTest
Tests run: 15, Failures: 0, Errors: 0, Skipped: 0, Time elapsed: 0.022 sec - in org.reaktivity.nukleus.maven.plugin.internal.generated.Varint64FWTest
Running org.reaktivity.nukleus.maven.plugin.internal.generated.String16FWTest
Tests run: 42, Failures: 0, Errors: 0, Skipped: 0, Time elapsed: 0.198 sec - in org.reaktivity.nukleus.maven.plugin.internal.generated.String16FWTest
Running org.reaktivity.nukleus.maven.plugin.internal.generated.NestedFWTest
Tests run: 9, Failures: 0, Errors: 0, Skipped: 0, Time elapsed: 0.035 sec - in org.reaktivity.nukleus.maven.plugin.internal.generated.NestedFWTest
Running org.reaktivity.nukleus.maven.plugin.internal.generated.FlatWithListFWTest
Tests run: 14, Failures: 0, Errors: 0, Skipped: 0, Time elapsed: 0.05 sec - in org.reaktivity.nukleus.maven.plugin.internal.generated.FlatWithListFWTest
Running org.reaktivity.nukleus.maven.plugin.internal.generated.IntegerFixedArraysFWTest
Tests run: 10, Failures: 0, Errors: 0, Skipped: 0, Time elapsed: 0.094 sec - in org.reaktivity.nukleus.maven.plugin.internal.generated.IntegerFixedArraysFWTest
Running org.reaktivity.nukleus.maven.plugin.internal.generated.IntegerFWTest
Tests run: 17, Failures: 0, Errors: 0, Skipped: 0, Time elapsed: 0.05 sec - in org.reaktivity.nukleus.maven.plugin.internal.generated.IntegerFWTest
Running org.reaktivity.nukleus.maven.plugin.internal.generated.StringFWTest
Tests run: 13, Failures: 0, Errors: 0, Skipped: 0, Time elapsed: 0.014 sec - in org.reaktivity.nukleus.maven.plugin.internal.generated.StringFWTest
Running org.reaktivity.nukleus.maven.plugin.internal.generated.ArrayFWTest
ARRAY containing 4 bytes of data
Tests run: 10, Failures: 0, Errors: 0, Skipped: 0, Time elapsed: 0.03 sec - in org.reaktivity.nukleus.maven.plugin.internal.generated.ArrayFWTest
Running org.reaktivity.nukleus.maven.plugin.internal.generated.OctetsFWTest
Tests run: 16, Failures: 0, Errors: 0, Skipped: 0, Time elapsed: 0.02 sec - in org.reaktivity.nukleus.maven.plugin.internal.generated.OctetsFWTest
Running org.reaktivity.nukleus.maven.plugin.internal.generated.PotentialNameConflitsFWTest
Tests run: 1, Failures: 0, Errors: 0, Skipped: 0, Time elapsed: 0.011 sec - in org.reaktivity.nukleus.maven.plugin.internal.generated.PotentialNameConflitsFWTest
Running org.reaktivity.nukleus.maven.plugin.internal.generated.FlatFWTest
Tests run: 23, Failures: 1, Errors: 0, Skipped: 0, Time elapsed: 0.019 sec <<< FAILURE! - in org.reaktivity.nukleus.maven.plugin.internal.generated.FlatFWTest
shouldReadDefaultedValues(org.reaktivity.nukleus.maven.plugin.internal.generated.FlatFWTest)  Time elapsed: 0.001 sec  <<< FAILURE!
java.lang.AssertionError: expected:<value1> but was:<"value1">
	at org.junit.Assert.fail(Assert.java:88)
	at org.junit.Assert.failNotEquals(Assert.java:834)
	at org.junit.Assert.assertEquals(Assert.java:118)
	at org.junit.Assert.assertEquals(Assert.java:144)
	at org.reaktivity.nukleus.maven.plugin.internal.generated.FlatFWTest.assertRequiredValuesAndDefaults(FlatFWTest.java:332)
	at org.reaktivity.nukleus.maven.plugin.internal.generated.FlatFWTest.shouldReadDefaultedValues(FlatFWTest.java:105)

Running org.reaktivity.nukleus.maven.plugin.internal.GenerateMojoTest
[debug] resource path: [file:/root/workspace/reaktivity/nukleus-maven-plugin/332057229/src/test/resources/test-project/, file:/root/workspace/reaktivity/nukleus-maven-plugin/332057229/src/test/resources/test-project/src/main/resources/META-INF/reaktivity, jar:file:/root/workspace/reaktivity/nukleus-maven-plugin/332057229/src/test/resources/test-project/target/test-classes!/META-INF/reaktivity/, jar:file:/root/workspace/reaktivity/nukleus-maven-plugin/332057229/src/test/resources/test-project/target/classes!/META-INF/reaktivity/]
[debug] loading: invalidIntArrayWithDefaultLengthNotSigned.idl
[debug] resource path: [file:/root/workspace/reaktivity/nukleus-maven-plugin/332057229/src/test/resources/test-project/, file:/root/workspace/reaktivity/nukleus-maven-plugin/332057229/src/test/resources/test-project/src/main/resources/META-INF/reaktivity, jar:file:/root/workspace/reaktivity/nukleus-maven-plugin/332057229/src/test/resources/test-project/target/test-classes!/META-INF/reaktivity/, jar:file:/root/workspace/reaktivity/nukleus-maven-plugin/332057229/src/test/resources/test-project/target/classes!/META-INF/reaktivity/]
[debug] loading: test.idl
[debug] referenced types: [test::inner::FlatParent]
[debug] referenced scopes: [test::inner]
Generating to target/generated-test-sources/test-reaktivity
[debug] resource path: [file:/root/workspace/reaktivity/nukleus-maven-plugin/332057229/src/test/resources/test-project/, file:/root/workspace/reaktivity/nukleus-maven-plugin/332057229/src/test/resources/test-project/src/main/resources/META-INF/reaktivity, jar:file:/root/workspace/reaktivity/nukleus-maven-plugin/332057229/src/test/resources/test-project/target/test-classes!/META-INF/reaktivity/, jar:file:/root/workspace/reaktivity/nukleus-maven-plugin/332057229/src/test/resources/test-project/target/classes!/META-INF/reaktivity/]
[debug] loading: invalidOctetsNotLast.idl
[debug] resource path: [file:/root/workspace/reaktivity/nukleus-maven-plugin/332057229/src/test/resources/test-project/, file:/root/workspace/reaktivity/nukleus-maven-plugin/332057229/src/test/resources/test-project/src/main/resources/META-INF/reaktivity, jar:file:/root/workspace/reaktivity/nukleus-maven-plugin/332057229/src/test/resources/test-project/target/test-classes!/META-INF/reaktivity/, jar:file:/root/workspace/reaktivity/nukleus-maven-plugin/332057229/src/test/resources/test-project/target/classes!/META-INF/reaktivity/]
[debug] loading: invalidUnrecognizedType.idl
[debug] referenced types: []
[debug] referenced scopes: []
[debug] resource path: [file:/root/workspace/reaktivity/nukleus-maven-plugin/332057229/src/test/resources/test-project/, file:/root/workspace/reaktivity/nukleus-maven-plugin/332057229/src/test/resources/test-project/src/main/resources/META-INF/reaktivity, jar:file:/root/workspace/reaktivity/nukleus-maven-plugin/332057229/src/test/resources/test-project/target/test-classes!/META-INF/reaktivity/, jar:file:/root/workspace/reaktivity/nukleus-maven-plugin/332057229/src/test/resources/test-project/target/classes!/META-INF/reaktivity/]
[debug] loading: invalidIntArrayLengthNotUnsigned.idl
[debug] resource path: [file:/root/workspace/reaktivity/nukleus-maven-plugin/332057229/src/test/resources/test-project/, file:/root/workspace/reaktivity/nukleus-maven-plugin/332057229/src/test/resources/test-project/src/main/resources/META-INF/reaktivity, jar:file:/root/workspace/reaktivity/nukleus-maven-plugin/332057229/src/test/resources/test-project/target/test-classes!/META-INF/reaktivity/, jar:file:/root/workspace/reaktivity/nukleus-maven-plugin/332057229/src/test/resources/test-project/target/classes!/META-INF/reaktivity/]
[debug] loading: invalidIntArrayLengthHasDefault.idl
Tests run: 7, Failures: 0, Errors: 0, Skipped: 1, Time elapsed: 6.219 sec - in org.reaktivity.nukleus.maven.plugin.internal.GenerateMojoTest

Results :

Failed tests: 
  FlatWithOctetsFWTest.shouldSetAllValues:100 expected:<org.reaktivity.nukleus.maven.plugin.internal.generated.FlatWithOctetsFWTest$2@43b653c8> but was:<org.reaktivity.nukleus.maven.plugin.internal.generated.FlatWithOctetsFWTest$1@43b653c8>
  FlatWithOctetsFWTest.shouldReadDefaultedValues:88->assertRequiredValuesAndDefaults:325 expected null, but was:<octets[60]>
  FlatFWTest.shouldReadDefaultedValues:105->assertRequiredValuesAndDefaults:332 expected:<value1> but was:<"value1">

Tests in error: 
  FlatWithOctetsFWTest.shouldDefaultValues:76->setRequiredValues:388->lambda$setRequiredValues$22:388 » IndexOutOfBounds

Tests run: 273, Failures: 3, Errors: 1, Skipped: 1

[INFO] ------------------------------------------------------------------------
[INFO] BUILD FAILURE
[INFO] ------------------------------------------------------------------------
[INFO] Total time: 27.537 s
[INFO] Finished at: 2018-01-23T00:36:17+01:00
[INFO] Final Memory: 38M/916M
[INFO] ------------------------------------------------------------------------
[ERROR] Failed to execute goal org.apache.maven.plugins:maven-surefire-plugin:2.17:test (default-test) on project nukleus-maven-plugin: There are test failures.
[ERROR] 
[ERROR] Please refer to /root/workspace/reaktivity/nukleus-maven-plugin/332057229/target/surefire-reports for the individual test results.
[ERROR] -> [Help 1]
[ERROR] 
[ERROR] To see the full stack trace of the errors, re-run Maven with the -e switch.
[ERROR] Re-run Maven using the -X switch to enable full debug logging.
[ERROR] 
[ERROR] For more information about the errors and possible solutions, please read the following articles:
[ERROR] [Help 1] http://cwiki.apache.org/confluence/display/MAVEN/MojoFailureException
