[INFO] Scanning for projects...
[INFO] ------------------------------------------------------------------------
[INFO] Reactor Build Order:
[INFO] 
[INFO] Yamcs
[INFO] Yamcs API
[INFO] Yamcs XTCE
[INFO] Yamcs Core
[INFO] Yamcs Artemis
[INFO] Yamcs Simulation
[INFO]                                                                         
[INFO] ------------------------------------------------------------------------
[INFO] Building Yamcs 4.4.3-SNAPSHOT
[INFO] ------------------------------------------------------------------------
[INFO]                                                                         
[INFO] ------------------------------------------------------------------------
[INFO] Building Yamcs API 4.4.3-SNAPSHOT
[INFO] ------------------------------------------------------------------------
[INFO] 
[INFO] --- maven-resources-plugin:2.6:resources (default-resources) @ yamcs-api ---
[INFO] Using 'UTF-8' encoding to copy filtered resources.
[INFO] Copying 1 resource
[INFO] 
[INFO] --- maven-compiler-plugin:2.3.2:compile (default-compile) @ yamcs-api ---
[INFO] Nothing to compile - all classes are up to date
[INFO] 
[INFO] --- maven-resources-plugin:2.6:testResources (default-testResources) @ yamcs-api ---
[INFO] Using 'UTF-8' encoding to copy filtered resources.
[INFO] skip non existing resourceDirectory /root/workspace/yamcs/yamcs/386176254/yamcs-api/src/test/resources
[INFO] 
[INFO] --- maven-compiler-plugin:2.3.2:testCompile (default-testCompile) @ yamcs-api ---
[INFO] Nothing to compile - all classes are up to date
[INFO] 
[INFO] --- maven-surefire-plugin:2.19.1:test (default-test) @ yamcs-api ---
[INFO] Downloading: https://repo.maven.apache.org/maven2/org/apache/maven/surefire/surefire-junit4/2.19.1/surefire-junit4-2.19.1.pom
[INFO] Downloaded: https://repo.maven.apache.org/maven2/org/apache/maven/surefire/surefire-junit4/2.19.1/surefire-junit4-2.19.1.pom (4 KB at 7.4 KB/sec)
[INFO] Downloading: https://repo.maven.apache.org/maven2/org/apache/maven/surefire/surefire-providers/2.19.1/surefire-providers-2.19.1.pom
[INFO] Downloaded: https://repo.maven.apache.org/maven2/org/apache/maven/surefire/surefire-providers/2.19.1/surefire-providers-2.19.1.pom (3 KB at 139.1 KB/sec)
[INFO] Downloading: https://repo.maven.apache.org/maven2/org/apache/maven/surefire/surefire-junit4/2.19.1/surefire-junit4-2.19.1.jar
[INFO] Downloaded: https://repo.maven.apache.org/maven2/org/apache/maven/surefire/surefire-junit4/2.19.1/surefire-junit4-2.19.1.jar (74 KB at 1601.1 KB/sec)

-------------------------------------------------------
 T E S T S
-------------------------------------------------------
Running org.yamcs.utils.TaiUtcConverterTest
Tests run: 2, Failures: 0, Errors: 0, Skipped: 0, Time elapsed: 0.079 sec - in org.yamcs.utils.TaiUtcConverterTest
Running org.yamcs.utils.TimeEncodingTest
Tests run: 17, Failures: 0, Errors: 0, Skipped: 0, Time elapsed: 0 sec - in org.yamcs.utils.TimeEncodingTest
Running org.yamcs.api.AbstractEventProducerTest
Tests run: 5, Failures: 0, Errors: 0, Skipped: 0, Time elapsed: 0.057 sec - in org.yamcs.api.AbstractEventProducerTest
Running org.yamcs.api.CcsdsPacketTest
Tests run: 2, Failures: 0, Errors: 0, Skipped: 0, Time elapsed: 0.008 sec - in org.yamcs.api.CcsdsPacketTest

Results :

Tests run: 26, Failures: 0, Errors: 0, Skipped: 0

[INFO]                                                                         
[INFO] ------------------------------------------------------------------------
[INFO] Building Yamcs XTCE 4.4.3-SNAPSHOT
[INFO] ------------------------------------------------------------------------
[INFO] 
[INFO] --- maven-resources-plugin:2.6:resources (default-resources) @ yamcs-xtce ---
[INFO] Using 'UTF-8' encoding to copy filtered resources.
[INFO] Copying 1 resource
[INFO] 
[INFO] --- maven-compiler-plugin:2.3.2:compile (default-compile) @ yamcs-xtce ---
[INFO] Nothing to compile - all classes are up to date
[INFO] 
[INFO] --- maven-resources-plugin:2.6:testResources (default-testResources) @ yamcs-xtce ---
[INFO] Using 'UTF-8' encoding to copy filtered resources.
[INFO] Copying 1 resource
[INFO] 
[INFO] --- maven-compiler-plugin:2.3.2:testCompile (default-testCompile) @ yamcs-xtce ---
[INFO] Nothing to compile - all classes are up to date
[INFO] 
[INFO] --- maven-surefire-plugin:2.19.1:test (default-test) @ yamcs-xtce ---

-------------------------------------------------------
 T E S T S
-------------------------------------------------------
Running org.yamcs.xtce.HistoryTest
Tests run: 2, Failures: 0, Errors: 0, Skipped: 0, Time elapsed: 0.052 sec - in org.yamcs.xtce.HistoryTest
Running org.yamcs.xtce.TestParameterTypeConstructors
Tests run: 1, Failures: 0, Errors: 0, Skipped: 0, Time elapsed: 0.196 sec - in org.yamcs.xtce.TestParameterTypeConstructors

Results :

Tests run: 3, Failures: 0, Errors: 0, Skipped: 0

[INFO]                                                                         
[INFO] ------------------------------------------------------------------------
[INFO] Building Yamcs Core 4.4.3-SNAPSHOT
[INFO] ------------------------------------------------------------------------
[INFO] 
[INFO] --- build-helper-maven-plugin:3.0.0:add-source (add-source) @ yamcs-core ---
[INFO] Source directory: /root/workspace/yamcs/yamcs/386176254/yamcs-core/target/generated-sources/version added.
[INFO] 
[INFO] --- maven-antrun-plugin:1.3:run (generate-version) @ yamcs-core ---
[INFO] Executing tasks
[INFO] Executed tasks
[INFO] 
[INFO] --- maven-resources-plugin:2.6:resources (default-resources) @ yamcs-core ---
[INFO] Using 'UTF-8' encoding to copy filtered resources.
[INFO] Copying 37 resources
[INFO] 
[INFO] --- maven-compiler-plugin:2.3.2:compile (default-compile) @ yamcs-core ---
[INFO] Compiling 1 source file to /root/workspace/yamcs/yamcs/386176254/yamcs-core/target/classes
[INFO] 
[INFO] --- maven-resources-plugin:2.6:testResources (default-testResources) @ yamcs-core ---
[INFO] Using 'UTF-8' encoding to copy filtered resources.
[INFO] Copying 43 resources
[INFO] Copying 14 resources
[INFO] 
[INFO] --- maven-compiler-plugin:2.3.2:testCompile (default-testCompile) @ yamcs-core ---
[INFO] Nothing to compile - all classes are up to date
[INFO] 
[INFO] --- maven-surefire-plugin:2.19.1:test (default-test) @ yamcs-core ---

-------------------------------------------------------
 T E S T S
-------------------------------------------------------
Running org.yamcs.parameterarchive.DoubleValueSegmentTest
Tests run: 1, Failures: 0, Errors: 0, Skipped: 0, Time elapsed: 0.063 sec - in org.yamcs.parameterarchive.DoubleValueSegmentTest
Running org.yamcs.parameterarchive.ParameterGroupIdMapTest
Tests run: 1, Failures: 0, Errors: 0, Skipped: 0, Time elapsed: 0.386 sec - in org.yamcs.parameterarchive.ParameterGroupIdMapTest
Running org.yamcs.parameterarchive.TestStructure
Tests run: 2, Failures: 0, Errors: 0, Skipped: 2, Time elapsed: 0.056 sec - in org.yamcs.parameterarchive.TestStructure
Running org.yamcs.parameterarchive.TestCompression
Tests run: 1, Failures: 0, Errors: 0, Skipped: 1, Time elapsed: 0.05 sec - in org.yamcs.parameterarchive.TestCompression
Running org.yamcs.parameterarchive.FloatValueSegmentTest
Tests run: 2, Failures: 0, Errors: 0, Skipped: 0, Time elapsed: 0.065 sec - in org.yamcs.parameterarchive.FloatValueSegmentTest
Running org.yamcs.parameterarchive.TimeSegmentTest
Tests run: 1, Failures: 0, Errors: 0, Skipped: 0, Time elapsed: 0.059 sec - in org.yamcs.parameterarchive.TimeSegmentTest
Running org.yamcs.parameterarchive.BooleanValueSegmentTest
Tests run: 1, Failures: 0, Errors: 0, Skipped: 0, Time elapsed: 0.06 sec - in org.yamcs.parameterarchive.BooleanValueSegmentTest
Running org.yamcs.parameterarchive.ParameterStatusTest
Tests run: 1, Failures: 0, Errors: 0, Skipped: 0, Time elapsed: 0.089 sec - in org.yamcs.parameterarchive.ParameterStatusTest
Running org.yamcs.parameterarchive.ObjectSegmentTest
Tests run: 4, Failures: 0, Errors: 0, Skipped: 0, Time elapsed: 0.131 sec - in org.yamcs.parameterarchive.ObjectSegmentTest
Running org.yamcs.parameterarchive.ParameterArchiveTest
Tests run: 18, Failures: 0, Errors: 0, Skipped: 0, Time elapsed: 1.084 sec - in org.yamcs.parameterarchive.ParameterArchiveTest
Running org.yamcs.parameterarchive.IntValueSegmentTest
Tests run: 3, Failures: 0, Errors: 0, Skipped: 0, Time elapsed: 0.075 sec - in org.yamcs.parameterarchive.IntValueSegmentTest
Running org.yamcs.parameterarchive.ParameterIdMapTest
Tests run: 1, Failures: 0, Errors: 0, Skipped: 0, Time elapsed: 0.376 sec - in org.yamcs.parameterarchive.ParameterIdMapTest
Running org.yamcs.parameterarchive.LongValueSegmentTest
Tests run: 3, Failures: 0, Errors: 0, Skipped: 0, Time elapsed: 0.066 sec - in org.yamcs.parameterarchive.LongValueSegmentTest
Running org.yamcs.parameterarchive.StringValueSegmentTest
Tests run: 1, Failures: 0, Errors: 0, Skipped: 0, Time elapsed: 0.075 sec - in org.yamcs.parameterarchive.StringValueSegmentTest
Running org.yamcs.parameter.SubsriptionArrayTest
Tests run: 1, Failures: 0, Errors: 0, Skipped: 0, Time elapsed: 0.054 sec - in org.yamcs.parameter.SubsriptionArrayTest
Running org.yamcs.parameter.ValueTest
Tests run: 1, Failures: 0, Errors: 0, Skipped: 1, Time elapsed: 0.056 sec - in org.yamcs.parameter.ValueTest
Running org.yamcs.parameter.ParameterValueListTest
Tests run: 5, Failures: 0, Errors: 0, Skipped: 0, Time elapsed: 0.145 sec - in org.yamcs.parameter.ParameterValueListTest
Running org.yamcs.parameter.ValueArrayTest
Tests run: 1, Failures: 0, Errors: 0, Skipped: 0, Time elapsed: 0.055 sec - in org.yamcs.parameter.ValueArrayTest
Running org.yamcs.parameter.SoftwareParameterManagerTest
Tests run: 1, Failures: 0, Errors: 0, Skipped: 0, Time elapsed: 4.474 sec - in org.yamcs.parameter.SoftwareParameterManagerTest
Running org.yamcs.parameter.ArrayParameterCacheTest
Tests run: 5, Failures: 0, Errors: 0, Skipped: 0, Time elapsed: 0.117 sec - in org.yamcs.parameter.ArrayParameterCacheTest
Running org.yamcs.parameter.ParameterCacheImplTest
Tests run: 6, Failures: 0, Errors: 0, Skipped: 1, Time elapsed: 0.158 sec - in org.yamcs.parameter.ParameterCacheImplTest
Running org.yamcs.yarch.rocksdb.HistogramRebuilderTest
Tests run: 2, Failures: 0, Errors: 0, Skipped: 0, Time elapsed: 0.542 sec - in org.yamcs.yarch.rocksdb.HistogramRebuilderTest
Running org.yamcs.yarch.rocksdb.RdbEngineTest
Tests run: 2, Failures: 0, Errors: 0, Skipped: 0, Time elapsed: 0.525 sec - in org.yamcs.yarch.rocksdb.RdbEngineTest
Running org.yamcs.yarch.rocksdb.RDBFactoryTest
Tests run: 2, Failures: 0, Errors: 0, Skipped: 0, Time elapsed: 2.246 sec - in org.yamcs.yarch.rocksdb.RDBFactoryTest
Running org.yamcs.yarch.rocksdb.PartitioningTest
Tests run: 3, Failures: 0, Errors: 0, Skipped: 0, Time elapsed: 0.715 sec - in org.yamcs.yarch.rocksdb.PartitioningTest
Running org.yamcs.yarch.rocksdb.RdbSelectPerfTest
Tests run: 1, Failures: 0, Errors: 0, Skipped: 1, Time elapsed: 0.014 sec - in org.yamcs.yarch.rocksdb.RdbSelectPerfTest
Running org.yamcs.yarch.rocksdb.TablespaceTest
Tests run: 2, Failures: 0, Errors: 0, Skipped: 0, Time elapsed: 0.384 sec - in org.yamcs.yarch.rocksdb.TablespaceTest
Running org.yamcs.yarch.rocksdb.RdbPartitionManagerTest
Tests run: 1, Failures: 0, Errors: 0, Skipped: 0, Time elapsed: 0.557 sec - in org.yamcs.yarch.rocksdb.RdbPartitionManagerTest
Running org.yamcs.yarch.rocksdb.BucketDbTest
Tests run: 4, Failures: 0, Errors: 0, Skipped: 0, Time elapsed: 1.041 sec - in org.yamcs.yarch.rocksdb.BucketDbTest
Running org.yamcs.yarch.rocksdb.TagsTest
Tests run: 1, Failures: 0, Errors: 0, Skipped: 0, Time elapsed: 0.458 sec - in org.yamcs.yarch.rocksdb.TagsTest
Running org.yamcs.yarch.rocksdb.TablespaceSerializationTest
Tests run: 1, Failures: 0, Errors: 0, Skipped: 0, Time elapsed: 0.14 sec - in org.yamcs.yarch.rocksdb.TablespaceSerializationTest
Running org.yamcs.yarch.rocksdb.RdbSelectTest
Tests run: 7, Failures: 0, Errors: 0, Skipped: 0, Time elapsed: 0.669 sec - in org.yamcs.yarch.rocksdb.RdbSelectTest
Running org.yamcs.yarch.TableDefinitionSerializationTest
Tests run: 4, Failures: 0, Errors: 0, Skipped: 0, Time elapsed: 0.638 sec - in org.yamcs.yarch.TableDefinitionSerializationTest
Running org.yamcs.yarch.WriterTest
Tests run: 6, Failures: 0, Errors: 0, Skipped: 0, Time elapsed: 0.695 sec - in org.yamcs.yarch.WriterTest
Running org.yamcs.yarch.HistogramStreamTest
Tests run: 15, Failures: 0, Errors: 0, Skipped: 3, Time elapsed: 3.718 sec - in org.yamcs.yarch.HistogramStreamTest
Running org.yamcs.yarch.StreamSelectPerfTest
Tests run: 1, Failures: 0, Errors: 0, Skipped: 0, Time elapsed: 1.679 sec - in org.yamcs.yarch.StreamSelectPerfTest
Running org.yamcs.yarch.StreamMergeTest
Tests run: 4, Failures: 0, Errors: 0, Skipped: 0, Time elapsed: 1.05 sec - in org.yamcs.yarch.StreamMergeTest
Running org.yamcs.yarch.oldrocksdb.RDBFactoryTest
Tests run: 2, Failures: 0, Errors: 0, Skipped: 0, Time elapsed: 2.069 sec - in org.yamcs.yarch.oldrocksdb.RDBFactoryTest
Running org.yamcs.yarch.oldrocksdb.PartitionManagerTest
Tests run: 5, Failures: 0, Errors: 0, Skipped: 0, Time elapsed: 0.545 sec - in org.yamcs.yarch.oldrocksdb.PartitionManagerTest
Running org.yamcs.yarch.oldrocksdb.TagsTest
Tests run: 1, Failures: 0, Errors: 0, Skipped: 0, Time elapsed: 0.503 sec - in org.yamcs.yarch.oldrocksdb.TagsTest
Running org.yamcs.yarch.oldrocksdb.PartitioningTest
Tests run: 6, Failures: 0, Errors: 0, Skipped: 0, Time elapsed: 0.944 sec - in org.yamcs.yarch.oldrocksdb.PartitioningTest
Running org.yamcs.yarch.oldrocksdb.HistogramRebuilderTest
Tests run: 3, Failures: 0, Errors: 0, Skipped: 0, Time elapsed: 0.532 sec - in org.yamcs.yarch.oldrocksdb.HistogramRebuilderTest
Running org.yamcs.yarch.oldrocksdb.RdbEngineTest
Tests run: 1, Failures: 0, Errors: 0, Skipped: 0, Time elapsed: 0.442 sec - in org.yamcs.yarch.oldrocksdb.RdbEngineTest
Running org.yamcs.yarch.oldrocksdb.RdbSelectPerfTest
Tests run: 1, Failures: 0, Errors: 0, Skipped: 1, Time elapsed: 0.014 sec - in org.yamcs.yarch.oldrocksdb.RdbSelectPerfTest
Running org.yamcs.yarch.oldrocksdb.RdbSelectTest
Tests run: 14, Failures: 0, Errors: 0, Skipped: 0, Time elapsed: 0.914 sec - in org.yamcs.yarch.oldrocksdb.RdbSelectTest
Running org.yamcs.yarch.StreamSelectProtobufTest
Tests run: 5, Failures: 0, Errors: 0, Skipped: 0, Time elapsed: 0.619 sec - in org.yamcs.yarch.StreamSelectProtobufTest
Running org.yamcs.yarch.StreamSelect1Test
Tests run: 2, Failures: 0, Errors: 0, Skipped: 0, Time elapsed: 0.565 sec - in org.yamcs.yarch.StreamSelect1Test
Running org.yamcs.yarch.StreamSqlParserTest
Tests run: 3, Failures: 0, Errors: 0, Skipped: 0, Time elapsed: 0.455 sec - in org.yamcs.yarch.StreamSqlParserTest
Running org.yamcs.yarch.DynamicSchemaTableTest
Tests run: 4, Failures: 0, Errors: 0, Skipped: 0, Time elapsed: 0.6 sec - in org.yamcs.yarch.DynamicSchemaTableTest
Running org.yamcs.yarch.StreamSelectTest
Tests run: 3, Failures: 0, Errors: 0, Skipped: 0, Time elapsed: 0.55 sec - in org.yamcs.yarch.StreamSelectTest
Running org.yamcs.yarch.StandaloneStreamTest
Tests run: 1, Failures: 0, Errors: 0, Skipped: 0, Time elapsed: 0.356 sec - in org.yamcs.yarch.StandaloneStreamTest
Running org.yamcs.yarch.ConcurrencyTest
Tests run: 3, Failures: 0, Errors: 0, Skipped: 0, Time elapsed: 42.998 sec - in org.yamcs.yarch.ConcurrencyTest
Running org.yamcs.yarch.EnumWithPartitionTest
Tests run: 12, Failures: 0, Errors: 0, Skipped: 0, Time elapsed: 1.124 sec - in org.yamcs.yarch.EnumWithPartitionTest
Running org.yamcs.yarch.EnumTest
Tests run: 9, Failures: 0, Errors: 0, Skipped: 0, Time elapsed: 0.96 sec - in org.yamcs.yarch.EnumTest
Running org.yamcs.yarch.StarSelectTest
Tests run: 1, Failures: 0, Errors: 0, Skipped: 0, Time elapsed: 0.362 sec - in org.yamcs.yarch.StarSelectTest
Running org.yamcs.yarch.HistogramSegmentTest
Tests run: 10, Failures: 0, Errors: 0, Skipped: 0, Time elapsed: 0.138 sec - in org.yamcs.yarch.HistogramSegmentTest
Running org.yamcs.yarch.StreamSelect2Test
Tests run: 8, Failures: 0, Errors: 0, Skipped: 0, Time elapsed: 3.566 sec - in org.yamcs.yarch.StreamSelect2Test
Running org.yamcs.tctm.CrcCciitCalculatorTest
Tests run: 1, Failures: 0, Errors: 0, Skipped: 0, Time elapsed: 0.071 sec - in org.yamcs.tctm.CrcCciitCalculatorTest
Running org.yamcs.tctm.TcpTcUplinkerTest
Tests run: 1, Failures: 0, Errors: 0, Skipped: 0, Time elapsed: 0.156 sec - in org.yamcs.tctm.TcpTcUplinkerTest
Running org.yamcs.tctm.TmFileReaderTest
Tests run: 2, Failures: 0, Errors: 0, Skipped: 0, Time elapsed: 0.39 sec - in org.yamcs.tctm.TmFileReaderTest
Running org.yamcs.tctm.TcpTcDataLinkTest
Tests run: 2, Failures: 0, Errors: 0, Skipped: 0, Time elapsed: 9.738 sec - in org.yamcs.tctm.TcpTcDataLinkTest
Running org.yamcs.archive.CcsdsTmIndexTest
Tests run: 3, Failures: 0, Errors: 0, Skipped: 1, Time elapsed: 0.389 sec - in org.yamcs.archive.CcsdsTmIndexTest
Running org.yamcs.archive.CmdHistoryRecordingTest
Tests run: 1, Failures: 0, Errors: 0, Skipped: 0, Time elapsed: 0.582 sec - in org.yamcs.archive.CmdHistoryRecordingTest
Running org.yamcs.web.rest.archive.RestDownsamplerTest
Tests run: 1, Failures: 0, Errors: 0, Skipped: 0, Time elapsed: 0.064 sec - in org.yamcs.web.rest.archive.RestDownsamplerTest
Running org.yamcs.web.rest.mdb.NameDescriptionSearchMatcherTest
Tests run: 1, Failures: 0, Errors: 0, Skipped: 0, Time elapsed: 0.395 sec - in org.yamcs.web.rest.mdb.NameDescriptionSearchMatcherTest
Running org.yamcs.web.rest.mdb.XtceToGpbAssemblerTest
Tests run: 3, Failures: 0, Errors: 0, Skipped: 0, Time elapsed: 0.562 sec - in org.yamcs.web.rest.mdb.XtceToGpbAssemblerTest
Running org.yamcs.web.rest.RestRequestTest
Tests run: 5, Failures: 0, Errors: 0, Skipped: 0, Time elapsed: 0.158 sec - in org.yamcs.web.rest.RestRequestTest
Running org.yamcs.web.rest.RouterTest
Tests run: 10, Failures: 0, Errors: 0, Skipped: 0, Time elapsed: 0.392 sec - in org.yamcs.web.rest.RouterTest
Running org.yamcs.utils.VarIntUtilTest
Tests run: 3, Failures: 0, Errors: 0, Skipped: 0, Time elapsed: 0.058 sec - in org.yamcs.utils.VarIntUtilTest
Running org.yamcs.utils.SortedIntArrayTest
s2 encoded: [-1, 5, 20]
Tests run: 10, Failures: 0, Errors: 0, Skipped: 1, Time elapsed: 0.064 sec - in org.yamcs.utils.SortedIntArrayTest
Running org.yamcs.utils.BitBufferTest
Tests run: 12, Failures: 0, Errors: 0, Skipped: 0, Time elapsed: 0.06 sec - in org.yamcs.utils.BitBufferTest
Running org.yamcs.utils.TimeIntervalTest
Tests run: 1, Failures: 0, Errors: 0, Skipped: 0, Time elapsed: 0.07 sec - in org.yamcs.utils.TimeIntervalTest
Running org.yamcs.utils.ParititionedTimeTest
Tests run: 4, Failures: 0, Errors: 0, Skipped: 0, Time elapsed: 0.055 sec - in org.yamcs.utils.ParititionedTimeTest
Running org.yamcs.utils.TimeEncodingTest
max = 185539080470436999
5881469-05-27T23:59:59.999Z
Tests run: 2, Failures: 0, Errors: 0, Skipped: 0, Time elapsed: 0.1 sec - in org.yamcs.utils.TimeEncodingTest
Running org.yamcs.utils.BooleanArrayTest
Tests run: 2, Failures: 0, Errors: 0, Skipped: 0, Time elapsed: 0.058 sec - in org.yamcs.utils.BooleanArrayTest
Running org.yamcs.utils.ByteArrayUtilsTest
Tests run: 2, Failures: 0, Errors: 0, Skipped: 0, Time elapsed: 0.055 sec - in org.yamcs.utils.ByteArrayUtilsTest
Running org.yamcs.ArchiveIntegrationTest
Tests run: 8, Failures: 0, Errors: 0, Skipped: 0, Time elapsed: 11.945 sec - in org.yamcs.ArchiveIntegrationTest
Running org.yamcs.xtceproc.JavaExpressionCalibratorFactoryTest
Tests run: 3, Failures: 0, Errors: 0, Skipped: 0, Time elapsed: 0.256 sec - in org.yamcs.xtceproc.JavaExpressionCalibratorFactoryTest
Running org.yamcs.xtceproc.CcsdsGreenBookCommandEncodingTest
Tests run: 1, Failures: 0, Errors: 0, Skipped: 0, Time elapsed: 0.419 sec - in org.yamcs.xtceproc.CcsdsGreenBookCommandEncodingTest
Running org.yamcs.xtceproc.XtceCommandEncodingTest
Tests run: 23, Failures: 0, Errors: 0, Skipped: 0, Time elapsed: 0.721 sec - in org.yamcs.xtceproc.XtceCommandEncodingTest
Running org.yamcs.xtceproc.XtceTmExtractorTest
Tests run: 26, Failures: 0, Errors: 0, Skipped: 0, Time elapsed: 0.649 sec - in org.yamcs.xtceproc.XtceTmExtractorTest
Running org.yamcs.xtceproc.XtceDbFactoryTest
Tests run: 3, Failures: 0, Errors: 0, Skipped: 0, Time elapsed: 0.493 sec - in org.yamcs.xtceproc.XtceDbFactoryTest
Running org.yamcs.xtceproc.CcsdsGreenBookTmTest
Tests run: 3, Failures: 0, Errors: 0, Skipped: 0, Time elapsed: 0.427 sec - in org.yamcs.xtceproc.CcsdsGreenBookTmTest
Running org.yamcs.ParameterArchiveIntegrationTest
Tests run: 2, Failures: 0, Errors: 0, Skipped: 0, Time elapsed: 14.325 sec - in org.yamcs.ParameterArchiveIntegrationTest
Running org.yamcs.algorithms.XtceAlgorithmTest
Tests run: 2, Failures: 0, Errors: 0, Skipped: 0, Time elapsed: 1.478 sec - in org.yamcs.algorithms.XtceAlgorithmTest
Running org.yamcs.algorithms.AlgorithmWithContextTest
Tests run: 1, Failures: 0, Errors: 0, Skipped: 0, Time elapsed: 1.017 sec - in org.yamcs.algorithms.AlgorithmWithContextTest
Running org.yamcs.algorithms.WindowBufferTest
Tests run: 1, Failures: 0, Errors: 0, Skipped: 0, Time elapsed: 0.059 sec - in org.yamcs.algorithms.WindowBufferTest
Running org.yamcs.algorithms.AlgorithmManagerTest
Tests run: 14, Failures: 0, Errors: 0, Skipped: 1, Time elapsed: 11.552 sec - in org.yamcs.algorithms.AlgorithmManagerTest
Running org.yamcs.algorithms.AlgorithmManagerPyTest
Tests run: 3, Failures: 0, Errors: 0, Skipped: 0, Time elapsed: 4.341 sec - in org.yamcs.algorithms.AlgorithmManagerPyTest
Running org.yamcs.algorithms.AlgorithmManagerJavaTest
Tests run: 3, Failures: 0, Errors: 0, Skipped: 0, Time elapsed: 0.912 sec - in org.yamcs.algorithms.AlgorithmManagerJavaTest
Running org.yamcs.security.JWTTest
Tests run: 2, Failures: 0, Errors: 0, Skipped: 0, Time elapsed: 0.124 sec - in org.yamcs.security.JWTTest
Running org.yamcs.security.PasswordHashTest
Running tests...
Tests run: 1, Failures: 0, Errors: 0, Skipped: 0, Time elapsed: 1.408 sec - in org.yamcs.security.PasswordHashTest
Running org.yamcs.ComVerifIntegrationTest
alg_verif_started:
  receivedCmdId: 25
  sentCmdId: 25
  receivedSeqNum: 5000
  sentSeqNum: 5000
  stage: 0
  result: 0
yep, this is our command
alg_verif_completed:
  receivedCmdId: 25
  sentCmdId: 25
  receivedSeqNum: 5000
  sentSeqNum: 5000
  stage: 1
  result: 5
yep, this is our command
Tests run: 2, Failures: 0, Errors: 0, Skipped: 0, Time elapsed: 5.007 sec - in org.yamcs.ComVerifIntegrationTest
Running org.yamcs.LongWebsocketFrameTest
Tests run: 2, Failures: 0, Errors: 0, Skipped: 0, Time elapsed: 9.425 sec - in org.yamcs.LongWebsocketFrameTest
Running org.yamcs.RestClientTest
Tests run: 3, Failures: 0, Errors: 0, Skipped: 0, Time elapsed: 4.582 sec - in org.yamcs.RestClientTest
Running org.yamcs.cli.YamcsCliTest
Tests run: 1, Failures: 0, Errors: 0, Skipped: 0, Time elapsed: 4.542 sec - in org.yamcs.cli.YamcsCliTest
Running org.yamcs.AlarmTest
Tests run: 5, Failures: 0, Errors: 0, Skipped: 0, Time elapsed: 0.52 sec - in org.yamcs.AlarmTest
Running org.yamcs.ui.eventviewer.UtilsTest
Tests run: 3, Failures: 0, Errors: 0, Skipped: 0, Time elapsed: 0.058 sec - in org.yamcs.ui.eventviewer.UtilsTest
Running org.yamcs.alarms.AlarmServerTest
Tests run: 6, Failures: 0, Errors: 0, Skipped: 0, Time elapsed: 0.142 sec - in org.yamcs.alarms.AlarmServerTest
Running org.yamcs.PermissionsTest
Tests run: 6, Failures: 1, Errors: 0, Skipped: 0, Time elapsed: 7.192 sec <<< FAILURE! - in org.yamcs.PermissionsTest
testAuthenticationWebServices(org.yamcs.PermissionsTest)  Time elapsed: 0.047 sec  <<< FAILURE!
java.lang.AssertionError: should have thrown an exception
	at org.yamcs.PermissionsTest.testAuthenticationWebServices(PermissionsTest.java:39)

Running org.yamcs.EventCrashHandlerTest
Tests run: 1, Failures: 0, Errors: 0, Skipped: 0, Time elapsed: 0.123 sec - in org.yamcs.EventCrashHandlerTest
Running org.yamcs.ContainerRequestManagerTest
Tests run: 1, Failures: 0, Errors: 0, Skipped: 0, Time elapsed: 0.482 sec - in org.yamcs.ContainerRequestManagerTest
Running org.yamcs.xtce.XmlLoaderTest
Tests run: 3, Failures: 0, Errors: 0, Skipped: 0, Time elapsed: 1.208 sec - in org.yamcs.xtce.XmlLoaderTest
Running org.yamcs.xtce.SpreadsheetLoaderTest
Tests run: 8, Failures: 0, Errors: 0, Skipped: 0, Time elapsed: 0.701 sec - in org.yamcs.xtce.SpreadsheetLoaderTest
Running org.yamcs.xtce.TestCloning
Tests run: 1, Failures: 0, Errors: 0, Skipped: 0, Time elapsed: 2.389 sec - in org.yamcs.xtce.TestCloning
Running org.yamcs.IntegrationTest
Tests run: 19, Failures: 0, Errors: 0, Skipped: 1, Time elapsed: 19.839 sec - in org.yamcs.IntegrationTest
Running org.yamcs.AuthModuleTest
Tests run: 1, Failures: 0, Errors: 1, Skipped: 0, Time elapsed: 4.239 sec <<< FAILURE! - in org.yamcs.AuthModuleTest
test1(org.yamcs.AuthModuleTest)  Time elapsed: 0.207 sec  <<< ERROR!
java.util.concurrent.ExecutionException: 
org.yamcs.api.YamcsApiException: 401 Unauthorized: Missing 'Authorization' or 'Cookie' header

	at org.yamcs.AuthModuleTest.test1(AuthModuleTest.java:37)
Caused by: org.yamcs.api.YamcsApiException: 
401 Unauthorized: Missing 'Authorization' or 'Cookie' header


Running org.yamcs.management.ProcessorsTest
connecting to yamcs
connecting to yamcs
log: Exception creating processor: createProcessor invoked with a list full of invalid client ids
Tests run: 2, Failures: 0, Errors: 0, Skipped: 0, Time elapsed: 7.468 sec - in org.yamcs.management.ProcessorsTest
Running org.yamcs.api.rest.HttpClientTest
Tests run: 2, Failures: 0, Errors: 0, Skipped: 0, Time elapsed: 4.594 sec - in org.yamcs.api.rest.HttpClientTest

Results :

Failed tests: 
  PermissionsTest.testAuthenticationWebServices:39 should have thrown an exception
Tests in error: 
  AuthModuleTest.test1:37 » Execution org.yamcs.api.YamcsApiException: 401 Unaut...

Tests run: 438, Failures: 1, Errors: 1, Skipped: 14

[INFO] ------------------------------------------------------------------------
[INFO] Reactor Summary:
[INFO] 
[INFO] Yamcs .............................................. SUCCESS [  0.045 s]
[INFO] Yamcs API .......................................... SUCCESS [  2.164 s]
[INFO] Yamcs XTCE ......................................... SUCCESS [  0.869 s]
[INFO] Yamcs Core ......................................... FAILURE [04:41 min]
[INFO] Yamcs Artemis ...................................... SKIPPED
[INFO] Yamcs Simulation ................................... SKIPPED
[INFO] ------------------------------------------------------------------------
[INFO] BUILD FAILURE
[INFO] ------------------------------------------------------------------------
[INFO] Total time: 04:45 min
[INFO] Finished at: 2018-05-31T15:35:09+02:00
[INFO] Final Memory: 21M/756M
[INFO] ------------------------------------------------------------------------
[ERROR] Failed to execute goal org.apache.maven.plugins:maven-surefire-plugin:2.19.1:test (default-test) on project yamcs-core: There are test failures.
[ERROR] 
[ERROR] Please refer to /root/workspace/yamcs/yamcs/386176254/yamcs-core/target/surefire-reports for the individual test results.
[ERROR] -> [Help 1]
[ERROR] 
[ERROR] To see the full stack trace of the errors, re-run Maven with the -e switch.
[ERROR] Re-run Maven using the -X switch to enable full debug logging.
[ERROR] 
[ERROR] For more information about the errors and possible solutions, please read the following articles:
[ERROR] [Help 1] http://cwiki.apache.org/confluence/display/MAVEN/MojoFailureException
[ERROR] 
[ERROR] After correcting the problems, you can resume the build with the command
[ERROR]   mvn <goals> -rf :yamcs-core
