[INFO] Scanning for projects...
[WARNING] 
[WARNING] Some problems were encountered while building the effective model for com.microsoft.azure:azure-storage-blob:jar:10.0.3-Preview
[WARNING] 'build.plugins.plugin.version' for org.codehaus.mojo:build-helper-maven-plugin is missing. @ line 162, column 21
[WARNING] 
[WARNING] It is highly recommended to fix these problems because they threaten the stability of your build.
[WARNING] 
[WARNING] For this reason, future Maven versions might no longer support building such malformed projects.
[WARNING] 
[INFO]                                                                         
[INFO] ------------------------------------------------------------------------
[INFO] Building Azure Storage Blob 10.0.3-Preview
[INFO] ------------------------------------------------------------------------
[INFO] 
[INFO] --- maven-resources-plugin:2.6:resources (default-resources) @ azure-storage-blob ---
[INFO] Using 'UTF-8' encoding to copy filtered resources.
[INFO] skip non existing resourceDirectory /root/workspace/rickle-msft/azure-storage-java/414217563/src/main/resources
[INFO] 
[INFO] --- maven-compiler-plugin:3.1:compile (default-compile) @ azure-storage-blob ---
[INFO] Changes detected - recompiling the module!
[INFO] Using Groovy-Eclipse compiler to compile both Java and Groovy files
[INFO] 
[INFO] --- maven-resources-plugin:2.6:testResources (default-testResources) @ azure-storage-blob ---
[INFO] Using 'UTF-8' encoding to copy filtered resources.
[INFO] Copying 1 resource
[INFO] 
[INFO] --- maven-compiler-plugin:3.1:testCompile (default-testCompile) @ azure-storage-blob ---
[INFO] Changes detected - recompiling the module!
[INFO] Using Groovy-Eclipse compiler to compile both Java and Groovy files
[INFO] 
[INFO] --- maven-surefire-plugin:2.20.1:test (default-test) @ azure-storage-blob ---
[INFO] Downloading: https://dl.bintray.com/groovy/maven/org/apache/maven/surefire/surefire-junit4/2.20.1/surefire-junit4-2.20.1.pom
[INFO] Downloading: https://repo.maven.apache.org/maven2/org/apache/maven/surefire/surefire-junit4/2.20.1/surefire-junit4-2.20.1.pom
[INFO] Downloaded: https://repo.maven.apache.org/maven2/org/apache/maven/surefire/surefire-junit4/2.20.1/surefire-junit4-2.20.1.pom (4 KB at 16.1 KB/sec)
[INFO] Downloading: https://dl.bintray.com/groovy/maven/org/apache/maven/surefire/surefire-providers/2.20.1/surefire-providers-2.20.1.pom
[INFO] Downloading: https://repo.maven.apache.org/maven2/org/apache/maven/surefire/surefire-providers/2.20.1/surefire-providers-2.20.1.pom
[INFO] Downloaded: https://repo.maven.apache.org/maven2/org/apache/maven/surefire/surefire-providers/2.20.1/surefire-providers-2.20.1.pom (3 KB at 47.0 KB/sec)
[INFO] Downloading: https://dl.bintray.com/groovy/maven/org/apache/maven/surefire/surefire-junit4/2.20.1/surefire-junit4-2.20.1.jar
[INFO] Downloading: https://repo.maven.apache.org/maven2/org/apache/maven/surefire/surefire-junit4/2.20.1/surefire-junit4-2.20.1.jar
[INFO] Downloaded: https://repo.maven.apache.org/maven2/org/apache/maven/surefire/surefire-junit4/2.20.1/surefire-junit4-2.20.1.jar (81 KB at 664.0 KB/sec)
[INFO] 
[INFO] -------------------------------------------------------
[INFO]  T E S T S
[INFO] -------------------------------------------------------
[INFO] Running com.microsoft.azure.storage.HelperTest
[ERROR] Tests run: 1, Failures: 0, Errors: 1, Skipped: 0, Time elapsed: 1.662 s <<< FAILURE! - in com.microsoft.azure.storage.HelperTest
[ERROR] com.microsoft.azure.storage.HelperTest  Time elapsed: 1.657 s  <<< ERROR!
org.spockframework.util.InternalSpockError: Failed to instantiate spec 'HelperTest'
	at org.apache.maven.surefire.junit4.JUnit4Provider.execute(JUnit4Provider.java:369)
	at org.apache.maven.surefire.junit4.JUnit4Provider.executeWithRerun(JUnit4Provider.java:275)
	at org.apache.maven.surefire.junit4.JUnit4Provider.executeTestSet(JUnit4Provider.java:239)
	at org.apache.maven.surefire.junit4.JUnit4Provider.invoke(JUnit4Provider.java:160)
Caused by: java.lang.ExceptionInInitializerError
	at org.apache.maven.surefire.junit4.JUnit4Provider.execute(JUnit4Provider.java:369)
	at org.apache.maven.surefire.junit4.JUnit4Provider.executeWithRerun(JUnit4Provider.java:275)
	at org.apache.maven.surefire.junit4.JUnit4Provider.executeTestSet(JUnit4Provider.java:239)
	at org.apache.maven.surefire.junit4.JUnit4Provider.invoke(JUnit4Provider.java:160)
Caused by: java.lang.NullPointerException
	at org.apache.maven.surefire.junit4.JUnit4Provider.execute(JUnit4Provider.java:369)
	at org.apache.maven.surefire.junit4.JUnit4Provider.executeWithRerun(JUnit4Provider.java:275)
	at org.apache.maven.surefire.junit4.JUnit4Provider.executeTestSet(JUnit4Provider.java:239)
	at org.apache.maven.surefire.junit4.JUnit4Provider.invoke(JUnit4Provider.java:160)

[INFO] Running com.microsoft.azure.storage.BlobStorageAPITests
[ERROR] Tests run: 1, Failures: 0, Errors: 1, Skipped: 0, Time elapsed: 0.031 s <<< FAILURE! - in com.microsoft.azure.storage.BlobStorageAPITests
[ERROR] TestPutBlobBasic(com.microsoft.azure.storage.BlobStorageAPITests)  Time elapsed: 0.018 s  <<< ERROR!
java.lang.NullPointerException
	at com.microsoft.azure.storage.BlobStorageAPITests.TestPutBlobBasic(BlobStorageAPITests.java:70)

[INFO] Running com.microsoft.azure.storage.ContainerAPITest
[ERROR] Tests run: 1, Failures: 0, Errors: 1, Skipped: 0, Time elapsed: 0.305 s <<< FAILURE! - in com.microsoft.azure.storage.ContainerAPITest
[ERROR] com.microsoft.azure.storage.ContainerAPITest  Time elapsed: 0.304 s  <<< ERROR!
org.spockframework.util.InternalSpockError: Failed to instantiate spec 'ContainerAPITest'
	at org.apache.maven.surefire.junit4.JUnit4Provider.execute(JUnit4Provider.java:369)
	at org.apache.maven.surefire.junit4.JUnit4Provider.executeWithRerun(JUnit4Provider.java:275)
	at org.apache.maven.surefire.junit4.JUnit4Provider.executeTestSet(JUnit4Provider.java:239)
	at org.apache.maven.surefire.junit4.JUnit4Provider.invoke(JUnit4Provider.java:160)
Caused by: java.lang.NoClassDefFoundError: Could not initialize class com.microsoft.azure.storage.APISpec
	at org.apache.maven.surefire.junit4.JUnit4Provider.execute(JUnit4Provider.java:369)
	at org.apache.maven.surefire.junit4.JUnit4Provider.executeWithRerun(JUnit4Provider.java:275)
	at org.apache.maven.surefire.junit4.JUnit4Provider.executeTestSet(JUnit4Provider.java:239)
	at org.apache.maven.surefire.junit4.JUnit4Provider.invoke(JUnit4Provider.java:160)

[INFO] Running com.microsoft.azure.storage.BlockBlobAPITest
[ERROR] Tests run: 1, Failures: 0, Errors: 1, Skipped: 0, Time elapsed: 0.035 s <<< FAILURE! - in com.microsoft.azure.storage.BlockBlobAPITest
[ERROR] com.microsoft.azure.storage.BlockBlobAPITest  Time elapsed: 0.035 s  <<< ERROR!
org.spockframework.util.InternalSpockError: Failed to instantiate spec 'BlockBlobAPITest'
	at org.apache.maven.surefire.junit4.JUnit4Provider.execute(JUnit4Provider.java:369)
	at org.apache.maven.surefire.junit4.JUnit4Provider.executeWithRerun(JUnit4Provider.java:275)
	at org.apache.maven.surefire.junit4.JUnit4Provider.executeTestSet(JUnit4Provider.java:239)
	at org.apache.maven.surefire.junit4.JUnit4Provider.invoke(JUnit4Provider.java:160)
Caused by: java.lang.NoClassDefFoundError: Could not initialize class com.microsoft.azure.storage.APISpec
	at org.apache.maven.surefire.junit4.JUnit4Provider.execute(JUnit4Provider.java:369)
	at org.apache.maven.surefire.junit4.JUnit4Provider.executeWithRerun(JUnit4Provider.java:275)
	at org.apache.maven.surefire.junit4.JUnit4Provider.executeTestSet(JUnit4Provider.java:239)
	at org.apache.maven.surefire.junit4.JUnit4Provider.invoke(JUnit4Provider.java:160)

[INFO] Running com.microsoft.azure.storage.ServiceAPITest
[ERROR] Tests run: 1, Failures: 0, Errors: 1, Skipped: 0, Time elapsed: 0 s <<< FAILURE! - in com.microsoft.azure.storage.ServiceAPITest
[ERROR] com.microsoft.azure.storage.ServiceAPITest  Time elapsed: 0 s  <<< ERROR!
org.spockframework.util.InternalSpockError: Failed to instantiate spec 'ServiceAPITest'
	at org.apache.maven.surefire.junit4.JUnit4Provider.execute(JUnit4Provider.java:369)
	at org.apache.maven.surefire.junit4.JUnit4Provider.executeWithRerun(JUnit4Provider.java:275)
	at org.apache.maven.surefire.junit4.JUnit4Provider.executeTestSet(JUnit4Provider.java:239)
	at org.apache.maven.surefire.junit4.JUnit4Provider.invoke(JUnit4Provider.java:160)
Caused by: java.lang.NoClassDefFoundError: Could not initialize class com.microsoft.azure.storage.APISpec
	at org.apache.maven.surefire.junit4.JUnit4Provider.execute(JUnit4Provider.java:369)
	at org.apache.maven.surefire.junit4.JUnit4Provider.executeWithRerun(JUnit4Provider.java:275)
	at org.apache.maven.surefire.junit4.JUnit4Provider.executeTestSet(JUnit4Provider.java:239)
	at org.apache.maven.surefire.junit4.JUnit4Provider.invoke(JUnit4Provider.java:160)

[INFO] Running com.microsoft.azure.storage.blob.RetryTest
[ERROR] Tests run: 1, Failures: 0, Errors: 1, Skipped: 0, Time elapsed: 0 s <<< FAILURE! - in com.microsoft.azure.storage.blob.RetryTest
[ERROR] com.microsoft.azure.storage.blob.RetryTest  Time elapsed: 0 s  <<< ERROR!
org.spockframework.util.InternalSpockError: Failed to instantiate spec 'RetryTest'
	at org.apache.maven.surefire.junit4.JUnit4Provider.execute(JUnit4Provider.java:369)
	at org.apache.maven.surefire.junit4.JUnit4Provider.executeWithRerun(JUnit4Provider.java:275)
	at org.apache.maven.surefire.junit4.JUnit4Provider.executeTestSet(JUnit4Provider.java:239)
	at org.apache.maven.surefire.junit4.JUnit4Provider.invoke(JUnit4Provider.java:160)
Caused by: java.lang.NoClassDefFoundError: Could not initialize class com.microsoft.azure.storage.APISpec
	at org.apache.maven.surefire.junit4.JUnit4Provider.execute(JUnit4Provider.java:369)
	at org.apache.maven.surefire.junit4.JUnit4Provider.executeWithRerun(JUnit4Provider.java:275)
	at org.apache.maven.surefire.junit4.JUnit4Provider.executeTestSet(JUnit4Provider.java:239)
	at org.apache.maven.surefire.junit4.JUnit4Provider.invoke(JUnit4Provider.java:160)

[INFO] Running com.microsoft.azure.storage.Samples
myaccount.blob.core.windows.net
mycontainter
ReadMe.txt
2011-03-09T01:42:34.9360000Z

2015-02-21
b
2111-01-09T01:42:34Z
2222-03-09T01:42:34Z
rw
168.1.5.60-168.1.5.70
https,http
myIdentifier
bf
92836758923659283652983562==
https://myaccount.blob.core.windows.net/othercontainer/ReadMe.txt
[ERROR] Tests run: 20, Failures: 0, Errors: 17, Skipped: 0, Time elapsed: 3.895 s <<< FAILURE! - in com.microsoft.azure.storage.Samples
[ERROR] exampleBlobURL_startCopy(com.microsoft.azure.storage.Samples)  Time elapsed: 0.005 s  <<< ERROR!
java.lang.NullPointerException
	at com.microsoft.azure.storage.Samples.exampleBlobURL_startCopy(Samples.java:1283)

[ERROR] exampleLazyEnumeration(com.microsoft.azure.storage.Samples)  Time elapsed: 0.001 s  <<< ERROR!
java.lang.NullPointerException
	at com.microsoft.azure.storage.Samples.exampleLazyEnumeration(Samples.java:1508)

[ERROR] examplePageBlobURL(com.microsoft.azure.storage.Samples)  Time elapsed: 0.027 s  <<< ERROR!
java.lang.NullPointerException
	at com.microsoft.azure.storage.Samples.examplePageBlobURL(Samples.java:1112)

[ERROR] exampleContainerURL_SetPermissions(com.microsoft.azure.storage.Samples)  Time elapsed: 0.001 s  <<< ERROR!
java.lang.NullPointerException
	at com.microsoft.azure.storage.Samples.exampleContainerURL_SetPermissions(Samples.java:585)

[ERROR] exampleBlobAccessConditions(com.microsoft.azure.storage.Samples)  Time elapsed: 0 s  <<< ERROR!
java.lang.NullPointerException
	at com.microsoft.azure.storage.Samples.exampleBlobAccessConditions(Samples.java:659)

[ERROR] exampleMetadata_containers(com.microsoft.azure.storage.Samples)  Time elapsed: 0.001 s  <<< ERROR!
java.lang.NullPointerException
	at com.microsoft.azure.storage.Samples.exampleMetadata_containers(Samples.java:800)

[ERROR] exampleBlobHTTPHeaders(com.microsoft.azure.storage.Samples)  Time elapsed: 0 s  <<< ERROR!
java.lang.NullPointerException
	at com.microsoft.azure.storage.Samples.exampleBlobHTTPHeaders(Samples.java:910)

[ERROR] exampleCreateContainerIfNotExists(com.microsoft.azure.storage.Samples)  Time elapsed: 0 s  <<< ERROR!
java.lang.NullPointerException
	at com.microsoft.azure.storage.Samples.exampleCreateContainerIfNotExists(Samples.java:1440)

[ERROR] exampleDownloadStream(com.microsoft.azure.storage.Samples)  Time elapsed: 0 s  <<< ERROR!
java.lang.NullPointerException
	at com.microsoft.azure.storage.Samples.exampleDownloadStream(Samples.java:1391)

[ERROR] exampleUploadFileToBlockBlob(com.microsoft.azure.storage.Samples)  Time elapsed: 0 s  <<< ERROR!
java.lang.NullPointerException
	at com.microsoft.azure.storage.Samples.exampleUploadFileToBlockBlob(Samples.java:1337)

[ERROR] exampleMetadata_blob(com.microsoft.azure.storage.Samples)  Time elapsed: 0.01 s  <<< ERROR!
java.lang.NullPointerException
	at com.microsoft.azure.storage.Samples.exampleMetadata_blob(Samples.java:850)

[ERROR] exampleAccountSASSignatureValues(com.microsoft.azure.storage.Samples)  Time elapsed: 0.003 s  <<< ERROR!
java.lang.NullPointerException
	at com.microsoft.azure.storage.Samples.exampleAccountSASSignatureValues(Samples.java:473)

[ERROR] basicExample(com.microsoft.azure.storage.Samples)  Time elapsed: 0 s  <<< ERROR!
java.lang.NullPointerException
	at com.microsoft.azure.storage.Samples.basicExample(Samples.java:67)

[ERROR] exampleBlobSASSignatureValues(com.microsoft.azure.storage.Samples)  Time elapsed: 0 s  <<< ERROR!
java.lang.NullPointerException
	at com.microsoft.azure.storage.Samples.exampleBlobSASSignatureValues(Samples.java:528)

[ERROR] example_blobSnapshot(com.microsoft.azure.storage.Samples)  Time elapsed: 0 s  <<< ERROR!
java.lang.NullPointerException
	at com.microsoft.azure.storage.Samples.example_blobSnapshot(Samples.java:1202)

[ERROR] exampleAppendBlobURL(com.microsoft.azure.storage.Samples)  Time elapsed: 0.012 s  <<< ERROR!
java.lang.NullPointerException
	at com.microsoft.azure.storage.Samples.exampleAppendBlobURL(Samples.java:1062)

[ERROR] exampleBlockBlobURL(com.microsoft.azure.storage.Samples)  Time elapsed: 0 s  <<< ERROR!
java.lang.NullPointerException
	at com.microsoft.azure.storage.Samples.exampleBlockBlobURL(Samples.java:990)

[INFO] Running com.microsoft.azure.storage.RetryReaderTest
[ERROR] Tests run: 1, Failures: 0, Errors: 1, Skipped: 0, Time elapsed: 0.018 s <<< FAILURE! - in com.microsoft.azure.storage.RetryReaderTest
[ERROR] com.microsoft.azure.storage.RetryReaderTest  Time elapsed: 0.018 s  <<< ERROR!
org.spockframework.util.InternalSpockError: Failed to instantiate spec 'RetryReaderTest'
	at org.apache.maven.surefire.junit4.JUnit4Provider.execute(JUnit4Provider.java:369)
	at org.apache.maven.surefire.junit4.JUnit4Provider.executeWithRerun(JUnit4Provider.java:275)
	at org.apache.maven.surefire.junit4.JUnit4Provider.executeTestSet(JUnit4Provider.java:239)
	at org.apache.maven.surefire.junit4.JUnit4Provider.invoke(JUnit4Provider.java:160)
Caused by: java.lang.NoClassDefFoundError: Could not initialize class com.microsoft.azure.storage.APISpec
	at org.apache.maven.surefire.junit4.JUnit4Provider.execute(JUnit4Provider.java:369)
	at org.apache.maven.surefire.junit4.JUnit4Provider.executeWithRerun(JUnit4Provider.java:275)
	at org.apache.maven.surefire.junit4.JUnit4Provider.executeTestSet(JUnit4Provider.java:239)
	at org.apache.maven.surefire.junit4.JUnit4Provider.invoke(JUnit4Provider.java:160)

[INFO] Running com.microsoft.azure.storage.AppendBlobAPITest
[ERROR] Tests run: 1, Failures: 0, Errors: 1, Skipped: 0, Time elapsed: 0.016 s <<< FAILURE! - in com.microsoft.azure.storage.AppendBlobAPITest
[ERROR] com.microsoft.azure.storage.AppendBlobAPITest  Time elapsed: 0.016 s  <<< ERROR!
org.spockframework.util.InternalSpockError: Failed to instantiate spec 'AppendBlobAPITest'
	at org.apache.maven.surefire.junit4.JUnit4Provider.execute(JUnit4Provider.java:369)
	at org.apache.maven.surefire.junit4.JUnit4Provider.executeWithRerun(JUnit4Provider.java:275)
	at org.apache.maven.surefire.junit4.JUnit4Provider.executeTestSet(JUnit4Provider.java:239)
	at org.apache.maven.surefire.junit4.JUnit4Provider.invoke(JUnit4Provider.java:160)
Caused by: java.lang.NoClassDefFoundError: Could not initialize class com.microsoft.azure.storage.APISpec
	at org.apache.maven.surefire.junit4.JUnit4Provider.execute(JUnit4Provider.java:369)
	at org.apache.maven.surefire.junit4.JUnit4Provider.executeWithRerun(JUnit4Provider.java:275)
	at org.apache.maven.surefire.junit4.JUnit4Provider.executeTestSet(JUnit4Provider.java:239)
	at org.apache.maven.surefire.junit4.JUnit4Provider.invoke(JUnit4Provider.java:160)

[INFO] Running com.microsoft.azure.storage.PageBlobAPITest
[ERROR] Tests run: 1, Failures: 0, Errors: 1, Skipped: 0, Time elapsed: 0.024 s <<< FAILURE! - in com.microsoft.azure.storage.PageBlobAPITest
[ERROR] com.microsoft.azure.storage.PageBlobAPITest  Time elapsed: 0.024 s  <<< ERROR!
org.spockframework.util.InternalSpockError: Failed to instantiate spec 'PageBlobAPITest'
	at org.apache.maven.surefire.junit4.JUnit4Provider.execute(JUnit4Provider.java:369)
	at org.apache.maven.surefire.junit4.JUnit4Provider.executeWithRerun(JUnit4Provider.java:275)
	at org.apache.maven.surefire.junit4.JUnit4Provider.executeTestSet(JUnit4Provider.java:239)
	at org.apache.maven.surefire.junit4.JUnit4Provider.invoke(JUnit4Provider.java:160)
Caused by: java.lang.NoClassDefFoundError: Could not initialize class com.microsoft.azure.storage.APISpec
	at org.apache.maven.surefire.junit4.JUnit4Provider.execute(JUnit4Provider.java:369)
	at org.apache.maven.surefire.junit4.JUnit4Provider.executeWithRerun(JUnit4Provider.java:275)
	at org.apache.maven.surefire.junit4.JUnit4Provider.executeTestSet(JUnit4Provider.java:239)
	at org.apache.maven.surefire.junit4.JUnit4Provider.invoke(JUnit4Provider.java:160)

[INFO] Running com.microsoft.azure.storage.TransferManagerTest
[ERROR] Tests run: 1, Failures: 0, Errors: 1, Skipped: 0, Time elapsed: 0.022 s <<< FAILURE! - in com.microsoft.azure.storage.TransferManagerTest
[ERROR] com.microsoft.azure.storage.TransferManagerTest  Time elapsed: 0.022 s  <<< ERROR!
org.spockframework.util.InternalSpockError: Failed to instantiate spec 'TransferManagerTest'
	at org.apache.maven.surefire.junit4.JUnit4Provider.execute(JUnit4Provider.java:369)
	at org.apache.maven.surefire.junit4.JUnit4Provider.executeWithRerun(JUnit4Provider.java:275)
	at org.apache.maven.surefire.junit4.JUnit4Provider.executeTestSet(JUnit4Provider.java:239)
	at org.apache.maven.surefire.junit4.JUnit4Provider.invoke(JUnit4Provider.java:160)
Caused by: java.lang.NoClassDefFoundError: Could not initialize class com.microsoft.azure.storage.APISpec
	at org.apache.maven.surefire.junit4.JUnit4Provider.execute(JUnit4Provider.java:369)
	at org.apache.maven.surefire.junit4.JUnit4Provider.executeWithRerun(JUnit4Provider.java:275)
	at org.apache.maven.surefire.junit4.JUnit4Provider.executeTestSet(JUnit4Provider.java:239)
	at org.apache.maven.surefire.junit4.JUnit4Provider.invoke(JUnit4Provider.java:160)

[INFO] Running com.microsoft.azure.storage.BlobAPITest
[ERROR] Tests run: 1, Failures: 0, Errors: 1, Skipped: 0, Time elapsed: 0.124 s <<< FAILURE! - in com.microsoft.azure.storage.BlobAPITest
[ERROR] com.microsoft.azure.storage.BlobAPITest  Time elapsed: 0.124 s  <<< ERROR!
org.spockframework.util.InternalSpockError: Failed to instantiate spec 'BlobAPITest'
	at org.apache.maven.surefire.junit4.JUnit4Provider.execute(JUnit4Provider.java:369)
	at org.apache.maven.surefire.junit4.JUnit4Provider.executeWithRerun(JUnit4Provider.java:275)
	at org.apache.maven.surefire.junit4.JUnit4Provider.executeTestSet(JUnit4Provider.java:239)
	at org.apache.maven.surefire.junit4.JUnit4Provider.invoke(JUnit4Provider.java:160)
Caused by: java.lang.NoClassDefFoundError: Could not initialize class com.microsoft.azure.storage.APISpec
	at org.apache.maven.surefire.junit4.JUnit4Provider.execute(JUnit4Provider.java:369)
	at org.apache.maven.surefire.junit4.JUnit4Provider.executeWithRerun(JUnit4Provider.java:275)
	at org.apache.maven.surefire.junit4.JUnit4Provider.executeTestSet(JUnit4Provider.java:239)
	at org.apache.maven.surefire.junit4.JUnit4Provider.invoke(JUnit4Provider.java:160)

[INFO] 
[INFO] Results:
[INFO] 
[ERROR] Errors: 
[ERROR]   BlobStorageAPITests.TestPutBlobBasic:70 » NullPointer
[ERROR]   Samples.basicExample:67 » NullPointer
[ERROR]   Samples.exampleAccountSASSignatureValues:473 » NullPointer
[ERROR]   Samples.exampleAppendBlobURL:1062 » NullPointer
[ERROR]   Samples.exampleBlobAccessConditions:659 » NullPointer
[ERROR]   Samples.exampleBlobHTTPHeaders:910 » NullPointer
[ERROR]   Samples.exampleBlobSASSignatureValues:528 » NullPointer
[ERROR]   Samples.exampleBlobURL_startCopy:1283 » NullPointer
[ERROR]   Samples.exampleBlockBlobURL:990 » NullPointer
[ERROR]   Samples.exampleContainerURL_SetPermissions:585 » NullPointer
[ERROR]   Samples.exampleCreateContainerIfNotExists:1440 » NullPointer
[ERROR]   Samples.exampleDownloadStream:1391 » NullPointer
[ERROR]   Samples.exampleLazyEnumeration:1508 » NullPointer
[ERROR]   Samples.exampleMetadata_blob:850 » NullPointer
[ERROR]   Samples.exampleMetadata_containers:800 » NullPointer
[ERROR]   Samples.examplePageBlobURL:1112 » NullPointer
[ERROR]   Samples.exampleUploadFileToBlockBlob:1337 » NullPointer
[ERROR]   Samples.example_blobSnapshot:1202 » NullPointer
[ERROR]   JUnit4Provider.invoke:160->executeTestSet:239->executeWithRerun:275->execute:369 » InternalSpock
[ERROR]   JUnit4Provider.invoke:160->executeTestSet:239->executeWithRerun:275->execute:369 » InternalSpock
[ERROR]   JUnit4Provider.invoke:160->executeTestSet:239->executeWithRerun:275->execute:369 » InternalSpock
[ERROR]   JUnit4Provider.invoke:160->executeTestSet:239->executeWithRerun:275->execute:369 » InternalSpock
[ERROR]   JUnit4Provider.invoke:160->executeTestSet:239->executeWithRerun:275->execute:369 » InternalSpock
[ERROR]   JUnit4Provider.invoke:160->executeTestSet:239->executeWithRerun:275->execute:369 » InternalSpock
[ERROR]   JUnit4Provider.invoke:160->executeTestSet:239->executeWithRerun:275->execute:369 » InternalSpock
[ERROR]   JUnit4Provider.invoke:160->executeTestSet:239->executeWithRerun:275->execute:369 » InternalSpock
[ERROR]   JUnit4Provider.invoke:160->executeTestSet:239->executeWithRerun:275->execute:369 » InternalSpock
[ERROR]   JUnit4Provider.invoke:160->executeTestSet:239->executeWithRerun:275->execute:369 » InternalSpock
[INFO] 
[ERROR] Tests run: 31, Failures: 0, Errors: 28, Skipped: 0
[INFO] 
[INFO] ------------------------------------------------------------------------
[INFO] BUILD FAILURE
[INFO] ------------------------------------------------------------------------
[INFO] Total time: 40.018 s
[INFO] Finished at: 2018-08-09T21:37:06+02:00
[INFO] Final Memory: 19M/458M
[INFO] ------------------------------------------------------------------------
[ERROR] Failed to execute goal org.apache.maven.plugins:maven-surefire-plugin:2.20.1:test (default-test) on project azure-storage-blob: There are test failures.
[ERROR] 
[ERROR] Please refer to /root/workspace/rickle-msft/azure-storage-java/414217563/target/surefire-reports for the individual test results.
[ERROR] Please refer to dump files (if any exist) [date]-jvmRun[N].dump, [date].dumpstream and [date]-jvmRun[N].dumpstream.
[ERROR] -> [Help 1]
[ERROR] 
[ERROR] To see the full stack trace of the errors, re-run Maven with the -e switch.
[ERROR] Re-run Maven using the -X switch to enable full debug logging.
[ERROR] 
[ERROR] For more information about the errors and possible solutions, please read the following articles:
[ERROR] [Help 1] http://cwiki.apache.org/confluence/display/MAVEN/MojoFailureException
