[INFO] Scanning for projects...
[INFO] ------------------------------------------------------------------------
[INFO] Reactor Build Order:
[INFO] 
[INFO] io.openscore.lang:score-language
[INFO] score-lang-entities
[INFO] score-lang-runtime
[INFO] score-lang-compiler
[INFO] score-lang-api
[INFO] score-lang-cli
[INFO] score-language-tests
[INFO] score-lang-content-verifier
[INFO]                                                                         
[INFO] ------------------------------------------------------------------------
[INFO] Building io.openscore.lang:score-language 0.1.17-SNAPSHOT
[INFO] ------------------------------------------------------------------------
[INFO] 
[INFO] --- maven-enforcer-plugin:1.3.1:enforce (enforce-versions) @ score-language ---
[INFO] Skipping Rule Enforcement.
[INFO]                                                                         
[INFO] ------------------------------------------------------------------------
[INFO] Building score-lang-entities 0.1.17-SNAPSHOT
[INFO] ------------------------------------------------------------------------
[INFO] 
[INFO] --- maven-enforcer-plugin:1.3.1:enforce (enforce-versions) @ score-lang-entities ---
[INFO] Skipping Rule Enforcement.
[INFO] 
[INFO] --- maven-resources-plugin:2.6:resources (default-resources) @ score-lang-entities ---
[INFO] Using 'UTF-8' encoding to copy filtered resources.
[INFO] skip non existing resourceDirectory /root/workspace/leusonmario/cloud-slang/409657807/score-lang-entities/src/main/resources
[INFO] 
[INFO] --- maven-compiler-plugin:3.0:compile (default-compile) @ score-lang-entities ---
[INFO] Changes detected - recompiling the module!
[INFO] Compiling 11 source files to /root/workspace/leusonmario/cloud-slang/409657807/score-lang-entities/target/classes
[INFO] 
[INFO] --- maven-resources-plugin:2.6:testResources (default-testResources) @ score-lang-entities ---
[INFO] Using 'UTF-8' encoding to copy filtered resources.
[INFO] skip non existing resourceDirectory /root/workspace/leusonmario/cloud-slang/409657807/score-lang-entities/src/test/resources
[INFO] 
[INFO] --- maven-compiler-plugin:3.0:testCompile (default-testCompile) @ score-lang-entities ---
[INFO] Changes detected - recompiling the module!
[INFO] Compiling 1 source file to /root/workspace/leusonmario/cloud-slang/409657807/score-lang-entities/target/test-classes
[INFO] 
[INFO] --- maven-surefire-plugin:2.15:test (default-test) @ score-lang-entities ---
[INFO] Surefire report directory: /root/workspace/leusonmario/cloud-slang/409657807/score-lang-entities/target/surefire-reports
[INFO] Downloading: https://repo.maven.apache.org/maven2/org/apache/maven/surefire/surefire-junit4/2.15/surefire-junit4-2.15.pom
[INFO] Downloaded: https://repo.maven.apache.org/maven2/org/apache/maven/surefire/surefire-junit4/2.15/surefire-junit4-2.15.pom (3 KB at 2.8 KB/sec)
[INFO] Downloading: https://repo.maven.apache.org/maven2/org/apache/maven/surefire/surefire-providers/2.15/surefire-providers-2.15.pom
[INFO] Downloaded: https://repo.maven.apache.org/maven2/org/apache/maven/surefire/surefire-providers/2.15/surefire-providers-2.15.pom (3 KB at 89.3 KB/sec)
[INFO] Downloading: https://repo.maven.apache.org/maven2/org/apache/maven/surefire/surefire-junit4/2.15/surefire-junit4-2.15.jar
[INFO] Downloaded: https://repo.maven.apache.org/maven2/org/apache/maven/surefire/surefire-junit4/2.15/surefire-junit4-2.15.jar (63 KB at 668.3 KB/sec)

-------------------------------------------------------
 T E S T S
-------------------------------------------------------
Running org.openscore.lang.entities.DeserializeTest
Tests run: 4, Failures: 0, Errors: 0, Skipped: 0, Time elapsed: 0.779 sec - in org.openscore.lang.entities.DeserializeTest

Results :

Tests run: 4, Failures: 0, Errors: 0, Skipped: 0

[INFO]                                                                         
[INFO] ------------------------------------------------------------------------
[INFO] Building score-lang-runtime 0.1.17-SNAPSHOT
[INFO] ------------------------------------------------------------------------
[INFO] 
[INFO] --- maven-enforcer-plugin:1.3.1:enforce (enforce-versions) @ score-lang-runtime ---
[INFO] Skipping Rule Enforcement.
[INFO] 
[INFO] --- maven-resources-plugin:2.6:resources (default-resources) @ score-lang-runtime ---
[INFO] Using 'UTF-8' encoding to copy filtered resources.
[INFO] skip non existing resourceDirectory /root/workspace/leusonmario/cloud-slang/409657807/score-lang-runtime/src/main/resources
[INFO] 
[INFO] --- maven-compiler-plugin:3.0:compile (default-compile) @ score-lang-runtime ---
[INFO] Changes detected - recompiling the module!
[INFO] Compiling 21 source files to /root/workspace/leusonmario/cloud-slang/409657807/score-lang-runtime/target/classes
[WARNING] /root/workspace/leusonmario/cloud-slang/409657807/score-lang-runtime/src/main/java/org/openscore/lang/runtime/events/LanguageEventData.java: Some input files use unchecked or unsafe operations.
[WARNING] /root/workspace/leusonmario/cloud-slang/409657807/score-lang-runtime/src/main/java/org/openscore/lang/runtime/events/LanguageEventData.java: Recompile with -Xlint:unchecked for details.
[INFO] 
[INFO] --- maven-resources-plugin:2.6:testResources (default-testResources) @ score-lang-runtime ---
[INFO] Using 'UTF-8' encoding to copy filtered resources.
[INFO] skip non existing resourceDirectory /root/workspace/leusonmario/cloud-slang/409657807/score-lang-runtime/src/test/resources
[INFO] 
[INFO] --- maven-compiler-plugin:3.0:testCompile (default-testCompile) @ score-lang-runtime ---
[INFO] Changes detected - recompiling the module!
[INFO] Compiling 12 source files to /root/workspace/leusonmario/cloud-slang/409657807/score-lang-runtime/target/test-classes
[WARNING] /root/workspace/leusonmario/cloud-slang/409657807/score-lang-runtime/src/test/java/org/openscore/lang/runtime/steps/ExecutableStepsTest.java: Some input files use unchecked or unsafe operations.
[WARNING] /root/workspace/leusonmario/cloud-slang/409657807/score-lang-runtime/src/test/java/org/openscore/lang/runtime/steps/ExecutableStepsTest.java: Recompile with -Xlint:unchecked for details.
[INFO] 
[INFO] --- maven-surefire-plugin:2.15:test (default-test) @ score-lang-runtime ---
[INFO] Surefire report directory: /root/workspace/leusonmario/cloud-slang/409657807/score-lang-runtime/target/surefire-reports

-------------------------------------------------------
 T E S T S
-------------------------------------------------------
Running org.openscore.lang.runtime.bindings.InputsBindingTest
Tests run: 26, Failures: 0, Errors: 0, Skipped: 0, Time elapsed: 8.183 sec - in org.openscore.lang.runtime.bindings.InputsBindingTest
Running org.openscore.lang.runtime.bindings.LoopsBindingTest
Tests run: 7, Failures: 0, Errors: 0, Skipped: 0, Time elapsed: 0.27 sec - in org.openscore.lang.runtime.bindings.LoopsBindingTest
Running org.openscore.lang.runtime.bindings.OutputsBindingTest
Tests run: 8, Failures: 0, Errors: 0, Skipped: 0, Time elapsed: 0.141 sec - in org.openscore.lang.runtime.bindings.OutputsBindingTest
Running org.openscore.lang.runtime.bindings.ResultBindingTest
Tests run: 12, Failures: 0, Errors: 0, Skipped: 0, Time elapsed: 0.148 sec - in org.openscore.lang.runtime.bindings.ResultBindingTest
Running org.openscore.lang.runtime.bindings.ScriptEvaluatorTest
Tests run: 2, Failures: 0, Errors: 0, Skipped: 0, Time elapsed: 0.107 sec - in org.openscore.lang.runtime.bindings.ScriptEvaluatorTest
Running org.openscore.lang.runtime.env.ExecutionPathTest
Tests run: 1, Failures: 0, Errors: 0, Skipped: 0, Time elapsed: 0.026 sec - in org.openscore.lang.runtime.env.ExecutionPathTest
Running org.openscore.lang.runtime.events.LanguageEventDataTest
Tests run: 8, Failures: 0, Errors: 0, Skipped: 0, Time elapsed: 0.015 sec - in org.openscore.lang.runtime.events.LanguageEventDataTest
Running org.openscore.lang.runtime.navigations.NavigationsTest
Tests run: 2, Failures: 0, Errors: 0, Skipped: 0, Time elapsed: 0.075 sec - in org.openscore.lang.runtime.navigations.NavigationsTest
Running org.openscore.lang.runtime.steps.ActionStepsTest
localhost
8080
PING localhost (127.0.0.1): 56 data bytes
64 bytes from 127.0.0.1: icmp_seq=0 ttl=64 time=0.087 ms
--- localhost ping statistics ---
1 packets transmitted, 1 packets received, 0% packet loss
round-trip min/avg/max/stddev = 0.087/0.087/0.087/0.000 ms
http://localhost:8080
Tests run: 22, Failures: 0, Errors: 0, Skipped: 0, Time elapsed: 0.885 sec - in org.openscore.lang.runtime.steps.ActionStepsTest
Running org.openscore.lang.runtime.steps.ExecutableStepsTest
Tests run: 9, Failures: 0, Errors: 0, Skipped: 0, Time elapsed: 0.106 sec - in org.openscore.lang.runtime.steps.ExecutableStepsTest
Running org.openscore.lang.runtime.steps.TaskStepsTest
Tests run: 14, Failures: 0, Errors: 0, Skipped: 0, Time elapsed: 0.187 sec - in org.openscore.lang.runtime.steps.TaskStepsTest

Results :

Tests run: 111, Failures: 0, Errors: 0, Skipped: 0

[INFO]                                                                         
[INFO] ------------------------------------------------------------------------
[INFO] Building score-lang-compiler 0.1.17-SNAPSHOT
[INFO] ------------------------------------------------------------------------
[INFO] 
[INFO] --- maven-enforcer-plugin:1.3.1:enforce (enforce-versions) @ score-lang-compiler ---
[INFO] Skipping Rule Enforcement.
[INFO] 
[INFO] --- maven-resources-plugin:2.6:resources (default-resources) @ score-lang-compiler ---
[INFO] Using 'UTF-8' encoding to copy filtered resources.
[INFO] skip non existing resourceDirectory /root/workspace/leusonmario/cloud-slang/409657807/score-lang-compiler/src/main/resources
[INFO] 
[INFO] --- maven-compiler-plugin:3.0:compile (default-compile) @ score-lang-compiler ---
[INFO] Changes detected - recompiling the module!
[INFO] Compiling 37 source files to /root/workspace/leusonmario/cloud-slang/409657807/score-lang-compiler/target/classes
[WARNING] /root/workspace/leusonmario/cloud-slang/409657807/score-lang-compiler/src/main/java/org/openscore/lang/compiler/modeller/ExecutableBuilder.java: Some input files use unchecked or unsafe operations.
[WARNING] /root/workspace/leusonmario/cloud-slang/409657807/score-lang-compiler/src/main/java/org/openscore/lang/compiler/modeller/ExecutableBuilder.java: Recompile with -Xlint:unchecked for details.
[INFO] 
[INFO] --- maven-resources-plugin:2.6:testResources (default-testResources) @ score-lang-compiler ---
[INFO] Using 'UTF-8' encoding to copy filtered resources.
[INFO] Copying 56 resources
[INFO] 
[INFO] --- maven-compiler-plugin:3.0:testCompile (default-testCompile) @ score-lang-compiler ---
[INFO] Changes detected - recompiling the module!
[INFO] Compiling 19 source files to /root/workspace/leusonmario/cloud-slang/409657807/score-lang-compiler/target/test-classes
[WARNING] /root/workspace/leusonmario/cloud-slang/409657807/score-lang-compiler/src/test/java/org/openscore/lang/compiler/modeller/transformers/DoTransformerTest.java: Some input files use unchecked or unsafe operations.
[WARNING] /root/workspace/leusonmario/cloud-slang/409657807/score-lang-compiler/src/test/java/org/openscore/lang/compiler/modeller/transformers/DoTransformerTest.java: Recompile with -Xlint:unchecked for details.
[INFO] 
[INFO] --- maven-surefire-plugin:2.15:test (default-test) @ score-lang-compiler ---
[INFO] Surefire report directory: /root/workspace/leusonmario/cloud-slang/409657807/score-lang-compiler/target/surefire-reports

-------------------------------------------------------
 T E S T S
-------------------------------------------------------
Running org.openscore.lang.compiler.CompileBasicFlowTest
Tests run: 3, Failures: 0, Errors: 0, Skipped: 0, Time elapsed: 1.874 sec - in org.openscore.lang.compiler.CompileBasicFlowTest
Running org.openscore.lang.compiler.CompileDependenciesTest
Tests run: 9, Failures: 0, Errors: 0, Skipped: 0, Time elapsed: 0.153 sec - in org.openscore.lang.compiler.CompileDependenciesTest
Running org.openscore.lang.compiler.CompileFlowWithMultipleStepsTest
Tests run: 2, Failures: 0, Errors: 0, Skipped: 0, Time elapsed: 0.021 sec - in org.openscore.lang.compiler.CompileFlowWithMultipleStepsTest
Running org.openscore.lang.compiler.CompileFlowWithOnFailureTest
Tests run: 1, Failures: 0, Errors: 0, Skipped: 0, Time elapsed: 0.01 sec - in org.openscore.lang.compiler.CompileFlowWithOnFailureTest
Running org.openscore.lang.compiler.CompileLoopsFlowTest
Tests run: 10, Failures: 0, Errors: 0, Skipped: 0, Time elapsed: 0.064 sec - in org.openscore.lang.compiler.CompileLoopsFlowTest
Running org.openscore.lang.compiler.CompileOperationTest
Tests run: 11, Failures: 0, Errors: 0, Skipped: 0, Time elapsed: 0.037 sec - in org.openscore.lang.compiler.CompileOperationTest
Running org.openscore.lang.compiler.CompilerErrorsTest
Tests run: 30, Failures: 0, Errors: 0, Skipped: 0, Time elapsed: 0.112 sec - in org.openscore.lang.compiler.CompilerErrorsTest
Running org.openscore.lang.compiler.SlangSourceTest
Tests run: 6, Failures: 0, Errors: 0, Skipped: 0, Time elapsed: 0.063 sec - in org.openscore.lang.compiler.SlangSourceTest
Running org.openscore.lang.compiler.modeller.ExecutableBuilderTest
Tests run: 13, Failures: 0, Errors: 0, Skipped: 1, Time elapsed: 0.073 sec - in org.openscore.lang.compiler.modeller.ExecutableBuilderTest
Running org.openscore.lang.compiler.modeller.transformers.BreakTransformerTest
Tests run: 3, Failures: 0, Errors: 0, Skipped: 0, Time elapsed: 0.002 sec - in org.openscore.lang.compiler.modeller.transformers.BreakTransformerTest
Running org.openscore.lang.compiler.modeller.transformers.DoTransformerTest
Tests run: 2, Failures: 0, Errors: 0, Skipped: 0, Time elapsed: 0.07 sec - in org.openscore.lang.compiler.modeller.transformers.DoTransformerTest
Running org.openscore.lang.compiler.modeller.transformers.ForTransformerTest
Tests run: 16, Failures: 0, Errors: 0, Skipped: 0, Time elapsed: 0.028 sec - in org.openscore.lang.compiler.modeller.transformers.ForTransformerTest
Running org.openscore.lang.compiler.modeller.transformers.InputsTransformerTest
Tests run: 13, Failures: 0, Errors: 0, Skipped: 0, Time elapsed: 0.05 sec - in org.openscore.lang.compiler.modeller.transformers.InputsTransformerTest
Running org.openscore.lang.compiler.modeller.transformers.OutputsTransformerTest
Tests run: 5, Failures: 0, Errors: 0, Skipped: 0, Time elapsed: 0.045 sec - in org.openscore.lang.compiler.modeller.transformers.OutputsTransformerTest
Running org.openscore.lang.compiler.modeller.transformers.PublishTransformerTest
Tests run: 4, Failures: 0, Errors: 0, Skipped: 0, Time elapsed: 0.076 sec - in org.openscore.lang.compiler.modeller.transformers.PublishTransformerTest
Running org.openscore.lang.compiler.modeller.transformers.ResultsTransformerTest
Tests run: 5, Failures: 0, Errors: 0, Skipped: 0, Time elapsed: 0.034 sec - in org.openscore.lang.compiler.modeller.transformers.ResultsTransformerTest
Running org.openscore.lang.compiler.parser.YamlParserTest
Tests run: 2, Failures: 0, Errors: 0, Skipped: 0, Time elapsed: 0.06 sec - in org.openscore.lang.compiler.parser.YamlParserTest
Running org.openscore.lang.compiler.scorecompiler.ExecutionPlanBuilderTest
Tests run: 4, Failures: 0, Errors: 0, Skipped: 0, Time elapsed: 0.046 sec - in org.openscore.lang.compiler.scorecompiler.ExecutionPlanBuilderTest
Running org.openscore.lang.compiler.scorecompiler.ExecutionStepFactoryTest
Tests run: 17, Failures: 0, Errors: 0, Skipped: 0, Time elapsed: 0.009 sec - in org.openscore.lang.compiler.scorecompiler.ExecutionStepFactoryTest

Results :

Tests run: 156, Failures: 0, Errors: 0, Skipped: 1

[INFO]                                                                         
[INFO] ------------------------------------------------------------------------
[INFO] Building score-lang-api 0.1.17-SNAPSHOT
[INFO] ------------------------------------------------------------------------
[INFO] 
[INFO] --- maven-enforcer-plugin:1.3.1:enforce (enforce-versions) @ score-lang-api ---
[INFO] Skipping Rule Enforcement.
[INFO] 
[INFO] --- maven-resources-plugin:2.6:resources (default-resources) @ score-lang-api ---
[INFO] Using 'UTF-8' encoding to copy filtered resources.
[INFO] skip non existing resourceDirectory /root/workspace/leusonmario/cloud-slang/409657807/score-lang-api/src/main/resources
[INFO] 
[INFO] --- maven-compiler-plugin:3.0:compile (default-compile) @ score-lang-api ---
[INFO] Changes detected - recompiling the module!
[INFO] Compiling 3 source files to /root/workspace/leusonmario/cloud-slang/409657807/score-lang-api/target/classes
[INFO] 
[INFO] --- maven-resources-plugin:2.6:testResources (default-testResources) @ score-lang-api ---
[INFO] Using 'UTF-8' encoding to copy filtered resources.
[INFO] Copying 1 resource
[INFO] 
[INFO] --- maven-compiler-plugin:3.0:testCompile (default-testCompile) @ score-lang-api ---
[INFO] Changes detected - recompiling the module!
[INFO] Compiling 1 source file to /root/workspace/leusonmario/cloud-slang/409657807/score-lang-api/target/test-classes
[WARNING] /root/workspace/leusonmario/cloud-slang/409657807/score-lang-api/src/test/java/org/openscore/lang/api/SlangImplTest.java: /root/workspace/leusonmario/cloud-slang/409657807/score-lang-api/src/test/java/org/openscore/lang/api/SlangImplTest.java uses unchecked or unsafe operations.
[WARNING] /root/workspace/leusonmario/cloud-slang/409657807/score-lang-api/src/test/java/org/openscore/lang/api/SlangImplTest.java: Recompile with -Xlint:unchecked for details.
[INFO] 
[INFO] --- maven-surefire-plugin:2.15:test (default-test) @ score-lang-api ---
[INFO] Surefire report directory: /root/workspace/leusonmario/cloud-slang/409657807/score-lang-api/target/surefire-reports

-------------------------------------------------------
 T E S T S
-------------------------------------------------------
Running org.openscore.lang.api.SlangImplTest
2018-07-30 02:47:53:223 [INFO ] TestContextManager: Could not instantiate TestExecutionListener [org.springframework.test.context.web.ServletTestExecutionListener]. Specify custom listener classes or make the default listener classes (and their required dependencies) available. Offending class: [javax/servlet/ServletContext] (main, org.springframework.test.context.TestContextManager.retrieveTestExecutionListeners(TestContextManager.java:242))
2018-07-30 02:47:53:231 [INFO ] TestContextManager: Could not instantiate TestExecutionListener [org.springframework.test.context.transaction.TransactionalTestExecutionListener]. Specify custom listener classes or make the default listener classes (and their required dependencies) available. Offending class: [org/springframework/transaction/interceptor/TransactionAttribute] (main, org.springframework.test.context.TestContextManager.retrieveTestExecutionListeners(TestContextManager.java:242))
2018-07-30 02:47:53:549 [INFO ] GenericApplicationContext: Refreshing org.springframework.context.support.GenericApplicationContext@3532ec19: startup date [Mon Jul 30 02:47:53 CEST 2018]; root of context hierarchy (main, org.springframework.context.support.AbstractApplicationContext.prepareRefresh(AbstractApplicationContext.java:515))
2018-07-30 02:47:54:360 [ERROR] SlangImpl: Failed compilation for source : temp1203585567876536066.tmp ,Exception is : null (main, org.openscore.lang.api.SlangImpl.compile(SlangImpl.java:69))
Tests run: 14, Failures: 0, Errors: 0, Skipped: 0, Time elapsed: 1.668 sec - in org.openscore.lang.api.SlangImplTest
2018-07-30 02:47:54:429 [INFO ] GenericApplicationContext: Closing org.springframework.context.support.GenericApplicationContext@3532ec19: startup date [Mon Jul 30 02:47:53 CEST 2018]; root of context hierarchy (Thread-0, org.springframework.context.support.AbstractApplicationContext.doClose(AbstractApplicationContext.java:875))

Results :

Tests run: 14, Failures: 0, Errors: 0, Skipped: 0

[INFO]                                                                         
[INFO] ------------------------------------------------------------------------
[INFO] Building score-lang-cli 0.1.17-SNAPSHOT
[INFO] ------------------------------------------------------------------------
[INFO] 
[INFO] --- maven-enforcer-plugin:1.3.1:enforce (enforce-versions) @ score-lang-cli ---
[INFO] Skipping Rule Enforcement.
[INFO] 
[INFO] --- maven-resources-plugin:2.6:resources (default-resources) @ score-lang-cli ---
[INFO] Using 'UTF-8' encoding to copy filtered resources.
[INFO] Copying 6 resources
[INFO] 
[INFO] --- maven-compiler-plugin:3.0:compile (default-compile) @ score-lang-cli ---
[INFO] Changes detected - recompiling the module!
[INFO] Compiling 13 source files to /root/workspace/leusonmario/cloud-slang/409657807/score-lang-cli/target/classes
[WARNING] /root/workspace/leusonmario/cloud-slang/409657807/score-lang-cli/src/main/java/org/openscore/lang/cli/utils/CompilerHelperImpl.java: /root/workspace/leusonmario/cloud-slang/409657807/score-lang-cli/src/main/java/org/openscore/lang/cli/utils/CompilerHelperImpl.java uses unchecked or unsafe operations.
[WARNING] /root/workspace/leusonmario/cloud-slang/409657807/score-lang-cli/src/main/java/org/openscore/lang/cli/utils/CompilerHelperImpl.java: Recompile with -Xlint:unchecked for details.
[INFO] 
[INFO] --- maven-resources-plugin:2.6:testResources (default-testResources) @ score-lang-cli ---
[INFO] Using 'UTF-8' encoding to copy filtered resources.
[INFO] Copying 10 resources
[INFO] 
[INFO] --- maven-compiler-plugin:3.0:testCompile (default-testCompile) @ score-lang-cli ---
[INFO] Changes detected - recompiling the module!
[INFO] Compiling 6 source files to /root/workspace/leusonmario/cloud-slang/409657807/score-lang-cli/target/test-classes
[WARNING] /root/workspace/leusonmario/cloud-slang/409657807/score-lang-cli/src/test/java/org/openscore/lang/cli/SlangCLITest.java: /root/workspace/leusonmario/cloud-slang/409657807/score-lang-cli/src/test/java/org/openscore/lang/cli/SlangCLITest.java uses unchecked or unsafe operations.
[WARNING] /root/workspace/leusonmario/cloud-slang/409657807/score-lang-cli/src/test/java/org/openscore/lang/cli/SlangCLITest.java: Recompile with -Xlint:unchecked for details.
[INFO] 
[INFO] --- maven-surefire-plugin:2.15:test (default-test) @ score-lang-cli ---
[INFO] Surefire report directory: /root/workspace/leusonmario/cloud-slang/409657807/score-lang-cli/target/surefire-reports

-------------------------------------------------------
 T E S T S
-------------------------------------------------------
Running org.openscore.lang.cli.MapConverterTest
Tests run: 5, Failures: 0, Errors: 0, Skipped: 0, Time elapsed: 0.279 sec - in org.openscore.lang.cli.MapConverterTest
Running org.openscore.lang.cli.SlangCLITest
Tests run: 15, Failures: 0, Errors: 0, Skipped: 0, Time elapsed: 5.992 sec - in org.openscore.lang.cli.SlangCLITest
Running org.openscore.lang.cli.services.ScoreServicesImplTest
Tests run: 4, Failures: 0, Errors: 0, Skipped: 0, Time elapsed: 0.577 sec - in org.openscore.lang.cli.services.ScoreServicesImplTest
Running org.openscore.lang.cli.services.SyncTriggerEventListenerTest
Tests run: 4, Failures: 0, Errors: 0, Skipped: 0, Time elapsed: 0.03 sec - in org.openscore.lang.cli.services.SyncTriggerEventListenerTest
Running org.openscore.lang.cli.utils.CompilerHelperTest
Tests run: 11, Failures: 0, Errors: 0, Skipped: 0, Time elapsed: 0.354 sec - in org.openscore.lang.cli.utils.CompilerHelperTest

Results :

Tests run: 39, Failures: 0, Errors: 0, Skipped: 0

[INFO]                                                                         
[INFO] ------------------------------------------------------------------------
[INFO] Building score-language-tests 0.1.17-SNAPSHOT
[INFO] ------------------------------------------------------------------------
[INFO] 
[INFO] --- maven-enforcer-plugin:1.3.1:enforce (enforce-versions) @ score-language-tests ---
[INFO] Skipping Rule Enforcement.
[INFO] 
[INFO] --- maven-resources-plugin:2.6:resources (default-resources) @ score-language-tests ---
[INFO] Using 'UTF-8' encoding to copy filtered resources.
[INFO] skip non existing resourceDirectory /root/workspace/leusonmario/cloud-slang/409657807/score-language-tests/src/main/resources
[INFO] 
[INFO] --- maven-compiler-plugin:3.0:compile (default-compile) @ score-language-tests ---
[INFO] Changes detected - recompiling the module!
[INFO] Compiling 3 source files to /root/workspace/leusonmario/cloud-slang/409657807/score-language-tests/target/classes
[INFO] 
[INFO] --- maven-resources-plugin:2.6:testResources (default-testResources) @ score-language-tests ---
[INFO] Using 'UTF-8' encoding to copy filtered resources.
[INFO] Copying 43 resources
[INFO] 
[INFO] --- maven-compiler-plugin:3.0:testCompile (default-testCompile) @ score-language-tests ---
[INFO] Changes detected - recompiling the module!
[INFO] Compiling 9 source files to /root/workspace/leusonmario/cloud-slang/409657807/score-language-tests/target/test-classes
[INFO] 
[INFO] --- maven-surefire-plugin:2.15:test (default-test) @ score-language-tests ---
[INFO] Surefire report directory: /root/workspace/leusonmario/cloud-slang/409657807/score-language-tests/target/surefire-reports

-------------------------------------------------------
 T E S T S
-------------------------------------------------------
Running org.openscore.lang.systemtests.LoopFlowsTest
2018-07-30 02:48:05 INFO  TestContextManager:242 - Could not instantiate TestExecutionListener [org.springframework.test.context.web.ServletTestExecutionListener]. Specify custom listener classes or make the default listener classes (and their required dependencies) available. Offending class: [org/springframework/web/context/request/RequestAttributes]
2018-07-30 02:48:06 INFO  XmlBeanDefinitionReader:317 - Loading XML bean definitions from class path resource [META-INF/spring/systemTestContext.xml]
2018-07-30 02:48:06 INFO  ScoreNamespaceHandler:36 - Registering Score namespace handler
2018-07-30 02:48:06 INFO  XmlBeanDefinitionReader:317 - Loading XML bean definitions from class path resource [META-INF/spring/score/context/scoreRepositoryContext.xml]
2018-07-30 02:48:07 INFO  XmlBeanDefinitionReader:317 - Loading XML bean definitions from class path resource [META-INF/spring/score/context/scoreEngineSchedulerContext.xml]
2018-07-30 02:48:07 INFO  XmlBeanDefinitionReader:317 - Loading XML bean definitions from class path resource [META-INF/spring/score/context/scoreWorkerSchedulerContext.xml]
2018-07-30 02:48:07 INFO  GenericApplicationContext:515 - Refreshing org.springframework.context.support.GenericApplicationContext@60c6f5b: startup date [Mon Jul 30 02:48:07 CEST 2018]; root of context hierarchy
2018-07-30 02:48:08 INFO  EmbeddedDatabaseFactory:147 - Creating embedded database 'testdb'
2018-07-30 02:48:09 INFO  EmbeddedDatabaseFactory:147 - Creating embedded database 'testdb'
2018-07-30 02:48:09 INFO  LocalContainerEntityManagerFactoryBean:332 - Building JPA container EntityManagerFactory for persistence unit 'default'
2018-07-30 02:48:10 INFO  Version:37 - HCANN000001: Hibernate Commons Annotations {4.0.2.Final}
2018-07-30 02:48:10 INFO  Version:41 - HHH000412: Hibernate Core {4.2.16.Final}
2018-07-30 02:48:10 INFO  Environment:238 - HHH000206: hibernate.properties not found
2018-07-30 02:48:10 INFO  Environment:345 - HHH000021: Bytecode provider name : javassist
2018-07-30 02:48:10 INFO  Ejb3Configuration:530 - HHH000204: Processing PersistenceUnitInfo [
	name: default
	...]
2018-07-30 02:48:10 INFO  ConnectionProviderInitiator:188 - HHH000130: Instantiating explicit connection provider: org.hibernate.ejb.connection.InjectedDataSourceConnectionProvider
Database name is: H2 databaseMajorVersion is: 1
2018-07-30 02:48:10 INFO  Dialect:130 - HHH000400: Using dialect: org.hibernate.dialect.H2Dialect
2018-07-30 02:48:10 INFO  TransactionFactoryInitiator:73 - HHH000268: Transaction strategy: org.hibernate.engine.transaction.internal.jdbc.JdbcTransactionFactory
2018-07-30 02:48:11 INFO  ASTQueryTranslatorFactory:48 - HHH000397: Using ASTQueryTranslatorFactory
2018-07-30 02:48:11 INFO  Version:27 - HV000001: Hibernate Validator 4.3.0.Final
2018-07-30 02:48:11 INFO  SchemaValidator:137 - HHH000229: Running schema validator
2018-07-30 02:48:11 INFO  SchemaValidator:145 - HHH000102: Fetching database metadata
2018-07-30 02:48:11 INFO  TableMetadata:66 - HHH000261: Table found: TESTDB.PUBLIC.OO_EXECUTION_STATE
2018-07-30 02:48:11 INFO  TableMetadata:67 - HHH000037: Columns: [execution_id, branch_id, execution_object, id, status]
2018-07-30 02:48:11 INFO  TableMetadata:66 - HHH000261: Table found: TESTDB.PUBLIC.OO_FINISHED_BRANCHES
2018-07-30 02:48:11 INFO  TableMetadata:67 - HHH000037: Columns: [execution_id, suspended_execution_id, branch_id, split_id, id, branch_exception, branch_context]
2018-07-30 02:48:11 INFO  TableMetadata:66 - HHH000261: Table found: TESTDB.PUBLIC.OO_PARTITION_GROUPS
2018-07-30 02:48:11 INFO  TableMetadata:67 - HHH000037: Columns: [group_size, active_partition, time_threshold, name, size_threshold, last_roll_time, id]
2018-07-30 02:48:11 INFO  TableMetadata:66 - HHH000261: Table found: TESTDB.PUBLIC.OO_RUNNING_EXECUTION_PLANS
2018-07-30 02:48:11 INFO  TableMetadata:67 - HHH000037: Columns: [result, execution_plan_zipped, execution_plan, id, uuid]
2018-07-30 02:48:11 INFO  TableMetadata:66 - HHH000261: Table found: TESTDB.PUBLIC.OO_SUSPENDED_EXECUTIONS
2018-07-30 02:48:11 INFO  TableMetadata:67 - HHH000037: Columns: [execution_id, execution_object, split_id, id, number_of_branches]
2018-07-30 02:48:11 INFO  TableMetadata:66 - HHH000261: Table found: TESTDB.PUBLIC.OO_VERSION_COUNTERS
2018-07-30 02:48:11 INFO  TableMetadata:67 - HHH000037: Columns: [counter_version, counter_name, id]
2018-07-30 02:48:11 INFO  TableMetadata:66 - HHH000261: Table found: TESTDB.PUBLIC.OO_WORKER_GROUPS
2018-07-30 02:48:11 INFO  TableMetadata:67 - HHH000037: Columns: [group_name, worker_id]
2018-07-30 02:48:11 INFO  TableMetadata:66 - HHH000261: Table found: TESTDB.PUBLIC.OO_WORKER_LOCKS
2018-07-30 02:48:11 INFO  TableMetadata:67 - HHH000037: Columns: [id, uuid]
2018-07-30 02:48:11 INFO  TableMetadata:66 - HHH000261: Table found: TESTDB.PUBLIC.OO_WORKER_NODES
2018-07-30 02:48:11 INFO  TableMetadata:67 - HHH000037: Columns: [jvm, ack_time, is_active, os, install_path, description, uuid, ack_version, dot_net_version, password, is_deleted, bulk_number, wrv, id, host_name, status]
2018-07-30 02:48:12 INFO  PartitionTemplateImpl:153 - Registering callback class ExecutionStatesCallback for partition group [null]
2018-07-30 02:48:12 INFO  PartitionServiceImpl:50 - Partition group [OO_EXECUTION_STATES] was created, with group size 2, and timeThreshold -1, and sizeThreshold 50000
2018-07-30 02:48:13 INFO  ThreadPoolTaskScheduler:165 - Initializing ExecutorService  'scoreOrchestratorScheduler'
2018-07-30 02:48:13 INFO  OutboundBufferImpl:64 - maxBufferWeight = 60000
2018-07-30 02:48:13 INFO  InBuffer:79 - InBuffer capacity is set to :500, coolDownPollingMillis is set to :200
2018-07-30 02:48:13 INFO  WorkerManager:80 - Initialize worker with UUID: -1
2018-07-30 02:48:13 INFO  WorkerRegistration:57 - Registering worker -1
2018-07-30 02:48:13 INFO  WorkerRegistration:63 - Creating worker...
2018-07-30 02:48:13 INFO  WorkerRegistration:66 - Worker [-1] registered and activated
2018-07-30 02:48:13 INFO  ThreadPoolTaskScheduler:165 - Initializing ExecutorService  'scoreWorkerScheduler'
2018-07-30 02:48:18 WARN  WorkerRecoveryServiceImpl:126 - Worker [-1] is up and will be recovered
2018-07-30 02:48:18 INFO  WorkerExecutionMonitorServiceImpl:41 - Collecting Worker Monitors
2018-07-30 02:48:18 INFO  WorkerExecutionMonitorServiceImpl:44 - Sending Worker Monitors Info to central:[{RUNNING_TASKS_AVERAGE=0, MONITOR_END_TIME=1532911698451, INBUFFER_SIZE_AVERAGE=0, MONITOR_START_TIME=1532911693671, FREE_MOMORY=170970640, WROKER_ID=-1, OUTBUDDER_SIZE_AVERAGE=0, MAX_MOMORY=3741319168, INBUFFER_CAPACITY=500, TOTAL_MEMORY=517996544, EXECUTION_THREADS_AMOUNT=20, OUTBUFFER_CAPACITY=60000}]
2018-07-30 02:48:18 WARN  WorkerRecoveryServiceImpl:92 - Worker [-1] is going to be recovered
2018-07-30 02:48:18 WARN  WorkerRecoveryServiceImpl:108 - Worker [-1] recovery id done in 66 ms
2018-07-30 02:48:18 INFO  WorkerManager:176 - Worker is up
1
default value
2
default value
3
default value
1
default value
2
default value
abc
default value
1
2
2018-07-30 02:48:23 ERROR ExecutionServiceImpl:100 - Error during execution: 
java.lang.NullPointerException
	at org.openscore.events.EventBusImpl.dispatch(EventBusImpl.java:38)
	at org.openscore.worker.execution.services.ExecutionServiceImpl.dumpBusEvents(ExecutionServiceImpl.java:283)
	at org.openscore.worker.execution.services.ExecutionServiceImpl.execute(ExecutionServiceImpl.java:90)
	at org.openscore.worker.management.services.SimpleExecutionRunnable.executeRegularStep(SimpleExecutionRunnable.java:147)
	at org.openscore.worker.management.services.SimpleExecutionRunnable.run(SimpleExecutionRunnable.java:111)
	at java.util.concurrent.Executors$RunnableAdapter.call(Executors.java:511)
	at java.util.concurrent.FutureTask.run(FutureTask.java:266)
	at java.util.concurrent.ThreadPoolExecutor.runWorker(ThreadPoolExecutor.java:1142)
	at java.util.concurrent.ThreadPoolExecutor$Worker.run(ThreadPoolExecutor.java:617)
	at org.openscore.worker.management.services.WorkerThreadFactory$1.run(WorkerThreadFactory.java:33)
	at java.lang.Thread.run(Thread.java:745)
0
1
2
1
2
abc
default value
peter
three
john
1
jane
2
peter
three
john
1
jane
2
abc
default value
three
1
2
three
1
2
three
1
2
abc
default value
Tests run: 10, Failures: 3, Errors: 0, Skipped: 0, Time elapsed: 20.204 sec <<< FAILURE! - in org.openscore.lang.systemtests.LoopFlowsTest
testFlowWithMapLoops(org.openscore.lang.systemtests.LoopFlowsTest)  Time elapsed: 0.455 sec  <<< FAILURE!
java.lang.AssertionError: null
	at org.junit.Assert.fail(Assert.java:92)
	at org.junit.Assert.assertTrue(Assert.java:43)
	at org.junit.Assert.assertTrue(Assert.java:54)
	at org.openscore.lang.systemtests.LoopFlowsTest.testFlowWithMapLoops(LoopFlowsTest.java:122)

testFlowWithMapLoopsWithDefaultBreak(org.openscore.lang.systemtests.LoopFlowsTest)  Time elapsed: 0.16 sec  <<< FAILURE!
java.lang.AssertionError: expected:<2> but was:<3>
	at org.junit.Assert.fail(Assert.java:93)
	at org.junit.Assert.failNotEquals(Assert.java:647)
	at org.junit.Assert.assertEquals(Assert.java:128)
	at org.junit.Assert.assertEquals(Assert.java:472)
	at org.junit.Assert.assertEquals(Assert.java:456)
	at org.openscore.lang.systemtests.LoopFlowsTest.testFlowWithMapLoopsWithDefaultBreak(LoopFlowsTest.java:152)

testFlowWithMapLoopsWithBreak(org.openscore.lang.systemtests.LoopFlowsTest)  Time elapsed: 0.305 sec  <<< FAILURE!
java.lang.AssertionError: expected:<3> but was:<4>
	at org.junit.Assert.fail(Assert.java:93)
	at org.junit.Assert.failNotEquals(Assert.java:647)
	at org.junit.Assert.assertEquals(Assert.java:128)
	at org.junit.Assert.assertEquals(Assert.java:472)
	at org.junit.Assert.assertEquals(Assert.java:456)
	at org.openscore.lang.systemtests.LoopFlowsTest.testFlowWithMapLoopsWithBreak(LoopFlowsTest.java:181)

Running org.openscore.lang.systemtests.OperationSystemTest
2018-07-30 02:48:25 INFO  TestContextManager:242 - Could not instantiate TestExecutionListener [org.springframework.test.context.web.ServletTestExecutionListener]. Specify custom listener classes or make the default listener classes (and their required dependencies) available. Offending class: [org/springframework/web/context/request/RequestAttributes]
hello world
454
value1
new input
value2
value3
value4
value5
6
2018-07-30 02:48:26 ERROR ExecutableSteps:89 - There was an error running the start executable execution step of: 'test_op_2'. Error is: Input with name: 'input1' is Required, but value is empty
2018-07-30 02:48:26 ERROR ReflectionAdapterImpl:72 - Failed to run the action! Class: org.openscore.lang.runtime.steps.ExecutableSteps, method: startExecutable, reason: Error running: 'test_op_2': Input with name: 'input1' is Required, but value is empty
java.lang.reflect.InvocationTargetException
	at sun.reflect.GeneratedMethodAccessor64.invoke(Unknown Source)
	at sun.reflect.DelegatingMethodAccessorImpl.invoke(DelegatingMethodAccessorImpl.java:43)
	at java.lang.reflect.Method.invoke(Method.java:498)
	at org.openscore.worker.execution.reflection.ReflectionAdapterImpl.executeControlAction(ReflectionAdapterImpl.java:62)
	at org.openscore.worker.execution.services.ExecutionServiceImpl.executeStep(ExecutionServiceImpl.java:316)
	at org.openscore.worker.execution.services.ExecutionServiceImpl.execute(ExecutionServiceImpl.java:78)
	at org.openscore.worker.management.services.SimpleExecutionRunnable.executeRegularStep(SimpleExecutionRunnable.java:147)
	at org.openscore.worker.management.services.SimpleExecutionRunnable.run(SimpleExecutionRunnable.java:111)
	at java.util.concurrent.Executors$RunnableAdapter.call(Executors.java:511)
	at java.util.concurrent.FutureTask.run(FutureTask.java:266)
	at java.util.concurrent.ThreadPoolExecutor.runWorker(ThreadPoolExecutor.java:1142)
	at java.util.concurrent.ThreadPoolExecutor$Worker.run(ThreadPoolExecutor.java:617)
	at org.openscore.worker.management.services.WorkerThreadFactory$1.run(WorkerThreadFactory.java:33)
	at java.lang.Thread.run(Thread.java:745)
Caused by: java.lang.RuntimeException: Error running: 'test_op_2': Input with name: 'input1' is Required, but value is empty
	at org.openscore.lang.runtime.steps.ExecutableSteps.startExecutable(ExecutableSteps.java:90)
	... 14 more
Caused by: java.lang.RuntimeException: Input with name: 'input1' is Required, but value is empty
	at org.openscore.lang.runtime.bindings.InputsBinding.bindInput(InputsBinding.java:58)
	at org.openscore.lang.runtime.bindings.InputsBinding.bindInputs(InputsBinding.java:41)
	at org.openscore.lang.runtime.steps.ExecutableSteps.startExecutable(ExecutableSteps.java:67)
	... 14 more
2018-07-30 02:48:26 ERROR ExecutionServiceImpl:323 - Error occurred during operation execution.  Execution id: 101600082
org.openscore.exceptions.FlowExecutionException: Error running: 'test_op_2': Input with name: 'input1' is Required, but value is empty
	at org.openscore.worker.execution.reflection.ReflectionAdapterImpl.executeControlAction(ReflectionAdapterImpl.java:73)
	at org.openscore.worker.execution.services.ExecutionServiceImpl.executeStep(ExecutionServiceImpl.java:316)
	at org.openscore.worker.execution.services.ExecutionServiceImpl.execute(ExecutionServiceImpl.java:78)
	at org.openscore.worker.management.services.SimpleExecutionRunnable.executeRegularStep(SimpleExecutionRunnable.java:147)
	at org.openscore.worker.management.services.SimpleExecutionRunnable.run(SimpleExecutionRunnable.java:111)
	at java.util.concurrent.Executors$RunnableAdapter.call(Executors.java:511)
	at java.util.concurrent.FutureTask.run(FutureTask.java:266)
	at java.util.concurrent.ThreadPoolExecutor.runWorker(ThreadPoolExecutor.java:1142)
	at java.util.concurrent.ThreadPoolExecutor$Worker.run(ThreadPoolExecutor.java:617)
	at org.openscore.worker.management.services.WorkerThreadFactory$1.run(WorkerThreadFactory.java:33)
	at java.lang.Thread.run(Thread.java:745)
Caused by: java.lang.reflect.InvocationTargetException
	at sun.reflect.GeneratedMethodAccessor64.invoke(Unknown Source)
	at sun.reflect.DelegatingMethodAccessorImpl.invoke(DelegatingMethodAccessorImpl.java:43)
	at java.lang.reflect.Method.invoke(Method.java:498)
	at org.openscore.worker.execution.reflection.ReflectionAdapterImpl.executeControlAction(ReflectionAdapterImpl.java:62)
	... 10 more
Caused by: java.lang.RuntimeException: Error running: 'test_op_2': Input with name: 'input1' is Required, but value is empty
	at org.openscore.lang.runtime.steps.ExecutableSteps.startExecutable(ExecutableSteps.java:90)
	... 14 more
Caused by: java.lang.RuntimeException: Input with name: 'input1' is Required, but value is empty
	at org.openscore.lang.runtime.bindings.InputsBinding.bindInput(InputsBinding.java:58)
	at org.openscore.lang.runtime.bindings.InputsBinding.bindInputs(InputsBinding.java:41)
	at org.openscore.lang.runtime.steps.ExecutableSteps.startExecutable(ExecutableSteps.java:67)
	... 14 more
http://localhost:8080
please print it
Tests run: 5, Failures: 0, Errors: 0, Skipped: 0, Time elapsed: 1.058 sec - in org.openscore.lang.systemtests.OperationSystemTest
Running org.openscore.lang.systemtests.SimpleFlowTest
2018-07-30 02:48:26 INFO  TestContextManager:242 - Could not instantiate TestExecutionListener [org.springframework.test.context.web.ServletTestExecutionListener]. Specify custom listener classes or make the default listener classes (and their required dependencies) available. Offending class: [org/springframework/web/context/request/RequestAttributes]
2018-07-30 02:48:26 ERROR SlangImpl:69 - Failed compilation for source : flow_with_missing_navigation_from_op_result.sl ,Exception is : Cannot compile flow: 'basic_flow' since for task: 'Task1', the result 'CUSTOM' of its dependency: 'user.ops.print_custom_result_op' has no matching navigation
time zone is: 2
daylight time zone is: 3
time zone is: -999
2018-07-30 02:48:27 ERROR ExecutableSteps:89 - There was an error running the start executable execution step of: 'simple_flow'. Error is: Input with name: 'input1' is Required, but value is empty
2018-07-30 02:48:27 ERROR ReflectionAdapterImpl:72 - Failed to run the action! Class: org.openscore.lang.runtime.steps.ExecutableSteps, method: startExecutable, reason: Error running: 'simple_flow': Input with name: 'input1' is Required, but value is empty
java.lang.reflect.InvocationTargetException
	at sun.reflect.GeneratedMethodAccessor64.invoke(Unknown Source)
	at sun.reflect.DelegatingMethodAccessorImpl.invoke(DelegatingMethodAccessorImpl.java:43)
	at java.lang.reflect.Method.invoke(Method.java:498)
	at org.openscore.worker.execution.reflection.ReflectionAdapterImpl.executeControlAction(ReflectionAdapterImpl.java:62)
	at org.openscore.worker.execution.services.ExecutionServiceImpl.executeStep(ExecutionServiceImpl.java:316)
	at org.openscore.worker.execution.services.ExecutionServiceImpl.execute(ExecutionServiceImpl.java:78)
	at org.openscore.worker.management.services.SimpleExecutionRunnable.executeRegularStep(SimpleExecutionRunnable.java:147)
	at org.openscore.worker.management.services.SimpleExecutionRunnable.run(SimpleExecutionRunnable.java:111)
	at java.util.concurrent.Executors$RunnableAdapter.call(Executors.java:511)
	at java.util.concurrent.FutureTask.run(FutureTask.java:266)
	at java.util.concurrent.ThreadPoolExecutor.runWorker(ThreadPoolExecutor.java:1142)
	at java.util.concurrent.ThreadPoolExecutor$Worker.run(ThreadPoolExecutor.java:617)
	at org.openscore.worker.management.services.WorkerThreadFactory$1.run(WorkerThreadFactory.java:33)
	at java.lang.Thread.run(Thread.java:745)
Caused by: java.lang.RuntimeException: Error running: 'simple_flow': Input with name: 'input1' is Required, but value is empty
	at org.openscore.lang.runtime.steps.ExecutableSteps.startExecutable(ExecutableSteps.java:90)
	... 14 more
Caused by: java.lang.RuntimeException: Input with name: 'input1' is Required, but value is empty
	at org.openscore.lang.runtime.bindings.InputsBinding.bindInput(InputsBinding.java:58)
	at org.openscore.lang.runtime.bindings.InputsBinding.bindInputs(InputsBinding.java:41)
	at org.openscore.lang.runtime.steps.ExecutableSteps.startExecutable(ExecutableSteps.java:67)
	... 14 more
2018-07-30 02:48:27 ERROR ExecutionServiceImpl:323 - Error occurred during operation execution.  Execution id: 101600117
org.openscore.exceptions.FlowExecutionException: Error running: 'simple_flow': Input with name: 'input1' is Required, but value is empty
	at org.openscore.worker.execution.reflection.ReflectionAdapterImpl.executeControlAction(ReflectionAdapterImpl.java:73)
	at org.openscore.worker.execution.services.ExecutionServiceImpl.executeStep(ExecutionServiceImpl.java:316)
	at org.openscore.worker.execution.services.ExecutionServiceImpl.execute(ExecutionServiceImpl.java:78)
	at org.openscore.worker.management.services.SimpleExecutionRunnable.executeRegularStep(SimpleExecutionRunnable.java:147)
	at org.openscore.worker.management.services.SimpleExecutionRunnable.run(SimpleExecutionRunnable.java:111)
	at java.util.concurrent.Executors$RunnableAdapter.call(Executors.java:511)
	at java.util.concurrent.FutureTask.run(FutureTask.java:266)
	at java.util.concurrent.ThreadPoolExecutor.runWorker(ThreadPoolExecutor.java:1142)
	at java.util.concurrent.ThreadPoolExecutor$Worker.run(ThreadPoolExecutor.java:617)
	at org.openscore.worker.management.services.WorkerThreadFactory$1.run(WorkerThreadFactory.java:33)
	at java.lang.Thread.run(Thread.java:745)
Caused by: java.lang.reflect.InvocationTargetException
	at sun.reflect.GeneratedMethodAccessor64.invoke(Unknown Source)
	at sun.reflect.DelegatingMethodAccessorImpl.invoke(DelegatingMethodAccessorImpl.java:43)
	at java.lang.reflect.Method.invoke(Method.java:498)
	at org.openscore.worker.execution.reflection.ReflectionAdapterImpl.executeControlAction(ReflectionAdapterImpl.java:62)
	... 10 more
Caused by: java.lang.RuntimeException: Error running: 'simple_flow': Input with name: 'input1' is Required, but value is empty
	at org.openscore.lang.runtime.steps.ExecutableSteps.startExecutable(ExecutableSteps.java:90)
	... 14 more
Caused by: java.lang.RuntimeException: Input with name: 'input1' is Required, but value is empty
	at org.openscore.lang.runtime.bindings.InputsBinding.bindInput(InputsBinding.java:58)
	at org.openscore.lang.runtime.bindings.InputsBinding.bindInputs(InputsBinding.java:41)
	at org.openscore.lang.runtime.steps.ExecutableSteps.startExecutable(ExecutableSteps.java:67)
	... 14 more
2018-07-30 02:48:27 ERROR ExecutableSteps:89 - There was an error running the start executable execution step of: 'simple_flow'. Error is: Input with name: 'host' is Required, but value is empty
2018-07-30 02:48:27 ERROR ReflectionAdapterImpl:72 - Failed to run the action! Class: org.openscore.lang.runtime.steps.ExecutableSteps, method: startExecutable, reason: Error running: 'simple_flow': Input with name: 'host' is Required, but value is empty
java.lang.reflect.InvocationTargetException
	at sun.reflect.GeneratedMethodAccessor64.invoke(Unknown Source)
	at sun.reflect.DelegatingMethodAccessorImpl.invoke(DelegatingMethodAccessorImpl.java:43)
	at java.lang.reflect.Method.invoke(Method.java:498)
	at org.openscore.worker.execution.reflection.ReflectionAdapterImpl.executeControlAction(ReflectionAdapterImpl.java:62)
	at org.openscore.worker.execution.services.ExecutionServiceImpl.executeStep(ExecutionServiceImpl.java:316)
	at org.openscore.worker.execution.services.ExecutionServiceImpl.execute(ExecutionServiceImpl.java:78)
	at org.openscore.worker.management.services.SimpleExecutionRunnable.executeRegularStep(SimpleExecutionRunnable.java:147)
	at org.openscore.worker.management.services.SimpleExecutionRunnable.run(SimpleExecutionRunnable.java:111)
	at java.util.concurrent.Executors$RunnableAdapter.call(Executors.java:511)
	at java.util.concurrent.FutureTask.run(FutureTask.java:266)
	at java.util.concurrent.ThreadPoolExecutor.runWorker(ThreadPoolExecutor.java:1142)
	at java.util.concurrent.ThreadPoolExecutor$Worker.run(ThreadPoolExecutor.java:617)
	at org.openscore.worker.management.services.WorkerThreadFactory$1.run(WorkerThreadFactory.java:33)
	at java.lang.Thread.run(Thread.java:745)
Caused by: java.lang.RuntimeException: Error running: 'simple_flow': Input with name: 'host' is Required, but value is empty
	at org.openscore.lang.runtime.steps.ExecutableSteps.startExecutable(ExecutableSteps.java:90)
	... 14 more
Caused by: java.lang.RuntimeException: Input with name: 'host' is Required, but value is empty
	at org.openscore.lang.runtime.bindings.InputsBinding.bindInput(InputsBinding.java:58)
	at org.openscore.lang.runtime.bindings.InputsBinding.bindInputs(InputsBinding.java:41)
	at org.openscore.lang.runtime.steps.ExecutableSteps.startExecutable(ExecutableSteps.java:67)
	... 14 more
2018-07-30 02:48:27 ERROR ExecutionServiceImpl:323 - Error occurred during operation execution.  Execution id: 101600124
org.openscore.exceptions.FlowExecutionException: Error running: 'simple_flow': Input with name: 'host' is Required, but value is empty
	at org.openscore.worker.execution.reflection.ReflectionAdapterImpl.executeControlAction(ReflectionAdapterImpl.java:73)
	at org.openscore.worker.execution.services.ExecutionServiceImpl.executeStep(ExecutionServiceImpl.java:316)
	at org.openscore.worker.execution.services.ExecutionServiceImpl.execute(ExecutionServiceImpl.java:78)
	at org.openscore.worker.management.services.SimpleExecutionRunnable.executeRegularStep(SimpleExecutionRunnable.java:147)
	at org.openscore.worker.management.services.SimpleExecutionRunnable.run(SimpleExecutionRunnable.java:111)
	at java.util.concurrent.Executors$RunnableAdapter.call(Executors.java:511)
	at java.util.concurrent.FutureTask.run(FutureTask.java:266)
	at java.util.concurrent.ThreadPoolExecutor.runWorker(ThreadPoolExecutor.java:1142)
	at java.util.concurrent.ThreadPoolExecutor$Worker.run(ThreadPoolExecutor.java:617)
	at org.openscore.worker.management.services.WorkerThreadFactory$1.run(WorkerThreadFactory.java:33)
	at java.lang.Thread.run(Thread.java:745)
Caused by: java.lang.reflect.InvocationTargetException
	at sun.reflect.GeneratedMethodAccessor64.invoke(Unknown Source)
	at sun.reflect.DelegatingMethodAccessorImpl.invoke(DelegatingMethodAccessorImpl.java:43)
	at java.lang.reflect.Method.invoke(Method.java:498)
	at org.openscore.worker.execution.reflection.ReflectionAdapterImpl.executeControlAction(ReflectionAdapterImpl.java:62)
	... 10 more
Caused by: java.lang.RuntimeException: Error running: 'simple_flow': Input with name: 'host' is Required, but value is empty
	at org.openscore.lang.runtime.steps.ExecutableSteps.startExecutable(ExecutableSteps.java:90)
	... 14 more
Caused by: java.lang.RuntimeException: Input with name: 'host' is Required, but value is empty
	at org.openscore.lang.runtime.bindings.InputsBinding.bindInput(InputsBinding.java:58)
	at org.openscore.lang.runtime.bindings.InputsBinding.bindInputs(InputsBinding.java:41)
	at org.openscore.lang.runtime.steps.ExecutableSteps.startExecutable(ExecutableSteps.java:67)
	... 14 more
2018-07-30 02:48:27 ERROR TaskSteps:131 - There was an error running the begin task execution step of: 'Task1'. Error is: Input with name: 'port' is Required, but value is empty
2018-07-30 02:48:27 ERROR ReflectionAdapterImpl:72 - Failed to run the action! Class: org.openscore.lang.runtime.steps.TaskSteps, method: beginTask, reason: Error running: Task1: Input with name: 'port' is Required, but value is empty
java.lang.reflect.InvocationTargetException
	at sun.reflect.GeneratedMethodAccessor72.invoke(Unknown Source)
	at sun.reflect.DelegatingMethodAccessorImpl.invoke(DelegatingMethodAccessorImpl.java:43)
	at java.lang.reflect.Method.invoke(Method.java:498)
	at org.openscore.worker.execution.reflection.ReflectionAdapterImpl.executeControlAction(ReflectionAdapterImpl.java:62)
	at org.openscore.worker.execution.services.ExecutionServiceImpl.executeStep(ExecutionServiceImpl.java:316)
	at org.openscore.worker.execution.services.ExecutionServiceImpl.execute(ExecutionServiceImpl.java:78)
	at org.openscore.worker.management.services.SimpleExecutionRunnable.executeRegularStep(SimpleExecutionRunnable.java:147)
	at org.openscore.worker.management.services.SimpleExecutionRunnable.run(SimpleExecutionRunnable.java:111)
	at java.util.concurrent.Executors$RunnableAdapter.call(Executors.java:511)
	at java.util.concurrent.FutureTask.run(FutureTask.java:266)
	at java.util.concurrent.ThreadPoolExecutor.runWorker(ThreadPoolExecutor.java:1142)
	at java.util.concurrent.ThreadPoolExecutor$Worker.run(ThreadPoolExecutor.java:617)
	at org.openscore.worker.management.services.WorkerThreadFactory$1.run(WorkerThreadFactory.java:33)
	at java.lang.Thread.run(Thread.java:745)
Caused by: java.lang.RuntimeException: Error running: Task1: Input with name: 'port' is Required, but value is empty
	at org.openscore.lang.runtime.steps.TaskSteps.beginTask(TaskSteps.java:132)
	... 14 more
Caused by: java.lang.RuntimeException: Input with name: 'port' is Required, but value is empty
	at org.openscore.lang.runtime.bindings.InputsBinding.bindInput(InputsBinding.java:58)
	at org.openscore.lang.runtime.bindings.InputsBinding.bindInputs(InputsBinding.java:41)
	at org.openscore.lang.runtime.steps.TaskSteps.beginTask(TaskSteps.java:116)
	... 14 more
2018-07-30 02:48:27 ERROR ExecutionServiceImpl:323 - Error occurred during operation execution.  Execution id: 101600131
org.openscore.exceptions.FlowExecutionException: Error running: Task1: Input with name: 'port' is Required, but value is empty
	at org.openscore.worker.execution.reflection.ReflectionAdapterImpl.executeControlAction(ReflectionAdapterImpl.java:73)
	at org.openscore.worker.execution.services.ExecutionServiceImpl.executeStep(ExecutionServiceImpl.java:316)
	at org.openscore.worker.execution.services.ExecutionServiceImpl.execute(ExecutionServiceImpl.java:78)
	at org.openscore.worker.management.services.SimpleExecutionRunnable.executeRegularStep(SimpleExecutionRunnable.java:147)
	at org.openscore.worker.management.services.SimpleExecutionRunnable.run(SimpleExecutionRunnable.java:111)
	at java.util.concurrent.Executors$RunnableAdapter.call(Executors.java:511)
	at java.util.concurrent.FutureTask.run(FutureTask.java:266)
	at java.util.concurrent.ThreadPoolExecutor.runWorker(ThreadPoolExecutor.java:1142)
	at java.util.concurrent.ThreadPoolExecutor$Worker.run(ThreadPoolExecutor.java:617)
	at org.openscore.worker.management.services.WorkerThreadFactory$1.run(WorkerThreadFactory.java:33)
	at java.lang.Thread.run(Thread.java:745)
Caused by: java.lang.reflect.InvocationTargetException
	at sun.reflect.GeneratedMethodAccessor72.invoke(Unknown Source)
	at sun.reflect.DelegatingMethodAccessorImpl.invoke(DelegatingMethodAccessorImpl.java:43)
	at java.lang.reflect.Method.invoke(Method.java:498)
	at org.openscore.worker.execution.reflection.ReflectionAdapterImpl.executeControlAction(ReflectionAdapterImpl.java:62)
	... 10 more
Caused by: java.lang.RuntimeException: Error running: Task1: Input with name: 'port' is Required, but value is empty
	at org.openscore.lang.runtime.steps.TaskSteps.beginTask(TaskSteps.java:132)
	... 14 more
Caused by: java.lang.RuntimeException: Input with name: 'port' is Required, but value is empty
	at org.openscore.lang.runtime.bindings.InputsBinding.bindInput(InputsBinding.java:58)
	at org.openscore.lang.runtime.bindings.InputsBinding.bindInputs(InputsBinding.java:41)
	at org.openscore.lang.runtime.steps.TaskSteps.beginTask(TaskSteps.java:116)
	... 14 more
Tests run: 7, Failures: 0, Errors: 0, Skipped: 0, Time elapsed: 1.464 sec - in org.openscore.lang.systemtests.SimpleFlowTest
Running org.openscore.lang.systemtests.SubFlowSystemTest
2018-07-30 02:48:28 INFO  TestContextManager:242 - Could not instantiate TestExecutionListener [org.springframework.test.context.web.ServletTestExecutionListener]. Specify custom listener classes or make the default listener classes (and their required dependencies) available. Offending class: [org/springframework/web/context/request/RequestAttributes]
Tests run: 1, Failures: 0, Errors: 0, Skipped: 0, Time elapsed: 0.058 sec - in org.openscore.lang.systemtests.SubFlowSystemTest
Running org.openscore.lang.systemtests.flows.DataFlowTest
2018-07-30 02:48:28 INFO  TestContextManager:242 - Could not instantiate TestExecutionListener [org.springframework.test.context.web.ServletTestExecutionListener]. Specify custom listener classes or make the default listener classes (and their required dependencies) available. Offending class: [org/springframework/web/context/request/RequestAttributes]
value1
time zone is: 22
hello world
Tests run: 3, Failures: 0, Errors: 2, Skipped: 0, Time elapsed: 0.406 sec <<< FAILURE! - in org.openscore.lang.systemtests.flows.DataFlowTest
testDataFlow(org.openscore.lang.systemtests.flows.DataFlowTest)  Time elapsed: 0.093 sec  <<< ERROR!
java.lang.NullPointerException: null
	at org.openscore.lang.systemtests.RunDataAggregatorListener.buildStepData(RunDataAggregatorListener.java:71)
	at org.openscore.lang.systemtests.RunDataAggregatorListener.aggregate(RunDataAggregatorListener.java:52)
	at org.openscore.lang.systemtests.TriggerFlows.runWithData(TriggerFlows.java:70)
	at org.openscore.lang.systemtests.SystemsTestsParent.triggerWithData(SystemsTestsParent.java:47)
	at org.openscore.lang.systemtests.flows.DataFlowTest.testDataFlow(DataFlowTest.java:50)

testBindingsFlowIntegers(org.openscore.lang.systemtests.flows.DataFlowTest)  Time elapsed: 0.12 sec  <<< ERROR!
java.lang.NullPointerException: null
	at org.openscore.lang.systemtests.flows.DataFlowTest.testBindingsFlowIntegers(DataFlowTest.java:97)

Running org.openscore.lang.systemtests.flows.NavigationTest
2018-07-30 02:48:28 INFO  TestContextManager:242 - Could not instantiate TestExecutionListener [org.springframework.test.context.web.ServletTestExecutionListener]. Specify custom listener classes or make the default listener classes (and their required dependencies) available. Offending class: [org/springframework/web/context/request/RequestAttributes]
Even number processed. Result= 68
Odd number processed. Result= 39
Send email mock
hostname: emailHost
port: 25
sender: user@host.com
recipient: user@host.com
subject: Flow failure
body: Wrong number: 1024
Producing default navigation based on input
AwesomeCity
Producing default navigation based on input
Send email mock
hostname: emailHost
port: 25
sender: user@host.com
recipient: user@host.com
subject: Flow failure
body: Default failure navigation here
Tests run: 5, Failures: 0, Errors: 1, Skipped: 0, Time elapsed: 0.978 sec <<< FAILURE! - in org.openscore.lang.systemtests.flows.NavigationTest
testComplexNavigationEvenNumber(org.openscore.lang.systemtests.flows.NavigationTest)  Time elapsed: 0.072 sec  <<< ERROR!
java.lang.NullPointerException: null
	at org.openscore.lang.systemtests.RunDataAggregatorListener.buildStepData(RunDataAggregatorListener.java:71)
	at org.openscore.lang.systemtests.RunDataAggregatorListener.aggregate(RunDataAggregatorListener.java:52)
	at org.openscore.lang.systemtests.TriggerFlows.runWithData(TriggerFlows.java:70)
	at org.openscore.lang.systemtests.SystemsTestsParent.triggerWithData(SystemsTestsParent.java:47)
	at org.openscore.lang.systemtests.flows.NavigationTest.testComplexNavigationEvenNumber(NavigationTest.java:54)

2018-07-30 02:48:29 INFO  GenericApplicationContext:875 - Closing org.springframework.context.support.GenericApplicationContext@60c6f5b: startup date [Mon Jul 30 02:48:07 CEST 2018]; root of context hierarchy
2018-07-30 02:48:29 INFO  WorkerManager:204 - The worker is down
2018-07-30 02:48:29 INFO  ThreadPoolTaskScheduler:203 - Shutting down ExecutorService 'scoreWorkerScheduler'
2018-07-30 02:48:29 INFO  ThreadPoolTaskScheduler:203 - Shutting down ExecutorService 'scoreOrchestratorScheduler'
2018-07-30 02:48:29 INFO  LocalContainerEntityManagerFactoryBean:462 - Closing JPA EntityManagerFactory for persistence unit 'default'

Results :

Failed tests: 
  LoopFlowsTest.testFlowWithMapLoops:122 null
  LoopFlowsTest.testFlowWithMapLoopsWithDefaultBreak:152 expected:<2> but was:<3>
  LoopFlowsTest.testFlowWithMapLoopsWithBreak:181 expected:<3> but was:<4>

Tests in error: 
  DataFlowTest.testDataFlow:50->SystemsTestsParent.triggerWithData:47  NullPointer
  DataFlowTest.testBindingsFlowIntegers:97 NullPointer
  NavigationTest.testComplexNavigationEvenNumber:54->SystemsTestsParent.triggerWithData:47  NullPointer

Tests run: 31, Failures: 3, Errors: 3, Skipped: 0

[INFO] ------------------------------------------------------------------------
[INFO] Reactor Summary:
[INFO] 
[INFO] io.openscore.lang:score-language ................... SUCCESS [  0.946 s]
[INFO] score-lang-entities ................................ SUCCESS [  7.754 s]
[INFO] score-lang-runtime ................................. SUCCESS [ 14.816 s]
[INFO] score-lang-compiler ................................ SUCCESS [  4.709 s]
[INFO] score-lang-api ..................................... SUCCESS [  2.482 s]
[INFO] score-lang-cli ..................................... SUCCESS [ 10.050 s]
[INFO] score-language-tests ............................... FAILURE [ 25.248 s]
[INFO] score-lang-content-verifier ........................ SKIPPED
[INFO] ------------------------------------------------------------------------
[INFO] BUILD FAILURE
[INFO] ------------------------------------------------------------------------
[INFO] Total time: 01:06 min
[INFO] Finished at: 2018-07-30T02:48:29+02:00
[INFO] Final Memory: 42M/394M
[INFO] ------------------------------------------------------------------------
[ERROR] Failed to execute goal org.apache.maven.plugins:maven-surefire-plugin:2.15:test (default-test) on project score-language-tests: There are test failures.
[ERROR] 
[ERROR] Please refer to /root/workspace/leusonmario/cloud-slang/409657807/score-language-tests/target/surefire-reports for the individual test results.
[ERROR] -> [Help 1]
[ERROR] 
[ERROR] To see the full stack trace of the errors, re-run Maven with the -e switch.
[ERROR] Re-run Maven using the -X switch to enable full debug logging.
[ERROR] 
[ERROR] For more information about the errors and possible solutions, please read the following articles:
[ERROR] [Help 1] http://cwiki.apache.org/confluence/display/MAVEN/MojoFailureException
[ERROR] 
[ERROR] After correcting the problems, you can resume the build with the command
[ERROR]   mvn <goals> -rf :score-language-tests
