[INFO] Scanning for projects...
[INFO] Inspecting build with total of 1 modules...
[INFO] Installing Nexus Staging features:
[INFO]   ... total of 1 executions of maven-deploy-plugin replaced with nexus-staging-maven-plugin
[INFO]                                                                         
[INFO] ------------------------------------------------------------------------
[INFO] Building Spoon Core 6.0.0-SNAPSHOT
[INFO] ------------------------------------------------------------------------
[INFO] 
[INFO] --- maven-enforcer-plugin:1.4.1:enforce (enforce-maven) @ spoon-core ---
[INFO] Skipping Rule Enforcement.
[INFO] 
[INFO] --- maven-enforcer-plugin:1.4.1:enforce (enforce-bytecode-version) @ spoon-core ---
[INFO] Skipping Rule Enforcement.
[INFO] 
[INFO] --- jacoco-maven-plugin:0.7.5.201505241946:prepare-agent (default) @ spoon-core ---
[INFO] argLine set to -javaagent:/root/./workspace/INRIA/spoon/284408601/.m2/org/jacoco/org.jacoco.agent/0.7.5.201505241946/org.jacoco.agent-0.7.5.201505241946-runtime.jar=destfile=/root/workspace/INRIA/spoon/284408601/target/jacoco.exec
[INFO] 
[INFO] --- maven-resources-plugin:2.6:resources (default-resources) @ spoon-core ---
[INFO] Using 'UTF-8' encoding to copy filtered resources.
[INFO] Copying 3 resources
[INFO] Copying 1 resource
[INFO] 
[INFO] --- maven-compiler-plugin:3.1:compile (default-compile) @ spoon-core ---
[INFO] Changes detected - recompiling the module!
[INFO] Compiling 516 source files to /root/workspace/INRIA/spoon/284408601/target/classes
[WARNING] /root/workspace/INRIA/spoon/284408601/src/main/java/spoon/reflect/factory/CodeFactory.java: Some input files use unchecked or unsafe operations.
[WARNING] /root/workspace/INRIA/spoon/284408601/src/main/java/spoon/reflect/factory/CodeFactory.java: Recompile with -Xlint:unchecked for details.
[INFO] 
[INFO] --- maven-resources-plugin:2.6:testResources (default-testResources) @ spoon-core ---
[INFO] Using 'UTF-8' encoding to copy filtered resources.
[INFO] Copying 121 resources
[INFO] 
[INFO] --- maven-compiler-plugin:3.1:testCompile (default-testCompile) @ spoon-core ---
[INFO] Nothing to compile - all classes are up to date
[INFO] 
[INFO] --- maven-surefire-plugin:2.19.1:test (default-test) @ spoon-core ---
[INFO] Downloading: https://repo.maven.apache.org/maven2/org/apache/maven/surefire/surefire-junit4/2.19.1/surefire-junit4-2.19.1.pom
[INFO] Downloaded: https://repo.maven.apache.org/maven2/org/apache/maven/surefire/surefire-junit4/2.19.1/surefire-junit4-2.19.1.pom (4 KB at 5.7 KB/sec)
[INFO] Downloading: https://repo.maven.apache.org/maven2/org/apache/maven/surefire/surefire-providers/2.19.1/surefire-providers-2.19.1.pom
[INFO] Downloaded: https://repo.maven.apache.org/maven2/org/apache/maven/surefire/surefire-providers/2.19.1/surefire-providers-2.19.1.pom (3 KB at 104.3 KB/sec)
[INFO] Downloading: https://repo.maven.apache.org/maven2/org/apache/maven/surefire/surefire-junit4/2.19.1/surefire-junit4-2.19.1.jar
[INFO] Downloaded: https://repo.maven.apache.org/maven2/org/apache/maven/surefire/surefire-junit4/2.19.1/surefire-junit4-2.19.1.jar (74 KB at 1248.3 KB/sec)

-------------------------------------------------------
 T E S T S
-------------------------------------------------------
Running spoon.reflect.ast.AstCheckerTest
Tests run: 2, Failures: 0, Errors: 0, Skipped: 0, Time elapsed: 17.505 sec - in spoon.reflect.ast.AstCheckerTest
Running spoon.reflect.ast.CloneTest
Tests run: 2, Failures: 0, Errors: 0, Skipped: 0, Time elapsed: 8.452 sec - in spoon.reflect.ast.CloneTest
Running spoon.reflect.declaration.UnknownDeclarationTest
Tests run: 1, Failures: 0, Errors: 0, Skipped: 0, Time elapsed: 0.048 sec - in spoon.reflect.declaration.UnknownDeclarationTest
Running spoon.reflect.declaration.CtTypeInformationTest
Tests run: 3, Failures: 0, Errors: 0, Skipped: 0, Time elapsed: 0.822 sec - in spoon.reflect.declaration.CtTypeInformationTest
Running spoon.reflect.visitor.CtInheritanceScannerMethodsTest
Tests run: 1, Failures: 0, Errors: 0, Skipped: 0, Time elapsed: 1.863 sec - in spoon.reflect.visitor.CtInheritanceScannerMethodsTest
Running spoon.reflect.visitor.CtScannerTest
Tests run: 2, Failures: 0, Errors: 0, Skipped: 0, Time elapsed: 6.568 sec - in spoon.reflect.visitor.CtScannerTest
Running spoon.reflect.visitor.CtInheritanceScannerTest
Tests run: 73, Failures: 0, Errors: 0, Skipped: 0, Time elapsed: 0.781 sec - in spoon.reflect.visitor.CtInheritanceScannerTest
Running spoon.reflect.visitor.CtVisitorTest
Tests run: 1, Failures: 0, Errors: 0, Skipped: 0, Time elapsed: 1.044 sec - in spoon.reflect.visitor.CtVisitorTest
Running spoon.LauncherTest
Tests run: 4, Failures: 0, Errors: 0, Skipped: 0, Time elapsed: 0.279 sec - in spoon.LauncherTest
Running spoon.test.limits.utils.InternalTest
Tests run: 2, Failures: 0, Errors: 0, Skipped: 0, Time elapsed: 0.089 sec - in spoon.test.limits.utils.InternalTest
Running spoon.test.parameters.ParameterTest
Tests run: 3, Failures: 0, Errors: 0, Skipped: 0, Time elapsed: 0.293 sec - in spoon.test.parameters.ParameterTest
Running spoon.test.pkg.PackageTest
Tests run: 9, Failures: 0, Errors: 0, Skipped: 0, Time elapsed: 0.628 sec - in spoon.test.pkg.PackageTest
Running spoon.test.reference.CloneReferenceTest
Tests run: 2, Failures: 0, Errors: 0, Skipped: 0, Time elapsed: 0.098 sec - in spoon.test.reference.CloneReferenceTest
Running spoon.test.reference.VariableAccessTest
Tests run: 10, Failures: 0, Errors: 0, Skipped: 0, Time elapsed: 0.545 sec - in spoon.test.reference.VariableAccessTest
Running spoon.test.reference.ExecutableReferenceGenericTest
Tests run: 12, Failures: 0, Errors: 0, Skipped: 0, Time elapsed: 0.581 sec - in spoon.test.reference.ExecutableReferenceGenericTest
Running spoon.test.reference.ElasticsearchStackoverflowTest
Tests run: 1, Failures: 0, Errors: 0, Skipped: 0, Time elapsed: 0.166 sec - in spoon.test.reference.ElasticsearchStackoverflowTest
Running spoon.test.reference.AnnotationFieldReferenceTest
Tests run: 1, Failures: 0, Errors: 0, Skipped: 0, Time elapsed: 0.05 sec - in spoon.test.reference.AnnotationFieldReferenceTest
Running spoon.test.reference.TypeReferenceTest
Tests run: 27, Failures: 0, Errors: 0, Skipped: 0, Time elapsed: 1.456 sec - in spoon.test.reference.TypeReferenceTest
Running spoon.test.reference.ExecutableReferenceTest
Tests run: 6, Failures: 0, Errors: 0, Skipped: 0, Time elapsed: 0.382 sec - in spoon.test.reference.ExecutableReferenceTest
Running spoon.test.exceptions.ExceptionTest
Tests run: 6, Failures: 0, Errors: 0, Skipped: 0, Time elapsed: 0.385 sec - in spoon.test.exceptions.ExceptionTest
Running spoon.test.prettyprinter.QualifiedThisRefTest
Tests run: 3, Failures: 0, Errors: 0, Skipped: 0, Time elapsed: 0.18 sec - in spoon.test.prettyprinter.QualifiedThisRefTest
Running spoon.test.prettyprinter.LinesTest
Tests run: 3, Failures: 0, Errors: 0, Skipped: 0, Time elapsed: 0.488 sec - in spoon.test.prettyprinter.LinesTest
Running spoon.test.prettyprinter.PrinterTest
Tests run: 8, Failures: 0, Errors: 0, Skipped: 0, Time elapsed: 2.542 sec - in spoon.test.prettyprinter.PrinterTest
Running spoon.test.prettyprinter.DefaultPrettyPrinterTest
Tests run: 11, Failures: 0, Errors: 0, Skipped: 0, Time elapsed: 0.663 sec - in spoon.test.prettyprinter.DefaultPrettyPrinterTest
Running spoon.test.reflect.visitor.ReferenceQueryTest
Tests run: 1, Failures: 0, Errors: 0, Skipped: 0, Time elapsed: 0.043 sec - in spoon.test.reflect.visitor.ReferenceQueryTest
Running spoon.test.method_overriding.MethodOverriddingTest
Tests run: 2, Failures: 0, Errors: 0, Skipped: 0, Time elapsed: 0.11 sec - in spoon.test.method_overriding.MethodOverriddingTest
Running spoon.test.factory.AnnotationFactoryTest
Tests run: 1, Failures: 0, Errors: 0, Skipped: 0, Time elapsed: 0.045 sec - in spoon.test.factory.AnnotationFactoryTest
Running spoon.test.factory.ClassFactoryTest
Tests run: 2, Failures: 0, Errors: 0, Skipped: 0, Time elapsed: 0.002 sec - in spoon.test.factory.ClassFactoryTest
Running spoon.test.factory.FieldFactoryTest
Tests run: 2, Failures: 0, Errors: 0, Skipped: 0, Time elapsed: 0.147 sec - in spoon.test.factory.FieldFactoryTest
Running spoon.test.factory.TypeFactoryTest
Tests run: 3, Failures: 0, Errors: 0, Skipped: 0, Time elapsed: 0.096 sec - in spoon.test.factory.TypeFactoryTest
Running spoon.test.factory.CodeFactoryTest
Tests run: 1, Failures: 0, Errors: 0, Skipped: 0, Time elapsed: 0.001 sec - in spoon.test.factory.CodeFactoryTest
Running spoon.test.factory.ExecutableFactoryTest
Tests run: 1, Failures: 0, Errors: 0, Skipped: 0, Time elapsed: 0 sec - in spoon.test.factory.ExecutableFactoryTest
Running spoon.test.factory.FactoryTest
Tests run: 6, Failures: 0, Errors: 0, Skipped: 0, Time elapsed: 1.605 sec - in spoon.test.factory.FactoryTest
Running spoon.test.factory.ConstructorFactoryTest
Tests run: 2, Failures: 0, Errors: 0, Skipped: 0, Time elapsed: 0.043 sec - in spoon.test.factory.ConstructorFactoryTest
Running spoon.test.comment.CommentTest
Tests run: 15, Failures: 0, Errors: 0, Skipped: 0, Time elapsed: 16.466 sec - in spoon.test.comment.CommentTest
Running spoon.test.strings.StringLiteralTest
Tests run: 1, Failures: 0, Errors: 0, Skipped: 0, Time elapsed: 0.042 sec - in spoon.test.strings.StringLiteralTest
Running spoon.test.strings.StringTest
Tests run: 1, Failures: 0, Errors: 0, Skipped: 0, Time elapsed: 0.039 sec - in spoon.test.strings.StringTest
Running spoon.test.jdtimportbuilder.ImportBuilderTest
Tests run: 6, Failures: 0, Errors: 0, Skipped: 0, Time elapsed: 0.272 sec - in spoon.test.jdtimportbuilder.ImportBuilderTest
Running spoon.test.control.ControlTest
Tests run: 2, Failures: 0, Errors: 0, Skipped: 0, Time elapsed: 0.074 sec - in spoon.test.control.ControlTest
Running spoon.test.ctCase.SwitchCaseTest
Tests run: 2, Failures: 0, Errors: 0, Skipped: 0, Time elapsed: 0.078 sec - in spoon.test.ctCase.SwitchCaseTest
Running spoon.test.casts.CastTest
Tests run: 5, Failures: 0, Errors: 0, Skipped: 0, Time elapsed: 0.231 sec - in spoon.test.casts.CastTest
Running spoon.test.method.MethodTest
Tests run: 4, Failures: 0, Errors: 0, Skipped: 0, Time elapsed: 0.169 sec - in spoon.test.method.MethodTest
Running spoon.test.arrays.ArraysTest
Tests run: 4, Failures: 0, Errors: 0, Skipped: 0, Time elapsed: 0.314 sec - in spoon.test.arrays.ArraysTest
Running spoon.test.filters.CUFilterTest
Tests run: 3, Failures: 0, Errors: 0, Skipped: 0, Time elapsed: 0.115 sec - in spoon.test.filters.CUFilterTest
Running spoon.test.filters.FilterTest
2017-10-07 00:10:28,510 INFO spoon.Launcher - Spoon version 6.0.0-SNAPSHOT
2017-10-07 00:10:28,512 INFO spoon.Launcher - running Spoon...
2017-10-07 00:10:28,512 INFO spoon.Launcher - start processing...
2017-10-07 00:10:28,559 INFO spoon.Launcher - end of processing: 
2017-10-07 00:10:28,560 INFO spoon.Launcher - no errors, no warnings
2017-10-07 00:10:28,753 INFO spoon.Launcher - Spoon version 6.0.0-SNAPSHOT
2017-10-07 00:10:28,754 INFO spoon.Launcher - running Spoon...
2017-10-07 00:10:28,754 INFO spoon.Launcher - start processing...
2017-10-07 00:10:28,800 INFO spoon.Launcher - end of processing: 
2017-10-07 00:10:28,801 INFO spoon.Launcher - no errors, no warnings
2017-10-07 00:10:28,978 INFO spoon.Launcher - Spoon version 6.0.0-SNAPSHOT
2017-10-07 00:10:28,978 INFO spoon.Launcher - running Spoon...
2017-10-07 00:10:28,979 INFO spoon.Launcher - start processing...
2017-10-07 00:10:29,026 INFO spoon.Launcher - end of processing: 
2017-10-07 00:10:29,026 INFO spoon.Launcher - no errors, no warnings
2017-10-07 00:10:29,260 INFO spoon.Launcher - Spoon version 6.0.0-SNAPSHOT
2017-10-07 00:10:29,260 INFO spoon.Launcher - running Spoon...
2017-10-07 00:10:29,260 INFO spoon.Launcher - start processing...
2017-10-07 00:10:29,306 INFO spoon.Launcher - end of processing: 
2017-10-07 00:10:29,306 INFO spoon.Launcher - no errors, no warnings
2017-10-07 00:10:29,411 INFO spoon.Launcher - Spoon version 6.0.0-SNAPSHOT
2017-10-07 00:10:29,411 INFO spoon.Launcher - running Spoon...
2017-10-07 00:10:29,412 INFO spoon.Launcher - start processing...
2017-10-07 00:10:29,457 INFO spoon.Launcher - end of processing: 
2017-10-07 00:10:29,458 INFO spoon.Launcher - no errors, no warnings
2017-10-07 00:10:29,919 INFO spoon.Launcher - Spoon version 6.0.0-SNAPSHOT
2017-10-07 00:10:29,920 INFO spoon.Launcher - running Spoon...
2017-10-07 00:10:29,920 INFO spoon.Launcher - start processing...
2017-10-07 00:10:29,966 INFO spoon.Launcher - end of processing: 
2017-10-07 00:10:29,967 INFO spoon.Launcher - no errors, no warnings
2017-10-07 00:10:30,239 INFO spoon.Launcher - Spoon version 6.0.0-SNAPSHOT
2017-10-07 00:10:30,240 INFO spoon.Launcher - running Spoon...
2017-10-07 00:10:30,241 INFO spoon.Launcher - start processing...
2017-10-07 00:10:30,287 INFO spoon.Launcher - end of processing: 
2017-10-07 00:10:30,288 INFO spoon.Launcher - no errors, no warnings
2017-10-07 00:10:30,530 INFO spoon.Launcher - Spoon version 6.0.0-SNAPSHOT
2017-10-07 00:10:30,531 INFO spoon.Launcher - running Spoon...
2017-10-07 00:10:30,531 INFO spoon.Launcher - start processing...
2017-10-07 00:10:30,578 INFO spoon.Launcher - end of processing: 
2017-10-07 00:10:30,578 INFO spoon.Launcher - no errors, no warnings
2017-10-07 00:10:30,634 INFO spoon.Launcher - Spoon version 6.0.0-SNAPSHOT
2017-10-07 00:10:30,634 INFO spoon.Launcher - running Spoon...
2017-10-07 00:10:30,634 INFO spoon.Launcher - start processing...
2017-10-07 00:10:30,680 INFO spoon.Launcher - end of processing: 
2017-10-07 00:10:30,680 INFO spoon.Launcher - no errors, no warnings
2017-10-07 00:10:30,802 INFO spoon.Launcher - Spoon version 6.0.0-SNAPSHOT
2017-10-07 00:10:30,802 INFO spoon.Launcher - running Spoon...
2017-10-07 00:10:30,802 INFO spoon.Launcher - start processing...
2017-10-07 00:10:30,849 INFO spoon.Launcher - end of processing: 
2017-10-07 00:10:30,849 INFO spoon.Launcher - no errors, no warnings
2017-10-07 00:10:30,975 INFO spoon.Launcher - Spoon version 6.0.0-SNAPSHOT
2017-10-07 00:10:30,975 INFO spoon.Launcher - running Spoon...
2017-10-07 00:10:30,975 INFO spoon.Launcher - start processing...
2017-10-07 00:10:31,021 INFO spoon.Launcher - end of processing: 
2017-10-07 00:10:31,022 INFO spoon.Launcher - no errors, no warnings
2017-10-07 00:10:31,074 INFO spoon.Launcher - Spoon version 6.0.0-SNAPSHOT
2017-10-07 00:10:31,074 INFO spoon.Launcher - running Spoon...
2017-10-07 00:10:31,074 INFO spoon.Launcher - start processing...
2017-10-07 00:10:31,120 INFO spoon.Launcher - end of processing: 
2017-10-07 00:10:31,121 INFO spoon.Launcher - no errors, no warnings
2017-10-07 00:10:31,458 INFO spoon.Launcher - Spoon version 6.0.0-SNAPSHOT
2017-10-07 00:10:31,458 INFO spoon.Launcher - running Spoon...
2017-10-07 00:10:31,458 INFO spoon.Launcher - start processing...
2017-10-07 00:10:31,503 INFO spoon.Launcher - end of processing: 
2017-10-07 00:10:31,504 INFO spoon.Launcher - no errors, no warnings
2017-10-07 00:10:31,799 INFO spoon.Launcher - Spoon version 6.0.0-SNAPSHOT
2017-10-07 00:10:31,799 INFO spoon.Launcher - running Spoon...
2017-10-07 00:10:31,800 INFO spoon.Launcher - start processing...
2017-10-07 00:10:31,844 INFO spoon.Launcher - end of processing: 
2017-10-07 00:10:31,844 INFO spoon.Launcher - no errors, no warnings
Tests run: 41, Failures: 0, Errors: 1, Skipped: 0, Time elapsed: 3.521 sec <<< FAILURE! - in spoon.test.filters.FilterTest
testInvalidQueryStep(spoon.test.filters.FilterTest)  Time elapsed: 0.1 sec  <<< ERROR!
java.lang.ClassCastException: spoon.support.reflect.declaration.CtClassImpl cannot be cast to spoon.reflect.declaration.CtMethod
	at spoon.test.filters.FilterTest.testInvalidQueryStep(FilterTest.java:630)

Running spoon.test.initializers.InitializerTest
Tests run: 2, Failures: 0, Errors: 0, Skipped: 0, Time elapsed: 0.074 sec - in spoon.test.initializers.InitializerTest
Running spoon.test.trycatch.TryCatchTest
Tests run: 9, Failures: 0, Errors: 0, Skipped: 0, Time elapsed: 0.421 sec - in spoon.test.trycatch.TryCatchTest
Running spoon.test.generics.GenericsTest
Tests run: 41, Failures: 0, Errors: 0, Skipped: 0, Time elapsed: 2.794 sec - in spoon.test.generics.GenericsTest
Running spoon.test.visibility.VisibilityTest
Tests run: 5, Failures: 0, Errors: 0, Skipped: 0, Time elapsed: 0.602 sec - in spoon.test.visibility.VisibilityTest
Running spoon.test.ctClass.CtClassTest
Tests run: 6, Failures: 0, Errors: 0, Skipped: 0, Time elapsed: 1.977 sec - in spoon.test.ctClass.CtClassTest
Running spoon.test.annotation.AnnotationTest
Tests run: 41, Failures: 0, Errors: 0, Skipped: 0, Time elapsed: 4.027 sec - in spoon.test.annotation.AnnotationTest
Running spoon.test.annotation.AnnotationLoopTest
Tests run: 1, Failures: 0, Errors: 0, Skipped: 0, Time elapsed: 0.046 sec - in spoon.test.annotation.AnnotationLoopTest
Running spoon.test.annotation.AnnotationValuesTest
Tests run: 6, Failures: 0, Errors: 0, Skipped: 0, Time elapsed: 0.143 sec - in spoon.test.annotation.AnnotationValuesTest
Running spoon.test.replace.ReplaceParametrizedTest
Tests run: 73, Failures: 0, Errors: 0, Skipped: 0, Time elapsed: 2.577 sec - in spoon.test.replace.ReplaceParametrizedTest
Running spoon.test.replace.ReplaceTest
Tests run: 17, Failures: 0, Errors: 0, Skipped: 0, Time elapsed: 0.989 sec - in spoon.test.replace.ReplaceTest
Running spoon.test.processing.ProcessingTest
Tests run: 7, Failures: 0, Errors: 0, Skipped: 0, Time elapsed: 0.327 sec - in spoon.test.processing.ProcessingTest
Running spoon.test.api.APITest
Tests run: 15, Failures: 0, Errors: 0, Skipped: 0, Time elapsed: 8.279 sec - in spoon.test.api.APITest
Running spoon.test.api.NoClasspathTest
Tests run: 3, Failures: 0, Errors: 0, Skipped: 0, Time elapsed: 0.083 sec - in spoon.test.api.NoClasspathTest
Running spoon.test.api.FileSystemFolderTest
Tests run: 2, Failures: 0, Errors: 0, Skipped: 0, Time elapsed: 0.002 sec - in spoon.test.api.FileSystemFolderTest
Running spoon.test.api.MetamodelTest
Tests run: 3, Failures: 0, Errors: 0, Skipped: 0, Time elapsed: 1.762 sec - in spoon.test.api.MetamodelTest
Running spoon.test.constructor.ConstructorTest
Tests run: 6, Failures: 0, Errors: 0, Skipped: 0, Time elapsed: 0.345 sec - in spoon.test.constructor.ConstructorTest
Running spoon.test.support.ResourceTest
Tests run: 4, Failures: 0, Errors: 0, Skipped: 0, Time elapsed: 0.188 sec - in spoon.test.support.ResourceTest
Running spoon.test.template.TemplateClassAccessTest
Tests run: 1, Failures: 0, Errors: 0, Skipped: 0, Time elapsed: 0.083 sec - in spoon.test.template.TemplateClassAccessTest
Running spoon.test.template.TemplateInvocationSubstitutionTest
Tests run: 2, Failures: 0, Errors: 0, Skipped: 0, Time elapsed: 0.11 sec - in spoon.test.template.TemplateInvocationSubstitutionTest
Running spoon.test.template.TemplateArrayAccessTest
Tests run: 2, Failures: 0, Errors: 0, Skipped: 0, Time elapsed: 0.088 sec - in spoon.test.template.TemplateArrayAccessTest
Running spoon.test.template.TemplateTest
0
Tests run: 24, Failures: 0, Errors: 0, Skipped: 0, Time elapsed: 2.056 sec - in spoon.test.template.TemplateTest
Running spoon.test.template.TemplateEnumAccessTest
Tests run: 1, Failures: 0, Errors: 0, Skipped: 0, Time elapsed: 0.088 sec - in spoon.test.template.TemplateEnumAccessTest
Running spoon.test.template.TemplateReplaceReturnTest
Tests run: 1, Failures: 0, Errors: 0, Skipped: 0, Time elapsed: 0.086 sec - in spoon.test.template.TemplateReplaceReturnTest
Running spoon.test.literal.LiteralTest
Tests run: 5, Failures: 0, Errors: 0, Skipped: 0, Time elapsed: 0.518 sec - in spoon.test.literal.LiteralTest
Running spoon.test.fieldaccesses.FieldAccessTest
Tests run: 16, Failures: 0, Errors: 0, Skipped: 0, Time elapsed: 0.681 sec - in spoon.test.fieldaccesses.FieldAccessTest
Running spoon.test.compilationunit.GetBinaryFilesTest
Tests run: 5, Failures: 0, Errors: 0, Skipped: 0, Time elapsed: 0.384 sec - in spoon.test.compilationunit.GetBinaryFilesTest
Running spoon.test.compilationunit.TestEncoding
Tests run: 1, Failures: 0, Errors: 0, Skipped: 0, Time elapsed: 0.048 sec - in spoon.test.compilationunit.TestEncoding
Running spoon.test.refactoring.MethodsRefactoringTest
Tests run: 5, Failures: 0, Errors: 0, Skipped: 0, Time elapsed: 1.048 sec - in spoon.test.refactoring.MethodsRefactoringTest
Running spoon.test.refactoring.RefactoringTest
Tests run: 4, Failures: 0, Errors: 0, Skipped: 0, Time elapsed: 0.555 sec - in spoon.test.refactoring.RefactoringTest
Running spoon.test.refactoring.CtRenameLocalVariableRefactoringTest
Tests run: 4, Failures: 0, Errors: 0, Skipped: 0, Time elapsed: 14.042 sec - in spoon.test.refactoring.CtRenameLocalVariableRefactoringTest
Running spoon.test.ctBlock.TestCtBlock
Tests run: 3, Failures: 0, Errors: 0, Skipped: 0, Time elapsed: 0.122 sec - in spoon.test.ctBlock.TestCtBlock
Running spoon.test.field.FieldTest
Tests run: 4, Failures: 0, Errors: 0, Skipped: 0, Time elapsed: 0.12 sec - in spoon.test.field.FieldTest
Running spoon.test.labels.TestLabels
Tests run: 1, Failures: 0, Errors: 0, Skipped: 0, Time elapsed: 0.057 sec - in spoon.test.labels.TestLabels
Running spoon.test.OutputTypeTest
Tests run: 1, Failures: 0, Errors: 0, Skipped: 0, Time elapsed: 0 sec - in spoon.test.OutputTypeTest
Running spoon.test.ctBodyHolder.CtBodyHolderTest
Tests run: 6, Failures: 0, Errors: 0, Skipped: 0, Time elapsed: 0.304 sec - in spoon.test.ctBodyHolder.CtBodyHolderTest
Running spoon.test.javadoc.JavaDocTest
Tests run: 2, Failures: 0, Errors: 0, Skipped: 0, Time elapsed: 0.084 sec - in spoon.test.javadoc.JavaDocTest
Running spoon.test.constructorcallnewclass.ConstructorCallTest
Tests run: 6, Failures: 0, Errors: 0, Skipped: 0, Time elapsed: 0.284 sec - in spoon.test.constructorcallnewclass.ConstructorCallTest
Running spoon.test.constructorcallnewclass.NewClassTest
Tests run: 7, Failures: 0, Errors: 0, Skipped: 0, Time elapsed: 0.542 sec - in spoon.test.constructorcallnewclass.NewClassTest
Running spoon.test.variable.AccessTest
Tests run: 8, Failures: 0, Errors: 0, Skipped: 0, Time elapsed: 0.367 sec - in spoon.test.variable.AccessTest
Running spoon.test.variable.AccessFullyQualifiedFieldTest
Tests run: 9, Failures: 0, Errors: 0, Skipped: 0, Time elapsed: 0.792 sec - in spoon.test.variable.AccessFullyQualifiedFieldTest
Running spoon.test.delete.DeleteTest
Tests run: 14, Failures: 0, Errors: 0, Skipped: 0, Time elapsed: 0.563 sec - in spoon.test.delete.DeleteTest
Running spoon.test.query_function.VariableReferencesTest
2017-10-07 00:11:19,697 INFO spoon.Launcher - Spoon version 6.0.0-SNAPSHOT
2017-10-07 00:11:19,697 INFO spoon.Launcher - running Spoon...
2017-10-07 00:11:19,697 INFO spoon.Launcher - start processing...
2017-10-07 00:11:19,767 INFO spoon.Launcher - end of processing: 
2017-10-07 00:11:19,767 INFO spoon.Launcher - no errors, no warnings
2017-10-07 00:11:19,846 INFO spoon.Launcher - Spoon version 6.0.0-SNAPSHOT
2017-10-07 00:11:19,846 INFO spoon.Launcher - running Spoon...
2017-10-07 00:11:19,846 INFO spoon.Launcher - start processing...
2017-10-07 00:11:19,899 INFO spoon.Launcher - end of processing: 
2017-10-07 00:11:19,899 INFO spoon.Launcher - no errors, no warnings
2017-10-07 00:11:20,082 INFO spoon.Launcher - Spoon version 6.0.0-SNAPSHOT
2017-10-07 00:11:20,082 INFO spoon.Launcher - running Spoon...
2017-10-07 00:11:20,082 INFO spoon.Launcher - start processing...
2017-10-07 00:11:20,136 INFO spoon.Launcher - end of processing: 
2017-10-07 00:11:20,136 INFO spoon.Launcher - no errors, no warnings
2017-10-07 00:11:20,184 INFO spoon.Launcher - Spoon version 6.0.0-SNAPSHOT
2017-10-07 00:11:20,184 INFO spoon.Launcher - running Spoon...
2017-10-07 00:11:20,185 INFO spoon.Launcher - start processing...
2017-10-07 00:11:20,238 INFO spoon.Launcher - end of processing: 
2017-10-07 00:11:20,238 INFO spoon.Launcher - no errors, no warnings
2017-10-07 00:11:20,330 INFO spoon.Launcher - Spoon version 6.0.0-SNAPSHOT
2017-10-07 00:11:20,331 INFO spoon.Launcher - running Spoon...
2017-10-07 00:11:20,331 INFO spoon.Launcher - start processing...
2017-10-07 00:11:20,384 INFO spoon.Launcher - end of processing: 
2017-10-07 00:11:20,385 INFO spoon.Launcher - no errors, no warnings
2017-10-07 00:11:20,435 INFO spoon.Launcher - Spoon version 6.0.0-SNAPSHOT
2017-10-07 00:11:20,436 INFO spoon.Launcher - running Spoon...
2017-10-07 00:11:20,436 INFO spoon.Launcher - start processing...
2017-10-07 00:11:20,488 INFO spoon.Launcher - end of processing: 
2017-10-07 00:11:20,489 INFO spoon.Launcher - no errors, no warnings
2017-10-07 00:11:20,538 INFO spoon.Launcher - Spoon version 6.0.0-SNAPSHOT
2017-10-07 00:11:20,538 INFO spoon.Launcher - running Spoon...
2017-10-07 00:11:20,538 INFO spoon.Launcher - start processing...
2017-10-07 00:11:20,590 INFO spoon.Launcher - end of processing: 
2017-10-07 00:11:20,590 INFO spoon.Launcher - no errors, no warnings
2017-10-07 00:11:20,632 INFO spoon.Launcher - Spoon version 6.0.0-SNAPSHOT
2017-10-07 00:11:20,633 INFO spoon.Launcher - running Spoon...
2017-10-07 00:11:20,634 INFO spoon.Launcher - start processing...
2017-10-07 00:11:20,688 INFO spoon.Launcher - end of processing: 
2017-10-07 00:11:20,688 INFO spoon.Launcher - no errors, no warnings
Tests run: 8, Failures: 0, Errors: 0, Skipped: 0, Time elapsed: 1.106 sec - in spoon.test.query_function.VariableReferencesTest
Running spoon.test.query_function.VariableReferencesModelTest
Tests run: 15, Failures: 0, Errors: 0, Skipped: 0, Time elapsed: 0.013 sec - in spoon.test.query_function.VariableReferencesModelTest
Running spoon.test.parent.ParentTest
Tests run: 11, Failures: 0, Errors: 0, Skipped: 1, Time elapsed: 0.655 sec - in spoon.test.parent.ParentTest
Running spoon.test.parent.TopLevelTypeTest
Tests run: 1, Failures: 0, Errors: 0, Skipped: 0, Time elapsed: 0.041 sec - in spoon.test.parent.TopLevelTypeTest
Running spoon.test.parent.NullParentTest
Tests run: 8, Failures: 0, Errors: 0, Skipped: 0, Time elapsed: 0.328 sec - in spoon.test.parent.NullParentTest
Running spoon.test.parent.ParentContractTest
Tests run: 61, Failures: 0, Errors: 0, Skipped: 0, Time elapsed: 0.565 sec - in spoon.test.parent.ParentContractTest
Running spoon.test.logging.LogTest
2017-10-07 00:11:22,415 DEBUG spoon.Launcher - output: spooned
2017-10-07 00:11:22,416 DEBUG spoon.Launcher - destination: /root/workspace/INRIA/spoon/284408601/spooned-classes
2017-10-07 00:11:22,416 DEBUG spoon.Launcher - source classpath: null
2017-10-07 00:11:22,416 DEBUG spoon.Launcher - template classpath: []
2017-10-07 00:11:22,417 INFO spoon.Launcher - Log info
2017-10-07 00:11:22,417 WARN spoon.Launcher - Log warn
2017-10-07 00:11:22,417 ERROR spoon.Launcher - Log error
2017-10-07 00:11:22,417 DEBUG spoon.Launcher - Log debug
2017-10-07 00:11:22,418 DEBUG spoon.Launcher - output: spooned
2017-10-07 00:11:22,418 DEBUG spoon.Launcher - destination: /root/workspace/INRIA/spoon/284408601/spooned-classes
2017-10-07 00:11:22,419 DEBUG spoon.Launcher - source classpath: null
2017-10-07 00:11:22,419 DEBUG spoon.Launcher - template classpath: []
2017-10-07 00:11:22,419 INFO spoon.Launcher - Log info
2017-10-07 00:11:22,419 WARN spoon.Launcher - Log warn
2017-10-07 00:11:22,419 ERROR spoon.Launcher - Log error
2017-10-07 00:11:22,420 DEBUG spoon.Launcher - Log debug
2017-10-07 00:11:22,421 INFO spoon.Launcher - Log info
2017-10-07 00:11:22,421 WARN spoon.Launcher - Log warn
2017-10-07 00:11:22,422 ERROR spoon.Launcher - Log error
2017-10-07 00:11:22,423 WARN spoon.Launcher - Log warn
2017-10-07 00:11:22,423 ERROR spoon.Launcher - Log error
2017-10-07 00:11:22,424 ERROR spoon.Launcher - Log error
Tests run: 6, Failures: 0, Errors: 0, Skipped: 0, Time elapsed: 0.006 sec - in spoon.test.logging.LogTest
Running spoon.test.ctType.CtTypeTest
Tests run: 8, Failures: 0, Errors: 0, Skipped: 0, Time elapsed: 0.722 sec - in spoon.test.ctType.CtTypeTest
Running spoon.test.ctType.CtTypeParameterTest
Tests run: 2, Failures: 0, Errors: 0, Skipped: 0, Time elapsed: 0.099 sec - in spoon.test.ctType.CtTypeParameterTest
Running spoon.test.imports.ImportAndExtendWithPackageNameTest
Tests run: 1, Failures: 0, Errors: 0, Skipped: 0, Time elapsed: 0.038 sec - in spoon.test.imports.ImportAndExtendWithPackageNameTest
Running spoon.test.imports.ImportScannerTest
Tests run: 5, Failures: 0, Errors: 0, Skipped: 0, Time elapsed: 0.156 sec - in spoon.test.imports.ImportScannerTest
Running spoon.test.imports.ImportTest
Tests run: 39, Failures: 0, Errors: 0, Skipped: 0, Time elapsed: 3.896 sec - in spoon.test.imports.ImportTest
Running spoon.test.comparison.EqualTest
Tests run: 4, Failures: 0, Errors: 0, Skipped: 0, Time elapsed: 0.191 sec - in spoon.test.comparison.EqualTest
Running spoon.test.invocations.InvocationTest
Tests run: 2, Failures: 0, Errors: 0, Skipped: 0, Time elapsed: 0.079 sec - in spoon.test.invocations.InvocationTest
Running spoon.test.methodreference.MethodReferenceTest
Tests run: 13, Failures: 0, Errors: 0, Skipped: 0, Time elapsed: 1.224 sec - in spoon.test.methodreference.MethodReferenceTest
Running spoon.test.lambda.LambdaTest
Tests run: 22, Failures: 0, Errors: 0, Skipped: 0, Time elapsed: 1.674 sec - in spoon.test.lambda.LambdaTest
Running spoon.test.ctElement.MetadataTest
Tests run: 1, Failures: 0, Errors: 0, Skipped: 0, Time elapsed: 0.037 sec - in spoon.test.ctElement.MetadataTest
Running spoon.test.ctElement.ElementTest
Tests run: 1, Failures: 0, Errors: 0, Skipped: 0, Time elapsed: 0 sec - in spoon.test.ctElement.ElementTest
Running spoon.test.jar.JarTest
Tests run: 3, Failures: 0, Errors: 0, Skipped: 0, Time elapsed: 0.115 sec - in spoon.test.jar.JarTest
Running spoon.test.intercession.IntercessionTest
Tests run: 8, Failures: 0, Errors: 0, Skipped: 1, Time elapsed: 3.583 sec - in spoon.test.intercession.IntercessionTest
Running spoon.test.intercession.IntercessionContractTest
Tests run: 94, Failures: 0, Errors: 0, Skipped: 0, Time elapsed: 0.268 sec - in spoon.test.intercession.IntercessionContractTest
Running spoon.test.intercession.RemoveTest
Tests run: 1, Failures: 0, Errors: 0, Skipped: 0, Time elapsed: 0.037 sec - in spoon.test.intercession.RemoveTest
Running spoon.test.intercession.insertBefore.InsertMethodsTest
Tests run: 9, Failures: 0, Errors: 0, Skipped: 0, Time elapsed: 0.726 sec - in spoon.test.intercession.insertBefore.InsertMethodsTest
Running spoon.test.visitor.VisitorTest
Tests run: 1, Failures: 0, Errors: 0, Skipped: 0, Time elapsed: 0.039 sec - in spoon.test.visitor.VisitorTest
Running spoon.test.main.MainTest
Tests run: 6, Failures: 0, Errors: 0, Skipped: 0, Time elapsed: 52.666 sec - in spoon.test.main.MainTest
Running spoon.test.executable.ExecutableTest
Tests run: 3, Failures: 0, Errors: 0, Skipped: 0, Time elapsed: 0.116 sec - in spoon.test.executable.ExecutableTest
Running spoon.test.executable.ExecutableRefTest
Tests run: 5, Failures: 0, Errors: 0, Skipped: 0, Time elapsed: 0.253 sec - in spoon.test.executable.ExecutableRefTest
Running spoon.test.loop.LoopTest
Tests run: 2, Failures: 0, Errors: 0, Skipped: 0, Time elapsed: 0.084 sec - in spoon.test.loop.LoopTest
Running spoon.test.staticFieldAccess2.ImplicitStaticFieldReferenceTest
Tests run: 16, Failures: 0, Errors: 0, Skipped: 0, Time elapsed: 1.337 sec - in spoon.test.staticFieldAccess2.ImplicitStaticFieldReferenceTest
Running spoon.test.sourcePosition.SourcePositionTest
Tests run: 1, Failures: 0, Errors: 0, Skipped: 0, Time elapsed: 0.075 sec - in spoon.test.sourcePosition.SourcePositionTest
Running spoon.test.secondaryclasses.ClassesTest
Tests run: 6, Failures: 0, Errors: 0, Skipped: 0, Time elapsed: 0.247 sec - in spoon.test.secondaryclasses.ClassesTest
Running spoon.test.model.BlockTest
Tests run: 2, Failures: 0, Errors: 0, Skipped: 0, Time elapsed: 0.079 sec - in spoon.test.model.BlockTest
Running spoon.test.model.TypeTest
Tests run: 8, Failures: 0, Errors: 0, Skipped: 0, Time elapsed: 0.342 sec - in spoon.test.model.TypeTest
Running spoon.test.model.SwitchCaseTest
Tests run: 2, Failures: 0, Errors: 0, Skipped: 0, Time elapsed: 0.076 sec - in spoon.test.model.SwitchCaseTest
Running spoon.test.model.AnonymousExecutableTest
Tests run: 1, Failures: 0, Errors: 0, Skipped: 0, Time elapsed: 0.04 sec - in spoon.test.model.AnonymousExecutableTest
Running spoon.test.type.TypeTest
Tests run: 12, Failures: 0, Errors: 0, Skipped: 0, Time elapsed: 0.605 sec - in spoon.test.type.TypeTest
Running spoon.test.condition.ConditionalTest
Tests run: 4, Failures: 0, Errors: 0, Skipped: 0, Time elapsed: 0.15 sec - in spoon.test.condition.ConditionalTest
Running spoon.test.compilation.CompilationTest
>> Hello: Bar <<
>> Hello: FooEx <<
>> Hello: IBar <<
>> Hello: SimpleProcessor <<
Tests run: 13, Failures: 0, Errors: 0, Skipped: 0, Time elapsed: 6.646 sec - in spoon.test.compilation.CompilationTest
Running spoon.test.enums.EnumsTest
Tests run: 4, Failures: 0, Errors: 0, Skipped: 0, Time elapsed: 0.162 sec - in spoon.test.enums.EnumsTest
Running spoon.test.targeted.TargetedExpressionTest
Tests run: 17, Failures: 0, Errors: 0, Skipped: 0, Time elapsed: 0.724 sec - in spoon.test.targeted.TargetedExpressionTest
Running spoon.test.properties.PropertiesTest
Tests run: 1, Failures: 0, Errors: 0, Skipped: 0, Time elapsed: 0.043 sec - in spoon.test.properties.PropertiesTest
Running spoon.test.eval.EvalTest
Tests run: 4, Failures: 0, Errors: 0, Skipped: 0, Time elapsed: 0.274 sec - in spoon.test.eval.EvalTest
Running spoon.test.serializable.SerializableTest
Tests run: 3, Failures: 0, Errors: 0, Skipped: 0, Time elapsed: 0.18 sec - in spoon.test.serializable.SerializableTest
Running spoon.test.staticFieldAccess.StaticAccessTest
Tests run: 2, Failures: 0, Errors: 0, Skipped: 0, Time elapsed: 0.132 sec - in spoon.test.staticFieldAccess.StaticAccessTest
Running spoon.test.varargs.VarArgsTest
Tests run: 1, Failures: 0, Errors: 0, Skipped: 0, Time elapsed: 0.038 sec - in spoon.test.varargs.VarArgsTest
Running spoon.test.position.PositionTest
Tests run: 10, Failures: 0, Errors: 0, Skipped: 0, Time elapsed: 0.357 sec - in spoon.test.position.PositionTest
Running spoon.test.architecture.SpoonArchitectureEnforcerTest
Tests run: 6, Failures: 0, Errors: 0, Skipped: 0, Time elapsed: 12.319 sec - in spoon.test.architecture.SpoonArchitectureEnforcerTest
Running spoon.test.interfaces.InterfaceTest
Tests run: 6, Failures: 0, Errors: 0, Skipped: 0, Time elapsed: 0.264 sec - in spoon.test.interfaces.InterfaceTest
Running spoon.test.snippets.SnippetTest
Tests run: 6, Failures: 0, Errors: 0, Skipped: 0, Time elapsed: 0.325 sec - in spoon.test.snippets.SnippetTest
Running spoon.test.signature.SignatureTest
Tests run: 8, Failures: 0, Errors: 0, Skipped: 0, Time elapsed: 0.597 sec - in spoon.test.signature.SignatureTest
Running spoon.test.path.PathTest
Tests run: 6, Failures: 0, Errors: 0, Skipped: 0, Time elapsed: 0.25 sec - in spoon.test.path.PathTest
Running spoon.processing.ProcessingTest
Tests run: 2, Failures: 0, Errors: 0, Skipped: 0, Time elapsed: 0.064 sec - in spoon.processing.ProcessingTest
Running spoon.processing.CtGenerationTest
Tests run: 3, Failures: 0, Errors: 0, Skipped: 0, Time elapsed: 30.886 sec - in spoon.processing.CtGenerationTest
Running spoon.support.compiler.classpath.ComputeClasspathTest
Tests run: 1, Failures: 0, Errors: 0, Skipped: 0, Time elapsed: 0.001 sec - in spoon.support.compiler.classpath.ComputeClasspathTest
Running spoon.support.compiler.jdt.ExtendedStringLiteralTest
Tests run: 1, Failures: 0, Errors: 0, Skipped: 0, Time elapsed: 0.044 sec - in spoon.support.compiler.jdt.ExtendedStringLiteralTest
Running spoon.support.compiler.jdt.JDTBuilderTest
Tests run: 1, Failures: 0, Errors: 0, Skipped: 0, Time elapsed: 0.001 sec - in spoon.support.compiler.jdt.JDTBuilderTest
Running spoon.support.compiler.jdt.JDTBatchCompilerTest
Tests run: 1, Failures: 0, Errors: 0, Skipped: 0, Time elapsed: 0.078 sec - in spoon.support.compiler.jdt.JDTBatchCompilerTest
Running spoon.support.visitor.java.JavaReflectionTreeBuilderTest
Tests run: 9, Failures: 0, Errors: 0, Skipped: 0, Time elapsed: 0.039 sec - in spoon.support.visitor.java.JavaReflectionTreeBuilderTest
Running spoon.MavenLauncherTest
Tests run: 4, Failures: 1, Errors: 0, Skipped: 0, Time elapsed: 0.153 sec <<< FAILURE! - in spoon.MavenLauncherTest
spoonMavenLauncherTest(spoon.MavenLauncherTest)  Time elapsed: 0.075 sec  <<< FAILURE!
java.lang.AssertionError: expected:<5> but was:<0>
	at spoon.MavenLauncherTest.spoonMavenLauncherTest(MavenLauncherTest.java:16)

Running spoon.testing.CtPackageAssertTest
Tests run: 3, Failures: 0, Errors: 0, Skipped: 0, Time elapsed: 0.116 sec - in spoon.testing.CtPackageAssertTest
Running spoon.testing.FileAssertTest
Tests run: 2, Failures: 0, Errors: 0, Skipped: 0, Time elapsed: 0.153 sec - in spoon.testing.FileAssertTest
Running spoon.testing.CtElementAssertTest
Tests run: 5, Failures: 0, Errors: 0, Skipped: 0, Time elapsed: 0.222 sec - in spoon.testing.CtElementAssertTest
Running spoon.testing.AbstractAssertTest
Tests run: 4, Failures: 0, Errors: 0, Skipped: 0, Time elapsed: 0.285 sec - in spoon.testing.AbstractAssertTest

Results :

Failed tests: 
  MavenLauncherTest.spoonMavenLauncherTest:16 expected:<5> but was:<0>
Tests in error: 
  FilterTest.testInvalidQueryStep:630 » ClassCast spoon.support.reflect.declarat...

Tests run: 1186, Failures: 1, Errors: 1, Skipped: 2

[INFO] ------------------------------------------------------------------------
[INFO] BUILD FAILURE
[INFO] ------------------------------------------------------------------------
[INFO] Total time: 04:23 min
[INFO] Finished at: 2017-10-07T00:13:26+02:00
[INFO] Final Memory: 36M/950M
[INFO] ------------------------------------------------------------------------
[ERROR] Failed to execute goal org.apache.maven.plugins:maven-surefire-plugin:2.19.1:test (default-test) on project spoon-core: There are test failures.
[ERROR] 
[ERROR] Please refer to /root/workspace/INRIA/spoon/284408601/target/surefire-reports for the individual test results.
[ERROR] -> [Help 1]
[ERROR] 
[ERROR] To see the full stack trace of the errors, re-run Maven with the -e switch.
[ERROR] Re-run Maven using the -X switch to enable full debug logging.
[ERROR] 
[ERROR] For more information about the errors and possible solutions, please read the following articles:
[ERROR] [Help 1] http://cwiki.apache.org/confluence/display/MAVEN/MojoFailureException
