[INFO] Scanning for projects...
[INFO] ------------------------------------------------------------------------
[INFO] Reactor Build Order:
[INFO] 
[INFO] vpro-shared-parent
[INFO] vpro-shared-logging
[INFO] vpro-shared-util
[INFO] vpro-shared-jackson2
[INFO] vpro-shared-camel
[INFO] vpro-shared-resteasy
[INFO] vpro-shared-client-resteasy
[INFO] vpro-shared-configuration
[INFO] vpro-shared-ektorp
[INFO] vpro-shared-elasticsearch
[INFO] vpro-shared-elasticsearch5
[INFO] vpro-shared-elasticsearch-client
[INFO] vpro-shared-test
[INFO] vpro-shared-xml
[INFO] vpro-shared-hibernate
[INFO] vpro-shared-avro
[INFO] vpro-shared-persistence
[INFO] vpro-shared-rs
[INFO] vpro-shared-services
[INFO] vpro-shared-swagger
[INFO] vpro-shared-transfer
[INFO] vpro-shared-validation
[INFO] vpro-shared-web
[INFO] vpro-shared-ws
[INFO] vpro-shared-guice
[INFO] vpro-shared-couchdb-util
[INFO]                                                                         
[INFO] ------------------------------------------------------------------------
[INFO] Building vpro-shared-parent 2.0-SNAPSHOT
[INFO] ------------------------------------------------------------------------
[INFO]                                                                         
[INFO] ------------------------------------------------------------------------
[INFO] Building vpro-shared-logging 2.0-SNAPSHOT
[INFO] ------------------------------------------------------------------------
[INFO] 
[INFO] --- maven-resources-plugin:2.6:resources (default-resources) @ vpro-shared-logging ---
[INFO] Using 'UTF-8' encoding to copy filtered resources.
[INFO] skip non existing resourceDirectory /root/workspace/vpro/vpro-shared/422226958/vpro-shared-logging/src/main/resources
[INFO] 
[INFO] --- maven-compiler-plugin:3.8.0:compile (default-compile) @ vpro-shared-logging ---
[INFO] Changes detected - recompiling the module!
[INFO] Compiling 20 source files to /root/workspace/vpro/vpro-shared/422226958/vpro-shared-logging/target/classes
[INFO] 
[INFO] --- maven-resources-plugin:2.6:testResources (default-testResources) @ vpro-shared-logging ---
[INFO] Using 'UTF-8' encoding to copy filtered resources.
[INFO] skip non existing resourceDirectory /root/workspace/vpro/vpro-shared/422226958/vpro-shared-logging/src/test/resources
[INFO] 
[INFO] --- maven-compiler-plugin:3.8.0:testCompile (default-testCompile) @ vpro-shared-logging ---
[INFO] Nothing to compile - all classes are up to date
[INFO] 
[INFO] --- maven-surefire-plugin:2.20:test (default-test) @ vpro-shared-logging ---
[INFO] Downloading: https://repo.maven.apache.org/maven2/org/apache/maven/surefire/surefire-junit4/2.20/surefire-junit4-2.20.pom
[INFO] Downloaded: https://repo.maven.apache.org/maven2/org/apache/maven/surefire/surefire-junit4/2.20/surefire-junit4-2.20.pom (4 KB at 4.5 KB/sec)
[INFO] Downloading: https://repo.maven.apache.org/maven2/org/apache/maven/surefire/surefire-providers/2.20/surefire-providers-2.20.pom
[INFO] Downloaded: https://repo.maven.apache.org/maven2/org/apache/maven/surefire/surefire-providers/2.20/surefire-providers-2.20.pom (3 KB at 54.6 KB/sec)
[INFO] Downloading: https://repo.maven.apache.org/maven2/org/apache/maven/surefire/surefire-junit4/2.20/surefire-junit4-2.20.jar
[INFO] Downloaded: https://repo.maven.apache.org/maven2/org/apache/maven/surefire/surefire-junit4/2.20/surefire-junit4-2.20.jar (81 KB at 582.7 KB/sec)
[INFO] 
[INFO] -------------------------------------------------------
[INFO]  T E S T S
[INFO] -------------------------------------------------------
[INFO] Running nl.vpro.logging.LoggerHelperTest
[INFO] Tests run: 1, Failures: 0, Errors: 0, Skipped: 0, Time elapsed: 0.349 s - in nl.vpro.logging.LoggerHelperTest
[INFO] Running nl.vpro.logging.LoggerOutputStreamTest
[INFO] Tests run: 1, Failures: 0, Errors: 0, Skipped: 0, Time elapsed: 0 s - in nl.vpro.logging.LoggerOutputStreamTest
[INFO] Running nl.vpro.logging.simple.StringBuilderSimpleLoggerTest
[INFO] Tests run: 3, Failures: 0, Errors: 0, Skipped: 0, Time elapsed: 0.126 s - in nl.vpro.logging.simple.StringBuilderSimpleLoggerTest
[INFO] Running nl.vpro.logging.simple.ChainedSimpleLoggerTest
[INFO] Tests run: 1, Failures: 0, Errors: 0, Skipped: 0, Time elapsed: 0.014 s - in nl.vpro.logging.simple.ChainedSimpleLoggerTest
[INFO] 
[INFO] Results:
[INFO] 
[INFO] Tests run: 6, Failures: 0, Errors: 0, Skipped: 0
[INFO] 
[INFO]                                                                         
[INFO] ------------------------------------------------------------------------
[INFO] Building vpro-shared-util 2.0-SNAPSHOT
[INFO] ------------------------------------------------------------------------
[INFO] 
[INFO] --- maven-resources-plugin:2.6:resources (default-resources) @ vpro-shared-util ---
[INFO] Using 'UTF-8' encoding to copy filtered resources.
[INFO] Copying 1 resource
[INFO] 
[INFO] --- maven-compiler-plugin:3.8.0:compile (default-compile) @ vpro-shared-util ---
[INFO] Nothing to compile - all classes are up to date
[INFO] 
[INFO] --- maven-resources-plugin:2.6:testResources (default-testResources) @ vpro-shared-util ---
[INFO] Using 'UTF-8' encoding to copy filtered resources.
[INFO] Copying 4 resources
[INFO] 
[INFO] --- maven-compiler-plugin:3.8.0:testCompile (default-testCompile) @ vpro-shared-util ---
[INFO] Nothing to compile - all classes are up to date
[INFO] 
[INFO] --- maven-surefire-plugin:2.20:test (default-test) @ vpro-shared-util ---
[INFO] 
[INFO] -------------------------------------------------------
[INFO]  T E S T S
[INFO] -------------------------------------------------------
[INFO] Running nl.vpro.util.WindowedEventRateTest
2018-08-29 21:35:45,019 INFO WindowedEventRateTest test.72 0 duration: 0 ms. Measured rate NaN #/s (true)
2018-08-29 21:35:45,023 INFO WindowedEventRateTest test.72 100 duration: 7 ms. Measured rate 14285.714285714286 #/s (true)
2018-08-29 21:35:45,024 INFO WindowedEventRateTest test.72 200 duration: 8 ms. Measured rate 25000.0 #/s (true)
2018-08-29 21:35:45,025 INFO WindowedEventRateTest test.72 300 duration: 9 ms. Measured rate 33333.333333333336 #/s (true)
2018-08-29 21:35:45,025 INFO WindowedEventRateTest test.72 400 duration: 9 ms. Measured rate 44444.444444444445 #/s (true)
2018-08-29 21:35:45,026 INFO WindowedEventRateTest test.72 500 duration: 10 ms. Measured rate 50000.0 #/s (true)
2018-08-29 21:35:45,026 INFO WindowedEventRateTest test.72 600 duration: 10 ms. Measured rate 60000.0 #/s (true)
2018-08-29 21:35:45,026 INFO WindowedEventRateTest test.72 700 duration: 10 ms. Measured rate 70000.0 #/s (true)
2018-08-29 21:35:45,027 INFO WindowedEventRateTest test.72 800 duration: 11 ms. Measured rate 72727.27272727272 #/s (true)
2018-08-29 21:35:45,027 INFO WindowedEventRateTest test.72 900 duration: 11 ms. Measured rate 81818.18181818182 #/s (true)
2018-08-29 21:35:49,828 INFO WindowedEventRateTest test.80 duration: 4811 ms. Measured rate 207.81379883624274 #/s (true)
2018-08-29 21:35:50,054 INFO WindowedEventRateTest test.85 ranges: {[2018-08-29T19:35:46.016Z..2018-08-29T19:35:47.016Z)=0, [2018-08-29T19:35:47.016Z..2018-08-29T19:35:48.016Z)=0, [2018-08-29T19:35:48.016Z..2018-08-29T19:35:49.016Z)=0, [2018-08-29T19:35:49.016Z..2018-08-29T19:35:50.016Z)=0, [2018-08-29T19:35:50.016Z..2018-08-29T19:35:51.016Z)=0}
[ERROR] Tests run: 3, Failures: 1, Errors: 0, Skipped: 0, Time elapsed: 7.74 s <<< FAILURE! - in nl.vpro.util.WindowedEventRateTest
[ERROR] testAccuracyDuringWarmup(nl.vpro.util.WindowedEventRateTest)  Time elapsed: 1.343 s  <<< FAILURE!
java.lang.AssertionError: 

Expecting:
  <1299L>
to be close to:
  <1000L>
by less than 20% but difference was 29.9%.
(a difference of exactly 20% being considered valid)
	at nl.vpro.util.WindowedEventRateTest.testAccuracyDuringWarmup(WindowedEventRateTest.java:106)

[INFO] Running nl.vpro.util.WindowedLongSummaryStatisticsTest
{[2018-08-29T19:35:42.059Z..2018-08-29T19:35:43.059Z)=LongSummaryStatistics{count=0, sum=0, min=9223372036854775807, average=0.000000, max=-9223372036854775808}, [2018-08-29T19:35:43.059Z..2018-08-29T19:35:44.059Z)=LongSummaryStatistics{count=0, sum=0, min=9223372036854775807, average=0.000000, max=-9223372036854775808}, [2018-08-29T19:35:44.059Z..2018-08-29T19:35:45.059Z)=LongSummaryStatistics{count=0, sum=0, min=9223372036854775807, average=0.000000, max=-9223372036854775808}, [2018-08-29T19:35:45.059Z..2018-08-29T19:35:46.059Z)=LongSummaryStatistics{count=0, sum=0, min=9223372036854775807, average=0.000000, max=-9223372036854775808}, [2018-08-29T19:35:46.059Z..2018-08-29T19:35:47.059Z)=LongSummaryStatistics{count=0, sum=0, min=9223372036854775807, average=0.000000, max=-9223372036854775808}, [2018-08-29T19:35:47.059Z..2018-08-29T19:35:48.059Z)=LongSummaryStatistics{count=0, sum=0, min=9223372036854775807, average=0.000000, max=-9223372036854775808}, [2018-08-29T19:35:48.059Z..2018-08-29T19:35:49.059Z)=LongSummaryStatistics{count=0, sum=0, min=9223372036854775807, average=0.000000, max=-9223372036854775808}, [2018-08-29T19:35:49.059Z..2018-08-29T19:35:50.059Z)=LongSummaryStatistics{count=0, sum=0, min=9223372036854775807, average=0.000000, max=-9223372036854775808}, [2018-08-29T19:35:50.059Z..2018-08-29T19:35:51.059Z)=LongSummaryStatistics{count=2, sum=300, min=100, average=150.000000, max=200}, [2018-08-29T19:35:51.059Z..2018-08-29T19:35:52.059Z)=LongSummaryStatistics{count=2, sum=500, min=200, average=250.000000, max=300}}
[INFO] Tests run: 1, Failures: 0, Errors: 0, Skipped: 0, Time elapsed: 1.021 s - in nl.vpro.util.WindowedLongSummaryStatisticsTest
[INFO] Running nl.vpro.util.MultiLanguageStringTest
[INFO] Tests run: 4, Failures: 0, Errors: 0, Skipped: 0, Time elapsed: 0.052 s - in nl.vpro.util.MultiLanguageStringTest
[INFO] Running nl.vpro.util.URLResourceTest
2018-08-29 21:35:52,138 INFO URLResource getCachedResource.289 Loaded https://poms.omroep.nl/broadcasters/ -> 2018-08-23T00:07:41Z
{NMO=NMO, JO=Joodse Omroep, NPO=NPO, MO=Moslim Omroep, PP=Politieke partijen, BNN=BNN, KRNC=KRO-NCRV, AVRO=AVRO, RNW=Radio Nederland Wereldomroep, LLNK=LLiNK, SOCU=Socutera, RKK=RKK, NED3=NPO 3, NED2=NPO 2, BNVA=BNNVARA, RTUT=RTV Utrecht, NIO=NIO, NOS=NOS, NED1=NPO 1, RTOO=RTV Oost, TROS=TROS, VARA=VARA, RTRM=RTV Rijnmond, OBBT=Omroep Brabant, RAD6=NPO Radio 6, OWST=Omroep West, RAD5=NPO Radio 5, VRT=VRT, RAD4=NPO Radio 4, EXT=External, RAD3=NPO 3FM, RAD2=NPO Radio 2, RAD1=NPO Radio 1, VPRO=VPRO, AVTR=AVROTROS, OFVL=Omroep Flevoland, BVN=BVN, ZAPP=NPO Zapp, POWN=PowNed, FUNX=FunX, ZAPL=NPO Zappelin, OHM=OHM, RVU=RVU, NCRV=NCRV, ROGE=TV Gelderland, MTNL=MTNL, EO=EO, RTNO=RTV Noord, WNL=WNL, IKON=IKON, L1=L1, POGO=Polygoon, NTR=NTR, BOS=BOS, RVD=Rijksvoorlichtingsdienst, ZVK=ZvK, KRO=KRO, RTNH=RTV Noord Holland, OZEE=Omroep Zeeland, ROFR=Omrop Frysl창n, RTDR=RTV Drenthe, HUMA=Human, MAX=MAX, TELE=Teleac, NPS=NPS}
2018-08-29 21:35:54,272 INFO URLResource getCachedResource.283 Found expiry 2018-08-29T20:35:54.272Z for https://poms.omroep.nl/broadcasters/ truncated to 2018-08-29T19:35:55.272Z
{NMO=NMO, JO=Joodse Omroep, NPO=NPO, MO=Moslim Omroep, PP=Politieke partijen, BNN=BNN, KRNC=KRO-NCRV, AVRO=AVRO, RNW=Radio Nederland Wereldomroep, LLNK=LLiNK, SOCU=Socutera, RKK=RKK, NED3=NPO 3, NED2=NPO 2, BNVA=BNNVARA, RTUT=RTV Utrecht, NIO=NIO, NOS=NOS, NED1=NPO 1, RTOO=RTV Oost, TROS=TROS, VARA=VARA, RTRM=RTV Rijnmond, OBBT=Omroep Brabant, RAD6=NPO Radio 6, OWST=Omroep West, RAD5=NPO Radio 5, VRT=VRT, RAD4=NPO Radio 4, EXT=External, RAD3=NPO 3FM, RAD2=NPO Radio 2, RAD1=NPO Radio 1, VPRO=VPRO, AVTR=AVROTROS, OFVL=Omroep Flevoland, BVN=BVN, ZAPP=NPO Zapp, POWN=PowNed, FUNX=FunX, ZAPL=NPO Zappelin, OHM=OHM, RVU=RVU, NCRV=NCRV, ROGE=TV Gelderland, MTNL=MTNL, EO=EO, RTNO=RTV Noord, WNL=WNL, IKON=IKON, L1=L1, POGO=Polygoon, NTR=NTR, BOS=BOS, RVD=Rijksvoorlichtingsdienst, ZVK=ZvK, KRO=KRO, RTNH=RTV Noord Holland, OZEE=Omroep Zeeland, ROFR=Omrop Frysl창n, RTDR=RTV Drenthe, HUMA=Human, MAX=MAX, TELE=Teleac, NPS=NPS}
2018-08-29 21:35:54,328 INFO URLResource getCachedResource.319 http://poms.omroep.nl/broadcasters/ is redirecting to https://poms.omroep.nl/broadcasters/
2018-08-29 21:35:54,356 INFO URLResource getCachedResource.289 Loaded http://poms.omroep.nl/broadcasters/ -> 2018-08-23T00:07:41Z
2018-08-29 21:35:54,372 INFO URLResource getCachedResource.185 Loaded {NMO=NMO, JO=Joodse Omroep, NPO=NPO, MO=Moslim Omroep, PP=Politieke partijen, BNN=BNN, KRNC=KRO-NCRV, AVRO=AVRO, RNW=Radio Nederland Wereldomroep, LLNK=LLiNK, SOCU=Socutera, RKK=RKK, NED3=NPO 3, NED2=NPO 2, RTUT=RTV Utrecht, NIO=NIO, NOS=NOS, NED1=NPO 1, RTOO=RTV Oost, TROS=TROS, VARA=VARA, RTRM=RTV Rijnmond, OBBT=Omroep Brabant, RAD6=NPO Radio 6, RAD5=NPO Radio 5, OWST=Omroep West, RAD4=NPO Radio 4, VRT=VRT, RAD3=NPO 3FM, EXT=External, RAD2=NPO Radio 2, RAD1=NPO Radio 1, AVTR=AVROTROS, VPRO=VPRO, OFVL=Omroep Flevoland, ZAPP=NPO Zapp, BVN=BVN, POWN=PowNed, ZAPL=NPO Zappelin, FUNX=FunX, RVU=RVU, OHM=OHM, NCRV=NCRV, ROGE=TV Gelderland, MTNL=MTNL, RTNO=RTV Noord, EO=EO, WNL=WNL, L1=L1, IKON=IKON, NTR=NTR, POGO=Polygoon, BOS=BOS, RTNH=RTV Noord Holland, KRO=KRO, ZVK=ZvK, RVD=Rijksvoorlichtingsdienst, OZEE=Omroep Zeeland, ROFR=Omrop Frysl창n, RTDR=RTV Drenthe, HUMA=HUMAN, MAX=MAX, TELE=Teleac, NPS=NPS} from classpath:/broadcasters.properties
2018-08-29 21:35:54,380 INFO URLResource getCachedResource.185 Loaded {NMO=NMO, JO=Joodse Omroep, NPO=NPO, MO=Moslim Omroep, PP=Politieke partijen, BNN=BNN, KRNC=KRO-NCRV, AVRO=AVRO, RNW=Radio Nederland Wereldomroep, LLNK=LLiNK, SOCU=Socutera, RKK=RKK, NED3=NPO 3, NED2=NPO 2, RTUT=RTV Utrecht, NIO=NIO, NOS=NOS, NED1=NPO 1, RTOO=RTV Oost, TROS=TROS, VARA=VARA, RTRM=RTV Rijnmond, OBBT=Omroep Brabant, RAD6=NPO Radio 6, OWST=Omroep West, RAD5=NPO Radio 5, VRT=VRT, RAD4=NPO Radio 4, EXT=External, RAD3=NPO 3FM, RAD2=NPO Radio 2, RAD1=NPO Radio 1, VPRO=VPRO, AVTR=AVROTROS, OFVL=Omroep Flevoland, BVN=BVN, ZAPP=NPO Zapp, POWN=PowNed, FUNX=FunX, ZAPL=NPO Zappelin, OHM=OHM, RVU=RVU, NCRV=NCRV, ROGE=TV Gelderland, MTNL=MTNL, EO=EO, RTNO=RTV Noord, WNL=WNL, IKON=IKON, L1=L1, POGO=Polygoon, NTR=NTR, BOS=BOS, RVD=Rijksvoorlichtingsdienst, ZVK=ZvK, KRO=KRO, RTNH=RTV Noord Holland, OZEE=Omroep Zeeland, ROFR=Omrop Frysl창n, RTDR=RTV Drenthe, HUMA=HUMAN, MAX=MAX, TELE=Teleac, NPS=NPS} from classpath:/broadcasters.properties
2018-08-29 21:35:55,782 WARN URLResource getCachedResource.334 503:http://poms.omroep.nl/broadcasters/: (caching until 2018-08-29T19:35:55.781Z)
2018-08-29 21:35:55,783 INFO URLResource getCachedResource.303 Reloaded http://poms.omroep.nl/broadcasters/ as it was expired (lastmodified null  -> 1970-01-01T00:00:00Z)
2018-08-29 21:35:55,784 WARN URLResource getCachedResource.334 500:http://poms.omroep.nl/broadcasters/: (caching until 2018-08-29T19:35:55.784Z)
2018-08-29 21:35:55,785 INFO URLResource getCachedResource.303 Reloaded http://poms.omroep.nl/broadcasters/ as it was expired (lastmodified null  -> 1970-01-01T00:00:00Z)
[WARNING] Tests run: 6, Failures: 0, Errors: 0, Skipped: 1, Time elapsed: 4.639 s - in nl.vpro.util.URLResourceTest
[INFO] Running nl.vpro.util.FileCachingInputStreamTest
2018-08-29 21:35:55,806 INFO FileCachingInputStreamTest before.37 Interrupted false
2018-08-29 21:35:55,877 INFO FileCachingInputStreamTest before.37 Interrupted false
2018-08-29 21:35:55,888 INFO FileCachingInputStream close.273 Interrupted Copier(ready=true, count=1200, in=java.io.ByteArrayInputStream@3081f72c, out=java.io.BufferedOutputStream@3148f668, batch=3, callback=nl.vpro.util.FileCachingInputStream$$Lambda$31/1217207511@6e005dc9, errorHandler=null, batchConsumer=nl.vpro.util.FileCachingInputStream$$Lambda$32/951741667@7ceb3185, future=java.util.concurrent.FutureTask@436c81a3, name=/tmp/file-caching-inputstream3212049973068531469.tmp, notify=nl.vpro.util.FileCachingInputStream@3561c410)
2018-08-29 21:35:55,890 INFO FileCachingInputStreamTest before.37 Interrupted false
2018-08-29 21:35:57,956 INFO FileCachingInputStream lambda$new$3.218 Created /tmp/file-caching-inputstream749526996270778191.tmp (1200 bytes written)
2018-08-29 21:35:57,958 INFO FileCachingInputStreamTest before.37 Interrupted false
2018-08-29 21:35:57,968 INFO FileCachingInputStream close.273 Interrupted Copier(ready=false, count=301, in=java.io.ByteArrayInputStream@3917c4f2, out=java.io.BufferedOutputStream@37d03da0, batch=3, callback=nl.vpro.util.FileCachingInputStream$$Lambda$31/1217207511@33efaf82, errorHandler=null, batchConsumer=nl.vpro.util.FileCachingInputStream$$Lambda$32/951741667@76ed379b, future=java.util.concurrent.FutureTask@715a4de0, name=/tmp/file-caching-inputstream7391698720968847104.tmp, notify=nl.vpro.util.FileCachingInputStream@47514356)
2018-08-29 21:35:57,975 RROR Copier run.102 /tmp/file-caching-inputstream7391698720968847104.tmp: Connector Copier(ready=false, count=301, in=java.io.ByteArrayInputStream@3917c4f2, out=java.io.BufferedOutputStream@37d03da0, batch=3, callback=nl.vpro.util.FileCachingInputStream$$Lambda$31/1217207511@33efaf82, errorHandler=null, batchConsumer=nl.vpro.util.FileCachingInputStream$$Lambda$32/951741667@76ed379b, future=java.util.concurrent.FutureTask@715a4de0, name=/tmp/file-caching-inputstream7391698720968847104.tmp, notify=nl.vpro.util.FileCachingInputStream@47514356): class java.nio.channels.ClosedByInterruptException null
2018-08-29 21:35:57,975 INFO FileCachingInputStream lambda$new$3.218 Created /tmp/file-caching-inputstream7391698720968847104.tmp (301 bytes written)
2018-08-29 21:35:57,976 INFO FileCachingInputStreamTest before.37 Interrupted false
2018-08-29 21:35:57,980 INFO FileCachingInputStream lambda$new$0.180 Creating /tmp/file-caching-inputstream2878177922821955138.tmp (4 bytes written)
2018-08-29 21:35:57,981 INFO FileCachingInputStream lambda$new$0.180 Creating /tmp/file-caching-inputstream2878177922821955138.tmp (5 bytes written)
2018-08-29 21:35:57,981 INFO FileCachingInputStream lambda$new$0.180 Creating /tmp/file-caching-inputstream2878177922821955138.tmp (6 bytes written)
2018-08-29 21:35:57,982 INFO FileCachingInputStream lambda$new$0.180 Creating /tmp/file-caching-inputstream2878177922821955138.tmp (7 bytes written)
2018-08-29 21:35:57,982 INFO FileCachingInputStream lambda$new$0.180 Creating /tmp/file-caching-inputstream2878177922821955138.tmp (8 bytes written)
2018-08-29 21:35:57,982 INFO FileCachingInputStream lambda$new$0.180 Creating /tmp/file-caching-inputstream2878177922821955138.tmp (9 bytes written)
2018-08-29 21:35:57,982 INFO FileCachingInputStream lambda$new$0.180 Creating /tmp/file-caching-inputstream2878177922821955138.tmp (10 bytes written)
2018-08-29 21:35:57,982 INFO FileCachingInputStreamTest testWaitForBytes.302 Found 10
2018-08-29 21:35:57,983 INFO FileCachingInputStream lambda$new$0.180 Creating /tmp/file-caching-inputstream2878177922821955138.tmp (11 bytes written)
2018-08-29 21:35:57,983 INFO FileCachingInputStream lambda$new$0.180 Creating /tmp/file-caching-inputstream2878177922821955138.tmp (12 bytes written)
2018-08-29 21:35:57,983 INFO FileCachingInputStream lambda$new$3.218 Created /tmp/file-caching-inputstream2878177922821955138.tmp (12 bytes written)
2018-08-29 21:35:57,986 INFO FileCachingInputStreamTest before.37 Interrupted false
2018-08-29 21:36:00,057 INFO FileCachingInputStream lambda$new$3.218 Created /tmp/file-caching-inputstream267487484584453531.tmp (1200 bytes written)
2018-08-29 21:36:00,059 INFO FileCachingInputStreamTest before.37 Interrupted false
2018-08-29 21:36:00,066 INFO FileCachingInputStreamTest lambda$testReadFileGetsInterrupted$1.117 301 Interrupting Thread[main,5,main] 0
2018-08-29 21:36:00,068 INFO FileCachingInputStream close.273 Interrupted Copier(ready=false, count=337, in=java.io.ByteArrayInputStream@301eda63, out=java.io.BufferedOutputStream@3d246ea3, batch=3, callback=nl.vpro.util.FileCachingInputStream$$Lambda$31/1217207511@341814d3, errorHandler=null, batchConsumer=nl.vpro.util.FileCachingInputStream$$Lambda$32/951741667@4397ad89, future=java.util.concurrent.FutureTask@59cba5a, name=/tmp/file-caching-inputstream240614599270740961.tmp, notify=nl.vpro.util.FileCachingInputStream@1bd39d3c)
2018-08-29 21:36:00,069 INFO FileCachingInputStreamTest testReadFileGetsInterrupted.144 Interrupted: true
2018-08-29 21:36:00,070 INFO FileCachingInputStreamTest before.37 Interrupted true
2018-08-29 21:36:00,070 INFO FileCachingInputStreamTest testWaitForBytesOnZeroBytes.324 Found 0
2018-08-29 21:36:00,071 INFO FileCachingInputStreamTest before.37 Interrupted false
2018-08-29 21:36:00,082 RROR Copier run.102 /tmp/file-caching-inputstream240614599270740961.tmp: Connector Copier(ready=false, count=337, in=java.io.ByteArrayInputStream@301eda63, out=java.io.BufferedOutputStream@3d246ea3, batch=3, callback=nl.vpro.util.FileCachingInputStream$$Lambda$31/1217207511@341814d3, errorHandler=null, batchConsumer=nl.vpro.util.FileCachingInputStream$$Lambda$32/951741667@4397ad89, future=java.util.concurrent.FutureTask@59cba5a, name=/tmp/file-caching-inputstream240614599270740961.tmp, notify=nl.vpro.util.FileCachingInputStream@1bd39d3c): class java.nio.channels.ClosedByInterruptException null
2018-08-29 21:36:00,091 INFO FileCachingInputStream lambda$new$3.218 Created /tmp/file-caching-inputstream240614599270740961.tmp (337 bytes written)
2018-08-29 21:36:00,117 INFO FileCachingInputStreamTest before.37 Interrupted false
2018-08-29 21:36:00,125 INFO FileCachingInputStream <init>.155 Created /tmp/bestaatniet
2018-08-29 21:36:00,126 INFO FileCachingInputStream lambda$new$0.180 Creating /tmp/bestaatniet/file-caching-inputstream6613506945805799405.tmp (12 bytes written)
2018-08-29 21:36:00,127 INFO FileCachingInputStream lambda$new$3.218 Created /tmp/bestaatniet/file-caching-inputstream6613506945805799405.tmp (12 bytes written)
2018-08-29 21:36:00,132 INFO FileCachingInputStreamTest before.37 Interrupted false
2018-08-29 21:36:00,148 INFO FileCachingInputStreamTest before.37 Interrupted false
2018-08-29 21:36:00,150 INFO FileCachingInputStream lambda$new$0.180 Creating /tmp/file-caching-inputstream8057634550615266893.tmp (12 bytes written)
2018-08-29 21:36:00,151 INFO FileCachingInputStream lambda$new$3.218 Created /tmp/file-caching-inputstream8057634550615266893.tmp (12 bytes written)
2018-08-29 21:36:00,154 INFO FileCachingInputStreamTest before.37 Interrupted false
[WARNING] Tests run: 17, Failures: 0, Errors: 0, Skipped: 4, Time elapsed: 4.381 s - in nl.vpro.util.FileCachingInputStreamTest
[INFO] Running nl.vpro.util.ResortedSortedSetTest
[INFO] Tests run: 4, Failures: 0, Errors: 0, Skipped: 0, Time elapsed: 0.015 s - in nl.vpro.util.ResortedSortedSetTest
[INFO] Running nl.vpro.util.CommandExecutorImplTest
2018-08-29 21:36:00,227 INFO usr log.97 /usr/bin/env echo hoi
2018-08-29 21:36:00,344 INFO usr log.97 /usr/bin/env echo hoi
2018-08-29 21:36:00,349 INFO usr log.97 hoi
2018-08-29 21:36:00,403 INFO usr log.97 /usr/bin/env find .
2018-08-29 21:36:00,456 INFO CommandExecutorImplTest accept.184 .
2018-08-29 21:36:00,456 INFO CommandExecutorImplTest accept.184 ./target
2018-08-29 21:36:00,456 INFO CommandExecutorImplTest accept.184 ./target/maven-archiver
2018-08-29 21:36:00,457 INFO CommandExecutorImplTest accept.184 ./target/maven-archiver/pom.properties
2018-08-29 21:36:00,457 INFO CommandExecutorImplTest accept.184 ./target/test-classes
2018-08-29 21:36:00,457 INFO CommandExecutorImplTest accept.184 ./target/test-classes/log4j.xml
2018-08-29 21:36:00,457 INFO CommandExecutorImplTest accept.184 ./target/test-classes/reflectionutilstest_with_prefix.properties
2018-08-29 21:36:00,457 INFO CommandExecutorImplTest accept.184 ./target/test-classes/reflectionutilstest.properties
2018-08-29 21:36:00,458 INFO CommandExecutorImplTest accept.184 ./target/test-classes/broadcasters.properties
2018-08-29 21:36:00,458 INFO CommandExecutorImplTest accept.184 ./target/test-classes/nl
2018-08-29 21:36:00,458 INFO CommandExecutorImplTest accept.184 ./target/test-classes/nl/vpro
2018-08-29 21:36:00,458 INFO CommandExecutorImplTest accept.184 ./target/test-classes/nl/vpro/util
2018-08-29 21:36:00,458 INFO CommandExecutorImplTest accept.184 ./target/test-classes/nl/vpro/util/WindowedEventRateTest.class
2018-08-29 21:36:00,458 INFO CommandExecutorImplTest accept.184 ./target/test-classes/nl/vpro/util/WindowedLongSummaryStatisticsTest.class
2018-08-29 21:36:00,459 INFO CommandExecutorImplTest accept.184 ./target/test-classes/nl/vpro/util/MultiLanguageStringTest.class
2018-08-29 21:36:00,459 INFO CommandExecutorImplTest accept.184 ./target/test-classes/nl/vpro/util/URLResourceTest.class
2018-08-29 21:36:00,459 INFO CommandExecutorImplTest accept.184 ./target/test-classes/nl/vpro/util/FileCachingInputStreamTest.class
2018-08-29 21:36:00,459 INFO CommandExecutorImplTest accept.184 ./target/test-classes/nl/vpro/util/ResortedSortedSetTest.class
2018-08-29 21:36:00,459 INFO CommandExecutorImplTest accept.184 ./target/test-classes/nl/vpro/util/CommandExecutorImplTest.class
2018-08-29 21:36:00,460 INFO CommandExecutorImplTest accept.184 ./target/test-classes/nl/vpro/util/ObjectFilterTest$A.class
2018-08-29 21:36:00,472 INFO bin log.97 /bin/pwd
2018-08-29 21:36:00,483 INFO CommandExecutorImplTest workdir.67 Found workdir /tmp
[INFO] Tests run: 4, Failures: 0, Errors: 0, Skipped: 0, Time elapsed: 0.285 s - in nl.vpro.util.CommandExecutorImplTest
[INFO] Running nl.vpro.util.DateUtilsTest
[INFO] Tests run: 4, Failures: 0, Errors: 0, Skipped: 0, Time elapsed: 0.014 s - in nl.vpro.util.DateUtilsTest
[INFO] Running nl.vpro.util.CallbackIteratorTest
[INFO] Tests run: 1, Failures: 0, Errors: 0, Skipped: 0, Time elapsed: 0.054 s - in nl.vpro.util.CallbackIteratorTest
[INFO] Running nl.vpro.util.TextUtilTest
[INFO] Tests run: 34, Failures: 0, Errors: 0, Skipped: 0, Time elapsed: 0.395 s - in nl.vpro.util.TextUtilTest
[INFO] Running nl.vpro.util.BatchedReceiverTest
[INFO] Tests run: 2, Failures: 0, Errors: 0, Skipped: 0, Time elapsed: 0.004 s - in nl.vpro.util.BatchedReceiverTest
[INFO] Running nl.vpro.util.URLPathEncodeTest
[INFO] Tests run: 2, Failures: 0, Errors: 0, Skipped: 0, Time elapsed: 0.006 s - in nl.vpro.util.URLPathEncodeTest
[INFO] Running nl.vpro.util.MaxOffsetIteratorTest
[INFO] Tests run: 4, Failures: 0, Errors: 0, Skipped: 0, Time elapsed: 0.029 s - in nl.vpro.util.MaxOffsetIteratorTest
[INFO] Running nl.vpro.util.MergedSortedIteratorTest
[INFO] Tests run: 3, Failures: 0, Errors: 0, Skipped: 0, Time elapsed: 0.015 s - in nl.vpro.util.MergedSortedIteratorTest
[INFO] Running nl.vpro.util.FilteringIteratorTest
[INFO] Tests run: 5, Failures: 0, Errors: 0, Skipped: 0, Time elapsed: 0.01 s - in nl.vpro.util.FilteringIteratorTest
[INFO] Running nl.vpro.util.ISO6937Test
[INFO] Tests run: 5, Failures: 0, Errors: 0, Skipped: 0, Time elapsed: 0.326 s - in nl.vpro.util.ISO6937Test
[INFO] Running nl.vpro.util.TransformingSortedSetTest
[INFO] Tests run: 5, Failures: 0, Errors: 0, Skipped: 0, Time elapsed: 0.01 s - in nl.vpro.util.TransformingSortedSetTest
[INFO] Running nl.vpro.util.FileSizeFormatterTest
[INFO] Tests run: 4, Failures: 0, Errors: 0, Skipped: 0, Time elapsed: 0.012 s - in nl.vpro.util.FileSizeFormatterTest
[INFO] Running nl.vpro.util.ProviderAndBuilderTest
[INFO] Tests run: 3, Failures: 0, Errors: 0, Skipped: 0, Time elapsed: 0.041 s - in nl.vpro.util.ProviderAndBuilderTest
[INFO] Running nl.vpro.util.ObjectFilterTest
2018-08-29 21:36:01,457 RROR Copier run.102 command output: Connector Copier(ready=false, count=0, in=java.lang.UNIXProcess$ProcessPipeInputStream@3f714869, out=java.io.PipedOutputStream@31b6b1f7, batch=8192, callback=null, errorHandler=nl.vpro.util.CommandExecutorImpl$$Lambda$52/1985925702@35892319, batchConsumer=null, future=null, name=command output, notify=null): class java.io.IOException Read end dead
2018-08-29 21:36:01,466 INFO usr log.97 Killed java.lang.UNIXProcess@708bbbcc because class java.io.IOException: Read end dead
[INFO] Tests run: 1, Failures: 0, Errors: 0, Skipped: 0, Time elapsed: 0.029 s - in nl.vpro.util.ObjectFilterTest
[INFO] Running nl.vpro.util.ThreadPoolsTest
[WARNING] Tests run: 1, Failures: 0, Errors: 0, Skipped: 1, Time elapsed: 0 s - in nl.vpro.util.ThreadPoolsTest
[INFO] Running nl.vpro.util.HeadAdderTest
[INFO] Tests run: 7, Failures: 0, Errors: 0, Skipped: 0, Time elapsed: 0.026 s - in nl.vpro.util.HeadAdderTest
[INFO] Running nl.vpro.util.TailAdderTest
2018-08-29 21:36:01,525 WARN TailAdder findNext.132 java.lang.Exception
[INFO] Tests run: 7, Failures: 0, Errors: 0, Skipped: 0, Time elapsed: 0.004 s - in nl.vpro.util.TailAdderTest
[INFO] Running nl.vpro.util.TimeUtilsTest
2018-08-29 21:36:01,531 INFO TimeUtilsTest parse2.52 2018-02-13T09:00
PT4.0006S
[INFO] Tests run: 8, Failures: 0, Errors: 0, Skipped: 0, Time elapsed: 0.058 s - in nl.vpro.util.TimeUtilsTest
[INFO] Running nl.vpro.util.SkippingIteratorTest
[INFO] Tests run: 4, Failures: 0, Errors: 0, Skipped: 0, Time elapsed: 0.005 s - in nl.vpro.util.SkippingIteratorTest
[INFO] Running nl.vpro.util.StringsTest
[INFO] Tests run: 2, Failures: 0, Errors: 0, Skipped: 0, Time elapsed: 0.015 s - in nl.vpro.util.StringsTest
[INFO] Running nl.vpro.util.TransformingListTest
[INFO] Tests run: 3, Failures: 0, Errors: 0, Skipped: 0, Time elapsed: 0.008 s - in nl.vpro.util.TransformingListTest
[INFO] Running nl.vpro.util.ConfigUtilsTest
2018-08-29 21:36:01,634 INFO ConfigUtils getProperties.96 Reading classpath:/reflectionutilstest.properties
2018-08-29 21:36:01,636 INFO ConfigUtils getProperties.100 Reading properties from classpath classpath:/reflectionutilstest.properties
2018-08-29 21:36:01,674 INFO ConfigUtils getProperties.96 Reading classpath:/reflectionutilstest.properties
2018-08-29 21:36:01,674 INFO ConfigUtils getProperties.100 Reading properties from classpath classpath:/reflectionutilstest.properties
2018-08-29 21:36:01,684 INFO ConfigUtils getProperties.96 Reading classpath:/reflectionutilstest.properties
2018-08-29 21:36:01,685 INFO ConfigUtils getProperties.100 Reading properties from classpath classpath:/reflectionutilstest.properties
[INFO] Tests run: 17, Failures: 0, Errors: 0, Skipped: 0, Time elapsed: 0.091 s - in nl.vpro.util.ConfigUtilsTest
[INFO] Running nl.vpro.util.WrappedIteratorTest
[INFO] Tests run: 1, Failures: 0, Errors: 0, Skipped: 0, Time elapsed: 0.004 s - in nl.vpro.util.WrappedIteratorTest
[INFO] Running nl.vpro.util.UrlProviderTest
[INFO] Tests run: 2, Failures: 0, Errors: 0, Skipped: 0, Time elapsed: 0 s - in nl.vpro.util.UrlProviderTest
[INFO] Running nl.vpro.util.PairTest
[INFO] Tests run: 1, Failures: 0, Errors: 0, Skipped: 0, Time elapsed: 0 s - in nl.vpro.util.PairTest
[INFO] Running nl.vpro.util.HTMLStripperTest
[INFO] Tests run: 1, Failures: 0, Errors: 0, Skipped: 0, Time elapsed: 0.08 s - in nl.vpro.util.HTMLStripperTest
[INFO] Running nl.vpro.util.ReflectionUtilsTest
[INFO] Tests run: 2, Failures: 0, Errors: 0, Skipped: 0, Time elapsed: 0.012 s - in nl.vpro.util.ReflectionUtilsTest
[INFO] 
[INFO] Results:
[INFO] 
[ERROR] Failures: 
[ERROR]   WindowedEventRateTest.testAccuracyDuringWarmup:106 
Expecting:
  <1299L>
to be close to:
  <1000L>
by less than 20% but difference was 29.9%.
(a difference of exactly 20% being considered valid)
[INFO] 
[ERROR] Tests run: 168, Failures: 1, Errors: 0, Skipped: 6
[INFO] 
[INFO] ------------------------------------------------------------------------
[INFO] Reactor Summary:
[INFO] 
[INFO] vpro-shared-parent ................................. SUCCESS [  0.004 s]
[INFO] vpro-shared-logging ................................ SUCCESS [ 13.234 s]
[INFO] vpro-shared-util ................................... FAILURE [ 20.266 s]
[INFO] vpro-shared-jackson2 ............................... SKIPPED
[INFO] vpro-shared-camel .................................. SKIPPED
[INFO] vpro-shared-resteasy ............................... SKIPPED
[INFO] vpro-shared-client-resteasy ........................ SKIPPED
[INFO] vpro-shared-configuration .......................... SKIPPED
[INFO] vpro-shared-ektorp ................................. SKIPPED
[INFO] vpro-shared-elasticsearch .......................... SKIPPED
[INFO] vpro-shared-elasticsearch5 ......................... SKIPPED
[INFO] vpro-shared-elasticsearch-client ................... SKIPPED
[INFO] vpro-shared-test ................................... SKIPPED
[INFO] vpro-shared-xml .................................... SKIPPED
[INFO] vpro-shared-hibernate .............................. SKIPPED
[INFO] vpro-shared-avro ................................... SKIPPED
[INFO] vpro-shared-persistence ............................ SKIPPED
[INFO] vpro-shared-rs ..................................... SKIPPED
[INFO] vpro-shared-services ............................... SKIPPED
[INFO] vpro-shared-swagger ................................ SKIPPED
[INFO] vpro-shared-transfer ............................... SKIPPED
[INFO] vpro-shared-validation ............................. SKIPPED
[INFO] vpro-shared-web .................................... SKIPPED
[INFO] vpro-shared-ws ..................................... SKIPPED
[INFO] vpro-shared-guice .................................. SKIPPED
[INFO] vpro-shared-couchdb-util ........................... SKIPPED
[INFO] ------------------------------------------------------------------------
[INFO] BUILD FAILURE
[INFO] ------------------------------------------------------------------------
[INFO] Total time: 34.547 s
[INFO] Finished at: 2018-08-29T21:36:01+02:00
[INFO] Final Memory: 27M/310M
[INFO] ------------------------------------------------------------------------
[ERROR] Failed to execute goal org.apache.maven.plugins:maven-surefire-plugin:2.20:test (default-test) on project vpro-shared-util: There are test failures.
[ERROR] 
[ERROR] Please refer to /root/workspace/vpro/vpro-shared/422226958/vpro-shared-util/target/surefire-reports for the individual test results.
[ERROR] Please refer to dump files (if any exist) [date]-jvmRun[N].dump, [date].dumpstream and [date]-jvmRun[N].dumpstream.
[ERROR] -> [Help 1]
[ERROR] 
[ERROR] To see the full stack trace of the errors, re-run Maven with the -e switch.
[ERROR] Re-run Maven using the -X switch to enable full debug logging.
[ERROR] 
[ERROR] For more information about the errors and possible solutions, please read the following articles:
[ERROR] [Help 1] http://cwiki.apache.org/confluence/display/MAVEN/MojoFailureException
[ERROR] 
[ERROR] After correcting the problems, you can resume the build with the command
[ERROR]   mvn <goals> -rf :vpro-shared-util
