[INFO] Scanning for projects...
[INFO] ------------------------------------------------------------------------
[INFO] Reactor Build Order:
[INFO] 
[INFO] Apache Commons VFS Project
[INFO] Apache Commons VFS
[INFO] Apache Commons VFS Examples
[INFO] Apache Commons VFS Distribution
[INFO]                                                                         
[INFO] ------------------------------------------------------------------------
[INFO] Building Apache Commons VFS Project 2.2.1-SNAPSHOT
[INFO] ------------------------------------------------------------------------
[INFO] 
[INFO] --- maven-enforcer-plugin:1.4.1:enforce (enforce-maven-3) @ commons-vfs2-project ---
[INFO] Skipping Rule Enforcement.
[INFO] 
[INFO] --- build-helper-maven-plugin:3.0.0:parse-version (parse-version) @ commons-vfs2-project ---
[INFO] 
[INFO] --- maven-antrun-plugin:1.8:run (javadoc.resources) @ commons-vfs2-project ---
[INFO] Executing tasks

main:
[INFO] Executed tasks
[INFO] 
[INFO] --- maven-antrun-plugin:1.8:run (vfs-jar-manifest) @ commons-vfs2-project ---
[INFO] Executing tasks

main:
[INFO] Executed tasks
[INFO] 
[INFO] --- maven-remote-resources-plugin:1.5:process (process-resource-bundles) @ commons-vfs2-project ---
[INFO] 
[INFO] --- buildnumber-maven-plugin:1.4:create (default) @ commons-vfs2-project ---
[INFO] Executing: /bin/sh -c cd '/root/workspace/apache/commons-vfs/342399535' && 'svn' '--non-interactive' 'info'
[INFO] Working directory: /root/workspace/apache/commons-vfs/342399535
[INFO] Storing buildNumber: ?????? at timestamp: 1518796542497
[INFO] Executing: /bin/sh -c cd '/root/workspace/apache/commons-vfs/342399535' && 'svn' '--non-interactive' 'info'
[INFO] Working directory: /root/workspace/apache/commons-vfs/342399535
[INFO] Storing buildScmBranch: UNKNOWN_BRANCH
[INFO] 
[INFO] --- maven-bundle-plugin:3.4.0:manifest (bundle-manifest) @ commons-vfs2-project ---
[WARNING] Ignoring project type pom - supportedProjectTypes = [jar, bundle]
[INFO] 
[INFO] --- animal-sniffer-maven-plugin:1.16:check (checkAPIcompatibility) @ commons-vfs2-project ---
[INFO] Checking unresolved references to org.codehaus.mojo.signature:java17:1.0
[INFO]                                                                         
[INFO] ------------------------------------------------------------------------
[INFO] Building Apache Commons VFS 2.2.1-SNAPSHOT
[INFO] ------------------------------------------------------------------------
[INFO] 
[INFO] --- maven-enforcer-plugin:1.4.1:enforce (enforce-maven-3) @ commons-vfs2 ---
[INFO] Skipping Rule Enforcement.
[INFO] 
[INFO] --- build-helper-maven-plugin:3.0.0:parse-version (parse-version) @ commons-vfs2 ---
[INFO] 
[INFO] --- maven-antrun-plugin:1.8:run (javadoc.resources) @ commons-vfs2 ---
[INFO] Executing tasks

main:
[INFO] Executed tasks
[INFO] 
[INFO] --- maven-antrun-plugin:1.8:run (vfs-jar-manifest) @ commons-vfs2 ---
[INFO] Executing tasks

main:
[INFO] Executed tasks
[INFO] 
[INFO] --- maven-remote-resources-plugin:1.5:process (process-resource-bundles) @ commons-vfs2 ---
[INFO] 
[INFO] --- buildnumber-maven-plugin:1.4:create (default) @ commons-vfs2 ---
[INFO] Executing: /bin/sh -c cd '/root/workspace/apache/commons-vfs/342399535/commons-vfs2' && 'svn' '--non-interactive' 'info'
[INFO] Working directory: /root/workspace/apache/commons-vfs/342399535/commons-vfs2
[INFO] Storing buildNumber: ?????? at timestamp: 1518796544170
[INFO] Executing: /bin/sh -c cd '/root/workspace/apache/commons-vfs/342399535/commons-vfs2' && 'svn' '--non-interactive' 'info'
[INFO] Working directory: /root/workspace/apache/commons-vfs/342399535/commons-vfs2
[INFO] Storing buildScmBranch: UNKNOWN_BRANCH
[INFO] 
[INFO] --- maven-resources-plugin:2.7:resources (default-resources) @ commons-vfs2 ---
[INFO] Using 'UTF-8' encoding to copy filtered resources.
[INFO] Copying 4 resources
[INFO] Copying 2 resources to META-INF
[INFO] 
[INFO] --- maven-compiler-plugin:3.7.0:compile (default-compile) @ commons-vfs2 ---
[INFO] Nothing to compile - all classes are up to date
[INFO] 
[INFO] --- maven-bundle-plugin:3.4.0:manifest (bundle-manifest) @ commons-vfs2 ---
[INFO] 
[INFO] --- animal-sniffer-maven-plugin:1.16:check (checkAPIcompatibility) @ commons-vfs2 ---
[INFO] Checking unresolved references to org.codehaus.mojo.signature:java17:1.0
[INFO] 
[INFO] --- maven-resources-plugin:2.7:testResources (default-testResources) @ commons-vfs2 ---
[INFO] Using 'UTF-8' encoding to copy filtered resources.
[INFO] Copying 51 resources
[INFO] Copying 2 resources to META-INF
[INFO] 
[INFO] --- maven-compiler-plugin:3.7.0:testCompile (default-testCompile) @ commons-vfs2 ---
[INFO] Changes detected - recompiling the module!
[INFO] Compiling 115 source files to /root/workspace/apache/commons-vfs/342399535/commons-vfs2/target/test-classes
[INFO] /root/workspace/apache/commons-vfs/342399535/commons-vfs2/src/test/java/org/apache/commons/vfs2/provider/hdfs/test/HdfsFileProviderTest.java: Some input files use or override a deprecated API.
[INFO] /root/workspace/apache/commons-vfs/342399535/commons-vfs2/src/test/java/org/apache/commons/vfs2/provider/hdfs/test/HdfsFileProviderTest.java: Recompile with -Xlint:deprecation for details.
[INFO] 
[INFO] --- maven-antrun-plugin:1.8:run (default) @ commons-vfs2 ---
[INFO] Executing tasks

main:
     [move] Moving 2 files to /root/workspace/apache/commons-vfs/342399535/commons-vfs2/target/test-classes/test-data/code
[INFO] Executed tasks
[INFO] 
[INFO] --- maven-surefire-plugin:2.19.1:test (default-test) @ commons-vfs2 ---
[INFO] Downloading: https://repo.maven.apache.org/maven2/org/apache/maven/surefire/surefire-junit4/2.19.1/surefire-junit4-2.19.1.pom
[INFO] Downloaded: https://repo.maven.apache.org/maven2/org/apache/maven/surefire/surefire-junit4/2.19.1/surefire-junit4-2.19.1.pom (4 KB at 10.6 KB/sec)
[INFO] Downloading: https://repo.maven.apache.org/maven2/org/apache/maven/surefire/surefire-providers/2.19.1/surefire-providers-2.19.1.pom
[INFO] Downloaded: https://repo.maven.apache.org/maven2/org/apache/maven/surefire/surefire-providers/2.19.1/surefire-providers-2.19.1.pom (3 KB at 89.4 KB/sec)
[INFO] Downloading: https://repo.maven.apache.org/maven2/org/apache/maven/surefire/surefire-junit4/2.19.1/surefire-junit4-2.19.1.jar
[INFO] Downloaded: https://repo.maven.apache.org/maven2/org/apache/maven/surefire/surefire-junit4/2.19.1/surefire-junit4-2.19.1.jar (74 KB at 1444.1 KB/sec)

-------------------------------------------------------
 T E S T S
-------------------------------------------------------
Running org.apache.commons.vfs2.operations.BasicOperationsTestCase
Tests run: 4, Failures: 0, Errors: 0, Skipped: 0, Time elapsed: 0.212 sec - in org.apache.commons.vfs2.operations.BasicOperationsTestCase
Running org.apache.commons.vfs2.FileTypeSelectorTest
Tests run: 3, Failures: 0, Errors: 0, Skipped: 0, Time elapsed: 0.18 sec - in org.apache.commons.vfs2.FileTypeSelectorTest
Running org.apache.commons.vfs2.provider.https.test.GetContentInfoFunctionalTest
Tests run: 1, Failures: 0, Errors: 0, Skipped: 0, Time elapsed: 0.395 sec - in org.apache.commons.vfs2.provider.https.test.GetContentInfoFunctionalTest
Running org.apache.commons.vfs2.provider.ftps.test.FtpsProviderImplicitTestCase
VfsClassLoaderTests no layered .jar provider, skipping.
created threads still running:
#1: main	pool-1-thread-1	TIMED_WAITING	not_a_daemon	null
#2: main	pool-1-thread-2	RUNNABLE	not_a_daemon	class java.util.concurrent.ThreadPoolExecutor$Worker
#6: main	pool-1-thread-6	RUNNABLE	not_a_daemon	class java.util.concurrent.ThreadPoolExecutor$Worker

Tests run: 84, Failures: 0, Errors: 0, Skipped: 0, Time elapsed: 25.76 sec - in org.apache.commons.vfs2.provider.ftps.test.FtpsProviderImplicitTestCase
Running org.apache.commons.vfs2.provider.ftps.test.FtpsProviderExplicitTestCase
VfsClassLoaderTests no layered .jar provider, skipping.
created threads still running:
#1: main	pool-4-thread-1	TIMED_WAITING	not_a_daemon	class java.util.concurrent.ThreadPoolExecutor$Worker
#2: main	pool-4-thread-2	TIMED_WAITING	not_a_daemon	class java.util.concurrent.ThreadPoolExecutor$Worker
#3: main	pool-4-thread-3	TIMED_WAITING	not_a_daemon	class java.util.concurrent.ThreadPoolExecutor$Worker
#4: main	NioProcessor-15	RUNNABLE	not_a_daemon	class java.util.concurrent.ThreadPoolExecutor$Worker
#5: main	NioProcessor-12	RUNNABLE	not_a_daemon	class java.util.concurrent.ThreadPoolExecutor$Worker
#6: main	NioProcessor-14	RUNNABLE	not_a_daemon	class java.util.concurrent.ThreadPoolExecutor$Worker

Tests run: 84, Failures: 0, Errors: 0, Skipped: 0, Time elapsed: 34.208 sec - in org.apache.commons.vfs2.provider.ftps.test.FtpsProviderExplicitTestCase
Running org.apache.commons.vfs2.provider.ftps.test.MultipleConnectionTestCase
Tests run: 2, Failures: 0, Errors: 0, Skipped: 0, Time elapsed: 0.338 sec - in org.apache.commons.vfs2.provider.ftps.test.MultipleConnectionTestCase
Running org.apache.commons.vfs2.provider.url.test.UrlHttpProviderTestCase
VfsClassLoaderTests no layered .jar provider, skipping.
created threads still running:
#1: main	org.apache.commons.vfs2.cache.SoftRefFilesCache$SoftRefReleaseThread	TIMED_WAITING	daemon	null

Tests run: 84, Failures: 0, Errors: 0, Skipped: 0, Time elapsed: 4.297 sec - in org.apache.commons.vfs2.provider.url.test.UrlHttpProviderTestCase
Running org.apache.commons.vfs2.provider.url.test.UrlProviderTestCase
VfsClassLoaderTests no local file provider, skipping.
VfsClassLoaderTests no local file provider, skipping.
created threads still running:

Tests run: 84, Failures: 0, Errors: 0, Skipped: 0, Time elapsed: 4.283 sec - in org.apache.commons.vfs2.provider.url.test.UrlProviderTestCase
Running org.apache.commons.vfs2.provider.url.test.UrlProviderHttpTestCase
VfsClassLoaderTests no layered .jar provider, skipping.
created threads still running:
#1: system	Keep-Alive-Timer	TIMED_WAITING	daemon	class sun.net.www.http.KeepAliveCache
#2: system	Keep-Alive-SocketCleaner	TIMED_WAITING	daemon	class sun.net.www.http.KeepAliveStreamCleaner
#3: (null)	org.apache.commons.vfs2.cache.SoftRefFilesCache$SoftRefReleaseThread	RUNNABLE	daemon	null

Tests run: 84, Failures: 0, Errors: 0, Skipped: 0, Time elapsed: 4.561 sec - in org.apache.commons.vfs2.provider.url.test.UrlProviderHttpTestCase
Running org.apache.commons.vfs2.provider.res.test.ResourceProviderTestCase
VfsClassLoaderTests no local file provider, skipping.
VfsClassLoaderTests no local file provider, skipping.
created threads still running:
#1: main	org.apache.commons.vfs2.cache.SoftRefFilesCache$SoftRefReleaseThread	TIMED_WAITING	daemon	null

Tests run: 84, Failures: 0, Errors: 0, Skipped: 0, Time elapsed: 4.24 sec - in org.apache.commons.vfs2.provider.res.test.ResourceProviderTestCase
Running org.apache.commons.vfs2.provider.hdfs.test.HdfsFileProviderTest
Formatting using clusterid: testClusterID
Tests run: 13, Failures: 0, Errors: 0, Skipped: 0, Time elapsed: 3.374 sec - in org.apache.commons.vfs2.provider.hdfs.test.HdfsFileProviderTest
Running org.apache.commons.vfs2.provider.hdfs.test.HdfsFileProviderTestCase
Formatting using clusterid: testClusterID
VfsClassLoaderTests no layered .jar provider, skipping.
created threads still running:
#1: main	org.apache.commons.vfs2.cache.SoftRefFilesCache$SoftRefReleaseThread	TIMED_WAITING	daemon	null
#2: main	org.apache.hadoop.hdfs.PeerCache@77e7246b	TIMED_WAITING	daemon	class org.apache.hadoop.hdfs.PeerCache$1

Tests run: 84, Failures: 0, Errors: 0, Skipped: 0, Time elapsed: 7.911 sec - in org.apache.commons.vfs2.provider.hdfs.test.HdfsFileProviderTestCase
Running org.apache.commons.vfs2.provider.test.VirtualProviderTestCase
created threads still running:

Tests run: 86, Failures: 0, Errors: 0, Skipped: 0, Time elapsed: 4.523 sec - in org.apache.commons.vfs2.provider.test.VirtualProviderTestCase
Running org.apache.commons.vfs2.provider.test.GenericFileNameTestCase
Tests run: 2, Failures: 0, Errors: 0, Skipped: 0, Time elapsed: 0.001 sec - in org.apache.commons.vfs2.provider.test.GenericFileNameTestCase
Running org.apache.commons.vfs2.provider.test.FileObjectSortTestCase
Tests run: 5, Failures: 0, Errors: 0, Skipped: 0, Time elapsed: 0.013 sec - in org.apache.commons.vfs2.provider.test.FileObjectSortTestCase
Running org.apache.commons.vfs2.provider.zip.test.FileLockTestCase
Tests run: 10, Failures: 0, Errors: 0, Skipped: 1, Time elapsed: 0.042 sec - in org.apache.commons.vfs2.provider.zip.test.FileLockTestCase
Running org.apache.commons.vfs2.provider.zip.test.NestedZipTestCase
VfsClassLoaderTests no layered .jar provider, skipping.
created threads still running:
#1: (null)	org.apache.commons.vfs2.cache.SoftRefFilesCache$SoftRefReleaseThread	RUNNABLE	daemon	null

Tests run: 84, Failures: 0, Errors: 0, Skipped: 0, Time elapsed: 4.497 sec - in org.apache.commons.vfs2.provider.zip.test.NestedZipTestCase
Running org.apache.commons.vfs2.provider.zip.test.ZipFileObjectTestCase
Tests run: 5, Failures: 0, Errors: 0, Skipped: 1, Time elapsed: 0.004 sec - in org.apache.commons.vfs2.provider.zip.test.ZipFileObjectTestCase
Running org.apache.commons.vfs2.provider.zip.test.ZipProviderTestCase
VfsClassLoaderTests no layered .jar provider, skipping.
created threads still running:
#1: main	org.apache.commons.vfs2.cache.SoftRefFilesCache$SoftRefReleaseThread	TIMED_WAITING	daemon	null

Tests run: 84, Failures: 0, Errors: 0, Skipped: 0, Time elapsed: 4.446 sec - in org.apache.commons.vfs2.provider.zip.test.ZipProviderTestCase
Running org.apache.commons.vfs2.provider.zip.test.ParseXmlInZipTestCase
Tests run: 7, Failures: 0, Errors: 0, Skipped: 0, Time elapsed: 0.227 sec - in org.apache.commons.vfs2.provider.zip.test.ParseXmlInZipTestCase
Running org.apache.commons.vfs2.provider.ram.test.CustomRamProviderTest
Tests run: 9, Failures: 0, Errors: 0, Skipped: 0, Time elapsed: 0.014 sec - in org.apache.commons.vfs2.provider.ram.test.CustomRamProviderTest
Running org.apache.commons.vfs2.provider.ram.test.RamProviderTestCase
VfsClassLoaderTests no layered .jar provider, skipping.
created threads still running:
#1: main	org.apache.commons.vfs2.cache.SoftRefFilesCache$SoftRefReleaseThread	TIMED_WAITING	daemon	null

Tests run: 84, Failures: 0, Errors: 0, Skipped: 0, Time elapsed: 11.34 sec - in org.apache.commons.vfs2.provider.ram.test.RamProviderTestCase
Running org.apache.commons.vfs2.provider.http.test.GetContentInfoFunctionalTest
Tests run: 1, Failures: 0, Errors: 0, Skipped: 0, Time elapsed: 0.307 sec - in org.apache.commons.vfs2.provider.http.test.GetContentInfoFunctionalTest
Running org.apache.commons.vfs2.provider.http.test.HttpProviderTestCase
VfsClassLoaderTests no layered .jar provider, skipping.
created threads still running:
#1: (null)	org.apache.commons.vfs2.cache.SoftRefFilesCache$SoftRefReleaseThread	RUNNABLE	daemon	null
#2: main	org.apache.commons.vfs2.cache.SoftRefFilesCache$SoftRefReleaseThread	TIMED_WAITING	daemon	null

Tests run: 89, Failures: 0, Errors: 0, Skipped: 0, Time elapsed: 4.74 sec - in org.apache.commons.vfs2.provider.http.test.HttpProviderTestCase
Running org.apache.commons.vfs2.provider.http.test.HttpFilesCacheTestCase
Tests run: 1, Failures: 0, Errors: 0, Skipped: 0, Time elapsed: 0 sec - in org.apache.commons.vfs2.provider.http.test.HttpFilesCacheTestCase
Running org.apache.commons.vfs2.provider.temp.test.TemporaryProviderTestCase
VfsClassLoaderTests no layered .jar provider, skipping.
created threads still running:
#1: main	org.apache.commons.vfs2.cache.SoftRefFilesCache$SoftRefReleaseThread	TIMED_WAITING	daemon	null

Tests run: 84, Failures: 0, Errors: 0, Skipped: 0, Time elapsed: 4.462 sec - in org.apache.commons.vfs2.provider.temp.test.TemporaryProviderTestCase
Running org.apache.commons.vfs2.provider.sftp.test.SftpProviderTestCase
VfsClassLoaderTests no layered .jar provider, skipping.
created threads still running:
#1: main	pool-22-thread-1	TIMED_WAITING	not_a_daemon	class java.util.concurrent.ThreadPoolExecutor$Worker
#2: main	pool-21-thread-1	TIMED_WAITING	not_a_daemon	class java.util.concurrent.ThreadPoolExecutor$Worker
#3: main	org.apache.commons.vfs2.cache.SoftRefFilesCache$SoftRefReleaseThread	TIMED_WAITING	daemon	null
#4: main	pool-22-thread-2	TIMED_WAITING	not_a_daemon	class java.util.concurrent.ThreadPoolExecutor$Worker
#5: main	pool-22-thread-3	TIMED_WAITING	not_a_daemon	class java.util.concurrent.ThreadPoolExecutor$Worker
#6: main	pool-22-thread-4	TIMED_WAITING	not_a_daemon	class java.util.concurrent.ThreadPoolExecutor$Worker

created threads still running:
#1: main	org.apache.commons.vfs2.cache.SoftRefFilesCache$SoftRefReleaseThread	RUNNABLE	daemon	null

Tests run: 102, Failures: 0, Errors: 0, Skipped: 0, Time elapsed: 15.889 sec - in org.apache.commons.vfs2.provider.sftp.test.SftpProviderTestCase
Running org.apache.commons.vfs2.provider.UriParserTestCase
Tests run: 2, Failures: 0, Errors: 0, Skipped: 0, Time elapsed: 0.004 sec - in org.apache.commons.vfs2.provider.UriParserTestCase
Running org.apache.commons.vfs2.provider.ftp.test.FtpProviderTestCase
VfsClassLoaderTests no layered .jar provider, skipping.
created threads still running:
#1: main	pool-24-thread-1	TIMED_WAITING	not_a_daemon	class java.util.concurrent.ThreadPoolExecutor$Worker
#2: main	pool-24-thread-2	TIMED_WAITING	not_a_daemon	class java.util.concurrent.ThreadPoolExecutor$Worker
#3: main	pool-24-thread-3	TIMED_WAITING	not_a_daemon	class java.util.concurrent.ThreadPoolExecutor$Worker
#4: main	NioProcessor-41	RUNNABLE	not_a_daemon	class java.util.concurrent.ThreadPoolExecutor$Worker
#5: main	pool-24-thread-5	TIMED_WAITING	not_a_daemon	class java.util.concurrent.ThreadPoolExecutor$Worker
#6: main	pool-24-thread-6	TIMED_WAITING	not_a_daemon	class java.util.concurrent.ThreadPoolExecutor$Worker

Tests run: 84, Failures: 0, Errors: 0, Skipped: 0, Time elapsed: 22.423 sec - in org.apache.commons.vfs2.provider.ftp.test.FtpProviderTestCase
Running org.apache.commons.vfs2.provider.ftp.test.MultipleConnectionTestCase
Tests run: 2, Failures: 0, Errors: 0, Skipped: 0, Time elapsed: 0.03 sec - in org.apache.commons.vfs2.provider.ftp.test.MultipleConnectionTestCase
Running org.apache.commons.vfs2.provider.ftp.test.FtpProviderUserDirTestCase
VfsClassLoaderTests no layered .jar provider, skipping.
created threads still running:
#1: main	NioProcessor-51	RUNNABLE	not_a_daemon	class java.util.concurrent.ThreadPoolExecutor$Worker
#2: main	NioProcessor-55	RUNNABLE	not_a_daemon	class java.util.concurrent.ThreadPoolExecutor$Worker
#3: main	NioProcessor-56	RUNNABLE	not_a_daemon	class java.util.concurrent.ThreadPoolExecutor$Worker
#4: main	NioProcessor-57	RUNNABLE	not_a_daemon	class java.util.concurrent.ThreadPoolExecutor$Worker
#5: main	NioProcessor-50	RUNNABLE	not_a_daemon	class java.util.concurrent.ThreadPoolExecutor$Worker
#6: main	pool-30-thread-6	TIMED_WAITING	not_a_daemon	class java.util.concurrent.ThreadPoolExecutor$Worker
#7: main	NioProcessor-53	RUNNABLE	not_a_daemon	class java.util.concurrent.ThreadPoolExecutor$Worker
#8: main	pool-30-thread-8	RUNNABLE	not_a_daemon	class java.util.concurrent.ThreadPoolExecutor$Worker

Tests run: 84, Failures: 0, Errors: 0, Skipped: 0, Time elapsed: 22.554 sec - in org.apache.commons.vfs2.provider.ftp.test.FtpProviderUserDirTestCase
Running org.apache.commons.vfs2.provider.jar.test.JarProviderTestCase
VfsClassLoaderTests no layered .jar provider, skipping.
created threads still running:
#1: main	org.apache.commons.vfs2.cache.SoftRefFilesCache$SoftRefReleaseThread	TIMED_WAITING	daemon	null

Tests run: 84, Failures: 0, Errors: 0, Skipped: 0, Time elapsed: 4.409 sec - in org.apache.commons.vfs2.provider.jar.test.JarProviderTestCase
Running org.apache.commons.vfs2.provider.jar.test.NestedJarTestCase
created threads still running:
#1: main	org.apache.commons.vfs2.cache.SoftRefFilesCache$SoftRefReleaseThread	TIMED_WAITING	daemon	null

Tests run: 84, Failures: 0, Errors: 0, Skipped: 0, Time elapsed: 4.374 sec - in org.apache.commons.vfs2.provider.jar.test.NestedJarTestCase
Running org.apache.commons.vfs2.provider.jar.test.JarAttributesTestCase
Tests run: 2, Failures: 0, Errors: 0, Skipped: 0, Time elapsed: 0 sec - in org.apache.commons.vfs2.provider.jar.test.JarAttributesTestCase
Running org.apache.commons.vfs2.provider.tar.test.LargeTarTestCase
Tests run: 1, Failures: 0, Errors: 0, Skipped: 0, Time elapsed: 12.474 sec - in org.apache.commons.vfs2.provider.tar.test.LargeTarTestCase
Running org.apache.commons.vfs2.provider.tar.test.NestedTarTestCase
VfsClassLoaderTests no layered .jar provider, skipping.
created threads still running:
#1: main	org.apache.commons.vfs2.cache.SoftRefFilesCache$SoftRefReleaseThread	RUNNABLE	daemon	null

Tests run: 84, Failures: 0, Errors: 0, Skipped: 0, Time elapsed: 4.485 sec - in org.apache.commons.vfs2.provider.tar.test.NestedTarTestCase
Running org.apache.commons.vfs2.provider.tar.test.Tbz2ProviderTestCase
VfsClassLoaderTests no layered .jar provider, skipping.
created threads still running:
#1: main	org.apache.commons.vfs2.cache.SoftRefFilesCache$SoftRefReleaseThread	TIMED_WAITING	daemon	null

Tests run: 84, Failures: 0, Errors: 0, Skipped: 0, Time elapsed: 4.458 sec - in org.apache.commons.vfs2.provider.tar.test.Tbz2ProviderTestCase
Running org.apache.commons.vfs2.provider.tar.test.TgzProviderTestCase
VfsClassLoaderTests no layered .jar provider, skipping.
created threads still running:
#1: main	org.apache.commons.vfs2.cache.SoftRefFilesCache$SoftRefReleaseThread	TIMED_WAITING	daemon	null

Tests run: 84, Failures: 0, Errors: 0, Skipped: 0, Time elapsed: 4.377 sec - in org.apache.commons.vfs2.provider.tar.test.TgzProviderTestCase
Running org.apache.commons.vfs2.provider.tar.test.NestedTbz2TestCase
VfsClassLoaderTests no layered .jar provider, skipping.
created threads still running:
#1: main	org.apache.commons.vfs2.cache.SoftRefFilesCache$SoftRefReleaseThread	TIMED_WAITING	daemon	null

Tests run: 84, Failures: 0, Errors: 0, Skipped: 0, Time elapsed: 4.455 sec - in org.apache.commons.vfs2.provider.tar.test.NestedTbz2TestCase
Running org.apache.commons.vfs2.provider.tar.test.NestedTgzTestCase
VfsClassLoaderTests no layered .jar provider, skipping.
created threads still running:
#1: main	org.apache.commons.vfs2.cache.SoftRefFilesCache$SoftRefReleaseThread	TIMED_WAITING	daemon	null

Tests run: 84, Failures: 0, Errors: 0, Skipped: 0, Time elapsed: 4.426 sec - in org.apache.commons.vfs2.provider.tar.test.NestedTgzTestCase
Running org.apache.commons.vfs2.provider.tar.test.TarProviderTestCase
VfsClassLoaderTests no layered .jar provider, skipping.
created threads still running:
#1: (null)	org.apache.commons.vfs2.cache.SoftRefFilesCache$SoftRefReleaseThread	TERMINATED	daemon	null

Tests run: 84, Failures: 0, Errors: 0, Skipped: 0, Time elapsed: 4.484 sec - in org.apache.commons.vfs2.provider.tar.test.TarProviderTestCase
Running org.apache.commons.vfs2.provider.local.test.LocalProviderTestCase
VfsClassLoaderTests no layered .jar provider, skipping.
created threads still running:
#1: main	org.apache.commons.vfs2.cache.SoftRefFilesCache$SoftRefReleaseThread	TIMED_WAITING	daemon	null

Tests run: 90, Failures: 3, Errors: 0, Skipped: 0, Time elapsed: 4.536 sec <<< FAILURE! - in org.apache.commons.vfs2.provider.local.test.LocalProviderTestCase
testExecutable(org.apache.commons.vfs2.test.PermissionsTests)  Time elapsed: 0.013 sec  <<< FAILURE!
java.lang.AssertionError
	at org.junit.Assert.fail(Assert.java:86)
	at org.junit.Assert.assertTrue(Assert.java:41)
	at org.junit.Assert.assertFalse(Assert.java:64)
	at org.junit.Assert.assertFalse(Assert.java:74)
	at org.apache.commons.vfs2.test.PermissionsTests.testExecutable(PermissionsTests.java:68)
	at sun.reflect.NativeMethodAccessorImpl.invoke0(Native Method)
	at sun.reflect.NativeMethodAccessorImpl.invoke(NativeMethodAccessorImpl.java:62)
	at sun.reflect.DelegatingMethodAccessorImpl.invoke(DelegatingMethodAccessorImpl.java:43)
	at java.lang.reflect.Method.invoke(Method.java:498)
	at org.apache.commons.vfs2.test.AbstractProviderTestCase.runTest(AbstractProviderTestCase.java:190)
	at junit.framework.TestCase.runBare(TestCase.java:141)
	at junit.framework.TestResult$1.protect(TestResult.java:122)
	at junit.framework.TestResult.runProtected(TestResult.java:142)
	at junit.framework.TestResult.run(TestResult.java:125)
	at junit.framework.TestCase.run(TestCase.java:129)
	at junit.framework.TestSuite.runTest(TestSuite.java:252)
	at junit.framework.TestSuite.run(TestSuite.java:247)
	at junit.extensions.TestDecorator.basicRun(TestDecorator.java:23)
	at org.apache.commons.vfs2.test.AbstractTestSuite$1.protect(AbstractTestSuite.java:132)
	at junit.framework.TestResult.runProtected(TestResult.java:142)
	at org.apache.commons.vfs2.test.AbstractTestSuite.run(AbstractTestSuite.java:137)
	at org.junit.internal.runners.JUnit38ClassRunner.run(JUnit38ClassRunner.java:86)
	at org.apache.maven.surefire.junit4.JUnit4Provider.execute(JUnit4Provider.java:367)
	at org.apache.maven.surefire.junit4.JUnit4Provider.executeWithRerun(JUnit4Provider.java:274)
	at org.apache.maven.surefire.junit4.JUnit4Provider.executeTestSet(JUnit4Provider.java:238)
	at org.apache.maven.surefire.junit4.JUnit4Provider.invoke(JUnit4Provider.java:161)
	at org.apache.maven.surefire.booter.ForkedBooter.invokeProviderInSameClassLoader(ForkedBooter.java:290)
	at org.apache.maven.surefire.booter.ForkedBooter.runSuitesInProcess(ForkedBooter.java:242)
	at org.apache.maven.surefire.booter.ForkedBooter.main(ForkedBooter.java:121)

testWriteable(org.apache.commons.vfs2.test.PermissionsTests)  Time elapsed: 0.001 sec  <<< FAILURE!
java.lang.AssertionError
	at org.junit.Assert.fail(Assert.java:86)
	at org.junit.Assert.assertTrue(Assert.java:41)
	at org.junit.Assert.assertFalse(Assert.java:64)
	at org.junit.Assert.assertFalse(Assert.java:74)
	at org.apache.commons.vfs2.test.PermissionsTests.testWriteable(PermissionsTests.java:88)
	at sun.reflect.NativeMethodAccessorImpl.invoke0(Native Method)
	at sun.reflect.NativeMethodAccessorImpl.invoke(NativeMethodAccessorImpl.java:62)
	at sun.reflect.DelegatingMethodAccessorImpl.invoke(DelegatingMethodAccessorImpl.java:43)
	at java.lang.reflect.Method.invoke(Method.java:498)
	at org.apache.commons.vfs2.test.AbstractProviderTestCase.runTest(AbstractProviderTestCase.java:190)
	at junit.framework.TestCase.runBare(TestCase.java:141)
	at junit.framework.TestResult$1.protect(TestResult.java:122)
	at junit.framework.TestResult.runProtected(TestResult.java:142)
	at junit.framework.TestResult.run(TestResult.java:125)
	at junit.framework.TestCase.run(TestCase.java:129)
	at junit.framework.TestSuite.runTest(TestSuite.java:252)
	at junit.framework.TestSuite.run(TestSuite.java:247)
	at junit.extensions.TestDecorator.basicRun(TestDecorator.java:23)
	at org.apache.commons.vfs2.test.AbstractTestSuite$1.protect(AbstractTestSuite.java:132)
	at junit.framework.TestResult.runProtected(TestResult.java:142)
	at org.apache.commons.vfs2.test.AbstractTestSuite.run(AbstractTestSuite.java:137)
	at org.junit.internal.runners.JUnit38ClassRunner.run(JUnit38ClassRunner.java:86)
	at org.apache.maven.surefire.junit4.JUnit4Provider.execute(JUnit4Provider.java:367)
	at org.apache.maven.surefire.junit4.JUnit4Provider.executeWithRerun(JUnit4Provider.java:274)
	at org.apache.maven.surefire.junit4.JUnit4Provider.executeTestSet(JUnit4Provider.java:238)
	at org.apache.maven.surefire.junit4.JUnit4Provider.invoke(JUnit4Provider.java:161)
	at org.apache.maven.surefire.booter.ForkedBooter.invokeProviderInSameClassLoader(ForkedBooter.java:290)
	at org.apache.maven.surefire.booter.ForkedBooter.runSuitesInProcess(ForkedBooter.java:242)
	at org.apache.maven.surefire.booter.ForkedBooter.main(ForkedBooter.java:121)

testReadable(org.apache.commons.vfs2.test.PermissionsTests)  Time elapsed: 0.001 sec  <<< FAILURE!
java.lang.AssertionError
	at org.junit.Assert.fail(Assert.java:86)
	at org.junit.Assert.assertTrue(Assert.java:41)
	at org.junit.Assert.assertFalse(Assert.java:64)
	at org.junit.Assert.assertFalse(Assert.java:74)
	at org.apache.commons.vfs2.test.PermissionsTests.testReadable(PermissionsTests.java:111)
	at sun.reflect.NativeMethodAccessorImpl.invoke0(Native Method)
	at sun.reflect.NativeMethodAccessorImpl.invoke(NativeMethodAccessorImpl.java:62)
	at sun.reflect.DelegatingMethodAccessorImpl.invoke(DelegatingMethodAccessorImpl.java:43)
	at java.lang.reflect.Method.invoke(Method.java:498)
	at org.apache.commons.vfs2.test.AbstractProviderTestCase.runTest(AbstractProviderTestCase.java:190)
	at junit.framework.TestCase.runBare(TestCase.java:141)
	at junit.framework.TestResult$1.protect(TestResult.java:122)
	at junit.framework.TestResult.runProtected(TestResult.java:142)
	at junit.framework.TestResult.run(TestResult.java:125)
	at junit.framework.TestCase.run(TestCase.java:129)
	at junit.framework.TestSuite.runTest(TestSuite.java:252)
	at junit.framework.TestSuite.run(TestSuite.java:247)
	at junit.extensions.TestDecorator.basicRun(TestDecorator.java:23)
	at org.apache.commons.vfs2.test.AbstractTestSuite$1.protect(AbstractTestSuite.java:132)
	at junit.framework.TestResult.runProtected(TestResult.java:142)
	at org.apache.commons.vfs2.test.AbstractTestSuite.run(AbstractTestSuite.java:137)
	at org.junit.internal.runners.JUnit38ClassRunner.run(JUnit38ClassRunner.java:86)
	at org.apache.maven.surefire.junit4.JUnit4Provider.execute(JUnit4Provider.java:367)
	at org.apache.maven.surefire.junit4.JUnit4Provider.executeWithRerun(JUnit4Provider.java:274)
	at org.apache.maven.surefire.junit4.JUnit4Provider.executeTestSet(JUnit4Provider.java:238)
	at org.apache.maven.surefire.junit4.JUnit4Provider.invoke(JUnit4Provider.java:161)
	at org.apache.maven.surefire.booter.ForkedBooter.invokeProviderInSameClassLoader(ForkedBooter.java:290)
	at org.apache.maven.surefire.booter.ForkedBooter.runSuitesInProcess(ForkedBooter.java:242)
	at org.apache.maven.surefire.booter.ForkedBooter.main(ForkedBooter.java:121)

Running org.apache.commons.vfs2.provider.local.test.ConversionTestCase
Tests run: 2, Failures: 0, Errors: 0, Skipped: 2, Time elapsed: 0.001 sec - in org.apache.commons.vfs2.provider.local.test.ConversionTestCase
Running org.apache.commons.vfs2.provider.webdav.test.WebdavProviderTestCase
VfsClassLoaderTests no layered .jar provider, skipping.
created threads still running:
#1: main	org.apache.commons.vfs2.cache.SoftRefFilesCache$SoftRefReleaseThread	TIMED_WAITING	daemon	null

Tests run: 84, Failures: 0, Errors: 0, Skipped: 0, Time elapsed: 38.766 sec - in org.apache.commons.vfs2.provider.webdav.test.WebdavProviderTestCase
Running org.apache.commons.vfs2.FileSystemOptionsTest
Tests run: 1, Failures: 0, Errors: 0, Skipped: 0, Time elapsed: 0.001 sec - in org.apache.commons.vfs2.FileSystemOptionsTest
Running org.apache.commons.vfs2.InvertIncludeFileSelectorTest
Tests run: 2, Failures: 0, Errors: 0, Skipped: 0, Time elapsed: 0.004 sec - in org.apache.commons.vfs2.InvertIncludeFileSelectorTest
Running org.apache.commons.vfs2.test.FileSystemManagerFactoryTestCase
Tests run: 1, Failures: 0, Errors: 0, Skipped: 0, Time elapsed: 0.002 sec - in org.apache.commons.vfs2.test.FileSystemManagerFactoryTestCase
Running org.apache.commons.vfs2.FileSystemExceptionTest
Tests run: 3, Failures: 0, Errors: 0, Skipped: 0, Time elapsed: 0.002 sec - in org.apache.commons.vfs2.FileSystemExceptionTest
Running org.apache.commons.vfs2.FileIteratorTest
Tests run: 1, Failures: 0, Errors: 0, Skipped: 0, Time elapsed: 0.002 sec - in org.apache.commons.vfs2.FileIteratorTest
Running org.apache.commons.vfs2.VFSTest
Tests run: 1, Failures: 0, Errors: 0, Skipped: 0, Time elapsed: 0.005 sec - in org.apache.commons.vfs2.VFSTest
Running org.apache.commons.vfs2.auth.StaticUserAuthenticatorTestCase
Tests run: 2, Failures: 0, Errors: 0, Skipped: 0, Time elapsed: 0.008 sec - in org.apache.commons.vfs2.auth.StaticUserAuthenticatorTestCase
Running org.apache.commons.vfs2.cache.SoftRefFilesCacheTestCase
created threads still running:
#1: main	org.apache.commons.vfs2.cache.SoftRefFilesCache$SoftRefReleaseThread	TIMED_WAITING	daemon	null

Tests run: 4, Failures: 0, Errors: 0, Skipped: 0, Time elapsed: 4.686 sec - in org.apache.commons.vfs2.cache.SoftRefFilesCacheTestCase
Running org.apache.commons.vfs2.cache.LRUFilesCacheTestCase
Tests run: 4, Failures: 0, Errors: 0, Skipped: 0, Time elapsed: 4.446 sec - in org.apache.commons.vfs2.cache.LRUFilesCacheTestCase
Running org.apache.commons.vfs2.cache.WeakRefFilesCacheTestCase
Tests run: 4, Failures: 0, Errors: 0, Skipped: 0, Time elapsed: 4.511 sec - in org.apache.commons.vfs2.cache.WeakRefFilesCacheTestCase
Running org.apache.commons.vfs2.cache.NullFilesCacheTestCase
Tests run: 4, Failures: 0, Errors: 0, Skipped: 0, Time elapsed: 4.53 sec - in org.apache.commons.vfs2.cache.NullFilesCacheTestCase
Running org.apache.commons.vfs2.cache.DefaultFilesCacheTestCase
Tests run: 3, Failures: 0, Errors: 0, Skipped: 0, Time elapsed: 4.441 sec - in org.apache.commons.vfs2.cache.DefaultFilesCacheTestCase
Running org.apache.commons.vfs2.impl.test.DefaultFileSystemManagerTest
Tests run: 5, Failures: 0, Errors: 0, Skipped: 0, Time elapsed: 0.002 sec - in org.apache.commons.vfs2.impl.test.DefaultFileSystemManagerTest
Running org.apache.commons.vfs2.FileTypeTest
Tests run: 5, Failures: 0, Errors: 0, Skipped: 0, Time elapsed: 0.013 sec - in org.apache.commons.vfs2.FileTypeTest
Running org.apache.commons.vfs2.FileExtensionSelectorTest
Tests run: 5, Failures: 0, Errors: 0, Skipped: 0, Time elapsed: 0.005 sec - in org.apache.commons.vfs2.FileExtensionSelectorTest
Running org.apache.commons.vfs2.util.DelegatingFileSystemOptionsBuilderTest
Tests run: 3, Failures: 0, Errors: 0, Skipped: 0, Time elapsed: 0.016 sec - in org.apache.commons.vfs2.util.DelegatingFileSystemOptionsBuilderTest
Running org.apache.commons.vfs2.util.EncryptDecryptTest
Tests run: 1, Failures: 0, Errors: 0, Skipped: 0, Time elapsed: 0.004 sec - in org.apache.commons.vfs2.util.EncryptDecryptTest
Running org.apache.commons.vfs2.UserAuthenticationDataTestCase
Tests run: 2, Failures: 0, Errors: 0, Skipped: 0, Time elapsed: 0.001 sec - in org.apache.commons.vfs2.UserAuthenticationDataTestCase
Running org.apache.commons.vfs2.PatternFileSelectorTest
Tests run: 3, Failures: 0, Errors: 0, Skipped: 0, Time elapsed: 0.003 sec - in org.apache.commons.vfs2.PatternFileSelectorTest

Results :

Failed tests: 
org.apache.commons.vfs2.test.PermissionsTests.testExecutable(org.apache.commons.vfs2.test.PermissionsTests)
  Run 1: PASS
  Run 2: PermissionsTests>AbstractProviderTestCase.runTest:190->testExecutable:68

org.apache.commons.vfs2.test.PermissionsTests.testReadable(org.apache.commons.vfs2.test.PermissionsTests)
  Run 1: PASS
  Run 2: PermissionsTests>AbstractProviderTestCase.runTest:190->testReadable:111

org.apache.commons.vfs2.test.PermissionsTests.testWriteable(org.apache.commons.vfs2.test.PermissionsTests)
  Run 1: PASS
  Run 2: PermissionsTests>AbstractProviderTestCase.runTest:190->testWriteable:88


Tests run: 2338, Failures: 3, Errors: 0, Skipped: 4

[INFO] ------------------------------------------------------------------------
[INFO] Reactor Summary:
[INFO] 
[INFO] Apache Commons VFS Project ......................... SUCCESS [  3.195 s]
[INFO] Apache Commons VFS ................................. FAILURE [05:08 min]
[INFO] Apache Commons VFS Examples ........................ SKIPPED
[INFO] Apache Commons VFS Distribution .................... SKIPPED
[INFO] ------------------------------------------------------------------------
[INFO] BUILD FAILURE
[INFO] ------------------------------------------------------------------------
[INFO] Total time: 05:11 min
[INFO] Finished at: 2018-02-16T17:00:51+01:00
[INFO] Final Memory: 48M/944M
[INFO] ------------------------------------------------------------------------
[ERROR] Failed to execute goal org.apache.maven.plugins:maven-surefire-plugin:2.19.1:test (default-test) on project commons-vfs2: There are test failures.
[ERROR] 
[ERROR] Please refer to /root/workspace/apache/commons-vfs/342399535/commons-vfs2/target/surefire-reports for the individual test results.
[ERROR] -> [Help 1]
[ERROR] 
[ERROR] To see the full stack trace of the errors, re-run Maven with the -e switch.
[ERROR] Re-run Maven using the -X switch to enable full debug logging.
[ERROR] 
[ERROR] For more information about the errors and possible solutions, please read the following articles:
[ERROR] [Help 1] http://cwiki.apache.org/confluence/display/MAVEN/MojoFailureException
[ERROR] 
[ERROR] After correcting the problems, you can resume the build with the command
[ERROR]   mvn <goals> -rf :commons-vfs2
