[INFO] Scanning for projects...
[INFO] ------------------------------------------------------------------------
[INFO] Reactor Build Order:
[INFO] 
[INFO] Metrics Parent
[INFO] Metrics Documentation
[INFO] Annotations for Metrics
[INFO] Metrics Core
[INFO] Benchmarks for Metrics
[INFO] JVM Integration for Metrics
[INFO] Metrics Health Checks
[INFO] Metrics Integration for Ehcache
[INFO] Graphite Integration for Metrics
[INFO] Metrics Integration for Apache HttpClient
[INFO] Metrics Integration for Apache HttpAsyncClient
[INFO] Metrics Integration for JCache
[INFO] Metrics Integration for JDBI
[INFO] Metrics Integration for Jersey 2.x
[INFO] Metrics Integration for Jetty 9.3 and higher
[INFO] Jackson Integration for Metrics
[INFO] Metrics Integration for Log4j 2.x
[INFO] Metrics Integration for Logback
[INFO] Metrics Integration for Servlets
[INFO] Metrics Utility Servlets
[INFO] Metrics JCStress tests
[INFO] Metrics Integration with JMX
[INFO]                                                                         
[INFO] ------------------------------------------------------------------------
[INFO] Building Metrics Parent 4.0.0-alpha4-SNAPSHOT
[INFO] ------------------------------------------------------------------------
[INFO] 
[INFO] --- maven-enforcer-plugin:1.2:enforce (enforce) @ metrics-parent ---
[INFO] Skipping Rule Enforcement.
[INFO]                                                                         
[INFO] ------------------------------------------------------------------------
[INFO] Building Metrics Documentation 4.0.0-alpha4-SNAPSHOT
[INFO] ------------------------------------------------------------------------
[INFO] 
[INFO] --- maven-enforcer-plugin:1.2:enforce (enforce) @ docs ---
[INFO] Skipping Rule Enforcement.
[INFO] 
[INFO] --- build-helper-maven-plugin:1.9.1:parse-version (parse-version) @ docs ---
[INFO] 
[INFO] --- maven-resources-plugin:2.6:resources (process-resources) @ docs ---
[INFO] Using 'UTF-8' encoding to copy filtered resources.
[INFO] Copying 71 resources
[INFO] 
[INFO] --- maven-resources-plugin:2.6:resources (default-resources) @ docs ---
[INFO] Using 'UTF-8' encoding to copy filtered resources.
[INFO] Copying 71 resources
[INFO] 
[INFO] --- maven-compiler-plugin:3.7.0:compile (default-compile) @ docs ---
[INFO] No sources to compile
[INFO] 
[INFO] --- maven-resources-plugin:2.6:testResources (default-testResources) @ docs ---
[INFO] Using 'UTF-8' encoding to copy filtered resources.
[INFO] skip non existing resourceDirectory /root/workspace/dropwizard/metrics/275831275/docs/src/test/resources
[INFO] 
[INFO] --- maven-compiler-plugin:3.7.0:testCompile (default-testCompile) @ docs ---
[INFO] No sources to compile
[INFO] 
[INFO] --- maven-surefire-plugin:2.14.1:test (default-test) @ docs ---
[INFO] No tests to run.
[INFO]                                                                         
[INFO] ------------------------------------------------------------------------
[INFO] Building Annotations for Metrics 4.0.0-alpha4-SNAPSHOT
[INFO] ------------------------------------------------------------------------
[INFO] 
[INFO] --- maven-enforcer-plugin:1.2:enforce (enforce) @ metrics-annotation ---
[INFO] Skipping Rule Enforcement.
[INFO] 
[INFO] --- maven-resources-plugin:3.0.2:resources (default-resources) @ metrics-annotation ---
[INFO] Using 'UTF-8' encoding to copy filtered resources.
[INFO] skip non existing resourceDirectory /root/workspace/dropwizard/metrics/275831275/metrics-annotation/src/main/resources
[INFO] 
[INFO] --- maven-compiler-plugin:3.7.0:compile (default-compile) @ metrics-annotation ---
[INFO] Nothing to compile - all classes are up to date
[INFO] 
[INFO] --- maven-resources-plugin:3.0.2:testResources (default-testResources) @ metrics-annotation ---
[INFO] Using 'UTF-8' encoding to copy filtered resources.
[INFO] skip non existing resourceDirectory /root/workspace/dropwizard/metrics/275831275/metrics-annotation/src/test/resources
[INFO] 
[INFO] --- maven-compiler-plugin:3.7.0:testCompile (default-testCompile) @ metrics-annotation ---
[INFO] No sources to compile
[INFO] 
[INFO] --- maven-surefire-plugin:2.14.1:test (default-test) @ metrics-annotation ---
[INFO] No tests to run.
[INFO]                                                                         
[INFO] ------------------------------------------------------------------------
[INFO] Building Metrics Core 4.0.0-alpha4-SNAPSHOT
[INFO] ------------------------------------------------------------------------
[INFO] 
[INFO] --- maven-enforcer-plugin:1.2:enforce (enforce) @ metrics-core ---
[INFO] Skipping Rule Enforcement.
[INFO] 
[INFO] --- maven-resources-plugin:3.0.2:resources (default-resources) @ metrics-core ---
[INFO] Using 'UTF-8' encoding to copy filtered resources.
[INFO] skip non existing resourceDirectory /root/workspace/dropwizard/metrics/275831275/metrics-core/src/main/resources
[INFO] 
[INFO] --- maven-compiler-plugin:3.7.0:compile (default-compile) @ metrics-core ---
[INFO] Nothing to compile - all classes are up to date
[INFO] 
[INFO] --- maven-resources-plugin:3.0.2:testResources (default-testResources) @ metrics-core ---
[INFO] Using 'UTF-8' encoding to copy filtered resources.
[INFO] skip non existing resourceDirectory /root/workspace/dropwizard/metrics/275831275/metrics-core/src/test/resources
[INFO] 
[INFO] --- maven-compiler-plugin:3.7.0:testCompile (default-testCompile) @ metrics-core ---
[INFO] Nothing to compile - all classes are up to date
[INFO] 
[INFO] --- maven-surefire-plugin:2.14.1:test (default-test) @ metrics-core ---
[INFO] Surefire report directory: /root/workspace/dropwizard/metrics/275831275/metrics-core/target/surefire-reports
[INFO] Downloading: https://repo.maven.apache.org/maven2/org/apache/maven/surefire/surefire-junit47/2.14.1/surefire-junit47-2.14.1.pom
[INFO] Downloaded: https://repo.maven.apache.org/maven2/org/apache/maven/surefire/surefire-junit47/2.14.1/surefire-junit47-2.14.1.pom (5 KB at 4.5 KB/sec)
[INFO] Downloading: https://repo.maven.apache.org/maven2/org/apache/maven/surefire/surefire-providers/2.14.1/surefire-providers-2.14.1.pom
[INFO] Downloaded: https://repo.maven.apache.org/maven2/org/apache/maven/surefire/surefire-providers/2.14.1/surefire-providers-2.14.1.pom (3 KB at 58.1 KB/sec)
[INFO] Downloading: https://repo.maven.apache.org/maven2/org/apache/maven/surefire/common-junit48/2.14.1/common-junit48-2.14.1.pom
[INFO] Downloaded: https://repo.maven.apache.org/maven2/org/apache/maven/surefire/common-junit48/2.14.1/common-junit48-2.14.1.pom (4 KB at 26.1 KB/sec)
[INFO] Downloading: https://repo.maven.apache.org/maven2/org/apache/maven/surefire/common-junit4/2.14.1/common-junit4-2.14.1.pom
[INFO] Downloaded: https://repo.maven.apache.org/maven2/org/apache/maven/surefire/common-junit4/2.14.1/common-junit4-2.14.1.pom (2 KB at 60.5 KB/sec)
[INFO] Downloading: https://repo.maven.apache.org/maven2/org/apache/maven/surefire/common-junit3/2.14.1/common-junit3-2.14.1.pom
[INFO] Downloaded: https://repo.maven.apache.org/maven2/org/apache/maven/surefire/common-junit3/2.14.1/common-junit3-2.14.1.pom (2 KB at 0.8 KB/sec)
[INFO] Downloading: https://repo.maven.apache.org/maven2/org/apache/maven/surefire/common-java5/2.14.1/common-java5-2.14.1.pom
[INFO] Downloaded: https://repo.maven.apache.org/maven2/org/apache/maven/surefire/common-java5/2.14.1/common-java5-2.14.1.pom (2 KB at 54.4 KB/sec)
[INFO] Downloading: https://repo.maven.apache.org/maven2/org/apache/maven/surefire/surefire-grouper/2.14.1/surefire-grouper-2.14.1.pom
[INFO] Downloaded: https://repo.maven.apache.org/maven2/org/apache/maven/surefire/surefire-grouper/2.14.1/surefire-grouper-2.14.1.pom (3 KB at 23.5 KB/sec)
[INFO] Downloading: https://repo.maven.apache.org/maven2/org/apache/maven/surefire/surefire-junit47/2.14.1/surefire-junit47-2.14.1.jar
[INFO] Downloading: https://repo.maven.apache.org/maven2/org/apache/maven/surefire/common-junit3/2.14.1/common-junit3-2.14.1.jar
[INFO] Downloading: https://repo.maven.apache.org/maven2/org/apache/maven/surefire/common-junit4/2.14.1/common-junit4-2.14.1.jar
[INFO] Downloading: https://repo.maven.apache.org/maven2/org/apache/maven/surefire/common-java5/2.14.1/common-java5-2.14.1.jar
[INFO] Downloading: https://repo.maven.apache.org/maven2/org/apache/maven/surefire/common-junit48/2.14.1/common-junit48-2.14.1.jar
[INFO] Downloaded: https://repo.maven.apache.org/maven2/org/apache/maven/surefire/common-junit3/2.14.1/common-junit3-2.14.1.jar (12 KB at 167.1 KB/sec)
[INFO] Downloading: https://repo.maven.apache.org/maven2/org/apache/maven/surefire/surefire-grouper/2.14.1/surefire-grouper-2.14.1.jar
[INFO] Downloaded: https://repo.maven.apache.org/maven2/org/apache/maven/surefire/common-junit4/2.14.1/common-junit4-2.14.1.jar (16 KB at 102.5 KB/sec)
[INFO] Downloaded: https://repo.maven.apache.org/maven2/org/apache/maven/surefire/common-java5/2.14.1/common-java5-2.14.1.jar (55 KB at 394.6 KB/sec)
[INFO] Downloaded: https://repo.maven.apache.org/maven2/org/apache/maven/surefire/surefire-grouper/2.14.1/surefire-grouper-2.14.1.jar (37 KB at 392.8 KB/sec)
[INFO] Downloaded: https://repo.maven.apache.org/maven2/org/apache/maven/surefire/common-junit48/2.14.1/common-junit48-2.14.1.jar (17 KB at 84.6 KB/sec)
[INFO] Downloaded: https://repo.maven.apache.org/maven2/org/apache/maven/surefire/surefire-junit47/2.14.1/surefire-junit47-2.14.1.jar (103 KB at 439.7 KB/sec)

-------------------------------------------------------
 T E S T S
-------------------------------------------------------
parallel='classes', perCoreThreadCount=true, threadCount=2, useUnlimitedThreads=false
Running com.codahale.metrics.InstrumentedExecutorServiceTest
Tests run: 1, Failures: 0, Errors: 0, Skipped: 0, Time elapsed: 0.429 sec
Running com.codahale.metrics.ChunkedAssociativeLongArrayTest
Tests run: 2, Failures: 0, Errors: 0, Skipped: 0, Time elapsed: 0.526 sec
Running com.codahale.metrics.ClockTest
Tests run: 2, Failures: 0, Errors: 0, Skipped: 0, Time elapsed: 0.476 sec
Running com.codahale.metrics.CachedGaugeTest
Tests run: 2, Failures: 0, Errors: 0, Skipped: 0, Time elapsed: 0.555 sec
Running com.codahale.metrics.SlidingWindowReservoirTest
Tests run: 2, Failures: 0, Errors: 0, Skipped: 0, Time elapsed: 0.002 sec
Running com.codahale.metrics.UniformSnapshotTest
Tests run: 25, Failures: 0, Errors: 0, Skipped: 0, Time elapsed: 0.105 sec
Running com.codahale.metrics.CounterTest
Tests run: 7, Failures: 0, Errors: 0, Skipped: 0, Time elapsed: 0.014 sec
Running com.codahale.metrics.MeterApproximationTest
Tests run: 12, Failures: 0, Errors: 0, Skipped: 0, Time elapsed: 0.789 sec
Running com.codahale.metrics.InstrumentedThreadFactoryTest
Tests run: 1, Failures: 0, Errors: 0, Skipped: 0, Time elapsed: 0.229 sec
Running com.codahale.metrics.RatioGaugeTest
Tests run: 5, Failures: 0, Errors: 0, Skipped: 0, Time elapsed: 0.573 sec
Running com.codahale.metrics.EWMATest
Tests run: 3, Failures: 0, Errors: 0, Skipped: 0, Time elapsed: 0.484 sec
Running com.codahale.metrics.DerivativeGaugeTest
Tests run: 1, Failures: 0, Errors: 0, Skipped: 0, Time elapsed: 0.001 sec
Running com.codahale.metrics.UniformReservoirTest
Tests run: 1, Failures: 0, Errors: 0, Skipped: 0, Time elapsed: 0.419 sec
Running com.codahale.metrics.SharedMetricRegistriesTest
Tests run: 8, Failures: 0, Errors: 0, Skipped: 0, Time elapsed: 0.064 sec
Running com.codahale.metrics.Slf4jReporterTest
Tests run: 10, Failures: 0, Errors: 0, Skipped: 0, Time elapsed: 0.086 sec
Running com.codahale.metrics.SlidingTimeWindowReservoirTest
Tests run: 3, Failures: 0, Errors: 0, Skipped: 0, Time elapsed: 7.323 sec
Running com.codahale.metrics.TimerTest
Tests run: 8, Failures: 0, Errors: 0, Skipped: 0, Time elapsed: 1.211 sec
Running com.codahale.metrics.MetricFilterTest
Tests run: 1, Failures: 0, Errors: 0, Skipped: 0, Time elapsed: 2.94 sec
Running com.codahale.metrics.InstrumentedScheduledExecutorServiceTest
Tests run: 6, Failures: 0, Errors: 0, Skipped: 0, Time elapsed: 0.7 sec
Running com.codahale.metrics.SlidingTimeWindowArrayReservoirTest
Tests run: 4, Failures: 0, Errors: 0, Skipped: 0, Time elapsed: 5.117 sec
Running com.codahale.metrics.FixedNameCsvFileProviderTest
Tests run: 2, Failures: 0, Errors: 0, Skipped: 0, Time elapsed: 0.051 sec
Running com.codahale.metrics.ConsoleReporterTest
Tests run: 8, Failures: 0, Errors: 0, Skipped: 0, Time elapsed: 1.314 sec
Running com.codahale.metrics.ExponentiallyDecayingReservoirTest
Tests run: 10, Failures: 0, Errors: 0, Skipped: 0, Time elapsed: 1.901 sec
Running com.codahale.metrics.ScheduledReporterTest
Tests run: 13, Failures: 0, Errors: 0, Skipped: 0, Time elapsed: 1.657 sec
Running com.codahale.metrics.CsvReporterTest
Tests run: 6, Failures: 0, Errors: 0, Skipped: 0, Time elapsed: 0.162 sec
Running com.codahale.metrics.HistogramTest
Tests run: 3, Failures: 0, Errors: 0, Skipped: 0, Time elapsed: 0.182 sec
Running com.codahale.metrics.MetricRegistryTest
Tests run: 39, Failures: 0, Errors: 0, Skipped: 0, Time elapsed: 0.161 sec
Running com.codahale.metrics.WeightedSnapshotTest
Tests run: 26, Failures: 0, Errors: 0, Skipped: 0, Time elapsed: 1.975 sec
Running com.codahale.metrics.MetricRegistryListenerTest
Tests run: 6, Failures: 0, Errors: 0, Skipped: 0, Time elapsed: 0.015 sec
Running com.codahale.metrics.MeterTest
Tests run: 2, Failures: 0, Errors: 0, Skipped: 0, Time elapsed: 0.003 sec

Results :

Tests run: 219, Failures: 0, Errors: 0, Skipped: 0

[INFO]                                                                         
[INFO] ------------------------------------------------------------------------
[INFO] Building Benchmarks for Metrics 4.0.0-alpha4-SNAPSHOT
[INFO] ------------------------------------------------------------------------
[INFO] 
[INFO] --- maven-enforcer-plugin:1.2:enforce (enforce) @ metrics-benchmarks ---
[INFO] Skipping Rule Enforcement.
[INFO] 
[INFO] --- maven-resources-plugin:2.6:resources (default-resources) @ metrics-benchmarks ---
[INFO] Using 'UTF-8' encoding to copy filtered resources.
[INFO] skip non existing resourceDirectory /root/workspace/dropwizard/metrics/275831275/metrics-benchmarks/src/main/resources
[INFO] 
[INFO] --- maven-compiler-plugin:3.6.1:compile (default-compile) @ metrics-benchmarks ---
[INFO] Nothing to compile - all classes are up to date
[INFO] 
[INFO] --- maven-resources-plugin:2.6:testResources (default-testResources) @ metrics-benchmarks ---
[INFO] Using 'UTF-8' encoding to copy filtered resources.
[INFO] skip non existing resourceDirectory /root/workspace/dropwizard/metrics/275831275/metrics-benchmarks/src/test/resources
[INFO] 
[INFO] --- maven-compiler-plugin:3.6.1:testCompile (default-testCompile) @ metrics-benchmarks ---
[INFO] No sources to compile
[INFO] 
[INFO] --- maven-surefire-plugin:2.14.1:test (default-test) @ metrics-benchmarks ---
[INFO] No tests to run.
[INFO]                                                                         
[INFO] ------------------------------------------------------------------------
[INFO] Building JVM Integration for Metrics 4.0.0-alpha4-SNAPSHOT
[INFO] ------------------------------------------------------------------------
[INFO] 
[INFO] --- maven-enforcer-plugin:1.2:enforce (enforce) @ metrics-jvm ---
[INFO] Skipping Rule Enforcement.
[INFO] 
[INFO] --- maven-resources-plugin:3.0.2:resources (default-resources) @ metrics-jvm ---
[INFO] Using 'UTF-8' encoding to copy filtered resources.
[INFO] skip non existing resourceDirectory /root/workspace/dropwizard/metrics/275831275/metrics-jvm/src/main/resources
[INFO] 
[INFO] --- maven-compiler-plugin:3.7.0:compile (default-compile) @ metrics-jvm ---
[INFO] Nothing to compile - all classes are up to date
[INFO] 
[INFO] --- maven-resources-plugin:3.0.2:testResources (default-testResources) @ metrics-jvm ---
[INFO] Using 'UTF-8' encoding to copy filtered resources.
[INFO] skip non existing resourceDirectory /root/workspace/dropwizard/metrics/275831275/metrics-jvm/src/test/resources
[INFO] 
[INFO] --- maven-compiler-plugin:3.7.0:testCompile (default-testCompile) @ metrics-jvm ---
[INFO] Nothing to compile - all classes are up to date
[INFO] 
[INFO] --- maven-surefire-plugin:2.14.1:test (default-test) @ metrics-jvm ---
[INFO] Surefire report directory: /root/workspace/dropwizard/metrics/275831275/metrics-jvm/target/surefire-reports

-------------------------------------------------------
 T E S T S
-------------------------------------------------------
parallel='classes', perCoreThreadCount=true, threadCount=2, useUnlimitedThreads=false
Running com.codahale.metrics.jvm.CpuTimeClockTest
Tests run: 1, Failures: 1, Errors: 0, Skipped: 0, Time elapsed: 0.282 sec <<< FAILURE!
cpuTimeClock(com.codahale.metrics.jvm.CpuTimeClockTest)  Time elapsed: 0.282 sec  <<< FAILURE!
java.lang.AssertionError: 
Expecting:
  <1.505473818855E12>
to be close to:
  <1.505473819081E12>
by less than <200.0> but difference was <226.0>.
(a difference of exactly <200.0> being considered valid)
	at com.codahale.metrics.jvm.CpuTimeClockTest.cpuTimeClock(CpuTimeClockTest.java:17)

Running com.codahale.metrics.jvm.ThreadDeadlockDetectorTest
Tests run: 3, Failures: 0, Errors: 0, Skipped: 0, Time elapsed: 0.25 sec
Running com.codahale.metrics.jvm.ThreadStatesGaugeSetTest
Tests run: 7, Failures: 0, Errors: 0, Skipped: 0, Time elapsed: 0.295 sec
Running com.codahale.metrics.jvm.FileDescriptorRatioGaugeTest
Tests run: 3, Failures: 0, Errors: 0, Skipped: 0, Time elapsed: 0.94 sec
Running com.codahale.metrics.jvm.GarbageCollectorMetricSetTest
Tests run: 4, Failures: 0, Errors: 0, Skipped: 0, Time elapsed: 0.193 sec
Running com.codahale.metrics.jvm.BufferPoolMetricSetTest
Tests run: 8, Failures: 0, Errors: 0, Skipped: 0, Time elapsed: 0.009 sec
Running com.codahale.metrics.jvm.JvmAttributeGaugeSetTest
Tests run: 5, Failures: 0, Errors: 0, Skipped: 0, Time elapsed: 0.01 sec
Running com.codahale.metrics.jvm.ClassLoadingGaugeSetTest
Tests run: 2, Failures: 0, Errors: 0, Skipped: 0, Time elapsed: 0.345 sec
Running com.codahale.metrics.jvm.ThreadDumpTest
Tests run: 1, Failures: 0, Errors: 0, Skipped: 0, Time elapsed: 0.005 sec
Running com.codahale.metrics.jvm.MemoryUsageGaugeSetTest
Tests run: 23, Failures: 0, Errors: 0, Skipped: 0, Time elapsed: 0.112 sec
Running com.codahale.metrics.jvm.JmxAttributeGaugeTest
Tests run: 5, Failures: 0, Errors: 0, Skipped: 0, Time elapsed: 0.027 sec

Results :

Failed tests: 
  CpuTimeClockTest.cpuTimeClock:17 
Expecting:
  <1.505473818855E12>
to be close to:
  <1.505473819081E12>
by less than <200.0> but difference was <226.0>.
(a difference of exactly <200.0> being considered valid)

Tests run: 62, Failures: 1, Errors: 0, Skipped: 0

[INFO] ------------------------------------------------------------------------
[INFO] Reactor Summary:
[INFO] 
[INFO] Metrics Parent ..................................... SUCCESS [  0.393 s]
[INFO] Metrics Documentation .............................. SUCCESS [  2.365 s]
[INFO] Annotations for Metrics ............................ SUCCESS [  0.290 s]
[INFO] Metrics Core ....................................... SUCCESS [ 14.260 s]
[INFO] Benchmarks for Metrics ............................. SUCCESS [  0.526 s]
[INFO] JVM Integration for Metrics ........................ FAILURE [  3.390 s]
[INFO] Metrics Health Checks .............................. SKIPPED
[INFO] Metrics Integration for Ehcache .................... SKIPPED
[INFO] Graphite Integration for Metrics ................... SKIPPED
[INFO] Metrics Integration for Apache HttpClient .......... SKIPPED
[INFO] Metrics Integration for Apache HttpAsyncClient ..... SKIPPED
[INFO] Metrics Integration for JCache ..................... SKIPPED
[INFO] Metrics Integration for JDBI ....................... SKIPPED
[INFO] Metrics Integration for Jersey 2.x ................. SKIPPED
[INFO] Metrics Integration for Jetty 9.3 and higher ....... SKIPPED
[INFO] Jackson Integration for Metrics .................... SKIPPED
[INFO] Metrics Integration for Log4j 2.x .................. SKIPPED
[INFO] Metrics Integration for Logback .................... SKIPPED
[INFO] Metrics Integration for Servlets ................... SKIPPED
[INFO] Metrics Utility Servlets ........................... SKIPPED
[INFO] Metrics JCStress tests ............................. SKIPPED
[INFO] Metrics Integration with JMX ....................... SKIPPED
[INFO] ------------------------------------------------------------------------
[INFO] BUILD FAILURE
[INFO] ------------------------------------------------------------------------
[INFO] Total time: 23.214 s
[INFO] Finished at: 2017-09-15T13:10:21+02:00
[INFO] Final Memory: 30M/590M
[INFO] ------------------------------------------------------------------------
[ERROR] Failed to execute goal org.apache.maven.plugins:maven-surefire-plugin:2.14.1:test (default-test) on project metrics-jvm: There are test failures.
[ERROR] 
[ERROR] Please refer to /root/workspace/dropwizard/metrics/275831275/metrics-jvm/target/surefire-reports for the individual test results.
[ERROR] -> [Help 1]
[ERROR] 
[ERROR] To see the full stack trace of the errors, re-run Maven with the -e switch.
[ERROR] Re-run Maven using the -X switch to enable full debug logging.
[ERROR] 
[ERROR] For more information about the errors and possible solutions, please read the following articles:
[ERROR] [Help 1] http://cwiki.apache.org/confluence/display/MAVEN/MojoFailureException
[ERROR] 
[ERROR] After correcting the problems, you can resume the build with the command
[ERROR]   mvn <goals> -rf :metrics-jvm
