[INFO] Scanning for projects...
[INFO] Inspecting build with total of 15 modules...
[INFO] Installing Nexus Staging features:
[INFO]   ... total of 15 executions of maven-deploy-plugin replaced with nexus-staging-maven-plugin
[INFO] ------------------------------------------------------------------------
[INFO] Reactor Build Order:
[INFO] 
[INFO] biojava
[INFO] biojava-core
[INFO] biojava-phylo
[INFO] biojava-alignment
[INFO] biojava-structure
[INFO] biojava-integrationtest
[INFO] biojava-structure-gui
[INFO] biojava-sequencing
[INFO] biojava-genome
[INFO] biojava-modfinder
[INFO] biojava-ws
[INFO] biojava-protein-disorder
[INFO] biojava-aa-prop
[INFO] biojava-survival
[INFO] biojava-ontology
[INFO]                                                                         
[INFO] ------------------------------------------------------------------------
[INFO] Building biojava 4.2.9-SNAPSHOT
[INFO] ------------------------------------------------------------------------
[INFO] 
[INFO] --- maven-enforcer-plugin:1.2:enforce (enforce-maven) @ biojava ---
[INFO] Skipping Rule Enforcement.
[INFO]                                                                         
[INFO] ------------------------------------------------------------------------
[INFO] Building biojava-core 4.2.9-SNAPSHOT
[INFO] ------------------------------------------------------------------------
[INFO] 
[INFO] --- maven-enforcer-plugin:1.2:enforce (enforce-maven) @ biojava-core ---
[INFO] Skipping Rule Enforcement.
[INFO] 
[INFO] --- maven-resources-plugin:2.7:resources (default-resources) @ biojava-core ---
[INFO] Using 'UTF-8' encoding to copy filtered resources.
[INFO] Copying 24 resources
[INFO] 
[INFO] --- maven-compiler-plugin:3.3:compile (default-compile) @ biojava-core ---
[INFO] Nothing to compile - all classes are up to date
[INFO] 
[INFO] --- maven-resources-plugin:2.7:testResources (default-testResources) @ biojava-core ---
[INFO] Using 'UTF-8' encoding to copy filtered resources.
[INFO] Copying 17 resources
[INFO] 
[INFO] --- maven-compiler-plugin:3.3:testCompile (default-testCompile) @ biojava-core ---
[INFO] Nothing to compile - all classes are up to date
[INFO] 
[INFO] --- maven-surefire-plugin:2.19.1:test (default-test) @ biojava-core ---
[INFO] Downloading: https://repo.maven.apache.org/maven2/org/apache/maven/surefire/surefire-junit4/2.19.1/surefire-junit4-2.19.1.pom
[INFO] Downloaded: https://repo.maven.apache.org/maven2/org/apache/maven/surefire/surefire-junit4/2.19.1/surefire-junit4-2.19.1.pom (4 KB at 3.2 KB/sec)
[INFO] Downloading: https://repo.maven.apache.org/maven2/org/apache/maven/surefire/surefire-providers/2.19.1/surefire-providers-2.19.1.pom
[INFO] Downloaded: https://repo.maven.apache.org/maven2/org/apache/maven/surefire/surefire-providers/2.19.1/surefire-providers-2.19.1.pom (3 KB at 86.3 KB/sec)
[INFO] Downloading: https://repo.maven.apache.org/maven2/org/apache/maven/surefire/surefire-junit4/2.19.1/surefire-junit4-2.19.1.jar
[INFO] Downloaded: https://repo.maven.apache.org/maven2/org/apache/maven/surefire/surefire-junit4/2.19.1/surefire-junit4-2.19.1.jar (74 KB at 618.9 KB/sec)

-------------------------------------------------------
 T E S T S
-------------------------------------------------------
Running org.biojava.nbio.core.search.io.HspTest
getAlignment
hashCode
equals
Tests run: 3, Failures: 0, Errors: 0, Skipped: 0, Time elapsed: 1.265 sec - in org.biojava.nbio.core.search.io.HspTest
Running org.biojava.nbio.core.search.io.SearchIOTest
Tests run: 3, Failures: 0, Errors: 0, Skipped: 0, Time elapsed: 10.172 sec - in org.biojava.nbio.core.search.io.SearchIOTest
Running org.biojava.nbio.core.search.io.blast.BlastXMLParserTest
createObjects
getFileExtensions
setFile
Tests run: 6, Failures: 0, Errors: 0, Skipped: 2, Time elapsed: 2.654 sec - in org.biojava.nbio.core.search.io.blast.BlastXMLParserTest
Running org.biojava.nbio.core.search.io.blast.BlastTabularParserTest
createObjects
getFileExtensions
setFile
Tests run: 3, Failures: 0, Errors: 0, Skipped: 0, Time elapsed: 3.092 sec - in org.biojava.nbio.core.search.io.blast.BlastTabularParserTest
Running org.biojava.nbio.core.TestAmbiguityCompoundSet
Tests run: 1, Failures: 0, Errors: 0, Skipped: 0, Time elapsed: 1.172 sec - in org.biojava.nbio.core.TestAmbiguityCompoundSet
Running org.biojava.nbio.core.sequence.MultipleSequenceAlignmentTest
Tests run: 1, Failures: 0, Errors: 0, Skipped: 0, Time elapsed: 1.269 sec - in org.biojava.nbio.core.sequence.MultipleSequenceAlignmentTest
Running org.biojava.nbio.core.sequence.location.LocationParserTest
Tests run: 2, Failures: 0, Errors: 0, Skipped: 2, Time elapsed: 0.244 sec - in org.biojava.nbio.core.sequence.location.LocationParserTest
Running org.biojava.nbio.core.sequence.location.InsdcParserTest
Tests run: 2, Failures: 0, Errors: 0, Skipped: 0, Time elapsed: 1.23 sec - in org.biojava.nbio.core.sequence.location.InsdcParserTest
Running org.biojava.nbio.core.sequence.location.LocationTest
Tests run: 7, Failures: 0, Errors: 0, Skipped: 0, Time elapsed: 1.08 sec - in org.biojava.nbio.core.sequence.location.LocationTest
Running org.biojava.nbio.core.sequence.location.TargetedLocationParserTest
Tests run: 4, Failures: 0, Errors: 0, Skipped: 0, Time elapsed: 1.258 sec - in org.biojava.nbio.core.sequence.location.TargetedLocationParserTest
Running org.biojava.nbio.core.sequence.SequenceViewTest
Tests run: 3, Failures: 0, Errors: 0, Skipped: 0, Time elapsed: 1.216 sec - in org.biojava.nbio.core.sequence.SequenceViewTest
Running org.biojava.nbio.core.sequence.EditSequenceTest
Tests run: 4, Failures: 0, Errors: 0, Skipped: 0, Time elapsed: 1.213 sec - in org.biojava.nbio.core.sequence.EditSequenceTest
Running org.biojava.nbio.core.sequence.loader.SimpleGenbankProxySequenceReaderTest
Tests run: 1, Failures: 0, Errors: 0, Skipped: 0, Time elapsed: 2.807 sec - in org.biojava.nbio.core.sequence.loader.SimpleGenbankProxySequenceReaderTest
Running org.biojava.nbio.core.sequence.loader.GenbankProxySequenceReaderTest
Tests run: 16, Failures: 0, Errors: 0, Skipped: 0, Time elapsed: 19.377 sec - in org.biojava.nbio.core.sequence.loader.GenbankProxySequenceReaderTest
Running org.biojava.nbio.core.sequence.io.CasePreservingProteinSequenceCreatorTest
Tests run: 1, Failures: 0, Errors: 0, Skipped: 0, Time elapsed: 1.98 sec - in org.biojava.nbio.core.sequence.io.CasePreservingProteinSequenceCreatorTest
Running org.biojava.nbio.core.sequence.io.FastaReaderTest
Tests run: 3, Failures: 0, Errors: 0, Skipped: 0, Time elapsed: 0.793 sec - in org.biojava.nbio.core.sequence.io.FastaReaderTest
Running org.biojava.nbio.core.sequence.io.FastaWriterTest
Tests run: 2, Failures: 0, Errors: 0, Skipped: 0, Time elapsed: 0.801 sec - in org.biojava.nbio.core.sequence.io.FastaWriterTest
Running org.biojava.nbio.core.sequence.io.GenbankWriterTest
Tests run: 1, Failures: 0, Errors: 0, Skipped: 0, Time elapsed: 0.935 sec - in org.biojava.nbio.core.sequence.io.GenbankWriterTest
Running org.biojava.nbio.core.sequence.io.GenericFastaHeaderParserTest
Tests run: 1, Failures: 0, Errors: 0, Skipped: 0, Time elapsed: 0.796 sec - in org.biojava.nbio.core.sequence.io.GenericFastaHeaderParserTest
Running org.biojava.nbio.core.sequence.io.GenbankCookbookTest
Tests run: 1, Failures: 0, Errors: 0, Skipped: 0, Time elapsed: 3.225 sec - in org.biojava.nbio.core.sequence.io.GenbankCookbookTest
Running org.biojava.nbio.core.sequence.io.GenbankReaderTest
Tests run: 2, Failures: 0, Errors: 0, Skipped: 0, Time elapsed: 0.817 sec - in org.biojava.nbio.core.sequence.io.GenbankReaderTest
Running org.biojava.nbio.core.sequence.compound.AmbiguityDNACompoundTest
Tests run: 2, Failures: 0, Errors: 0, Skipped: 0, Time elapsed: 0.769 sec - in org.biojava.nbio.core.sequence.compound.AmbiguityDNACompoundTest
Running org.biojava.nbio.core.sequence.TranslationTest
Tests run: 12, Failures: 0, Errors: 0, Skipped: 0, Time elapsed: 1.323 sec - in org.biojava.nbio.core.sequence.TranslationTest
Running org.biojava.nbio.core.sequence.DNATest
Tests run: 20, Failures: 0, Errors: 0, Skipped: 0, Time elapsed: 0.874 sec - in org.biojava.nbio.core.sequence.DNATest
Running org.biojava.nbio.core.sequence.JoiningSequenceReaderTest
Tests run: 2, Failures: 0, Errors: 0, Skipped: 0, Time elapsed: 0.635 sec - in org.biojava.nbio.core.sequence.JoiningSequenceReaderTest
Running org.biojava.nbio.core.alignment.SimpleSequencePairTest
Tests run: 34, Failures: 0, Errors: 0, Skipped: 0, Time elapsed: 0.725 sec - in org.biojava.nbio.core.alignment.SimpleSequencePairTest
Running org.biojava.nbio.core.alignment.SimpleAlignedSequenceTest
Tests run: 33, Failures: 0, Errors: 0, Skipped: 1, Time elapsed: 0.838 sec - in org.biojava.nbio.core.alignment.SimpleAlignedSequenceTest
Running org.biojava.nbio.core.alignment.SimpleProfileTest
Tests run: 54, Failures: 0, Errors: 0, Skipped: 1, Time elapsed: 0.824 sec - in org.biojava.nbio.core.alignment.SimpleProfileTest

Results :

Tests run: 224, Failures: 0, Errors: 0, Skipped: 6

[INFO]                                                                         
[INFO] ------------------------------------------------------------------------
[INFO] Building biojava-phylo 4.2.9-SNAPSHOT
[INFO] ------------------------------------------------------------------------
[WARNING] The POM for org.biojava.thirdparty:forester:jar:1.038 is invalid, transitive dependencies (if any) will not be available, enable debug logging for more details
[INFO] 
[INFO] --- maven-enforcer-plugin:1.2:enforce (enforce-maven) @ biojava-phylo ---
[INFO] Skipping Rule Enforcement.
[INFO] 
[INFO] --- maven-resources-plugin:2.7:resources (default-resources) @ biojava-phylo ---
[INFO] Using 'UTF-8' encoding to copy filtered resources.
[INFO] Copying 2 resources
[INFO] 
[INFO] --- maven-compiler-plugin:3.3:compile (default-compile) @ biojava-phylo ---
[INFO] Nothing to compile - all classes are up to date
[INFO] 
[INFO] --- maven-resources-plugin:2.7:testResources (default-testResources) @ biojava-phylo ---
[INFO] Using 'UTF-8' encoding to copy filtered resources.
[INFO] Copying 2 resources
[INFO] 
[INFO] --- maven-compiler-plugin:3.3:testCompile (default-testCompile) @ biojava-phylo ---
[INFO] Nothing to compile - all classes are up to date
[INFO] 
[INFO] --- maven-surefire-plugin:2.19.1:test (default-test) @ biojava-phylo ---

-------------------------------------------------------
 T E S T S
-------------------------------------------------------
Running org.biojava.nbio.phylo.TestForesterWrapper
Tests run: 1, Failures: 0, Errors: 0, Skipped: 0, Time elapsed: 0.927 sec - in org.biojava.nbio.phylo.TestForesterWrapper
Running org.biojava.nbio.phylo.TestDistanceTreeEvaluator
Tests run: 2, Failures: 0, Errors: 0, Skipped: 0, Time elapsed: 0.694 sec - in org.biojava.nbio.phylo.TestDistanceTreeEvaluator

Results :

Tests run: 3, Failures: 0, Errors: 0, Skipped: 0

[INFO]                                                                         
[INFO] ------------------------------------------------------------------------
[INFO] Building biojava-alignment 4.2.9-SNAPSHOT
[INFO] ------------------------------------------------------------------------
[INFO] 
[INFO] --- maven-enforcer-plugin:1.2:enforce (enforce-maven) @ biojava-alignment ---
[INFO] Skipping Rule Enforcement.
[INFO] 
[INFO] --- maven-resources-plugin:2.7:resources (default-resources) @ biojava-alignment ---
[INFO] Using 'UTF-8' encoding to copy filtered resources.
[INFO] Copying 1 resource
[INFO] 
[INFO] --- maven-compiler-plugin:3.3:compile (default-compile) @ biojava-alignment ---
[INFO] Nothing to compile - all classes are up to date
[INFO] 
[INFO] --- maven-resources-plugin:2.7:testResources (default-testResources) @ biojava-alignment ---
[INFO] Using 'UTF-8' encoding to copy filtered resources.
[INFO] Copying 10 resources
[INFO] 
[INFO] --- maven-compiler-plugin:3.3:testCompile (default-testCompile) @ biojava-alignment ---
[INFO] Nothing to compile - all classes are up to date
[INFO] 
[INFO] --- maven-surefire-plugin:2.19.1:test (default-test) @ biojava-alignment ---

-------------------------------------------------------
 T E S T S
-------------------------------------------------------
Running org.biojava.nbio.alignment.TestSubOptimalMSA
Tests run: 2, Failures: 0, Errors: 0, Skipped: 1, Time elapsed: 1.16 sec - in org.biojava.nbio.alignment.TestSubOptimalMSA
Running org.biojava.nbio.alignment.NeedlemanWunschTest
CG--TATATATCGCGCGCGCGATATATATATCT-TCTCTAAAAAAA
GGTATATATATCGCGCGCACGAT-TATATATCTCTCTCTAAAAAAA

Tests run: 23, Failures: 0, Errors: 0, Skipped: 0, Time elapsed: 1.102 sec - in org.biojava.nbio.alignment.NeedlemanWunschTest
Running org.biojava.nbio.alignment.LocalAlignmentTest
Tests run: 1, Failures: 0, Errors: 0, Skipped: 0, Time elapsed: 0.72 sec - in org.biojava.nbio.alignment.LocalAlignmentTest
Running org.biojava.nbio.alignment.GuideTreeTest
Tests run: 8, Failures: 0, Errors: 0, Skipped: 0, Time elapsed: 1.306 sec - in org.biojava.nbio.alignment.GuideTreeTest
Running org.biojava.nbio.alignment.SimpleGapPenaltyTest
Tests run: 5, Failures: 0, Errors: 0, Skipped: 0, Time elapsed: 0.102 sec - in org.biojava.nbio.alignment.SimpleGapPenaltyTest
Running org.biojava.nbio.alignment.SimpleSubstitutionMatrixTest
Tests run: 9, Failures: 0, Errors: 0, Skipped: 0, Time elapsed: 0.714 sec - in org.biojava.nbio.alignment.SimpleSubstitutionMatrixTest
Running org.biojava.nbio.alignment.routines.AlignerHelperTest
Tests run: 9, Failures: 0, Errors: 0, Skipped: 0, Time elapsed: 0.184 sec - in org.biojava.nbio.alignment.routines.AlignerHelperTest
Running org.biojava.nbio.alignment.routines.GuanUberbacherTest
Tests run: 10, Failures: 0, Errors: 0, Skipped: 0, Time elapsed: 0.807 sec - in org.biojava.nbio.alignment.routines.GuanUberbacherTest
Running org.biojava.nbio.alignment.SmithWatermanTest
Tests run: 15, Failures: 0, Errors: 0, Skipped: 0, Time elapsed: 0.784 sec - in org.biojava.nbio.alignment.SmithWatermanTest
Running org.biojava.nbio.alignment.TestDNAAlignment
Tests run: 6, Failures: 0, Errors: 0, Skipped: 0, Time elapsed: 4.643 sec - in org.biojava.nbio.alignment.TestDNAAlignment
Running org.biojava.nbio.alignment.io.TestStockholmParser
Tests run: 1, Failures: 0, Errors: 0, Skipped: 0, Time elapsed: 2.734 sec - in org.biojava.nbio.alignment.io.TestStockholmParser
Running org.biojava.nbio.alignment.aaindex.TestAAINDEXLoading
Tests run: 2, Failures: 0, Errors: 0, Skipped: 0, Time elapsed: 0.869 sec - in org.biojava.nbio.alignment.aaindex.TestAAINDEXLoading
Running org.biojava.nbio.alignment.FractionalSimilarityScorerTest
Tests run: 7, Failures: 0, Errors: 0, Skipped: 0, Time elapsed: 1.193 sec - in org.biojava.nbio.alignment.FractionalSimilarityScorerTest
Running org.biojava.nbio.alignment.SimpleProfileProfileAlignerTest
Tests run: 15, Failures: 0, Errors: 0, Skipped: 0, Time elapsed: 0.897 sec - in org.biojava.nbio.alignment.SimpleProfileProfileAlignerTest
Running org.biojava.nbio.alignment.FractionalIdentityScorerTest
Tests run: 7, Failures: 0, Errors: 0, Skipped: 0, Time elapsed: 3.861 sec - in org.biojava.nbio.alignment.FractionalIdentityScorerTest
Running org.biojava.nbio.alignment.SimpleProfilePairTest
Tests run: 3, Failures: 0, Errors: 0, Skipped: 0, Time elapsed: 1.096 sec - in org.biojava.nbio.alignment.SimpleProfilePairTest

Results :

Tests run: 123, Failures: 0, Errors: 0, Skipped: 1

[INFO]                                                                         
[INFO] ------------------------------------------------------------------------
[INFO] Building biojava-structure 4.2.9-SNAPSHOT
[INFO] ------------------------------------------------------------------------
[INFO] 
[INFO] --- maven-enforcer-plugin:1.2:enforce (enforce-maven) @ biojava-structure ---
[INFO] Skipping Rule Enforcement.
[INFO] 
[INFO] --- maven-resources-plugin:2.7:resources (default-resources) @ biojava-structure ---
[INFO] Using 'UTF-8' encoding to copy filtered resources.
[INFO] Copying 3 resources
[INFO] Copying 61 resources
[INFO] 
[INFO] --- maven-compiler-plugin:3.3:compile (default-compile) @ biojava-structure ---
[INFO] Nothing to compile - all classes are up to date
[INFO] 
[INFO] --- maven-resources-plugin:2.7:testResources (default-testResources) @ biojava-structure ---
[INFO] Using 'UTF-8' encoding to copy filtered resources.
[INFO] Copying 84 resources
[INFO] 
[INFO] --- maven-compiler-plugin:3.3:testCompile (default-testCompile) @ biojava-structure ---
[INFO] Nothing to compile - all classes are up to date
[INFO] 
[INFO] --- maven-surefire-plugin:2.19.1:test (default-test) @ biojava-structure ---

-------------------------------------------------------
 T E S T S
-------------------------------------------------------
Running org.biojava.nbio.structure.TestBond
Tests run: 9, Failures: 0, Errors: 0, Skipped: 0, Time elapsed: 14.154 sec - in org.biojava.nbio.structure.TestBond
Running org.biojava.nbio.structure.TestParsingCalcium
Tests run: 2, Failures: 0, Errors: 0, Skipped: 0, Time elapsed: 8.939 sec - in org.biojava.nbio.structure.TestParsingCalcium
Running org.biojava.nbio.structure.ResidueRangeTest
Tests run: 12, Failures: 0, Errors: 0, Skipped: 0, Time elapsed: 9.143 sec - in org.biojava.nbio.structure.ResidueRangeTest
Running org.biojava.nbio.structure.validation.TestValidationReportParsing
Tests run: 1, Failures: 0, Errors: 0, Skipped: 0, Time elapsed: 3.658 sec - in org.biojava.nbio.structure.validation.TestValidationReportParsing
Running org.biojava.nbio.structure.TestAtomCache
Tests run: 5, Failures: 0, Errors: 0, Skipped: 0, Time elapsed: 12.412 sec - in org.biojava.nbio.structure.TestAtomCache
Running org.biojava.nbio.structure.secstruc.TestSecStrucCalc
Tests run: 1, Failures: 0, Errors: 0, Skipped: 0, Time elapsed: 14.836 sec - in org.biojava.nbio.structure.secstruc.TestSecStrucCalc
Running org.biojava.nbio.structure.secstruc.TestDSSPParser
Tests run: 1, Failures: 0, Errors: 0, Skipped: 0, Time elapsed: 3.465 sec - in org.biojava.nbio.structure.secstruc.TestDSSPParser
Running org.biojava.nbio.structure.asa.TestAsaCalc
Tests run: 1, Failures: 0, Errors: 0, Skipped: 0, Time elapsed: 5.614 sec - in org.biojava.nbio.structure.asa.TestAsaCalc
Running org.biojava.nbio.structure.Test4hhb
Tests run: 1, Failures: 0, Errors: 0, Skipped: 0, Time elapsed: 2.898 sec - in org.biojava.nbio.structure.Test4hhb
Running org.biojava.nbio.structure.AtomPositionMapTest
Tests run: 5, Failures: 0, Errors: 0, Skipped: 0, Time elapsed: 4.859 sec - in org.biojava.nbio.structure.AtomPositionMapTest
Running org.biojava.nbio.structure.TestChargeAdder
Tests run: 2, Failures: 0, Errors: 0, Skipped: 0, Time elapsed: 6.143 sec - in org.biojava.nbio.structure.TestChargeAdder
Running org.biojava.nbio.structure.TestCompoundResIndexMapping
Tests run: 3, Failures: 0, Errors: 0, Skipped: 0, Time elapsed: 3.115 sec - in org.biojava.nbio.structure.TestCompoundResIndexMapping
Running org.biojava.nbio.structure.symmetry.core.TestQuatSymmetryDetection
Tests run: 3, Failures: 0, Errors: 1, Skipped: 0, Time elapsed: 13.961 sec <<< FAILURE! - in org.biojava.nbio.structure.symmetry.core.TestQuatSymmetryDetection
test1b4c(org.biojava.nbio.structure.symmetry.core.TestQuatSymmetryDetection)  Time elapsed: 6.113 sec  <<< ERROR!
java.lang.NullPointerException
	at org.biojava.nbio.structure.symmetry.core.TestQuatSymmetryDetection.getSymmetry(TestQuatSymmetryDetection.java:116)
	at org.biojava.nbio.structure.symmetry.core.TestQuatSymmetryDetection.test1b4c(TestQuatSymmetryDetection.java:58)

Running org.biojava.nbio.structure.symmetry.core.TestChainClusterer
Tests run: 1, Failures: 0, Errors: 0, Skipped: 0, Time elapsed: 0.128 sec - in org.biojava.nbio.structure.symmetry.core.TestChainClusterer
Running org.biojava.nbio.structure.symmetry.internal.TestSingleRefiner
Tests run: 3, Failures: 0, Errors: 0, Skipped: 0, Time elapsed: 0.695 sec - in org.biojava.nbio.structure.symmetry.internal.TestSingleRefiner
Running org.biojava.nbio.structure.symmetry.internal.TestSequenceFunctionOrderDetector
Tests run: 1, Failures: 0, Errors: 0, Skipped: 0, Time elapsed: 33.481 sec - in org.biojava.nbio.structure.symmetry.internal.TestSequenceFunctionOrderDetector
Running org.biojava.nbio.structure.symmetry.internal.TestCeSymm
Tests run: 1, Failures: 0, Errors: 0, Skipped: 0, Time elapsed: 11.624 sec - in org.biojava.nbio.structure.symmetry.internal.TestCeSymm
Running org.biojava.nbio.structure.symmetry.internal.TestSymmetryAxes
Tests run: 3, Failures: 0, Errors: 0, Skipped: 0, Time elapsed: 0.293 sec - in org.biojava.nbio.structure.symmetry.internal.TestSymmetryAxes
Running org.biojava.nbio.structure.TestURLIdentifier
Tests run: 2, Failures: 0, Errors: 0, Skipped: 0, Time elapsed: 4.948 sec - in org.biojava.nbio.structure.TestURLIdentifier
Running org.biojava.nbio.structure.ChemCompTest
Tests run: 4, Failures: 0, Errors: 0, Skipped: 0, Time elapsed: 1.322 sec - in org.biojava.nbio.structure.ChemCompTest
Running org.biojava.nbio.structure.TestAltLocs
Tests run: 9, Failures: 0, Errors: 0, Skipped: 0, Time elapsed: 9.012 sec - in org.biojava.nbio.structure.TestAltLocs
Running org.biojava.nbio.structure.SourceCompoundTest
SOURCE INFO:
Fragment? UNP RESIDUES 32-576
Organism Scientific: MUS MUSCULUS
Organism Tax Id: 10090
Organism Common: MOUSE
Gene: ACHE
Expression System: HOMO SAPIENS
Expression System Tax Id: 9606
Expression System Strain: HEK293F
Expression System Vector Type: PLASMID
Expression System Plasmid: PCDNA3.1
Tests run: 7, Failures: 0, Errors: 0, Skipped: 0, Time elapsed: 4.337 sec - in org.biojava.nbio.structure.SourceCompoundTest
Running org.biojava.nbio.structure.contact.TestContactCalc
Inter-chain contacts calculation vs distance matrix for 2trx A-B
Calculated contacts in 0.048 s
Calculated distance matrix in 0.042 s
(number of atoms: 822, 822)
Intra-chain contacts calculation vs distance matrix for 1smtA
Calculated contacts in 0.016 s
Calculated distance matrix in 0.020 s
(number of atoms: 778)
Intra-chain contacts calculation vs distance matrix for 1su4A
Calculated contacts in 0.066 s
Calculated distance matrix in 0.633 s
(number of atoms: 7671)
Intra-chain contacts calculation vs distance matrix for 2trxA
Calculated contacts in 0.006 s
Calculated distance matrix in 0.010 s
(number of atoms: 822)
1d2sA	ALL	5.0	CA	8.0	CB	8.0	
1od3A	ALL	5.0	CA	8.0	CB	8.0	
1oewA	ALL	5.0	CA	8.0	CB	8.0	
1w0nA	ALL	5.0	CA	8.0	CB	8.0	
1wb4A	ALL	5.0	CA	8.0	CB	8.0	
1wvfA	ALL	5.0	CA	8.0	CB	8.0	
2gpiA	ALL	5.0	CA	8.0	CB	8.0	
AU interfaces of 3hbx, number of atom contacts: 4899, 4885, 4875
AU interfaces of 3hbx, number of residue contacts: 438, 442, 437
Tests run: 6, Failures: 0, Errors: 0, Skipped: 0, Time elapsed: 17.127 sec - in org.biojava.nbio.structure.contact.TestContactCalc
Running org.biojava.nbio.structure.rcsb.RCSBLigandsFactoryTest
Tests run: 5, Failures: 0, Errors: 4, Skipped: 0, Time elapsed: 3.469 sec <<< FAILURE! - in org.biojava.nbio.structure.rcsb.RCSBLigandsFactoryTest
testFromHeteroAtomIdsUrl(org.biojava.nbio.structure.rcsb.RCSBLigandsFactoryTest)  Time elapsed: 2.281 sec  <<< ERROR!
java.lang.NullPointerException
	at org.biojava.nbio.structure.rcsb.RCSBLigandsFactoryTest.testFromHeteroAtomIdsUrl(RCSBLigandsFactoryTest.java:110)

testFromPdbIdsUrl(org.biojava.nbio.structure.rcsb.RCSBLigandsFactoryTest)  Time elapsed: 0.09 sec  <<< ERROR!
java.lang.NullPointerException
	at org.biojava.nbio.structure.rcsb.RCSBLigandsFactoryTest.testFromPdbIdsUrl(RCSBLigandsFactoryTest.java:68)

testFromHeteroAtomIdUrl(org.biojava.nbio.structure.rcsb.RCSBLigandsFactoryTest)  Time elapsed: 0.09 sec  <<< ERROR!
java.lang.NullPointerException
	at org.biojava.nbio.structure.rcsb.RCSBLigandsFactoryTest.testFromHeteroAtomIdUrl(RCSBLigandsFactoryTest.java:118)

testFromPdbIdUrl(org.biojava.nbio.structure.rcsb.RCSBLigandsFactoryTest)  Time elapsed: 0.09 sec  <<< ERROR!
java.lang.NullPointerException
	at org.biojava.nbio.structure.rcsb.RCSBLigandsFactoryTest.testFromPdbIdUrl(RCSBLigandsFactoryTest.java:57)

Running org.biojava.nbio.structure.rcsb.RCSBDescriptionFactoryTest
Tests run: 5, Failures: 0, Errors: 0, Skipped: 0, Time elapsed: 0.825 sec - in org.biojava.nbio.structure.rcsb.RCSBDescriptionFactoryTest
Running org.biojava.nbio.structure.TestStructureCrossReferences
Testing references in mmCIF loading with alignSeqRes
Testing references in original structure
Testing references in cloned structure
Testing references in original structure after having cloned it
Testing references of chain clones
Testing references in atom arrays
Testing references in original structure after getUniqueInterfaces
Testing references in original structure
Testing references in cloned structure
Testing references in original structure after having cloned it
Testing references of chain clones
Testing references in atom arrays
Testing references in original structure after getUniqueInterfaces
Testing references in original structure
Testing references in cloned structure
Testing references in original structure after having cloned it
Testing references of chain clones
Testing references in atom arrays
Testing references in original structure after getUniqueInterfaces
Testing references in original structure
Testing references in cloned structure
Testing references in original structure after having cloned it
Testing references of chain clones
Testing references in atom arrays
Testing references in original structure after getUniqueInterfaces
Testing references in mmCIF loading with NO alignSeqRes
Testing references in original structure
Testing references in cloned structure
Testing references in original structure after having cloned it
Testing references of chain clones
Testing references in atom arrays
Testing references in original structure after getUniqueInterfaces
Testing references in original structure
Testing references in cloned structure
Testing references in original structure after having cloned it
Testing references of chain clones
Testing references in atom arrays
Testing references in original structure after getUniqueInterfaces
Testing references in PDB loading with alignSeqRes
Testing references in original structure
Testing references in cloned structure
Testing references in original structure after having cloned it
Testing references of chain clones
Testing references in atom arrays
Testing references in original structure after getUniqueInterfaces
Testing references in original structure
Testing references in cloned structure
Testing references in original structure after having cloned it
Testing references of chain clones
Testing references in atom arrays
Testing references in original structure after getUniqueInterfaces
Tests run: 4, Failures: 0, Errors: 0, Skipped: 0, Time elapsed: 12.962 sec - in org.biojava.nbio.structure.TestStructureCrossReferences
Running org.biojava.nbio.structure.align.client.TestStructureName
Tests run: 6, Failures: 0, Errors: 0, Skipped: 1, Time elapsed: 1.071 sec - in org.biojava.nbio.structure.align.client.TestStructureName
Running org.biojava.nbio.structure.align.multiple.TestAFPChainConversion
Tests run: 1, Failures: 0, Errors: 0, Skipped: 0, Time elapsed: 0.806 sec - in org.biojava.nbio.structure.align.multiple.TestAFPChainConversion
Running org.biojava.nbio.structure.align.multiple.util.TestMultipleAlignmentScorer
Tests run: 5, Failures: 0, Errors: 0, Skipped: 0, Time elapsed: 0.876 sec - in org.biojava.nbio.structure.align.multiple.util.TestMultipleAlignmentScorer
Running org.biojava.nbio.structure.align.multiple.util.TestMultipleAlignmentTools
Tests run: 1, Failures: 0, Errors: 0, Skipped: 0, Time elapsed: 0.118 sec - in org.biojava.nbio.structure.align.multiple.util.TestMultipleAlignmentTools
Running org.biojava.nbio.structure.align.multiple.util.TestMultipleAlignmentXMLParser
Tests run: 2, Failures: 0, Errors: 0, Skipped: 0, Time elapsed: 8.541 sec - in org.biojava.nbio.structure.align.multiple.util.TestMultipleAlignmentXMLParser
Running org.biojava.nbio.structure.align.multiple.util.TestMultipleAlignmentWriter
Operations for block 1
     X1 = ( 1.000000)*Xref + ( 0.000000)*Yref + ( 0.000000)*Zref + (    0.000000)
     Y1 = ( 0.000000)*Xref + ( 1.000000)*Yref + ( 0.000000)*Zref + (    0.000000)
     Z1 = ( 0.000000)*Xref + ( 0.000000)*Yref + ( 1.000000)*Zref + (    0.000000)

     X2 = ( 0.814927)*Xref + (-0.239779)*Yref + ( 0.527636)*Zref + (   -0.198745)
     Y2 = ( 0.467768)*Xref + ( 0.809629)*Yref + (-0.354534)*Zref + (    2.791076)
     Z2 = (-0.342180)*Xref + ( 0.535730)*Yref + ( 0.771950)*Zref + (   -8.230708)

     X3 = (-0.330341)*Xref + ( 0.933003)*Yref + (-0.142761)*Zref + (    6.552893)
     Y3 = ( 0.678439)*Xref + ( 0.339868)*Yref + ( 0.651314)*Zref + (    1.762178)
     Z3 = ( 0.656198)*Xref + ( 0.118301)*Yref + (-0.745258)*Zref + (    3.834594)

     X4 = ( 0.518511)*Xref + (-0.228254)*Yref + (-0.824043)*Zref + (   25.789098)
     Y4 = ( 0.499493)*Xref + ( 0.863045)*Yref + ( 0.075237)*Zref + (  -19.128131)
     Z4 = ( 0.694013)*Xref + (-0.450614)*Yref + ( 0.561509)*Zref + (   12.348022)

Operations for block 2
     X1 = ( 1.000000)*Xref + ( 0.000000)*Yref + ( 0.000000)*Zref + (    0.000000)
     Y1 = ( 0.000000)*Xref + ( 1.000000)*Yref + ( 0.000000)*Zref + (    0.000000)
     Z1 = ( 0.000000)*Xref + ( 0.000000)*Yref + ( 1.000000)*Zref + (    0.000000)

     X2 = ( 0.842373)*Xref + (-0.345647)*Yref + ( 0.413445)*Zref + (    4.318617)
     Y2 = ( 0.521783)*Xref + ( 0.714942)*Yref + (-0.465403)*Zref + (    7.141563)
     Z2 = (-0.134724)*Xref + ( 0.607772)*Yref + ( 0.782600)*Zref + (  -10.200162)

     X3 = (-0.359346)*Xref + ( 0.905779)*Yref + (-0.224576)*Zref + (    6.158376)
     Y3 = ( 0.649531)*Xref + ( 0.415555)*Yref + ( 0.636729)*Zref + (    1.430105)
     Z3 = ( 0.670059)*Xref + ( 0.082937)*Yref + (-0.737660)*Zref + (    3.658757)

     X4 = ( 0.529785)*Xref + (-0.108909)*Yref + (-0.841110)*Zref + (   21.801521)
     Y4 = ( 0.305436)*Xref + ( 0.949679)*Yref + ( 0.069417)*Zref + (  -20.677779)
     Z4 = ( 0.791225)*Xref + (-0.293682)*Yref + ( 0.536390)*Zref + (    7.940602)


Tests run: 10, Failures: 0, Errors: 0, Skipped: 0, Time elapsed: 10.673 sec - in org.biojava.nbio.structure.align.multiple.util.TestMultipleAlignmentWriter
Running org.biojava.nbio.structure.align.TestAlignDBSearchPairs
Tests run: 1, Failures: 0, Errors: 0, Skipped: 0, Time elapsed: 0.077 sec - in org.biojava.nbio.structure.align.TestAlignDBSearchPairs
Running org.biojava.nbio.structure.align.util.AtomCacheTest
Tests run: 8, Failures: 0, Errors: 0, Skipped: 0, Time elapsed: 18.111 sec - in org.biojava.nbio.structure.align.util.AtomCacheTest
Running org.biojava.nbio.structure.align.util.RotationAxisTest
Tests run: 1, Failures: 0, Errors: 0, Skipped: 0, Time elapsed: 0.897 sec - in org.biojava.nbio.structure.align.util.RotationAxisTest
Running org.biojava.nbio.structure.align.ce.TestWebStartClient
Tests run: 1, Failures: 0, Errors: 0, Skipped: 0, Time elapsed: 1.024 sec - in org.biojava.nbio.structure.align.ce.TestWebStartClient
Running org.biojava.nbio.structure.align.ce.CeCPMainTest
Tests run: 5, Failures: 0, Errors: 0, Skipped: 0, Time elapsed: 6.102 sec - in org.biojava.nbio.structure.align.ce.CeCPMainTest
Running org.biojava.nbio.structure.align.ce.TestSmallAlignment
Tests run: 1, Failures: 0, Errors: 0, Skipped: 0, Time elapsed: 3.408 sec - in org.biojava.nbio.structure.align.ce.TestSmallAlignment
Running org.biojava.nbio.structure.TestNucleotides
Tests run: 3, Failures: 0, Errors: 0, Skipped: 0, Time elapsed: 4.101 sec - in org.biojava.nbio.structure.TestNucleotides
Running org.biojava.nbio.structure.TestDNAAlignment
Tests run: 1, Failures: 0, Errors: 0, Skipped: 0, Time elapsed: 4.556 sec - in org.biojava.nbio.structure.TestDNAAlignment
Running org.biojava.nbio.structure.TestExperimentalTechniques
Tests run: 4, Failures: 0, Errors: 0, Skipped: 0, Time elapsed: 7.703 sec - in org.biojava.nbio.structure.TestExperimentalTechniques
Running org.biojava.nbio.structure.io.mmcif.TestChemCompProvider
Using PDB_DIR=/tmp as temporary file directory
Using PDB_DIR=/tmp as temporary file directory
Tests run: 2, Failures: 0, Errors: 0, Skipped: 0, Time elapsed: 6.021 sec - in org.biojava.nbio.structure.io.mmcif.TestChemCompProvider
Running org.biojava.nbio.structure.io.TestMMCIFWriting
Tests run: 4, Failures: 0, Errors: 0, Skipped: 0, Time elapsed: 11.103 sec - in org.biojava.nbio.structure.io.TestMMCIFWriting
Running org.biojava.nbio.structure.io.TestDifficultMmCIFFiles
Tests run: 7, Failures: 0, Errors: 1, Skipped: 0, Time elapsed: 14.323 sec <<< FAILURE! - in org.biojava.nbio.structure.io.TestDifficultMmCIFFiles
test2BI6(org.biojava.nbio.structure.io.TestDifficultMmCIFFiles)  Time elapsed: 1.372 sec  <<< ERROR!
java.lang.NullPointerException
	at org.biojava.nbio.structure.io.TestDifficultMmCIFFiles.test2BI6(TestDifficultMmCIFFiles.java:120)

Running org.biojava.nbio.structure.io.TestHardBioUnits
Tests run: 1, Failures: 0, Errors: 0, Skipped: 0, Time elapsed: 11.27 sec - in org.biojava.nbio.structure.io.TestHardBioUnits
Running org.biojava.nbio.structure.io.TestTitleParsing
Tests run: 1, Failures: 1, Errors: 0, Skipped: 0, Time elapsed: 6.254 sec <<< FAILURE! - in org.biojava.nbio.structure.io.TestTitleParsing
test2W6E(org.biojava.nbio.structure.io.TestTitleParsing)  Time elapsed: 6.149 sec  <<< FAILURE!
org.junit.ComparisonFailure: expected:<...trolled dehydration:[ ]hydration state 1.> but was:<...trolled dehydration:[]hydration state 1.>
	at org.biojava.nbio.structure.io.TestTitleParsing.test2W6E(TestTitleParsing.java:58)

Running org.biojava.nbio.structure.io.TestQuaternaryStructureProviders
Tests run: 6, Failures: 2, Errors: 0, Skipped: 0, Time elapsed: 9.906 sec <<< FAILURE! - in org.biojava.nbio.structure.io.TestQuaternaryStructureProviders
test5LDH(org.biojava.nbio.structure.io.TestQuaternaryStructureProviders)  Time elapsed: 3.853 sec  <<< FAILURE!
java.lang.AssertionError: Bioassembly 3 for PDB id 5LDH should fail with a StructureException!
	at org.biojava.nbio.structure.io.TestQuaternaryStructureProviders.test5LDH(TestQuaternaryStructureProviders.java:68)

testGetNrBioAssemblies5LDH(org.biojava.nbio.structure.io.TestQuaternaryStructureProviders)  Time elapsed: 0.233 sec  <<< FAILURE!
java.lang.AssertionError: There should be only 2 bioassemblies for 5LDH, see github issue #230 expected:<2> but was:<4>
	at org.biojava.nbio.structure.io.TestQuaternaryStructureProviders.testGetNrBioAssemblies5LDH(TestQuaternaryStructureProviders.java:89)

Running org.biojava.nbio.structure.io.sifts.SiftsChainToUniprotMappingTest
Tests run: 1, Failures: 0, Errors: 0, Skipped: 0, Time elapsed: 3.292 sec - in org.biojava.nbio.structure.io.sifts.SiftsChainToUniprotMappingTest
Running org.biojava.nbio.structure.io.TestURLBasedFileParsing
structure 4NWR XXXX Description: sub-range [] of XXXX PROTEIN BINDING BioAssemblies: {} NrBioAssemblies: 0 Title: Computationally Designed Two-Component Self-Assembling Tetrahedral Cage T33-28 CrystallographicInfo: [P 1 21 1 - 124.91 189.25 376.83, 90.00 90.02 90.00] Resolution: 99.0 Rfree: 1.0 Authors: D.E.McNamara,N.P.King,J.B.Bale,W.Sheffler,D.Baker,T.O.Yeates IdCode: XXXX Classification: PROTEIN BINDING DepDate: Thu Jan 01 01:00:00 CET 1970 ModDate: Thu Jan 01 01:00:00 CET 1970 ExperimentalTechniques: [X-RAY DIFFRACTION] 
 chains:
chain 0: >A< 
 length SEQRES: 0 length ATOM: 151 aminos: 151 hetatms: 0 nucleotides: 0
chain 1: >B< 
 length SEQRES: 0 length ATOM: 113 aminos: 113 hetatms: 0 nucleotides: 0
chain 2: >D< 
 length SEQRES: 0 length ATOM: 113 aminos: 113 hetatms: 0 nucleotides: 0
chain 3: >F< 
 length SEQRES: 0 length ATOM: 113 aminos: 113 hetatms: 0 nucleotides: 0
chain 4: >H< 
 length SEQRES: 0 length ATOM: 113 aminos: 113 hetatms: 0 nucleotides: 0
chain 5: >J< 
 length SEQRES: 0 length ATOM: 113 aminos: 113 hetatms: 0 nucleotides: 0
chain 6: >L< 
 length SEQRES: 0 length ATOM: 113 aminos: 113 hetatms: 0 nucleotides: 0
chain 7: >N< 
 length SEQRES: 0 length ATOM: 113 aminos: 113 hetatms: 0 nucleotides: 0
chain 8: >P< 
 length SEQRES: 0 length ATOM: 113 aminos: 113 hetatms: 0 nucleotides: 0
chain 9: >R< 
 length SEQRES: 0 length ATOM: 113 aminos: 113 hetatms: 0 nucleotides: 0
chain 10: >T< 
 length SEQRES: 0 length ATOM: 113 aminos: 113 hetatms: 0 nucleotides: 0
chain 11: >V< 
 length SEQRES: 0 length ATOM: 113 aminos: 113 hetatms: 0 nucleotides: 0
chain 12: >X< 
 length SEQRES: 0 length ATOM: 113 aminos: 113 hetatms: 0 nucleotides: 0
chain 13: >C< 
 length SEQRES: 0 length ATOM: 152 aminos: 152 hetatms: 0 nucleotides: 0
chain 14: >E< 
 length SEQRES: 0 length ATOM: 153 aminos: 153 hetatms: 0 nucleotides: 0
chain 15: >G< 
 length SEQRES: 0 length ATOM: 152 aminos: 152 hetatms: 0 nucleotides: 0
chain 16: >I< 
 length SEQRES: 0 length ATOM: 151 aminos: 151 hetatms: 0 nucleotides: 0
chain 17: >K< 
 length SEQRES: 0 length ATOM: 151 aminos: 151 hetatms: 0 nucleotides: 0
chain 18: >M< 
 length SEQRES: 0 length ATOM: 152 aminos: 152 hetatms: 0 nucleotides: 0
chain 19: >O< 
 length SEQRES: 0 length ATOM: 151 aminos: 151 hetatms: 0 nucleotides: 0
chain 20: >Q< 
 length SEQRES: 0 length ATOM: 151 aminos: 151 hetatms: 0 nucleotides: 0
chain 21: >S< 
 length SEQRES: 0 length ATOM: 151 aminos: 151 hetatms: 0 nucleotides: 0
chain 22: >U< 
 length SEQRES: 0 length ATOM: 151 aminos: 151 hetatms: 0 nucleotides: 0
chain 23: >W< 
 length SEQRES: 0 length ATOM: 151 aminos: 151 hetatms: 0 nucleotides: 0
DBRefs: 0
Molecules: 
Compound: 1 (no name) chains: A,C,E,G,I,K,M,O,Q,S,U,W
Compound: 2 (no name) chains: B,D,F,H,J,L,N,P,R,T,V,X

Tests run: 1, Failures: 0, Errors: 0, Skipped: 0, Time elapsed: 5.238 sec - in org.biojava.nbio.structure.io.TestURLBasedFileParsing
Running org.biojava.nbio.structure.io.StructureSequenceMatcherTest
Tests run: 4, Failures: 0, Errors: 0, Skipped: 0, Time elapsed: 4.202 sec - in org.biojava.nbio.structure.io.StructureSequenceMatcherTest
Running org.biojava.nbio.structure.io.TestSiftsParsing
Tests run: 4, Failures: 0, Errors: 0, Skipped: 0, Time elapsed: 3.071 sec - in org.biojava.nbio.structure.io.TestSiftsParsing
Running org.biojava.nbio.structure.io.TestDBRefParsing
Tests run: 2, Failures: 0, Errors: 0, Skipped: 0, Time elapsed: 0.974 sec - in org.biojava.nbio.structure.io.TestDBRefParsing
Running org.biojava.nbio.structure.io.TestParseMmCIFLigands
Hetatom 201 017 true atoms: 38 has altLocs :1
Hetatom 202 017 true atoms: 38
Hetatom 142 HEM true atoms: 43
Hetatom 147 PO4 true atoms: 1
Hetatom 148 HEM true atoms: 43
Hetatom 142 HEM true atoms: 43
Hetatom 147 PO4 true atoms: 1
Hetatom 148 HEM true atoms: 43
Tests run: 2, Failures: 0, Errors: 0, Skipped: 0, Time elapsed: 4.41 sec - in org.biojava.nbio.structure.io.TestParseMmCIFLigands
Running org.biojava.nbio.structure.io.TestParseMmCIFFeatures
Tests run: 4, Failures: 0, Errors: 0, Skipped: 0, Time elapsed: 4.583 sec - in org.biojava.nbio.structure.io.TestParseMmCIFFeatures
Running org.biojava.nbio.structure.io.FastaAFPChainConverterTest
Tests run: 5, Failures: 0, Errors: 0, Skipped: 0, Time elapsed: 12.805 sec - in org.biojava.nbio.structure.io.FastaAFPChainConverterTest
Running org.biojava.nbio.structure.io.TestMMcifOrganismParsing
Tests run: 3, Failures: 0, Errors: 0, Skipped: 0, Time elapsed: 3.9 sec - in org.biojava.nbio.structure.io.TestMMcifOrganismParsing
Running org.biojava.nbio.structure.io.TestMmCIFSpecialCases
Tests run: 1, Failures: 0, Errors: 0, Skipped: 0, Time elapsed: 0.679 sec - in org.biojava.nbio.structure.io.TestMmCIFSpecialCases
Running org.biojava.nbio.structure.io.TestHeaderOnly
A:CCTGTGACAAATTGCCCTCAGT
B:CTGAGGGCAATTTGTCACAGGT
C:MAETAVINHKKRKNSPRIVQSNDLTEAAYSLSRDQKRMLYLFVDQIRKSDGTLQEHDGICEIHVAKYAEIFGLTSAEASKDIRQALKSFAGKEVVFYRPEEDAGDEKGYESFPWFIKPAHSPSRGLYSVHINPYLIPFFIGLQNRFTQFRLSETKEITNPYAMRLYESLCQYRKPDGSGIVSLKIDWIIERYQLPQSYQRMPDFRRRFLQVCVNEINSRTPMRLSYIEKKKGRQTTHIVFSFRDITSMTTG
A:CCTGTGACAAATTGCCCTCAGT
B:CTGAGGGCAATTTGTCACAGGT
C:MAETAVINHKKRKNSPRIVQSNDLTEAAYSLSRDQKRMLYLFVDQIRKSDGTLQEHDGICEIHVAKYAEIFGLTSAEASKDIRQALKSFAGKEVVFYRPEEDAGDEKGYESFPWFIKPAHSPSRGLYSVHINPYLIPFFIGLQNRFTQFRLSETKEITNPYAMRLYESLCQYRKPDGSGIVSLKIDWIIERYQLPQSYQRMPDFRRRFLQVCVNEINSRTPMRLSYIEKKKGRQTTHIVFSFRDITSMTTG
Testing PDB parsing speed
[] Elapsed time: 0.018 s
Testing mmCIF parsing speed
[] Elapsed time: 0.507 s
Tests run: 3, Failures: 0, Errors: 0, Skipped: 0, Time elapsed: 4.164 sec - in org.biojava.nbio.structure.io.TestHeaderOnly
Running org.biojava.nbio.structure.io.TestParseOnAsymId
Tests run: 1, Failures: 0, Errors: 0, Skipped: 0, Time elapsed: 2.477 sec - in org.biojava.nbio.structure.io.TestParseOnAsymId
Running org.biojava.nbio.structure.io.TestNonDepositedFiles
Tests run: 10, Failures: 0, Errors: 0, Skipped: 0, Time elapsed: 5.243 sec - in org.biojava.nbio.structure.io.TestNonDepositedFiles
Running org.biojava.nbio.structure.TestCompoundHeuristics
Entities for file: 2m7y_raw.pdb.gz
A: A
Entities for file: 2m7y_raw.pdb.gz
A: A
Entities for file: 3c5f_raw.pdb.gz
A: A B
D: D E
P: P Q
T: T U
Entities for file: 3c5f_raw.pdb.gz
A: A B
D: D E
P: P Q
T: T U
Entities for file: 4b19_raw.pdb.gz
A: A
Entities for file: 4b19_raw.pdb.gz
A: A
Entities for file: 3ddo_raw_noseqres.pdb.gz
A: A B C D E F
Entities for file: 3ddo_raw_noseqres.pdb.gz
A: A B C D E F
Entities for file: 3ddo_raw_trunc_seqres.pdb.gz
A: A B C D E F
Entities for file: 3ddo_raw_trunc_seqres.pdb.gz
A: A B C D E F
Entities for file: 1b8g_raw.pdb.gz
A: A B
Entities for file: 1b8g_raw.pdb.gz
A: A B
Tests run: 6, Failures: 0, Errors: 0, Skipped: 0, Time elapsed: 3.239 sec - in org.biojava.nbio.structure.TestCompoundHeuristics
Running org.biojava.nbio.structure.TestBioAssemblyIdentifier
Tests run: 1, Failures: 0, Errors: 0, Skipped: 0, Time elapsed: 4.327 sec - in org.biojava.nbio.structure.TestBioAssemblyIdentifier
Running org.biojava.nbio.structure.TestDownloadChemCompProvider
Tests run: 1, Failures: 0, Errors: 0, Skipped: 0, Time elapsed: 1.154 sec - in org.biojava.nbio.structure.TestDownloadChemCompProvider
Running org.biojava.nbio.structure.HetatomImplTest
Tests run: 6, Failures: 0, Errors: 0, Skipped: 0, Time elapsed: 0.743 sec - in org.biojava.nbio.structure.HetatomImplTest
Running org.biojava.nbio.structure.ResidueNumberTest
Tests run: 7, Failures: 0, Errors: 0, Skipped: 0, Time elapsed: 0.076 sec - in org.biojava.nbio.structure.ResidueNumberTest
Running org.biojava.nbio.structure.TestLoadStructureFromURL
making dir with space:/tmp/TEST DIR
Tests run: 1, Failures: 0, Errors: 0, Skipped: 0, Time elapsed: 2.51 sec - in org.biojava.nbio.structure.TestLoadStructureFromURL
Running org.biojava.nbio.structure.Test2JA5
Tests run: 2, Failures: 0, Errors: 0, Skipped: 0, Time elapsed: 4.206 sec - in org.biojava.nbio.structure.Test2JA5
Running org.biojava.nbio.structure.TestCalc
Tests run: 4, Failures: 0, Errors: 0, Skipped: 0, Time elapsed: 0.813 sec - in org.biojava.nbio.structure.TestCalc
Running org.biojava.nbio.structure.PdbFileFormat30Test
104D is a LEGACY entry - this will most likely not parse correctly.
Tests run: 3, Failures: 0, Errors: 0, Skipped: 0, Time elapsed: 3.819 sec - in org.biojava.nbio.structure.PdbFileFormat30Test
Running org.biojava.nbio.structure.TestVeryLongFileName
Tests run: 1, Failures: 0, Errors: 0, Skipped: 0, Time elapsed: 1.048 sec - in org.biojava.nbio.structure.TestVeryLongFileName
Running org.biojava.nbio.structure.xtal.TestCrystalInfo
Tests run: 4, Failures: 0, Errors: 0, Skipped: 0, Time elapsed: 20.564 sec - in org.biojava.nbio.structure.xtal.TestCrystalInfo
Running org.biojava.nbio.structure.xtal.TestCrystalCell
Tests run: 4, Failures: 0, Errors: 0, Skipped: 0, Time elapsed: 0.137 sec - in org.biojava.nbio.structure.xtal.TestCrystalCell
Running org.biojava.nbio.structure.xtal.TestSpaceGroup
Tests run: 1, Failures: 0, Errors: 0, Skipped: 0, Time elapsed: 1.729 sec - in org.biojava.nbio.structure.xtal.TestSpaceGroup
Running org.biojava.nbio.structure.xtal.TestInterfaceClustering
Tests run: 2, Failures: 0, Errors: 0, Skipped: 0, Time elapsed: 23.243 sec - in org.biojava.nbio.structure.xtal.TestInterfaceClustering
Running org.biojava.nbio.structure.TestCloning
Tests run: 4, Failures: 0, Errors: 0, Skipped: 0, Time elapsed: 4.445 sec - in org.biojava.nbio.structure.TestCloning
Running org.biojava.nbio.structure.PDBStatusTest
Tests run: 6, Failures: 0, Errors: 0, Skipped: 0, Time elapsed: 2.078 sec - in org.biojava.nbio.structure.PDBStatusTest
Running org.biojava.nbio.structure.TestStructureImpl
Tests run: 1, Failures: 0, Errors: 0, Skipped: 0, Time elapsed: 0.776 sec - in org.biojava.nbio.structure.TestStructureImpl
Running org.biojava.nbio.structure.SiteTest
Tests run: 7, Failures: 0, Errors: 0, Skipped: 0, Time elapsed: 0.692 sec - in org.biojava.nbio.structure.SiteTest
Running org.biojava.nbio.structure.ElementTest
Tests run: 3, Failures: 0, Errors: 0, Skipped: 0, Time elapsed: 0.073 sec - in org.biojava.nbio.structure.ElementTest

Results :

Failed tests: 
  TestQuaternaryStructureProviders.test5LDH:68 Bioassembly 3 for PDB id 5LDH should fail with a StructureException!
  TestQuaternaryStructureProviders.testGetNrBioAssemblies5LDH:89 There should be only 2 bioassemblies for 5LDH, see github issue #230 expected:<2> but was:<4>
  TestTitleParsing.test2W6E:58 expected:<...trolled dehydration:[ ]hydration state 1.> but was:<...trolled dehydration:[]hydration state 1.>
Tests in error: 
  TestDifficultMmCIFFiles.test2BI6:120 NullPointer
  RCSBLigandsFactoryTest.testFromHeteroAtomIdUrl:118 NullPointer
  RCSBLigandsFactoryTest.testFromHeteroAtomIdsUrl:110 NullPointer
  RCSBLigandsFactoryTest.testFromPdbIdUrl:57 NullPointer
  RCSBLigandsFactoryTest.testFromPdbIdsUrl:68 NullPointer
  TestQuatSymmetryDetection.test1b4c:58->getSymmetry:116 NullPointer

Tests run: 273, Failures: 3, Errors: 6, Skipped: 1

[INFO] ------------------------------------------------------------------------
[INFO] Reactor Summary:
[INFO] 
[INFO] biojava ............................................ SUCCESS [  0.685 s]
[INFO] biojava-core ....................................... SUCCESS [01:31 min]
[INFO] biojava-phylo ...................................... SUCCESS [  3.483 s]
[INFO] biojava-alignment .................................. SUCCESS [ 38.345 s]
[INFO] biojava-structure .................................. FAILURE [08:52 min]
[INFO] biojava-integrationtest ............................ SKIPPED
[INFO] biojava-structure-gui .............................. SKIPPED
[INFO] biojava-sequencing ................................. SKIPPED
[INFO] biojava-genome ..................................... SKIPPED
[INFO] biojava-modfinder .................................. SKIPPED
[INFO] biojava-ws ......................................... SKIPPED
[INFO] biojava-protein-disorder ........................... SKIPPED
[INFO] biojava-aa-prop .................................... SKIPPED
[INFO] biojava-survival ................................... SKIPPED
[INFO] biojava-ontology ................................... SKIPPED
[INFO] ------------------------------------------------------------------------
[INFO] BUILD FAILURE
[INFO] ------------------------------------------------------------------------
[INFO] Total time: 11:10 min
[INFO] Finished at: 2017-10-03T19:20:02+02:00
[INFO] Final Memory: 26M/792M
[INFO] ------------------------------------------------------------------------
[ERROR] Failed to execute goal org.apache.maven.plugins:maven-surefire-plugin:2.19.1:test (default-test) on project biojava-structure: There are test failures.
[ERROR] 
[ERROR] Please refer to /root/workspace/biojava/biojava/282798817/biojava-structure/target/surefire-reports for the individual test results.
[ERROR] -> [Help 1]
[ERROR] 
[ERROR] To see the full stack trace of the errors, re-run Maven with the -e switch.
[ERROR] Re-run Maven using the -X switch to enable full debug logging.
[ERROR] 
[ERROR] For more information about the errors and possible solutions, please read the following articles:
[ERROR] [Help 1] http://cwiki.apache.org/confluence/display/MAVEN/MojoFailureException
[ERROR] 
[ERROR] After correcting the problems, you can resume the build with the command
[ERROR]   mvn <goals> -rf :biojava-structure
