[INFO] Scanning for projects...
[INFO] Inspecting build with total of 6 modules...
[INFO] Installing Nexus Staging features:
[INFO]   ... total of 6 executions of maven-deploy-plugin replaced with nexus-staging-maven-plugin
[INFO] ------------------------------------------------------------------------
[INFO] Reactor Build Order:
[INFO] 
[INFO] encon
[INFO] encon-common
[INFO] encon-terms
[INFO] encon-config
[INFO] encon-databind
[INFO] encon
[INFO]                                                                         
[INFO] ------------------------------------------------------------------------
[INFO] Building encon 1.3.0
[INFO] ------------------------------------------------------------------------
[INFO]                                                                         
[INFO] ------------------------------------------------------------------------
[INFO] Building encon-common 1.3.0
[INFO] ------------------------------------------------------------------------
[INFO] 
[INFO] --- maven-checkstyle-plugin:3.0.0:check (validate) @ encon-common ---
[INFO] 
[INFO] --- maven-resources-plugin:2.6:resources (default-resources) @ encon-common ---
[INFO] Using 'UTF-8' encoding to copy filtered resources.
[INFO] skip non existing resourceDirectory /root/workspace/appulse-projects/encon-java/397573353/encon-common/src/main/resources
[INFO] 
[INFO] --- maven-compiler-plugin:3.1:compile (default-compile) @ encon-common ---
[INFO] Nothing to compile - all classes are up to date
[INFO] 
[INFO] >>> findbugs-maven-plugin:3.0.5:check (analyze-compile) > :findbugs @ encon-common >>>
[INFO] 
[INFO] --- findbugs-maven-plugin:3.0.5:findbugs (findbugs) @ encon-common ---
[INFO] 
[INFO] <<< findbugs-maven-plugin:3.0.5:check (analyze-compile) < :findbugs @ encon-common <<<
[INFO] 
[INFO] --- findbugs-maven-plugin:3.0.5:check (analyze-compile) @ encon-common ---
[INFO] 
[INFO] --- maven-resources-plugin:2.6:testResources (default-testResources) @ encon-common ---
[INFO] Using 'UTF-8' encoding to copy filtered resources.
[INFO] skip non existing resourceDirectory /root/workspace/appulse-projects/encon-java/397573353/encon-common/src/test/resources
[INFO] 
[INFO] --- maven-compiler-plugin:3.1:testCompile (default-testCompile) @ encon-common ---
[INFO] Nothing to compile - all classes are up to date
[INFO] 
[INFO] --- maven-surefire-plugin:2.21.0:test (default-test) @ encon-common ---
[INFO] Downloading: https://repo.maven.apache.org/maven2/org/apache/maven/surefire/surefire-junit4/2.21.0/surefire-junit4-2.21.0.pom
[INFO] Downloaded: https://repo.maven.apache.org/maven2/org/apache/maven/surefire/surefire-junit4/2.21.0/surefire-junit4-2.21.0.pom (4 KB at 10.0 KB/sec)
[INFO] Downloading: https://repo.maven.apache.org/maven2/org/apache/maven/surefire/surefire-providers/2.21.0/surefire-providers-2.21.0.pom
[INFO] Downloaded: https://repo.maven.apache.org/maven2/org/apache/maven/surefire/surefire-providers/2.21.0/surefire-providers-2.21.0.pom (3 KB at 144.4 KB/sec)
[INFO] Downloading: https://repo.maven.apache.org/maven2/org/apache/maven/surefire/surefire-junit4/2.21.0/surefire-junit4-2.21.0.jar
[INFO] Downloaded: https://repo.maven.apache.org/maven2/org/apache/maven/surefire/surefire-junit4/2.21.0/surefire-junit4-2.21.0.jar (83 KB at 1836.9 KB/sec)
[INFO] 
[INFO] -------------------------------------------------------
[INFO]  T E S T S
[INFO] -------------------------------------------------------
[INFO] Running io.appulse.encon.common.NodeDescriptorTest

RUNNING TEST: io.appulse.encon.common.NodeDescriptorTest.shortName


RUNNING TEST: io.appulse.encon.common.NodeDescriptorTest.fullLongName


RUNNING TEST: io.appulse.encon.common.NodeDescriptorTest.fullShortName

[INFO] Tests run: 3, Failures: 0, Errors: 0, Skipped: 0, Time elapsed: 0.951 s - in io.appulse.encon.common.NodeDescriptorTest
[INFO] Running io.appulse.encon.common.DistributionFlagTest

RUNNING TEST: io.appulse.encon.common.DistributionFlagTest.parse


RUNNING TEST: io.appulse.encon.common.DistributionFlagTest.bitwiseOr

[INFO] Tests run: 2, Failures: 0, Errors: 0, Skipped: 0, Time elapsed: 0.007 s - in io.appulse.encon.common.DistributionFlagTest
[INFO] 
[INFO] Results:
[INFO] 
[INFO] Tests run: 5, Failures: 0, Errors: 0, Skipped: 0
[INFO] 
[INFO]                                                                         
[INFO] ------------------------------------------------------------------------
[INFO] Building encon-terms 1.3.0
[INFO] ------------------------------------------------------------------------
[INFO] 
[INFO] --- maven-checkstyle-plugin:3.0.0:check (validate) @ encon-terms ---
[INFO] 
[INFO] --- maven-resources-plugin:2.6:resources (default-resources) @ encon-terms ---
[INFO] Using 'UTF-8' encoding to copy filtered resources.
[INFO] skip non existing resourceDirectory /root/workspace/appulse-projects/encon-java/397573353/encon-terms/src/main/resources
[INFO] 
[INFO] --- maven-compiler-plugin:3.1:compile (default-compile) @ encon-terms ---
[INFO] Nothing to compile - all classes are up to date
[INFO] 
[INFO] >>> findbugs-maven-plugin:3.0.5:check (analyze-compile) > :findbugs @ encon-terms >>>
[INFO] 
[INFO] --- findbugs-maven-plugin:3.0.5:findbugs (findbugs) @ encon-terms ---
[INFO] 
[INFO] <<< findbugs-maven-plugin:3.0.5:check (analyze-compile) < :findbugs @ encon-terms <<<
[INFO] 
[INFO] --- findbugs-maven-plugin:3.0.5:check (analyze-compile) @ encon-terms ---
[INFO] 
[INFO] --- maven-resources-plugin:2.6:testResources (default-testResources) @ encon-terms ---
[INFO] Using 'UTF-8' encoding to copy filtered resources.
[INFO] skip non existing resourceDirectory /root/workspace/appulse-projects/encon-java/397573353/encon-terms/src/test/resources
[INFO] 
[INFO] --- maven-compiler-plugin:3.1:testCompile (default-testCompile) @ encon-terms ---
[INFO] Nothing to compile - all classes are up to date
[INFO] 
[INFO] --- maven-surefire-plugin:2.21.0:test (default-test) @ encon-terms ---
[INFO] 
[INFO] -------------------------------------------------------
[INFO]  T E S T S
[INFO] -------------------------------------------------------
[INFO] Running io.appulse.encon.terms.type.ErlangNilTest

RUNNING TEST: io.appulse.encon.terms.type.ErlangNilTest.encode


RUNNING TEST: io.appulse.encon.terms.type.ErlangNilTest.toBytes


RUNNING TEST: io.appulse.encon.terms.type.ErlangNilTest.newInstance

[INFO] Tests run: 3, Failures: 0, Errors: 0, Skipped: 0, Time elapsed: 0.338 s - in io.appulse.encon.terms.type.ErlangNilTest
[INFO] Running io.appulse.encon.terms.type.ErlangReferenceTest

RUNNING TEST: io.appulse.encon.terms.type.ErlangReferenceTest.instantiate


RUNNING TEST: io.appulse.encon.terms.type.ErlangReferenceTest.decode


RUNNING TEST: io.appulse.encon.terms.type.ErlangReferenceTest.encode


RUNNING TEST: io.appulse.encon.terms.type.ErlangReferenceTest.toBytes


RUNNING TEST: io.appulse.encon.terms.type.ErlangReferenceTest.newInstance

[INFO] Tests run: 5, Failures: 0, Errors: 0, Skipped: 0, Time elapsed: 1.119 s - in io.appulse.encon.terms.type.ErlangReferenceTest
[INFO] Running io.appulse.encon.terms.type.ErlangIntegerTest

RUNNING TEST: io.appulse.encon.terms.type.ErlangIntegerTest.instantiate


RUNNING TEST: io.appulse.encon.terms.type.ErlangIntegerTest.decode


RUNNING TEST: io.appulse.encon.terms.type.ErlangIntegerTest.encode

[INFO] Tests run: 3, Failures: 0, Errors: 0, Skipped: 0, Time elapsed: 0.01 s - in io.appulse.encon.terms.type.ErlangIntegerTest
[INFO] Running io.appulse.encon.terms.type.ErlangAtomTest

RUNNING TEST: io.appulse.encon.terms.type.ErlangAtomTest.instantiate


RUNNING TEST: io.appulse.encon.terms.type.ErlangAtomTest.decode


RUNNING TEST: io.appulse.encon.terms.type.ErlangAtomTest.encode


RUNNING TEST: io.appulse.encon.terms.type.ErlangAtomTest.toBytes


RUNNING TEST: io.appulse.encon.terms.type.ErlangAtomTest.newInstance

[INFO] Tests run: 5, Failures: 0, Errors: 0, Skipped: 0, Time elapsed: 0.079 s - in io.appulse.encon.terms.type.ErlangAtomTest
[INFO] Running io.appulse.encon.terms.type.ErlangBitStringTest

RUNNING TEST: io.appulse.encon.terms.type.ErlangBitStringTest.erlangTermValidationException


RUNNING TEST: io.appulse.encon.terms.type.ErlangBitStringTest.decode


RUNNING TEST: io.appulse.encon.terms.type.ErlangBitStringTest.encode


RUNNING TEST: io.appulse.encon.terms.type.ErlangBitStringTest.toBytes


RUNNING TEST: io.appulse.encon.terms.type.ErlangBitStringTest.newInstance

[INFO] Tests run: 5, Failures: 0, Errors: 0, Skipped: 0, Time elapsed: 0.096 s - in io.appulse.encon.terms.type.ErlangBitStringTest
[INFO] Running io.appulse.encon.terms.type.ErlangTupleTest

RUNNING TEST: io.appulse.encon.terms.type.ErlangTupleTest.instantiate


RUNNING TEST: io.appulse.encon.terms.type.ErlangTupleTest.encode


RUNNING TEST: io.appulse.encon.terms.type.ErlangTupleTest.toBytes


RUNNING TEST: io.appulse.encon.terms.type.ErlangTupleTest.newInstance

[INFO] Tests run: 4, Failures: 0, Errors: 0, Skipped: 0, Time elapsed: 0.102 s - in io.appulse.encon.terms.type.ErlangTupleTest
[INFO] Running io.appulse.encon.terms.type.ErlangListTest

RUNNING TEST: io.appulse.encon.terms.type.ErlangListTest.encode


RUNNING TEST: io.appulse.encon.terms.type.ErlangListTest.toBytes


RUNNING TEST: io.appulse.encon.terms.type.ErlangListTest.newInstance

[INFO] Tests run: 3, Failures: 0, Errors: 0, Skipped: 0, Time elapsed: 0.21 s - in io.appulse.encon.terms.type.ErlangListTest
[INFO] Running io.appulse.encon.terms.type.ErlangFloatTest

RUNNING TEST: io.appulse.encon.terms.type.ErlangFloatTest.decode


RUNNING TEST: io.appulse.encon.terms.type.ErlangFloatTest.encode

[INFO] Tests run: 2, Failures: 0, Errors: 0, Skipped: 0, Time elapsed: 0.004 s - in io.appulse.encon.terms.type.ErlangFloatTest
[INFO] Running io.appulse.encon.terms.type.ErlangPortTest

RUNNING TEST: io.appulse.encon.terms.type.ErlangPortTest.decode


RUNNING TEST: io.appulse.encon.terms.type.ErlangPortTest.encode


RUNNING TEST: io.appulse.encon.terms.type.ErlangPortTest.toBytes


RUNNING TEST: io.appulse.encon.terms.type.ErlangPortTest.newInstance

[INFO] Tests run: 4, Failures: 0, Errors: 0, Skipped: 0, Time elapsed: 0.003 s - in io.appulse.encon.terms.type.ErlangPortTest
[INFO] Running io.appulse.encon.terms.type.ErlangBinaryTest

RUNNING TEST: io.appulse.encon.terms.type.ErlangBinaryTest.instantiate


RUNNING TEST: io.appulse.encon.terms.type.ErlangBinaryTest.decode


RUNNING TEST: io.appulse.encon.terms.type.ErlangBinaryTest.encode


RUNNING TEST: io.appulse.encon.terms.type.ErlangBinaryTest.toBytes


RUNNING TEST: io.appulse.encon.terms.type.ErlangBinaryTest.newInstance

[INFO] Tests run: 5, Failures: 0, Errors: 0, Skipped: 0, Time elapsed: 0.002 s - in io.appulse.encon.terms.type.ErlangBinaryTest
[INFO] Running io.appulse.encon.terms.type.ErlangStringTest

RUNNING TEST: io.appulse.encon.terms.type.ErlangStringTest.decode


RUNNING TEST: io.appulse.encon.terms.type.ErlangStringTest.encode

[INFO] Tests run: 2, Failures: 0, Errors: 0, Skipped: 0, Time elapsed: 0.172 s - in io.appulse.encon.terms.type.ErlangStringTest
[INFO] Running io.appulse.encon.terms.type.ErlangPidTest

RUNNING TEST: io.appulse.encon.terms.type.ErlangPidTest.decode


RUNNING TEST: io.appulse.encon.terms.type.ErlangPidTest.encode


RUNNING TEST: io.appulse.encon.terms.type.ErlangPidTest.toBytes


RUNNING TEST: io.appulse.encon.terms.type.ErlangPidTest.newInstance

[INFO] Tests run: 4, Failures: 0, Errors: 0, Skipped: 0, Time elapsed: 0.001 s - in io.appulse.encon.terms.type.ErlangPidTest
[INFO] Running io.appulse.encon.terms.type.ErlangMapTest

RUNNING TEST: io.appulse.encon.terms.type.ErlangMapTest.encode

[INFO] Tests run: 1, Failures: 0, Errors: 0, Skipped: 0, Time elapsed: 0.001 s - in io.appulse.encon.terms.type.ErlangMapTest
[INFO] 
[INFO] Results:
[INFO] 
[INFO] Tests run: 46, Failures: 0, Errors: 0, Skipped: 0
[INFO] 
[INFO]                                                                         
[INFO] ------------------------------------------------------------------------
[INFO] Building encon-config 1.3.0
[INFO] ------------------------------------------------------------------------
[INFO] 
[INFO] --- maven-checkstyle-plugin:3.0.0:check (validate) @ encon-config ---
[INFO] 
[INFO] --- maven-resources-plugin:2.6:resources (default-resources) @ encon-config ---
[INFO] Using 'UTF-8' encoding to copy filtered resources.
[INFO] skip non existing resourceDirectory /root/workspace/appulse-projects/encon-java/397573353/encon-config/src/main/resources
[INFO] 
[INFO] --- maven-compiler-plugin:3.1:compile (default-compile) @ encon-config ---
[INFO] Nothing to compile - all classes are up to date
[INFO] 
[INFO] >>> findbugs-maven-plugin:3.0.5:check (analyze-compile) > :findbugs @ encon-config >>>
[INFO] 
[INFO] --- findbugs-maven-plugin:3.0.5:findbugs (findbugs) @ encon-config ---
[INFO] 
[INFO] <<< findbugs-maven-plugin:3.0.5:check (analyze-compile) < :findbugs @ encon-config <<<
[INFO] 
[INFO] --- findbugs-maven-plugin:3.0.5:check (analyze-compile) @ encon-config ---
[INFO] 
[INFO] --- maven-resources-plugin:2.6:testResources (default-testResources) @ encon-config ---
[INFO] Using 'UTF-8' encoding to copy filtered resources.
[INFO] Copying 1 resource
[INFO] 
[INFO] --- maven-compiler-plugin:3.1:testCompile (default-testCompile) @ encon-config ---
[INFO] Nothing to compile - all classes are up to date
[INFO] 
[INFO] --- maven-surefire-plugin:2.21.0:test (default-test) @ encon-config ---
[INFO] 
[INFO] -------------------------------------------------------
[INFO]  T E S T S
[INFO] -------------------------------------------------------
[INFO] Running io.appulse.encon.config.ConfigTest

RUNNING TEST: io.appulse.encon.config.ConfigTest.defaultDefaults


RUNNING TEST: io.appulse.encon.config.ConfigTest.nonDefaultDefaults


RUNNING TEST: io.appulse.encon.config.ConfigTest.manual


RUNNING TEST: io.appulse.encon.config.ConfigTest.nodeWithDefaults


RUNNING TEST: io.appulse.encon.config.ConfigTest.load

[INFO] Tests run: 5, Failures: 0, Errors: 0, Skipped: 0, Time elapsed: 1.894 s - in io.appulse.encon.config.ConfigTest
[INFO] 
[INFO] Results:
[INFO] 
[INFO] Tests run: 5, Failures: 0, Errors: 0, Skipped: 0
[INFO] 
[INFO]                                                                         
[INFO] ------------------------------------------------------------------------
[INFO] Building encon-databind 1.3.0
[INFO] ------------------------------------------------------------------------
[INFO] 
[INFO] --- maven-checkstyle-plugin:3.0.0:check (validate) @ encon-databind ---
[INFO] 
[INFO] --- maven-resources-plugin:2.6:resources (default-resources) @ encon-databind ---
[INFO] Using 'UTF-8' encoding to copy filtered resources.
[INFO] skip non existing resourceDirectory /root/workspace/appulse-projects/encon-java/397573353/encon-databind/src/main/resources
[INFO] 
[INFO] --- maven-compiler-plugin:3.1:compile (default-compile) @ encon-databind ---
[INFO] Nothing to compile - all classes are up to date
[INFO] 
[INFO] >>> findbugs-maven-plugin:3.0.5:check (analyze-compile) > :findbugs @ encon-databind >>>
[INFO] 
[INFO] --- findbugs-maven-plugin:3.0.5:findbugs (findbugs) @ encon-databind ---
[INFO] 
[INFO] <<< findbugs-maven-plugin:3.0.5:check (analyze-compile) < :findbugs @ encon-databind <<<
[INFO] 
[INFO] --- findbugs-maven-plugin:3.0.5:check (analyze-compile) @ encon-databind ---
[INFO] 
[INFO] --- maven-resources-plugin:2.6:testResources (default-testResources) @ encon-databind ---
[INFO] Using 'UTF-8' encoding to copy filtered resources.
[INFO] skip non existing resourceDirectory /root/workspace/appulse-projects/encon-java/397573353/encon-databind/src/test/resources
[INFO] 
[INFO] --- maven-compiler-plugin:3.1:testCompile (default-testCompile) @ encon-databind ---
[INFO] Nothing to compile - all classes are up to date
[INFO] 
[INFO] --- maven-surefire-plugin:2.21.0:test (default-test) @ encon-databind ---
[INFO] 
[INFO] -------------------------------------------------------
[INFO]  T E S T S
[INFO] -------------------------------------------------------
[INFO] Running io.appulse.encon.databind.TermMapperTest
[INFO] Tests run: 1, Failures: 0, Errors: 0, Skipped: 0, Time elapsed: 0.177 s - in io.appulse.encon.databind.TermMapperTest
[INFO] Running io.appulse.encon.databind.TermMapperDifferentWrappersTest
[INFO] Tests run: 5, Failures: 0, Errors: 0, Skipped: 0, Time elapsed: 0.017 s - in io.appulse.encon.databind.TermMapperDifferentWrappersTest
[INFO] 
[INFO] Results:
[INFO] 
[INFO] Tests run: 6, Failures: 0, Errors: 0, Skipped: 0
[INFO] 
[INFO]                                                                         
[INFO] ------------------------------------------------------------------------
[INFO] Building encon 1.3.0
[INFO] ------------------------------------------------------------------------
[INFO] 
[INFO] --- maven-checkstyle-plugin:3.0.0:check (validate) @ encon ---
[INFO] 
[INFO] --- maven-resources-plugin:2.6:resources (default-resources) @ encon ---
[INFO] Using 'UTF-8' encoding to copy filtered resources.
[INFO] skip non existing resourceDirectory /root/workspace/appulse-projects/encon-java/397573353/encon/src/main/resources
[INFO] 
[INFO] --- maven-compiler-plugin:3.1:compile (default-compile) @ encon ---
[INFO] Nothing to compile - all classes are up to date
[INFO] 
[INFO] >>> findbugs-maven-plugin:3.0.5:check (analyze-compile) > :findbugs @ encon >>>
[INFO] 
[INFO] --- findbugs-maven-plugin:3.0.5:findbugs (findbugs) @ encon ---
[INFO] 
[INFO] <<< findbugs-maven-plugin:3.0.5:check (analyze-compile) < :findbugs @ encon <<<
[INFO] 
[INFO] --- findbugs-maven-plugin:3.0.5:check (analyze-compile) @ encon ---
[INFO] 
[INFO] --- maven-resources-plugin:2.6:testResources (default-testResources) @ encon ---
[INFO] Using 'UTF-8' encoding to copy filtered resources.
[INFO] Copying 2 resources
[INFO] 
[INFO] --- maven-compiler-plugin:3.1:testCompile (default-testCompile) @ encon ---
[INFO] Nothing to compile - all classes are up to date
[INFO] 
[INFO] --- maven-surefire-plugin:2.21.0:test (default-test) @ encon ---
[INFO] 
[INFO] -------------------------------------------------------
[INFO]  T E S T S
[INFO] -------------------------------------------------------
[INFO] Running io.appulse.encon.GeneratorPortTest

RUNNING TEST: io.appulse.encon.GeneratorPortTest.generate

[INFO] Tests run: 1, Failures: 0, Errors: 0, Skipped: 0, Time elapsed: 0.889 s - in io.appulse.encon.GeneratorPortTest
[INFO] Running io.appulse.encon.GeneratorReferenceTest

RUNNING TEST: io.appulse.encon.GeneratorReferenceTest.generateReference

[INFO] Tests run: 1, Failures: 0, Errors: 0, Skipped: 0, Time elapsed: 0.099 s - in io.appulse.encon.GeneratorReferenceTest
[INFO] Running io.appulse.encon.NodesTest

RUNNING TEST: io.appulse.encon.NodesTest.instantiating

2018-06-28 01:03:03.095 DEBUG   --- [           main] io.appulse.epmd.java.client.EpmdClient   : Default EPMD port is: '4369'
2018-06-28 01:03:03.133 DEBUG   --- [           main] io.appulse.encon.Nodes                   : Creating ERTS instance with config Config(defaults=Defaults(epmdPort=4369, type=R6_ERLANG, shortNamed=false, cookie=kojima-secret, protocol=TCP, low=R6, high=R6, distributionFlags=[EXTENDED_REFERENCES, EXTENDED_PIDS_PORTS, BIT_BINARIES, FUN_TAGS, MAP_TAG, NEW_FUN_TAGS, UTF8_ATOMS, BIG_CREATION, NEW_FLOATS], mailbox=MailboxConfig(name=null, blocking=true), server=ServerConfig(port=null, bossThreads=1, workerThreads=1), compression=CompressionConfig(enabled=false, level=-1)), nodes={kojima2=NodeConfig(epmdPort=4369, type=R6_ERLANG, shortNamed=false, cookie=kojima-secret, protocol=TCP, low=R6, high=R6, distributionFlags=[EXTENDED_REFERENCES, EXTENDED_PIDS_PORTS, BIT_BINARIES, FUN_TAGS, MAP_TAG, NEW_FUN_TAGS, UTF8_ATOMS, BIG_CREATION, NEW_FLOATS], mailboxes=[], server=null, compression=CompressionConfig(enabled=false, level=-1)), kojima1=NodeConfig(epmdPort=4369, type=R6_ERLANG, shortNamed=false, cookie=kojima-secret, protocol=TCP, low=R6, high=R6, distributionFlags=[EXTENDED_REFERENCES, EXTENDED_PIDS_PORTS, BIT_BINARIES, FUN_TAGS, MAP_TAG, NEW_FUN_TAGS, UTF8_ATOMS, BIG_CREATION, NEW_FLOATS], mailboxes=[], server=null, compression=CompressionConfig(enabled=false, level=-1)), ocelot=NodeConfig(epmdPort=4369, type=R6_ERLANG, shortNamed=false, cookie=kojima-secret, protocol=TCP, low=R6, high=R6, distributionFlags=[EXTENDED_REFERENCES, EXTENDED_PIDS_PORTS, BIT_BINARIES, FUN_TAGS, MAP_TAG, NEW_FUN_TAGS, UTF8_ATOMS, BIG_CREATION, NEW_FLOATS], mailboxes=[MailboxConfig(name=revolver, blocking=true)], server=null, compression=CompressionConfig(enabled=false, level=-1))})
2018-06-28 01:03:03.136 DEBUG   --- [           main] io.appulse.encon.Node                    : Creating new Node 'kojima2@.lille.inria.fr' with config:
  NodeConfig(epmdPort=4369, type=R6_ERLANG, shortNamed=false, cookie=kojima-secret, protocol=TCP, low=R6, high=R6, distributionFlags=[EXTENDED_REFERENCES, EXTENDED_PIDS_PORTS, BIT_BINARIES, FUN_TAGS, MAP_TAG, NEW_FUN_TAGS, UTF8_ATOMS, BIG_CREATION, NEW_FLOATS], mailboxes=[], server=ServerConfig(port=65531, bossThreads=1, workerThreads=1), compression=CompressionConfig(enabled=false, level=-1))

2018-06-28 01:03:03.138 DEBUG   --- [           main] io.appulse.epmd.java.client.EpmdClient   : Instantiated EPMD client to 'spirals-vortex.lille.inria.fr/172.17.0.4:4369'
2018-06-28 01:03:03.139 DEBUG   --- [           main] io.appulse.epmd.java.client.EpmdClient   : Registering: 'kojima2'
2018-06-28 01:03:03.144 DEBUG   --- [           main] io.appulse.epmd.java.client.Connection   : Sending: Registration(port=65531, type=R6_ERLANG, protocol=TCP, high=R6, low=R6, name=kojima2)
2018-06-28 01:03:03.154 ERROR   --- [           main] io.appulse.epmd.java.client.Connection   : Couldn't connect to EPMD server (spirals-vortex.lille.inria.fr/172.17.0.4:4369), maybe it is down
2018-06-28 01:03:03.154 DEBUG   --- [           main] io.appulse.epmd.java.client.Connection   : EPMD connection (from localhost:-1, to null) was closed
2018-06-28 01:03:03.154 ERROR   --- [           main] io.appulse.epmd.java.client.EpmdClient   : 'kojima2' wasn't registered successfully
[ERROR] Tests run: 1, Failures: 0, Errors: 1, Skipped: 0, Time elapsed: 0.241 s <<< FAILURE! - in io.appulse.encon.NodesTest
[ERROR] instantiating(io.appulse.encon.NodesTest)  Time elapsed: 0.241 s  <<< ERROR!
io.appulse.epmd.java.client.exception.EpmdRegistrationException: io.appulse.epmd.java.client.exception.EpmdConnectionException: Couldn't connect to EPMD server (spirals-vortex.lille.inria.fr/172.17.0.4:4369), maybe it is down
	at io.appulse.epmd.java.client.EpmdClient.register(EpmdClient.java:168)
	at io.appulse.encon.Node.newInstance(Node.java:78)
	at io.appulse.encon.Nodes.newNode(Nodes.java:166)
	at io.appulse.encon.Nodes.lambda$start$0(Nodes.java:75)
	at java.util.HashMap$EntrySet.forEach(HashMap.java:1043)
	at io.appulse.encon.Nodes.start(Nodes.java:75)
	at io.appulse.encon.NodesTest.instantiating(NodesTest.java:62)
	at sun.reflect.NativeMethodAccessorImpl.invoke0(Native Method)
	at sun.reflect.NativeMethodAccessorImpl.invoke(NativeMethodAccessorImpl.java:62)
	at sun.reflect.DelegatingMethodAccessorImpl.invoke(DelegatingMethodAccessorImpl.java:43)
	at java.lang.reflect.Method.invoke(Method.java:498)
	at org.junit.runners.model.FrameworkMethod$1.runReflectiveCall(FrameworkMethod.java:50)
	at org.junit.internal.runners.model.ReflectiveCallable.run(ReflectiveCallable.java:12)
	at org.junit.runners.model.FrameworkMethod.invokeExplosively(FrameworkMethod.java:47)
	at org.junit.internal.runners.statements.InvokeMethod.evaluate(InvokeMethod.java:17)
	at org.junit.rules.TestWatcher$1.evaluate(TestWatcher.java:55)
	at org.junit.rules.RunRules.evaluate(RunRules.java:20)
	at org.junit.runners.ParentRunner.runLeaf(ParentRunner.java:325)
	at org.junit.runners.BlockJUnit4ClassRunner.runChild(BlockJUnit4ClassRunner.java:78)
	at org.junit.runners.BlockJUnit4ClassRunner.runChild(BlockJUnit4ClassRunner.java:57)
	at org.junit.runners.ParentRunner$3.run(ParentRunner.java:290)
	at org.junit.runners.ParentRunner$1.schedule(ParentRunner.java:71)
	at org.junit.runners.ParentRunner.runChildren(ParentRunner.java:288)
	at org.junit.runners.ParentRunner.access$000(ParentRunner.java:58)
	at org.junit.runners.ParentRunner$2.evaluate(ParentRunner.java:268)
	at org.junit.runners.ParentRunner.run(ParentRunner.java:363)
	at org.apache.maven.surefire.junit4.JUnit4Provider.execute(JUnit4Provider.java:365)
	at org.apache.maven.surefire.junit4.JUnit4Provider.executeWithRerun(JUnit4Provider.java:273)
	at org.apache.maven.surefire.junit4.JUnit4Provider.executeTestSet(JUnit4Provider.java:238)
	at org.apache.maven.surefire.junit4.JUnit4Provider.invoke(JUnit4Provider.java:159)
	at org.apache.maven.surefire.booter.ForkedBooter.invokeProviderInSameClassLoader(ForkedBooter.java:379)
	at org.apache.maven.surefire.booter.ForkedBooter.runSuitesInProcess(ForkedBooter.java:340)
	at org.apache.maven.surefire.booter.ForkedBooter.execute(ForkedBooter.java:125)
	at org.apache.maven.surefire.booter.ForkedBooter.main(ForkedBooter.java:413)
Caused by: io.appulse.epmd.java.client.exception.EpmdConnectionException: Couldn't connect to EPMD server (spirals-vortex.lille.inria.fr/172.17.0.4:4369), maybe it is down
	at io.appulse.epmd.java.client.Connection.connect(Connection.java:147)
	at io.appulse.epmd.java.client.Connection.send(Connection.java:79)
	at io.appulse.epmd.java.client.Connection.send(Connection.java:92)
	at io.appulse.epmd.java.client.EpmdClient.register(EpmdClient.java:164)
	... 33 more
Caused by: java.net.ConnectException: Connection refused (Connection refused)
	at java.net.PlainSocketImpl.socketConnect(Native Method)
	at java.net.AbstractPlainSocketImpl.doConnect(AbstractPlainSocketImpl.java:350)
	at java.net.AbstractPlainSocketImpl.connectToAddress(AbstractPlainSocketImpl.java:206)
	at java.net.AbstractPlainSocketImpl.connect(AbstractPlainSocketImpl.java:188)
	at java.net.SocksSocketImpl.connect(SocksSocketImpl.java:392)
	at java.net.Socket.connect(Socket.java:589)
	at io.appulse.epmd.java.client.Connection.connect(Connection.java:141)
	... 36 more

[INFO] Running io.appulse.encon.NodeTest

RUNNING TEST: io.appulse.encon.NodeTest.register

2018-06-28 01:03:03.164 DEBUG   --- [           main] io.appulse.encon.Node                    : Creating new Node 'node_922@localhost' with config:
  NodeConfig(epmdPort=4369, type=R6_ERLANG, shortNamed=true, cookie=, protocol=TCP, low=R6, high=R6, distributionFlags=[EXTENDED_REFERENCES, EXTENDED_PIDS_PORTS, BIT_BINARIES, FUN_TAGS, MAP_TAG, NEW_FUN_TAGS, UTF8_ATOMS, BIG_CREATION, NEW_FLOATS], mailboxes=[], server=ServerConfig(port=65530, bossThreads=1, workerThreads=2), compression=CompressionConfig(enabled=false, level=-1))

2018-06-28 01:03:03.164 DEBUG   --- [           main] io.appulse.epmd.java.client.EpmdClient   : Instantiated EPMD client to 'spirals-vortex.lille.inria.fr/172.17.0.4:4369'
2018-06-28 01:03:03.164 DEBUG   --- [           main] io.appulse.epmd.java.client.EpmdClient   : Registering: 'node_922'
2018-06-28 01:03:03.164 DEBUG   --- [           main] io.appulse.epmd.java.client.Connection   : Sending: Registration(port=65530, type=R6_ERLANG, protocol=TCP, high=R6, low=R6, name=node_922)
2018-06-28 01:03:03.165 ERROR   --- [           main] io.appulse.epmd.java.client.Connection   : Couldn't connect to EPMD server (spirals-vortex.lille.inria.fr/172.17.0.4:4369), maybe it is down
2018-06-28 01:03:03.165 DEBUG   --- [           main] io.appulse.epmd.java.client.Connection   : EPMD connection (from localhost:-1, to null) was closed
2018-06-28 01:03:03.165 ERROR   --- [           main] io.appulse.epmd.java.client.EpmdClient   : 'node_922' wasn't registered successfully

RUNNING TEST: io.appulse.encon.NodeTest.sendFromOneToAnotherNode

2018-06-28 01:03:03.469 DEBUG   --- [           main] io.appulse.encon.Node                    : Creating new Node 'node_904@localhost' with config:
  NodeConfig(epmdPort=4369, type=R6_ERLANG, shortNamed=true, cookie=, protocol=TCP, low=R6, high=R6, distributionFlags=[EXTENDED_REFERENCES, EXTENDED_PIDS_PORTS, BIT_BINARIES, FUN_TAGS, MAP_TAG, NEW_FUN_TAGS, UTF8_ATOMS, BIG_CREATION, NEW_FLOATS], mailboxes=[], server=ServerConfig(port=65529, bossThreads=1, workerThreads=2), compression=CompressionConfig(enabled=false, level=-1))

2018-06-28 01:03:03.470 DEBUG   --- [           main] io.appulse.epmd.java.client.EpmdClient   : Instantiated EPMD client to 'spirals-vortex.lille.inria.fr/172.17.0.4:4369'
2018-06-28 01:03:03.471 DEBUG   --- [           main] io.appulse.epmd.java.client.EpmdClient   : Registering: 'node_904'
2018-06-28 01:03:03.471 DEBUG   --- [           main] io.appulse.epmd.java.client.Connection   : Sending: Registration(port=65529, type=R6_ERLANG, protocol=TCP, high=R6, low=R6, name=node_904)
2018-06-28 01:03:03.472 ERROR   --- [           main] io.appulse.epmd.java.client.Connection   : Couldn't connect to EPMD server (spirals-vortex.lille.inria.fr/172.17.0.4:4369), maybe it is down
2018-06-28 01:03:03.473 DEBUG   --- [           main] io.appulse.epmd.java.client.Connection   : EPMD connection (from localhost:-1, to null) was closed
2018-06-28 01:03:03.473 ERROR   --- [           main] io.appulse.epmd.java.client.EpmdClient   : 'node_904' wasn't registered successfully

RUNNING TEST: io.appulse.encon.NodeTest.exit

2018-06-28 01:03:03.777 DEBUG   --- [           main] io.appulse.encon.Node                    : Creating new Node 'node_344@localhost' with config:
  NodeConfig(epmdPort=4369, type=R6_ERLANG, shortNamed=true, cookie=, protocol=TCP, low=R6, high=R6, distributionFlags=[EXTENDED_REFERENCES, EXTENDED_PIDS_PORTS, BIT_BINARIES, FUN_TAGS, MAP_TAG, NEW_FUN_TAGS, UTF8_ATOMS, BIG_CREATION, NEW_FLOATS], mailboxes=[], server=ServerConfig(port=65528, bossThreads=1, workerThreads=2), compression=CompressionConfig(enabled=false, level=-1))

2018-06-28 01:03:03.778 DEBUG   --- [           main] io.appulse.epmd.java.client.EpmdClient   : Instantiated EPMD client to 'spirals-vortex.lille.inria.fr/172.17.0.4:4369'
2018-06-28 01:03:03.778 DEBUG   --- [           main] io.appulse.epmd.java.client.EpmdClient   : Registering: 'node_344'
2018-06-28 01:03:03.778 DEBUG   --- [           main] io.appulse.epmd.java.client.Connection   : Sending: Registration(port=65528, type=R6_ERLANG, protocol=TCP, high=R6, low=R6, name=node_344)
2018-06-28 01:03:03.779 ERROR   --- [           main] io.appulse.epmd.java.client.Connection   : Couldn't connect to EPMD server (spirals-vortex.lille.inria.fr/172.17.0.4:4369), maybe it is down
2018-06-28 01:03:03.780 DEBUG   --- [           main] io.appulse.epmd.java.client.Connection   : EPMD connection (from localhost:-1, to null) was closed
2018-06-28 01:03:03.780 ERROR   --- [           main] io.appulse.epmd.java.client.EpmdClient   : 'node_344' wasn't registered successfully

RUNNING TEST: io.appulse.encon.NodeTest.link

2018-06-28 01:03:04.084 DEBUG   --- [           main] io.appulse.encon.Node                    : Creating new Node 'node_57@localhost' with config:
  NodeConfig(epmdPort=4369, type=R6_ERLANG, shortNamed=true, cookie=, protocol=TCP, low=R6, high=R6, distributionFlags=[EXTENDED_REFERENCES, EXTENDED_PIDS_PORTS, BIT_BINARIES, FUN_TAGS, MAP_TAG, NEW_FUN_TAGS, UTF8_ATOMS, BIG_CREATION, NEW_FLOATS], mailboxes=[], server=ServerConfig(port=65527, bossThreads=1, workerThreads=2), compression=CompressionConfig(enabled=false, level=-1))

2018-06-28 01:03:04.085 DEBUG   --- [           main] io.appulse.epmd.java.client.EpmdClient   : Instantiated EPMD client to 'spirals-vortex.lille.inria.fr/172.17.0.4:4369'
2018-06-28 01:03:04.086 DEBUG   --- [           main] io.appulse.epmd.java.client.EpmdClient   : Registering: 'node_57'
2018-06-28 01:03:04.086 DEBUG   --- [           main] io.appulse.epmd.java.client.Connection   : Sending: Registration(port=65527, type=R6_ERLANG, protocol=TCP, high=R6, low=R6, name=node_57)
2018-06-28 01:03:04.087 ERROR   --- [           main] io.appulse.epmd.java.client.Connection   : Couldn't connect to EPMD server (spirals-vortex.lille.inria.fr/172.17.0.4:4369), maybe it is down
2018-06-28 01:03:04.088 DEBUG   --- [           main] io.appulse.epmd.java.client.Connection   : EPMD connection (from localhost:-1, to null) was closed
2018-06-28 01:03:04.088 ERROR   --- [           main] io.appulse.epmd.java.client.EpmdClient   : 'node_57' wasn't registered successfully

RUNNING TEST: io.appulse.encon.NodeTest.ping

2018-06-28 01:03:04.392 DEBUG   --- [           main] io.appulse.encon.Node                    : Creating new Node 'node_382@localhost' with config:
  NodeConfig(epmdPort=4369, type=R6_ERLANG, shortNamed=true, cookie=secret, protocol=TCP, low=R6, high=R6, distributionFlags=[EXTENDED_REFERENCES, EXTENDED_PIDS_PORTS, BIT_BINARIES, FUN_TAGS, MAP_TAG, NEW_FUN_TAGS, UTF8_ATOMS, BIG_CREATION, NEW_FLOATS], mailboxes=[], server=ServerConfig(port=65526, bossThreads=1, workerThreads=2), compression=CompressionConfig(enabled=false, level=-1))

2018-06-28 01:03:04.392 DEBUG   --- [           main] io.appulse.epmd.java.client.EpmdClient   : Instantiated EPMD client to 'spirals-vortex.lille.inria.fr/172.17.0.4:4369'
2018-06-28 01:03:04.393 DEBUG   --- [           main] io.appulse.epmd.java.client.EpmdClient   : Registering: 'node_382'
2018-06-28 01:03:04.393 DEBUG   --- [           main] io.appulse.epmd.java.client.Connection   : Sending: Registration(port=65526, type=R6_ERLANG, protocol=TCP, high=R6, low=R6, name=node_382)
2018-06-28 01:03:04.394 ERROR   --- [           main] io.appulse.epmd.java.client.Connection   : Couldn't connect to EPMD server (spirals-vortex.lille.inria.fr/172.17.0.4:4369), maybe it is down
2018-06-28 01:03:04.394 DEBUG   --- [           main] io.appulse.epmd.java.client.Connection   : EPMD connection (from localhost:-1, to null) was closed
2018-06-28 01:03:04.395 ERROR   --- [           main] io.appulse.epmd.java.client.EpmdClient   : 'node_382' wasn't registered successfully

RUNNING TEST: io.appulse.encon.NodeTest.send

2018-06-28 01:03:04.699 DEBUG   --- [           main] io.appulse.encon.Node                    : Creating new Node 'node_851@localhost' with config:
  NodeConfig(epmdPort=4369, type=R6_ERLANG, shortNamed=true, cookie=secret, protocol=TCP, low=R6, high=R6, distributionFlags=[EXTENDED_REFERENCES, EXTENDED_PIDS_PORTS, BIT_BINARIES, FUN_TAGS, MAP_TAG, NEW_FUN_TAGS, UTF8_ATOMS, BIG_CREATION, NEW_FLOATS], mailboxes=[], server=ServerConfig(port=65525, bossThreads=1, workerThreads=2), compression=CompressionConfig(enabled=false, level=-1))

2018-06-28 01:03:04.699 DEBUG   --- [           main] io.appulse.epmd.java.client.EpmdClient   : Instantiated EPMD client to 'spirals-vortex.lille.inria.fr/172.17.0.4:4369'
2018-06-28 01:03:04.699 DEBUG   --- [           main] io.appulse.epmd.java.client.EpmdClient   : Registering: 'node_851'
2018-06-28 01:03:04.700 DEBUG   --- [           main] io.appulse.epmd.java.client.Connection   : Sending: Registration(port=65525, type=R6_ERLANG, protocol=TCP, high=R6, low=R6, name=node_851)
2018-06-28 01:03:04.701 ERROR   --- [           main] io.appulse.epmd.java.client.Connection   : Couldn't connect to EPMD server (spirals-vortex.lille.inria.fr/172.17.0.4:4369), maybe it is down
2018-06-28 01:03:04.702 DEBUG   --- [           main] io.appulse.epmd.java.client.Connection   : EPMD connection (from localhost:-1, to null) was closed
2018-06-28 01:03:04.702 ERROR   --- [           main] io.appulse.epmd.java.client.EpmdClient   : 'node_851' wasn't registered successfully

RUNNING TEST: io.appulse.encon.NodeTest.instantiating

2018-06-28 01:03:05.005 DEBUG   --- [           main] io.appulse.encon.Node                    : Creating new Node 'node_789@localhost' with config:
  NodeConfig(epmdPort=4369, type=R6_ERLANG, shortNamed=true, cookie=, protocol=TCP, low=R6, high=R6, distributionFlags=[EXTENDED_REFERENCES, EXTENDED_PIDS_PORTS, BIT_BINARIES, FUN_TAGS, MAP_TAG, NEW_FUN_TAGS, UTF8_ATOMS, BIG_CREATION, NEW_FLOATS], mailboxes=[MailboxConfig(name=one, blocking=true), MailboxConfig(name=two, blocking=true)], server=ServerConfig(port=65524, bossThreads=1, workerThreads=2), compression=CompressionConfig(enabled=false, level=-1))

2018-06-28 01:03:05.006 DEBUG   --- [           main] io.appulse.epmd.java.client.EpmdClient   : Instantiated EPMD client to 'spirals-vortex.lille.inria.fr/172.17.0.4:4369'
2018-06-28 01:03:05.006 DEBUG   --- [           main] io.appulse.epmd.java.client.EpmdClient   : Registering: 'node_789'
2018-06-28 01:03:05.007 DEBUG   --- [           main] io.appulse.epmd.java.client.Connection   : Sending: Registration(port=65524, type=R6_ERLANG, protocol=TCP, high=R6, low=R6, name=node_789)
2018-06-28 01:03:05.008 ERROR   --- [           main] io.appulse.epmd.java.client.Connection   : Couldn't connect to EPMD server (spirals-vortex.lille.inria.fr/172.17.0.4:4369), maybe it is down
2018-06-28 01:03:05.008 DEBUG   --- [           main] io.appulse.epmd.java.client.Connection   : EPMD connection (from localhost:-1, to null) was closed
2018-06-28 01:03:05.008 ERROR   --- [           main] io.appulse.epmd.java.client.EpmdClient   : 'node_789' wasn't registered successfully

RUNNING TEST: io.appulse.encon.NodeTest.sendWithRedirect

2018-06-28 01:03:05.311 DEBUG   --- [           main] io.appulse.encon.Node                    : Creating new Node 'node_168@localhost' with config:
  NodeConfig(epmdPort=4369, type=R6_ERLANG, shortNamed=true, cookie=secret, protocol=TCP, low=R6, high=R6, distributionFlags=[EXTENDED_REFERENCES, EXTENDED_PIDS_PORTS, BIT_BINARIES, FUN_TAGS, MAP_TAG, NEW_FUN_TAGS, UTF8_ATOMS, BIG_CREATION, NEW_FLOATS], mailboxes=[], server=ServerConfig(port=65523, bossThreads=1, workerThreads=2), compression=CompressionConfig(enabled=false, level=-1))

2018-06-28 01:03:05.312 DEBUG   --- [           main] io.appulse.epmd.java.client.EpmdClient   : Instantiated EPMD client to 'spirals-vortex.lille.inria.fr/172.17.0.4:4369'
2018-06-28 01:03:05.312 DEBUG   --- [           main] io.appulse.epmd.java.client.EpmdClient   : Registering: 'node_168'
2018-06-28 01:03:05.313 DEBUG   --- [           main] io.appulse.epmd.java.client.Connection   : Sending: Registration(port=65523, type=R6_ERLANG, protocol=TCP, high=R6, low=R6, name=node_168)
2018-06-28 01:03:05.314 ERROR   --- [           main] io.appulse.epmd.java.client.Connection   : Couldn't connect to EPMD server (spirals-vortex.lille.inria.fr/172.17.0.4:4369), maybe it is down
2018-06-28 01:03:05.314 DEBUG   --- [           main] io.appulse.epmd.java.client.Connection   : EPMD connection (from localhost:-1, to null) was closed
2018-06-28 01:03:05.314 ERROR   --- [           main] io.appulse.epmd.java.client.EpmdClient   : 'node_168' wasn't registered successfully
[ERROR] Tests run: 8, Failures: 0, Errors: 8, Skipped: 0, Time elapsed: 2.448 s <<< FAILURE! - in io.appulse.encon.NodeTest
[ERROR] register(io.appulse.encon.NodeTest)  Time elapsed: 0.299 s  <<< ERROR!
io.appulse.epmd.java.client.exception.EpmdRegistrationException: io.appulse.epmd.java.client.exception.EpmdConnectionException: Couldn't connect to EPMD server (spirals-vortex.lille.inria.fr/172.17.0.4:4369), maybe it is down
	at io.appulse.epmd.java.client.EpmdClient.register(EpmdClient.java:168)
	at io.appulse.encon.Node.newInstance(Node.java:78)
	at io.appulse.encon.Nodes.singleNode(Nodes.java:118)
	at io.appulse.encon.Nodes.singleNode(Nodes.java:101)
	at io.appulse.encon.NodeTest.register(NodeTest.java:77)
	at sun.reflect.NativeMethodAccessorImpl.invoke0(Native Method)
	at sun.reflect.NativeMethodAccessorImpl.invoke(NativeMethodAccessorImpl.java:62)
	at sun.reflect.DelegatingMethodAccessorImpl.invoke(DelegatingMethodAccessorImpl.java:43)
	at java.lang.reflect.Method.invoke(Method.java:498)
	at org.junit.runners.model.FrameworkMethod$1.runReflectiveCall(FrameworkMethod.java:50)
	at org.junit.internal.runners.model.ReflectiveCallable.run(ReflectiveCallable.java:12)
	at org.junit.runners.model.FrameworkMethod.invokeExplosively(FrameworkMethod.java:47)
	at org.junit.internal.runners.statements.InvokeMethod.evaluate(InvokeMethod.java:17)
	at org.junit.internal.runners.statements.RunAfters.evaluate(RunAfters.java:27)
	at org.junit.rules.TestWatcher$1.evaluate(TestWatcher.java:55)
	at org.junit.rules.RunRules.evaluate(RunRules.java:20)
	at org.junit.runners.ParentRunner.runLeaf(ParentRunner.java:325)
	at org.junit.runners.BlockJUnit4ClassRunner.runChild(BlockJUnit4ClassRunner.java:78)
	at org.junit.runners.BlockJUnit4ClassRunner.runChild(BlockJUnit4ClassRunner.java:57)
	at org.junit.runners.ParentRunner$3.run(ParentRunner.java:290)
	at org.junit.runners.ParentRunner$1.schedule(ParentRunner.java:71)
	at org.junit.runners.ParentRunner.runChildren(ParentRunner.java:288)
	at org.junit.runners.ParentRunner.access$000(ParentRunner.java:58)
	at org.junit.runners.ParentRunner$2.evaluate(ParentRunner.java:268)
	at org.junit.runners.ParentRunner.run(ParentRunner.java:363)
	at org.apache.maven.surefire.junit4.JUnit4Provider.execute(JUnit4Provider.java:365)
	at org.apache.maven.surefire.junit4.JUnit4Provider.executeWithRerun(JUnit4Provider.java:273)
	at org.apache.maven.surefire.junit4.JUnit4Provider.executeTestSet(JUnit4Provider.java:238)
	at org.apache.maven.surefire.junit4.JUnit4Provider.invoke(JUnit4Provider.java:159)
	at org.apache.maven.surefire.booter.ForkedBooter.invokeProviderInSameClassLoader(ForkedBooter.java:379)
	at org.apache.maven.surefire.booter.ForkedBooter.runSuitesInProcess(ForkedBooter.java:340)
	at org.apache.maven.surefire.booter.ForkedBooter.execute(ForkedBooter.java:125)
	at org.apache.maven.surefire.booter.ForkedBooter.main(ForkedBooter.java:413)
Caused by: io.appulse.epmd.java.client.exception.EpmdConnectionException: Couldn't connect to EPMD server (spirals-vortex.lille.inria.fr/172.17.0.4:4369), maybe it is down
	at io.appulse.epmd.java.client.Connection.connect(Connection.java:147)
	at io.appulse.epmd.java.client.Connection.send(Connection.java:79)
	at io.appulse.epmd.java.client.Connection.send(Connection.java:92)
	at io.appulse.epmd.java.client.EpmdClient.register(EpmdClient.java:164)
	... 32 more
Caused by: java.net.ConnectException: Connection refused (Connection refused)
	at java.net.PlainSocketImpl.socketConnect(Native Method)
	at java.net.AbstractPlainSocketImpl.doConnect(AbstractPlainSocketImpl.java:350)
	at java.net.AbstractPlainSocketImpl.connectToAddress(AbstractPlainSocketImpl.java:206)
	at java.net.AbstractPlainSocketImpl.connect(AbstractPlainSocketImpl.java:188)
	at java.net.SocksSocketImpl.connect(SocksSocketImpl.java:392)
	at java.net.Socket.connect(Socket.java:589)
	at io.appulse.epmd.java.client.Connection.connect(Connection.java:141)
	... 35 more

[ERROR] sendFromOneToAnotherNode(io.appulse.encon.NodeTest)  Time elapsed: 0.308 s  <<< ERROR!
io.appulse.epmd.java.client.exception.EpmdRegistrationException: io.appulse.epmd.java.client.exception.EpmdConnectionException: Couldn't connect to EPMD server (spirals-vortex.lille.inria.fr/172.17.0.4:4369), maybe it is down
	at io.appulse.epmd.java.client.EpmdClient.register(EpmdClient.java:168)
	at io.appulse.encon.Node.newInstance(Node.java:78)
	at io.appulse.encon.Nodes.singleNode(Nodes.java:118)
	at io.appulse.encon.Nodes.singleNode(Nodes.java:101)
	at io.appulse.encon.NodeTest.sendFromOneToAnotherNode(NodeTest.java:165)
	at sun.reflect.NativeMethodAccessorImpl.invoke0(Native Method)
	at sun.reflect.NativeMethodAccessorImpl.invoke(NativeMethodAccessorImpl.java:62)
	at sun.reflect.DelegatingMethodAccessorImpl.invoke(DelegatingMethodAccessorImpl.java:43)
	at java.lang.reflect.Method.invoke(Method.java:498)
	at org.junit.runners.model.FrameworkMethod$1.runReflectiveCall(FrameworkMethod.java:50)
	at org.junit.internal.runners.model.ReflectiveCallable.run(ReflectiveCallable.java:12)
	at org.junit.runners.model.FrameworkMethod.invokeExplosively(FrameworkMethod.java:47)
	at org.junit.internal.runners.statements.InvokeMethod.evaluate(InvokeMethod.java:17)
	at org.junit.internal.runners.statements.RunAfters.evaluate(RunAfters.java:27)
	at org.junit.rules.TestWatcher$1.evaluate(TestWatcher.java:55)
	at org.junit.rules.RunRules.evaluate(RunRules.java:20)
	at org.junit.runners.ParentRunner.runLeaf(ParentRunner.java:325)
	at org.junit.runners.BlockJUnit4ClassRunner.runChild(BlockJUnit4ClassRunner.java:78)
	at org.junit.runners.BlockJUnit4ClassRunner.runChild(BlockJUnit4ClassRunner.java:57)
	at org.junit.runners.ParentRunner$3.run(ParentRunner.java:290)
	at org.junit.runners.ParentRunner$1.schedule(ParentRunner.java:71)
	at org.junit.runners.ParentRunner.runChildren(ParentRunner.java:288)
	at org.junit.runners.ParentRunner.access$000(ParentRunner.java:58)
	at org.junit.runners.ParentRunner$2.evaluate(ParentRunner.java:268)
	at org.junit.runners.ParentRunner.run(ParentRunner.java:363)
	at org.apache.maven.surefire.junit4.JUnit4Provider.execute(JUnit4Provider.java:365)
	at org.apache.maven.surefire.junit4.JUnit4Provider.executeWithRerun(JUnit4Provider.java:273)
	at org.apache.maven.surefire.junit4.JUnit4Provider.executeTestSet(JUnit4Provider.java:238)
	at org.apache.maven.surefire.junit4.JUnit4Provider.invoke(JUnit4Provider.java:159)
	at org.apache.maven.surefire.booter.ForkedBooter.invokeProviderInSameClassLoader(ForkedBooter.java:379)
	at org.apache.maven.surefire.booter.ForkedBooter.runSuitesInProcess(ForkedBooter.java:340)
	at org.apache.maven.surefire.booter.ForkedBooter.execute(ForkedBooter.java:125)
	at org.apache.maven.surefire.booter.ForkedBooter.main(ForkedBooter.java:413)
Caused by: io.appulse.epmd.java.client.exception.EpmdConnectionException: Couldn't connect to EPMD server (spirals-vortex.lille.inria.fr/172.17.0.4:4369), maybe it is down
	at io.appulse.epmd.java.client.Connection.connect(Connection.java:147)
	at io.appulse.epmd.java.client.Connection.send(Connection.java:79)
	at io.appulse.epmd.java.client.Connection.send(Connection.java:92)
	at io.appulse.epmd.java.client.EpmdClient.register(EpmdClient.java:164)
	... 32 more
Caused by: java.net.ConnectException: Connection refused (Connection refused)
	at java.net.PlainSocketImpl.socketConnect(Native Method)
	at java.net.AbstractPlainSocketImpl.doConnect(AbstractPlainSocketImpl.java:350)
	at java.net.AbstractPlainSocketImpl.connectToAddress(AbstractPlainSocketImpl.java:206)
	at java.net.AbstractPlainSocketImpl.connect(AbstractPlainSocketImpl.java:188)
	at java.net.SocksSocketImpl.connect(SocksSocketImpl.java:392)
	at java.net.Socket.connect(Socket.java:589)
	at io.appulse.epmd.java.client.Connection.connect(Connection.java:141)
	... 35 more

[ERROR] exit(io.appulse.encon.NodeTest)  Time elapsed: 0.307 s  <<< ERROR!
io.appulse.epmd.java.client.exception.EpmdRegistrationException: io.appulse.epmd.java.client.exception.EpmdConnectionException: Couldn't connect to EPMD server (spirals-vortex.lille.inria.fr/172.17.0.4:4369), maybe it is down
	at io.appulse.epmd.java.client.EpmdClient.register(EpmdClient.java:168)
	at io.appulse.encon.Node.newInstance(Node.java:78)
	at io.appulse.encon.Nodes.singleNode(Nodes.java:118)
	at io.appulse.encon.Nodes.singleNode(Nodes.java:101)
	at io.appulse.encon.NodeTest.exit(NodeTest.java:324)
	at sun.reflect.NativeMethodAccessorImpl.invoke0(Native Method)
	at sun.reflect.NativeMethodAccessorImpl.invoke(NativeMethodAccessorImpl.java:62)
	at sun.reflect.DelegatingMethodAccessorImpl.invoke(DelegatingMethodAccessorImpl.java:43)
	at java.lang.reflect.Method.invoke(Method.java:498)
	at org.junit.runners.model.FrameworkMethod$1.runReflectiveCall(FrameworkMethod.java:50)
	at org.junit.internal.runners.model.ReflectiveCallable.run(ReflectiveCallable.java:12)
	at org.junit.runners.model.FrameworkMethod.invokeExplosively(FrameworkMethod.java:47)
	at org.junit.internal.runners.statements.InvokeMethod.evaluate(InvokeMethod.java:17)
	at org.junit.internal.runners.statements.RunAfters.evaluate(RunAfters.java:27)
	at org.junit.rules.TestWatcher$1.evaluate(TestWatcher.java:55)
	at org.junit.rules.RunRules.evaluate(RunRules.java:20)
	at org.junit.runners.ParentRunner.runLeaf(ParentRunner.java:325)
	at org.junit.runners.BlockJUnit4ClassRunner.runChild(BlockJUnit4ClassRunner.java:78)
	at org.junit.runners.BlockJUnit4ClassRunner.runChild(BlockJUnit4ClassRunner.java:57)
	at org.junit.runners.ParentRunner$3.run(ParentRunner.java:290)
	at org.junit.runners.ParentRunner$1.schedule(ParentRunner.java:71)
	at org.junit.runners.ParentRunner.runChildren(ParentRunner.java:288)
	at org.junit.runners.ParentRunner.access$000(ParentRunner.java:58)
	at org.junit.runners.ParentRunner$2.evaluate(ParentRunner.java:268)
	at org.junit.runners.ParentRunner.run(ParentRunner.java:363)
	at org.apache.maven.surefire.junit4.JUnit4Provider.execute(JUnit4Provider.java:365)
	at org.apache.maven.surefire.junit4.JUnit4Provider.executeWithRerun(JUnit4Provider.java:273)
	at org.apache.maven.surefire.junit4.JUnit4Provider.executeTestSet(JUnit4Provider.java:238)
	at org.apache.maven.surefire.junit4.JUnit4Provider.invoke(JUnit4Provider.java:159)
	at org.apache.maven.surefire.booter.ForkedBooter.invokeProviderInSameClassLoader(ForkedBooter.java:379)
	at org.apache.maven.surefire.booter.ForkedBooter.runSuitesInProcess(ForkedBooter.java:340)
	at org.apache.maven.surefire.booter.ForkedBooter.execute(ForkedBooter.java:125)
	at org.apache.maven.surefire.booter.ForkedBooter.main(ForkedBooter.java:413)
Caused by: io.appulse.epmd.java.client.exception.EpmdConnectionException: Couldn't connect to EPMD server (spirals-vortex.lille.inria.fr/172.17.0.4:4369), maybe it is down
	at io.appulse.epmd.java.client.Connection.connect(Connection.java:147)
	at io.appulse.epmd.java.client.Connection.send(Connection.java:79)
	at io.appulse.epmd.java.client.Connection.send(Connection.java:92)
	at io.appulse.epmd.java.client.EpmdClient.register(EpmdClient.java:164)
	... 32 more
Caused by: java.net.ConnectException: Connection refused (Connection refused)
	at java.net.PlainSocketImpl.socketConnect(Native Method)
	at java.net.AbstractPlainSocketImpl.doConnect(AbstractPlainSocketImpl.java:350)
	at java.net.AbstractPlainSocketImpl.connectToAddress(AbstractPlainSocketImpl.java:206)
	at java.net.AbstractPlainSocketImpl.connect(AbstractPlainSocketImpl.java:188)
	at java.net.SocksSocketImpl.connect(SocksSocketImpl.java:392)
	at java.net.Socket.connect(Socket.java:589)
	at io.appulse.epmd.java.client.Connection.connect(Connection.java:141)
	... 35 more

[ERROR] link(io.appulse.encon.NodeTest)  Time elapsed: 0.307 s  <<< ERROR!
io.appulse.epmd.java.client.exception.EpmdRegistrationException: io.appulse.epmd.java.client.exception.EpmdConnectionException: Couldn't connect to EPMD server (spirals-vortex.lille.inria.fr/172.17.0.4:4369), maybe it is down
	at io.appulse.epmd.java.client.EpmdClient.register(EpmdClient.java:168)
	at io.appulse.encon.Node.newInstance(Node.java:78)
	at io.appulse.encon.Nodes.singleNode(Nodes.java:118)
	at io.appulse.encon.Nodes.singleNode(Nodes.java:101)
	at io.appulse.encon.NodeTest.link(NodeTest.java:296)
	at sun.reflect.NativeMethodAccessorImpl.invoke0(Native Method)
	at sun.reflect.NativeMethodAccessorImpl.invoke(NativeMethodAccessorImpl.java:62)
	at sun.reflect.DelegatingMethodAccessorImpl.invoke(DelegatingMethodAccessorImpl.java:43)
	at java.lang.reflect.Method.invoke(Method.java:498)
	at org.junit.runners.model.FrameworkMethod$1.runReflectiveCall(FrameworkMethod.java:50)
	at org.junit.internal.runners.model.ReflectiveCallable.run(ReflectiveCallable.java:12)
	at org.junit.runners.model.FrameworkMethod.invokeExplosively(FrameworkMethod.java:47)
	at org.junit.internal.runners.statements.InvokeMethod.evaluate(InvokeMethod.java:17)
	at org.junit.internal.runners.statements.RunAfters.evaluate(RunAfters.java:27)
	at org.junit.rules.TestWatcher$1.evaluate(TestWatcher.java:55)
	at org.junit.rules.RunRules.evaluate(RunRules.java:20)
	at org.junit.runners.ParentRunner.runLeaf(ParentRunner.java:325)
	at org.junit.runners.BlockJUnit4ClassRunner.runChild(BlockJUnit4ClassRunner.java:78)
	at org.junit.runners.BlockJUnit4ClassRunner.runChild(BlockJUnit4ClassRunner.java:57)
	at org.junit.runners.ParentRunner$3.run(ParentRunner.java:290)
	at org.junit.runners.ParentRunner$1.schedule(ParentRunner.java:71)
	at org.junit.runners.ParentRunner.runChildren(ParentRunner.java:288)
	at org.junit.runners.ParentRunner.access$000(ParentRunner.java:58)
	at org.junit.runners.ParentRunner$2.evaluate(ParentRunner.java:268)
	at org.junit.runners.ParentRunner.run(ParentRunner.java:363)
	at org.apache.maven.surefire.junit4.JUnit4Provider.execute(JUnit4Provider.java:365)
	at org.apache.maven.surefire.junit4.JUnit4Provider.executeWithRerun(JUnit4Provider.java:273)
	at org.apache.maven.surefire.junit4.JUnit4Provider.executeTestSet(JUnit4Provider.java:238)
	at org.apache.maven.surefire.junit4.JUnit4Provider.invoke(JUnit4Provider.java:159)
	at org.apache.maven.surefire.booter.ForkedBooter.invokeProviderInSameClassLoader(ForkedBooter.java:379)
	at org.apache.maven.surefire.booter.ForkedBooter.runSuitesInProcess(ForkedBooter.java:340)
	at org.apache.maven.surefire.booter.ForkedBooter.execute(ForkedBooter.java:125)
	at org.apache.maven.surefire.booter.ForkedBooter.main(ForkedBooter.java:413)
Caused by: io.appulse.epmd.java.client.exception.EpmdConnectionException: Couldn't connect to EPMD server (spirals-vortex.lille.inria.fr/172.17.0.4:4369), maybe it is down
	at io.appulse.epmd.java.client.Connection.connect(Connection.java:147)
	at io.appulse.epmd.java.client.Connection.send(Connection.java:79)
	at io.appulse.epmd.java.client.Connection.send(Connection.java:92)
	at io.appulse.epmd.java.client.EpmdClient.register(EpmdClient.java:164)
	... 32 more
Caused by: java.net.ConnectException: Connection refused (Connection refused)
	at java.net.PlainSocketImpl.socketConnect(Native Method)
	at java.net.AbstractPlainSocketImpl.doConnect(AbstractPlainSocketImpl.java:350)
	at java.net.AbstractPlainSocketImpl.connectToAddress(AbstractPlainSocketImpl.java:206)
	at java.net.AbstractPlainSocketImpl.connect(AbstractPlainSocketImpl.java:188)
	at java.net.SocksSocketImpl.connect(SocksSocketImpl.java:392)
	at java.net.Socket.connect(Socket.java:589)
	at io.appulse.epmd.java.client.Connection.connect(Connection.java:141)
	... 35 more

[ERROR] ping(io.appulse.encon.NodeTest)  Time elapsed: 0.307 s  <<< ERROR!
io.appulse.epmd.java.client.exception.EpmdRegistrationException: io.appulse.epmd.java.client.exception.EpmdConnectionException: Couldn't connect to EPMD server (spirals-vortex.lille.inria.fr/172.17.0.4:4369), maybe it is down
	at io.appulse.epmd.java.client.EpmdClient.register(EpmdClient.java:168)
	at io.appulse.encon.Node.newInstance(Node.java:78)
	at io.appulse.encon.Nodes.singleNode(Nodes.java:118)
	at io.appulse.encon.NodeTest.ping(NodeTest.java:107)
	at sun.reflect.NativeMethodAccessorImpl.invoke0(Native Method)
	at sun.reflect.NativeMethodAccessorImpl.invoke(NativeMethodAccessorImpl.java:62)
	at sun.reflect.DelegatingMethodAccessorImpl.invoke(DelegatingMethodAccessorImpl.java:43)
	at java.lang.reflect.Method.invoke(Method.java:498)
	at org.junit.runners.model.FrameworkMethod$1.runReflectiveCall(FrameworkMethod.java:50)
	at org.junit.internal.runners.model.ReflectiveCallable.run(ReflectiveCallable.java:12)
	at org.junit.runners.model.FrameworkMethod.invokeExplosively(FrameworkMethod.java:47)
	at org.junit.internal.runners.statements.InvokeMethod.evaluate(InvokeMethod.java:17)
	at org.junit.internal.runners.statements.RunAfters.evaluate(RunAfters.java:27)
	at org.junit.rules.TestWatcher$1.evaluate(TestWatcher.java:55)
	at org.junit.rules.RunRules.evaluate(RunRules.java:20)
	at org.junit.runners.ParentRunner.runLeaf(ParentRunner.java:325)
	at org.junit.runners.BlockJUnit4ClassRunner.runChild(BlockJUnit4ClassRunner.java:78)
	at org.junit.runners.BlockJUnit4ClassRunner.runChild(BlockJUnit4ClassRunner.java:57)
	at org.junit.runners.ParentRunner$3.run(ParentRunner.java:290)
	at org.junit.runners.ParentRunner$1.schedule(ParentRunner.java:71)
	at org.junit.runners.ParentRunner.runChildren(ParentRunner.java:288)
	at org.junit.runners.ParentRunner.access$000(ParentRunner.java:58)
	at org.junit.runners.ParentRunner$2.evaluate(ParentRunner.java:268)
	at org.junit.runners.ParentRunner.run(ParentRunner.java:363)
	at org.apache.maven.surefire.junit4.JUnit4Provider.execute(JUnit4Provider.java:365)
	at org.apache.maven.surefire.junit4.JUnit4Provider.executeWithRerun(JUnit4Provider.java:273)
	at org.apache.maven.surefire.junit4.JUnit4Provider.executeTestSet(JUnit4Provider.java:238)
	at org.apache.maven.surefire.junit4.JUnit4Provider.invoke(JUnit4Provider.java:159)
	at org.apache.maven.surefire.booter.ForkedBooter.invokeProviderInSameClassLoader(ForkedBooter.java:379)
	at org.apache.maven.surefire.booter.ForkedBooter.runSuitesInProcess(ForkedBooter.java:340)
	at org.apache.maven.surefire.booter.ForkedBooter.execute(ForkedBooter.java:125)
	at org.apache.maven.surefire.booter.ForkedBooter.main(ForkedBooter.java:413)
Caused by: io.appulse.epmd.java.client.exception.EpmdConnectionException: Couldn't connect to EPMD server (spirals-vortex.lille.inria.fr/172.17.0.4:4369), maybe it is down
	at io.appulse.epmd.java.client.Connection.connect(Connection.java:147)
	at io.appulse.epmd.java.client.Connection.send(Connection.java:79)
	at io.appulse.epmd.java.client.Connection.send(Connection.java:92)
	at io.appulse.epmd.java.client.EpmdClient.register(EpmdClient.java:164)
	... 31 more
Caused by: java.net.ConnectException: Connection refused (Connection refused)
	at java.net.PlainSocketImpl.socketConnect(Native Method)
	at java.net.AbstractPlainSocketImpl.doConnect(AbstractPlainSocketImpl.java:350)
	at java.net.AbstractPlainSocketImpl.connectToAddress(AbstractPlainSocketImpl.java:206)
	at java.net.AbstractPlainSocketImpl.connect(AbstractPlainSocketImpl.java:188)
	at java.net.SocksSocketImpl.connect(SocksSocketImpl.java:392)
	at java.net.Socket.connect(Socket.java:589)
	at io.appulse.epmd.java.client.Connection.connect(Connection.java:141)
	... 34 more

[ERROR] send(io.appulse.encon.NodeTest)  Time elapsed: 0.307 s  <<< ERROR!
io.appulse.epmd.java.client.exception.EpmdRegistrationException: io.appulse.epmd.java.client.exception.EpmdConnectionException: Couldn't connect to EPMD server (spirals-vortex.lille.inria.fr/172.17.0.4:4369), maybe it is down
	at io.appulse.epmd.java.client.EpmdClient.register(EpmdClient.java:168)
	at io.appulse.encon.Node.newInstance(Node.java:78)
	at io.appulse.encon.Nodes.singleNode(Nodes.java:118)
	at io.appulse.encon.NodeTest.send(NodeTest.java:254)
	at sun.reflect.NativeMethodAccessorImpl.invoke0(Native Method)
	at sun.reflect.NativeMethodAccessorImpl.invoke(NativeMethodAccessorImpl.java:62)
	at sun.reflect.DelegatingMethodAccessorImpl.invoke(DelegatingMethodAccessorImpl.java:43)
	at java.lang.reflect.Method.invoke(Method.java:498)
	at org.junit.runners.model.FrameworkMethod$1.runReflectiveCall(FrameworkMethod.java:50)
	at org.junit.internal.runners.model.ReflectiveCallable.run(ReflectiveCallable.java:12)
	at org.junit.runners.model.FrameworkMethod.invokeExplosively(FrameworkMethod.java:47)
	at org.junit.internal.runners.statements.InvokeMethod.evaluate(InvokeMethod.java:17)
	at org.junit.internal.runners.statements.RunAfters.evaluate(RunAfters.java:27)
	at org.junit.rules.TestWatcher$1.evaluate(TestWatcher.java:55)
	at org.junit.rules.RunRules.evaluate(RunRules.java:20)
	at org.junit.runners.ParentRunner.runLeaf(ParentRunner.java:325)
	at org.junit.runners.BlockJUnit4ClassRunner.runChild(BlockJUnit4ClassRunner.java:78)
	at org.junit.runners.BlockJUnit4ClassRunner.runChild(BlockJUnit4ClassRunner.java:57)
	at org.junit.runners.ParentRunner$3.run(ParentRunner.java:290)
	at org.junit.runners.ParentRunner$1.schedule(ParentRunner.java:71)
	at org.junit.runners.ParentRunner.runChildren(ParentRunner.java:288)
	at org.junit.runners.ParentRunner.access$000(ParentRunner.java:58)
	at org.junit.runners.ParentRunner$2.evaluate(ParentRunner.java:268)
	at org.junit.runners.ParentRunner.run(ParentRunner.java:363)
	at org.apache.maven.surefire.junit4.JUnit4Provider.execute(JUnit4Provider.java:365)
	at org.apache.maven.surefire.junit4.JUnit4Provider.executeWithRerun(JUnit4Provider.java:273)
	at org.apache.maven.surefire.junit4.JUnit4Provider.executeTestSet(JUnit4Provider.java:238)
	at org.apache.maven.surefire.junit4.JUnit4Provider.invoke(JUnit4Provider.java:159)
	at org.apache.maven.surefire.booter.ForkedBooter.invokeProviderInSameClassLoader(ForkedBooter.java:379)
	at org.apache.maven.surefire.booter.ForkedBooter.runSuitesInProcess(ForkedBooter.java:340)
	at org.apache.maven.surefire.booter.ForkedBooter.execute(ForkedBooter.java:125)
	at org.apache.maven.surefire.booter.ForkedBooter.main(ForkedBooter.java:413)
Caused by: io.appulse.epmd.java.client.exception.EpmdConnectionException: Couldn't connect to EPMD server (spirals-vortex.lille.inria.fr/172.17.0.4:4369), maybe it is down
	at io.appulse.epmd.java.client.Connection.connect(Connection.java:147)
	at io.appulse.epmd.java.client.Connection.send(Connection.java:79)
	at io.appulse.epmd.java.client.Connection.send(Connection.java:92)
	at io.appulse.epmd.java.client.EpmdClient.register(EpmdClient.java:164)
	... 31 more
Caused by: java.net.ConnectException: Connection refused (Connection refused)
	at java.net.PlainSocketImpl.socketConnect(Native Method)
	at java.net.AbstractPlainSocketImpl.doConnect(AbstractPlainSocketImpl.java:350)
	at java.net.AbstractPlainSocketImpl.connectToAddress(AbstractPlainSocketImpl.java:206)
	at java.net.AbstractPlainSocketImpl.connect(AbstractPlainSocketImpl.java:188)
	at java.net.SocksSocketImpl.connect(SocksSocketImpl.java:392)
	at java.net.Socket.connect(Socket.java:589)
	at io.appulse.epmd.java.client.Connection.connect(Connection.java:141)
	... 34 more

[ERROR] instantiating(io.appulse.encon.NodeTest)  Time elapsed: 0.306 s  <<< ERROR!
io.appulse.epmd.java.client.exception.EpmdRegistrationException: io.appulse.epmd.java.client.exception.EpmdConnectionException: Couldn't connect to EPMD server (spirals-vortex.lille.inria.fr/172.17.0.4:4369), maybe it is down
	at io.appulse.epmd.java.client.EpmdClient.register(EpmdClient.java:168)
	at io.appulse.encon.Node.newInstance(Node.java:78)
	at io.appulse.encon.Nodes.singleNode(Nodes.java:118)
	at io.appulse.encon.NodeTest.instantiating(NodeTest.java:144)
	at sun.reflect.NativeMethodAccessorImpl.invoke0(Native Method)
	at sun.reflect.NativeMethodAccessorImpl.invoke(NativeMethodAccessorImpl.java:62)
	at sun.reflect.DelegatingMethodAccessorImpl.invoke(DelegatingMethodAccessorImpl.java:43)
	at java.lang.reflect.Method.invoke(Method.java:498)
	at org.junit.runners.model.FrameworkMethod$1.runReflectiveCall(FrameworkMethod.java:50)
	at org.junit.internal.runners.model.ReflectiveCallable.run(ReflectiveCallable.java:12)
	at org.junit.runners.model.FrameworkMethod.invokeExplosively(FrameworkMethod.java:47)
	at org.junit.internal.runners.statements.InvokeMethod.evaluate(InvokeMethod.java:17)
	at org.junit.internal.runners.statements.RunAfters.evaluate(RunAfters.java:27)
	at org.junit.rules.TestWatcher$1.evaluate(TestWatcher.java:55)
	at org.junit.rules.RunRules.evaluate(RunRules.java:20)
	at org.junit.runners.ParentRunner.runLeaf(ParentRunner.java:325)
	at org.junit.runners.BlockJUnit4ClassRunner.runChild(BlockJUnit4ClassRunner.java:78)
	at org.junit.runners.BlockJUnit4ClassRunner.runChild(BlockJUnit4ClassRunner.java:57)
	at org.junit.runners.ParentRunner$3.run(ParentRunner.java:290)
	at org.junit.runners.ParentRunner$1.schedule(ParentRunner.java:71)
	at org.junit.runners.ParentRunner.runChildren(ParentRunner.java:288)
	at org.junit.runners.ParentRunner.access$000(ParentRunner.java:58)
	at org.junit.runners.ParentRunner$2.evaluate(ParentRunner.java:268)
	at org.junit.runners.ParentRunner.run(ParentRunner.java:363)
	at org.apache.maven.surefire.junit4.JUnit4Provider.execute(JUnit4Provider.java:365)
	at org.apache.maven.surefire.junit4.JUnit4Provider.executeWithRerun(JUnit4Provider.java:273)
	at org.apache.maven.surefire.junit4.JUnit4Provider.executeTestSet(JUnit4Provider.java:238)
	at org.apache.maven.surefire.junit4.JUnit4Provider.invoke(JUnit4Provider.java:159)
	at org.apache.maven.surefire.booter.ForkedBooter.invokeProviderInSameClassLoader(ForkedBooter.java:379)
	at org.apache.maven.surefire.booter.ForkedBooter.runSuitesInProcess(ForkedBooter.java:340)
	at org.apache.maven.surefire.booter.ForkedBooter.execute(ForkedBooter.java:125)
	at org.apache.maven.surefire.booter.ForkedBooter.main(ForkedBooter.java:413)
Caused by: io.appulse.epmd.java.client.exception.EpmdConnectionException: Couldn't connect to EPMD server (spirals-vortex.lille.inria.fr/172.17.0.4:4369), maybe it is down
	at io.appulse.epmd.java.client.Connection.connect(Connection.java:147)
	at io.appulse.epmd.java.client.Connection.send(Connection.java:79)
	at io.appulse.epmd.java.client.Connection.send(Connection.java:92)
	at io.appulse.epmd.java.client.EpmdClient.register(EpmdClient.java:164)
	... 31 more
Caused by: java.net.ConnectException: Connection refused (Connection refused)
	at java.net.PlainSocketImpl.socketConnect(Native Method)
	at java.net.AbstractPlainSocketImpl.doConnect(AbstractPlainSocketImpl.java:350)
	at java.net.AbstractPlainSocketImpl.connectToAddress(AbstractPlainSocketImpl.java:206)
	at java.net.AbstractPlainSocketImpl.connect(AbstractPlainSocketImpl.java:188)
	at java.net.SocksSocketImpl.connect(SocksSocketImpl.java:392)
	at java.net.Socket.connect(Socket.java:589)
	at io.appulse.epmd.java.client.Connection.connect(Connection.java:141)
	... 34 more

[ERROR] sendWithRedirect(io.appulse.encon.NodeTest)  Time elapsed: 0.306 s  <<< ERROR!
io.appulse.epmd.java.client.exception.EpmdRegistrationException: io.appulse.epmd.java.client.exception.EpmdConnectionException: Couldn't connect to EPMD server (spirals-vortex.lille.inria.fr/172.17.0.4:4369), maybe it is down
	at io.appulse.epmd.java.client.EpmdClient.register(EpmdClient.java:168)
	at io.appulse.encon.Node.newInstance(Node.java:78)
	at io.appulse.encon.Nodes.singleNode(Nodes.java:118)
	at io.appulse.encon.NodeTest.sendWithRedirect(NodeTest.java:206)
	at sun.reflect.NativeMethodAccessorImpl.invoke0(Native Method)
	at sun.reflect.NativeMethodAccessorImpl.invoke(NativeMethodAccessorImpl.java:62)
	at sun.reflect.DelegatingMethodAccessorImpl.invoke(DelegatingMethodAccessorImpl.java:43)
	at java.lang.reflect.Method.invoke(Method.java:498)
	at org.junit.runners.model.FrameworkMethod$1.runReflectiveCall(FrameworkMethod.java:50)
	at org.junit.internal.runners.model.ReflectiveCallable.run(ReflectiveCallable.java:12)
	at org.junit.runners.model.FrameworkMethod.invokeExplosively(FrameworkMethod.java:47)
	at org.junit.internal.runners.statements.InvokeMethod.evaluate(InvokeMethod.java:17)
	at org.junit.internal.runners.statements.RunAfters.evaluate(RunAfters.java:27)
	at org.junit.rules.TestWatcher$1.evaluate(TestWatcher.java:55)
	at org.junit.rules.RunRules.evaluate(RunRules.java:20)
	at org.junit.runners.ParentRunner.runLeaf(ParentRunner.java:325)
	at org.junit.runners.BlockJUnit4ClassRunner.runChild(BlockJUnit4ClassRunner.java:78)
	at org.junit.runners.BlockJUnit4ClassRunner.runChild(BlockJUnit4ClassRunner.java:57)
	at org.junit.runners.ParentRunner$3.run(ParentRunner.java:290)
	at org.junit.runners.ParentRunner$1.schedule(ParentRunner.java:71)
	at org.junit.runners.ParentRunner.runChildren(ParentRunner.java:288)
	at org.junit.runners.ParentRunner.access$000(ParentRunner.java:58)
	at org.junit.runners.ParentRunner$2.evaluate(ParentRunner.java:268)
	at org.junit.runners.ParentRunner.run(ParentRunner.java:363)
	at org.apache.maven.surefire.junit4.JUnit4Provider.execute(JUnit4Provider.java:365)
	at org.apache.maven.surefire.junit4.JUnit4Provider.executeWithRerun(JUnit4Provider.java:273)
	at org.apache.maven.surefire.junit4.JUnit4Provider.executeTestSet(JUnit4Provider.java:238)
	at org.apache.maven.surefire.junit4.JUnit4Provider.invoke(JUnit4Provider.java:159)
	at org.apache.maven.surefire.booter.ForkedBooter.invokeProviderInSameClassLoader(ForkedBooter.java:379)
	at org.apache.maven.surefire.booter.ForkedBooter.runSuitesInProcess(ForkedBooter.java:340)
	at org.apache.maven.surefire.booter.ForkedBooter.execute(ForkedBooter.java:125)
	at org.apache.maven.surefire.booter.ForkedBooter.main(ForkedBooter.java:413)
Caused by: io.appulse.epmd.java.client.exception.EpmdConnectionException: Couldn't connect to EPMD server (spirals-vortex.lille.inria.fr/172.17.0.4:4369), maybe it is down
	at io.appulse.epmd.java.client.Connection.connect(Connection.java:147)
	at io.appulse.epmd.java.client.Connection.send(Connection.java:79)
	at io.appulse.epmd.java.client.Connection.send(Connection.java:92)
	at io.appulse.epmd.java.client.EpmdClient.register(EpmdClient.java:164)
	... 31 more
Caused by: java.net.ConnectException: Connection refused (Connection refused)
	at java.net.PlainSocketImpl.socketConnect(Native Method)
	at java.net.AbstractPlainSocketImpl.doConnect(AbstractPlainSocketImpl.java:350)
	at java.net.AbstractPlainSocketImpl.connectToAddress(AbstractPlainSocketImpl.java:206)
	at java.net.AbstractPlainSocketImpl.connect(AbstractPlainSocketImpl.java:188)
	at java.net.SocksSocketImpl.connect(SocksSocketImpl.java:392)
	at java.net.Socket.connect(Socket.java:589)
	at io.appulse.epmd.java.client.Connection.connect(Connection.java:141)
	... 34 more

[INFO] Running io.appulse.encon.GeneratorPidTest

RUNNING TEST: io.appulse.encon.GeneratorPidTest.generate

[INFO] Tests run: 1, Failures: 0, Errors: 0, Skipped: 0, Time elapsed: 0 s - in io.appulse.encon.GeneratorPidTest
[INFO] Running io.appulse.encon.connection.ConnectionModuleTest
[INFO] Tests run: 1, Failures: 0, Errors: 0, Skipped: 0, Time elapsed: 0.026 s - in io.appulse.encon.connection.ConnectionModuleTest
[INFO] 
[INFO] Results:
[INFO] 
[ERROR] Errors: 
[ERROR]   NodeTest.exit:324  EpmdRegistration io.appulse.epmd.java.client.exception.Epm...
[ERROR]   NodeTest.instantiating:144  EpmdRegistration io.appulse.epmd.java.client.exce...
[ERROR]   NodeTest.link:296  EpmdRegistration io.appulse.epmd.java.client.exception.Epm...
[ERROR]   NodeTest.ping:107  EpmdRegistration io.appulse.epmd.java.client.exception.Epm...
[ERROR]   NodeTest.register:77  EpmdRegistration io.appulse.epmd.java.client.exception....
[ERROR]   NodeTest.send:254  EpmdRegistration io.appulse.epmd.java.client.exception.Epm...
[ERROR]   NodeTest.sendFromOneToAnotherNode:165  EpmdRegistration io.appulse.epmd.java....
[ERROR]   NodeTest.sendWithRedirect:206  EpmdRegistration io.appulse.epmd.java.client.e...
[ERROR]   NodesTest.instantiating:62  EpmdRegistration io.appulse.epmd.java.client.exce...
[INFO] 
[ERROR] Tests run: 13, Failures: 0, Errors: 9, Skipped: 0
[INFO] 
[INFO] ------------------------------------------------------------------------
[INFO] Reactor Summary:
[INFO] 
[INFO] encon .............................................. SUCCESS [  0.023 s]
[INFO] encon-common ....................................... SUCCESS [  4.237 s]
[INFO] encon-terms ........................................ SUCCESS [  2.902 s]
[INFO] encon-config ....................................... SUCCESS [  2.581 s]
[INFO] encon-databind ..................................... SUCCESS [  0.805 s]
[INFO] encon .............................................. FAILURE [  4.462 s]
[INFO] ------------------------------------------------------------------------
[INFO] BUILD FAILURE
[INFO] ------------------------------------------------------------------------
[INFO] Total time: 15.745 s
[INFO] Finished at: 2018-06-28T01:03:06+02:00
[INFO] Final Memory: 36M/946M
[INFO] ------------------------------------------------------------------------
[ERROR] Failed to execute goal org.apache.maven.plugins:maven-surefire-plugin:2.21.0:test (default-test) on project encon: There are test failures.
[ERROR] 
[ERROR] Please refer to /root/workspace/appulse-projects/encon-java/397573353/encon/target/surefire-reports for the individual test results.
[ERROR] Please refer to dump files (if any exist) [date]-jvmRun[N].dump, [date].dumpstream and [date]-jvmRun[N].dumpstream.
[ERROR] -> [Help 1]
[ERROR] 
[ERROR] To see the full stack trace of the errors, re-run Maven with the -e switch.
[ERROR] Re-run Maven using the -X switch to enable full debug logging.
[ERROR] 
[ERROR] For more information about the errors and possible solutions, please read the following articles:
[ERROR] [Help 1] http://cwiki.apache.org/confluence/display/MAVEN/MojoFailureException
[ERROR] 
[ERROR] After correcting the problems, you can resume the build with the command
[ERROR]   mvn <goals> -rf :encon
