[INFO] Scanning for projects...
[INFO] ------------------------------------------------------------------------
[INFO] Reactor Build Order:
[INFO] 
[INFO] Asynchronous Http Client Project
[INFO] Asynchronous Http Client Netty Utils
[INFO] Asynchronous Http Client
[INFO] Asynchronous Http Client Extras Parent
[INFO] Asynchronous Http Client Guava Extras
[INFO] Asynchronous Http Client JDeferred Extras
[INFO] Asynchronous Http Client Registry Extras
[INFO] Asynchronous Http Client RxJava Extras
[INFO] Asynchronous Http Client RxJava2 Extras
[INFO] Asynchronous Http Simple Client
[INFO] Asynchronous Http Client Retrofit2 Extras
[INFO] Asynchronous Http Client Typesafe Config Extras
[INFO] Asynchronous Http Client Example
[INFO]                                                                         
[INFO] ------------------------------------------------------------------------
[INFO] Building Asynchronous Http Client Project 2.4.4-SNAPSHOT
[INFO] ------------------------------------------------------------------------
[INFO] 
[INFO] --- maven-enforcer-plugin:1.4.1:enforce (enforce-maven) @ async-http-client-project ---
[INFO] Skipping Rule Enforcement.
[INFO] 
[INFO] --- maven-enforcer-plugin:1.4.1:enforce (enforce-versions) @ async-http-client-project ---
[INFO] Skipping Rule Enforcement.
[INFO]                                                                         
[INFO] ------------------------------------------------------------------------
[INFO] Building Asynchronous Http Client Netty Utils 2.4.4-SNAPSHOT
[INFO] ------------------------------------------------------------------------
[INFO] 
[INFO] --- maven-enforcer-plugin:1.4.1:enforce (enforce-maven) @ async-http-client-netty-utils ---
[INFO] Skipping Rule Enforcement.
[INFO] 
[INFO] --- maven-enforcer-plugin:1.4.1:enforce (enforce-versions) @ async-http-client-netty-utils ---
[INFO] Skipping Rule Enforcement.
[INFO] 
[INFO] --- maven-resources-plugin:3.0.2:resources (default-resources) @ async-http-client-netty-utils ---
[INFO] Using 'UTF-8' encoding to copy filtered resources.
[INFO] skip non existing resourceDirectory /root/workspace/AsyncHttpClient/async-http-client/349224175/netty-utils/src/main/resources
[INFO] 
[INFO] --- maven-compiler-plugin:3.6.1:compile (default-compile) @ async-http-client-netty-utils ---
[INFO] Nothing to compile - all classes are up to date
[INFO] 
[INFO] --- maven-resources-plugin:3.0.2:testResources (default-testResources) @ async-http-client-netty-utils ---
[INFO] Using 'UTF-8' encoding to copy filtered resources.
[INFO] skip non existing resourceDirectory /root/workspace/AsyncHttpClient/async-http-client/349224175/netty-utils/src/test/resources
[INFO] 
[INFO] --- maven-compiler-plugin:3.6.1:testCompile (default-testCompile) @ async-http-client-netty-utils ---
[INFO] Nothing to compile - all classes are up to date
[INFO] 
[INFO] --- maven-surefire-plugin:2.19.1:test (default-test) @ async-http-client-netty-utils ---
[INFO] Downloading: https://repo.maven.apache.org/maven2/org/apache/maven/surefire/surefire-testng/2.19.1/surefire-testng-2.19.1.pom
[INFO] Downloaded: https://repo.maven.apache.org/maven2/org/apache/maven/surefire/surefire-testng/2.19.1/surefire-testng-2.19.1.pom (3 KB at 7.9 KB/sec)
[INFO] Downloading: https://repo.maven.apache.org/maven2/org/apache/maven/surefire/surefire-providers/2.19.1/surefire-providers-2.19.1.pom
[INFO] Downloaded: https://repo.maven.apache.org/maven2/org/apache/maven/surefire/surefire-providers/2.19.1/surefire-providers-2.19.1.pom (3 KB at 139.1 KB/sec)
[INFO] Downloading: https://repo.maven.apache.org/maven2/org/apache/maven/surefire/common-java5/2.19.1/common-java5-2.19.1.pom
[INFO] Downloaded: https://repo.maven.apache.org/maven2/org/apache/maven/surefire/common-java5/2.19.1/common-java5-2.19.1.pom (3 KB at 104.6 KB/sec)
[INFO] Downloading: https://repo.maven.apache.org/maven2/org/apache/maven/surefire/surefire-testng-utils/2.19.1/surefire-testng-utils-2.19.1.pom
[INFO] Downloaded: https://repo.maven.apache.org/maven2/org/apache/maven/surefire/surefire-testng-utils/2.19.1/surefire-testng-utils-2.19.1.pom (3 KB at 149.1 KB/sec)
[INFO] Downloading: https://repo.maven.apache.org/maven2/org/apache/maven/surefire/surefire-grouper/2.19.1/surefire-grouper-2.19.1.pom
[INFO] Downloaded: https://repo.maven.apache.org/maven2/org/apache/maven/surefire/surefire-grouper/2.19.1/surefire-grouper-2.19.1.pom (3 KB at 128.3 KB/sec)
[INFO] Downloading: https://repo.maven.apache.org/maven2/org/apache/maven/surefire/common-java5/2.19.1/common-java5-2.19.1.jar
[INFO] Downloading: https://repo.maven.apache.org/maven2/org/apache/maven/surefire/surefire-grouper/2.19.1/surefire-grouper-2.19.1.jar
[INFO] Downloading: https://repo.maven.apache.org/maven2/org/apache/maven/surefire/surefire-testng/2.19.1/surefire-testng-2.19.1.jar
[INFO] Downloading: https://repo.maven.apache.org/maven2/org/apache/maven/surefire/surefire-testng-utils/2.19.1/surefire-testng-utils-2.19.1.jar
[INFO] Downloaded: https://repo.maven.apache.org/maven2/org/apache/maven/surefire/common-java5/2.19.1/common-java5-2.19.1.jar (44 KB at 1197.0 KB/sec)
[INFO] Downloaded: https://repo.maven.apache.org/maven2/org/apache/maven/surefire/surefire-testng-utils/2.19.1/surefire-testng-utils-2.19.1.jar (27 KB at 626.4 KB/sec)
[INFO] Downloaded: https://repo.maven.apache.org/maven2/org/apache/maven/surefire/surefire-grouper/2.19.1/surefire-grouper-2.19.1.jar (38 KB at 797.2 KB/sec)
[INFO] Downloaded: https://repo.maven.apache.org/maven2/org/apache/maven/surefire/surefire-testng/2.19.1/surefire-testng-2.19.1.jar (42 KB at 740.3 KB/sec)

-------------------------------------------------------
 T E S T S
-------------------------------------------------------
Running org.asynchttpclient.netty.util.Utf8ByteBufCharsetDecoderTest
Tests run: 4, Failures: 0, Errors: 0, Skipped: 0, Time elapsed: 0.435 sec - in org.asynchttpclient.netty.util.Utf8ByteBufCharsetDecoderTest

Results :

Tests run: 4, Failures: 0, Errors: 0, Skipped: 0

[INFO]                                                                         
[INFO] ------------------------------------------------------------------------
[INFO] Building Asynchronous Http Client 2.4.4-SNAPSHOT
[INFO] ------------------------------------------------------------------------
[INFO] 
[INFO] --- maven-enforcer-plugin:1.4.1:enforce (enforce-maven) @ async-http-client ---
[INFO] Skipping Rule Enforcement.
[INFO] 
[INFO] --- maven-enforcer-plugin:1.4.1:enforce (enforce-versions) @ async-http-client ---
[INFO] Skipping Rule Enforcement.
[INFO] 
[INFO] --- maven-resources-plugin:3.0.2:resources (default-resources) @ async-http-client ---
[INFO] Using 'UTF-8' encoding to copy filtered resources.
[INFO] Copying 3 resources
[INFO] 
[INFO] --- maven-compiler-plugin:3.6.1:compile (default-compile) @ async-http-client ---
[INFO] Nothing to compile - all classes are up to date
[INFO] 
[INFO] --- maven-resources-plugin:3.0.2:testResources (default-testResources) @ async-http-client ---
[INFO] Using 'UTF-8' encoding to copy filtered resources.
[INFO] Copying 13 resources
[INFO] 
[INFO] --- maven-compiler-plugin:3.6.1:testCompile (default-testCompile) @ async-http-client ---
[INFO] Nothing to compile - all classes are up to date
[INFO] 
[INFO] --- maven-surefire-plugin:2.19.1:test (default-test) @ async-http-client ---

-------------------------------------------------------
 T E S T S
-------------------------------------------------------
Running TestSuite
Tests run: 520, Failures: 9, Errors: 0, Skipped: 0, Time elapsed: 167.143 sec <<< FAILURE! - in TestSuite
newConnectionEventsAreFired(org.asynchttpclient.BasicHttpTest)  Time elapsed: 0.05 sec  <<< FAILURE!
java.lang.AssertionError: Got [ConnectionPool, HostnameResolution, HostnameResolutionSuccess, ConnectionOpen, ConnectionFailure, ConnectionOpen, ConnectionSuccess, RequestSend, HeadersWritten, StatusReceived, HeadersReceived, ConnectionOffer, Completed]: lists don't have the same size expected [11] but found [13]
	at org.asynchttpclient.BasicHttpTest.lambda$null$75(BasicHttpTest.java:877)
	at org.asynchttpclient.BasicHttpTest.lambda$newConnectionEventsAreFired$76(BasicHttpTest.java:856)
	at org.asynchttpclient.BasicHttpTest.newConnectionEventsAreFired(BasicHttpTest.java:855)

echoWSSText(org.asynchttpclient.ws.ProxyTunnellingTest)  Time elapsed: 0.041 sec  <<< FAILURE!
java.lang.NullPointerException
	at org.asynchttpclient.ws.ProxyTunnellingTest.runTest(ProxyTunnellingTest.java:107)
	at org.asynchttpclient.ws.ProxyTunnellingTest.echoWSSText(ProxyTunnellingTest.java:68)

echoWSText(org.asynchttpclient.ws.ProxyTunnellingTest)  Time elapsed: 0.021 sec  <<< FAILURE!
java.lang.NullPointerException
	at org.asynchttpclient.ws.ProxyTunnellingTest.runTest(ProxyTunnellingTest.java:107)
	at org.asynchttpclient.ws.ProxyTunnellingTest.echoWSText(ProxyTunnellingTest.java:63)

testConfigProxy(org.asynchttpclient.proxy.HttpsProxyTest)  Time elapsed: 0.028 sec  <<< FAILURE!
java.lang.AssertionError: expected [200] but found [500]
	at org.asynchttpclient.proxy.HttpsProxyTest.testConfigProxy(HttpsProxyTest.java:83)

testPooledConnectionsWithProxy(org.asynchttpclient.proxy.HttpsProxyTest)  Time elapsed: 0.013 sec  <<< FAILURE!
java.lang.AssertionError: expected [200] but found [500]
	at org.asynchttpclient.proxy.HttpsProxyTest.testPooledConnectionsWithProxy(HttpsProxyTest.java:94)

testRequestProxy(org.asynchttpclient.proxy.HttpsProxyTest)  Time elapsed: 0.012 sec  <<< FAILURE!
java.lang.AssertionError: expected [200] but found [500]
	at org.asynchttpclient.proxy.HttpsProxyTest.testRequestProxy(HttpsProxyTest.java:70)

runSocksProxy(org.asynchttpclient.proxy.ProxyTest)  Time elapsed: 0.041 sec  <<< FAILURE!
java.util.concurrent.ExecutionException: java.net.ConnectException: Protocol family unavailable: localhost/0:0:0:0:0:0:0:1:8000
	at org.asynchttpclient.proxy.ProxyTest.runSocksProxy(ProxyTest.java:341)
Caused by: java.net.ConnectException: Protocol family unavailable: localhost/0:0:0:0:0:0:0:1:8000
Caused by: io.netty.channel.AbstractChannel$AnnotatedSocketException: Protocol family unavailable: localhost/0:0:0:0:0:0:0:1:8000
Caused by: java.net.SocketException: Protocol family unavailable

testNormalEventsFired(org.asynchttpclient.BasicHttpsTest)  Time elapsed: 0.065 sec  <<< FAILURE!
java.lang.AssertionError: Got [ConnectionPool, HostnameResolution, HostnameResolutionSuccess, ConnectionOpen, ConnectionFailure, ConnectionOpen, ConnectionSuccess, TlsHandshake, TlsHandshakeSuccess, RequestSend, HeadersWritten, StatusReceived, HeadersReceived, ConnectionOffer, Completed]: lists don't have the same size expected [13] but found [15]
	at org.asynchttpclient.BasicHttpsTest.lambda$null$13(BasicHttpsTest.java:204)
	at org.asynchttpclient.BasicHttpsTest.lambda$testNormalEventsFired$14(BasicHttpsTest.java:182)
	at org.asynchttpclient.BasicHttpsTest.testNormalEventsFired(BasicHttpsTest.java:181)

nonPreemptiveProxyAuthWithHttpsTarget(org.asynchttpclient.BasicHttpProxyToHttpsTest)  Time elapsed: 0.017 sec  <<< FAILURE!
java.lang.AssertionError: expected [200] but found [500]
	at org.asynchttpclient.BasicHttpProxyToHttpsTest.nonPreemptiveProxyAuthWithHttpsTarget(BasicHttpProxyToHttpsTest.java:106)


Results :

Failed tests: 
  BasicHttpProxyToHttpsTest.nonPreemptiveProxyAuthWithHttpsTarget:106 expected [200] but found [500]
  BasicHttpTest.newConnectionEventsAreFired:855->lambda$newConnectionEventsAreFired$76:856->lambda$null$75:877 Got [ConnectionPool, HostnameResolution, HostnameResolutionSuccess, ConnectionOpen, ConnectionFailure, ConnectionOpen, ConnectionSuccess, RequestSend, HeadersWritten, StatusReceived, HeadersReceived, ConnectionOffer, Completed]: lists don't have the same size expected [11] but found [13]
  BasicHttpsTest.testNormalEventsFired:181->lambda$testNormalEventsFired$14:182->lambda$null$13:204 Got [ConnectionPool, HostnameResolution, HostnameResolutionSuccess, ConnectionOpen, ConnectionFailure, ConnectionOpen, ConnectionSuccess, TlsHandshake, TlsHandshakeSuccess, RequestSend, HeadersWritten, StatusReceived, HeadersReceived, ConnectionOffer, Completed]: lists don't have the same size expected [13] but found [15]
  HttpsProxyTest.testConfigProxy:83 expected [200] but found [500]
  HttpsProxyTest.testPooledConnectionsWithProxy:94 expected [200] but found [500]
  HttpsProxyTest.testRequestProxy:70 expected [200] but found [500]
  ProxyTest.runSocksProxy:341 » Execution java.net.ConnectException: Protocol fa...
  ProxyTunnellingTest.echoWSSText:68->runTest:107 NullPointer
  ProxyTunnellingTest.echoWSText:63->runTest:107 NullPointer

Tests run: 520, Failures: 9, Errors: 0, Skipped: 0

[INFO] ------------------------------------------------------------------------
[INFO] Reactor Summary:
[INFO] 
[INFO] Asynchronous Http Client Project ................... SUCCESS [  0.465 s]
[INFO] Asynchronous Http Client Netty Utils ............... SUCCESS [  2.497 s]
[INFO] Asynchronous Http Client ........................... FAILURE [02:48 min]
[INFO] Asynchronous Http Client Extras Parent ............. SKIPPED
[INFO] Asynchronous Http Client Guava Extras .............. SKIPPED
[INFO] Asynchronous Http Client JDeferred Extras .......... SKIPPED
[INFO] Asynchronous Http Client Registry Extras ........... SKIPPED
[INFO] Asynchronous Http Client RxJava Extras ............. SKIPPED
[INFO] Asynchronous Http Client RxJava2 Extras ............ SKIPPED
[INFO] Asynchronous Http Simple Client .................... SKIPPED
[INFO] Asynchronous Http Client Retrofit2 Extras .......... SKIPPED
[INFO] Asynchronous Http Client Typesafe Config Extras .... SKIPPED
[INFO] Asynchronous Http Client Example ................... SKIPPED
[INFO] ------------------------------------------------------------------------
[INFO] BUILD FAILURE
[INFO] ------------------------------------------------------------------------
[INFO] Total time: 02:51 min
[INFO] Finished at: 2018-03-05T11:34:51+01:00
[INFO] Final Memory: 26M/931M
[INFO] ------------------------------------------------------------------------
[ERROR] Failed to execute goal org.apache.maven.plugins:maven-surefire-plugin:2.19.1:test (default-test) on project async-http-client: There are test failures.
[ERROR] 
[ERROR] Please refer to /root/workspace/AsyncHttpClient/async-http-client/349224175/client/target/surefire-reports for the individual test results.
[ERROR] -> [Help 1]
[ERROR] 
[ERROR] To see the full stack trace of the errors, re-run Maven with the -e switch.
[ERROR] Re-run Maven using the -X switch to enable full debug logging.
[ERROR] 
[ERROR] For more information about the errors and possible solutions, please read the following articles:
[ERROR] [Help 1] http://cwiki.apache.org/confluence/display/MAVEN/MojoFailureException
[ERROR] 
[ERROR] After correcting the problems, you can resume the build with the command
[ERROR]   mvn <goals> -rf :async-http-client
