[INFO] Scanning for projects...
[INFO]                                                                         
[INFO] ------------------------------------------------------------------------
[INFO] Building searchcode 1.3.13
[INFO] ------------------------------------------------------------------------
[INFO] 
[INFO] --- maven-resources-plugin:2.6:resources (default-resources) @ searchcode ---
[INFO] Using 'UTF-8' encoding to copy filtered resources.
[INFO] Copying 205 resources
[INFO] 
[INFO] --- maven-compiler-plugin:3.6.1:compile (default-compile) @ searchcode ---
[INFO] Nothing to compile - all classes are up to date
[INFO] 
[INFO] --- maven-resources-plugin:2.6:testResources (default-testResources) @ searchcode ---
[INFO] Using 'UTF-8' encoding to copy filtered resources.
[INFO] skip non existing resourceDirectory /root/workspace/boyter/searchcode-server/347969720/src/test/resources
[INFO] 
[INFO] --- maven-compiler-plugin:3.6.1:testCompile (default-testCompile) @ searchcode ---
[INFO] Nothing to compile - all classes are up to date
[INFO] 
[INFO] --- maven-surefire-plugin:2.19.1:test (default-test) @ searchcode ---
[INFO] Downloading: https://repo.maven.apache.org/maven2/org/apache/maven/surefire/surefire-junit4/2.19.1/surefire-junit4-2.19.1.pom
[INFO] Downloaded: https://repo.maven.apache.org/maven2/org/apache/maven/surefire/surefire-junit4/2.19.1/surefire-junit4-2.19.1.pom (4 KB at 8.6 KB/sec)
[INFO] Downloading: https://repo.maven.apache.org/maven2/org/apache/maven/surefire/surefire-providers/2.19.1/surefire-providers-2.19.1.pom
[INFO] Downloaded: https://repo.maven.apache.org/maven2/org/apache/maven/surefire/surefire-providers/2.19.1/surefire-providers-2.19.1.pom (3 KB at 131.7 KB/sec)
[INFO] Downloading: https://repo.maven.apache.org/maven2/org/apache/maven/surefire/surefire-junit4/2.19.1/surefire-junit4-2.19.1.jar
[INFO] Downloaded: https://repo.maven.apache.org/maven2/org/apache/maven/surefire/surefire-junit4/2.19.1/surefire-junit4-2.19.1.jar (74 KB at 1207.4 KB/sec)

-------------------------------------------------------
 T E S T S
-------------------------------------------------------
Running com.searchcode.app.util.LoggerWrapperTest
Tests run: 15, Failures: 0, Errors: 0, Skipped: 0, Time elapsed: 0.521 sec - in com.searchcode.app.util.LoggerWrapperTest
Running com.searchcode.app.util.RepositorySourceTest
Tests run: 4, Failures: 0, Errors: 0, Skipped: 0, Time elapsed: 0.044 sec - in com.searchcode.app.util.RepositorySourceTest
Running com.searchcode.app.util.OWASPFileClassifierResultTest
Tests run: 11, Failures: 0, Errors: 0, Skipped: 0, Time elapsed: 0.068 sec - in com.searchcode.app.util.OWASPFileClassifierResultTest
Running com.searchcode.app.util.AESEncryptorTest
Tests run: 3, Failures: 0, Errors: 0, Skipped: 0, Time elapsed: 0.083 sec - in com.searchcode.app.util.AESEncryptorTest
Running com.searchcode.app.util.HelpersTest
Tests run: 14, Failures: 0, Errors: 0, Skipped: 0, Time elapsed: 3.407 sec - in com.searchcode.app.util.HelpersTest
Running com.searchcode.app.util.VectorspaceTest
Tests run: 5, Failures: 0, Errors: 0, Skipped: 0, Time elapsed: 0.001 sec - in com.searchcode.app.util.VectorspaceTest
Running com.searchcode.app.util.Cocomo2Test
Tests run: 3, Failures: 0, Errors: 0, Skipped: 0, Time elapsed: 0 sec - in com.searchcode.app.util.Cocomo2Test
Running com.searchcode.app.util.SpellingCorrectorTest
Tests run: 13, Failures: 0, Errors: 0, Skipped: 0, Time elapsed: 1.368 sec - in com.searchcode.app.util.SpellingCorrectorTest
Running com.searchcode.app.util.FileClassifierResultTest
Tests run: 14, Failures: 0, Errors: 0, Skipped: 0, Time elapsed: 0.082 sec - in com.searchcode.app.util.FileClassifierResultTest
Running com.searchcode.app.util.SearchcodeLibTest
Tests run: 55, Failures: 0, Errors: 0, Skipped: 0, Time elapsed: 1.244 sec - in com.searchcode.app.util.SearchcodeLibTest
Running com.searchcode.app.util.LicenceCheckerTest
Tests run: 9, Failures: 1, Errors: 5, Skipped: 0, Time elapsed: 0.032 sec <<< FAILURE! - in com.searchcode.app.util.LicenceCheckerTest
testKeywordMatchMultipleGPLUnlicense(com.searchcode.app.util.LicenceCheckerTest)  Time elapsed: 0.012 sec  <<< ERROR!
java.util.NoSuchElementException: No value present
	at com.searchcode.app.util.LicenceCheckerTest.testKeywordMatchMultipleGPLUnlicense(LicenceCheckerTest.java:52)

testLoadDatabaseConcordance(com.searchcode.app.util.LicenceCheckerTest)  Time elapsed: 0 sec  <<< ERROR!
java.lang.IndexOutOfBoundsException: Index: 0, Size: 0
	at com.searchcode.app.util.LicenceCheckerTest.testLoadDatabaseConcordance(LicenceCheckerTest.java:26)

testLoadDatabase(com.searchcode.app.util.LicenceCheckerTest)  Time elapsed: 0.005 sec  <<< FAILURE!
java.lang.AssertionError: 

Expecting:
  <[]>
to have at least one element of type:
  <com.searchcode.app.model.LicenseResult>
but had none.
	at com.searchcode.app.util.LicenceCheckerTest.testLoadDatabase(LicenceCheckerTest.java:22)

testSingleIdentifier(com.searchcode.app.util.LicenceCheckerTest)  Time elapsed: 0.001 sec  <<< ERROR!
java.lang.IndexOutOfBoundsException: Index: 0, Size: 0
	at com.searchcode.app.util.LicenceCheckerTest.testSingleIdentifier(LicenceCheckerTest.java:31)

testMultipleIdentifier(com.searchcode.app.util.LicenceCheckerTest)  Time elapsed: 0.001 sec  <<< ERROR!
java.lang.IndexOutOfBoundsException: Index: 0, Size: 0
	at com.searchcode.app.util.LicenceCheckerTest.testMultipleIdentifier(LicenceCheckerTest.java:36)

testKeywordMatchUnlicense(com.searchcode.app.util.LicenceCheckerTest)  Time elapsed: 0.001 sec  <<< ERROR!
java.util.NoSuchElementException: No value present
	at com.searchcode.app.util.LicenceCheckerTest.testKeywordMatchUnlicense(LicenceCheckerTest.java:47)

Running com.searchcode.app.util.UniqueRepoQueueTest
Tests run: 7, Failures: 0, Errors: 0, Skipped: 0, Time elapsed: 0.004 sec - in com.searchcode.app.util.UniqueRepoQueueTest
Running com.searchcode.app.service.AdminRouteServiceTest
Tests run: 8, Failures: 0, Errors: 0, Skipped: 0, Time elapsed: 0.132 sec - in com.searchcode.app.service.AdminRouteServiceTest
Running com.searchcode.app.service.DataServiceTest
Tests run: 2, Failures: 0, Errors: 0, Skipped: 0, Time elapsed: 0.002 sec - in com.searchcode.app.service.DataServiceTest
Running com.searchcode.app.service.JobServiceTest
Tests run: 1, Failures: 0, Errors: 0, Skipped: 0, Time elapsed: 0 sec - in com.searchcode.app.service.JobServiceTest
Running com.searchcode.app.service.IndexServiceTest
Tests run: 30, Failures: 0, Errors: 0, Skipped: 0, Time elapsed: 1.915 sec - in com.searchcode.app.service.IndexServiceTest
Running com.searchcode.app.service.StatsServiceTest
Tests run: 3, Failures: 0, Errors: 0, Skipped: 0, Time elapsed: 0 sec - in com.searchcode.app.service.StatsServiceTest
Running com.searchcode.app.service.ValidatorServiceTest
Tests run: 6, Failures: 0, Errors: 0, Skipped: 0, Time elapsed: 0.008 sec - in com.searchcode.app.service.ValidatorServiceTest
Running com.searchcode.app.service.ApiServiceTest
Tests run: 11, Failures: 0, Errors: 0, Skipped: 0, Time elapsed: 0.011 sec - in com.searchcode.app.service.ApiServiceTest
Running com.searchcode.app.service.TimeCodeSearcherTest
Tests run: 1, Failures: 0, Errors: 0, Skipped: 0, Time elapsed: 0 sec - in com.searchcode.app.service.TimeCodeSearcherTest
Running com.searchcode.app.service.CodeMatcherTest
Tests run: 32, Failures: 0, Errors: 0, Skipped: 0, Time elapsed: 7.078 sec - in com.searchcode.app.service.CodeMatcherTest
Running com.searchcode.app.service.route.CommonRouteServiceTest
Tests run: 1, Failures: 0, Errors: 0, Skipped: 0, Time elapsed: 0.008 sec - in com.searchcode.app.service.route.CommonRouteServiceTest
Running com.searchcode.app.service.CodeRouteServiceTest
Tests run: 8, Failures: 0, Errors: 0, Skipped: 0, Time elapsed: 0.061 sec - in com.searchcode.app.service.CodeRouteServiceTest
Running com.searchcode.app.service.ApiRouteServiceTest
Tests run: 39, Failures: 0, Errors: 0, Skipped: 0, Time elapsed: 0.03 sec - in com.searchcode.app.service.ApiRouteServiceTest
Running com.searchcode.app.dao.DataTest
Tests run: 9, Failures: 0, Errors: 0, Skipped: 0, Time elapsed: 0.058 sec - in com.searchcode.app.dao.DataTest
Running com.searchcode.app.dao.ApiTest
Tests run: 5, Failures: 0, Errors: 0, Skipped: 0, Time elapsed: 0.021 sec - in com.searchcode.app.dao.ApiTest
Running com.searchcode.app.dao.RepoTest
Tests run: 11, Failures: 0, Errors: 0, Skipped: 0, Time elapsed: 0.283 sec - in com.searchcode.app.dao.RepoTest
Running com.searchcode.app.dto.CodeIndexDocumentTest
Tests run: 3, Failures: 0, Errors: 0, Skipped: 0, Time elapsed: 0 sec - in com.searchcode.app.dto.CodeIndexDocumentTest
Running com.searchcode.app.dto.RepoResultTest
Tests run: 7, Failures: 0, Errors: 0, Skipped: 0, Time elapsed: 0 sec - in com.searchcode.app.dto.RepoResultTest
Running com.searchcode.app.jobs.repository.SearchcodeFleVisitorTest
Tests run: 1, Failures: 0, Errors: 0, Skipped: 0, Time elapsed: 0.786 sec - in com.searchcode.app.jobs.repository.SearchcodeFleVisitorTest
Running com.searchcode.app.jobs.IndexGitHistoryJobTest
Tests run: 1, Failures: 0, Errors: 0, Skipped: 0, Time elapsed: 0.069 sec - in com.searchcode.app.jobs.IndexGitHistoryJobTest
Running com.searchcode.app.jobs.IndexDocumentsJobTest
Tests run: 1, Failures: 0, Errors: 0, Skipped: 0, Time elapsed: 0.008 sec - in com.searchcode.app.jobs.IndexDocumentsJobTest
Running com.searchcode.app.jobs.IndexFileRepoJobTest
Tests run: 2, Failures: 0, Errors: 0, Skipped: 0, Time elapsed: 0 sec - in com.searchcode.app.jobs.IndexFileRepoJobTest
Running com.searchcode.app.jobs.IndexSvnRepoJobTest
Tests run: 4, Failures: 0, Errors: 0, Skipped: 0, Time elapsed: 0.029 sec - in com.searchcode.app.jobs.IndexSvnRepoJobTest
Running com.searchcode.app.jobs.IndexBaseRepoJobTest
Tests run: 4, Failures: 0, Errors: 0, Skipped: 0, Time elapsed: 0.045 sec - in com.searchcode.app.jobs.IndexBaseRepoJobTest
Running com.searchcode.app.jobs.IndexBaseAndGitRepoJobTest
Tests run: 14, Failures: 0, Errors: 0, Skipped: 0, Time elapsed: 0.009 sec - in com.searchcode.app.jobs.IndexBaseAndGitRepoJobTest
Running com.searchcode.app.AppTest
Tests run: 2, Failures: 0, Errors: 0, Skipped: 0, Time elapsed: 0.235 sec - in com.searchcode.app.AppTest

Results :

Failed tests: 
  LicenceCheckerTest.testLoadDatabase:22 
Expecting:
  <[]>
to have at least one element of type:
  <com.searchcode.app.model.LicenseResult>
but had none.
Tests in error: 
  LicenceCheckerTest.testKeywordMatchMultipleGPLUnlicense:52 » NoSuchElement No ...
  LicenceCheckerTest.testKeywordMatchUnlicense:47 » NoSuchElement No value prese...
  LicenceCheckerTest.testLoadDatabaseConcordance:26 » IndexOutOfBounds Index: 0,...
  LicenceCheckerTest.testMultipleIdentifier:36 » IndexOutOfBounds Index: 0, Size...
  LicenceCheckerTest.testSingleIdentifier:31 » IndexOutOfBounds Index: 0, Size: ...

Tests run: 359, Failures: 1, Errors: 5, Skipped: 0

[INFO] ------------------------------------------------------------------------
[INFO] BUILD FAILURE
[INFO] ------------------------------------------------------------------------
[INFO] Total time: 20.740 s
[INFO] Finished at: 2018-03-01T22:24:48+01:00
[INFO] Final Memory: 23M/922M
[INFO] ------------------------------------------------------------------------
[ERROR] Failed to execute goal org.apache.maven.plugins:maven-surefire-plugin:2.19.1:test (default-test) on project searchcode: There are test failures.
[ERROR] 
[ERROR] Please refer to /root/workspace/boyter/searchcode-server/347969720/target/surefire-reports for the individual test results.
[ERROR] -> [Help 1]
[ERROR] 
[ERROR] To see the full stack trace of the errors, re-run Maven with the -e switch.
[ERROR] Re-run Maven using the -X switch to enable full debug logging.
[ERROR] 
[ERROR] For more information about the errors and possible solutions, please read the following articles:
[ERROR] [Help 1] http://cwiki.apache.org/confluence/display/MAVEN/MojoFailureException
