[INFO] Scanning for projects...
[INFO] ------------------------------------------------------------------------
[INFO] Reactor Build Order:
[INFO] 
[INFO] ClazzFish
[INFO] clazzfish-agent
[INFO] clazzfish-monitor
[INFO]                                                                         
[INFO] ------------------------------------------------------------------------
[INFO] Building ClazzFish 0.8-SNAPSHOT
[INFO] ------------------------------------------------------------------------
[INFO] 
[INFO] --- jacoco-maven-plugin:0.8.0:prepare-agent (prepare-agent) @ clazzfish ---
[INFO] argLine set to -javaagent:/root/./workspace/oboehm/ClazzFish/380428423/.m2/org/jacoco/org.jacoco.agent/0.8.0/org.jacoco.agent-0.8.0-runtime.jar=destfile=/root/workspace/oboehm/ClazzFish/380428423/target/jacoco.exec
[INFO] 
[INFO] --- jacoco-maven-plugin:0.8.0:report (post-unit-test) @ clazzfish ---
[INFO] Skipping JaCoCo execution due to missing execution data file.
[INFO]                                                                         
[INFO] ------------------------------------------------------------------------
[INFO] Building clazzfish-agent 0.8-SNAPSHOT
[INFO] ------------------------------------------------------------------------
[INFO] 
[INFO] --- jacoco-maven-plugin:0.8.0:prepare-agent (prepare-agent) @ clazzfish-agent ---
[INFO] argLine set to -javaagent:/root/./workspace/oboehm/ClazzFish/380428423/.m2/org/jacoco/org.jacoco.agent/0.8.0/org.jacoco.agent-0.8.0-runtime.jar=destfile=/root/workspace/oboehm/ClazzFish/380428423/agent/target/jacoco.exec
[INFO] 
[INFO] --- maven-resources-plugin:2.6:resources (default-resources) @ clazzfish-agent ---
[INFO] Using 'UTF-8' encoding to copy filtered resources.
[INFO] Copying 1 resource
[INFO] 
[INFO] --- maven-compiler-plugin:3.1:compile (default-compile) @ clazzfish-agent ---
[INFO] Changes detected - recompiling the module!
[INFO] Compiling 5 source files to /root/workspace/oboehm/ClazzFish/380428423/agent/target/classes
[INFO] 
[INFO] --- maven-resources-plugin:2.6:testResources (default-testResources) @ clazzfish-agent ---
[INFO] Using 'UTF-8' encoding to copy filtered resources.
[INFO] skip non existing resourceDirectory /root/workspace/oboehm/ClazzFish/380428423/agent/src/test/resources
[INFO] 
[INFO] --- maven-compiler-plugin:3.1:testCompile (default-testCompile) @ clazzfish-agent ---
[INFO] Nothing to compile - all classes are up to date
[INFO] 
[INFO] --- maven-surefire-plugin:2.19.1:test (default-test) @ clazzfish-agent ---
[INFO] Downloading: https://repo.maven.apache.org/maven2/org/apache/maven/maven-artifact/3.0/maven-artifact-3.0.pom
[INFO] Downloaded: https://repo.maven.apache.org/maven2/org/apache/maven/maven-artifact/3.0/maven-artifact-3.0.pom (2 KB at 6.0 KB/sec)
[INFO] Downloading: https://repo.maven.apache.org/maven2/org/apache/maven/maven/3.0/maven-3.0.pom
[INFO] Downloaded: https://repo.maven.apache.org/maven2/org/apache/maven/maven/3.0/maven-3.0.pom (22 KB at 763.3 KB/sec)
[INFO] Downloading: https://repo.maven.apache.org/maven2/org/codehaus/plexus/plexus-utils/2.0.4/plexus-utils-2.0.4.pom
[INFO] Downloaded: https://repo.maven.apache.org/maven2/org/codehaus/plexus/plexus-utils/2.0.4/plexus-utils-2.0.4.pom (4 KB at 171.4 KB/sec)
[INFO] Downloading: https://repo.maven.apache.org/maven2/org/apache/maven/wagon/wagon-provider-api/1.0-beta-6/wagon-provider-api-1.0-beta-6.pom
[INFO] Downloaded: https://repo.maven.apache.org/maven2/org/apache/maven/wagon/wagon-provider-api/1.0-beta-6/wagon-provider-api-1.0-beta-6.pom (2 KB at 90.5 KB/sec)
[INFO] Downloading: https://repo.maven.apache.org/maven2/org/apache/maven/wagon/wagon/1.0-beta-6/wagon-1.0-beta-6.pom
[INFO] Downloaded: https://repo.maven.apache.org/maven2/org/apache/maven/wagon/wagon/1.0-beta-6/wagon-1.0-beta-6.pom (13 KB at 636.6 KB/sec)
[INFO] Downloading: https://repo.maven.apache.org/maven2/org/codehaus/plexus/plexus-utils/1.4.2/plexus-utils-1.4.2.pom
[INFO] Downloaded: https://repo.maven.apache.org/maven2/org/codehaus/plexus/plexus-utils/1.4.2/plexus-utils-1.4.2.pom (2 KB at 106.3 KB/sec)
[INFO] Downloading: https://repo.maven.apache.org/maven2/org/apache/maven/wagon/wagon-http/1.0-beta-6/wagon-http-1.0-beta-6.pom
[INFO] Downloaded: https://repo.maven.apache.org/maven2/org/apache/maven/wagon/wagon-http/1.0-beta-6/wagon-http-1.0-beta-6.pom (4 KB at 163.1 KB/sec)
[INFO] Downloading: https://repo.maven.apache.org/maven2/org/apache/maven/wagon/wagon-providers/1.0-beta-6/wagon-providers-1.0-beta-6.pom
[INFO] Downloaded: https://repo.maven.apache.org/maven2/org/apache/maven/wagon/wagon-providers/1.0-beta-6/wagon-providers-1.0-beta-6.pom (3 KB at 108.4 KB/sec)
[INFO] Downloading: https://repo.maven.apache.org/maven2/org/apache/maven/wagon/wagon-http-shared/1.0-beta-6/wagon-http-shared-1.0-beta-6.pom
[INFO] Downloaded: https://repo.maven.apache.org/maven2/org/apache/maven/wagon/wagon-http-shared/1.0-beta-6/wagon-http-shared-1.0-beta-6.pom (3 KB at 114.3 KB/sec)
[INFO] Downloading: https://repo.maven.apache.org/maven2/nekohtml/xercesMinimal/1.9.6.2/xercesMinimal-1.9.6.2.pom
[INFO] Downloaded: https://repo.maven.apache.org/maven2/nekohtml/xercesMinimal/1.9.6.2/xercesMinimal-1.9.6.2.pom (390 B at 21.2 KB/sec)
[INFO] Downloading: https://repo.maven.apache.org/maven2/nekohtml/nekohtml/1.9.6.2/nekohtml-1.9.6.2.pom
[INFO] Downloaded: https://repo.maven.apache.org/maven2/nekohtml/nekohtml/1.9.6.2/nekohtml-1.9.6.2.pom (704 B at 40.4 KB/sec)
[INFO] Downloading: https://repo.maven.apache.org/maven2/org/apache/maven/wagon/wagon-webdav-jackrabbit/1.0-beta-6/wagon-webdav-jackrabbit-1.0-beta-6.pom
[INFO] Downloaded: https://repo.maven.apache.org/maven2/org/apache/maven/wagon/wagon-webdav-jackrabbit/1.0-beta-6/wagon-webdav-jackrabbit-1.0-beta-6.pom (4 KB at 171.4 KB/sec)
[INFO] Downloading: https://repo.maven.apache.org/maven2/org/apache/jackrabbit/jackrabbit-webdav/1.5.0/jackrabbit-webdav-1.5.0.pom
[INFO] Downloaded: https://repo.maven.apache.org/maven2/org/apache/jackrabbit/jackrabbit-webdav/1.5.0/jackrabbit-webdav-1.5.0.pom (4 KB at 171.3 KB/sec)
[INFO] Downloading: https://repo.maven.apache.org/maven2/org/apache/jackrabbit/jackrabbit-parent/1.5.0/jackrabbit-parent-1.5.0.pom
[INFO] Downloaded: https://repo.maven.apache.org/maven2/org/apache/jackrabbit/jackrabbit-parent/1.5.0/jackrabbit-parent-1.5.0.pom (25 KB at 1099.2 KB/sec)
[INFO] Downloading: https://repo.maven.apache.org/maven2/org/apache/jackrabbit/jackrabbit-jcr-commons/1.5.0/jackrabbit-jcr-commons-1.5.0.pom
[INFO] Downloaded: https://repo.maven.apache.org/maven2/org/apache/jackrabbit/jackrabbit-jcr-commons/1.5.0/jackrabbit-jcr-commons-1.5.0.pom (3 KB at 153.4 KB/sec)
[INFO] Downloading: https://repo.maven.apache.org/maven2/org/slf4j/slf4j-api/1.5.3/slf4j-api-1.5.3.pom
[INFO] Downloaded: https://repo.maven.apache.org/maven2/org/slf4j/slf4j-api/1.5.3/slf4j-api-1.5.3.pom (3 KB at 161.9 KB/sec)
[INFO] Downloading: https://repo.maven.apache.org/maven2/org/slf4j/slf4j-parent/1.5.3/slf4j-parent-1.5.3.pom
[INFO] Downloaded: https://repo.maven.apache.org/maven2/org/slf4j/slf4j-parent/1.5.3/slf4j-parent-1.5.3.pom (8 KB at 397.7 KB/sec)
[INFO] Downloading: https://repo.maven.apache.org/maven2/commons-httpclient/commons-httpclient/3.0/commons-httpclient-3.0.pom
[INFO] Downloaded: https://repo.maven.apache.org/maven2/commons-httpclient/commons-httpclient/3.0/commons-httpclient-3.0.pom (8 KB at 392.0 KB/sec)
[INFO] Downloading: https://repo.maven.apache.org/maven2/org/slf4j/slf4j-nop/1.5.3/slf4j-nop-1.5.3.pom
[INFO] Downloaded: https://repo.maven.apache.org/maven2/org/slf4j/slf4j-nop/1.5.3/slf4j-nop-1.5.3.pom (2 KB at 79.3 KB/sec)
[INFO] Downloading: https://repo.maven.apache.org/maven2/nekohtml/xercesMinimal/1.9.6.2/xercesMinimal-1.9.6.2.jar
[INFO] Downloading: https://repo.maven.apache.org/maven2/org/apache/maven/wagon/wagon-http-shared/1.0-beta-6/wagon-http-shared-1.0-beta-6.jar
[INFO] Downloading: https://repo.maven.apache.org/maven2/org/apache/maven/wagon/wagon-http/1.0-beta-6/wagon-http-1.0-beta-6.jar
[INFO] Downloading: https://repo.maven.apache.org/maven2/nekohtml/nekohtml/1.9.6.2/nekohtml-1.9.6.2.jar
[INFO] Downloading: https://repo.maven.apache.org/maven2/org/apache/maven/wagon/wagon-provider-api/1.0-beta-6/wagon-provider-api-1.0-beta-6.jar
[INFO] Downloaded: https://repo.maven.apache.org/maven2/nekohtml/nekohtml/1.9.6.2/nekohtml-1.9.6.2.jar (110 KB at 2664.6 KB/sec)
[INFO] Downloading: https://repo.maven.apache.org/maven2/org/apache/maven/wagon/wagon-webdav-jackrabbit/1.0-beta-6/wagon-webdav-jackrabbit-1.0-beta-6.jar
[INFO] Downloaded: https://repo.maven.apache.org/maven2/org/apache/maven/wagon/wagon-provider-api/1.0-beta-6/wagon-provider-api-1.0-beta-6.jar (52 KB at 980.0 KB/sec)
[INFO] Downloading: https://repo.maven.apache.org/maven2/org/apache/jackrabbit/jackrabbit-webdav/1.5.0/jackrabbit-webdav-1.5.0.jar
[INFO] Downloaded: https://repo.maven.apache.org/maven2/org/apache/maven/wagon/wagon-http/1.0-beta-6/wagon-http-1.0-beta-6.jar (11 KB at 133.3 KB/sec)
[INFO] Downloaded: https://repo.maven.apache.org/maven2/org/apache/maven/wagon/wagon-http-shared/1.0-beta-6/wagon-http-shared-1.0-beta-6.jar (25 KB at 321.2 KB/sec)
[INFO] Downloaded: https://repo.maven.apache.org/maven2/nekohtml/xercesMinimal/1.9.6.2/xercesMinimal-1.9.6.2.jar (39 KB at 485.8 KB/sec)
[INFO] Downloading: https://repo.maven.apache.org/maven2/org/apache/jackrabbit/jackrabbit-jcr-commons/1.5.0/jackrabbit-jcr-commons-1.5.0.jar
[INFO] Downloading: https://repo.maven.apache.org/maven2/org/slf4j/slf4j-nop/1.5.3/slf4j-nop-1.5.3.jar
[INFO] Downloaded: https://repo.maven.apache.org/maven2/org/apache/maven/wagon/wagon-webdav-jackrabbit/1.0-beta-6/wagon-webdav-jackrabbit-1.0-beta-6.jar (18 KB at 388.3 KB/sec)
[INFO] Downloaded: https://repo.maven.apache.org/maven2/org/slf4j/slf4j-nop/1.5.3/slf4j-nop-1.5.3.jar (6 KB at 267.3 KB/sec)
[INFO] Downloaded: https://repo.maven.apache.org/maven2/org/apache/jackrabbit/jackrabbit-webdav/1.5.0/jackrabbit-webdav-1.5.0.jar (296 KB at 4228.3 KB/sec)
[INFO] Downloaded: https://repo.maven.apache.org/maven2/org/apache/jackrabbit/jackrabbit-jcr-commons/1.5.0/jackrabbit-jcr-commons-1.5.0.jar (199 KB at 4040.9 KB/sec)

-------------------------------------------------------
 T E S T S
-------------------------------------------------------
Running clazzfish.agent.ClasspathAgentTest
Tests run: 9, Failures: 0, Errors: 0, Skipped: 0, Time elapsed: 0.091 sec - in clazzfish.agent.ClasspathAgentTest
May 17 23:32:41 INFO: ClasspathAgent is ready and registered as MBean "clazzfish.agent:type=ClasspathAgent".
May 17 23:32:41 INFO: you must start class clazzfish.agent.ClasspathAgent as 'javaagent'

Results :

Tests run: 9, Failures: 0, Errors: 0, Skipped: 0

[INFO] 
[INFO] --- jacoco-maven-plugin:0.8.0:report (post-unit-test) @ clazzfish-agent ---
[INFO] Loading execution data file /root/workspace/oboehm/ClazzFish/380428423/agent/target/jacoco.exec
[INFO] Analyzed bundle 'clazzfish-agent' with 3 classes
[INFO]                                                                         
[INFO] ------------------------------------------------------------------------
[INFO] Building clazzfish-monitor 0.8-SNAPSHOT
[INFO] ------------------------------------------------------------------------
[INFO] 
[INFO] --- jacoco-maven-plugin:0.8.0:prepare-agent (prepare-agent) @ clazzfish-monitor ---
[INFO] argLine set to -javaagent:/root/./workspace/oboehm/ClazzFish/380428423/.m2/org/jacoco/org.jacoco.agent/0.8.0/org.jacoco.agent-0.8.0-runtime.jar=destfile=/root/workspace/oboehm/ClazzFish/380428423/monitor/target/jacoco.exec
[INFO] 
[INFO] --- maven-resources-plugin:2.6:resources (default-resources) @ clazzfish-monitor ---
[INFO] Using 'UTF-8' encoding to copy filtered resources.
[INFO] Copying 2 resources
[INFO] 
[INFO] --- maven-compiler-plugin:3.1:compile (default-compile) @ clazzfish-monitor ---
[INFO] Nothing to compile - all classes are up to date
[INFO] 
[INFO] --- maven-resources-plugin:2.6:testResources (default-testResources) @ clazzfish-monitor ---
[INFO] Using 'UTF-8' encoding to copy filtered resources.
[INFO] Copying 5 resources
[INFO] 
[INFO] --- maven-compiler-plugin:3.1:testCompile (default-testCompile) @ clazzfish-monitor ---
[INFO] Nothing to compile - all classes are up to date
[INFO] 
[INFO] --- maven-surefire-plugin:2.19.1:test (default-test) @ clazzfish-monitor ---

-------------------------------------------------------
 T E S T S
-------------------------------------------------------
Running clazzfish.monitor.util.ReflectionHelperTest
23:32:43.330 INFO [main] il.ReflectionHelperTest - found: [protected java.lang.String clazzfish.monitor.util.ReflectionHelperTest.nullString, private final java.lang.String clazzfish.monitor.util.ReflectionHelperTest.privateNullString]
Tests run: 14, Failures: 0, Errors: 0, Skipped: 0, Time elapsed: 0.657 sec - in clazzfish.monitor.util.ReflectionHelperTest
Running clazzfish.monitor.util.ConverterTest
23:32:43.389 INFO [main] itor.util.ConverterTest - s = "ConverterTest$InnerConverterTest@27df5806"
23:32:43.404 INFO [main] itor.util.ConverterTest - file:/with blank/ was converted to file:/with%20blank
23:32:43.439 INFO [main] itor.util.ConverterTest - Checking '/tmp' as URI (file://tmp).
23:32:43.439 INFO [main] itor.util.ConverterTest - Checking dir '/tmp' if it has 'file:/tmp/' as URI.
23:32:43.444 INFO [main] itor.util.ConverterTest - Checking '/usr/lib/jvm/java-8-openjdk-amd64/jre' as URI (file://usr/lib/jvm/java-8-openjdk-amd64/jre).
23:32:43.444 INFO [main] itor.util.ConverterTest - Checking dir '/usr/lib/jvm/java-8-openjdk-amd64/jre' if it has 'file:/usr/lib/jvm/java-8-openjdk-amd64/jre/' as URI.
23:32:43.449 INFO [main] itor.util.ConverterTest - file=/C:/Dokumente und Einstellungen/.m2/hugo.jar
23:32:43.454 INFO [main] itor.util.ConverterTest - /tmp/blubb.jar as URI is file:/tmp/blubb.jar
23:32:43.455 INFO [main] itor.util.ConverterTest - /tmp/blubb.jar!/hello/world as URI is file:/tmp/blubb.jar!/hello/world
Tests run: 34, Failures: 0, Errors: 0, Skipped: 0, Time elapsed: 0.097 sec - in clazzfish.monitor.util.ConverterTest
Running clazzfish.monitor.util.EnvironmentTest
23:32:43.467 INFO [main] or.util.EnvironmentTest - environment name: sun.misc.Launcher
23:32:43.482 INFO [main] or.util.EnvironmentTest - classloader for testing is sun.misc.Launcher$AppClassLoader
23:32:43.483 INFO [main] or.util.EnvironmentTest - Threads are allowed.
Tests run: 10, Failures: 0, Errors: 1, Skipped: 0, Time elapsed: 0.022 sec <<< FAILURE! - in clazzfish.monitor.util.EnvironmentTest
testGetLocalMavenRepositoryDir  Time elapsed: 0.014 sec  <<< ERROR!
java.io.IOException: local maven repository not found in [ /root/.m2/repository, /root/workspace/oboehm/ClazzFish/380428423/monitor/.repository, /root/workspace/oboehm/ClazzFish/380428423/monitor/../.repository ]
	at clazzfish.monitor.util.EnvironmentTest.testGetLocalMavenRepositoryDir(EnvironmentTest.java:131)

Running clazzfish.monitor.util.ClasspathHelperTest
Tests run: 3, Failures: 0, Errors: 0, Skipped: 0, Time elapsed: 0.001 sec - in clazzfish.monitor.util.ClasspathHelperTest
Running clazzfish.monitor.util.ArchivEntryTest
Tests run: 1, Failures: 0, Errors: 1, Skipped: 0, Time elapsed: 0.003 sec <<< FAILURE! - in clazzfish.monitor.util.ArchivEntryTest
clazzfish.monitor.util.ArchivEntryTest  Time elapsed: 0.003 sec  <<< ERROR!
java.io.IOException: local maven repository not found in [ /root/.m2/repository, /root/workspace/oboehm/ClazzFish/380428423/monitor/.repository, /root/workspace/oboehm/ClazzFish/380428423/monitor/../.repository ]
	at clazzfish.monitor.util.ArchivEntryTest.setUpBeforeClass(ArchivEntryTest.java:71)

Running clazzfish.monitor.util.NestedZipFileTest
23:32:43.495 INFO [main] .util.NestedZipFileTest - s = "ZipFile 'src/test/resources/clazzfish/monitor/util/world.war'"
23:32:43.527 INFO [main] .util.NestedZipFileTest - Reading ZipFile 'src/test/resources/clazzfish/monitor/util/world.war'...
23:32:43.527 INFO [main] .util.NestedZipFileTest - ZipFile has entry META-INF/.
23:32:43.528 INFO [main] .util.NestedZipFileTest - ZipFile has entry META-INF/MANIFEST.MF.
23:32:43.528 INFO [main] .util.NestedZipFileTest - ZipFile has entry WEB-INF/.
23:32:43.528 INFO [main] .util.NestedZipFileTest - ZipFile has entry WEB-INF/classes/.
23:32:43.529 INFO [main] .util.NestedZipFileTest - ZipFile has entry WEB-INF/classes/patterntesting/.
23:32:43.529 INFO [main] .util.NestedZipFileTest - ZipFile has entry WEB-INF/classes/patterntesting/sample/.
23:32:43.529 INFO [main] .util.NestedZipFileTest - ZipFile has entry WEB-INF/classes/patterntesting/sample/default.properties.
23:32:43.529 INFO [main] .util.NestedZipFileTest - ZipFile has entry WEB-INF/classes/patterntesting/sample/World.class.
23:32:43.530 INFO [main] .util.NestedZipFileTest - ZipFile has entry WEB-INF/lib/.
23:32:43.530 INFO [main] .util.NestedZipFileTest - ZipFile has entry WEB-INF/lib/commons-logging-1.1.1.jar.
23:32:43.531 INFO [main] .util.NestedZipFileTest - ZipFile has entry WEB-INF/lib/jcl-over-slf4j-1.7.21.jar.
23:32:43.531 INFO [main] .util.NestedZipFileTest - ZipFile has entry WEB-INF/lib/patterntesting-agent-1.6.3.jar.
23:32:43.531 INFO [main] .util.NestedZipFileTest - Reading ZipFile 'src/test/resources/clazzfish/monitor/util/world.war' successfully finished.
23:32:43.533 INFO [main] .util.NestedZipFileTest - Reading ZipFile '/tmp/patterntesting-agent-1.6.3.jar4810157963152546210.zip'...
23:32:43.533 INFO [main] .util.NestedZipFileTest - ZipFile has entry META-INF/.
23:32:43.534 INFO [main] .util.NestedZipFileTest - ZipFile has entry META-INF/MANIFEST.MF.
23:32:43.534 INFO [main] .util.NestedZipFileTest - ZipFile has entry patterntesting/.
23:32:43.534 INFO [main] .util.NestedZipFileTest - ZipFile has entry patterntesting/agent/.
23:32:43.534 INFO [main] .util.NestedZipFileTest - ZipFile has entry patterntesting/agent/logging/.
23:32:43.535 INFO [main] .util.NestedZipFileTest - ZipFile has entry patterntesting/agent/ClasspathAgent.class.
23:32:43.535 INFO [main] .util.NestedZipFileTest - ZipFile has entry patterntesting/agent/ClasspathAgentMBean.class.
23:32:43.535 INFO [main] .util.NestedZipFileTest - ZipFile has entry patterntesting/agent/logging/SingleLineFormatter.class.
23:32:43.535 INFO [main] .util.NestedZipFileTest - ZipFile has entry patterntesting/agent/logging/StdoutHandler.class.
23:32:43.536 INFO [main] .util.NestedZipFileTest - ZipFile has entry patterntesting/agent/logging.properties.
23:32:43.536 INFO [main] .util.NestedZipFileTest - ZipFile has entry META-INF/maven/.
23:32:43.536 INFO [main] .util.NestedZipFileTest - ZipFile has entry META-INF/maven/org.patterntesting/.
23:32:43.536 INFO [main] .util.NestedZipFileTest - ZipFile has entry META-INF/maven/org.patterntesting/patterntesting-agent/.
23:32:43.537 INFO [main] .util.NestedZipFileTest - ZipFile has entry META-INF/maven/org.patterntesting/patterntesting-agent/pom.xml.
23:32:43.537 INFO [main] .util.NestedZipFileTest - ZipFile has entry META-INF/maven/org.patterntesting/patterntesting-agent/pom.properties.
23:32:43.537 INFO [main] .util.NestedZipFileTest - Reading ZipFile '/tmp/patterntesting-agent-1.6.3.jar4810157963152546210.zip' successfully finished.
23:32:43.539 INFO [main] .util.NestedZipFileTest - Reading ZipFile '/tmp/jcl-over-slf4j-1.7.21.jar3423669182668605850.zip'...
23:32:43.539 INFO [main] .util.NestedZipFileTest - ZipFile has entry META-INF/.
23:32:43.539 INFO [main] .util.NestedZipFileTest - ZipFile has entry META-INF/MANIFEST.MF.
23:32:43.539 INFO [main] .util.NestedZipFileTest - ZipFile has entry META-INF/services/.
23:32:43.540 INFO [main] .util.NestedZipFileTest - ZipFile has entry org/.
23:32:43.540 INFO [main] .util.NestedZipFileTest - ZipFile has entry org/apache/.
23:32:43.540 INFO [main] .util.NestedZipFileTest - ZipFile has entry org/apache/commons/.
23:32:43.540 INFO [main] .util.NestedZipFileTest - ZipFile has entry org/apache/commons/logging/.
23:32:43.541 INFO [main] .util.NestedZipFileTest - ZipFile has entry org/apache/commons/logging/impl/.
23:32:43.541 INFO [main] .util.NestedZipFileTest - ZipFile has entry META-INF/services/org.apache.commons.logging.LogFactory.
23:32:43.541 INFO [main] .util.NestedZipFileTest - ZipFile has entry org/apache/commons/logging/impl/NoOpLog.class.
23:32:43.541 INFO [main] .util.NestedZipFileTest - ZipFile has entry org/apache/commons/logging/impl/SimpleLog$1.class.
23:32:43.542 INFO [main] .util.NestedZipFileTest - ZipFile has entry org/apache/commons/logging/impl/SimpleLog.class.
23:32:43.542 INFO [main] .util.NestedZipFileTest - ZipFile has entry org/apache/commons/logging/impl/SLF4JLocationAwareLog.class.
23:32:43.542 INFO [main] .util.NestedZipFileTest - ZipFile has entry org/apache/commons/logging/impl/SLF4JLog.class.
23:32:43.542 INFO [main] .util.NestedZipFileTest - ZipFile has entry org/apache/commons/logging/impl/SLF4JLogFactory.class.
23:32:43.543 INFO [main] .util.NestedZipFileTest - ZipFile has entry org/apache/commons/logging/Log.class.
23:32:43.543 INFO [main] .util.NestedZipFileTest - ZipFile has entry org/apache/commons/logging/LogConfigurationException.class.
23:32:43.544 INFO [main] .util.NestedZipFileTest - ZipFile has entry org/apache/commons/logging/LogFactory.class.
23:32:43.544 INFO [main] .util.NestedZipFileTest - ZipFile has entry META-INF/maven/.
23:32:43.544 INFO [main] .util.NestedZipFileTest - ZipFile has entry META-INF/maven/org.slf4j/.
23:32:43.545 INFO [main] .util.NestedZipFileTest - ZipFile has entry META-INF/maven/org.slf4j/jcl-over-slf4j/.
23:32:43.545 INFO [main] .util.NestedZipFileTest - ZipFile has entry META-INF/maven/org.slf4j/jcl-over-slf4j/pom.xml.
23:32:43.545 INFO [main] .util.NestedZipFileTest - ZipFile has entry META-INF/maven/org.slf4j/jcl-over-slf4j/pom.properties.
23:32:43.545 INFO [main] .util.NestedZipFileTest - Reading ZipFile '/tmp/jcl-over-slf4j-1.7.21.jar3423669182668605850.zip' successfully finished.
Tests run: 6, Failures: 0, Errors: 0, Skipped: 0, Time elapsed: 0.052 sec - in clazzfish.monitor.util.NestedZipFileTest
Running clazzfish.monitor.internal.ClassWalkerTest
23:32:43.560 INFO [main] nternal.ClassWalkerTest - 23 classes found in /root/workspace/oboehm/ClazzFish/380428423/monitor/target/test-classes.
Tests run: 1, Failures: 0, Errors: 0, Skipped: 0, Time elapsed: 0.013 sec - in clazzfish.monitor.internal.ClassWalkerTest
Running clazzfish.monitor.internal.ClasspathDiggerTest
23:32:43.608 INFO [main] nal.ClasspathDiggerTest - unused: /root/workspace/oboehm/ClazzFish/380428423/.m2/org/apache/logging/log4j/log4j-core/2.7/log4j-core-2.7.jar
23:32:43.608 INFO [main] nal.ClasspathDiggerTest - unused: /root/workspace/oboehm/ClazzFish/380428423/.m2/org/jacoco/org.jacoco.agent/0.8.0/org.jacoco.agent-0.8.0-runtime.jar
23:32:43.608 INFO [main] nal.ClasspathDiggerTest - unused: /root/workspace/oboehm/ClazzFish/380428423/.m2/org/apache/maven/surefire/common-java5/2.19.1/common-java5-2.19.1.jar
23:32:43.609 INFO [main] nal.ClasspathDiggerTest - unused: /root/workspace/oboehm/ClazzFish/380428423/.m2/org/junit/jupiter/junit-jupiter-engine/5.0.3/junit-jupiter-engine-5.0.3.jar
23:32:43.609 INFO [main] nal.ClasspathDiggerTest - unused: /root/workspace/oboehm/ClazzFish/380428423/.m2/org/junit/jupiter/junit-jupiter-api/5.2.0/junit-jupiter-api-5.2.0.jar
23:32:43.609 INFO [main] nal.ClasspathDiggerTest - unused: /root/workspace/oboehm/ClazzFish/380428423/.m2/org/slf4j/slf4j-api/1.7.25/slf4j-api-1.7.25.jar
23:32:43.609 INFO [main] nal.ClasspathDiggerTest - unused: /root/workspace/oboehm/ClazzFish/380428423/.m2/org/apache/maven/surefire/surefire-api/2.19.1/surefire-api-2.19.1.jar
23:32:43.610 INFO [main] nal.ClasspathDiggerTest - unused: /root/workspace/oboehm/ClazzFish/380428423/.m2/commons-io/commons-io/2.6/commons-io-2.6.jar
23:32:43.610 INFO [main] nal.ClasspathDiggerTest - unused: /root/workspace/oboehm/ClazzFish/380428423/.m2/org/junit/platform/junit-platform-surefire-provider/1.0.3/junit-platform-surefire-provider-1.0.3.jar
23:32:43.610 INFO [main] nal.ClasspathDiggerTest - unused: /root/workspace/oboehm/ClazzFish/380428423/.m2/org/apache/logging/log4j/log4j-api/2.7/log4j-api-2.7.jar
23:32:43.610 INFO [main] nal.ClasspathDiggerTest - unused: /root/workspace/oboehm/ClazzFish/380428423/.m2/org/apache/tomcat/tomcat-juli/9.0.8/tomcat-juli-9.0.8.jar
23:32:43.611 INFO [main] nal.ClasspathDiggerTest - unused: /root/workspace/oboehm/ClazzFish/380428423/.m2/org/apache/tomcat/tomcat-servlet-api/9.0.8/tomcat-servlet-api-9.0.8.jar
23:32:43.611 INFO [main] nal.ClasspathDiggerTest - unused: /root/workspace/oboehm/ClazzFish/380428423/.m2/org/hamcrest/hamcrest-library/1.3/hamcrest-library-1.3.jar
23:32:43.611 INFO [main] nal.ClasspathDiggerTest - unused: /root/workspace/oboehm/ClazzFish/380428423/.m2/org/apache/logging/log4j/log4j-slf4j-impl/2.7/log4j-slf4j-impl-2.7.jar
23:32:43.611 INFO [main] nal.ClasspathDiggerTest - unused: /root/workspace/oboehm/ClazzFish/380428423/.m2/org/apache/commons/commons-lang3/3.7/commons-lang3-3.7.jar
23:32:43.612 INFO [main] nal.ClasspathDiggerTest - unused: /root/workspace/oboehm/ClazzFish/380428423/.m2/org/apache/tomcat/tomcat-catalina/9.0.8/tomcat-catalina-9.0.8.jar
23:32:43.612 INFO [main] nal.ClasspathDiggerTest - unused: /root/workspace/oboehm/ClazzFish/380428423/.m2/org/apiguardian/apiguardian-api/1.0.0/apiguardian-api-1.0.0.jar
23:32:43.612 INFO [main] nal.ClasspathDiggerTest - unused: /root/workspace/oboehm/ClazzFish/380428423/.m2/org/junit/platform/junit-platform-commons/1.2.0/junit-platform-commons-1.2.0.jar
23:32:43.612 INFO [main] nal.ClasspathDiggerTest - unused: /root/workspace/oboehm/ClazzFish/380428423/.m2/org/apache/tomcat/tomcat-util/9.0.8/tomcat-util-9.0.8.jar
23:32:43.613 INFO [main] nal.ClasspathDiggerTest - unused: /root/workspace/oboehm/ClazzFish/380428423/.m2/org/apache/tomcat/tomcat-api/9.0.8/tomcat-api-9.0.8.jar
23:32:43.613 INFO [main] nal.ClasspathDiggerTest - unused: /root/workspace/oboehm/ClazzFish/380428423/.m2/org/hamcrest/hamcrest-core/1.3/hamcrest-core-1.3.jar
23:32:43.613 INFO [main] nal.ClasspathDiggerTest - unused: /root/workspace/oboehm/ClazzFish/380428423/.m2/org/junit/platform/junit-platform-engine/1.0.3/junit-platform-engine-1.0.3.jar
23:32:43.613 INFO [main] nal.ClasspathDiggerTest - unused: /root/workspace/oboehm/ClazzFish/380428423/.m2/org/apache/maven/surefire/surefire-booter/2.19.1/surefire-booter-2.19.1.jar
23:32:43.614 INFO [main] nal.ClasspathDiggerTest - unused: /root/workspace/oboehm/ClazzFish/380428423/.m2/org/opentest4j/opentest4j/1.1.0/opentest4j-1.1.0.jar
23:32:43.614 INFO [main] nal.ClasspathDiggerTest - unused: /root/workspace/oboehm/ClazzFish/380428423/.m2/org/junit/platform/junit-platform-launcher/1.0.3/junit-platform-launcher-1.0.3.jar
23:32:43.614 INFO [main] nal.ClasspathDiggerTest - not in java.class.path: /root/workspace/oboehm/ClazzFish/380428423/monitor/target/classes
23:32:43.614 INFO [main] nal.ClasspathDiggerTest - not in java.class.path: /root/./workspace/oboehm/ClazzFish/380428423/.m2/org/apache/commons/commons-lang3/3.7/commons-lang3-3.7.jar
23:32:43.615 INFO [main] nal.ClasspathDiggerTest - not in java.class.path: /root/./workspace/oboehm/ClazzFish/380428423/.m2/commons-io/commons-io/2.6/commons-io-2.6.jar
23:32:43.615 INFO [main] nal.ClasspathDiggerTest - not in java.class.path: /root/./workspace/oboehm/ClazzFish/380428423/.m2/org/slf4j/slf4j-api/1.7.25/slf4j-api-1.7.25.jar
23:32:43.615 INFO [main] nal.ClasspathDiggerTest - not in java.class.path: /root/./workspace/oboehm/ClazzFish/380428423/.m2/org/apache/logging/log4j/log4j-slf4j-impl/2.7/log4j-slf4j-impl-2.7.jar
23:32:43.615 INFO [main] nal.ClasspathDiggerTest - not in java.class.path: /root/./workspace/oboehm/ClazzFish/380428423/.m2/org/apache/logging/log4j/log4j-api/2.7/log4j-api-2.7.jar
23:32:43.616 INFO [main] nal.ClasspathDiggerTest - not in java.class.path: /root/./workspace/oboehm/ClazzFish/380428423/.m2/org/apache/logging/log4j/log4j-core/2.7/log4j-core-2.7.jar
23:32:43.616 INFO [main] nal.ClasspathDiggerTest - not in java.class.path: /root/./workspace/oboehm/ClazzFish/380428423/.m2/org/apache/tomcat/tomcat-catalina/9.0.8/tomcat-catalina-9.0.8.jar
23:32:43.616 INFO [main] nal.ClasspathDiggerTest - not in java.class.path: /root/./workspace/oboehm/ClazzFish/380428423/.m2/org/apache/tomcat/tomcat-servlet-api/9.0.8/tomcat-servlet-api-9.0.8.jar
23:32:43.616 INFO [main] nal.ClasspathDiggerTest - not in java.class.path: /root/./workspace/oboehm/ClazzFish/380428423/.m2/org/apache/tomcat/tomcat-jsp-api/9.0.8/tomcat-jsp-api-9.0.8.jar
23:32:43.617 INFO [main] nal.ClasspathDiggerTest - not in java.class.path: /root/./workspace/oboehm/ClazzFish/380428423/.m2/org/apache/tomcat/tomcat-el-api/9.0.8/tomcat-el-api-9.0.8.jar
23:32:43.617 INFO [main] nal.ClasspathDiggerTest - not in java.class.path: /root/./workspace/oboehm/ClazzFish/380428423/.m2/org/apache/tomcat/tomcat-juli/9.0.8/tomcat-juli-9.0.8.jar
23:32:43.617 INFO [main] nal.ClasspathDiggerTest - not in java.class.path: /root/./workspace/oboehm/ClazzFish/380428423/.m2/org/apache/tomcat/tomcat-annotations-api/9.0.8/tomcat-annotations-api-9.0.8.jar
23:32:43.617 INFO [main] nal.ClasspathDiggerTest - not in java.class.path: /root/./workspace/oboehm/ClazzFish/380428423/.m2/org/apache/tomcat/tomcat-api/9.0.8/tomcat-api-9.0.8.jar
23:32:43.618 INFO [main] nal.ClasspathDiggerTest - not in java.class.path: /root/./workspace/oboehm/ClazzFish/380428423/.m2/org/apache/tomcat/tomcat-jni/9.0.8/tomcat-jni-9.0.8.jar
23:32:43.618 INFO [main] nal.ClasspathDiggerTest - not in java.class.path: /root/./workspace/oboehm/ClazzFish/380428423/.m2/org/apache/tomcat/tomcat-coyote/9.0.8/tomcat-coyote-9.0.8.jar
23:32:43.618 INFO [main] nal.ClasspathDiggerTest - not in java.class.path: /root/./workspace/oboehm/ClazzFish/380428423/.m2/org/apache/tomcat/tomcat-util/9.0.8/tomcat-util-9.0.8.jar
23:32:43.618 INFO [main] nal.ClasspathDiggerTest - not in java.class.path: /root/./workspace/oboehm/ClazzFish/380428423/.m2/org/apache/tomcat/tomcat-util-scan/9.0.8/tomcat-util-scan-9.0.8.jar
23:32:43.619 INFO [main] nal.ClasspathDiggerTest - not in java.class.path: /root/./workspace/oboehm/ClazzFish/380428423/.m2/org/apache/tomcat/tomcat-jaspic-api/9.0.8/tomcat-jaspic-api-9.0.8.jar
23:32:43.619 INFO [main] nal.ClasspathDiggerTest - not in java.class.path: /root/./workspace/oboehm/ClazzFish/380428423/.m2/commons-logging/commons-logging/1.1.1/commons-logging-1.1.1.jar
23:32:43.619 INFO [main] nal.ClasspathDiggerTest - not in java.class.path: /root/./workspace/oboehm/ClazzFish/380428423/.m2/org/junit/jupiter/junit-jupiter-api/5.2.0/junit-jupiter-api-5.2.0.jar
23:32:43.619 INFO [main] nal.ClasspathDiggerTest - not in java.class.path: /root/./workspace/oboehm/ClazzFish/380428423/.m2/org/apiguardian/apiguardian-api/1.0.0/apiguardian-api-1.0.0.jar
23:32:43.620 INFO [main] nal.ClasspathDiggerTest - not in java.class.path: /root/./workspace/oboehm/ClazzFish/380428423/.m2/org/opentest4j/opentest4j/1.1.0/opentest4j-1.1.0.jar
23:32:43.620 INFO [main] nal.ClasspathDiggerTest - not in java.class.path: /root/./workspace/oboehm/ClazzFish/380428423/.m2/org/junit/platform/junit-platform-commons/1.2.0/junit-platform-commons-1.2.0.jar
23:32:43.620 INFO [main] nal.ClasspathDiggerTest - not in java.class.path: /root/./workspace/oboehm/ClazzFish/380428423/.m2/org/hamcrest/hamcrest-library/1.3/hamcrest-library-1.3.jar
23:32:43.620 INFO [main] nal.ClasspathDiggerTest - not in java.class.path: /root/./workspace/oboehm/ClazzFish/380428423/.m2/org/hamcrest/hamcrest-core/1.3/hamcrest-core-1.3.jar
23:32:43.620 INFO [main] nal.ClasspathDiggerTest - not in java.class.path: /root/./workspace/oboehm/ClazzFish/380428423/.m2/org/mockito/mockito-core/2.18.3/mockito-core-2.18.3.jar
23:32:43.621 INFO [main] nal.ClasspathDiggerTest - not in java.class.path: /root/./workspace/oboehm/ClazzFish/380428423/.m2/net/bytebuddy/byte-buddy/1.8.5/byte-buddy-1.8.5.jar
23:32:43.621 INFO [main] nal.ClasspathDiggerTest - not in java.class.path: /root/./workspace/oboehm/ClazzFish/380428423/.m2/net/bytebuddy/byte-buddy-agent/1.8.5/byte-buddy-agent-1.8.5.jar
23:32:43.621 INFO [main] nal.ClasspathDiggerTest - not in java.class.path: /root/./workspace/oboehm/ClazzFish/380428423/.m2/org/objenesis/objenesis/2.6/objenesis-2.6.jar
23:32:44.491 INFO [main] nal.ClasspathDiggerTest - 4 resources loaded.
23:32:44.510 INFO [main] nal.ClasspathDiggerTest - 358 packages found, 313 packages loaded.
23:32:44.521 INFO [main] nal.ClasspathDiggerTest - 1. path: /root/workspace/oboehm/ClazzFish/380428423/monitor/target/test-classes
23:32:44.521 INFO [main] nal.ClasspathDiggerTest - 2. path: /root/workspace/oboehm/ClazzFish/380428423/monitor/target/classes
23:32:44.522 INFO [main] nal.ClasspathDiggerTest - 3. path: /root/./workspace/oboehm/ClazzFish/380428423/.m2/org/apache/commons/commons-lang3/3.7/commons-lang3-3.7.jar
23:32:44.522 INFO [main] nal.ClasspathDiggerTest - 4. path: /root/./workspace/oboehm/ClazzFish/380428423/.m2/commons-io/commons-io/2.6/commons-io-2.6.jar
23:32:44.522 INFO [main] nal.ClasspathDiggerTest - 5. path: /root/./workspace/oboehm/ClazzFish/380428423/.m2/org/slf4j/slf4j-api/1.7.25/slf4j-api-1.7.25.jar
23:32:44.522 INFO [main] nal.ClasspathDiggerTest - 6. path: /root/./workspace/oboehm/ClazzFish/380428423/.m2/org/apache/logging/log4j/log4j-slf4j-impl/2.7/log4j-slf4j-impl-2.7.jar
23:32:44.523 INFO [main] nal.ClasspathDiggerTest - 7. path: /root/./workspace/oboehm/ClazzFish/380428423/.m2/org/apache/logging/log4j/log4j-api/2.7/log4j-api-2.7.jar
23:32:44.523 INFO [main] nal.ClasspathDiggerTest - 8. path: /root/./workspace/oboehm/ClazzFish/380428423/.m2/org/apache/logging/log4j/log4j-core/2.7/log4j-core-2.7.jar
23:32:44.523 INFO [main] nal.ClasspathDiggerTest - 9. path: /root/./workspace/oboehm/ClazzFish/380428423/.m2/org/apache/tomcat/tomcat-catalina/9.0.8/tomcat-catalina-9.0.8.jar
23:32:44.523 INFO [main] nal.ClasspathDiggerTest - 10. path: /root/./workspace/oboehm/ClazzFish/380428423/.m2/org/apache/tomcat/tomcat-servlet-api/9.0.8/tomcat-servlet-api-9.0.8.jar
23:32:44.523 INFO [main] nal.ClasspathDiggerTest - 11. path: /root/./workspace/oboehm/ClazzFish/380428423/.m2/org/apache/tomcat/tomcat-jsp-api/9.0.8/tomcat-jsp-api-9.0.8.jar
23:32:44.524 INFO [main] nal.ClasspathDiggerTest - 12. path: /root/./workspace/oboehm/ClazzFish/380428423/.m2/org/apache/tomcat/tomcat-el-api/9.0.8/tomcat-el-api-9.0.8.jar
23:32:44.524 INFO [main] nal.ClasspathDiggerTest - 13. path: /root/./workspace/oboehm/ClazzFish/380428423/.m2/org/apache/tomcat/tomcat-juli/9.0.8/tomcat-juli-9.0.8.jar
23:32:44.524 INFO [main] nal.ClasspathDiggerTest - 14. path: /root/./workspace/oboehm/ClazzFish/380428423/.m2/org/apache/tomcat/tomcat-annotations-api/9.0.8/tomcat-annotations-api-9.0.8.jar
23:32:44.524 INFO [main] nal.ClasspathDiggerTest - 15. path: /root/./workspace/oboehm/ClazzFish/380428423/.m2/org/apache/tomcat/tomcat-api/9.0.8/tomcat-api-9.0.8.jar
23:32:44.525 INFO [main] nal.ClasspathDiggerTest - 16. path: /root/./workspace/oboehm/ClazzFish/380428423/.m2/org/apache/tomcat/tomcat-jni/9.0.8/tomcat-jni-9.0.8.jar
23:32:44.525 INFO [main] nal.ClasspathDiggerTest - 17. path: /root/./workspace/oboehm/ClazzFish/380428423/.m2/org/apache/tomcat/tomcat-coyote/9.0.8/tomcat-coyote-9.0.8.jar
23:32:44.525 INFO [main] nal.ClasspathDiggerTest - 18. path: /root/./workspace/oboehm/ClazzFish/380428423/.m2/org/apache/tomcat/tomcat-util/9.0.8/tomcat-util-9.0.8.jar
23:32:44.525 INFO [main] nal.ClasspathDiggerTest - 19. path: /root/./workspace/oboehm/ClazzFish/380428423/.m2/org/apache/tomcat/tomcat-util-scan/9.0.8/tomcat-util-scan-9.0.8.jar
23:32:44.525 INFO [main] nal.ClasspathDiggerTest - 20. path: /root/./workspace/oboehm/ClazzFish/380428423/.m2/org/apache/tomcat/tomcat-jaspic-api/9.0.8/tomcat-jaspic-api-9.0.8.jar
23:32:44.526 INFO [main] nal.ClasspathDiggerTest - 21. path: /root/./workspace/oboehm/ClazzFish/380428423/.m2/commons-logging/commons-logging/1.1.1/commons-logging-1.1.1.jar
23:32:44.526 INFO [main] nal.ClasspathDiggerTest - 22. path: /root/./workspace/oboehm/ClazzFish/380428423/.m2/org/junit/jupiter/junit-jupiter-api/5.2.0/junit-jupiter-api-5.2.0.jar
23:32:44.526 INFO [main] nal.ClasspathDiggerTest - 23. path: /root/./workspace/oboehm/ClazzFish/380428423/.m2/org/apiguardian/apiguardian-api/1.0.0/apiguardian-api-1.0.0.jar
23:32:44.526 INFO [main] nal.ClasspathDiggerTest - 24. path: /root/./workspace/oboehm/ClazzFish/380428423/.m2/org/opentest4j/opentest4j/1.1.0/opentest4j-1.1.0.jar
23:32:44.527 INFO [main] nal.ClasspathDiggerTest - 25. path: /root/./workspace/oboehm/ClazzFish/380428423/.m2/org/junit/platform/junit-platform-commons/1.2.0/junit-platform-commons-1.2.0.jar
23:32:44.527 INFO [main] nal.ClasspathDiggerTest - 26. path: /root/./workspace/oboehm/ClazzFish/380428423/.m2/org/hamcrest/hamcrest-library/1.3/hamcrest-library-1.3.jar
23:32:44.527 INFO [main] nal.ClasspathDiggerTest - 27. path: /root/./workspace/oboehm/ClazzFish/380428423/.m2/org/hamcrest/hamcrest-core/1.3/hamcrest-core-1.3.jar
23:32:44.527 INFO [main] nal.ClasspathDiggerTest - 28. path: /root/./workspace/oboehm/ClazzFish/380428423/.m2/org/mockito/mockito-core/2.18.3/mockito-core-2.18.3.jar
23:32:44.527 INFO [main] nal.ClasspathDiggerTest - 29. path: /root/./workspace/oboehm/ClazzFish/380428423/.m2/net/bytebuddy/byte-buddy/1.8.5/byte-buddy-1.8.5.jar
23:32:44.528 INFO [main] nal.ClasspathDiggerTest - 30. path: /root/./workspace/oboehm/ClazzFish/380428423/.m2/net/bytebuddy/byte-buddy-agent/1.8.5/byte-buddy-agent-1.8.5.jar
23:32:44.528 INFO [main] nal.ClasspathDiggerTest - 31. path: /root/./workspace/oboehm/ClazzFish/380428423/.m2/org/objenesis/objenesis/2.6/objenesis-2.6.jar
23:32:44.569 INFO [main] nal.ClasspathDiggerTest - 1948 classes loaded.
23:32:44.586 INFO [main] nal.ClasspathDiggerTest - 313 packages loaded
23:32:44.588 INFO [main] nal.ClasspathDiggerTest - ClasspathDigger for sun.misc.Launcher$AppClassLoader@18b4aac2 supports the given classloader
Tests run: 18, Failures: 2, Errors: 0, Skipped: 0, Time elapsed: 1.027 sec <<< FAILURE! - in clazzfish.monitor.internal.ClasspathDiggerTest
testEarWarJar  Time elapsed: 0.005 sec  <<< FAILURE!
java.lang.AssertionError: 

Expected: a collection containing "clazzfish.agent.ClasspathAgent"
     but: was "patterntesting.agent.ClasspathAgent", was "patterntesting.agent.ClasspathAgentMBean", was "patterntesting.agent.logging.SingleLineFormatter", was "patterntesting.agent.logging.StdoutHandler"
	at clazzfish.monitor.internal.ClasspathDiggerTest.checkGetClasses(ClasspathDiggerTest.java:349)
	at clazzfish.monitor.internal.ClasspathDiggerTest.testEarWarJar(ClasspathDiggerTest.java:332)

testWarJar  Time elapsed: 0.006 sec  <<< FAILURE!
java.lang.AssertionError: 

Expected: a collection containing "clazzfish.agent.ClasspathAgent"
     but: was "patterntesting.agent.ClasspathAgent", was "patterntesting.agent.ClasspathAgentMBean", was "patterntesting.agent.logging.SingleLineFormatter", was "patterntesting.agent.logging.StdoutHandler"
	at clazzfish.monitor.internal.ClasspathDiggerTest.checkGetClasses(ClasspathDiggerTest.java:349)
	at clazzfish.monitor.internal.ClasspathDiggerTest.testWarJar(ClasspathDiggerTest.java:319)

Running clazzfish.monitor.internal.ResourceWalkerTest
23:32:44.596 INFO [main] rnal.ResourceWalkerTest - 1 resources found: [/log4j2.xml]
23:32:44.600 INFO [main] rnal.ResourceWalkerTest - 5 resources found: [/META-INF/MANIFEST.MF, /clazzfish/monitor/util/test.properties, /clazzfish/monitor/util/world.ear, /clazzfish/monitor/util/world.war, /log4j2.xml]
23:32:44.602 INFO [main] rnal.ResourceWalkerTest - 9 packages found: [META-INF/, clazzfish/, clazzfish/monitor/, clazzfish/monitor/util/, clazzfish/monitor/internal/, clazzfish/monitor/io/, clazzfish/monitor/loader/, clazzfish/monitor/exception/, clazzfish/monitor/jmx/]
Tests run: 3, Failures: 0, Errors: 0, Skipped: 0, Time elapsed: 0.012 sec - in clazzfish.monitor.internal.ResourceWalkerTest
Running clazzfish.monitor.internal.ResourcepathDiggerTest
Tests run: 7, Failures: 0, Errors: 0, Skipped: 0, Time elapsed: 0.011 sec - in clazzfish.monitor.internal.ResourcepathDiggerTest
Running clazzfish.monitor.internal.DoubletDiggerTest
23:32:44.620 INFO [main] ernal.DoubletDiggerTest - s = "DoubletDigger for sun.misc.Launcher$AppClassLoader@18b4aac2"
Tests run: 2, Failures: 0, Errors: 0, Skipped: 0, Time elapsed: 0.004 sec - in clazzfish.monitor.internal.DoubletDiggerTest
Running clazzfish.monitor.io.ExtendedFileTest
23:32:44.623 INFO [main] tor.io.ExtendedFileTest - File '/tmp/dummy1790689944945597965.tst' was created for testing.
23:32:44.625 INFO [main] tor.io.ExtendedFileTest - Test is run only on Mac.
23:32:44.786 INFO [main] tor.io.ExtendedFileTest - file 'src/test/RESOURCES/log4j2.xml' does not exist - do you mean 'src/test/resources/log4j2.xml'?
23:32:44.787 INFO [main] tor.io.ExtendedFileTest - file 'src/test/resources/log4j2.XML' does not exist - do you mean 'src/test/resources/log4j2.xml'?
23:32:44.790 INFO [main] tor.io.ExtendedFileTest - file 'SRC/test/resources/log4j2.xml' does not exist - do you mean 'src/test/resources/log4j2.xml'?
23:32:44.792 INFO [main] tor.io.ExtendedFileTest - File '/tmp/dummy1790689944945597965.tst' will be deleted on exit.
Tests run: 10, Failures: 0, Errors: 0, Skipped: 0, Time elapsed: 0.169 sec - in clazzfish.monitor.io.ExtendedFileTest
Running clazzfish.monitor.ClassloaderTypeTest
23:32:44.794 INFO [main] tor.ClassloaderTypeTest - Type of java.net.URLClassLoader@2040732f is NET.
23:32:44.798 INFO [main] tor.ClassloaderTypeTest - Type of sun.misc.Launcher$AppClassLoader@18b4aac2 is SUN.
23:32:44.799 INFO [main] tor.ClassloaderTypeTest - Type of clazzfish.monitor.loader.CompoundClassLoader@533690d is WEBSPHERE.
Tests run: 7, Failures: 0, Errors: 0, Skipped: 0, Time elapsed: 0.006 sec - in clazzfish.monitor.ClassloaderTypeTest
Running clazzfish.monitor.ResourcepathMonitorTest
23:32:44.816 INFO [main] monitor.AbstractMonitor - Attributes will be dumped to dir '/tmp/ResourcepathMonitor@jhb1x01y'.
23:32:44.971 INFO [main] monitor.AbstractMonitor - Thread[Thread-2,5,main] was dumped to '/tmp/ResourcepathMonitor@jhb1x01y'.
23:32:44.972 INFO [main] tor.AbstractMonitorTest - testAddAsShutdownHook() is started with Thread[Thread-2,5,main].
23:32:44.993 INFO [main] ResourcepathMonitorTest - 10 doublets found
23:32:45.032 INFO [main] ResourcepathMonitorTest - testWhichInvalidResource() is started.
23:32:45.035 INFO [main] ResourcepathMonitorTest - firstDoublet = jar:file:/root/./workspace/oboehm/ClazzFish/380428423/.m2/org/apache/commons/commons-lang3/3.7/commons-lang3-3.7.jar!/META-INF/LICENSE.txt
23:32:45.036 INFO [main] ResourcepathMonitorTest - testRegisterAsMBean() is started.
23:32:45.056 INFO [main] ResourcepathMonitorTest - 6 incompatible resources found.
23:32:45.094 INFO [main] ResourcepathMonitorTest - testIsDoubletNirwana() is started.
23:32:45.115 INFO [main] ResourcepathMonitorTest - 2 incompatible classpath entries found.
23:32:45.116 INFO [main] ResourcepathMonitorTest - testWhichResource() is started.
23:32:45.135 INFO [main] ResourcepathMonitorTest - 33 pathes with doublet resources found.
23:32:45.135 INFO [main] ResourcepathMonitorTest - testGetNoResourcesMultiple() is started.
23:32:45.136 INFO [main] ResourcepathMonitorTest - 55 META-INF/MANIFEST.MF entries found in classpath.
23:32:45.137 INFO [main] tor.AbstractMonitorTest - testDumpMe() is started with Thread[Thread-2,5,main].
23:32:45.137 INFO [main] monitor.AbstractMonitor - Attributes will be dumped to dir '/tmp/ResourcepathMonitor@jhb1x0b5'.
23:32:45.246 INFO [main] tor.AbstractMonitorTest - Result was dumped to '/tmp/ResourcepathMonitor@jhb1x0b5'.
23:32:45.252 INFO [main] tor.AbstractMonitorTest - Directory '/tmp/ResourcepathMonitor@jhb1x0b5' is deleted.
23:32:45.252 INFO [main] monitor.AbstractMonitor - Attributes will be dumped to dir 'target/dump'.
23:32:45.347 INFO [main] tor.AbstractMonitorTest - Result was dumped to 'target/dump'.
23:32:45.348 INFO [main] tor.AbstractMonitorTest - Directory 'target/dump' is deleted.
23:32:45.349 INFO [main] ResourcepathMonitorTest - testIsDoublet() is started.
23:32:45.349 INFO [main] ResourcepathMonitorTest - testGetNoResources() is started.
Tests run: 21, Failures: 0, Errors: 0, Skipped: 0, Time elapsed: 0.548 sec - in clazzfish.monitor.ResourcepathMonitorTest
Running clazzfish.monitor.exception.NotFoundExceptionTest
Tests run: 4, Failures: 0, Errors: 0, Skipped: 0, Time elapsed: 0 sec - in clazzfish.monitor.exception.NotFoundExceptionTest
Running clazzfish.monitor.jmx.MBeanHelperTest
Tests run: 7, Failures: 0, Errors: 0, Skipped: 0, Time elapsed: 0.002 sec - in clazzfish.monitor.jmx.MBeanHelperTest
Running clazzfish.monitor.ClasspathMonitorTest
23:32:45.361 INFO [main] or.ClasspathMonitorTest - ClasspathMonitorTest is set up with ClasspathMonitor for sun.misc.Launcher$AppClassLoader@18b4aac2.
23:32:45.362 INFO [main] monitor.AbstractMonitor - Attributes will be dumped to dir '/tmp/ClasspathMonitor@jhb1x0he'.
23:32:45.791 INFO [main] monitor.AbstractMonitor - ClasspathMonitor for sun.misc.Launcher$AppClassLoader@18b4aac2 was dumped to '/tmp/ClasspathMonitor@jhb1x0he'.
23:32:45.792 INFO [main] tor.AbstractMonitorTest - testAddAsShutdownHook() is started with ClasspathMonitor for sun.misc.Launcher$AppClassLoader@18b4aac2.
23:32:45.794 INFO [main] or.ClasspathMonitorTest - testGetNoClasses() is started.
23:32:45.795 INFO [main] or.ClasspathMonitorTest - The class java.lang.String is found in jar:file:/usr/lib/jvm/java-8-openjdk-amd64/jre/lib/rt.jar!/java/lang/String.class.
23:32:45.796 INFO [main] or.ClasspathMonitorTest - testGetUsedClasspathSetPerformance() is started.
23:32:45.798 INFO [main] or.ClasspathMonitorTest - 1. call of getUsedClasspathSet() needed 2 ms.
23:32:45.799 INFO [main] or.ClasspathMonitorTest - testGetUsedClasspath() is started.
23:32:45.801 INFO [main] or.ClasspathMonitorTest - testIntersectionOfUsedAndUnusedClasspath() is started.
23:32:45.804 INFO [main] or.ClasspathMonitorTest - No conflict between used (30 entries) and unused (9 entries) found.
23:32:45.804 INFO [main] or.ClasspathMonitorTest - testGetDoublets() is started.
23:32:45.806 INFO [main] or.ClasspathMonitorTest - 67 doublets found
23:32:45.807 INFO [main] or.ClasspathMonitorTest - testGetUnusedClasspath() is started.
23:32:45.808 INFO [main] or.ClasspathMonitorTest - testRegisterAsMBean() is started.
23:32:45.809 INFO [main] or.ClasspathMonitorTest - testGetClassloaderDetails() is started.
23:32:45.815 INFO [main] or.ClasspathMonitorTest - testGetResources() is started.
23:32:45.816 INFO [main] or.ClasspathMonitorTest - testGetIncompatibleClasses() is started.
23:32:45.827 INFO [main] or.ClasspathMonitorTest - 26 incompatible classes found: [ class org.junit.jupiter.api.AssertEquals, class org.junit.jupiter.api.AssertFalse, class org.junit.jupiter.api.AssertNotNull, class org.junit.jupiter.api.AssertNull, class org.junit.jupiter.api.AssertThrows, class org.junit.jupiter.api.AssertTrue, class org.junit.jupiter.api.AssertionUtils, class org.junit.jupiter.api.Assertions, class org.junit.jupiter.api.TestInstance$Lifecycle, class org.junit.platform.commons.logging.LoggerFactory, class org.junit.platform.commons.logging.LoggerFactory$DelegatingLogger, class org.junit.platform.commons.util.AnnotationUtils, class org.junit.platform.commons.util.AnnotationUtils$AnnotationCacheKey, class org.junit.platform.commons.util.ClassLoaderUtils, class org.junit.platform.commons.util.ClassUtils, class org.junit.platform.commons.util.ClasspathScanner, class org.junit.platform.commons.util.CollectionUtils, class org.junit.platform.commons.util.ExceptionUtils, class org.junit.platform.commons.util.Preconditions, class org.junit.platform.commons.util.ReflectionUtils, class org.junit.platform.commons.util.ReflectionUtils$HierarchyTraversalMode, class org.junit.platform.commons.util.StringUtils, class org.opentest4j.AssertionFailedError, interface org.junit.jupiter.api.extension.ExtensionContext, interface org.junit.jupiter.api.extension.ExtensionContext$Store, interface org.junit.jupiter.api.extension.ParameterContext ]
23:32:45.838 INFO [main] or.ClasspathMonitorTest - testRegisterAsMBeanString() is started.
23:32:45.839 INFO [main] or.ClasspathMonitorTest - testGetBootClasspath() is started.
23:32:45.840 INFO [main] or.ClasspathMonitorTest - class java.lang.String found in /usr/lib/jvm/java-8-openjdk-amd64/jre/lib/rt.jar.
23:32:45.840 INFO [main] or.ClasspathMonitorTest - testGetCommonsLangManifestEntries() is started.
23:32:45.841 INFO [main] or.ClasspathMonitorTest - Manifest entries for class org.apache.commons.lang3.StringUtils
23:32:45.841 INFO [main] or.ClasspathMonitorTest - Bundle-License: https://www.apache.org/licenses/LICENSE-2.0.txt
23:32:45.841 INFO [main] or.ClasspathMonitorTest - Bundle-SymbolicName: org.apache.commons.lang3
23:32:45.842 INFO [main] or.ClasspathMonitorTest - Archiver-Version: Plexus Archiver
23:32:45.842 INFO [main] or.ClasspathMonitorTest - Built-By: ggregory
23:32:45.842 INFO [main] or.ClasspathMonitorTest - Bnd-LastModified: 1509819256170
23:32:45.842 INFO [main] or.ClasspathMonitorTest - Implementation-Vendor-Id: org.apache.commons
23:32:45.842 INFO [main] or.ClasspathMonitorTest - Specification-Title: Apache Commons Lang
23:32:45.843 INFO [main] or.ClasspathMonitorTest - Bundle-DocURL: http://commons.apache.org/proper/commons-lang/
23:32:45.843 INFO [main] or.ClasspathMonitorTest - Include-Resource: META-INF/LICENSE.txt=LICENSE.txt,META-INF/NOTICE.txt=NOTICE.txt
23:32:45.843 INFO [main] or.ClasspathMonitorTest - Require-Capability: osgi.ee;filter:="(&(osgi.ee=JavaSE)(version=1.7))"
23:32:45.843 INFO [main] or.ClasspathMonitorTest - Export-Package: org.apache.commons.lang3;version="3.7",org.apache.commons.lang3.arch;version="3.7",org.apache.commons.lang3.builder;version="3.7",org.apache.commons.lang3.concurrent;version="3.7",org.apache.commons.lang3.event;version="3.7",org.apache.commons.lang3.exception;version="3.7",org.apache.commons.lang3.math;version="3.7",org.apache.commons.lang3.mutable;version="3.7",org.apache.commons.lang3.reflect;version="3.7",org.apache.commons.lang3.text;version="3.7",org.apache.commons.lang3.text.translate;version="3.7",org.apache.commons.lang3.time;version="3.7",org.apache.commons.lang3.tuple;version="3.7"
23:32:45.843 INFO [main] or.ClasspathMonitorTest - Bundle-Name: Apache Commons Lang
23:32:45.843 INFO [main] or.ClasspathMonitorTest - Implementation-Title: Apache Commons Lang
23:32:45.844 INFO [main] or.ClasspathMonitorTest - Bundle-Description: Apache Commons Lang, a package of Java utility classes for the  classes that are in java.lang's hierarchy, or are considered to be so  standard as to justify existence in java.lang.
23:32:45.844 INFO [main] or.ClasspathMonitorTest - Automatic-Module-Name: org.apache.commons.lang3
23:32:45.844 INFO [main] or.ClasspathMonitorTest - Implementation-Version: 3.7
23:32:45.844 INFO [main] or.ClasspathMonitorTest - Specification-Vendor: The Apache Software Foundation
23:32:45.844 INFO [main] or.ClasspathMonitorTest - Bundle-ManifestVersion: 2
23:32:45.844 INFO [main] or.ClasspathMonitorTest - Bundle-Vendor: The Apache Software Foundation
23:32:45.845 INFO [main] or.ClasspathMonitorTest - Tool: Bnd-3.0.0.201509101326
23:32:45.845 INFO [main] or.ClasspathMonitorTest - Manifest-Version: 1.0
23:32:45.845 INFO [main] or.ClasspathMonitorTest - Implementation-Vendor: The Apache Software Foundation
23:32:45.845 INFO [main] or.ClasspathMonitorTest - Bundle-Version: 3.7.0
23:32:45.845 INFO [main] or.ClasspathMonitorTest - Created-By: Apache Maven Bundle Plugin
23:32:45.845 INFO [main] or.ClasspathMonitorTest - Implementation-URL: http://commons.apache.org/proper/commons-lang/
23:32:45.846 INFO [main] or.ClasspathMonitorTest - Build-Jdk: 1.7.0_80
23:32:45.846 INFO [main] or.ClasspathMonitorTest - Specification-Version: 3.7
23:32:45.846 INFO [main] or.ClasspathMonitorTest - testIsDoubletClass() is started.
23:32:45.847 INFO [main] or.ClasspathMonitorTest - testGetDoubletClasspath() is started.
23:32:45.854 INFO [main] or.ClasspathMonitorTest - doubletClasspath: [ /root/./workspace/oboehm/ClazzFish/380428423/.m2/org/apache/maven/surefire/common-java5/2.19.1/common-java5-2.19.1.jar, /root/./workspace/oboehm/ClazzFish/380428423/.m2/org/apache/maven/surefire/surefire-api/2.19.1/surefire-api-2.19.1.jar, /root/./workspace/oboehm/ClazzFish/380428423/.m2/org/junit/jupiter/junit-jupiter-api/5.0.3/junit-jupiter-api-5.0.3.jar, /root/./workspace/oboehm/ClazzFish/380428423/.m2/org/junit/jupiter/junit-jupiter-api/5.2.0/junit-jupiter-api-5.2.0.jar, /root/./workspace/oboehm/ClazzFish/380428423/.m2/org/junit/platform/junit-platform-commons/1.0.3/junit-platform-commons-1.0.3.jar, /root/./workspace/oboehm/ClazzFish/380428423/.m2/org/junit/platform/junit-platform-commons/1.2.0/junit-platform-commons-1.2.0.jar, /root/./workspace/oboehm/ClazzFish/380428423/.m2/org/opentest4j/opentest4j/1.0.0/opentest4j-1.0.0.jar, /root/./workspace/oboehm/ClazzFish/380428423/.m2/org/opentest4j/opentest4j/1.1.0/opentest4j-1.1.0.jar ]
23:32:45.854 INFO [main] or.ClasspathMonitorTest - testSizeOfUnusedClasspath() is started.
23:32:45.858 INFO [main] or.ClasspathMonitorTest - Classpath has 30 used and 9 unused elements.
23:32:45.860 INFO [main] or.ClasspathMonitorTest - 3 ms needed to get instance
23:32:45.861 INFO [main] or.ClasspathMonitorTest - testWhichClasspath() is started.
23:32:45.862 INFO [main] or.ClasspathMonitorTest - package clazzfish.monitor was found in file:/root/workspace/oboehm/ClazzFish/380428423/monitor/target/test-classes/
23:32:45.863 INFO [main] or.ClasspathMonitorTest - testIsLoaded() is started.
23:32:45.864 INFO [main] or.ClasspathMonitorTest - testGetTestManifestEntries() is started.
23:32:45.865 INFO [main] or.ClasspathMonitorTest - Manifest entries for class clazzfish.monitor.ClasspathMonitorTest
23:32:45.865 INFO [main] or.ClasspathMonitorTest - Extension-Name: clazzfish.monitor
23:32:45.865 INFO [main] or.ClasspathMonitorTest - Manifest-Version: 1.0
23:32:45.865 INFO [main] or.ClasspathMonitorTest - testGetClasspath() is started.
23:32:45.866 INFO [main] or.ClasspathMonitorTest - class clazzfish.monitor.ClasspathMonitorTest found in /root/workspace/oboehm/ClazzFish/380428423/monitor/target/test-classes.
23:32:45.866 INFO [main] or.ClasspathMonitorTest - testGetResource() is started.
23:32:45.867 INFO [main] or.ClasspathMonitorTest - resource found: file:/root/workspace/oboehm/ClazzFish/380428423/monitor/target/test-classes/log4j2.xml
23:32:45.867 INFO [main] or.ClasspathMonitorTest - testGetClasspathClasses() is started.
23:32:45.868 INFO [main] or.ClasspathMonitorTest - testGetUnusedClasses() is started.
23:32:45.869 INFO [main] or.ClasspathMonitorTest - 4381 unused classes found
23:32:45.870 INFO [main] or.ClasspathMonitorTest - testGetClasses() is started.
23:32:45.870 INFO [main] tor.AbstractMonitorTest - testDumpMe() is started with ClasspathMonitor for sun.misc.Launcher$AppClassLoader@18b4aac2.
23:32:45.871 INFO [main] monitor.AbstractMonitor - Attributes will be dumped to dir '/tmp/ClasspathMonitor@jhb1x0vj'.
23:32:45.949 INFO [main] tor.AbstractMonitorTest - Result was dumped to '/tmp/ClasspathMonitor@jhb1x0vj'.
23:32:45.950 INFO [main] tor.AbstractMonitorTest - Directory '/tmp/ClasspathMonitor@jhb1x0vj' is deleted.
23:32:45.951 INFO [main] monitor.AbstractMonitor - Attributes will be dumped to dir 'target/dump'.
23:32:46.020 INFO [main] tor.AbstractMonitorTest - Result was dumped to 'target/dump'.
23:32:46.022 INFO [main] tor.AbstractMonitorTest - Directory 'target/dump' is deleted.
23:32:46.022 INFO [main] or.ClasspathMonitorTest - testGetClassloaderInfo() is started.
23:32:46.023 INFO [main] or.ClasspathMonitorTest - classloader info: sun.misc.Launcher$AppClassLoader (supported)
23:32:46.023 INFO [main] or.ClasspathMonitorTest - testGetIncompatibleClasspath() is started.
23:32:46.036 INFO [main] or.ClasspathMonitorTest - 6 incompatible classpath entries found
23:32:46.037 INFO [main] or.ClasspathMonitorTest - testGetLoadedClassList() is started.
23:32:46.037 INFO [main] or.ClasspathMonitorTest - 2039 classes loaded
23:32:46.045 INFO [main] or.ClasspathMonitorTest - testWhichClassJar() is started.
23:32:46.046 INFO [main] or.ClasspathMonitorTest - found: /usr/lib/jvm/java-8-openjdk-amd64/jre/lib/rt.jar
23:32:46.046 INFO [main] or.ClasspathMonitorTest - testWhichClass() is started.
23:32:46.047 INFO [main] or.ClasspathMonitorTest - testGetSerialVersionUID() is started.
23:32:46.047 INFO [main] or.ClasspathMonitorTest - String.serialVersionUID=-6849794470754667710
Tests run: 35, Failures: 0, Errors: 0, Skipped: 0, Time elapsed: 0.69 sec - in clazzfish.monitor.ClasspathMonitorTest

Results :

Failed tests: 
  ClasspathDiggerTest.testEarWarJar:332->checkGetClasses:349 
Expected: a collection containing "clazzfish.agent.ClasspathAgent"
     but: was "patterntesting.agent.ClasspathAgent", was "patterntesting.agent.ClasspathAgentMBean", was "patterntesting.agent.logging.SingleLineFormatter", was "patterntesting.agent.logging.StdoutHandler"
  ClasspathDiggerTest.testWarJar:319->checkGetClasses:349 
Expected: a collection containing "clazzfish.agent.ClasspathAgent"
     but: was "patterntesting.agent.ClasspathAgent", was "patterntesting.agent.ClasspathAgentMBean", was "patterntesting.agent.logging.SingleLineFormatter", was "patterntesting.agent.logging.StdoutHandler"
Tests in error: 
  ArchivEntryTest.setUpBeforeClass:71  IO local maven repository not found in [...
  EnvironmentTest.testGetLocalMavenRepositoryDir:131  IO local maven repository...

Tests run: 183, Failures: 2, Errors: 2, Skipped: 0

[INFO] ------------------------------------------------------------------------
[INFO] Reactor Summary:
[INFO] 
[INFO] ClazzFish .......................................... SUCCESS [  0.538 s]
[INFO] clazzfish-agent .................................... SUCCESS [  4.544 s]
[INFO] clazzfish-monitor .................................. FAILURE [  4.885 s]
[INFO] ------------------------------------------------------------------------
[INFO] BUILD FAILURE
[INFO] ------------------------------------------------------------------------
[INFO] Total time: 10.064 s
[INFO] Finished at: 2018-05-17T23:32:46+02:00
[INFO] Final Memory: 26M/775M
[INFO] ------------------------------------------------------------------------
[ERROR] Failed to execute goal org.apache.maven.plugins:maven-surefire-plugin:2.19.1:test (default-test) on project clazzfish-monitor: There are test failures.
[ERROR] 
[ERROR] Please refer to /root/workspace/oboehm/ClazzFish/380428423/monitor/target/surefire-reports for the individual test results.
[ERROR] -> [Help 1]
[ERROR] 
[ERROR] To see the full stack trace of the errors, re-run Maven with the -e switch.
[ERROR] Re-run Maven using the -X switch to enable full debug logging.
[ERROR] 
[ERROR] For more information about the errors and possible solutions, please read the following articles:
[ERROR] [Help 1] http://cwiki.apache.org/confluence/display/MAVEN/MojoFailureException
[ERROR] 
[ERROR] After correcting the problems, you can resume the build with the command
[ERROR]   mvn <goals> -rf :clazzfish-monitor
